user_input,reference_contexts,reference,synthesizer_name,retrieved_contexts,response
What are some key aspects of the comparative study between Spanish from Mexico and Korean?,"['Natalia Ignatieva mente, el foco de entonación en inglés. Siendo un campo interdisciplinario entre la fo\xad nología y la sintaxis, es poco investigado, por lo que pensamos que este artículo puede arrojar luz sobre los fenómenos poco conocidos y provocar interés en nuestros lectores. Los dos trabajos que siguen se sitúan dentro de los estudios contrastivos, lo cual permite observar que el análisis contrastivo sigue en pie aun cuando han cambiado sus objetivos, métodos y prácticas, al igual que la terminología. Se habla hoy en día de estudios interlenguales e interculturales cuando se comparan elementos de diferentes lenguas. Nos es grato presentar aquí dos artículos de esta naturaleza. El primero de ellos “The English and French at work: Contrasting language practices and Cultural Shock”, de Christine Geofffoy, se dedica al fenómeno del choque cultural y prácticas lingüísticas contrastantes de los franceses e ingleses. La investigación realizada por la autora permite ver el contraste entre las actitudes comunicativas de los dos grupos analizados que causa confusión y malentendidos en el proceso de comunicación. La lin\xad güista aboga por el desarrollo de la competencia intercultural con fines de mejorar la co\xad municación internacional. Creo que este análisis es muy ilustrativo y trasciende el territorio de las dos naciones involucradas, nos podría dar pautas para otras prácticas y experiencias de la interacción en lenguas extranjeras. El otro artículo “Estudio comparativo entre las expresiones de uso cotidiano del español de México y del coreano”, de Hyejeong Jeong, compara algunas expresiones y frases idiomáticas en español con sus equivalentes en coreano. La meta final de este trabajo que nos abre un horizonte hacia una lengua “exótica”, “nueva” para nuestra revista y que, seguramente, va a enriquecer los conocimientos de nuestro púbico, es ayudar a los aprendientes coreanos de español, o, inversamente, a los hispanohablantes que estudian coreano, en su adquisición del léxico de L2. El siguiente autor, Eduardo Faingold, en su artículo “Pro-active attitudes and educational strategies in early trilingual acquisition: Referential avoidance and parental intervention at the one-word stage” estudia el fenómeno de multilingüismo en la adqui\xad sición temprana del lenguaje. Se examina el caso de un niño trilingüe que está adquirien\xad do de manera simultánea el hebreo, el español y el portugués en el ambiente de una sociedad multilingüe en Israel donde las lenguas de prestigio son inglés y francés. El autor analiza el uso de la estrategia de “explotación léxica” por el niño y los fenómenos paralelos, a saber, la “evitación referencial” y la “intervención patemo-matema”. Es una investigación interesante y muy recomendable para todos aquellos que se ocupan de la adquisición del lenguaje. Continúa el tema de adquisición de lenguas el artículo “Las actitudes y cómo me\xad dirlas” de Ali ne Signoret. Este ofrece la visión sociocultural del proceso de aprendizaje de L2, en este caso francés, y la influencia de las actitudes hacia la lengua y cultura francesa en el desarrollo del interlenguaje de los estudiantes hispanohablantes. Además nos proporciona un modelo del diseño de instrumento para medir las actitudes de los alumnos. Es un trabajo bien fundamentado y útil para profesores de lenguas extranjeras. El siguiente artículo, “Materiales para producción escrita: una propuesta metodológica para la enseñanza del español como segunda lengua”, de Rosa Esther Delgadillo sugiere el']","The article 'Estudio comparativo entre las expresiones de uso cotidiano del español de México y del coreano' by Hyejeong Jeong compares some expressions and idiomatic phrases in Spanish with their equivalents in Korean. The ultimate goal of this work is to assist Korean learners of Spanish, or vice versa, in acquiring L2 vocabulary.",single_hop_specifc_query_synthesizer,"['Discurso científico y definición       23\ndefiniciones muy parecidas a las de un diccionario, hasta definiciones como las \nque he llamado matemáticas; desde definiciones formales muy precisas y que el \nautor identifica como tales, hasta definiciones vagas e implícitas. Todas pueden \ntener diferentes propósitos. Podemos encontrar definiciones que no forman parte \nde la teoría en si, sino que ubican la ciencia dentro del saber humano, como:\nThe science of thermodynamics, in the widest sense in which the term is used nowadays, \nmay be said to be concerned with the understanding and interpretation of the properties \nof matter in so far as they are affected by changes of temperature.\nPippard (1964: I).\nEsta definición se parece mucho a las definiciones de diccionario. Está formulada \npara las personas que no tengan de antemano una idea de lo que normalmente se \nentiende por termodinámica. Tiene las características de que habla Widdowson: \nhay un término, thermodynamics, dado por el título del libro: The Elements of  \nClassical Thermodynamics;  este término se explica con un elemento nuevo: “[... \nthe understanding of ...]”\nPodemos encontrar también definiciones que, aunque establezcan términos de \nla teoría, no se encuentran marcadas ni léxica ni tipográficamente, porque los tér\xad\nminos no son muy importantes:\nTo determine a set is to determine its members.\nHu (1964: 2).\nHay definiciones en las que están involucrados los procedimientos por medio \nde los cuales se manipulan los \nelementos de la teoría, como la anterior o como la \ndefinición que da Feynman de adición y que está citada en la primera sección de \neste artículo. Hay definiciones expresadas de una manera más impersonal, to\xad\nmando sólo en cuenta las características (estáticas) de la entidad definida:\nThe point p is said to be an interior point of the set E provided that there exists a neigh-\nborhood N of p in X contained in E.\nHu (1964: 21).\nLos lingüistas aplicados que hemos estudiado la definición sólo hemos tomado \nen cuenta algunos tipos de definición y no todos los que están representados por \nlas definiciones que he citado en este artículo (ni tampoco todos los tipos que no \nestán representados aquí). Por lo tanto, no todo lo que hemos dicho es válido pa\xad\nra todas las definiciones. Yo, por ejemplo, he caracterizado la definición de la si\xad\nguiente manera:\nA. La entidad que se define se considera por primera vez en el sentido definido.\nB. La definición asocia la entidad definida con un conjunto de características distinti-\nvas.\nC. La definición clasifica la entidad definida.\nD. La definición establece la categoría de la entidad definida.', 'en el sustantivo, pues se presentan casos del uso de bronca tanto en singular como en \nplural. Sin embargo, uno de los rasgos que más llaman nuestra atención es que, a dife -\nrencia de otras formaciones entre verbos + bronca, el caso de meter es particular, ya que \nlos datos indican que la forma recurrente y aceptada entre los hablantes incluye la pro -\nnominalización reflexiva del verbo.\nEn ese tenor, Bogard (2015) señala que “si el verbo se amplía mediante la incor -\nporación de clíticos, el verbo no se convierte en una frase, sino que se mantiene como \nuna unidad morfosintáctica, es decir, se mantiene como el núcleo de la correspondiente  \nfrase verbal” (p. 5). Por esta razón, podríamos entonces decir que, para lematizar la \ncolocación –es decir, para determinar cuál sería su forma de registro lexicográfico–, las \nformaciones compuestas por meter y bronca tendrían que aparecer en una forma prono-\nminalizada. \nComo vemos en (2), es un caso que se da de manera especial en la combinatoria \ncon estas dos unidades y no se presenta necesariamente en otras. En (2a) notamos \nque se emplea la construcción con pronominalización, mientras que en (2b) la colo -\ncación se constituye por el verbo andar + en + broncas en infinitivo. Por último, en \n(2c) vemos una colocación en pretérito impersonal. Cada una presenta formas de uso \nvariadas; sin embargo, es el caso de meter el que refleja que se trata de una construcción \nexclusivamente pronominal (tabla 3).\n(2)\na. La personalidad era de meterse en broncas (PUEB_H33_087)\nb. sí una vez por andar en broncas (MONR_H11_HMP002)\nc. I: dice/ “oye mano/ ¿pues tú eres/ eres de ellos o eres de la empresa?”/ ahí es \ndonde empezaron [las...]\nE: [ajá]\nI:  broncas// (ME-267-23H-06)\nTabla 3. Meter como verbo pronominal en el colem(v+s)\nPersona Colocación (ejemplos) Total de ocurrencias\nSingular\n1º\n2º\n3º\nMe meta yo en broncas \nNi te metas en broncas \nLa bronca en la que se mete\n5\nPlural 1º ¿Para qué nos metemos en broncas? 2\nLos datos que encontramos en la tabla 3 nos indican que el uso de meterse en \nbroncas tiende a aparecer en las tres personas del singular y sólo en la primera del \nplural. Aunque esta información puede darnos una idea generalizada sobre la forma \nen que se constituyen las colocaciones de este tipo, el siguiente paso en una futura \ninvestigación deberá incluir la documentación en otras fuentes, de tal suerte que  \n92 xócHitL taveRa ceRvantes y caRLos gonZÁLeZ di PieRRo\nLM IV-1 \nLingüística Mexicana. Nueva Época, IV (2022), núm. 1: 81-97  \nISSN: 2448-8194', 'Procesamiento de discurso: relaciones semánticas, expectativas del lector y modelos mentales 17\nEstudios de Lingüística Aplicada, año 37, número 69, julio de 2019, pp. 9–35\ndoi: 10.22201/enallt.01852647p.2019.69.828\nza el modelo de situación. Con esta dinámica, si bien la producción es espontá-\nnea, los lectores deben adecuar y actualizar su producción de modo permanente \npara incluir nuevos inputs sucesivos. Es decir, desplegar un proceso estratégico \nque implica un monitoreo y una adaptación constante para articular expectativas \npropias e información externa, en función de construir una unidad globalmente \ncoherente. En la última instancia se propuso un sesgo explícito de las relaciones \nsemánticas a completar a partir de la inclusión de una partícula conectiva causal, \ncomo entonces, o una contracausal, como pero. Por un lado, el objetivo era veri-\nficar un adecuado monitoreo atencional y ejecutivo de los participantes; por otro, \ncontrastar este experimento con resultados surgidos de un estudio anterior (Zu-\nnino, 2016b) que mostraban una sistemática tendencia al completamiento causal \nincluso en presencia de marca lingüística explícita que sesgara el completamien-\nto en un sentido contrario: una tendencia extrema al completamiento causal por \ndefecto.\nCon estos objetivos en mente, nuestro análisis propone una sistematización \nde las producciones de los sujetos a partir de una clasificación de 11 tipos de re-\nlaciones semánticas, con especial interés sobre la dimensión amplia de causali-\ndad (causal / contracausal). Así, los análisis estadísticos se concentraron sobre \nlas variables independientes relación semántica; dimensión conceptual e \ninstancia de completamiento.\n2. Experimento\nComo todos los experimentos basados en un paradigma de completamiento, el \nque presentamos aquí se trata de una tarea que combina comprensión y produc-\nción. Se proponen tres instancias de continuación, a partir de las que el sujeto \ndebe construir progresivamente un discurso narrativo breve, sin más condicio -\nnamientos que producir textos que incluyan, como parte de un todo coherente, \nel input que se presenta como estímulo elicitador. Los sujetos son libres de esta-\nblecer las relaciones semánticas que crean más convenientes y cuantas supongan \nnecesarias; solo en la última instancia de completamiento aparece una marca \nexplícita —la partícula conectiva consecutiva entonces o adversativa pero— que \nrestringe las posibilidades de continuación semánticamente consistente.', 'Sujeto morfológico  (Estar + gerundio ) Presente progresivo\nTotal de verbos (estar + gerundio presente) producidos + requeridos \n1ª sg. 2ª sg. 3ª sg. 1ª pl. 2ª pl. 3ª pl.\nSuj.morf\nV+flex\nSingular\nAciertos\nii\nReglas defectivas Productividad\nSuj.morf\nV+flex\nPlural\nAciertos\nii\nReglas defectivas Productividad\nOmisiones Comisiones\n%\nAciertos\nii\nOmisiones Comisiones %\nAciertos\nii\nSin verbo V. Infiniti-\nvo(-flex)\n Flexiones\n inadecuadas Sin verbo V. Infinitivo(-flex)  Flexiones \ninadecuadas\nAux. Gdo. Aux. Gdo. Aux. Gdo. Aux. Gdo.\n1ª sg.\n(yo)\nEstoy\ncant-ando\ncom-iendo\nviv-iendo\n1ª pl.\n(nosotros/as)\nEstamos\ncant-ando\ncom-iendo\nviv-iendo\n% % % %\n% % % (-)precisión \nléxica\n% % % (-)precisión \nléxica\n% %\n2ª sg.\n(tú)\nEstás\ncant-ando\ncom-iendo\nviv-iendo\n2ª pl.\n(ustedes)\nEstán\ncant-ando\ncom-iendo\nviv-iendo\n% %\n% % % (-)precisión \nléxica\n% % % (-)precisión \nléxica\n%%\n3ª sg.\n(él/ella)\nEstá\ncant-ando\ncom-iendo\nviv-iendo\n3ª pl.\n(ellos/as)\nEstán\ncant-ando\ncom-iendo\nviv-iendo\n% %\n% % % (-)precisión \nléxica\n% % % (-)precisión \nléxica\n%%\n22\nLM III-1 Jalina RamíRez GRycuk\nLingüística Mexicana. Nueva Época, III (2021), núm. 1: 7-33  \nISSN: 2448-8194', 'La coLocación meterse en broncas\npodamos constatar este uso pronominal del verbo meter en las colocaciones con bron-\nca y determinar si hay otros usos que no hayan aparecido en nuestro corpus y me -\nrezcan igual atención.\nVínculo de dos lexemas y restricción combinatoria . Un aspecto interesante en las for -\nmaciones que hemos identificado es que, aunque el resto de los datos nos señala que la \npredisposición combinatoria de bronca como base colocativa es en cercanía con verbos, \nel uso particular de meter ocurre necesariamente por medio del uso de una preposición, \nconcretamente en. \nEn (3) podemos ver que en el caso de esta preposición, del total de las ocurrencias \ndel corpus (11), aparece en 10 ocasiones, mientras que en sólo un hablante se presenta \nel caso con a. La insuficiencia de casos dentro de los datos no nos permite determinar \nsi la segunda preposición es también de uso frecuente. Sin embargo, podemos decir, por \nlo pronto, que la estructura de las colocaciones del verbo meter con bronca puede expre-\nsarse como meterse en  bronca(s).\n(3)\na. Para qué me meto en broncas (ME-291-11H-06).\nb. Nos metimos a esa bronca (ME-055-32M-99).\nTransparencia y opacidad. Las colocaciones meterse + en + bronca(s) pueden conside-\nrarse dentro de las estructuras con mayor opacidad, puesto que, aun cuando no se trata \nde una expresión con un significado idiomático propiamente dicho –lo cual la ubicaría \ndentro del espectro de las locuciones–, su carga metafórica es mucho más relevante que \nen otros casos de formaciones con el mismo sustantivo (4).\n(4)\na. [y todavía]/ como si nos sobrara tiempo/ nos metimos a esta bronca / (ME-055- \n32M-99).\nb. y este / y entonces fue el accidente más grande que hemos tenido y / pos me \ncostó / y pa mucho / pérdida de tiempo / y dinero para arreglar esa bronca / pero \nfue un accidente donde murió una persona (MONR_H31_HMP077).\nSegún Lakoff y Johnson (1980), el ser humano estructura su forma de concebir el \nmundo por medio de metáforas de lo que hay en él para comprenderlo de mejor mane-\nra: “una vez que hemos identificado nuestras experiencias como objetos o sustancias, \npodemos referirnos a ellas, categorizarlas, agruparlas y cuantificarlas y, de esta manera, \nrazonar sobre ellas” (p. 63). En ese sentido, podemos decir que el caso de meterse en \nbroncas tiene una implicación cercana como la metáfora del canal o de recipiente, a sa-\nber: “El hablante pone ideas (objetos) en las palabras (recipientes) y las envía (a través \nde un canal) o un oyente que extrae las ideas-objetos de sus recipientes” (Reddy, apud. \n93\nLM IV-1\nLingüística Mexicana. Nueva Época, IV (2022), núm. 1: 81-97\nISSN: 2448-8194', '26      Fernando Castaños\nprincipio de esta sección proporcionamos una caracterización general de la defi\xad\nnición como meta-aseveración de correferencialidad. En la sección anterior indi\xad\ncamos cómo la definición puede servir para desempeñar diferentes funciones del \ndiscurso científico, lo que permite explicar, tomando en cuenta las intenciones del \nautor, por qué ocurren ciertos tipos de definición de un texto. Y en los últimos \npárrafos discutimos las características de las definiciones argumentativas en el \ndiscurso científico. Pasaremos ahora a combinar los tres enfoques en el análisis \nconcreto del siguiente texto, cuyas oraciones han sido numeradas para facilitar \nlas referencias en la discusión:\nCHAPTER 1 \nTHE EQUATIONS OF MOTION\n1. Generalized co-ordinates\n(1) One of the fundamental concepts of mechanics is that of a particle. (2) By this we mean \na body whose dimensions may be neglected in describing its motion. (3) The possibi-\nlity of so doing depends, of course, on the conditions of the problem concerned. (4) For \nexample, the planets may be regarded as particles in considering their motion about the \nsun, but not in considering their rotation about their axes.\n(5) The position of a particle in \nspace is defined by its radious vector r, whose compo-\nnents are its Cartesian co-ordinates, x, y, z. (6) The derívate v = d r / dt of r with res-\npect to the time t is called the velocity of the particle, and the second derívate d r /dt is \nits acceleration.\nLandau & Lifshitz (1972: 3).\nEl libro de donde fue tomado este texto está escrito para estudiantes que ya han \nllevado un curso de mecánica. Podemos decir que es un libro para estudiantes \navanzados del nivel de licenciatura. El título del primer capítulo indica que no se \nseguirá el enfoque de los libros introductorios, en los que se separan los proble\xad\nmas estáticos de los dinámicos. Aquí, el título nos hace suponer que se discutirán \ndesde un principio las consideraciones básicas para el planteamiento de proble\xad\nmas de dinámica; quizá los problemas estáticos se traten como casos particulares \nde problemas dinámicos. El título, entonces, cumple una función facilitadora: la \nde anunciar el contenido y el enfoque del capítulo y del libro.\nEl subtítulo Generalised co-ordinates indica que en la primera sección se dis\xad\ncutirá la manera de representar la ubicación, en el tiempo y en el espacio, de las \nentidades físicas. Tiene una función facilitadora.\nLas dos primeras oraciones sirven para realizar una definición. Cabe pregun\xad\ntarse por qué los autores usan dos oraciones para la definición de partícula, en lu\xad\ngar de una, como lo hacen para la velocidad más adelante. La razón es que los \nautores no sólo están llevando a cabo una función argumentativa, sino también \nuna función facilitadora y una función valorativa.\nLa función facilitadora es doble. Por un lado, los autores están diciéndoles a \naquellos alumnos que ya saben lo que es una partícula (supuestamente la mayoría \nde ellos): “vamos a definir partícula”. Esto les permite leer la definición muy rá\xad\npidamente, casi saltándosela. Por otro lado, están colocando el término definido']","The comparative study between Spanish from Mexico and Korean involves analyzing various linguistic aspects of both languages to identify similarities and differences. Some key aspects that researchers might focus on include:

1. Phonetics and Phonology: Comparing the sound systems of Spanish and Korean, including vowels, consonants, tones, and intonation patterns.

2. Morphology: Examining word formation, inflectional and derivational processes, and how words are structured in both languages.

3. Syntax: Analyzing sentence structure, word order, agreement, and other syntactic features in Spanish and Korean.

4. Semantics: Investigating the meanings of words, phrases, and sentences in both languages, as well as how concepts are expressed.

5. Pragmatics: Studying how language is used in context, including politeness strategies, speech acts, and cultural implications in communication.

6. Sociolinguistics: Exploring the social aspects of language use in Mexican Spanish and Korean, such as dialectal variations, language attitudes, and language contact phenomena.

7. Discourse Analysis: Examining how texts and conversations are structured, coherence, cohesion, and other discourse features in both languages.

8. Language Acquisition: Comparing the processes of learning Spanish in Mexico and Korean, including first and second language acquisition, bilingualism, and language development.

By investigating these aspects, researchers can gain insights into the linguistic structures and cultural contexts of Spanish from Mexico and Korean, contributing to a deeper understanding of both languages and their speakers."
Who authored the article 'El discurso explicativo en la divulgación científica'?,"['El estudio llevado a cabo por las autoras de la Universidad de Concepción, Chile, les permitió llegar a la conclusión de que la adquisición oral del inglés como lengua extranjera está en relación directa con el desarrollo del pensamiento crítico y con el desarrollo de estrategias comunicativas. El uso de Intenet favorece la producción y com\xad prensión de la oralidad en el aula, que se convierte en una comunidad abierta. Los resultados positivos de esta experimentación les dan la oportunidad a las investigadoras de hablar de un programa de desarrollo de pensamiento crítico que fomentaría el entendimiento intercultural y, finalmente, contribuiría a la adquisición exitosa de la lengua extranjera. Los artículos que siguen están relacionados con el área de análisis del discurso que es otra de las líneas importantes de investigación en el Departamento de Lingüística Aplicada. Empieza este bloque el artículo “El discurso explicativo en la divulgación científi\xad ca” de M. L. Berruecos V., donde la autora estudia el proceso de explicación en un corpus de seis artículos científicos. Desde la posición de la interacción discursiva se investigan las secuencias explicativas, los procedimientos utilizados para este propósito y los rasgos principales de éstos. Una de las conclusiones de la autora es que entre mayor sea el número de secuencias explicativas en un texto, mayor su didacticidad, de ahí la importancia del papel de la explicación en el discurso académico, de difusión de conoci\xad mientos, y en el discurso didáctico. M.E. Gómez de Mas y V. Zamudio Jasso, autoras de las dos aportaciones que siguen respectivamente, son profesoras-investigadoras del CELE que trabajan en el grupo de Análisis del discurso en el DLA. Es de notarse, no obstante, que la temática de sus estudios es distinta. Publicando sus artículos cumplimos con uno de los objetivos de Estudios de Lingüística Aplicada que es difundir los resultados de investigaciones en el DLA del CELE. El artículo de M.E. Gómez “Códices coloniales en contexto: las pasiones de los conquistadores” es un estudio discursivo de dos manuscritos pictóricos del siglo xvi en una situación social de dominación española en el México colonizado. Los discursos de estos documentos litigiosos muestran el conflicto entre los indios y sus opresores y se analizan en términos de sus pasiones. Como menciona la autora, los códices se han estudiado como una realidad histórica y no han sido todavía objeto de un análisis discursivo, de ahí proviene la aportación de este estudio al área del análisis del discurso y también a la pragmática. El otro artículo, “Acercamiento a la problemática en la escritura de ensayos de análisis literario”, de V. E. Zamudio propone estudiar factores que influyen en la escri\xad tura de los ensayos de análisis literario que hacen los alumnos de Letras Inglesas en la Facultad de Filosofía y Letras de la UNAM. Entre estos factores están el dominio de la lengua extranjera, el escritor, la comunidad académica y el género textual. La autora ha realizado un estudio de tipo exploratorio-interpretativo basado en datos cualitativos que le han permitido ver este problema como uno bastante complejo, dado por varios facto\xad res, lo cual implica una resolución, por medio de cursos de redacción, por ejemplo, que fuera adecuada a las necesidades de los estudiantes.']",M. L. Berruecos V. authored the article 'El discurso explicativo en la divulgación científica' where the author studied the process of explanation in a corpus of six scientific articles.,single_hop_specifc_query_synthesizer,"['Estudios de Lingüística Aplicada, año 38, número 71, julio de 2020, pp. 9–43\ndoi: 10.22201/enallt.01852647p.2020.71.900\n[ 20 ]  Kenneth Geoffrey Richter & Ricardo Alejandro Medel Romero\nOnce an item discrimination index was created, it was necessary\nto scrutinize the results in order to discover why certain items had\nlow discrimination scores.\n3.4.  Response frequency distribution\nThe response frequency distribution (rf) analysis was conducted\nto explain the fi  ndingsof the id procedure described above; that\nis, it was necessary to analyze in more detail why certain items re-\nceived good or bad id values. One of the goals of the rf analysis is\nto ascertain which distractors are more appealing to certain scorers\n(high or low). It is the aim of a rf analysis to compare the number \nof responses of each groupon certain items to fi n dthe level of dis-\ncrimination (Bailey,1998). It also shows the frequency with which\ntest items are selected by different groups.\nA total of 28 tests and their responses were analyzed statisti-\ncally. To carry out this analysis, once again, only the top-scoring\nand the bottom-scoring tests were recorded in Excel. First, the test\nitems were ordered from 1 to 50. Subsequently, a space for low-\nand high-scorers was assigned to every item. Finally,columns were\nassigned to the different distractors (A, B, C, and D in the case of\nthe grammar and reading sections, and A, B, and C in the case\nof the listening section). The number of times each option was\nselected by the low- and high-scorers was entered. In this way,\na comparison could be made between the preferences of the two \ngroups concerning the items, as shown in Table 4.\n(continued )\nTABLE 3. Item discrimination sample\nSTUDENT I 1 I 2 I 3 I 4 I 5 I 46 I 47 I 48 I 49 I 50 TOTAL\nIF upper 1.00 1.00 0.93 0.93 0.71 0.21 0.36 0.29 0.21 0.57\nIF lower 0.64 0.71 1.00 0.57 0.50 0.21 0.29 0.21 0.21 0.36\nID 0.36 0.29 -0.07 0.36 0.21 0.00 0.07 0.07 0.00 0.21\nNote: Some columns and rows have been hidden for space.', 'Los datos presentados en la tabla 4 confirman el cumplimiento casi absoluto \nde esos patrones en las tres generaciones de hablantes. No llegan a cumplirse del todo \núnicamente por el hecho de que en la primera generación hay más mujeres que usan ey \nque hombres ―pero la diferencia es prácticamente imperceptible: 8 mujeres frente a 7 \nhombres― y porque los informantes de la tercera generación no siguen la frecuencia de \nuso escalonada de ey según su nivel educativo; es decir, se esperaría que los informantes \nde nivel educativo medio sobrepasaran a los de nivel alto, y eso no sucede:\nTabla 4. Informantes que dicen ey en Guadalajara (n = 72)\nGeneración Hablantes\nSexo Nivel educativo\nHombre Mujer Bajo Medio Alto\n20-34 años 15 7 8 6 5 4\n35-54 años 17 10 7 8 6 3\n55-… años 11 6 5 7 1 3\nTotal 43 23 20 21 12 10\nFigura 4. Informantes que dicen ey en Guadalajara respecto al total de hablantes.\nCon todo, podemos apreciar en la figura 4 que, en Guadalajara, ey no indiza un sexo \nen particular ―lo producen hombres y mujeres casi por igual― ni una edad específica ―\nlo dicen hablantes de todas las edades― pero sí un nivel educativo concreto: el bajo. Las \nfrecuencias totales de ey en el corpus sustentan dos de estas deducciones y matizarían \nuna. Aunque de las 431 ocurrencias, 219 fueron producidas por hombres y 212 por mu-\njeres, y 316 ocurrencias fueron emitidas por informantes de nivel educativo bajo, 76 por \ninformantes de nivel medio y 39 por informantes de nivel alto, tal como se aprecia en la \ntabla 5 y en la figura 5, la mayoría de las ocurrencias fue dicha por informantes mayores \nde 55 años y por informantes de 35 a 54 años, lo cual deja muy por debajo el número de \nInformantes que dicen “ey” en Guadalajara respecto al total de hablantes\nTotal de hablantes en Guadalajara: 43 (≈100%)\n52\nPatricia córdova abundis y daniel barragán trejo LM V-1 \nLingüística Mexicana. Nueva Época, v (2023), núm. 1: 41-64  \nISSN: 2448-8194', 'Tabla 6. Índice de disponibilidad por tipo de institución\nEdad\nTabla 7. Total y promedio de palabras por grupo de edad\nEn la tabla 8 se observa el índice de disponibilidad de cada grupo de edad. La prime-\nra palabra en aparecer en el grupo de 15 a 16 años es gay, con un índice de 0.24714968 \ny un total de 10 ocurrencias en la muestra. \nNuestro interés en este apartado ha sido verificar la hipótesis que sugiere que el \nlexicón de los hablantes crece en correspondencia con su rango de edad. En la grá -\nfica 1 podemos ver que el número de palabras evocadas por hombres de institución \npública es de 81 en ambos grupos de edad, lo que muestra que en este estrato no hay \ndiferencia en cuanto a esta variable. En cambio, para la institución privada podemos \nobservar un incremento: los alumnos de 15-16 años emitieron 42 palabras, mientras \nque los de 17-18 años registraron un total de 96. En cuanto al sexo femenino de \ninstitución pública, se presenta una disminución de una unidad, rasgo no represen -\nInstitución pública Institución privada\nPalabra idl Palabra idl\n1 gay 0.28270114 amor 0.36691616\n2 amor 0.26887113 lesbianas 0.1603786\n3 homosexual 0.17045594 gay 0.15923506\n4 lesbiana 0.16527261 igualdad 0.14888955\n5 joto 0.12166862 asco 0.14481304\n6 felicidad 0.12166133 respeto 0.13815132\n7 discriminación 0.12029 gays 0.10852902\n8 igualdad 0.11887211 sexo 0.10835117\n9 libertad 0.09733354 amistad 0.10822576\n10 respeto 0.0936326 raro 0.09541517\nEdad Palabras Promedio\n15-16 años 270 6.75\n17-18 años 373 9.3\n40\nJorge Lázaro y MicheLLe rubino LM II-2 \nLingüística Mexicana. Nueva Época, II (2020), núm. 2: 29-48  \nISSN: 2448-8194', 'podría significar que su disponibilidad léxica es más amplia. Sin embargo, hay que mirar a \ndetalle los idl de todas las palabras para determinar si se trata efectivamente de una mayor \ndisponibilidad léxica o, por el contrario, de una distribución diferente de ellas.\nTabla 4. Índice de disponibilidad por sexo\n \nTipo de institución \nComo podemos observar en la tabla 5, se obtuvo una mayor cantidad de palabras emi -\ntidas de la institución pública (347, promedio de 8.6), que superó a la privada por 62 \nunidades. Esta última evocó 285 palabras, con lo que obtuvo un promedio de 7.1 por \ninformante. Hasta este momento, entonces, podemos constatar que la institución públi-\nca fue la que evocó más palabras.\nTabla 5. Total y promedio de palabras por tipo de institución\nEn la tabla 6, donde se muestra el índice de disponibilidad de la institución pública, \nse puede observar la palabra gay en primer lugar, con un índice de 0.28270114 y 13 \napariciones. según con estos resultados, la institución pública evocó más palabras que \nla de educación privada.\nHombres Mujeres\nPalabra idl Palabra idl\n1 gay 0.28980507 amor 0.33978312\n2 amor 0.28464675 igualdad 0.18305711\n3 homosexual 0.14978973 respeto 0.1767814\n4 libertad 0.12707167 gay 0.14604758\n5 lesbiana 0.10738158 lesbianas 0.13381209\n6 asco 0.09644609 discriminación 0.12118703\n7 joto 0.09008335 amistad 0.11768799\n8 lesbianas 0.08475817 sexo 0.115388\n9 igualdad 0.07814113 gays 0.1004557\n10 homosexualidad 0.07717483 hombres 0.08989513\nTipo de institución Palabras Promedio\nPública 347 8.6\nPrivada 285 7.1\n39\nLM II-2\nLingüística Mexicana. Nueva Época, II (2020), núm. 2: 29-48\nISSN: 2448-8194']","The article ""El discurso explicativo en la divulgación científica"" was authored by Patricia Córdova Abundis and Daniel Barragán Trejo."
What is the focus of Natalia Ignatieva's work in the field of linguistics?,"['Natalia Ignatieva tos en esta área, en escoger los medios adecuados para promover su presencia en even\xad tos científicos. Hyejeong Jeong en su artículo “Estudio sobre los marcadores de vacilación en coreano” abre otra página en el análisis discursivo. Se trata de un fenómeno poco estudiado, pero importante en el discurso coreano. El propósito del artículo es analizar el uso y las funciones de estos elementos discursivos. Los resultados de este estudio son interesantes, ya que la autora propone el carácter universal del fenómeno de los marca\xad dores analizados; en otras palabras, es un recurso lingüístico que está presente en todo lenguaje y que debería formar parte de un análisis conversacional en cualquier lengua. El artículo “La ansiedad en el proceso cognoscitivo al aprender inglés”, de Fran\xad cisco Castillo Navarrete, nos introduce a un tema poco discutido, por lo menos, errel ámbito mexicano. Estamos acostumbrados a investigar, analizar y discutir sobre qué hace el “buen aprendiente” de idiomas, qué estrategias usa para lograr el dominio de una lengua extranjera y actualmente existe abundante literatura acerca del tópico. Aho\xad ra bien, rara vez nos preguntamos qué es lo que hace el “mal” alumno, es decir, el que no es muy exitoso, y sobre todo, por qué no tiene éxito. A esto está dedicado el artículo de Francisco Castillo: entre las variables afectivas que influyen en la adquisición de lenguas extranjeras el autor elige el factor de ansiedad y hace un estudio exploratorio de cómo los estudiantes con ansiedad perciben el proceso de aprendizaje de inglés como L2. Al observar cinco estudiantes del sexo femenino con rasgos de ansiedad, el investi\xad gador trata de revelar cuáles aspectos de la clase han inhibido su proceso de adquisición de inglés. Las conclusiones a las que llega y sus sugerencias para futuras investigaciones ofrecen mucho sobre qué reflexionar para un profesor de idiomas. El tema de los factores que afectan la adquisición del lenguaje persiste en el artículo “En busca de las variables más influyentes en el aprendizaje de la lengua extranjera”, de David Lasagabaster. Otro de los temas de este artículo es el bilingüis\xad mo, que es un campo que adquiere cada vez mayor importancia. El autor propone estudiar algunas de las variables que ejerzan influencia en el aprendizaje de idiomas, llegando al final a la conclusión de que la competencia en la lengua materna y el conocimiento de otro idioma, más la conciencia metalingüística, resultan de las más importantes entre las que fueron exploradas en su análisis. En el mundo de la globalización donde el bilingüismo se ha hecho ya un fenómeno cotidiano y el aprendizaje de terceras lenguas se ha declarado como un prometedor terreno de estudios, el artículo de David Lasagabaster nos parece sumamente actual. Cierra la parte de artículos el trabajo de Aline Signoret “Cognición, pensamiento y lenguaje: Perspectivas teóricas desde la psicolingüística, la adquisición del lenguaje y la psicología cognitiva”, que reúne una serie de reflexiones sobre los problemas de cognición y lenguaje. La autora discute diferentes propuestas acerca de estos tópicos en el área de las ciencias cognitivas y la relación entre las mismas. Invitamos a nuestros lectores a unirse en estas reflexiones. En la parte dedicada a las reseñas, las primeras tres presentan el fruto de la mesa redonda “Novedades editoriales del CELE”, organizada en el marco de los festejos del']","Natalia Ignatieva focuses on selecting the appropriate means to promote her presence at scientific events and analyzing the use and functions of discourse elements, particularly hesitation markers in Korean discourse.",single_hop_specifc_query_synthesizer,"['(17)\na. Estiéndanse los límites del señorío de la Iglesia de la otra parte del Apenino hasta \nel mar Adriático, llegando al río Pescara, y destotra al río Garellano, incluso / \nincluido / hasta gran pedazo del Abruzo y de Campania \n(Historia de Felipe II, Rey de España 1619)\n b. En el caso del párrafo primero del artículo anterior, si estuviera asegurada la \nfinca, el valor del seguro quedará afecto al pago del capital del censo y de las \npensiones vencidas, á no ser que el censatario prefiera invertirlo en reedificar la \nfinca, en cuyo caso revivirá el censo con todos sus efectos, incluso / incluido / \nhasta el pago de las pensiones no satisfechas \n(Código Civil 1889)\nLa función de incluso como marcador de concesividad en estructuras condicionales \nestá relacionada con su función como partícula de foco escalar. Flamenco García (1999: \n3810) describe estas estructuras como concesivo-condicionales escalares, las cuales se ca-\nracterizan por combinar las propiedades concesivas con características condicionales. \nApunta que lo característico de una relación concesiva no es tanto una estructura sintác-\ntica particular, sino más bien la existencia de una información implícita que contradice \nel contenido proposicional expresado en cada uno de los miembros de que consta. Las \nconstrucciones concesivo-condicionales escalares comparten con las concesivas el con -\ntraste que se establece entre sus dos miembros y con las condicionales que en el conte -\nnido proposicional de la prótasis se hace referencia a situaciones de carácter hipotético.\nFlamenco García señala igualmente (1999: 3843) que dentro de la naturaleza escalar \nde piezas léxicas como incluso se inscribe la posibilidad de que se codifique una con -\ntraexpectativa. Esto influye de manera decisiva en la interpretación de construcciones \nencabezadas por incluso si, que es en suma el mismo tipo de contenido implícito transmi-\ntido por las expresiones concesivas y adversativas, esto es, el sentido de contradicción.  \nSi bien esta clase de estructura presenta apariciones esporádicas en etapas previas a \nla conclusión del cambio, generaliza su presencia en la segunda mitad del siglo xx, lo \ncual puede sugerir que, aunque esta función dependa de la función escalar de incluso, \nconserva una naturaleza más funcional o abstracta que la que tendría la función escalar \naisladamente. Por esta razón prolifera en la etapa final de su proceso de cambio, el cual \navanzó del plano léxico (participio) al plano funcional (partícula)9.\nIdentifico la etapa final del desarrollo histórico de incluso como el periodo más fun-\ncional, en el que K önig (1991) sitúa las partículas discursivas y, como he mostrado, in-\ncluso puede caracterizarse también como marcador discursivo o partícula discursiva. Esta \netiqueta engloba a las unidades lingüísticas que puedan presentar usos exclusi vamente \n9\u2009Sobre la direccionalidad del cambio, ver Bybee et al. (1994), Traugott (1995a), Hopper y Trau-\ngott (2003 [1993]) y Bybee (2004).\n176 Glenda zoé lizárraGa navarro\nLM II-2 \nLingüística Mexicana. Nueva Época, II (2020), núm. 2: 157-181  \nISSN: 2448-8194', 'Estudios de Lingüística Aplicada, año 43, número 81, julio de 2025, pp. 47–71\ndoi: 10.22201/enallt.01852647p.2025.81.1111\n[ 66 ] Esthela Ramírez Hernández\nción gss pasa de ser laxa a ser estricta y resulta en menos epéntesis \n(Cuadro 7).\ncuadRO 6. Jerarquización estocástica de restricciones basadas en la observación de etapas I y II\nOutput muy bajo Output bajo\nRestricción Jerarquización Restricción Jerarquización\ndep-iO\nmax-iO\ncOnT\n*cOmpleJ\nGss\n101 606\n100 000\n100 000\n98 394\n-3 571 256\ndep-iO\nmax-iO\ncOnT\n*cOmpleJ\nGss\ndm-3\n100 990\n100 000\n100 000\n99 010\n-24 696 890\n-54 673 342\ncuadRO 7. Jerarquización estocástica de restricciones basadas en la observación de etapas II y III\nOutput muy bajo Output bajo\nRestricción Jerarquización Restricción Jerarquización\ndep-iO\nmax-iO\ncOnT\n*cOmpleJ\nGss\ndm-3\n100 990\n100 000\n100 000\n99 010\n-24 696 890\n-54 673 342\ndep-iO\nmax-iO\ncOnT\n*cOmpleJ\nGss\ndm-3\n103 002\n100 000\n100 000\n96 998\n96 684\n-1 326 164\nCabe resaltar que max-io  y cont  nunca se quebrantan. Esto se \nobserva en que hay dos tipos de candidatos que nunca pueden ga-\nnar en la interlengua español-inglés. En primer lugar, aquellos que \nmuestran cualquier tipo de elisión (por ejemplo, star *[tar]). En \nsegundo lugar, los que presentan epéntesis que rompen la relación \nde contigüidad entre los dos segmentos en el inicio complejo (por \nejemplo, star *[setar]). Por ello, al correr el algoritmo de aprendi-\nzaje gradual, estas restricciones reciben el valor de 100, que es el \nvalor más estricto. Las Figuras 8, 9 y 10 son representaciones vi-\nsuales de los modelos gramaticales cuyos valores de restricciones \njerarquizadas representan intervalos en un continuo. Este continuo \nva de las restricciones más estrictas (inquebrantables), representa-\ndas en números positivos, a las más laxas, en números negativos.', 'anExo 1\nVocablo Diccionario de america-\nnismos\nDiccionario etimológico \ndel lunfardo (Conde, \n2004)\nNovísimo diccionario lun-\nfardo (Gobello y Oliveri, \n2005)\na cara o ceca x\naguantadero x x x\napretar x x x\nbacán x x x\nboliche x x x\nbolo x x x\nbuchón x\nbufarrón x\nbulín x x x\nbulo x x\ncachirla x\ncana x x\ncaño x\ncapote x\nchiche x\ncortada x\ncosturón x\ndato x\nencanastar x\nentrador x\nentregador x x x\nfariña x\nfarolear x\nfierro x\nflaco x\nfono x\ngaucho x\ngavilla x\ngrosso x\nguanaco x\nguita x x x\nmalandra x x x\n82 daniel casado gallegos y carlos yeudiel Puebla rodríguez\nLM IV-2 \nLingüística Mexicana. Nueva Época, IV (2022), núm. 2: 57-84  \nISSN: 2448-8194', 'Julián Rivera Jiménez114\nPor consiguiente, la euforia es la emoción y alegría vivida mediante el reconocimien-\nto de otras personas como lo ejemplifica el siguiente participante (7): \n(7)\nsí era una euforia muy grande, sentirme reconocido ¿no? Sentirme reconocido con \nextraños o sea en la calle, joven, muchacho, no sé ¿no? Siempre fue una euforia muy \nmuy grande.\nEste “reconocimiento” o “trato en masculino” con frecuencia ocurre después de co-\nmenzar el tratamiento de reemplazo hormonal, proceso que conlleva un cambio físico \nque ocasiona que los sujetos sean leídos como hombres, es decir, que pasen por. \nEs importante contrastar este sentimiento frente al análogo, la disforia, ocasionada \npor la ausencia de reconocimiento, que se abordó en la sección anterior. Los hablantes \ntrans difuminan la línea entre el sentir euforia (o disforia) ya sea por las características \nsexuales secundarias o por la malgenerización que ocurre en sus propios contextos de \nsocialización. Como términos identitarios, euforia y disforia no sólo sirven para explicar \nuna sensación corporeizada, sino que son términos socioculturalmente situados.\nPor otra parte, fuera del entorno social, uno de los participantes expresó que sintió \neuforia por primera vez al saber, por personajes de ficción, que existía la posibilidad de \nuna vida trans. Al inicio de este apartado de análisis se mencionó la importancia que \ntiene en los sujetos conocer a otras personas trans para construir su propia identidad. \nLa mayor parte de los hablantes mencionan a los referentes trans como una fase impor-\ntante en la construcción de su identidad de género. Ahora bien, no son solamente los \nreferentes explícitamente transmasculinos los que detonan la construcción identitaria, \nla disrupción del mandato de género en muchos casos es suficiente para que los sujetos \nlleguen a cuestionarse a sí mismos sus deseos y su identidad (Rivera, 2022).\nEl término euforia fue empleado por uno de los participantes al describir su proceso \nde descubrimiento y construcción identitaria, el cual se vio detonado por un personaje \nde animación japonesa que, si bien en la trama no era un personaje trans, rompía las \nnormas cisheteronormativas, y eso lo llevó a cuestionarse y a explorar su identidad (8).\nLingüística Mexicana. Nueva Época, issn: 2448-8194 \nvol. vii (2025), núm. 2.', 'Entre santos, venados y pascolas\n 119\nLM VII-1\nLingüística Mexicana. Nueva Época, vii (2025), núm. 1\nISSN: 2448-8194\nTabla 4. Tabla de relación edad- si/no hablan la lengua yoremnokki\n Colaborador  ¿Qué personas hablan más seguido el yoremnokki?\n Colaborador 1   Los mayores a veces.\n Colaborador 2  Mi tío, mi abuela y mi mamá.\n Colaborador 3  Los viejitos.\n Colaborador 4  Algunos adultos, tíos, abuelos.\nEn esta tabla 4 se observa cuál es el grupo prototípico de hablantes de yoremnokki, \ny cabe señalar que los lugares en donde se hace presente la lengua son mayoritaria -\nmente de índole religioso. Es importante destacar que el uso de la lengua siempre está \ncondicionado a que haya alguien más que la entienda como interlocutor, aunque no la \nhable, por ello las conversaciones se limitan sólo a adultos, sobre todo a adultos de edad \navanzada.\nEn las notas de diario de campo y mediante la observación se pudo comprobar que \neste fenómeno se debe a que los jóvenes mencionan constantemente que “hay lenguas \nque te dan mejores oportunidades”, lo cual se refleja en la tabla 5.\nTabla 5. El aprendizaje de los idiomas\nColaboradores    ¿Si existieran cursos gratuitos para aprender idiomas cuáles te gustaría aprender?\nColaborador 1    Inglés, para hablar con mi tío.\nColaborador 2    Inglés y yoreme para poder conocer más gente que hable otros idiomas.\nColaborador 3    Inglés.\nColaborador 4    Inglés, francés y ruso; son los idiomas que más me interesan, me van mejor.\nAlgunas de las ideas que los jóvenes repetían constantemente son que se puede ac -\nceder al “éxito” a través de un idioma extranjero y la idea de que aprender español o \nun idioma extranjero es sinónimo de “progreso”; por ejemplo, algunos colaboradores \n(distintos a los que se registran aquí) mencionaron que para poder acceder a estudiar \nse debe hablar español. De esta manera se puede constatar que el aprendizaje de los \nidiomas está ligado estrechamente con su prestigio lingüístico, pues se sabe que un \nidioma de prestigio es hablado por un grupo social que normalmente tiene las mismas \ncualidades positivas que su idioma, en otras palabras, no es sorprendente que el presti-\ngio lingüístico desempeñe un papel fundamental en la formación de actitudes hacia los \nidiomas.\nRespecto al uso del yoremnokki en los medios de comunicación, se pudo atestiguar \nque los jóvenes tienen interés en que se cuente con la presencia de esta lengua en los \nmedios porque cronsideran que así se conocería más. Cabe mencionar que los medios \nde comunicación que se tienen en mente son actuales, más bien digitales, por eso se \nconsidera que valdría la pena rescatar el yoremnokki por estos medios, además de que \nsería una oportunidad de apropiase de espacios y captar otros posibles usuarios de esta \nlengua.', '22  empiezo a darle dirección a mi vida (.) algo que no lo había hecho °antes°\n23  antes \uf067huía antes de tocar lo que sentía que venía difícil\n24  y y y \uf067me entraba miedo también y vergüenza y decía mejor vete (.) \n25 refúgiate en un lugar donde ni te vean °¿no?°\n26 T  y entonces (.)  ¿qué (.) avances has (.) logrado? me explicas que (.) \n27  que entraste muy brioso con mucha potencia mucha energía y \n28  que hubo varios momentos en los que (.) \n29  >ya no te daban ganas de continuar< (.)entre la plática con tu mujer \n30  y::: tu plática interna de::: ¿a poco te vas a rajar? >y esto y aquello< \n31  \uf068¿qué podríamos decir que has logrado con la terapia?\n32 P  principalmente ESTO(.)y el deseo(.)<\uf067principalmente esto de quedarme>\n33 T okay\n34 P  que aún con ese miedito (.) o >con otros sentimientos ahí< \uf067quedarme \n35  y meterme más a fondo (.) quedarme(.) estar aquí (.)\n36  y lo segundo (.) un deseo sincero de practicar mi escucha\nAl inicio del segmento de la sesión 9, en las líneas 1 a 4, el paciente habla sobre la \nforma en que ahora resuelve algunas situaciones que usualmente le costaban trabajo \ny la decisión que toma de atender las situaciones que le provocan dificultad con sus \npadres. Utiliza dos expresiones metafóricas: “voy a tratar de superar la vergüenza” en \nla línea 4 y “voy a tratar de no dejar que la vergüenza y la culpa se…” en la 5. Estas \nexpresiones surgen en ese momento como la continuación de su propósito de seguir tra-\nbajando consigo mismo en terapia.\nExpresa también, sin embargo, que experimenta vergüenza y que la siente en los tér -\nminos de la metáfora que utiliza: la vive como un obstáculo que dificulta su trabajo te -\nrapéutico y su proceso personal. En la metáfora de la línea 5 explica que va a tratar de \nvencer tanto la vergüenza como la culpa, como si se tratara de enemigos que le causan \nproblemas. La terapeuta solicita que precise qué es lo que le produce la primera de esas \nemociones y el paciente explica en las líneas 8 a 11 que tal sentimiento ocurre cuando \nexpone que no tiene dinero para pagar porque para él es una forma de decir que no pudo \nsolventar la parte económica. Hace una pequeña aclaración de que ya no le da vergüen-\nza, lo que sugiere que está logrando gradualmente que ésta disminuya: dice que a veces \n“le da” y a veces dice que “ya no le da”.\nPara disminuir el impacto de la vergüenza y la culpa, pensamientos que le producen \nincomodidad, los va resolviendo mediante un breve diálogo en el que él mismo se va \ndando soluciones o alternativas para disminuir la turbación de aquellos pensamientos \nque surgen a partir de la situación que vive. Para hablar de ellos también lo hace por \nmedio de una expresión metafórica: “me entra mucho eso del que qué pueden pen -\nsar”. Ésta es una manera de explicar cómo surge la vergüenza: tiene dificultades para \npagar y entonces aparece el cuestionamiento de lo que otras personas podrían opinar \nal respecto. \nAl expresar me entra, la experiencia de dichos pensamientos es que llegan a su in -\nterior en términos del dominio de lo material: el cuerpo es un espacio delimitado con \n72 fRida taveRa RamíReZ y beRnaRdo enRique PéReZ ÁLvaReZ\nLM IV-1 \nLingüística Mexicana. Nueva Época, IV (2022), núm. 1: 63-80  \nISSN: 2448-8194', 'que emplea Hopkinson, según el Collins Dictionary, es una colocación: minor matter. En \nla traducción dicha colocación aparece con una negación: así se mantiene el sentido de \nasunto grosso (“que supera lo ordinario por extensión, peso, volumen, masa” en Diziona-\nrio di italiano, La Repubblica) por medio de la antonimia, donde “el traductor selecciona \nun antónimo y lo combina con un elemento que lo niegue” (Chesterman 2016: 104), \nmientras que la segunda ocasión que Hopkinson traduce grosso opta por la estrategia de \nla sinonimia con major, palabra que en su significado ya incluye la intensificación que \nproduce el adverbio muy del texto fuente.  \nproBlEmas y solucionEs dE traducción\nEn este apartado mencionamos algunas unidades en las que consideramos que el traduc-\ntor pudo recurrir a otras soluciones en vez de traducir literalmente la unidad 5, porque \nno mantuvo la coherencia del texto, por cambio de género o por una falta de precisión. \nDichas decisiones, a nuestro parecer, tienen un peso importante en la comprensión del \ntexto en la lengua meta.\nEl primero es el ejemplo (12), el cual coincide con el único préstamo del español \nque encontramos en la traducción francesa: la unidad gaucho (Mirá que es un gaucho \nbruto → C’est un gaucho, une vraie brute!). Probablemente el traductor creyó que se \ntrataba de la forma de llamar a los argentinos en el exterior, aunque en realidad hace \nreferencia a\n(12) Gaucho (Diccionario de americanismos)\n1. adj. Arg. y Ur. Perteneciente o relativo a los gauchos. Un apero gaucho.\n2. adj. Arg. y Ur. Dicho de una persona: Noble, valiente y generosa.\n3. adj. Arg. Dicho de un animal o de una cosa: Que proporciona satisfacción por \nsu rendimiento.\n4. adj. Arg. p. us. Ducho en tretas, taimado.\nEl préstamo no sólo es poco transparente para el lector francófono, sino que puede \ncrear cierta confusión: la palabra gaucho en francés se refiere a gauchiste (izquierdista), \nunidad de la cual es abreviación:\n5\u2009La traducción literal ha sido una de las cuestiones más abordadas por los estudios de traducción. \nA partir de los aportes de Eugene Nida se pasó de un modelo de equivalentes entre dos lenguas a uno \nen donde importa más el sentido del texto meta y la relación de cercanía que guarda con el original. \nConsideramos que, si bien no existen relaciones unívocas de significado entre palabras de distintas \nlenguas, es necesario que en la traducción de esta novela se conserven rasgos tan marcados por el \nautor, como el nivel de registro y su uso en el sociolecto criminal.\n72 daniel casado gallegos y carlos yeudiel Puebla rodríguez\nLM IV-2 \nLingüística Mexicana. Nueva Época, IV (2022), núm. 2: 57-84  \nISSN: 2448-8194']","Natalia Ignatieva's work in the field of linguistics focuses on the historical development and functional aspects of the linguistic marker ""incluso"" in Spanish. Ignatieva explores how ""incluso"" functions as a marker of concessivity in conditional structures, related to its role as a scalar focus particle. She discusses the concesivo-condicionales escalares structures, which combine concessive properties with conditional characteristics. Ignatieva also delves into the scalar nature of lexical items like ""incluso,"" highlighting the possibility of encoding a counterexpectation. Overall, her research sheds light on the evolution and functional nature of ""incluso"" as a discourse marker or particle in Spanish."
Who is Teresita Cabanillas and what is her role in the linguistic research field?,"['Natalia Ignatieva La meta final es apoyar la adquisición y el uso de español oral y escrito en las difíciles condiciones del desplazamiento del español por el inglés. El articulo “Exploración de las creencias maternas en tomo al proceso de adquisi\xad ción del lenguaje” de Cecilia Rojas, Rosa Ma. Ortiz, Elva Álvarez, Teresita Cabanillas, y Emma Cano es ñuto de un trabajo colectivo interinstitucional situado en el área de psicolingüística. El proceso de adquisición de la lengua materna, en este caso español, se examina desde el punto de vista de la interacción entre madre e hijo donde se explo\xad ran las creencias maternas relativas al papel del niño como emisor, destinatario e interlo\xad cutor en este proceso. La investigación, llevada a cabo en la cuidad de Hermosillo, Sonora, abre un nuevo ángulo en los estudios sobre la adquisición del lenguaje en México y seguramente causará interés en nuestro auditorio. Tokiyo Tanaka y Erika Ehnis en su artículo “Las preposiciones a, en, de y los estu\xad diantes japoneses al estudiar español: gramática contrastiva” hacen un intento de construir la gramática pedagógica sobre un punto lingüístico: las preposiciones españolas que pro\xad vocan dificultades para los aprendientes de español como L2, cuya lengua materna es el japonés. Las autoras han aplicado un& prueba a los estudiantes japoneses del CEPE para medir sus conocimientos acerca del uso de estas preposiciones y han analizado sus resul\xad tados. Es un estudio en el cual intervienen muchos factores: el análisis contrastivo, el análisis de errores, aspectos cognoscitivos. Al final se presentan las implicaciones y suge\xad rencias didácticas que puedan ser de utilidad para los maestros de español. Con el artículo de Leonardo Herrera “Planeación y seguimiento de un proyecto de investigación para abordar el impacto de los estudios sobre interacción en el salón de clase” seguimos con la tradición de la revista de dar a conocer a nuestros lectores las investigaciones del CELE. Leonardo Herrera, como miembro del Departamento de Lin\xad güística Aplicada, ha trabajado dentro de una de las líneas de investigación más repre\xad sentativas del CELE, a saber, “interacción en el salón de clase”. Sus reflexiones acerca de las contribuciones de lingüistas aplicados sobre el tema y las condiciones reales de enseñanza de lenguas extranjeras en el país nos dan pautas para la organización de un proyecto de investigación en esta área. Compartiendo su experiencia en el análisis del fenómeno de interacción dentro de la enseñanza de portugués como L2, el autor pro\xad mueve la aplicación de este tipo de estudios a otros idiomas, y en otras instituciones. Es un artículo recomendable sobre todo para los profesores de lenguas que quieren empe\xad zar a investigar la realidad del salón de clase (y no saben cómo). El último artículo “Terminología y representación de los conocimientos: análisis y generación automáticos de los términos derivados y compuestos de la terminología de la informática” de Albert Álvarez nos remite al campo de terminología, mismo que está en constante desarrollo, de acuerdo con los requerimientos de nuestros tiempos en los que la aparición de nuevos términos es un fenómeno cotidiano sujeto a muchas polémicas. En su trabajo el autor propone un sistema de análisis y generación por computadora de una clase de términos, es decir, palabras compuestas y derivadas, basado en el método elaborado por el Laboratorio de Ingeniería Lingüística y de Lingüística Aplicada de la Universidad de Niza-Sophia Antipolis (Francia). El trabajo de Albert Álvarez es un']","Teresita Cabanillas is part of a collective interinstitutional work in the area of psycholinguistics. The research focuses on examining maternal beliefs regarding the language acquisition process, specifically in the interaction between mother and child. This study, conducted in Hermosillo, Sonora, offers a new perspective on language acquisition studies in Mexico.",single_hop_specifc_query_synthesizer,"['Lingüística Mexicana. Nueva Época, IV (2022),  \nnúm. 1: 99-118 ISSN: 2448-8194\nLicencia Creative Commons Attribution-Non-\nCommercial (CC BY-NC) 4.0 International\nFecha de recepción: 3 de junio de 2021\nFecha de aceptación: 6 de septiembre de 2021\nLa construcción del significado de guerra en el sexenio de \nFelipe Calderón Hinojosa\nThe Construction of the Meaning of War in the Early Years of \nFelipe Calderón’s Government, 2006-2007\nRESUMEN: La palabra guerra estuvo asociada a los acontecimientos \nque definieron la política de seguridad del gobierno de Felipe Calderón \nHinojosa, de 2006 a 2012, y sigue teniendo en nuestros días diferentes \nresonancias en su recepción y resignificación, especialmente en el ámbi-\nto de la prensa. La designación de los acontecimientos derivados de esta \npolítica de seguridad por la palabra guerra, lejos de aludir a una realidad \nunívoca, resulta en la constitución, según la entidad locutiva, de referen-\ntes distintos. El estudio se centra en la voz de la presidencia en cuanto \nentidad locutiva principal para analizar, mediante cinco fragmentos de \ndiscursos, la evolución de los significados conducidos por el uso de este \nnombre y de otros asociados en otros ámbitos discursivos.\nABSTRACT:  The word war was associated with the events that defined \nthe security policy of the government from president Felipe Calderón \nHinojosa, from 2006 to 2012, and continues to have different res -\nonances in its reception and resignification today, especially in the \npress. The designation of the events derived from this security policy \nby the word war, far from alluding to a concrete reality, results in the \nconstitution, according to the locutory entity, of different referents. \nThe study focuses on the voice of the presidency as the main speaking \nentity to analyze, through five fragments of speeches, the evolution of \nthe meanings driven by the use of this name and other associates in \nother discursive spheres.\nPalabras clave: \nconstrucción del  \nsignificado,  \nreferencialidad  \ndiscursiva,  \nconstrucción  \nde realidad.\nKeywords:  \nconstruction  \nof meaning,  \ndiscoursive  \nrefernciality,  \nconstruction of reality\nRodrigo Pardo Fernández\nUniversidad Michoacana de San Nicolás de Hidalgo\nrodrigo.pardo@umich.mx\nGuadalupe Georgina Gavarre Silva\nUniversidad Michoacana de San Nicolás de Hidalgo\n1650780j@umich.mx', 'Estudios de Lingüística Aplicada, año 41, número 76, enero de 2023, pp. 7–36\ndoi: 10.22201/enallt.01852647p.2023.76.1030\n[ 26 ] José Manuel Solís Navarro & Édgar Oswaldo González Bello\nLos modelos permiten comprender características que distin-\nguen a los profesores en cuanto a su percepción sobre el dominio \ndel inglés. El Modelo 1, con el mayor porcentaje de varianza ex-\nplicativa (R2 = 19), destaca que pertenecer a las áreas stem y haber \nestudiado un posgrado en el extranjero son factores que infl  uyen \npositivamente en el dominio del inglés. El Modelo 2 (R2 = .16) re-\nsultó signifi  cativo para el caso de aquellos que señalan haber reci-\nbido una educación bilingüe, haber estudiado inglés en una escuela \nde idiomas, vivir en el extranjero y/o aprender por iniciativa propia \n(Cuadro 5). Como puede observarse, los escenarios de aprendizaje \nque mayormente han contribuido a la noción de dominio son en \nsu mayoría informales, esto puede estar relacionado a los aspectos \nafectivos, en los cuales el sujeto adquiere el idioma de forma natu-\nral y no bajo una presión institucional o bajo la forma tradicional \nde enseñanza.\nCuadro 5. Análisis de regresión para las variables predictoras de la percepción sobre el dominio del inglés\nModelos B SE B β t p\nModelo 1\n1. Sexo .20 .09 .07 2.18 .029\n2. Edad -.00 .00 .01 .23 .817\n3. Antigüedad -.00 .00 -.04 -.93 .353\n4. Tipo de contrato .08 .11 .03 .78 .435\n5. Tiempo del contrato -.23 .11 -.07 -1.98 .048\n6. Pertenencia al SNI .22 .12 .07 1.84 .066\n7. Contar con doctorado -.04 .13 -.01 -.33 .739\n8. Áreas STEM .31 .09 .11 3.38 .001\n9. Estudiar posgrado en el extranjero .11 .02 .24 5.06 .000\nModelo 2\n1. Recibir educación bilingüe .66 .11 .18 5.08 .000\n2. Estudiar licenciatura -.03 .12 -.00 -.28 .776\n3. Estudiar un posgrado -.01 .09 -.00 -.16 .867', 'Comportamiento soCiolingüístiCoy disCursivo de ey en el habla de guadalajara\nComo puede apreciarse en la figura 1, las tres variables sociales de preseea en las \ntres ciudades arroja que los hombres dicen más ey que las mujeres (47 hombres frente a \n37 mujeres), que los 48 hablantes de nivel educativo bajo que lo usan duplican en núme-\nro a los 22 de nivel medio y triplican a los 14 de nivel alto, y que no existen diferencias \ngeneracionales: los hablantes de 20 a 34 años que lo emplean son 28, los hablantes de \n35 a 54 años son 29, y los hablantes de 55 años en adelante son 27. \nFigura 1. Representatividad por variable respecto del total de hablantes a nivel nacional.\nEl análisis general de las 595 frecuencias totales de ey en las tres localidades com -\nprueba las tendencias respecto del sexo y el nivel educativo, esto es, que las ocurrencias \ndichas por los hombres, (322), superan a las de las mujeres, (273), y que el grueso de \néstas, (461), es emitido por hablantes de nivel bajo. En este caso, la variable edad ma-\nnifiesta con claridad una pauta: 277 ocurrencias se concentran en la generación mayor \nde 55 años (véanse la tabla 2 y la figura 2).\nFigura 2. Frecuencia Relativa (hi) del total de ocurrencias de ey a nivel nacional.\nRepresentatividad por variable respecto al total de hablantes a nivel nacional\nTotal de hablantes en las tres comunidades de estudio: 84 (≈100%)\nFrecuencia Relativa (hi) del total de ocurrencias de “ey” a nivel nacional\nTotal de ocurrencias las tres comunidades de estudio: 595 (≈100%)\n49\nLM V-1\nLingüística Mexicana. Nueva Época, v (2023), núm. 1: 41-64\nISSN: 2448-8194', 'diccionarios\nCompany Company, Concepción. 2010. Diccionario de mexicanismos, México: Siglo xxi.  \nMerriam Webster. 2020. Merriam-Webster Unabridged Dictionary, en <http://unabridged.\nmerriam-webster.com> [consultado en noviembre de 2020]. \nÁlvarez Mellado, Elena. Observatorio Lázaro, Universidad de Brandeis <https://ob-\nservatoriolazaro.es/acerca.html> [consultado en noviembre de 2020]. \nCambridge University Press. 2020. Diccionario Cambridge inglés-español, <https://dictio-\nnary.cambridge.org/es/diccionario/ingles-espanol> [Consultado en noviembre de \n2020]. \nHarper Collins Publishers. 2020.  Collins  Unabridged Spanish to English and English to \nSpanish Dictionary <https://www.collinsdictionary.com/es/diccionario/inglesespa-\nnol> [Consultado en noviembre de 2020].\nDiccionario del español de México (dem). 2010. México: El Colegio de México. <http://\ndem.colmex.mx> [consultado en noviembre de 2020]\nReal Academia Española. Diccionario de la lengua española , en <http://dle.rae.es/> \n[consultado en noviembre de 2020]. \n36 mayra Haydee Tafoya cisneros y liHiT andrea Velázquez lora\nLM IV-2 \nLingüística Mexicana. Nueva Época, IV (2022), núm. 2: 15-38  \nISSN: 2448-8194', 'Estudios de Lingüística Aplicada, año 43, número 81, julio de 2025, pp. 7–46\ndoi: 10.22201/enallt.01852647p.2025.81.1109\nCognitive individual differences in learning Spanish L2/FL emblematic gestures [ 11 ]\nin L2/FL Spanish? 3) What specifi  c learning styles are related to \nthe learning of emblematic gestures in L2/FL Spanish?\n2. Literature review\n2.1.  Emblematic gestures in SLa\nEmblems are highly symbolic gestures within a community whose \nmeanings have different degrees of clarity for other speakers de-\npending on their form, meaning, and resemblance to the emblem-\natic gestures in their cultural code (Ekman & Friesen, 1969; Mc-\nNeill, 1992; Gullberg, 1998; Cienki, 2008; Teßendorf, 2013; Poy-\natos, 2017; Payrató & Clemente, 2020). For L2/FL classrooms and \nstudies on sla, emblems can be classifi  ed based on the degree of \nsimilarity with those in the learners’ culture of origin. Emblems \ncan be classifi  ed into three major categories: 1) common: gestures \nwith the same form and meaning in both cultures; 2) different: \ngestures that have a different form but share the same or very sim-\nilar meaning; and 3) unique: gestures with no formal or seman-\ntic equivalent in the other culture (Belío-Apaolaza & Hernández \nMuñoz, 2024). It is reasonable to assume that the latter two catego-\nries can lead to miscommunication and cultural misunderstandings \nwhen interacting in the target language.\nDespite the role of gestures in (mis)communication, research \non this discipline in sla is scarce.1 Indeed, only two empirical stud-\nies about the learning process of emblems are available.2 In the fi  rst \n1 There is, however, a substantial body of work addressing the role of other types \nof gestures in L2/FL learning and communication, especially on co-speech \ngestures. Refer the studies by Gullberg (1998) on communication strategies; \nMcCafferty (2002) on word retrieval; Gullberg (2008) on grammar learning; \nKelly, McDevitt and Esch (2009) on word learning; Macedonia and von Kriegs-\ntein (2012) on verbal memory; Hoetjes and van Maastricht (2020) on phoneme \nacquisition; and Stam (2018) on a literature review on this fi  eld.\n2 There are two additional types of research on emblematic gestures, but with no \nlearning process involved: studies that attempted to create a valid instrument to', 'Tabla 6. Índice de disponibilidad por tipo de institución\nEdad\nTabla 7. Total y promedio de palabras por grupo de edad\nEn la tabla 8 se observa el índice de disponibilidad de cada grupo de edad. La prime-\nra palabra en aparecer en el grupo de 15 a 16 años es gay, con un índice de 0.24714968 \ny un total de 10 ocurrencias en la muestra. \nNuestro interés en este apartado ha sido verificar la hipótesis que sugiere que el \nlexicón de los hablantes crece en correspondencia con su rango de edad. En la grá -\nfica 1 podemos ver que el número de palabras evocadas por hombres de institución \npública es de 81 en ambos grupos de edad, lo que muestra que en este estrato no hay \ndiferencia en cuanto a esta variable. En cambio, para la institución privada podemos \nobservar un incremento: los alumnos de 15-16 años emitieron 42 palabras, mientras \nque los de 17-18 años registraron un total de 96. En cuanto al sexo femenino de \ninstitución pública, se presenta una disminución de una unidad, rasgo no represen -\nInstitución pública Institución privada\nPalabra idl Palabra idl\n1 gay 0.28270114 amor 0.36691616\n2 amor 0.26887113 lesbianas 0.1603786\n3 homosexual 0.17045594 gay 0.15923506\n4 lesbiana 0.16527261 igualdad 0.14888955\n5 joto 0.12166862 asco 0.14481304\n6 felicidad 0.12166133 respeto 0.13815132\n7 discriminación 0.12029 gays 0.10852902\n8 igualdad 0.11887211 sexo 0.10835117\n9 libertad 0.09733354 amistad 0.10822576\n10 respeto 0.0936326 raro 0.09541517\nEdad Palabras Promedio\n15-16 años 270 6.75\n17-18 años 373 9.3\n40\nJorge Lázaro y MicheLLe rubino LM II-2 \nLingüística Mexicana. Nueva Época, II (2020), núm. 2: 29-48  \nISSN: 2448-8194', 'ANALISIS CONVERSACIONAL 15\nción que se utilizan. La segunda parte consiste en un \nesbozo de ampliación de esta corriente y sugiere su in- \ntegración en un modelo diferenciado de la interacción \nverbal. Asimismo especificaré algunas de las limitacio\xad\nnes teóricas del análisis conversacional desde una pers\xad\npectiva sociológica, para señalar finalmente algunos cam\xad\npos en el que el análisis conversacional, en su concep\xad\nción ampliada, podrá contribuir al conocimiento de pro\xad\nblemas de la comunicación en México, sin desarrollar es\xad\ntas preposiciones en detalle.\n2. Los antecedentes históricos\nEl análisis conversacional tiene su origen en  una \ncorriente iniciada por el sociólogo americano Harold \nGarfinkel en los años sesenta, ta etnometodotogía,  \nque a su vez se remonta a la etnociencia proveniente \nde la antropología cultural norteamericana. 4\nLa etnociencia se proponía encontrar esquemas de o- \nrientación que representaran el universo de la experien\xad\ncia de una cultura determinada, en otras palabras, recons- \ntruir el.""orden de las cosas en las cabezas de la gente"". \nEn la etnomedicina, por ejemplo, se intentaba descubrir, \na través de procedimientos semánticos de análisis compo- \nnencial, cuál era el sistema de conocimientos e interpre- \ntaciones de las enfermedades, sus causas y curaciones \nen una cultura o comunidad de habla específica.\nLos trabajos de Garfinkel (1967 etc.) y -con dife- \nrencias importantes-l os de Goffman (1967, 1971, etc.) \nse basan en las concepciones del sociólogo y filósofo \nalemán Alfred Schü tz, quien desarrolló, en los años cua- \nrenta en Estados Unidos, los principios metodológicos para \nuna sociología interpretativa, fenomenológ ica, que diera \ncuenta de las estructuras invariables y universales del \nmundo conceptual de una cultura.\nSobre el origen del término Etnometodología, consulte \nse Garfinkel (1974) y Bergmann (1981).\n4']",Teresita Cabanillas is not mentioned in the provided text. Would you like information on another linguist or topic mentioned in the text?
What is the perspective of Feynman on the definition of addition?,"['Fernando Castaños Por otro lado, para Widdowson definir se opone a nombrar y para Selinker et al. definir incluye nombrar. Esto parece una contradicción, peio lo que sucede es que los autores están considerando diferentes tipos de definición, o mejor dicho, están usando el término definición para referirse a distintos actos (que tienen algo en común). Ni lo que dice Widdowson, ni lo que dicen Selinker, Todd y Trimble, es cierto de todo aquello que comunmente se llama “definición”. Tomemos, por ejemplo, el siguiente párrafo, cuyo autor identifica como definición: DEFINITION 1.5. Two matrices [A] and [B] can be multiplied together in the order [AB] if and only if the number of colums in the first equals the number of rows in the se- cond. The matrices are then said to be conformable for the product [AB]. Noble (1969: 5) En este caso, el término definido por Noble, “conformable for the product [AB]”, ocupa el lugar que típicamente corresponde, en una oración en inglés, a la información nueva. 5 Aplicando un criterio más claro, la palabra then tiene una relación anafórica en relación con la oración anterior y, por ende, corresponde a la información dada. Más aún, en la segunda oración, la que contiene el término definido, tenemos el verbo said que según el mismo Widdowson, sería señal de una identificación, y no de una definición. Si aceptamos que el término definido no necesariamente ocupa la posición de “dado”, el siguiente es un contraejemplo de la caracterización de Selinker et al.: If we start with a certain number a, an integer, and we count successively one unit b ti- mes, the number we arrive at we call a + b, and that defines addition of integers. Feynman (1966: 22-1) En este caso es difícil identificar la clase a la cual pertenece el concepto “adi\xad ción”, y más difícil identificar las características que lo distinguen de otros con\xad ceptos que pertenezcan a la misma clase. Es decir, no expresa información de los tipos que Selinker et al. enumeran como (2) y (3). Podría pensarse que la falta de información que clasifique y distinga a la adi\xad ción no muestra una falla en el esquema de Selinker et al., sino que simplemente indica que la definición de Feynman no es una definición formal. El problema de este punto de vista es que entonces tampoco podríamos decir que la definición no es formal. En las definiciones que no son formales, la información clasificatoria no está expresada de manera tan abierta como en las definiciones formales, y podría argüirse, con mucha buena voluntad, que la idea de que la adición es una operación está de algún modo implícita en el párrafo de Feynman et al. Sin em\xad bargo, al menos en los esquemas de Tódd y Trimble, 6 todas las definiciones con\xad 5 Según Halliday (1970), la información dada comúnmente ocurre al principio de la oración inglesa y la información nueva al final. 6 En Todd and Trimble (1979), encontramos un desarrollo de la distinción entre definición formal y definición informal. Este desarrollo, que he sintetizado en el texto de este artículo, preserva el espíritu original de la caracterización que encontramos en Selinker, Todd, and Trimble (1976).']","In the case presented by Feynman, it is challenging to identify the class to which the concept of addition belongs and even more difficult to distinguish its characteristics from other concepts in the same class. This lack of information that classifies and distinguishes addition does not fit the criteria outlined by Selinker et al. for formal definitions. It could be argued that Feynman's definition of addition, while not explicitly formal, may still implicitly suggest that addition is an operation. However, according to Todd and Trimble, all definitions should clearly express classificatory information, which is not overtly present in Feynman's definition.",single_hop_specifc_query_synthesizer,"['alburero 2\nanalfabeta 2\nantisocial 2\ncholo 2\ncorriente 2\ndelincuente 2\ngato 2\ninadaptado 2\nizquierdista 2\npatán 2\npobretón 2\nreguetonero 2\ntepiteño 2\nborrego 1\naborigen 1\nasalariado 1\ncampesino 1\nchalán 1\nchilango 1\nchundo 1\nconflictivo 1\ncosteño 1\ndiscapacitado 1\nesclavo 1\nextravagante 1\ngodín 1\niletrado 1\nindigente 1\nincivilizado 1\nmarginado 1\nnativo 1\nopositor 1\npeleonero 1\nperredista 1\nproletario 1\nratero 1\nrebelde 1\nretraído 1\nsirviente 1\nsocialista 1\nPor supuesto, hay varios vocablos que aparecen una vez y que, además, sólo se \nregistran en ese grupo de edad (sombreados), esto es, fueron dichos por un hablante. \nAl respecto, es importante tomar en cuenta que la muestra total es relativamente pe-\nqueña (sólo 18 personas), lo que favorece la poca dispersión de varios vocablos. Sin \nembargo, por nuestra experiencia cotidiana, podemos afirmar que varias de las palabras  \nque emergieron una sola vez en el corpus sí son habituales, propias de la comuni-\ndad y no producto de una solución idiosincrática, como es el caso de chalán, godín  \ne indigente. Por otra parte, también es razonable inferir que estas palabras sombreadas \nson más comunes en esa generación.\nAdultos\nLos 162 reactivos de los adultos (de 31 a 49 años) arrojaron 70 vocablos diferentes, nue-\nve más que el grupo anterior, aunque algunas unidades léxicas desaparecieron y otras \nse agregaron o mantuvieron. Este grupo tuvo 31 vocablos que ninguna otra generación \nrepitió. Coinciden con los jóvenes en 32 vocablos (naco, vulgar, corriente, grosero, indio, \nñero, chaca, gato, inadaptado, ignorante, pobre, pueblerino, barrio, indígena, rebelde, chacho, \nchairo, chilango, guarro, reguetonero, sirviente, aborigen, asalariado, borrego, criado, delin -\ncuente, esclavo, iletrado, inculto, lépero, proletario, tepiteño ); no comparten con ellos 38 \n(majadero, provinciano, rural, buchón, comunista, moreno, pandillero, reguetoñero, revolto -\nso, acarreado, asaltante, barreño, bobo, borracho, castroso, cholombiano, desadaptado, des-\ninformado, diablero, disidente, estorbo, grillero, irrespetuoso, iztapalapense, lacra, marginal, \nmexicano, miserable, neófito, nopal, ordinario, oriundo, palero, paupérrimo, pejista, pelado, \ntonto, utópico). Justo los vocablos que se presentan con mayor frecuencia son los que \ntambién comparten con los jóvenes.\n76\nDinorah Beatriz Montiel Pérez y Julio César serrano LM V-1 \nLingüística Mexicana. Nueva Época, v (2023), núm. 1: 65-95  \nISSN: 2448-8194', 'patán 2\nrevoltoso 2\nsirviente 2\nanalfabeta 1\nandrajoso 1\nautóctono 1\nbajo 1\nbarrio 1\nbarriobajero 1\nborrego 1\ncampesino 1\ncatrín 1\nchilango 1\nconsciente 1\ncreído 1\ndesadaptado 1\ndesalineado 1\ndetestable 1\ndoméstico 1\nempleado 1\nesclavo 1\nestúpido 1\ngruetzo 1\nidiota 1\nindeciso 1\nizquierdista 1\njodido 1\nlépero 1\nmamón 1\nmarginado 1\nmexicano 1\nmicrobusero 1\nmozo 1\nnecesitado 1\nneófito 1\nñero 1\npatarrajada 1\npeón 1\npobre 1\npopulachero 1\nproletario 1\nprotestante 1\nprovinciano 1\npunk 1\nranchero 1\nrebelde 1\nreguetonero 1\nretrasado 1\nrojillo 1\nsalvadoreño 1\nsencillo 1\nsoñado 1\ntepiteño 1\ntraicionero 1\nzafio 1\nLéxico compartido\nLa distribución del léxico es peculiar en la muestra analizada. Si bien es complicado \nacceder al léxico pasivo, las 27 definiciones obligaron a los informantes a recurrir a va-\nriantes distintas sobre el eje temático explorado. El análisis de la distribución del léxico \npor grupos de edad permite proponer algunos vocablos como neologismos e innovacio-\nnes (en el grupo joven) y detectar posibles obsolescencias (cuando ciertos vocablos sólo \naparecen el en grupo de mayor edad).\nInnovaciones. Aunque es esperable que los diecinueve vocablos utilizados solo por los \njóvenes deben ser conocidos por las otras dos generaciones, dos son las unidades léxi-\ncas que sobresalen, y que podrían estar más afianzadas en el léxico de los jóvenes. La \nprimera se trata de un neologismo, no sólo como disfemismo, sino como forma, ya que \nlos mayores no lo enunciaron, se trata de godín, que surge del apellido Godínez. Este \napellido es originalmente monomorfémico, pero en esta comunidad de habla ha sufrido \n80\nDinorah Beatriz Montiel Pérez y Julio César serrano LM V-1 \nLingüística Mexicana. Nueva Época, v (2023), núm. 1: 65-95  \nISSN: 2448-8194', 'Rodríguez, Darinka. 2023. “Facebook, la ‘app’ donde los mexicanos más gastan sus \ndatos móviles”, El País. Disponible en https://elpais.com/mexico/2023-07-29/face-\nbook-la-app-donde-los-mexicanos-mas-gastan-sus-datos-moviles.html\nStatista. 2024. “Redes sociales con el mayor porcentaje de usuarios en México en \n2023”. Statista. Disponible en https://es.statista.com/estadisticas/1035031/mexi-\nco-porcentaje-de-usuarios-por-red-social/\nVan Dijk, Teun A. 1985. Discurso y contexto. Barcelona: Gedisa.\nVarela-Ortega, Soledad. 2005. Morfología léxica: la formación de palabras. Madrid: \nGredos.\n109\nLM VI-2\nLingüística Mexicana. Nueva Época, vi (2024), núm. 2\nISSN: 2448-8194La lengua no necesita cambios', 'neoLogismos ReLacionados con La Pandemia\n28 covidianidad 1 Cruce\n29 covidiano 2 Cruce\n30 covidiota 4 Cruce\n31 covidiotez 1 -ez\n32 covidistanciado 1 Cruce\n33 covidoso 1 -oso\n34 coviflú 1 N+N\n35 covinfluenza 1 Cruce\n36 covintenso 1 Cruce\n37 cubrebocas 1 V+N\n38 cubreboquear 1 -ear\n39 cuentamuertos 1 V+N\n40 cuentena 1 Cruce\n41 desconfinamiento 2 des-\n42 diabesidad 1 Cruce\n43 echaleganismo 1 -ismo\n44 extrapulmonar 1 extra-\n45 farmacorresistencia 1 N+N\n46 gatellada 1 -ada\n47 gatelliano 1 -ano\n48 Gatellinflas 1 Cruce\n49 glotonofobia 1 -fobia\n50 hipocondriasis 1 -sis\n51 infodemia 3 Cruce\n52 inmunoensayo 1 inmuno-\n53 intrahospitalario 1 intra-\n54 megaplan 1 mega-\n55 multisistémico 1 multi-\n56 Niño Covidios 1 Cruce\n57 no-estrategia 1 no-\n58 nosocomial 1 -al\n59 oxigenoterapia 1 -terapia\n60 pandemial 1 Cruce\n11\nLM IV-1\nLingüística Mexicana. Nueva Época, IV (2022), núm. 1: 7-29\nISSN: 2448-8194', 'Gráfica 2. Distribución de afijos en exp1 de acuerdo con su entropía relativa\nExploración de prefijos de exp1. Los niveles más altos de entropía los alcanzan los afijos \npresentes en la tabla 4.\nTabla 4. Entropías relativas más altas en exp1\nPrefijo Entropía relativa Entropía\ni- 0.79 3.97\nu- 0.73 3.67\na- 0.72 3.62\num- 0.72 3.61\n$- 0.72 3.61\nki- 0.71 3.5\nb- 0.70 3.5\ni$- 0.70 3.5\no- 0.69 3.49\nmi- 0.68 3.43\nEl prefijo i- es interesante destacarlo ya que es el que se utiliza en partes del cuerpo \ncomo iway ‘corazón’ pero que no tiene un valor posesivo como el prefijo ɲ- (Joël 1966; \nSánchez-Fernández 2016). Esta forma también aparece en nombres para plantas, e in-\ncluso se ha sugerido que es un clasificador que tiene su origen en la forma ʔiʔi ‘rama’ \n(Silver 1974). En cuanto a los otros casos, es interesante notar las formas mi- y ki-. En pa \nipai, la m- expresa la segunda persona, ya sea como marca en el verbo de objeto directo \no como sujeto, independientemente de si en el evento que formaliza la oración está in-\nvolucrada una tercera o primera persona; esto contrasta con la primera persona, cuyas \nformas sí varían de acuerdo con esta relación entre ɲ- y ʔ-. De las segmentaciones, 62 \n(9.4%) comienzan con m. \n86 mAnuel AlejAndro Sánchez fernández\nLM V-2 \nLingüística Mexicana. Nueva Época, v (2023), núm. 2: 73-94  \nISSN: 2448-8194']","The perspective of Feynman on the definition of addition is not explicitly mentioned in the provided text. The text focuses on linguistics articles, specifically discussing issues related to language comprehension, vocabulary, and entropy in linguistic systems. If you have any other questions related to these topics or need further clarification, feel free to ask!"
How does Fernando Castaños emphasize the importance of certain points in scientific texts?,"[""Fernando Castaños Sin embargo, en un contexto dado y para ciertos lectores a) puede ser más fácil de procesar que b). En otros casos podría suceder lo opuesto.10 Si el autor de un texto es capaz de percibir cuáles formulaciones serán más fáci\xad les de procesar para sus lectores potenciales, tomará esto en cuenta al escribir su versión final. Incluso es claro que hay muchas oraciones cuya función principal es la facilitación del procesamiento de la información; por ejemplo, en el libro de Klein, después del subtítulo D. Fermat's Principle, encontramos: This principle is a close analogue of the action principle in classical mechanics. Klein (1970: 31). El autor supone que el lector ya está familiarizado con el principio de acción y que, por lo tanto, la analogía le permitirá comprender más fácilmente el principio de Fermat. Es claro que esta oración no contribuye en nada a probar el argumen\xad to que presenta el autor, sólo ayuda a su recepción. Al tratar de identificar las funciones que están cumpliendo los actos retóricos en un texto científico, salta a la vista que el autor no sólo está probando asevera\xad ciones y controlando (en cierta medida) el procesamiento de la información por el lector, sino que también está indicando la importancia de ciertos puntos. A veces, incluso, justifica explícitamente la preferencia por ciertos tratamientos. Es decir, además de argumentar y facilitar, el autor valúa. La valoración se da principal\xad mente con respecto a la utilidad y a la belleza que tienen los temas tratados. La utilidad de un trabajo científico es juzgada por la sociedad en última instan\xad cia con referencia a los beneficios prácticos que pueda generar. 11 Pero para el científico mismo, la utilidad muchas veces se mide más directamente en términos de la teoría misma. Si una nueva formulación permite el tratamiento de proble\xad mas antes inaccesibles, es útil. Además, muchos científicos hacen ciencia princi\xad palmente porque les gusta. Muchas veces (particularmente en matemáticas) una innovación consiste simplemente en un cambio que hace la teoría más atractiva, desde un punto de vista estético. A continuación tenemos dos trozos de discurso. En un caso se dice por qué han adquirido importancia los métodos numéricos (importancia anteriormente menor si se la compara con la de métodos analíticos) en la solución de ciertos problemas. En el otro caso, el autor resalta la belleza de una ecuación que es capaz de resumir una serie de relaciones que ha considerado a lo largo de todo un capítulo: 10 Evidentemente, es necesario hacer estudios empíricos sobre la legibilidad de distintos tipos de dis- curso (distintos patrones de organización de los actos retóricos) para poblaciones dadas. 11 El caso de Gabor es muy ilustrativo. El produjo toda una teoría sobre los hologramas antes de que existieran hologramas, de hecho antes de que existiera siquiera el Láser. Empezaba su trabajo pregun- tándose qué se podría hacer con un rayo de luz coherente, si existiera. Terminaba diciendo que desa- fortunadamente tal rayo no existía. Cuando se inventó el Láser, los científicos se pusieron a averiguar si la fotografía tridimensional imaginada por Gabor era posible. Cuando ésta se empezó a aplicar en ingeniería aeronáutica y en sistemas de seguridad, Gabor fue condecorado con el premio Nobel. Antes de ello, su trabajo sólo era una bella pieza de argumentación físico-matemática, de interés para unos cuantos.""]","Fernando Castaños indicates the importance of certain points in scientific texts by not only proving assertions and controlling information processing by the reader but also by explicitly justifying the preference for certain treatments. He evaluates the utility and beauty of the topics discussed, with utility being judged by society based on practical benefits and by scientists themselves in terms of theory advancement. Additionally, scientific innovations are sometimes driven by the aesthetic appeal of making theories more attractive, particularly in fields like mathematics.",single_hop_specifc_query_synthesizer,"['conspirólogo\nEn el peor de los casos se dará cuenta que éste ya no es \nun fenómeno exclusivo del conspirólogo proverbial con el \ngorro de aluminio, no: la conspiración ya es parte de la con-\nversación pública.\nEl Universal. Opinión. Esteban \nIllades. 20 de agosto de 2020. \nVersión digital.\ncoronabicho Escuela en casa en tiempos del coronabicho: Entre Sherlock \nHolmes y Poirot.\nEl Universal. Confabulario. Mary \nCarmen Sánchez Ambriz. 12 de \nseptiembre de 2020. \nVersión digital.\ncoronabobo\nDe la existencia del virus nadie tiene la culpa, desde luego \n[...]. Los ciudadanos imputan la culpa a los políticos y los \npolíticos, con la boca pequeña, solo se atreven a inculpar, \nen fin, a esa “pequeña minoría” de irresponsables... ¿Peque-\nña? ¿Coronavirus? Coronabobos, dice el espejo.\nMilenio. El Mundo. Manuel Hi-\ndalgo, p. 23. 18 de septiembre \nde 2020.\ncoronabono\nEl Eurogrupo llegó este jueves a un acuerdo para movilizar \nmás de medio billón de euros en préstamos para ayudar \na estados, empresas y trabajadores afectados por el coro-\nnavirus, pero dejó para más adelante la discusión sobre la \nemisión de “coronabonos” para financiar la recuperación.\nSinembargo. Economía.  \n“Eurogrupo acuerda medio \nbillón de euros, pero sin coro-\nnabonos, para afectados por \nCOVID-19”. EFE. 10 de abril de \n2020. Versión digital.\ncoronaburguer\nEn medio de la pandemia por coronavirus el ingenio mexi-\ncano se hace presente en todo el país, con creaciones que \nvan desde un globo, pasteles, bonless, tatuajes y ahora una \nhamburguesa, se trata de la “Coronaburger” y es creada en \nCiudad Madero, Tamaulipas.\nMilenio Digital. Virales. Magda \nBárcenas. 11 de mayo de 2020.\ncoronacrisis Coronacrisis. La cuarentena trajo aparejada la crisis econó-\nmica por la que atraviesan distintos sectores.\nInfobae.com. Tendencias. Víctor \nIngrassia. 7 de junio  de 2020.\ncoronalibro\nCrean el “Coronalibro”. Más de 4 mil 500 propuestas de \n15 países respondieron a la convocatoria de la Universidad \nAutónoma Metropolitana (UAM) para un proyecto colabo-\nrativo, un fotolibro y una pieza multimedia en torno del \ncoronavirus.\nEl Universal. Cultura. Sonia Sie-\nrra. 7 de mayo de 2020. \nVersión digital.\ncoronavirulento\n“CORONAVIRULENTO”. El científico universitario refirió \nque el virus podría ya haber llegado a México sin que haya \nsido detectado, puesto que tarda 14 días en incubarse sin \nque se presenten síntomas.\nLa Crónica de Hoy. Academia. \n“El coronavirus llegará a Mé-\nxico y no estamos preparados: \nacadémicos”. Isaac Torres Cruz. \n31 de enero de 2020. \nVersión digital.\ncoronial\nEs lo que es y esto no va a terminar nunca, ni con una vacu-\nna ni con diez. Es, como están diciendo muchos de nuestros \nmás grandes pensadores: la era “coronial”. Así como la épo-\nca colonial tuvo sus características y sus valores, el corona-\nvirus nos está llevando a situaciones que jamás imaginamos \ny que no van a tener solución en la lógica “pre-coronial”.\nMilenio. Opinión. Álvaro de la \nCueva. 27 de septiembre de \n2020. Versión digital.\ncoronnial\nDespués de los millennials y la generación Z es la hora de \nlos coronnials. Este término, muy popular en las redes so-\nciales, se refiere a la generación que nacerá en los próximos \nmeses como consecuencia del aislamiento en parejas.\nInfobae.com. Tendencias. Víctor \nIngrassia. 7 de junio de 2020.\n22 Ramón ZacaRías Ponce de León\nLM IV-1 \nLingüística Mexicana. Nueva Época, IV (2022), núm. 1: 7-29  \nISSN: 2448-8194', 'Lingüística Mexicana. Nueva Época, v (2023), núm. 1: 147-150\nISSN: 2448-8194\nConcepción Company Company.\xa0 El español en América: de lengua \nde conquista a lengua patrimonial. El Colegio Nacional, México, \n2021; 85 pp.\nEnrique Meléndez Zarco\nUniversidad Nacional Autónoma de México\nzarcounam@gmail.com\nd \nesde hace más de cuatro décadas, Concepción Company Company, investigadora \nemérita de la unam, se ha encargado de analizar rigurosamente la trayectoria dia-\ncrónica del español en obras hoy clásicas en el campo de la filología y la lingüística, \nentre las que destacan los varios volúmenes de la Sintaxis histórica de la lengua española \n(2006-2014), los Documentos lingüísticos de la Nueva España  (1994) y el Léxico histórico \ndel español de México (2002). Ahora la investigadora mexicana nos acerca a la presencia \nindeleble del español en el continente americano, sede de una gran vastedad y diversi-\ndad geográfica, dialectal y cultural.\nEl libro que examinamos,  El español en América: de lengua de conquista a lengua pa -\ntrimonial, publicado por el Colegio Nacional, consta de 85 páginas, distribuidas en un \ncapítulo introductorio, al que le siguen seis capítulos y un apartado de conclusiones. En \nél se pone de manifiesto el paulatino proceso histórico del español, que pasó de ser una \nlengua de conquista al patrimonio de casi 500 millones de hispanohablantes nacidos en \nAmérica. El objetivo de esta obra es justamente dar cuenta de los testimonios lingüís-\nticos que respaldan las fases de conquista y patrimonialización del español americano, \nasí como de los cambios conceptuales generados. En principio, esta obra nos sitúa en \nun acontecer histórico que le asigna un estatus propio al español y que lo distingue de \ncualquier otro: el arribo de Colón y de sus hombres a las Antillas, en el mar Caribe. Tal \nevento, según la autora, permite establecer una precisión muy fina de datación diacró-\nnica del español o bien del momento exacto de su llegada a tierras americanas.\nPara Company, dicho contacto inicial dio cabida a un proceso muy complejo, gradual \ny no lineal mediante el cual se gestaron las muchas identidades lingüísticas del español \nen América; en él entran en juego tres variables principales: a) contactos múltiples y', 'teriormente en el s. xix sólo registré un caso y, finalmente, en el s. xxi obtuve 47 casos. \nDe acuerdo con esto, de modo general, se distingue un alza de los contextos hodiernales \npor parte del pps entre el s. xvii y xxi, aunque no es constante por la escasez de ejemplos \nregistrada en el s. xix. \nTabla 3. Contextos hodiernales con pps (s. xvii-xxi)\nContextos hodiernales\ns. xvii 8/1274  \n0.63%\ns. xix 1/1074\n0.093%\ns. xxi 47/1495\n3%\nUn rasgo importante que hay que subrayar es que mientras en el s. xxi los contextos \nhodiernales pueden abarcar formas como hoy, ahorita y ahora, como lo indican los ejem-\nplos de (7), en el s. xvii sólo hay ejemplos de contextos hodiernales con el adverbio hoy, \ncomo se muestra en (8). Asimismo, en el único ejemplo del s. xix, el contexto hodiernal \nes esta mañana, como se ve en (9). \n(7)\na. 25 E: [¿siempre se han visto]/ siempre se han visto así/ o tú lo decidiste ahora ya \ncon lo de la tesis? [CSCM, p. 175 (entrevista oral)]\nb. Hoy dijiste verme devastada, e hiciste lo único que se podía hacer en ese momen-\nto [Escena, 6 de diciembre 2006 (documento personal)]\nc. Hay algo de lo que apenas ahorita me di cuenta shido (sic), y es que es raro \nverme tan convencida de algo… [Escena, 21 de diciembre de 2006 (documento \npersonal)]\n(8)\nOy (sic) vi vuestra gran beldad la vez primera, señora; que el amor me obliga \nagora a deziros la verdad. [Verdad, p. 80 (teatro)]\n(9) \nMira a J. trae amarrada la mano que se lastimó en el coleadero esta mañana. [Cos-\ntumbres, p. 42 (crónica)]\nDiversos autores como Lope Blanch (1961), Moreno de Alba (1985) o Colombo \n(2015: 336-340) coinciden en sus observaciones sincrónicas, según las cuales el pps en \nespañol mexicano aparece en contextos hodiernales y su significado es perfectivo. \n36 erikA Pérez lezAmA\nLM V-2 \nLingüística Mexicana. Nueva Época, v (2023), núm. 2: 25-47  \nISSN: 2448-8194', 'Hugo H. Morales del Valle20\nFigura 7. Oscilograma, espectrograma y curva melódica del enunciado Es muy variable, producido por un hombre \nde Pénjamo, nacido entre 1945 y 1964, con estudios superiores\nEn la tabla 5, reproducimos una tabla de contingencia con los predictores que fue-\nron significativos de acuerdo con la regresión logística escalonada. De los predictores \npropuestos como potenciales variables explicativas, fueron significativos el año de naci-\nmiento, el corpus y las ciudad de origen, jerarquizados según su valor de p.\nTabla 5. Tabla de contingencia de los predictores significativos para L+H*L%\nPredictor Factor F/N % logodds\nNacimiento\n(p = 2.74e-09)\n1965-1984\n1919-1944\n1945-1964\n1985-1999\n55/240\n69/209\n54/330\n23/240\n22.92\n33.01\n16.36\n9.58\n0.466\n0.363\n-0.256\n-0.573\nCorpus\n(p = 0.00483)\nALM\n2019\n91/299\n110/720\n30.43\n15.28\n0.351\n-0.351\nCiudad\n(p = 0.0424)\nSan Felipe\nPénjamo\nLeón\nGuanajuato\n65/260\n48/250\n46/249\n42/260\n25.00\n19.20\n18.47\n16.15\n0.367\n-0.005\n-0.129\n-0.232\nTotal 201/1019 19.73\nComo señalamos arriba, los factores del predictor con el valor positivo de logodds son \nlos que favorecen el patrón L+H*L%. En este sentido, quienes patrocinan la entonación \ncircunfleja son las personas nacidas en los periodos 1919-1944 y 1965-1984 y las perso-\nnas originarias de San Felipe. Además, la probabilidad de registrar enunciados con esta \nconfiguración nuclear es mayor en el corpus del alm que en el corpus de 2019.\nLingüística Mexicana. Nueva Época, issn: 2448-8194 \nvol. vii (2025), núm. 2.', 'Estudios de Lingüística Aplicada, año 43, número 80, enero de 2025, pp. 7–48\ndoi:10.22201/enallt.01852647p.2025.80.1097\nSistema judicial y lengua vasca en España: una glotofobia persistente [ 27 ]\nlocutores de ese territorio ciertos derechos en materia lingüística \ny garantiza la defensa de la lengua vasca.\nSobre estas bases, el título preliminar de la Ley reconoce el \neuskera como lengua propia de la cav y en conjunto con el caste-\nllano como las lenguas coofi  ciales del territorio, además de pro-\nhibir cualquier discriminación por motivos lingüísticos. El primer \ntítulo aborda los derechos de los ciudadanos y las obligaciones de \nlas administraciones públicas en materia lingüística, mientras que \nel segundo título regula la acción de los poderes públicos.\nSu primer capítulo se refi  ere al uso del euskera por la admi-\nnistración pública, reconociendo el derecho al uso ciudadano de \nlas dos lenguas coofi  ciales del territorio en sus relaciones con la \nadministración autonómica. Asimismo:\nSe regula también la inscripción de documentos en los registros \npúblicos, se establece la forma bilingüe para la publicación de \nlas disposiciones normativas, resoluciones o actos de la admi-\nnistración, así como de las notifi  caciones y comunicaciones. \nSe faculta a todo ciudadano para utilizar la lengua ofi  cial de \nsu elección en las relaciones con la Administración de Justicia. \n[…] Se prevé la progresiva euskaldunización del personal [de] \nla administración pública (boe, 1982: 4).\nEn la Comunidad Foral de Navarra, la Ley Foral 18/1986, de 15 de \ndiciembre, del Vascuence, desarrolla el artículo 9 de la Ley de Re-\nintegración y Amejoramiento del Régimen Foral de Navarra. En su \npreámbulo, precisa: “aquellas Comunidades que, como Navarra, se \nhonran de disponer en su patrimonio de más de una lengua, están \nobligadas a preservar ese tesoro y evitar su deterioro o su pérdida” \n(boe, 1987). De igual forma:\n• En el título preliminar, el artículo 1 establece que:\n1) esta Ley Foral tiene por objeto la regulación del uso nor-\nmal y ofi  cial del euskera en los ámbitos de la convivencia']","I'm sorry, but there is no mention of Fernando Castaños in the provided text about linguistics articles. If you have any other questions or need information on the content provided, feel free to ask!"
What is the significance of Berlin in the context of language evolution?,"['Fernando Castaños tor se define en términos de un concepto no definido en el texto, el de co\xad ordenadas cartesianas. El primer punto significa que los autores no resaltan la importancia del concep\xad to, aunque la tiene. El segundo punto significa que los autores aceptan como váli\xad dos los resultados de la teoría estándar sobre las coordenadas cartesianas. Lo ha\xad cen suyos y parten de ellos sin plantearlos explícitamente. En la oración (6) los autores aceleran aún más el desarrollo de la argumenta\xad ción, aunque presentan definiciones explícitas. Encontramos otra vez dos defini\xad ciones, pero en este caso de dos términos distintos, velocity y acceleration, no del mismo término como en la oración (5). Además en la segunda definición se ha hecho elipsis de una parte que sí está en la primera, “of L ſ J with respect to time t”, y en lugar de “is called”, se usa simplemente “is”. Tenemos en los dos párrafos que hemos considerado definiciones de cuatro tér\xad minos: particle, radius vector, velocity y acceleration. En el primer párrafo está la definición del primer término y en el segundo las definiciones de los otros tres. A cada definición le van dedicando los autores menos espacio, acelerando así el de\xad sarrollo de la argumentación. Parecería que los autores se preocuparan inicial\xad mente para que los lectores pusieran su mente a trabajar en cierta dirección y des\xad pués fueran olvidando esta preocupación para concentrarse en la pura argumen\xad tación. Veamos ahora cuáles de las características del acto de definir que discutimos an\xad teriormente se enfocan en las definiciones de Landau y Lifshitz. Al definir par\xad tícula, los autores enfocan todas las características. Indican que a partir de ese momento el término particle, que está en cursivas, tendrá cierto significado y que éste es en última instancia arbitrario: “By this we mean [...]”. Los autores presen\xad tan también las características distintivas de las partículas: sus dimensiones son despreciables (en comparación con las otras magnitudes que intervienen en la descripción de su movimiento); esto se marca muy claramente con el pronombre whose(cuyas). La definición, además, clasifica las partículas como cuerpos (“...a body [...]”). Finalmente, en la oración (3) queda claro que partícula es un tipo y que diferentes objetos podrán ser considerados como muestras de él bajo ciertas circunstancias. La definición de radio vector no tiene todas las características, y de las que si tiene, no todas se enfocan. Por un lado, no se presentan características distintivas y, por otro, no se pone ningún énfasis en el hecho de que se considera por primera vez el término radio vector con un significado especial. Que Lr,, es un vector, queda claro en su nombre: radius vector; la clasificación se enfatiza al decir que tiene coordenadas, como todos los vectores. Que radio vector es un tipo, se re\xad salta al decir que cada partícula tiene su (its) radio vector. La arbitrariedad se refleja, aunque no de manera prominente, en la selección combinada del lexema define, que tiene un carácter definitivo, del tiempo presente y de la voz pasiva (“is defined”): las cosas son así, y ya. En la definición de velocidad vuelve a aparecer la primera característica. Con']","Berlin is not directly mentioned in the provided context, which focuses on the definitions of various terms related to physics. Therefore, there is no information available to discuss the significance of Berlin in the evolution of languages.",single_hop_specifc_query_synthesizer,"['concordAnciA de número suPerficiAL y efecTivA\nTabla 1. Características de las tres muestras\nPrimero, es importante aclarar que el niño Luis presentó menores logros lingüísti -\ncos, en comparación con las niñas; en su muestra siempre tuvo un desfase de su periodo \nde edad con los avances. No obstante, su registro nos permitió observar la etapa inicial  \nde nuestro enfoque de estudio. Por lo demás, es notorio que Natalia tiene la producción más \nalta de frases nominales, a pesar de su periodo de edad. \nSegundo, en una breve referencia sobre el léxico nominal, podemos decir que el tipo \nde sustantivo que más usaron los tres niños fue el inanimado contable. La división de sus \nnominales, respecto al contraste singular / plural, quedó de la siguiente manera: Natalia \ntuvo 157 casos sólo en singular, 30 sólo en plural y 59 con contraste de número; Tita usó \n168 nominales en singular, 17 sólo en plural y 18 con contraste de número; Luis presentó \n124 datos sólo en singular, 12 sólo en plural y 9 con contraste de número. De estas ge -\nneralidades se tomaron únicamente en cuenta los nominales que formaban parte de una \nfrase nominal.\nEl análisis que presentamos está estructurado a partir de cuatro variables; con esta or -\nganización se pretende que los datos sean claros, debido a que manejamos varios aspectos \ncomo el contraste de número en el nominal (singular / plural) o si éste sólo se produce en \nsingular o sólo en plural, si el nominal se relaciona con un tipo de determinante o con va-\nrios, y si éstos contrastan o no en número. También estudiamos si el nominal comparte el \nrasgo de número con el determinante y, por lo tanto, se da una concordancia o, por el con-\ntrario, no la establece y se obtiene una discordancia, aunque este último punto se revisará \ncon detalle más adelante. \nLa tabla 2 muestra las frases nominales de los tres niños, divididas de acuerdo con las \nvariables mencionadas. Las variables 1 y 2 se refieren a los nominales que aparecieron \nsólo en singular o sólo en plural y que, a su vez, controlan a un determinante también sólo \nen singular o sólo en plural, aunque éstos variarán en cuanto al tipo de determinante, por \nejemplo: el sol, un sol, las estrellas, unas estrellas. Por lo tanto, el análisis se centra en cómo el \nnominal comparte el rasgo de número con los diferentes determinantes y no en los tipos de \néstos. En cuanto a las variables 3 y 4, los nominales presentan contraste de número (singu-\nlar / plural) y controlan este rasgo desde dos perspectivas. En la variable 3, se comparte el \nrasgo con determinantes que se oponen en número, por ejemplo: el gato, los gatos, mientras \nque en la variable 4 hay variación en los determinantes, tanto en el tipo como en el número, \npor ejemplo: una araña, las arañas, otra araña, tres arañas, etcétera. \nNiños Rango de \nedad\nNúmero de \nregistros\nPorcentaje de \nregistros\nTotal de horas de \ngrabación\nDatos obtenidos  \n(frases nominales)\nLéxico nomi-\nnal acumulado\nNatalia 1:11:24 a \n2:02:18 60 5 sesiones \npor semana 45 horas 133 246\nTita 1:07 a 2:08 19 1 sesión \nal mes 38 horas 93 203\nLuis 1:11 a 2:08 10 1 sesión \nal mes 20 horas 74 145\n105\nLM II-1\nLingüística Mexicana. Nueva Época, II (2020) núm. 1: 101-115  \nISSN: 2448-8194', 'léxica, el nombre tiene la capacidad de convertirse en núcleo de frase, de ahí que se le \ndenomine frase nominal (nuclear).\nLa estructura de la frase nominal léxica permite distinguir matices semánticos, entre \nlos que podemos mencionar la definitud, la animacidad, la referencia, la topicalidad y la \ndistinción de persona : 1ª y 2ª vs. 3ª (Silverstein 1976; Givón 1978; Comrie 1979, 1989 \n[1981]; Croft 1988; Aissen 2003). Los dos últimos, sin embargo, aunque intervengan \neventualmente mediante alguno de sus rasgos, como en el caso de la topicalidad, no se \ndiscutirán formalmente en este estudio, ya que el análisis se circunscribe a las frases \nnominales cuyo núcleo es el nombre. \nEl propósito esencial de esta investigación se centra en la identificación de la con -\nvergencia de los rasgos semánticos mencionados anteriormente en cada frase nominal \nnuclear, así como en detectar cómo el grado de confluencia de estas propiedades detona \nla incidencia en las funciones sintácticas y los papeles temáticos de los participantes \ncodificados por medio de ellas. Por ello, se realizará un análisis mixto del elemento sin-\ntáctico en un cuento en náhuatl en su variante de la Huasteca veracruzana2.\nDefinitud / indefinitud\nLa definitud y su alternancia antagónica, la indefinitud, son rasgos identificables en los \nparticipantes de los eventos comunicativos. Lo definido o indefinido de una entidad \ncodificada gramaticalmente se establece bajo los criterios de unicidad o familiaridad, \nentre otros. La teoría de la unicidad (Russell 1905) argumenta que el referente debe \nidentificarse como la única entidad en el contexto particular del acto de habla que se \nestablece entre los interlocutores. La familiaridad (Christophersen 1939) perfila al re -\nferente como una entidad identificable por el hablante y el oyente porque es conocido \ny, por lo tanto, definido para ellos en su comunicación. En otras palabras, un referente \nserá definido si es único y familiar para los interlocutores del discurso; de lo contrario, \nserá indefinido y, en consecuencia, nuevo en la decodificación del mensaje por parte \ndel interlocutor.\nEste procedimiento permite que los nombres entren en juego con otros elementos \ngramaticales que abonan a la (in)definitud de los referentes, tales como artículos, de -\nmostrativos, posesivos, clíticos, afijos, entre otros, y que pueden ser documentados en \nlas lenguas del mundo. No obstante, en determinadas lenguas, el nombre puede no estar \nacompañado de alguno de los elementos que se mencionan.\n2\u2009Los cuentos pertenecen a una colección obtenida por Alan Sandstrom en 1990, cuya transcrip -\nción inicial fue revisada por el autor de este trabajo. Para la nueva edición (Peregrina 2013; 2015; \n2020), con base en los audios originales, se hizo una nueva transcripción y las adecuaciones nece -\nsarias para homogeneizar la escritura de los fonemas: toda c se sustituye por k, excepto antes de h; \ntoda y en función del morfema de 3ª persona del singular posesivo prefijado al nombre, por i; toda \nj, por h, y toda sh, por x.\nLingüística Mexicana. Nueva Época, III (2021), núm. 1: 35-77 \nISSN: 2448-8194\n38 manuel PeReGRina llanes\nLM III-1', 'Lingüística Mexicana. Nueva Época, II (2020), \nnúm. 1: 101-115 ISSN: 2448-8194\nLicencia Creative Commons Attribution-Non-\nCommercial (CC BY-NC) 4.0 International\nFecha de recepción: 10 de enero de 2019\nFecha de aceptación: 8 de marzo de 2019\nZuleyka Mahitzé Olvera Yabur\nUniversidad Nacional Autónoma de México\nolverayabur@gmail.com\nConcordancia de número superficial y efectiva en la \nadquisición temprana de frases nominales en español\nSuperficial and effective number agreement in Spanish \nnominal phrases early acquisition\nRESUMEN: En este artículo se analiza y se sustenta que la concordan-\ncia de número de las frases nominales se adquiere en etapas tempra -\nnas del desarrollo lingüístico infantil y que los niños pasan por dos \nmomentos hasta que logran su adquisición: concordancia de número \nsuperficial –producciones de base léxica como resultado de la imita -\nción de los niños al interactuar con sus cuidadores– y concordancia de \nnúmero efectiva –cuando los niños lograron analizar los constituyen -\ntes de la frase nominal.\nABSTRACT: In this paper, we analize and argue that nominal phrases \nnumber agreement is acquired in early stages of early linguistic devel-\nopment, passing by two moments: superficial number agreement –lex-\nical based productions resulting from children interactions with their \ncaregivers– and effective number agreement –when children are able \nto analyse nominal phrase constituents.\nPalabras clave: \netapa temprana, \ndesarrollo lingüístico \ninfantil, imitación, \nanálisis de  \nconstituyentes.\nKeywords: early \nlanguage acquisition, \nnominal phrases, \nimitation, constituent’s \nanalysis.', 'Estudios de Lingüística Aplicada, año 43, número 80, enero de 2025, pp. 7–48\ndoi:10.22201/enallt.01852647p.2025.80.1097\nSistema judicial y lengua vasca en España: una glotofobia persistente [ 11 ]\nLa noción de glotofobia se inspira en las palabras xenofobia, \nhomofobia o judeofobia para situar la refl  exión sociolingüística en \nun paradigma sociopolítico que hace referencia al rechazo de los \nlocutores y no solamente de las lenguas o de las variedades lin-\ngüísticas. “L’élaboration du concept de glottophobie s’inscrit dans \nla continuité de la conceptualisation, en sociolinguistique, de la \ndiglossie, de la minoration ou satellisation sociolinguistiques, de \nl’auto-odi ou haine de soi, de l’insécurité linguistique”5 (Blanchet, \n2021: 156). Se refi  ere a los primeros trabajos de William Labov \n(1976) que critican las interpretaciones propuestas por Basil Berns-\ntein (1975) a propósito de las prácticas lingüísticas de los jóvenes \nprovenientes de las clases populares. Más allá, esta elaboración \nconcibe la lengua como un medio y un objeto de poder, inscrita en \nrelaciones de poder e inmersa en procesos de colonización, domi-\nnación y hegemonía. Esta orientación teórica ha sido desarrolla-\nda inicialmente por los sociolingüistas Jean-Baptiste Marcellesi \n(1974), Robert Lafont (1997) y Louis-Jean Calvet (1974), así como \npor el sociólogo Pierre Bourdieu (1982; 2001). En Brasil, Marcos \nBagno (1999) ha llevado a cabo una refl  exión análoga sobre la no-\nción de prejuicios lingüísticos.\nComo lo subraya Blanchet, “l’établissement du caractère illé-\ngitime des disparités de traitement à prétexte linguistique rejoint \nles perspectives d’analyse des langues et variétés comme attributs \ncatégoriels contribuant à l’identifi  cation individuelle ou collecti-\nve”6 (Blanchet, 2021: 156). En ese sentido, las discriminaciones \nglotofóbicas coinciden, a menudo, con las discriminaciones vincu-\nladas al origen geográfi  co, a la situación económica o al géne-\n5 “La elaboración del concepto de glotofobia se inscribe en la continuidad de \nla conceptualización […] de la diglosia, de la minoración […], del odio de sí \nmismo [y] de la inseguridad lingüística.”\n6 “[E]l establecimiento del carácter ilegítimo de las disparidades de trato bajo \nun pretexto lingüístico coincide con las perspectivas que analizan las lenguas y \nsus variedades como atributos categoriales que contribuyen a la identifi  cación \nindividual o colectiva.”', 'la delincuencia que se extiende por todo el país, que amenaza sus instituciones, al propio \ngobierno y a todos los mexicanos (E\u20061). En la definición de esta entidad, abstracta, capaz \nde desafiar la fuerza del Estado, el presidente se autodefine, defensor, solo, al frente.\nCuatro días después de su toma de protesta, en su primera reunión oficial como \npresidente, frente a inversionistas españoles acompañados por el entonces príncipe de \nAsturias, hoy Felipe VI de España, sí habla de guerra, asegurando, siempre desde la \nprimera persona, que deben estar seguros de que su gobierno está haciendo todo para \n“ganar la guerra a la delincuencia” (E\u20062). Dos aspectos principales coadyuvan a forjar \ny consolidar esta representación de heroicidad en la conjugación de la figura del presi -\ndente, destacando su función personal, dirigente y protector con la representación de la \npropia empresa.\nEn cuanto al primer aspecto, las operaciones concretas contra la delincuencia se \npresentan como la ejecución de las instrucciones del presidente, como la realización de \nuna obra suya, y adquieren el carácter de una obra personal, como se observó en los \nenunciados de E\u20063: el secretario de Gobernación declara que la puesta en marcha de la \nOperación Conjunta Michoacán es la concreción de las órdenes del presidente y afirma \nel carácter personal del compromiso contraído el 1 de diciembre.\nEl carácter épico de la batalla y de la lucha de ese mismo día 1° de diciembre es re -\ntomado y reproducido por este miembro del gabinete de seguridad en el acto de habla \nperformativo: “Reiteramos a la opinión pública que la batalla contra el crimen organi -\nzado apenas comienza y será una lucha que nos llevará tiempo”.\nEl segundo eje se refiere a que, por medio de un hilo identitario tendido entre el \npasado histórico, el deber del Estado, los objetivos de su gobierno y su propia estrategia \ncomo concretización del mismo deber y objetivos que alcanza a los integrantes de las \ninstituciones del Estado, cuyo deber, como el del Estado, es el de proteger a la sociedad, \ncomo vemos en E\u20064.\nLa proyección épica de pelea incide en el marco de representación de víctimas y com-\nbatientes caídos en cumplimiento de su deber, y es retomada por guerra.\nLa consideración de la muerte de soldados, marinos y policías como “sacrificio por el \nbien de la patria”, y como “ofrenda de vidas” amplifica la metáfora épica por la evoca -\nción de los héroes de las gestas históricas, por cuyo sacrificio la nación existe, al tiempo \nque las equipara con “la guerra contra la delincuencia”.\nconclusiones\nSi el peligro que amenaza a la nación es tal que desafía al poder del Estado y pretende \nsuplantarlo, y si para este desafío no cabe más que una respuesta de la misma magnitud, \ndos fuerzas por lo tanto equiparables, dos fuerzas en conflicto, donde una no puede per-\nvivir sin la desaparición de la otra, se está presentando el escenario de un conflicto en \nel que las dos fuerzas, la delincuencia y el Estado, están armadas.\nEste trabajo reflexiona en torno a aspectos sociales que se configuran en el discurso po-\nlítico, de modo que una o varias palabras se configuran como términos al consolidar una \n116 geoRgina guadaLuPe gavaRRe siLva y RodRigo PaRdo feRnÁndeZ\nLM IV-1\nLingüística Mexicana. Nueva Época, IV (2022), núm. 1: 99-118  \nISSN: 2448-8194', 'Del tratamiento de falsos amigos en un diccionario electrónico de dudas 11\nEstudios de Lingüística Aplicada, año 30, número 56, diciembre de 2012, pp. 9-33\nintroDucción\nEn este artículo, las autoras quieren aportar unas consideraciones acerca de la \ninformación pertinente en las entradas de un diccionario electrónico de dudas \n(DeD) alemán/español para hispanohablantes.1 El estudio se centra en la inclusión \nde falsos amigos y pretende demostrar que estos, sin duda, constituyen un ámbito \npertinente para una obra de estas características dado que tal y como afirma Doval \n(2006: 466): “Los falsos amigos presentan un problema muy importante y muy \nfrecuente tanto en la traducción como en la didáctica de la lengua extranjera al \nque el diccionario bilingüe presta apenas atención”.\n2\nSi esto es así, un diccionario en soporte electrónico podría cambiar esta \nrealidad. Su elaboración depende de múltiples factores, aunque consideramos \nque tres son los puntos clave: los criterios de usabilidad3 del diccionario, el perfil \nde sus usuarios y los fines perseguidos con dicha herramienta. Teniendo en cuen-\nta los criterios de usabilidad, el diccionario en soporte digital —como veremos \nmás adelante— se presta de manera formidable a entradas de tipo falso amigo, ya \nque esta herramienta permite una organización de la interfaz sencilla, dispone de \nuna flexibilidad en cuanto al espacio, ofrece la posibilidad de disponer de manera \nlógica los distintos elementos como colores de hipervínculos, estados de los dis-\ntintos botones, entre otras consideraciones. Además, por analogía con convencio-\nnes cul turales y estándares establecidos es fácil para el usuario reconocer las \netiquetas y símbolos utilizados (Cf. Torres, 2009: 16). Todos estos recursos ayu-\ndarán sobremanera a facilitar la comprensión del fenómeno falso amigo, que en \nmuchas ocasiones puede convertirse incluso en un verdadero enemigo peligroso.  \n \n1 Por razones de espacio, las autoras se han visto obligadas a dejar de lado la problemática de la \nvariación dialectal de los latinismos en el español. Sin duda se trata de un problema complejo que \nmerecería su debida atención. En el análisis de los casos del presente artículo se ha observado in-\nformación a tal respecto que no siempre coincidía. Por ejemplo, en cuanto a “competencia” (caso 3)  \nobservamos su sinónimo “competición (deportiva)” registrado en los tres diccionarios menciona-\ndos, marcado como “americanismo” (drae, clave) y uso en “zonas del español meridional”.\n2 La traducción de las citas en alemán e inglés es nuestra.\n3 Usamos este término en el sentido de, por ejemplo, Wiegand & Fuentes, 2010: 232 y Azorín Fernández \n& Santamaría Pérez (2011).\nELA 56 interiores.indd   11 15/01/14   20:25']","Berlin is not specifically mentioned in the provided text about linguistic articles. If you have any other questions or need information on a different topic related to linguistics, feel free to ask!"
Who is Andrew P. Farley and what is the focus of his research?,"['8 Natalia Ignatieva la “adquisición de segunda lengua”, en el Departamento de Lingüística Aplicada. Es preciso mencionar que la presentación de los proyectos de investigación en curso de este departamento, siempre ha sido una de las prioridades de nuestra revista. Marilyn Buck en sus proyectos de investigación ha estudiado la adquisición de la gramática, particularmente del aspecto verbal. En el artículo aquí incluido, la autora explora la relación entre el aspecto gramatical y el aspecto léxico. Es un estudio donde se analiza la selección de las formas aspectuales del pasado en un relato y que fue aplicado a un grupo de estudiantes hispanohablantes de inglés, así como a uno de nativohablantes del mismo idioma. Los resultados del estudio apoyan la hipótesis del aspecto que establece una influencia del aspecto léxico en la selección de la morfología verbal. El siguiente trabajo, “Leamer Readiness and L2 Production in Spanish: Processability Theory on Trial”, de Andrew P. Farley y Kristina McCollam, prosigue con el tema de la adquisición de segundas lenguas y se enfoca en las etapas de adquisición del español como L2. Los autores exploran la relación entre el estado del alumno, en cuanto a su disponibilidad para aprender (readiness), y el tipo de instrucción que recibe y, por otra parte, el impacto de estas dos variables sobre el desarrollo de las etapas de adquisición. Los puntos gramaticales que sirvieron de material para los tests fueron: el marcador del objeto directo animado a y el modo subjuntivo. Este material se fundamenta en el modelo de “procesamiento del inpuf ”, de Van Patten, y la “teoría de procesabilidad”, de Pienemann, esta última se pone a prueba en el experimento. Los tipos de instrucción usados por los investigadores estadounidenses fueron: instrucción del input estructurado, instrucción de la información explícita y la combinación de estos dos. Los datos recabados después del tratamiento que recibieron los alumnos, los cuales teóricamente estaban “preparados”, o disponibles, para el punto meta, hicieron evidente que el tipo de instrucción influye en el desarrollo de las etapas y que su impacto es mayor que la influencia de la disponibilidad. De esta manera, los resultados contradicen a la teoría de procesabilidad de Pienemann y, en cambio, propor\xad cionan argumentos a favor de la instrucción de procesamiento que a través de este estudio demostró una vez más su eficacia y fuerza. Francisco Castillo y María del Pilar Cerdeira en su artículo “El papel de la partici\xad pación en la interacción en el salón de clase de español como segunda lengua”, abordan otro tema importante dentro del área de enseñanza de lenguas, que es la interacción en una clase de idiomas. Nos presentan los resultados de las observaciones obtenidas en clases de español, donde su meta fue ver cómo participan los alumnos extranjeros en dichas sesio\xad nes. Los autores han utilizado el modelo de interacción de Allwright para analizar, y procesar sus datos, mismo que les permitió estudiar la diversidad de tipos de participación manifestados por los estudiantes y confirmar sus hipótesis de que ésta, en su mayor parte, está condicionada por los requerimientos del profesor. El artículo de']","The work 'Leamer Readiness and L2 Production in Spanish: Processability Theory on Trial' by Andrew P. Farley and Kristina McCollam delves into the acquisition of second languages, specifically focusing on the stages of acquiring Spanish as a second language. The authors explore the relationship between the student's readiness to learn and the type of instruction received, as well as the impact of these variables on the development of acquisition stages.",single_hop_specifc_query_synthesizer,"['Las funciones de incluso en La historia deL españoL\nMartín Zorraquino, María Antonia. 2010. “Los marcadores del discurso y su mor -\nfología”, en Óscar Loureda Lamas y Esperanza Acín Villa (eds.),  Los estudios sobre \nmarcadores del discurso en español, hoy. Madrid: Arco / Libros, pp. 93-181.\nMartín Zorraquino, María Antonia y José Portolés Lázaro. 1999. “Los marcado-\nres del discurso”, en Ignacio Bosque y Violeta Demonte (dirs.), Gramática descriptiva \nde la lengua española, vol. 3: Entre la oración y el discurso. Morfología. Madrid: Espasa \nCalpe, pp. 4051-4212.\nPavón Lucero, María Victoria. 1999. “Clases de partículas: preposición, conjunción y \nadverbio”, en Ignacio Bosque y Violeta Demonte (dirs.),  Gramática descriptiva de la \nLengua Española, vol. 1: Sintaxis básica de las clases de palabras. Madrid: Espasa Calpe, \npp. 565-655.\nPortolés Lázaro, José. 2007. Marcadores del discurso, 4a ed. Barcelona: Ariel.\nReal Academia Española. Corpus diacrónico del español [corde], en <http://www.rae.es>.\nReal Academia Española. 2010. Diccionario de la lengua española [drae], 22ª ed., en \n<http://www.rae.es/recursos/diccionarios/drae>.\nReal Academia Española y Asociación de Academias de la Lengua Española. 2009. Nue-\nva gramática de la lengua española [ngle], t. 2: Sintaxis II. Madrid: Espasa.\nSánchez López, Cristina. 1999. “La negación”, en Ignacio Bosque y Violeta Demonte \n(dirs.), Gramática descriptiva de la lengua española, vol. 2: Las construcciones sintácticas \nfundamentales. Relaciones temporales, aspectuales y modales. Madrid: Espasa Calpe, pp. \n1025-1128.\nTraugott, Elizabeth Closs. 2010. “(Inter)subjectivity and (inter)subjectification: A re-\nassessment”, en Kristin Davidse, Lieben Vandelanotte y Hubert Cuyckens (eds.), Sub-\njectification, Intersubjectification and Grammaticalization . Berlin: Walter de Gruyter, \npp. 29-71.\nTraugott, Elizabeth Closs. 1995a. “The role of the development of discourse markers \nin a theory of grammaticalization”. Comunicación presentada en la 12th International \nconference on Historical Linguistics. Manchester, en <http://www.stanford.edu/~tr-\naugott/papers/discourse.pdf>.\nTraugott, Elizabeth Closs. 1995b. “Subjectification in grammaticalization”, en Dieter \nStein y Susan Wright (eds.),  Subjectivity and Subjectivisation. Cambridge: Cambridge \nUniversity Press, pp. 31-54.\nZimmermann, Malte. 2011. “The grammatical expression of focus in West Chadic: Va-\nriation and uniformity in and across languages”, Linguistics 49, núm. 5: 1161-1211.\nZimmermann, Malte y Edgar Onea. 2011. “Focus marking and focus interpretation”, \nLingua 121, núm. 11: 1651-1670.\nZwicky, Arnold. 1985. “Clitics and particles”, Language 61, núm. 2: 283-305.\n181\nLM II-2\nLingüística Mexicana. Nueva Época, II (2020), núm. 2: 157-181\nISSN: 2448-8194', 'Las funciones de incluso en La historia deL españoL\nb. Toda la servidumbre de D. Francisco, *tan incluso la peonada, que era numerosa, \nle llamaban á Chucho\xa0el niño \n(Chucho el ninfo 1871)\nAdemás de los casos en que funciona como participio o como partícula, identifico \notros aquí denominados limítrofes, donde no es posible determinar si su función es par -\nticipial o de partícula. Corresponden a ocurrencias donde incluso establece relaciones \nsintagmáticas con ffnn de número singular y género masculino, por lo que la concor -\ndancia característica del participio se ve neutralizada, como se muestra en (4). \n(4)\na. Estiéndanse los límites del señorío de la Iglesia de la otra parte del Apenino hasta \nel mar Adriático, llegando al río Pescara, y destotra al río Garellano, incluso / \nincluido / hasta gran pedazo del Abruzo y de Campania \n(Historia de Felipe II, Rey de España 1619)\nb. En el caso del párrafo primero del artículo anterior, si estuviera asegurada la \nfinca. el valor del seguro quedará afecto al pago del capital del censo y de las \npensiones vencidas, á no ser que el censatario prefiera invertirlo en reedificar la \nfinca, en cuyo caso revivirá el censo con todos sus efectos, incluso / incluido / \nhasta el pago de las pensiones no satisfechas \n(Código Civil 1889)\nLa neutralización de la concordancia de incluso con la fn dificulta su clasificación \ncomo participio o como partícula. Esto va a acompañado de una ambigüedad también \nde carácter funcional que se ilustra con la conmutación tanto por el participio analógi -\nco incluido como por la preposición hasta. Como partícula o como participio, los casos \nlimítrofes como los de (4) tienen en común el significado de inclusión que codifica esta \nunidad. De esta manera, la ambigüedad de estos casos no es sólo formal, sino también \nfuncional.\nEl segundo parámetro es la función gramatical: de acuerdo con la categoría a la que \npertenezca incluso, puede corresponder a una función participial o de partícula. Como \npartícula puede funcionar como marcador de foco –de inclusión, escalar o de concesivi-\ndad– o como marcador discursivo. En (5) ejemplifico las distintas funciones adverbiales \nde incluso como partícula. Como criterio explicativo, lo reemplazo por elementos típicos \nde la función que se ejemplifica. En (5a) funciona como una partícula de inclusión sim-\nple que indica que el elemento bajo su alcance –sargentos, cabos y tambores– pertenecen \na un dominio –un batallón–. El criterio para identificar esta función es el reemplazo por \nel participio adjetival incluido, que ha de concordar en género y número (masculino y \nplural) con el elemento modificado. \n161\nLM II-2\nLingüística Mexicana. Nueva Época, II (2020), núm. 2: 157-181\nISSN: 2448-8194', '(17)\na. Estiéndanse los límites del señorío de la Iglesia de la otra parte del Apenino hasta \nel mar Adriático, llegando al río Pescara, y destotra al río Garellano, incluso / \nincluido / hasta gran pedazo del Abruzo y de Campania \n(Historia de Felipe II, Rey de España 1619)\n b. En el caso del párrafo primero del artículo anterior, si estuviera asegurada la \nfinca, el valor del seguro quedará afecto al pago del capital del censo y de las \npensiones vencidas, á no ser que el censatario prefiera invertirlo en reedificar la \nfinca, en cuyo caso revivirá el censo con todos sus efectos, incluso / incluido / \nhasta el pago de las pensiones no satisfechas \n(Código Civil 1889)\nLa función de incluso como marcador de concesividad en estructuras condicionales \nestá relacionada con su función como partícula de foco escalar. Flamenco García (1999: \n3810) describe estas estructuras como concesivo-condicionales escalares, las cuales se ca-\nracterizan por combinar las propiedades concesivas con características condicionales. \nApunta que lo característico de una relación concesiva no es tanto una estructura sintác-\ntica particular, sino más bien la existencia de una información implícita que contradice \nel contenido proposicional expresado en cada uno de los miembros de que consta. Las \nconstrucciones concesivo-condicionales escalares comparten con las concesivas el con -\ntraste que se establece entre sus dos miembros y con las condicionales que en el conte -\nnido proposicional de la prótasis se hace referencia a situaciones de carácter hipotético.\nFlamenco García señala igualmente (1999: 3843) que dentro de la naturaleza escalar \nde piezas léxicas como incluso se inscribe la posibilidad de que se codifique una con -\ntraexpectativa. Esto influye de manera decisiva en la interpretación de construcciones \nencabezadas por incluso si, que es en suma el mismo tipo de contenido implícito transmi-\ntido por las expresiones concesivas y adversativas, esto es, el sentido de contradicción.  \nSi bien esta clase de estructura presenta apariciones esporádicas en etapas previas a \nla conclusión del cambio, generaliza su presencia en la segunda mitad del siglo xx, lo \ncual puede sugerir que, aunque esta función dependa de la función escalar de incluso, \nconserva una naturaleza más funcional o abstracta que la que tendría la función escalar \naisladamente. Por esta razón prolifera en la etapa final de su proceso de cambio, el cual \navanzó del plano léxico (participio) al plano funcional (partícula)9.\nIdentifico la etapa final del desarrollo histórico de incluso como el periodo más fun-\ncional, en el que K önig (1991) sitúa las partículas discursivas y, como he mostrado, in-\ncluso puede caracterizarse también como marcador discursivo o partícula discursiva. Esta \netiqueta engloba a las unidades lingüísticas que puedan presentar usos exclusi vamente \n9\u2009Sobre la direccionalidad del cambio, ver Bybee et al. (1994), Traugott (1995a), Hopper y Trau-\ngott (2003 [1993]) y Bybee (2004).\n176 Glenda zoé lizárraGa navarro\nLM II-2 \nLingüística Mexicana. Nueva Época, II (2020), núm. 2: 157-181  \nISSN: 2448-8194', 'La genericidad y los determinantes en el español de México\nResumiendo lo que hemos mostrado para la interpretación genérica con frases nomina-\nles de artículo indefinido:\n1.  Se presenta con predicados caracterizadores;\n2.  la frase nominal indefinida se presenta como “lo caracterizado”;\n3.  la frase nominal indefinida no refiere a la clase;\n4.  la frase nominal indefinida refiere a los miembros de la clase (individuos o sub-\nconjuntos de ella);\n5.  lo aseverado se resiste a la excepcionalidad;\n6.  el contexto situacional difícilmente delimita el universo de la frase nominal inde-\nfinida.\nEstá claro que los predicados caracterizadores le imprimen a la frase nominal inde-\nfinida un papel tal, que permiten la interpretación genérica de la oración. Es por esto \nque a este tipo de genericidad se le ha llamado “genericidad verbal” (Lawler 1973) y \ntambién “genericidad caracterizadora” (Krifka et al. 1995); es decir que no es el valor \npropio de la frase nominal indefinida lo que dispara la interpretación genérica, a dife -\nrencia de la frase nominal definida, que puede referir a la clase de manera general. A las \ninterpretaciones genéricas con frases definidas se les ha dado el nombre de “genericidad \nnominal” (Leonetti 1999), al reconocer que de la misma frase nominal definida surge la \nreferencia genérica16. Por lo tanto, resulta necesario indagar qué tiene el valor semánti-\nco de la definitud que puede referir la genericidad y no sólo la referencia particular. Me \nreferiré muy brevemente a lo central de las propuestas clásicas de la definitud.\ndescrIpcIones cLásIcas de La defInItud\nSon tres las propuestas ampliamente conocidas que se han hecho para describir el valor \nsemántico de la definitud, con antecedentes en Frege (1973 [1892]) y en Russell (1990 \n[1905]).\nEn la primera mitad del siglo xx, Paul Christophersen (1939)  presenta un amplio \nanálisis del funcionamiento de los artículos gramaticales del inglés, a partir del cual \npostula sus propuestas teóricas. Consideraba que lo básico de la definitud es que le agre-\nga a la frase nominal la asociación a un conocimiento previamente adquirido (directa \no indirectamente); a esto le llamó “familiaridad”; un ejemplo del funcionamiento de la \nfamiliaridad es el uso anafórico:\n(59) Trataba de tomarle foto a una ardilla, pero se apareció un gato y la ardi-\nlla se trepó rápidamente a un árbol.\n16\u2009 Christopher Lyons (1999) observa que la genericidad de la frase nominal se expresa en unas \nlenguas típicamente con frases plurales escuetas, en otras con frases definidas y, en algunas lenguas, \nel rango de frases nominales disponibles para la genericidad es amplio: definidas, indefinidas, sin-\ngulares y plurales.\n21\nLM VI-2\nLingüística Mexicana. Nueva Época, vi (2024), núm. 2\nISSN: 2448-8194']","I'm sorry, but based on the provided context, there is no mention of Andrew P. Farley or his research. The articles discussed in the context are focused on the functions of the word ""incluso"" in the Spanish language, discourse markers, and linguistic analysis of gossip. If you have any other questions related to these topics or any other linguistics-related inquiries, feel free to ask!"
Who is David Lasagabaster and what is his research about?,"['David Lasagabaster, “Un análisis de las actitudes hacia el inglés como lengua extranjera por medio de grupos de discusión”, concierne a otro aspecto del proceso de la ASL, como son las actitudes hacia L2, en este caso se trata de alumnos']","David Lasagabaster is known for his research on attitudes towards English as a foreign language through discussion groups, focusing on L2 attitudes among students.",single_hop_specifc_query_synthesizer,"['doi: 10.22201/enallt.01852647p.2024.79.1079\n[ 120 ] Sabine Pfl  eger\nEstudios de Lingüística Aplicada, año 42, número 79, julio de 2024, pp. 113–128\n2) Facilitan los procesos de identifi  cación individual y de per-\ntenencia a uno o más grupos sociales.\n3) Fomentan las comparaciones y evaluaciones entre indivi-\nduos y grupos.\nEn el apartado siguiente se ilustra cómo algunos de estos procesos \nde conceptualización se instancian en discursos mediáticos mexi-\ncanos acerca de los movimientos migratorios entre México y Esta-\ndos Unidos, produciendo diferentes puntos de vista y perspectivas \nidentitarias sobre el equilibrio de poder percibido en la relación \nde ambos países.\n2. La migración entre México y Estados Unidos: muchos \nescenarios diferentes, pero simultáneos\nLa migración en México es un fenómeno sui generis (iom, 2018). \nEsto se debe a que aquí, en un mismo país, coexisten diferentes \nescenarios migratorios. La ubicación geográfi  ca entre los países \ncentroamericanos y los Estados Unidos convierte a México en un \nespacio crítico para los fl  ujos migratorios. En primer lugar, México \ncuenta con un fuerte movimiento migratorio propio hacia Estados \nUnidos (Massey, Pren & Durand, 2009; Pérez-Soria, 2017). Au-\nnado a ello hay migrantes, en su mayoría transmigrantes centro-\namericanos, quienes, cada vez más, se quedan en México porque \nnunca llegan a su destino de cruzar la frontera a Estados Unidos \n(Fernández, Espinoza & Choy, 2012;  cndh, 2017). Asimismo ha \naumentado en los últimos años el número de migrantes y transmi-\ngrantes que, debido a la política estadounidense de refugiados, han \nregresado a México, de manera más o menos voluntaria (Calderón, \n2012; Mestris, 2013; Canales & Rojas, 2017). Adicionalmente a \nestos fenómenos, no se puede dejar de mencionar la fuerte mi-\ngración interna de áreas rurales a centros urbanos por la creciente \nviolencia de cárteles de droga que desplazan a las personas de sus \nlugares de origen.', 'El chisme: estrategias discursivas desplegadas en su construcción 35\nEstudios de Lingüística Aplicada, año 36, número 67, julio de 2018, pp. 9–43\ndoi: 10.22201/enallt.01852647p.2018.67.723\n39 M: °(y Jésica=)°\n40 ?: ¡ayy niñoos!\n41 M: °(=y por eso no la querían)°\n42 A: si no sa- si no [saben]\nEn los turnos 34 y 35 hay un claro pronunciamiento por parte de las hablantes que \nlas lleva a desligarse de las valoraciones negativas respecto a la 3ª p. Ambas buscan \nconservar intacta su imagen frente a la otra. Las valoraciones evocadas se constru-\nyen desde el distanciamiento (extravocalización atribuida). Este modo de expre-\nsarse involucra cierto tipo de evaluación que no es asumida por quienes hablan.\n5. Conclusiones\nLa investigación cuyos resultados han sido expuestos aquí me ha permitido mos-\ntrar uno de los tantos modos en que puede ser analizado el chisme. En particular \nhe recurrido a dos propuestas de análisis del discurso: el análisis de la conver -\nsación casual y la teoría de la valoración. El deseo de hacer este estudio nació \nde las observaciones realizadas en las interacciones orales. A pesar de que el fe-\nnómeno se presentó, en un principio, cotidiano y falto de trascendencia, poco a \npoco y partir de un análisis detallado, fue develando su complejidad discursiva.\nEl chisme es un género de la conversación casual —con parámetros de \nconstrucción específicos— configurado por los participantes durante la interac-\nción mediante el uso de múltiples estrategias discursivas, gracias a las cuales se  \nvan negociando posicionamientos discursivos. Estas estrategias guían el desarro-\nllo de la interacción, la forma como se da la inserción del chisme en alguna parte \nde la conversación, el contexto que propicia el cierre y cómo los participantes se \nposicionan, negocian su participación, en suma, el proceso de construcción del \ngénero chisme.\nEs importante recordar que esta investigación se realizó en un contexto muy \nespecífico, pues solo se consideraron las conversaciones de la informante cen-\ntral con sus vecinas. Vale recordar que la informante es una mujer de 50 años de \nedad, ama de casa y de clase media-baja que vive en un complejo habitacional \n(de departamentos) densamente poblado. Dadas las características de esta infor -\nmante (edad, ocupación, clase social, lugar de residencia), así como las activida-', 'Estudios de Lingüística Aplicada, año 41, número 76, enero de 2023, pp. 7–36\ndoi: 10.22201/enallt.01852647p.2023.76.1030\nPercepción sobre la adquisición y el dominio del inglés en profesores universitarios [ 27 ]\nCuadro 5. Análisis de regresión para las variables predictoras de la percepción sobre el dominio del inglés\nModelos B SE B β t p\n4. Estudiar en una escuela de idiomas .29 .09 .09 3.06 .002\n5. Vivir en el extranjero .93 .12 .24 7.29 .000\n6. Aprender por iniciativa propia .43 .08 .15 4.89 .000\n7. Atender una exigencia académica .06 .09 .02 .67 .500\nNota: Modelo 1 R2 = .18; Modelo 2 R2 = .35 (N = 670; p = < .005).\nLos resultados permiten advertir que los aspectos culturales son \nimportantes para alcanzar el dominio de una lengua extranjera, es-\npecialmente a través de contextos informales (aprender por cuenta \npropia, interacciones con hablantes nativos, ver películas, escuchar \nmúsica, etc.), ya que están altamente relacionados con la autoper-\ncepción del dominio del inglés.\n6. Conclusiones\nSe encontró una tendencia general de un nivel de dominio inter-\nmedio-bajo (B1) y, en algunas habilidades, intermedio-alto (B2), \nlo cual ha sido recurrente en estudios que reportan las habilidades \nlingüísticas de académicos no nativos (Martínez & Morgan, 2019), \nincluso en académicos que participan en programas emi (Dimo-\nva, 2017). Esta situación es similar a otros contextos que también \nexperimentan cambios en la política educativa y que proponen la \nincorporación de docentes que puedan sostener un proceso de en-\nseñanza en inglés con fi  nes académicos.\nEs de considerar que el dominio del inglés ha sido impulsa-\ndo por estrategias institucionales que buscan crear un consenso, \nademás de mantener el poder y las ganancias que otorgan las estruc-\nturas de mercado a cambio del capital lingüístico, el cual muchas \nveces proviene de la socialización familiar y la escolarización (Hou, \n2020). Sin embargo, las normas de aprendizaje de idiomas centra-\ndas en la noción del “hablante nativo ideal” han suscitado muchas \n(continuación )', ""[ 8 ] José Manuel Solís Navarro & Édgar Oswaldo González Bello\nEstudios de Lingüística Aplicada, año 41, número 76, enero de 2023, pp. 7–36\ndoi: 10.22201/enallt.01852647p.2023.76.1030\nResumen\nEl dominio del inglés ha sumado va -\nlor en la educación superior desde que \nuniversidades comenzaron a incorpo -\nrar procesos de internacionalización \nen casa, lo cual ha fomentado también \nla adquisición del idioma por parte de \nprofesores. Por lo tanto, se analiza la \npercepción del profesorado sobre el do-\nminio del inglés y su relación con los \nfactores socio-académicos, así como \ndel contexto de adquisición del idio -\nma. Se recolectaron respuestas de 670 \nacadémicos de una universidad públi -\nca de México a través de un cuestiona-\nrio digital; los datos fueron analizados \nmediante una regresión lineal múltiple \npara identificar efectos. Los resulta -\ndos advierten que la habilidad lectora \nse percibe con mayor competencia y la \ncapacidad oral con algunas debilidades. \nAdicionalmente, pertenecer a las áreas \nstem y aprender el idioma en ambien-\ntes no académicos pueden predecir la \npercepción del dominio del inglés. Se \nconcluye que, a pesar de los niveles de \ndominio identificados, las exigencias \nde ciertas acciones como impartir asig-\nnaturas en inglés hacen relevante la pla-\nnificación institucional y la definición \nde escenarios estratégicos de capacita-\nción docente en los que se oriente hacia \nla adquisición del idioma.\nPalabras clave: educación superior; \ninglés; currículo; profesorado\nAbstract\nEnglish Proficiency has added value \nin higher education since universities \nstarted incorporating internationaliza-\ntion processes at home, which has also \nencouraged teachers' acquisition of the \nEnglish language. Therefore, we ana -\nlyzed teachers' perception of English \nproficiency and its relationship with \nsocio-academic factors, as well as the \ncontext of language acquisition. Re -\nsponses were collected from 670 ac -\nademic professionals from a public \nuniversity in Mexico through an online \nquestionnaire; data were analyzed us -\ning multiple linear regression to iden-\ntify potential effects. The results indi-\ncate greater perceived competence in \nreading skills and some weaknesses \nin oral skills. Additionally, being part \nof stem areas and learning the En -\nglish language in non-academic envi -\nronments can predict the perception \nof English proficiency. It is conclud -\ned that, despite the proficiency levels \nidentified, the demands of certain ac -\ntivities, such as teaching subjects in \nEnglish, point to the relevance of in -\nstitutional planning and the definition \nof strategic teacher training scenarios \noriented towards language acquisition.\nKeywords: higher education; English; \ncurriculum; teachers"", 'ANALISIS CONVERSASIONAL 65\ncllita analizar las estrategias comunicativas que se em\xad\nplean para imponer los objetivos institucionales. En to\xad\ndas las instituciones que tienen contacto con el público; \ncomo los juzgados, las oficinas de consulta, asesorías o \nquejas, me parece factible hacer constar la relación asi\xad\nmétrica entre profesionales y clientes, lo que se refle- \nja en las estructuras discursivas.\nEn México, especialmente en el Distrito Federal, \nexiste un aparato estatal fuertemente desarrollado que \ncuenta con un gran número de dependencias e institucio\xad\nnes, algunas de las cuales muestran un gran despliegue \npublicitario (Secretaría de Educación Pública, institu\xad\nto Nacional del Consumidor, para mencionar solamente al\xad\ngunas). Un estudio de las prácticas discursivas al inte\xad\nrior y al exterior de estas instituciones podría diluci\xad\ndar en forma concreta hasta qué punto logran relacionar\xad\nse con el público y cómo funcionan los mecanismos de re\xad\nproducción del poder a través de todo el aparato discur\xad\nsivo del que disponen.\n6.3.1.   Posibles temas de investigación\nLa investigación en este campo podría arrojar como \nresultados:\n-Una descripción y tipología de discursos específi\xad\ncos en diversas instituciones.\n-La identificación de estrategias comunicativas y \nde sus realizaciones de acuerdo a los objetivos de los \ninteractantes sociales.\n-Un análisis de la relación entre estrategias y ti\xad\npos de interacción verbal y su influencia en el éxito o \nfracaso de la comunicación.\n-Una descripción de las formas específicas de asegu\xad\nramiento de la comprensión y de las formas de cooperación \ny de conflicto.\n-Un análisis de los problemas de lenguajes especia\xad\nlizados, sus funciones, formas y las dificultades que', 'Estudios de Lingüística Aplicada, año 41, número 76, enero de 2023, pp. 7–36\ndoi: 10.22201/enallt.01852647p.2023.76.1030\nPercepción sobre la adquisición y el dominio del inglés en profesores universitarios [ 19 ]\ncon nombramiento de profesor-investigador de tiempo completo, \n40% de profesor de asignatura y 8.7% tiene contrato de técnico \nacadémico. El tiempo estipulado en los contratos es principalmente \n“indeterminado” (70.5%) y en menor proporción “determinado” \n(29.5%). Adicionalmente, la muestra se clasifi  có en profesores de \náreas stem (60.1%) y no stem (39.9%).\n4.1.  Instrumento\nSe diseñó un instrumento para medir el dominio, actitudes y uso del \ninglés con fi  nes académicos. La percepción del dominio del inglés \nes la variable que se consideró para la elaboración de este texto. \nLos indicadores para medir el dominio del inglés fueron en función \nde las habilidades de la lengua: habla, escucha, lectura, escritura \ny gramática. Como opciones de respuesta se utilizó una escala tipo \nLikert según un continuum de siete niveles (0 = nulo a 6 = experto).\nPara fi  nes de validación sobre la forma de evaluar la percep-\nción del dominio del inglés, se realizaron análisis factoriales ex-\nploratorios, en los cuales se obtuvo una solución unidimensional, \ncon un porcentaje de varianza acumulada de .83. Adicionalmente, \nel coefi  ciente del alfa de Cronbach fue de .96, lo que denota una \nconsistencia interna en el modo de medir el constructo. Los resul-\ntados permitieron reconocer valores del determinante (.003), de \nla prueba de esfericidad de Bartlett (X 2 39682.40, p < .000) y el \nKMO (.88), lo que sugiere que los datos son adecuados para este \ntipo de análisis.\n4.2.  Análisis de datos\nEl análisis de datos fue realizado con apoyo del Statistical Package \nfor the Social Sciences (spss). El análisis descriptivo de las varia-\nbles permitió mostrar el nivel percibido de dominio del inglés se-\ngún cada una de las habilidades de la lengua. Una vez establecidos \nlos niveles, se realizaron pruebas t  bajo la hipótesis de encontrar \ndiferencias en las frecuencias de las respuestas según dos grupos']","David Lasagabaster is not mentioned in the provided context. If you have a specific article or research topic in mind related to linguistics or language studies, please provide more details so I can assist you better."
"What insights can be gathered from the reference to Eme, Lacroix & Almecija in the text?","['Ana María Borzone, María Luisa Silva y María Elena Benítez calificar el relato previo como una versión de secuencias descriptivas, más que como un relato canónico. En muchas ocasiones, sin lugar a dudas, estos usos podrían ser considerados como síntoma de cierta competencia narrativa deficita- ria (Eme, Lacroix & Almecija, 2010). No obstante, ante la demanda de producir un relato de experiencia personal, la narradora no solo produce un relato extenso sino que, además, no se observan las falencias mencionadas previamente. A continuación transcribimos parte del relato referido: No tenía la cocina grande, tenía la cocina no más de dos kilos, la chiquita de una hornalla. En esa pues, estaba haciéndome friendo huevos, tostando huevos, como se dice [...] ahí nomás se me movió el sartén y se me vino enseguida el aceite todo en mi pie y mirá me quedó marquita ahí [...] no sabía qué hacer, lo dejé con agua un ratito y a pocos segundo me volvió a arder peor y no aguantaba, todavía tenía miedo ir al hospital. Eso pasó hace cinco años atrás, en el año de crisis [...] y después se me entró a hacer pus, ampolla se me hizo, no lastimadura [...]. Al siguiente día estaba todo de los que pinché salía agüita y me dolía peor. Hasta ahí más o menos camina- ba poquito, pero no caminaba bien, cojeando pero después me fui en remís al Hospital Piñero. El Hospital Piñero no me quiso atender, me dijo que no era para ahí, que es muy grande, que es para el Hospital del Quemados y el remís ya se había ido y no tenía en qué ir y no había ningún remís que me lleve, meta buscar y no podía ni caminar. Después me fui al Hospital del Quemado [...] me fui y me atendió, pero ahí me hizo bien gritar; agarró una cosa parece que lo hubiera hecho con alco- hol, me explotó y me arrancó todo, iba a gritar pero mal. Me arrepentí de haber ido ahí. [...] y después como yo le he dicho me hizo la limpieza, después me vendó, me dijo, no sé cuantos días, creo que fue un martes, me dijo venga el viernes, y justo era en verano y justo yo vivía en el último piso de arriba y yo estaba sentada, con el calor, me ardía más, mi amiga me ha dicho no te vas a sacar y yo no aguanté, para dos días me vendó él, ella, 3 yo ni un día, lo saqué yo y después no podía volverla a conectar como estaba, después he venido nunca más voy al hospital. [...]. Y no podía trabajar porque era justo con ese pie tengo que trabajar y no podía. Después de tres meses pude trabajar, así estaba todo enero. Como se puede observar en el fragmento transcrito, el uso de deícticos se encuentra justificado por la dinámica conversacional, no se observa escasez de 3 Posiblemente la narradora corrige con el pronombre personal femenino (ella) la referencia inade- cuada, pues una doctora (ella) realizó las primeras curaciones que refiere. Estudios de Lingüística Aplicada, año 29, número 54, diciembre de 2011, pp. 9-35 ELA 54 interiores.indd 28 20/03/13 17:09']","The reference to Eme, Lacroix & Almecija in the text suggests that certain narrative uses could be indicative of deficient narrative competence. It implies that these uses may not align with canonical storytelling standards and could reflect a lack of narrative proficiency.",single_hop_specifc_query_synthesizer,"['42\ndifference between adverbs and adjectival con-\nstructions. It is not very easy to show that \nthis fact has to do with subjectivity but I \nthink that it can be related to the problem of \nthe deniability of the neustic. If it can be \nshown that the neustic cannot be negated, then \nit cannot be given a negative qualification \neither. I do not want to go too deeply into \nsuch a complicated matter, but let me briefly \nrefer to the problem. According to Hare (1971) \n(and many other authors), two kinds of negation \nare possible: external and internal.\n""The internal negation of \'I promise \nto pay you before the end of the tax \nyear\' is \'I promise not to pay you \nbefore the end of the tax year\'.     \nThe external negation of the same \npromise is \'I do not promise to pay  \nyou before the end of the tax year\'. \nNearly all speech-acts can be negat-\ned in these two ways.""\n(p. 82)\nLyons (1977, p. 769) takes external negation \nto be the negation of the neustic. In a  state-\nment like:\n(100) I do not say that the door is open\nthere would be a negation of the subscription \nsign. But I think that not even in this  case is \nthe subscription sign being negated. What the \nperson uttering (100) is denying is that he is \nasserting such and such, but this person is \nstill subscribing to the utterance, by assert-\ning that he does not say such and such. In \nother words my impression is that one can deny \nan utterance recursively by adding elements and  \nnegating them without ever getting to deny the \nabstract element of subscription which is in-\nescapably there, whenever a sentence is utter-\ned. The neustic ""l-say-so"" is an abstract ele-', 'nalys i s, (41) would be linked to (40) as an agreement to \nsatisfy the request, or something like that.\nTrappes-Lomax woul d, I think, reply that (40) does\nnot stop having information because it is a request, and\nthat (41) is a confirmation of that information, at the \nsame time that it is the agreement to satisfy the request. \nEither of the following modifications to our situation \nwill make thi s clear:\n1. After (41), Charlie adds: ""I hadn\'t noticed; my mind \nwas completely absorbed. (Me still opens window).\n2. It is a third person, Sally, who utters (41). (Charlie \nstill opens the window).\nIt can be said that in the original situation (40)\nonly makes a certain information present, whereas in mo-\ndification I it actually provides the information. It can \nalso be said that in the original situation (41) is an \nagreement to satisfy a request, whereas in modification \n2 it is an adherence to the request (or reproach). But in \nthe three situations (41) confirms (40).\nThe problem with Trappes-Lomax1s position is that it \nis not in accordance with Widdowson\'s 1973 approach. The \ndiagram to represent different sorts of links should in-\nclude different sorts of acts:\nGoing back to our situations, (40) is used to realize \nan observation, besides the request. (4l) is also used to \nrealize an observation, in fact the same one; this obser-\nvation is realized at the same time that the agreement, or \nthe adherence, is realized. Between these two observations \nin (40) and (41) there is a relationship of confirmation. \nThis obtains besides, and independently of, the relation-\n36', ""20\nthat mean two different things; or in French\nII est capital/ *capita1ement\nwhere the adverb does not exist.\nSee also the possibility of focusing the ad-\njective but not the adverb:\n(48) E' evidente che Pietro ama Ma- \nria ?\n(49)*E' evidentemente che Pietro ama \nMaria?\nThe lack of semantic equivalence between the \nadverb and the corresponding adjective is evi-\ndent in question-answer pairs. For example:\nQ.  (50) E' naturale che Pietro ami Ma-\nria?\nA   (a) Si, e' naturale \n(b) Si, naturalmente\nIn A ( a ) the scope of the adjective is the \nclause 'che Pietro ami Maria', while in A (b) it   \nis the whole sentence.\nThe same happens with negation. If we take:\n(51) E' probabile che Pietro ami Ma-  \nria\n(52) Probabilmente Pietro ama Maria\nand deny them with\n(53) Non e1 vero \nThe negation of (51) would refer to the proba-"", 'Estudios de Lingüística Aplicada, año 39, número 72, enero de 2021, pp. 9–48\ndoi: 10.22201/enallt.01852647p.2021.72.926\n[ 30 ]  Kent Fredholm\n5.6.3. Changing spelling or punctuation\ngt can sometimes translate misspelled words without asking the \nuser to fi  rst choose the correct spelling (cf. Ducar & Schocket, \n2018), something that occurred a few times in the screen recor-\ndings. On other occasions, students changed the spelling following \na suggestion from gt (Table 6) or after having identifi  ed spelling \nmistakes by themselves.\nTABLE 6. Changing spelling. Aurora: 4\nTIME MARK GT SEARCH GT RESULT\n23’24’’\n‘terrifi  ed’ [misspelt] * ‘försckräkt’\nClicks on the GT suggestion for spelling correction.\n23’25’’\n‘terrifi  ed’\nUses the result to continue with translation of a paragraph from English to Spanish.\nChanges of spelling also included trying out the use or omission \nof accents and other diacritics. When diacritics were omitted, mis-\nplaced, or incorrectly written, this resulted in translations that were \nincomprehensible, and the omission of English genitive apostro-\nphes rendered translations with plural forms, creating somewhat \nconfusing search results.\nA few students tried adding punctuation (full stops, question \nor exclamation marks) to their searches, and this sometimes al-\ntered the translations, albeit in unclear and unsystematic ways that \nwere probably diffi  cult for the students to understand or evaluate. \nGiannetti (2016: 75) emphasized that “proper punctuation” is es-\nförsckräkt\nMenade du: förskräckt\nförsckräkt\n10 / 5000 föreslå en förändring\nförskräcktförskräckt\nförskräckt\nförskräckt\nförskräckt\nförskräckt scared\n10 / 5000 föreslå en förändring', 'Sexto grado: \n7)\nkim: es muy grosera con mi bisabuelita.\nTercer grado: \n8)\nREN: me puso una pomada. \nSexto grado: \n9)\njoe: me puso una gasa.\nEn cuanto a la clase mental, los niños de 6° son los que tuvieron una mayor produc-\nción, luego, los de 3°, y, por último, los de 1°. adesse (2021) menciona que los procesos \nse distinguen semánticamente por la actividad psíquica de una persona que puede man-\ntener o experimentar un cambio de estado o una actividad interna, ya sea perceptiva, \nsensitiva o cognitiva. Montes (2014) afirma que los verbos de percepción son procesos \npasivos porque el sujeto recibe estímulos como ver u oír.\nLas características semánticas de los verbos de la clase mental se reflejan en la sinta-\nxis, pues proyectan toda su complejidad cognitiva. Esto se puede argumentar al observar \nque los niños de 1° grado se encuentran al inicio del desarrollo evolutivo de la lengua \ny son quienes presentaron una menor producción de esta clase, con respecto a los de \n3° y 6°. El verbo espantar de las oraciones (10), (11) y (12) está en primera persona del \nsingular, tiempo pretérito y corresponde a la acepción i de las dos que contiene adesse \n(2023); sus participantes sintáctico-semánticos son experimentadores, pues la acción \nrecae en la misma persona que está narrando, a través del proclítico dativo me. \nPrimer grado: \n10)\nval: yo me espanté.\nTercer grado: \n11)\ncon: es algo muy contagioso y yo me espanté.\n60 odette hernández\nLM VI-1 \nLingüística Mexicana. Nueva Época, vi (2024), núm. 1: 47-67  \nISSN: 2448-8194', 'encontrar iii\nEncontrarse [alguien] [en un estado concreto]\nEstar o hallarse [en un estado concreto]\nEjemplo: Decía: «No, papá, sí me encuentro muy bien», y es verdad; porque yo \nlo que he comprobado. \nAnálIsIs y rEsultAdos\nEn relación con cómo los niños desarrollan la sintaxis, los psicolingüistas han in -\ntentado explorar y explicar a través del método científico tal proceso. Con respecto \na las investigaciones que giran en torno a la semántica hay una menor producción \nde estudios evolutivos, lo cual puede deberse a que se requiere adentrarse a la cog -\nnición de los niños para poder observar cómo opera el significado y cómo los niños \nsignifican su mundo: es a través de la relación entre significado y significante como \nlos niños conceptualizan y organizan objetos, estados, acciones, personas, tiempos, \nescenarios, etcétera. \nEn el caso de la sintaxis infantil, hay una mayor producción de trabajos, en gran me-\ndida porque este nivel proporciona una guía más nítida de los mecanismos que influyen \nen el desarrollo lingüístico tardío; destacan aquellos estudios en los que se involucra la \ninteracción de niveles de análisis lingüístico, debido a que “mucha de la sofisticación \noracional alcanzada en este periodo está en estrecha relación con el dominio de la \ncomplejidad semántica que subyace a estructuras sintácticas” (Barriga 2004: 45). Por \ntanto, la base de datos adesse permite describir la interacción entre el nivel sintáctico \ny semántico de los verbos en español que los niños eligen para conformar sus discursos \ncon un sentido completo. \nUna situación esperada era que, en cada clase, los niños de 6° encabezaran los resul-\ntados, seguidos de los de 3° y 1°. Esto no ocurrió, debido a factores propios de la rees-\ntructuración del sistema lingüístico que relaciona aspectos lingüísticos, socioculturales \ny cognitivos. Sin embargo, se observa la evolución en el aumento consecutivo de tipos \nverbales de primero a sexto grado, con sus respectivas diferencias individuales (Rojas \ny Oropeza 2018) de índole discursiva entre niños del mismo grado. Lo anterior es rele -\nvante debido a que los niños cuentan con distintas habilidades narrativas propiciadas \npor su entorno familiar y el nivel de instrucción de sus padres o cuidadores, entre otros \nfactores. \nEn la gráfica 1\n13, se encuentran los resultados del cálculo de frecuencia relativa de \nlos niños de 1°, 3° y 6°. Se observa que en los tres grados hay una concentración en la \nclase material, seguida de las clases relacional, mental, existencial, comunicación, y, \nfinalmente, modulación. \n13\u2009Se elaboraron todas las gráficas con base en las tablas de frecuencia relativa.\n54 odette hernández\nLM VI-1 \nLingüística Mexicana. Nueva Época, vi (2024), núm. 1: 47-67  \nISSN: 2448-8194']","The reference to Eme, Lacroix & Almecija in the text provides insights into the syntactic and semantic development of children's language skills. Specifically, it highlights the importance of exploring and explaining this process through scientific methods. The mention of their work suggests a focus on the cognitive aspects of children's language development, observing how meaning operates and how children conceptualize and organize their world through the relationship between meaning and form. This reference underscores the significance of understanding how children attribute meaning to objects, actions, people, and other linguistic elements, shedding light on the intricate interplay between syntax and semantics in children's language acquisition."
Who presented the analysis of different aspects in the design of a course of redaction in English?,"['Natalia Ignatieva sentido el número 28 es bastante representativo, ya que las demás colaboraciones están escritas por profesores de nuestro Centro. La primera de éstas, «Diseño, procesos y perspectivas de un curso de redacción en inglés» de Alice Bracho y Alice Emery presenta el análisis de diferentes aspectos, tanto teóricos como metodológicos, en el diseño de un curso de redacción en inglés. Las autoras comparten con los lectores sus experiencias al diseñar el curso e impartir\xad lo durante tres años, reflexionan sobre su estado actual y su futuro. Creemos que estas experiencias serán de mucha utilidad para los maestros de inglés, asimismo como para diseñadores de cursos y público en general. Las contribuciones restantes están todas relacionadas de una manera u otra con los aspectos socioculturales en la enseñanza de lenguas. Así, en el trabajo «E.U.A. en el imaginario de estudiantes mexicanos» de María Eugenia Gómez de Mas surge como tema principal la actitud de los alumnos del CELE hacia los Estados Unidos, resultado colateral de la aplicación de un cuestionario sobre el Tratado de Libre Co\xad mercio a los alumnos de francés y, posteriormente a los de alemán e inglés. El tema en sí no parece ser nuevo, pero lo inesperado en este caso fue el hecho de que las preguntas del cuestionario fueron sobre Cañada... y esto permitirá a nuestros lectores ver el problema viejo en un contexto diferente. Los artículos que siguen constituyen ponencias presentadas en el II Coloquio de Lingüística que tuvo lugar en la Escuela Nacional de Antropología e Historia los días 24-26 de abril de 1998. Entre ellos está el trabajo «Investigaciones sobre el papel de percepciones so\xad cioculturales y lingüísticas en la enseñanza de idiomas» de Phyllis Ryan cuyo tema de alguna forma está conectado con el de la colaboración anterior, de María Eugenia Gómez. La estudiosa nos pone al tanto de los proyectos de investigación intercultural llevados a cabo en el Departamento de Lingüística Aplicada cuyos resultados le per\xad miten afirmar que las actitudes negativas, principalmente hacia la cultura norteameri\xad cana, crean barreras en el camino de aprendizaje de lenguas extranjeras, en particular, de inglés. A su vez, Monique Vercamer en el artículo denominado «Reflexiones y pro\xad puestas acerca de las relaciones de significación entre cultura y lenguaje» critica las gramáticas estructuralistas y gramáticas pedagógicas basadas en éstas e intenta propo\xad ner lo que llama «una gramática nocional» usando elementos semióticos. Aline Signoret en el trabajo «El modelo de la aculturación y el desarrollo del interlenguaje de una lengua extranjera» expone las bases teóricas de las propuestas que tratan de explicar la desigualdad en el desempeño lingüístico de los alumnos de idiomas. La investigadora toma el modelo de aculturación como marco de referencia y lo aplica con los alumnos principiantes de francés, lo cual le permite explicar el carácter desigual en el desarrollo del interlenguaje de los estudiantes. Finalmente, Roland Terborg en su contribución con el título «El ritual en el mantenimiento de lenguas indígenas» escribe sobre el uso simbólico de las lenguas. El autor distingue entre el uso creativo y el uso ritual del lenguaje y asocia éste último']",The analysis of different aspects in the design of a course of redaction in English was presented by Alice Bracho and Alice Emery.,single_hop_specifc_query_synthesizer,"['Tabla 4. Entonces y sus variantes por generación en informantes hombres\nTabla 5. Entonces y sus variantes por generación en informantes mujeres\nGeneración. Para ambos sexos, la 1ª generación, la de los más jóvenes, es la que presen-\nta mayor variación, porcentajes más bajos de la forma plena y porcentajes más altos de \nlas formas reducidas (tablas 4 y 5). Llaman especialmente la atención los datos de los \nhombres para entonces (27.8%), entons (34.4%) y tons (24.6%), pues en el caso de las \nmujeres el uso de la forma plena es más alto que el de los hombres (40%), pero también \nes el más bajo de las tres generaciones de mujeres. Esto indica que, para fines de los años \n60 e inicios de los 70, la generación de los más jóvenes, especialmente los hombres, de \n25 a 35 años, iba a la cabeza en el uso de las formas reducidas del marcador entonces, \nseguida por una segunda y tercera generaciones bastante más estables. Sería interesante \ncontrastar estos resultados con lo sucedido en periodos posteriores y con lo que tenemos \nen la actualidad.\n1ª generación 2ª generación 3ª generación Total\nentonces 17\n(27.8%)\n21\n(66.5%)\n27 \n(56%)\n65\n(46%)\ntonces 7\n(11.5%)\n3\n(9.4%)\n8\n(6.5%)\n18\n(3%)\nentons 15\n(24.6%)\n5\n(15.6%)\n7\n(15%)\n33\n(24%)\ntons 15\n(24.6%)\n3\n(9.4%)\n6\n(12.5%)\n24\n(17%)\nTotal 60 32 48 140\n1ª generación 2ª generación 3ª generación Total\nentonces 39\n(40%)\n27\n(73%)\n27 \n(75%)\n93\n(54%)\ntonces 17\n(17%)\n1\n(2.5%) 0 18\n(11%)\nentons 21\n(21%)\n7\n(19%)\n6\n(17%)\n34\n(20%)\ntons 21\n(21%)\n2\n(5%)\n3\n(8%)\n26\n(15%)\nTotal 98 37 36 171\n38 mAríA ÁngeLes soLer ArechALde\nLM II-1\nLingüística Mexicana. Nueva Época, II (2020), núm. 1: 31-44  \nISSN: 2448-8194', 'La cuarta pregunta de este módulo en el instrumento original es la siguiente: ¿Cuán-\ntos años ha pasado en un país/región donde se habla español(inglés)? Nuevamente, para la \nversión adaptada no fue necesario hacer la distinción entre español escrito y español \noral, ya que la naturaleza de la pregunta asume el uso de ambas modalidades. Se hizo \nuna sutil modificación: el uso del símbolo diagonal (/), fue sustituido por la conjunción \no en la versión para la población Sorda señante.\nEn el blp español-inglés, la quinta y la sexta pregunta se refieren a la cantidad de \naños que el bilingüe ha hablado en cada una de sus lenguas con su familia y en el tra -\nbajo. Para la versión lsm-español escrito/oral, fue necesario agregar el grupo social de \namigos (grupos deportivos, iglesia), debido a que se sabe de la importancia que tienen \ntodos los contextos sociales para el desarrollo de las habilidades lingüísticas del Sordo \nseñante. Además, se agregó la pregunta que ahonda en las lenguas que el Sordo usa en \ncada grupo social: familia, trabajo, amigos con las opciones lsm, español oral, español \nescrito, mímica, otra.\nFinalmente, las preguntas de este módulo en la versión español-inglés se responden \npor medio de un menú desplegable. Como todas las respuestas se solicitan en cantidad \nde años, dicho menú comprende desde 0 hasta 20+. Para ser más precisos y evitar \nconfusiones, en la versión lsm-español escrito/oral, se cambió la opción 0 por no sé lsm \n(español escrito; español oral) o mi familia/amigos no usan lsm (español escrito; español \noral). Además, se agregó la palabra año(s) tras cada dígito; 1 año, 2 años, 3 años, etc. \nEstos cambios no afectaron la forma de calificar los ítems propuesta por el instrumento \noriginal, ya que se mantuvo la escala inicial, que comprende de 0 a 20 puntos. En la ta-\nbla 2 se pueden observar la comparación de los formatos del Módulo i y la información \nbiográfica del blp en su versión español-inglés y la adaptación a lsm-español escrito/\noral (cdls).\nMódulo ii: Uso de lenguas. El Módulo ii del cdls comprende información sobre el \nuso de lenguas del bilingüe. En la versión español-inglés del instrumento se cuenta con \ncinco preguntas para cada lengua del hablante. En las primeras tres preguntas se busca \nobtener información sobre la cantidad de tiempo que el bilingüe utiliza inglés, español \ny otras lenguas en distintos contextos. La pregunta es la siguiente: En una semana nor-\nmal, ¿qué porcentaje del tiempo usa las siguientes lenguas con sus amigos/familia/escuela \no trabajo? El total, sumando las respuestas del uso de español, inglés y otras lenguas, \ndebe llegar al 100%. Para responder, se despliega un menú de opciones que van de 0% \na 100%. Al considerarse como preguntas difíciles de conceptualizar, especialmente para \nuna población con bajo nivel de lectura, y, con el objetivo de facilitar su comprensión, \nlos ítems fueron cambiados a la siguiente pregunta: En un día, ¿cuántas horas usas lsm \n(español escrito; español oral) con tus amigos/familia/escuela y trabajo? Fue necesario ha -\ncer una modificación en el menú de respuestas y, en lugar de tener las opciones de 0% \na 100%, se despliegan las opciones 0, 1-2 horas, 3-4 horas, 5-6 horas, más de 6 horas. En \neste caso, la opción 0 correspondería a 0%; 1-2 horas correspondería a 25% de la escala \noriginal; 2-4 horas, a 50%; 5-6 horas, a 75%, y más de 6 horas, a 100%.\nLa cuarta pregunta de la versión español-inglés es la siguiente: Cuando se habla a \nusted mismo, ¿con qué frecuencia se habla a sí mismo en las siguientes lenguas? El total, \n20 elizabeth Mendoza, donna Jackson-Maldonado y Gloria avecilla-raMÍrez\nLM VI-1 \nLingüística Mexicana. Nueva Época, vi (2024), núm. 1: 7-31  \nISSN: 2448-8194', 'EntoncEs, toncEs, Entons y tons en eL hAbLA cuLTA\nTabla 3. Frecuencia de uso de las variantes en informantes mujeres\nPasemos ahora a la revisión de los factores posiblemente implicados en la variación. \nEmpezaremos por los factores extralingüísticos, en este caso, sexo y edad.\nFactores extralingüísticos\nSexo. Como lo hemos podido constatar en las tablas 2 y 3, el corpus arroja más ejemplos \nde mujeres (171) que de hombres (140). En las tablas 4 y 5, en la última columna a la \nderecha de cada una de las tablas, observamos que son ellas las que muestran un mayor \nmantenimiento de la forma plena con un 54%, frente al 46% de los hombres. Por su par-\nte, los porcentajes de las formas reducidas son un poco más bajos en las mujeres (11%, \n20% y 15%) que en los hombres (13%, 24% y 17%). \nEstos ocho puntos porcentuales sumados de diferencia entre hombres y mujeres para \nla forma plena podrían deberse a que hay conciencia de una cierta estigmatización de \nlas formas reducidas y por ello las usan menos las mujeres, pues, en opinión de diversos \nautores, son lingüísticamente más conservadoras, o bien tienden a usar más las formas \nestándar, prestigiosas, y a evitar usos estigmatizados ( vid. Silva-Corvalán 1989: 69-75; \nLastra 1992: 307; Chambers y Trudgill 1994: 132-136; Trudgil 2000: 68-80). Sin embar-\ngo, a pesar de las diferentes frecuencias, hombres y mujeres siguen el mismo patrón, con \nla forma plena entonces a la cabeza, seguida de entons y tons, con pérdida de la vocal /e/ \nentre sibilantes y, finalmente, de tonces.\n1ª generación 2ª generación 3ª generación\n1I 3I 6I 4X 10I 10X 5I 5X 7X\nentonces 15 (28%) 7 \n(87.5%)\n17 \n(47%)\n10 \n(77%)\n8\n(89%)\n9\n(60%)\n25\n(89%) 0 27 \n(28.5%)\ntonces 3\n(5.5%) 0 14 (39%) 1\n(8%) 0 0 0 0 0\nentons 17 \n(31.5%)\n1 \n(12.5%)\n3\n(8%) 0 1 \n(11%)\n6\n(40%)\n3\n(11%) 0 3\n(43%)\ntons 19 (35%) 0 2\n(6%)\n2 \n(15.3%) 0 0 0 1\n(100%)\n2 \n(28.5%)\nTotales  \ninformante 54 8 36 13 9 15 28 1 7\nTotal 171\n37\nLM II-1\nLingüística Mexicana. Nueva Época, II (2020), núm. 1: 31-44\nISSN: 2448-8194', 'Estudios de Lingüística Aplicada, año 43, número 80, enero de 2025, pp. 7–48\ndoi:10.22201/enallt.01852647p.2025.80.1097\n[ 18 ] Eguzki Urteaga\na lo largo de los últimos años que dan cuenta de una glotofobia \npalpable hacia las lenguas minoritarias.\n3.2.  Las modalidades de designación de los jueces y magistrados\nAsimismo, la actitud de los jueces y magistrados está ligada a \nlas modalidades de designación de los miembros de los principa-\nles estamentos judiciales. Dichas modalidades están fi  jadas por \nel artículo 66.2 de la Constitución de 1978 y por la Ley Orgánica \n6/1985 del Poder Judicial. En efecto, a partir de entonces, los jue-\nces del Tribunal Constitucional y del Consejo General del Poder \nJudicial son designados por el Parlamento, que reúne el Congre-\nso de los Diputados y el Senado, lo que repercute en la politización \ndel poder judicial.\nAsí, el artículo 66.2 de la Constitución española estipula que \n“las Cortes Generales ejercen la potestad legislativa del Estado, \naprueban los presupuestos, controlan la acción del Gobierno y tie-\nnen las demás competencias que les atribuye la Constitución” (Bo-\nletín Ofi  cial del Estado, boe, 1978). Es precisamente en nombre \nde estas últimas que el Parlamento interviene en el nombramiento \ny la designación de los miembros de las altas instancias del Esta-\ndo y de los organismos públicos de la administración, gracias a la \nlegitimidad que confi  ere a sus miembros su elección al sufragio \nuniversal directo.\nEl Parlamento interviene de diferentes maneras: designando \nla totalidad o parte de los miembros; o pronunciándose sobre la \nidoneidad y la ausencia de confl  ictos de intereses de ciertos candi-\ndatos cuya propuesta corresponde a otros órganos:\n• En lo que se refi  ere al Tribunal Constitucional, encargado de \nvelar por el respeto de la Constitución y que está compuesto \npor doce miembros, cuatro están designados por el Congreso \nde los Diputados, cuatro por el Senado, dos por el Gobier-\nno central y otros dos por el Consejo General del Poder Judi-\ncial. Están nombrados para un periodo de nueve años y, cada', 'Estudios de Lingüística Aplicada, año 43, número 80, enero de 2025, pp. 7–48\ndoi:10.22201/enallt.01852647p.2025.80.1097\nSistema judicial y lengua vasca en España: una glotofobia persistente [ 39 ]\n5.3.  Las sentencias del Tribunal Constitucional español\nLa mayoría de las sentencias de la Sala de lo Contencioso-Admi-\nnistrativo del tsjn y del tsjpv ha sido ratifi  cada por el Tribunal \nConstitucional, a imagen de aquella que concierne al artículo 6.2 \nde la Ley 2/2016 relativa a las Instituciones Locales de Euskadi. \nDe hecho, el 3 de agosto de 2023, dicho Tribunal se pronuncia \nsobre varias disposiciones del artículo mencionado en nombre de \nposibles vulneraciones de los artículos 3, 9.3, 14 y 23 de la Cons-\ntitución. Tras recordar los antecedentes, indica los fundamentos ju-\nrídicos de su decisión, haciendo referencia a las sentencias previas \ndel Tribunal Constitucional sobre ese mismo tema.\nAl tiempo que indica que la carta magna reconoce la realidad \nplurilingüe de España y asigna a las instituciones la responsabili-\ndad de proteger y respetar las lenguas coofi  ciales, el Tribunal re-\ncuerda que “no es conforme con la Constitución otorgar normati-\nvamente preferencia en el uso, por parte de los poderes públicos, a \nuna lengua ofi  cial con relación a otras que también lo son, esto es, \nestablecer normativamente un trato prioritario en favor de alguna \nde las lenguas coofi  ciales” (boe, 2023: 115344).\xa0En ese sentido, la \nafi  rmación del uso preferente por los poderes públicos de una de \nlas dos lenguas coofi  ciales contradice una de las características que \nla ofi  cialidad lingüística ha defi  nido constitucionalmente, a saber, \nque dichas lenguas constituyen un medio habitual de comunica-\nción en y entre las administraciones públicas y en su relación con \nlos actores privados, con plena validez y efectos jurídicos (boe, \n2023: 115344).\nAplicando la doctrina del Tribunal Constitucional a la Ley \n2/2016 relativa a las Instituciones Locales de Euskadi, considera \nque el apartado segundo del artículo 6 “quiebra el equilibrio lin-\ngüístico entre las dos lenguas coofi  ciales al condicionarse el uso \ndel castellano al desconocimiento del euskera, de modo que los \nderechos de libre opción en materia lingüística de quien represen-\nta a los ciudadanos en las entidades locales se restringen de forma \ninjustifi  cada” (boe, 2023: 115345). Por ende, estima que es consti-', 'Estudios de Lingüística Aplicada, año 43, número 80, enero de 2025, pp. 153–160\nSusana Cuevas Suárez (Coord.). El cuerpo en la lengua. \nExpresiones no literales en el español de México. México: \nSecretaría de Cultura, inah, 2023. 276 pp.\nMaría del Refugio Pérez Paredes\nDepartamento de Filosofía, \nDivisión de Ciencias Sociales y Humanidades, \nUniversidad Autónoma Metropolitana\nEl cuerpo en la lengua. Expresiones no literales en el español \nde México, coordinado y editado por Susana Cuevas Suárez, reú-\nne trabajos de los integrantes del Seminario Interinstitucional de \nAntropología Lingüística que la propia Susana coordina. Los es-\ntudios retoman la metodología que emplearon en trabajos previos \npara el análisis de este dominio conceptual en lenguas mexicanas; \nla perspectiva teórica adoptada en ellos es la lingüística cognitiva, \nen particular, la teoría de la corporeidad o embodiment, y los da-\ntos analizados se obtuvieron del Corpus Coloquial de la Ciudad de \nMéxico, Preseea, México, el Corpus Sociolingüístico de la Ciudad \nde México, redes sociales, entre otros. Los vocablos analizados \nfueron siete: cabeza, pie, mano, ojo, boca, oreja y nariz, seleccio-\nnados a partir de su frecuencia de uso en las lenguas en general. \nEl objetivo del libro es mostrar cómo una misma metodología y un \nmismo enfoque teórico permiten dar cuenta de fenómenos semán-\nticos como la proyección semántica, la metáfora y la metonimia en \notra lengua, en este caso, el español, además de otros fenómenos \ncomplejos, como el blending, que implica la integración de más \nde uno de estos procesos.\nEl libro se organiza en siete capítulos, a saber: 1. “Cada cabe-\nza es un mundo”, de Susana Cuevas Suárez; 2. “Al pie del cañón”, \nde Francisco J. Peral Rabasa; 3. “Bajita la mano”, de Tania María \nCampaña Rojas; 4. “A ojo de buen cubero”, de Heriberto Sierra \nGómez Pedroso; 5. “A pedir de boca”, de Aileen Martínez Ortega; \n6. “Parar oreja”, de Juan Ramón Duarte García y Susana Cuevas', 'análisis acúsTico y descriPción de Procesos fonológicos\nvocalEs\nEl lacandón de Lacanjá tiene un sistema vocálico de seis timbres. En cuanto al grado \nde altura distingue dos vocales altas, tres medias y una baja, y, en cuanto al grado de \nposterioridad, se distinguen tres series: vocales anteriores, centrales y posteriores, como \nse muestra en la tabla 3.\nTabla 3. Timbres vocálicos\n          Anteriores         Centrales        Posteriores\nAltas    i    u\nMedias    e   ə   o\nBaja      a\nPara la correspondiente caracterización fonológica es necesario mencionar que las \nvocales posteriores son redondeadas. Así, podemos caracterizar los timbres vocálicos del \nlacandón en una matriz de rasgos que combine articuladores y rasgos distintivos, como \nse muestra en la tabla 4.\nTabla 4. Timbres vocálicos y rasgos\n    i u e o ə a\nLabial    − + − + − −\nCoronal    + − + − − −\nDorsal    − + − + − −\nAlto    + + − − − −\nBajo    − − − − − +\nEl sistema vocálico también muestra un contraste de longitud, así como un contraste \nentre vocales modales y vocales con el rasgo [+glotis constreñida]. Como se observa \nen los datos de (7) y (8), la distinción entre longitud y tipo de fonación se encuentra en \ntodos los timbres vocálicos, excepto por la vocal central media. En (7) puede apreciarse \nel contraste de longitud, mientras en (8) se muestra el contraste de voz modal contra \nvoz laringizada.\n(7)\n Contraste de longitud entre vocales breves y largas\n a. /tʃitʃ/  ‘duro’   d. /ɓeh/  ‘camino’\n/tʃiːtʃ/  ‘abuela materna’  /keːh/  ‘venado’\n b. /kʼah/  ‘amargo  e. /Ɂukʼ/  ‘piojo’\n/kaːh/  ‘pueblo’   /ɾuːkʼ/  ‘lodo’\n c. /soʔ/  ‘pavo’\n/soːɾ/  ‘cáscara’\n159\nLM IV-2\nLingüística Mexicana. Nueva Época, IV (2022), núm. 2: 153-178\nISSN: 2448-8194', 'Tabla 7. Evaluación de los candidatos para el input /jap/ ‘chayote’\nPor último, en la tabla 8, se evalúan los tipos silábicos cerrados por una consonante \nresonante. Los tipos silábicos cvcf y cvr manifiestan un comportamiento análogo en \ncuanto satisfacen la restricción de marcación WbyP y, de manera vacua, la *As-m Cl. Se \nexpresa también, desde una perspectiva formal, que la condición menos marcada para \nlas codas en la lengua es asociarse a una mora en la grada temporal y que la estructura \nmarcada para esta condición la representan las codas incapaces de asociarse a la grada \ntemporal. \nTabla 8. Evaluación de los candidatos para el input /ben/ ‘lodo’\nCon base en la representación formal del acento, por un lado, y de la asignación de \npeso, por el otro, continúo con el análisis formal del anclaje del rasgo [gc] en la lengua. \nLa legitimación de dicho rasgo está, en principio, regida por dos restricciones: la primera \nexige que que el input tenga un correspondiente en el output, y la segunda vela por que \nel rasgo [GC] se alinee con la mora derecha (15). Esta restricción está inspirada en la res-\ntricción que legitima el rasgo glotis constreñida en el quechua de Cuzco (Parker 1997).\n(15)\na. Max-[GC]: todo rasgo [gc] en el input debe de tener un correspondiente en el \noutput.\nb. AlD-[GC]: el rasgo [gc] debe de alinearse con la mora derecha.\nEn sílabas del tipo cv la manifestación del rasgo [gc] sobre la segunda mora se sigue \nde la jerarquía FT-BIN, MAX-[gc], AlD[gc] >> DEP-μ. En la tabla 9, el candidato óptimo \n/jaμp/ Ft-Bin *As-μ Cl WbyP Dep-μ\na. ☞ jaμpμ *\nb. jaμp *! *\nc. jaμμp *!\nd. jaμμpμ **!\n/beμn/ Ft-Bin *As-μ Cl WbyP Dep-μ\na. ☞ beμnμ *\nb. beμn *! *\nc. beμμn *!\nd. beμμnμ **!\n166 maRio ulises heRnández luna\nLM III-1 \nLingüística Mexicana. Nueva Época, III (2021), núm. 1: 151-171  \nISSN: 2448-8194']","The analysis of different aspects in the design of a course of redaction in English was presented by Susana Cuevas Suárez in the book ""El cuerpo en la lengua. Expresiones no literales en el español de México."""
What are the challenges faced by researchers in the field of translation studies in Jalisco?,"['eStudioS de trAducción en méxico. PerSPectivA lingüÍSticA SoBre PAnorAmAS de inveStigAción ejemplo, hay una predilección por los estudios de traducción en la Nueva España. Una muestra de ello es el libro Contactos lingüísticos y culturales en la época novohispana. Pers- pectivas multidisciplinarias, que editaron María del Pilar Máynez, Salvador Reyes y Frida Villavicencio (2014), en el cual recogieron diversos estudios sobre la traducción de tex- tos sagrados y la censura de las traducciones en este periodo. horizontes de Los estudios de traducción en México: tareas pendientes A partir del recuento de las tendencias temáticas antes señaladas, es posible pensar en las posibilidades a futuro de esta disciplina, ya que los estudios de traducción en la academia mexicana siguen en proceso de construcción y cuentan con un camino amplio y prometedor por recorrer. No obstante, como en cualquier campo novedoso, hay un sinnúmero de desafíos que enfrentar y muchas tareas por hacer. En su “ Semblanza de los estudios de traducción en México”, Patricia Velázquez Mar- tínez detalló que, por medio de “un consenso que se llevó a cabo entre la comunidad de la Universidad de Guadalajara en el año 2006” (2008), se determinaron tres áreas en “el campo de la traducción [que] necesitan atención en Jalisco”: la primera se refiere a sa- tisfacer la demanda del mercado; la segunda, a realizar investigación, puesto que señala que “el trabajo de investigación en traducción es escaso no sólo en Jalisco sino en todo México”, y sugiere investigar sobre la “alfabetización de grupos minoritarios que hablan lenguas indígenas”. En esta área también apunta que los investigadores necesitan lo que llama “movilidad académica”, que entiende como “obtener el servicio de traducción para Artículos, Ponencias y/o Conferencias, Reportes de Investigación, Intercambios académicos, etc.”, y, por último, señala que es indispensable investigar acerca de la práctica profesional de traductores en áreas tecnológicas o comerciales; finalmente, la tercera sería “formar traductores a nivel universitario”. Si bien todas las áreas de opor- tunidad señaladas por Velázquez Martínez siguen siendo vigentes y de difícil resolución a mediano plazo, me centraré en la segunda, respecto a la investigación, puesto que es la que corresponde a los estudios de traducción propiamente dichos. Una de las tareas ingentes de este campo tiene que ver con el establecimiento de un metalenguaje disciplinario en español. La terminología es fundamental en los estudios de traducción, ya que se necesitan términos comunes entre el gremio para designar y significar (Lara 2015, 31-32) los múltiples procesos de la práctica traductora. La sub- competencia terminológica es determinante en la formación del traductor. Teresa Cabré señala que “es absolutamente imprescindible que el traductor especializado tenga for - mación en terminología para llevar a cabo de manera óptima su actividad profesional, proponiendo un esquema flexible de implicación del traductor en terminología, que dé cuenta de los diferentes grados de compromiso que éste puede adoptar en su formación terminológica” (2010, 257). Contar con una terminología compartida por los profesio - nales de la traducción es indispensable para establecer unidades terminológicas básicas y urgentes que consideren todos sus componentes (cognitivo, lingüístico, sociofuncional 15 LM V-2']","In the field of translation studies in Jalisco, researchers face challenges such as meeting market demands, conducting research, especially due to the scarcity of translation research not only in Jalisco but throughout Mexico, investigating the literacy of minority groups speaking indigenous languages, requiring academic mobility for translation services, exploring the professional practice of translators in technological or commercial areas, and the need to educate translators at the university level.",single_hop_specifc_query_synthesizer,"['Can foreign language learners discover \nthe rules of non-salient forms?\n¿Pueden los aprendices de una lengua \nextranjera descubrir las reglas de formas \nlingüísticas no sobresalientes?\nRecepción: 13 de abril del 2023\nAceptación: 22 de junio del 2023\ndoi: 10.22201/enallt.01852647p.2023.77.1059\nJosé Luis Moreno-Vega\nUniversidad de Sonora, Departamento \nde Lenguas Extranjeras, \nLicenciatura en Enseñanza del Inglés \njoseluis.moreno@unison.mx\nAna Mónica Preciado-Sánchez\nUniversidad de Sonora, Departamento \nde Lenguas Extranjeras, \nLicenciatura en Enseñanza del Inglés \nana.preciado@unison.mx', 'Sujeto morfológico  (Estar + gerundio ) Presente progresivo\nTotal de verbos (estar + gerundio presente) producidos + requeridos \n1ª sg. 2ª sg. 3ª sg. 1ª pl. 2ª pl. 3ª pl.\nSuj.morf\nV+flex\nSingular\nAciertos\nii\nReglas defectivas Productividad\nSuj.morf\nV+flex\nPlural\nAciertos\nii\nReglas defectivas Productividad\nOmisiones Comisiones\n%\nAciertos\nii\nOmisiones Comisiones %\nAciertos\nii\nSin verbo V. Infiniti-\nvo(-flex)\n Flexiones\n inadecuadas Sin verbo V. Infinitivo(-flex)  Flexiones \ninadecuadas\nAux. Gdo. Aux. Gdo. Aux. Gdo. Aux. Gdo.\n1ª sg.\n(yo)\nEstoy\ncant-ando\ncom-iendo\nviv-iendo\n1ª pl.\n(nosotros/as)\nEstamos\ncant-ando\ncom-iendo\nviv-iendo\n% % % %\n% % % (-)precisión \nléxica\n% % % (-)precisión \nléxica\n% %\n2ª sg.\n(tú)\nEstás\ncant-ando\ncom-iendo\nviv-iendo\n2ª pl.\n(ustedes)\nEstán\ncant-ando\ncom-iendo\nviv-iendo\n% %\n% % % (-)precisión \nléxica\n% % % (-)precisión \nléxica\n%%\n3ª sg.\n(él/ella)\nEstá\ncant-ando\ncom-iendo\nviv-iendo\n3ª pl.\n(ellos/as)\nEstán\ncant-ando\ncom-iendo\nviv-iendo\n% %\n% % % (-)precisión \nléxica\n% % % (-)precisión \nléxica\n%%\n22\nLM III-1 Jalina RamíRez GRycuk\nLingüística Mexicana. Nueva Época, III (2021), núm. 1: 7-33  \nISSN: 2448-8194', 'Estudios de Lingüística Aplicada, año 37, número 70, diciembre de 2019, pp. 9–36\ndoi: 10.22201/enallt.01852647p.2019.70.869\n[ 34 ]  Ittay Gil Carrillo\nNEELY, JaMEs (1991).  Semantic priming effects in visual word recognition: A \nselective review of current fi  ndings and theories. En Derek Besner \n& Glyn W. Humphreys (Eds.), Basic processes in reading: Visual \nword recognition (pp. 264–336). Hillsdale: Erlbaum.\npapaFRaGOU, aNNa, & MUsOLINO, JULIEN (2003).  Scalar implicatures: Experiments at the \nsemantics-pragmatics interface. Cognition, 86(3), 253–282.\npEREa, MaNUEL, & R Osa, Eva (2002).  Does the proportion of associatively related \npairs modulate the associative priming effect at very brief stimu-\nlus-onset asynchronies? Acta Psychologica, 110(1), 103–124.\nspERBER, DaN, & WILsON, DEIRDRE (1995).  Relevance: Communication and cognition. \nOxford: Blackwell.\nvaN TIEL, BOB; vaN MILTENBURG, EMIEL; ZEvaKHINa, NaTaLIa, & G EURTs, BaRT (2016).  Scalar diversity. \nJournal of Semantics, 33(1), 137–175.\nvILLasEÑOR, GaLa KaRINa (2017).  Interpretación de términos numéricos: un estudio \nempírico. Estudios de Lingüística Aplicada, 35(66), 135–172.\nZEvaKHINa, NaTaLIa (2012). Strength and similarity of scalar alternatives. En Ana \nAguilar Guevara, Anna Chernilovskaya & Rick Nouwen (Eds.), Pro-\nceedings of Sinn und Bedeutung 16 (V ol. 2, pp. 647–658). Utrecht: \nmit Working Papers in Linguistics.', 'Procesamiento de discurso: relaciones semánticas, expectativas del lector y modelos mentales 29\nEstudios de Lingüística Aplicada, año 37, número 69, julio de 2019, pp. 9–35\ndoi: 10.22201/enallt.01852647p.2019.69.828\nmomento de afirmación de expectativa causal, en muchas ocasiones re-\nlacionado con la justificación o explicación del quiebre causal anterior \nque reconstruya la expectativa causal global del lector.\nFinalmente, no queremos dejar de observar el patrón de presencia / ausencia  \nde marca semántica explícita en general, pero, sobre todo, en función de la re-\nlación semántica particular. El efecto principal hallado para la variable pre -\nsencia / ausencia de partícula conectiva muestra que los sujetos prefieren \nintroducir una marca semántica explícita cuando construyen relaciones semán -\nticas en virtud de producir un discurso globalmente coherente. Sin embargo, su \ninteracción significativa con el factor relación semántica también muestra \nque esa tendencia varía en función de qué tipo de relación semántica se cons -\ntruya. Nuestros datos confirman la hipótesis de continuidad de Murray (1997) \nen términos de que las relaciones aditivas, paradigmáticamente continuas, son \nlas únicas que pueden carecer de marca explícita sin impedir u obstaculizar la \nconstrucción de un modelo mental y propiciar un discurso semánticamente con-\nsistente. Esto es: si la estrategia por defecto es la expectativa de continuidad, \nmientras no exista un quiebre en esa expectativa, la instrucción semántica ex -\nplícita no resulta determinante. Las consecutivas, por su parte, también conside-\nradas continuas, muestran, asimismo, una posibilidad relativamente consistente \nde prescindir de marca semántica explícita; sin embargo, esta posibilidad dis -\nminuye con las causales propiamente dichas y se restringe aún más con las con-\ntracausales —tanto adversativas como concesivas, como caso extremo que no \npodría construirse sin marca semántica explícita. Vale mencionar que aquí pare-\nce darse una articulación entre la expectativa de continuidad y la de causalidad \n—similar a la descripta en Zunino (2014) y Zunino (2016a) para el proceso de \ncomprensión— y que en ese cruce se determina un continuum respecto del rol y \nefecto de la partícula conectiva: las causales continuas, con entonces, serían las \nque pueden prescindir de marca explícita con mayor facilidad y en orden cre -\nciente de dificultad y necesidad —a propósito del quiebre de sucesivas expecta-\ntivas semánticas del lector— se ubicarían la causales discontinuas, con porque, \ny, por último, las contracausales, con pero y con aunque. En este sentido, halla-\nmos aquí otro punto en común entre procesos de comprensión y producción de \ndiscurso.', 'Estudios de Lingüística Aplicada, año 35, número 65, julio de 2017, pp. 11–36\nModelos temporales aplicados a la enseñanza del pretérito y copretérito 23\ndoi: 10.22201/enallt.01852647p.2017.65.725\nCuadro 3. Categorización del pretérito y el copretérito a partir del input proporcionado a los aprendientes de español L2 en \nla muestra analizada: cifras absolutas  \nNivel 2 Nivel 3 Nivel 4\nPre Co Pre Co Pre Co\nAspecto gramatical (1)\n[+ puntual] 5 0 10 0 20 0\n[+ durativo] 0 0 0 2 0 2\nAspecto gramatical (2)\n[+ perfectivo] 7 0 7 0 21 0\n[+ ingresivo] 0 0 0 0 10 0\n[+ terminativo] 7 0 7 0 18 0\n[+ imperfectivo] 0 1 0 12 0 20\n[+ progresivo] 0 0 0 1 0 2\n[+ habitual] 0 1 0 2 0 7\n[+ continuo] 0 0 0 9 0 17\nPerspectiva discursiva\nPrimer plano 0 0 0 0 22 0\nSecuencia de acciones 0 0 0 0 22 0\nCambio de estados 0 0 0 0 0 0\nSegundo plano 0 2 0 6 0 23\nHábitos 0 1 0 2 0 7\nDescripciones 0 1 0 4 0 16\nTemporalidad verbal\nO–V 0 0 0 0 0 0\n(O–V)oV 0 0 0 2 0 9\nTotal de pretéritos y copretéritos 7 2 17 18 55 44\nNota: Pre: pretérito, Co: copretérito, O–V: anterioridad al momento de la enunciación, (O–V)oV: simultaneidad respecto a un momento anterior \na la enunciación.', 'evento con “constitución interna”?, o ¿cuáles son los indicios para saber si una determi-\nnada forma tiene o no una “perspectiva interna”?  \nEste hecho es precisamente discutido por Klein (1994), quien recupera la teoría tri -\npartita de Reichenbach (1947), cuando establece tres intervalos temporales: tiempo tópico \n(tt), tiempo de la situación (tsit), y tiempo de la expresión (tu)2. Al permitir que estos tres \nelementos sean intervalos —y no puntos como en Reichenbach (1947)—, se admite la po-\nsibilidad de que entre ellos haya relaciones internas y externas de inclusión o exclusión, y \nestas relaciones, que vemos en la tabla 1, permiten expresar formalmente (y no tan meta-\nfóricamente) las definiciones de aspecto de Comrie (1976). De modo tal que el aspecto es \nconsiderado por Klein (1994: 99) esencialmente como la relación o relaciones que pueden \nsurgir entre el tt y el tsit: tt puede preceder a tsit (before), puede seguirlo (after), \npuede estar contenido en él (incl) o puede contener total o parcialmente (at) al tsit.\nTabla 1. Relaciones aspectuales (Klein 1994: 108)\nTérmino Relación aspectual\nImperfectivo  tt   incl    tsit\nPerfectivo       tt    at      tsit\nPerfecto           tt  after  tsit\nProspectivo     tt before tsit   \nAquí observamos que el perfectivo es descrito como una relación donde el tt (el cual \npuede ser denotado contextualmente o definido por un complemento temporal) inclu -\nye total o parcialmente al tsit  (el intervalo que denota el evento). Esta definición nos \npermite abordar al perfectivo como un contenido aspectual que presenta una situación, \nya sea incluida de inicio a fin en el tt, ya sea incluida parcialmente en este intervalo. \nLas lecturas de inclusión parcial, que se observan, por ejemplo, en los estados, no serán \nrevisadas en este trabajo.\nIgualmente ocurre con las relaciones temporales, las cuales se dan únicamente entre \nel tu (el tiempo en el que la expresión es dicha) y el tt, como se puede ver en la tabla 2. \nDe éstas nos interesa particularmente la relación de pasado porque es la que comparten \nlos dos tiempos verbales analizados. \nTabla 2. Relaciones temporales (Klein 1994: 124)\nTérmino Relaciones temporales\nPasado      tu  after  tt\nPresente   tu    incl   tt\nFuturo      tu before tt  \n2\u2009El tiempo de la situación (tsit) es el tiempo en el que la situación verbal ocurre, el tiempo tópico \n(tt) sería el tiempo sobre el cual algo es afirmado y el tiempo de la expresión (tu) es el tiempo en \nel que la expresión es dicha (Klein 1994: 3). \n28 erikA Pérez lezAmA\nLM V-2 \nLingüística Mexicana. Nueva Época, v (2023), núm. 2: 25-47  \nISSN: 2448-8194']","The article provided does not specifically address the challenges faced by researchers in the field of translation studies in Jalisco. It focuses on the ability of foreign language learners to discover the rules of non-salient forms in linguistic structures. If you need information on translation studies in Jalisco, I recommend looking for articles or research papers specifically related to that topic."
Who is Carrasco and what is their relevance in the context of language assessment research?,"['cAmBio ASPectuAl en loS tiemPoS Perfecto SimPle y comPueSto del eSPAñol mexicAno Al respecto, Squartini y Bertinetto (2000: 419) discuten precisamente la interpreta - ción diacrónica de estos estadios y sugieren una hipótesis en la que el estadio 2 puede ser un paso ajeno a la gramaticalización del ppc hacia valores perfectivos, la cual será abordada en las conclusiones. Con estas observaciones, pasaré al análisis. corpus y anáLisis de Los datos Brevemente comentaré las características del corpus que utilicé para este trabajo. Tomé tres cortes temporales: la primera mitad de los siglos xvii, xix y xxi. El motivo de esta segmentación fue recuperar documentación que incluyera un periodo colonial ya consoli- dado (casi un siglo después de la llegada española), así como mostrar datos actualizados del s. xxi, que ya estaban disponibles. La selección del corpus se justifica a partir de la dis- ponibilidad de géneros replicables en estos mismos cortes, de modo tal que se utilizaron 6 géneros: crónica, prosa literaria, teatro, periódicos, documentos personales —que abar- can blogs para el s. xxi y los Documentos lingüísticos de la Nueva España (dlne) (Company 1994) para los siglos xvii y xix—, así como entrevistas orales provenientes del Corpus sociolingüístico de la Ciudad de México (cscm) (Martín Butragueño y Lastra 2011). El uso de materiales de habla oral en el s. xxi sólo considera el análisis de la oralidad en este siglo y no propone, en modo alguno, un análisis de la oralidad para los siglos xvii y xix. Para que los resultados del análisis de cada siglo fueran comparables en términos cuantitativos, establecí una muestra base de 10 mil palabras para cada género, y a partir de dicha muestra, se seleccionaron los verbos en análisis que aparecían. Sin embargo, hubo restricciones de documentación en el periodo abordado: el s. xxi contiene infor- mación de los seis géneros; en los s. xix y xvii no hay entrevistas orales, y en el s. xvii (durante la primera mitad) no hay registro de periódicos de la época. De este modo, el universo de palabras entre siglos difiere y hablaré entonces de proporciones de uso. Pretérito Perfecto Simple Empezaremos analizando el pps y su aparición con adverbios hodiernales. Nuestros datos confirman lo que otros autores han descrito para español en general (Moreno de Alba 2006; Carrasco 2008; rae y asale 2009): que el pps tiene un contenido aspectual perfectivo y que este contenido es constante diacrónicamente en el español mexicano, pues en los tres siglos observamos que el 100% de las situaciones catalogadas como eventos tuvieron una lectura de inclusión total, donde el tsit se incluye completamente en el tt de la oración. En este caso, hablamos de eventos flexionados en pretérito simple, como en José caminó una calle, donde el evento de caminar se expone como concluido dentro de un periodo, el cual es anterior al tu. En contraste con esto, el uso de los contextos hodiernales refiere un cambio impor - tante en el pps del español mexicano. En la tabla 3 vemos los porcentajes de aparición de dichos contextos en el corpus. Como se puede apreciar, en el s. xvii hay 8 casos, pos- 35 LM V-2']","Carrasco is mentioned in the context in relation to analyzing language assessment tools for bilingual individuals in different contexts. The text discusses the aspectual perspective in the Simple and Compound Past Tenses of Mexican Spanish, where Carrasco's work is referenced alongside other authors like Squartini and Bertinetto (2000) in the diachronic interpretation of these stages. Carrasco's contribution is highlighted in the analysis of verb usage across different genres and time periods, particularly focusing on the aspectual perfective content of the Pretérito Perfecto Simple in Mexican Spanish.",single_hop_specifc_query_synthesizer,"['Real Academia Española y Asociación de Academias de la Lengua Española. 2009.  Nue-\nva gramática de la lengua española. Madrid: Espasa Libros.\nReichenbach, Hans. 1947. “The tenses of verbs”, Elements of Symbolic Logic 51: 71-78. \nRodríguez Louro, Celeste. 2009. Perfect Evolution and Change:  A Sociolinguistic Study \nof Preterit and Present Perfect Usage in Contemporary and Earlier Argentina , tesis de \ndoctorado. Melbourne: The University of Melbourne. \nRodríguez Molina, Javier. 2010. La gramaticalización de los tiempos compuestos en \nespañol antiguo: cinco cambios diacrónicos, tesis de doctorado. Madrid: Universidad \nAutónoma de Madrid. \nRomani, Patrizia. 2006. “Tiempos de formación romance I. Los tiempos compuestos”, \nen Concepción Company (ed.), Sintaxis histórica de la lengua española. vol. 1: Primera \nparte: La frase verbal. México: Universidad Nacional Autónoma de México-Fondo de \nCultura Económica, pp. 243-346.\nSchwenter, Scott. 1994a. “<<Hotnews>> and the grammaticalization of perfects”, \nLinguistics: An Interdisciplinary Journal of the Language Science, 32: 995-1028.\nSchwenter, Scott. 1994b. “The grammaticalization of an anterior in progress: evidence \nfrom a peninsular Spanish dialect”, Studies in Language 18: 71-111.\nSchwenter, Scott y Rena Torres Cacoullos. 2008. “Defaults and indeterminacy in \ntemporal grammaticalization: The ‘perfect’ road to perfective”, Language Variation \nand Change 20: 1-39.\nSquartini, Mario y Pier Bertinetto. 2000. “The Simple and Compound Past in Ro-\nmance languages”, en Östen Dahl (ed.), Tense and Aspect in the Languages of Europe . \nBerlin-New York: De Gruyter, pp. 403-439.\ncorpus \n[Escena] Anónimo. (2005-2006). Escena skene, en <http://escenaskene.blogspot.mx/> \n[consultado el 17 de abril 2016]. \n[Gente] Anónimo. (2009-2013). gente sin kehacer, en <http://gentesinkehacer.blogs-\npot.mx/> [consultado el 18 de abril 2016]. \n[Amuleto] Ayllón, Luis (2005): “La historia del ser que imaginó un amuleto bajo tierra. \nCuarteto para voces”, en Obras finalistas del Sexto Concurso Nacional de Dramaturgia \nManuel Herrera. Querétaro: Fondo Editorial de Querétaro. \n[Pelucas] Blumenthal, Vivian. (2005): “Pelucas. Abierto. Pase ud.”. En Obras finalistas \ndel Sexto Concurso Nacional de Dramaturgia Manuel Herrera, Querétaro: Fondo Edito-\nrial de Querétaro. \n[Sirgueros] Bramón, Francisco. 2013 [1620]. Los sirgueros de la virgen sin original pecado. \nEdición de Barrera, Trinidad. España: Universidad de Navarra-Iberoamericana-Ver-\nvuert-Bonilla Artigas Editores. \n[Obras poéticas] Calderón, Fernando. 1999 [1844]. Obras poéticas (Parnaso Mexicano \n1844). Edición facsimilar. Edición, presentación y apéndices de Tola de Habich, Fer-\nnando. México: Universidad Nacional Autónoma de México. \n46 erikA Pérez lezAmA\nLM V-2 \nLingüística Mexicana. Nueva Época, v (2023), núm. 2: 25-47  \nISSN: 2448-8194', 'nominal caballo / caballos usó seis: un, mi, el, los, tu y tus. Así, detectar que el determi -\nnante es una palabra independiente con respecto al nominal da paso a la combinatoria \nde elementos en la construcción de las frases nominales. Con ello, los niños pudieron \ncolocar los constituyentes en diversas construcciones y someterlos a prueba. \nOtro punto que se demostró es que el contraste ʻunoʼ vs. ʻmás que unoʼ (Clark y Ni -\nkitina 2009; Wood et al. 2009) es la base previa que conduce a la adquisición de los \nmorfemas de número, porque en el momento en que los niños comenzaron a detectar el \nʻconjunto (de algo)ʼ en el nominal ‒pauta dada por el plural‒ se percataron del contraste \nde número. Previamente, el plural sólo se refería a conjuntos, como los ejemplos en que \nlos niños únicamente usaron el nominal en plural: toallas, hienas.\nAsimismo, se pudo corroborar en nuestra investigación lo planteado por Li et al. \n(2009), cuando observamos que los niños presentaron contrastes de número en nomi -\nnales plurales que tienden a usarse tanto en singular como en plural – araña / arañas, \nniña / niñas, gato / gatos– y con esto siguieron el camino morfosintáctico, mientras que \nlos sustantivos que suelen tener una frecuencia de aparición mayormente en plural \n–orejas, piernas, colores, zapatos, deditos– continuaron la vía semántica. Así, pudimos \nver que la noción semántica y la construcción sintáctica del número derivan en dos  \ncaminos paralelos.\nFinalmente, vimos que los casos abundantes de concordancia fueron ramos de infor-\nmación que debimos separar para llegar a descubrir los dos tipos de concordancia de nú-\nmero que denominamos superficial y efectiva, y que nos llevó a comprender el complejo \nproceso que los niños realizan desde edades muy tempranas.\nBiBLiografía\nArias-Trejo, Natalia, Lisa M. Cantrell, Linda B. Smith y Elda A. Alva. 2014. “Early \ncomprehension of the Spanish plural”, Journal of Child Language 41, núm. 6: 1-17.\nBrandani, Lucía. 2013. “Concordancia nominal y operaciones post-sintácticas en la \ngramática infantil”, Revista de la Sociedad Argentina de Lingüística 1: 7-25.\nClark, Eve. 2001. “Emergent categories in first language acquisition”, en Melissa Bower-\nman y Stephen C. Levinson (eds.), Language Acquisition and Conceptual Development. \nCambridge: Cambridge University Press, pp. 379-405.\nClark, Eve y Tatiana  Nikitina. 2009. “One vs. more than one: Antecedents to plural \nmarking in early language acquisition”, Linguistics 47, núm. 1: 109-139.\nLapointe, Stephen G. 1988. “Toward a unified theory of agreement”, en Michael Bar -\nlow y Charles Ferguson (eds.), Agreement in Natural Language. Approaches, Theories, \nDescriptions. California: Stanford University, pp. 67-87.\nLi, Peggy, Tamiko Ogura, David Barner, Shu-Ju Yang y Susan Carey. 2009. “Does the \nconceptual distinction between singular and plural sets depend on language?”,\xa0Deve-\nlopmental Psychology\xa045, núm. 6: 1644-1653.\n114 zuLeykA mAhiTzé oLverA yAbur\nLM II-1 \nLingüística Mexicana. Nueva Época, II (2020), núm. 1: 101-115  \nISSN: 2448-8194', 'Estudios de Lingüística Aplicada, año 42, número 79, julio de 2024, pp. 71–109\ndoi: 10.22201/enallt.01852647p.2024.79.1096\n[ 82 ] Amor Madai Peña Ramos & Verónica González Márquez\nidentifi  ca con edad, número de narración, escuela, sexo y nombre, \npor ejemplo: 9–N20–E2–M–Ana Sofía.\n4.2.  Procedimiento de análisis\nSe segmentó cada narración por cláusulas, partiendo de la siguiente \ndefi  nición: “una unidad compuesta al menos por un sustantivo o \nun sintagma nominal que concuerda con un verbo o un sintagma \nverbal” (De Beaugrande & Dressler, 1997: 90). Luego, se clasifi  -\ncaron los tiempos verbales de cada cláusula.\nPosteriormente, se identifi  caron las secciones de la estructura \nnarrativa de las dos historias de acuerdo con las propuestas por La-\nbov y Waletzky (1967); los esquemas se muestran en los Anexos 3 \ny 4. Además, se identifi  có la estructura narrativa de cada narración \nde ambos corpora. Se elaboró una gráfi  ca para representar la rela-\nción tiempo verbal–estructura narrativa. Finalmente se realizó una \nrelación de mundo narrativo/mundo comentado y otra de acuerdo \ncon el aspecto de los tiempos verbales.\n5. Resultados\n5.1.  Corpus de cuento a partir de imágenes\nTal como se muestra en el Anexo 3, el cuento a partir de imágenes \ngenerado mediante la historia El cordoncito tiene varias secuen-\ncias de orientación, complicación y resolución. En el Cuadro 4 se \nmuestran dichas secuencias según su aparición en el corpus.\nCUADRO 4. Composición de narraciones (cuento a partir de imágenes)\nGrupos etarios\nEstructura narrativa\nO C R O C R O C R C R Coda\n5 años 8 8 4 8 8 8 7 8 8 8 8 6\n7 años 8 8 8 8 8 8 7 8 8 8 8 7\n9 años 8 8 8 8 8 8 5 8 8 7 8 6', '[ 157 ]\nLineamientos para publicar en ELA\nUna referencia bibliográfi  ca se conforma por las partes explicadas \nen el Cuadro 1 (aunque algunas de ellas son opcionales): lista de \nautores, año, título del artículo o capítulo, lista de editores, título \nde la publicación, número del volumen, número de páginas, ciu-\ndad y editorial. Las partes no estándar pueden añadirse entre pa-\nréntesis.\n15.3.  Reglas generales de formato\n• Los títulos de artículo o capítulo irán en redondas, sin comillas.\n• Los títulos de publicación (tanto de libros como de revistas) apare-\ncerán en cursivas.\n• Los títulos inician con mayúscula. En los títulos de artículos y li-\nbros en inglés no se emplean mayúsculas en el resto de las palabras \n(es decir, no se emplea title case), salvo en los nombres de revis-\ntas y series, y cuando la ortografía de la lengua lo exija. Se sugiere \nseguir el mismo criterio en títulos en otras lenguas.\n• El título principal y el subtítulo se separan con dos puntos. Si es en \nespañol, el subtítulo iniciará con letra minúscula; si es en inglés, \ntambién iniciará con minúscula a menos que se trate de una oración \ncompleta.\n• La lista de editores, o compiladores, coordinadores, etc., va seguida \nde (Ed.) o (Eds.), dependiendo del número de editores, o (Comp.) \no (Comps.), etc.\n• La ciudad de publicación va seguida de dos puntos.\n• Las partes no estándar se pueden añadir al fi  nal de una referencia \nentre paréntesis.\n• En las referencias, las abreviaturas, las preposiciones para introducir \nel volumen editado en el que aparece un capítulo, los nombres de \nla ciudad de publicación y cualquier información adicional deben \nir en la lengua principal del texto. Por ejemplo, en una contribución \nen español, se usará la preposición “En”, la abreviatura “Ed.” y el \nnombre “París” en la siguiente referencia:', 'vi. En virtud de que para el autor las colocaciones son unidades que se derivan \nprincipalmente de la oralidad, cada componente dentro de una combinación sólo \ntiene una forma de ser aplicado.\nvii. Poseen variantes libres y marcadas, las cuales se dan en función del registro uti-\nlizado o el uso específico que le dan los usuarios.\nviii. Suelen ser combinaciones que se reproducen en el habla cotidiana, son aceptadas \npor una determinada comunidad y son de dominio popular.\nix. El usuario puede seleccionar los elementos de las colocaciones, entre varias posi-\nbilidades, para expresar la misma idea. \nZuluaga (2002) concluye que la restricción combinatoria, como propiedad de las co-\nlocaciones, en realidad está determinada por el hecho de que existe un uso repetido, por \nlo que al final se acepta por la comunidad de habla, la que lo replica constantemente.\nAsimismo, Barrios Rodríguez (2015) señala lo que para ella son las características fun-\ndamentales de las colocaciones. Entre las que destacan la co-ocurrencia frecuente, la res -\ntricción combinatoria, la tolerancia a ser modificadas sin que pierda su sentido, la común \nadmisión de la nominalización, la admisión de la forma pasiva, la aceptación de las formas \ndel plural y la presentación de una flexibilidad en su léxico. A manera de ejemplo, son co-\nlocaciones tomadura de pelo y tomar el pelo, trasplante de órgano y el órgano fue trasplantado, \nentablar amistad y entablar amistades o violar una norma y transgredir una norma, según se \nestablece en las cuatro últimas características enunciadas. Como colofón de esta perspec -\ntiva, vale la pena señalar que para la mencionada autora deben ser consideradas como \ncolocaciones aquellas expresiones que denoten alguna relación de tipicidad entre sus com-\nponentes, lo cual no coincide con lo establecido por Zuluaga (2002).\nPor último, como adelantamos ya, el enfoque que estudiamos y desarrollamos con \nmayor detenimiento en el análisis del corpus de nuestra investigación es el de Kazumi \nKoike (2001, 2005). Para el autor, las colocaciones son “combinaciones frecuentes y pre-\nferentes de dos o más palabras que constituyen una categoría intermedia entre las com-\nbinaciones libres y las fijas […] suelen dividirse en colocaciones gramaticales ( consistir \nen) y léxicas (tomar una decisión)” (Koike 2001: 14). Enuncia seis grandes características \nque tienen las colocaciones, las cuales, a su vez, divide en dos grandes grupos: formales y \nsemánticas. Las primeras son la co-ocurrencia frecuente, las restricciones combinatorias \ny la composicionalidad formal, mientras que las segundas son el vínculo de dos lexemas, \nla tipicidad de la relación y la precisión semántica (Koike 2001). Otro valor que encon-\ntramos en este autor consiste en clasificar tales unidades en colocaciones léxicas simples y \ncolocaciones complejas, según los elementos con las que están constituidas. \nPor su importancia para la aplicación del estudio práctico y el análisis de esta investi-\ngación, abundaremos brevemente en cada una de las características que propone Koike.\nCo-ocurrencia frecuente. Aun cuando el autor admite que esta característica no es privati-\nva de las colocaciones, sí enfatiza que se trata de una de las más importantes y representa-\ntivas para reconocerlas. Está determinada por el significado, lo cual condiciona que ambos \nlexemas se encuentren con frecuencia en los textos o en las expresiones (Wotjak 1998). \n86 xócHitL taveRa ceRvantes y caRLos gonZÁLeZ di PieRRo\nLM IV-1 \nLingüística Mexicana. Nueva Época, IV (2022), núm. 1: 81-97  \nISSN: 2448-8194', 'Estudios de Lingüística Aplicada, año 38, número 71, julio de 2020, pp. 9–43\ndoi: 10.22201/enallt.01852647p.2020.71.900\n[ 22 ]  Kenneth Geoffrey Richter & Ricardo Alejandro Medel Romero\n4. Results and discussion\nThis section presents the results of the item analyses conducted on\nthe 50 items in the test.It highlights the fi  ndingsand offers recom-\nmendations concerning the improvement of the test.\n4.1.  Item facility\nThe if range was set from 0.30 to 0.80. That is, items falling with-\nin this range were considered acceptable for inclusion in the test;\nitems falling below 0.30 or above 0.80 were considered defi  cient\nand in need of modifi  cationor replacement.\nAs mentioned in the previous section, if helps to detect those\nitems that do not contribute to the reliability of a test because of\ntheir very high or very low levels of diffi  culty.A detailed descrip-\ntion of the items that emerged as weak, average, or strong based \non the results of the if analysis is included below.\n4.1.1. Listening subtest: items 1 to 10\nAccording to the if criteria, 30% of the items in the listening sub-\ntest fell outside the accepted range (0.30 to 0.80, see Table 5 be-\nlow). Items 1, 2, and 3 all had an if above 0.80 and would need to\nbe improved or replaced in any subsequent version of the exam.\nMoreover, although items 4, 7, and 9 fell within the acceptable if\nrange, these were somewhat suspicious since they fell close to the\nvery easy end (0.76) of the acceptable range.\nTABLE 5. Item facility of the listening subtest (10 items)\nITEM I 1 I 2 I 3 I 4 I 5 I 6 I 7 I 8 I 9 I 10\nTest-takers 41 43 47 38 28 25 38 33 38 23\nIF 0.82 0.86 0.94 0.76 0.56 0.50 0.76 0.66 0.76 0.46\nNote: “Test-takers” refers to the total of test-takers answering the item correctly out of 50.', 'Anexos\nAnexo 1. Numerales del 1 al 20 en mixe, cada numeral escrito en una secuencia gráfica\ntu’uk uno mäjktu’uk once 10 + 1\nmajtsk dos mäjkmajtsk doce 10 + 2\ntëkëëk tres mäjktëkëëk trece 10 + 3\nmaktäxk cuatro mäjkmäjkts catorce 10 + 4\nmakoxk cinco mäjkmojkx quince 10 + 5\ntutujk seis mäjktujk dieciséis 10 + 6\nwëxtujk siete mäjkwëxtujk diecisiete 10 + 7\ntuktujk ocho mäjktuktujk dieciocho 10 + 8\ntäxtujk nueve mäjktäxtujk diecinueve 10 + 9\nmäjk 10 ee’px 20\nFuente: Romero (2009)\nAnexo 2. Numerales del 20 al 100 en mixe (intervalos de 10 en 10)\nee’px veinte 20\nee’pxmäjk treinta 20 + 10\nwëxijkxy cuarenta 2 x 20\nwëxijkxymäjk cincuenta (2 x 20) + 10\ntëki’pxy sesenta 3 x 20\ntëki’pxymäjk setenta (3 x 20) + 10\nmakta’pxy ochenta 4 x 20\nmakta’pxymäjk noventa (4 x 20) + 10\nmakë’pxy 100 (5 x 20)\nFuente: Romero (2009)\nAnexo 3. AVISO\nSe informa a la población en general que ya llegó la vacuna de la influenza. Las enfer -\nmeras aplicarán dos veces la vacuna a\n-pacientes con diabetes\n-embarazadas\n-niños de 6 semanas a 11 años\n-adultos mayores\nContamos con 138 dosis disponibles. Acudir por la primera dosis al Centro de Salud de \n8:00 a 12:00 hrs.\n40\nDaniela espinoza y emilia Ferreiro LM V-1 \nLingüística Mexicana. Nueva Época, v (2023), núm. 1: 25-40  \nISSN: 2448-8194', '12 Fabiola Esmeralda López Rodríguez\nEstudios de Lingüística Aplicada, año 36, número 67, julio de 2018, pp. 9–43\ndoi: 10.22201/enallt.01852647p.2018.67.723\n2. Marco teórico\nDiversas ciencias sociales y humanas entienden al chisme como un reflejo de \nlos modos en que concebimos la realidad y nuestra vida en sociedad, entre ellas \nla antropología (Gluckman, 1963, 1968; Paine, 1967, 1970; Cox, 1970; Handel-\nman, 1973; Wilson, 1974; Haviland, 1977; Fine, 1985; Vázquez García & Chá-\nvez Arellano, 2008, De León Torres, 2010; entre otros), la sociología (Levin & \nArluke, 1987; Goffman, 1991; Bergmann, 1993; Goodman & Ben-Ze’ev, 1994; \nBergmann & Luckmann, 1995; Pietrosemoli, 2009) y la psicología (Dunbar, \n1996; Baumeister, Zhang & V ohs, 2004; Rosnow & Foster, 2005).1 En suma, a \ntodas las propuestas subyace la idea de que el chisme propicia formas particula-\nres de socializar y al mismo tiempo es producto de ellas.\nDesde la lingüística, autores como Eder y Enke (1991), Hall (1993a, \n1993b) y Ahmed (2010) analizan la estructura del chisme, pero difieren en el \npropósito final. Eder y Enke (1991) se centran en el orden de los actos por -\nque influye en la evolución de un chisme en la conversación. Por su parte, Hall \n(1993a, 1993b) busca explicar cuáles son los recursos que emplean los parti -\ncipantes para construir, mantener y modificar sus identidades al interior de un \ngrupo a partir de esta práctica oral cotidiana, importante y frecuente en diver -\nsos grupos culturales. Ahmed (2010) analiza a profundidad una conversación \nentre dos mujeres y, después de identificar y explicar los elementos lingüísticos \nutilizados, concluye que en la construcción del chisme están fuertemente im -\nplicadas las relaciones de poder que existen entre los participantes. Un trabajo  \nque destaco es el de Eggins y Slade (1997), quienes ven al chisme como uno de \nlos géneros más comunes y socialmente significativos de la conversación casual \nen inglés; en él la gente clasifica al mundo en términos de lo que debería o no \nhacerse. De estas autoras retomo no solo un marco de referencia sino también \nalgunas herramientas analíticas.\nEn general se acepta que gran parte de nuestras interacciones las dedicamos \nal chisme y que este es una conversación casual del tipo evaluativo —entre perso-\nnas que tienen familiaridad entre sí—, sobre asuntos concernientes a terceras per-\n1 Para acceder a una revisión exhaustiva respecto a cómo ha sido estudiado el chisme desde dis-\ntintas disciplinas se recomienda consultar a López Rodríguez (2015).']","Carrasco is not mentioned in the provided linguistic articles. If you have any other questions or need information on a different topic within linguistics, feel free to ask!"
What is the significance of the ISSN 2448-8194 in the context of Linguistica Mexicana?,"['Lingüística Mexicana. Nueva Época, v (2023), núm. 2: 25-47 ISSN: 2448-8194']","The ISSN 2448-8194 is associated with the journal Lingüística Mexicana, specifically in its fifth volume from 2023, issue number 2.",single_hop_specifc_query_synthesizer,"['Algunas exploraciones en torno a la reflexión metalingüística sobre la ironía 17\nEstudios de Lingüística Aplicada, año 35, número 66, diciembre de 2017, pp. 9–39\ndoi: 10.22201/enallt.01852647p.2017.66.827\npretación irónica: aunque María literalmente dice que la fiesta estuvo fantástica, \nen realidad quiere expresar que no le gustó.\nSi bien la teoría de Sperber y Wilson (Wilson & Sperber, 1992, 2004) ha \nsido objeto de críticas (al respecto véase, entre otros, Attardo, 2000, y Kalber -\nmatten, 2006), también ha recibido un importante soporte experimental (Kal -\nbermatten, 2006). Por tanto, consideramos que resulta ser una herramienta vá-\nlida para el estudio sobre la manera en que los niños y adolescentes interpretan \nlas expresiones irónicas. Por otra parte, creemos que esta aproximación permite \nanalizar la forma en que un individuo hace una reflexión sobre el lenguaje en sí \nmismo (mención en términos de la teoría de la relevancia, reflexión metalingüís-\ntica en términos de Gombert, 1992).\n1.4. Aspectos que inciden en la interpretación de la ironía verbal\nDesde la propuesta de la teoría de la relevancia (Wilson & Sperber, 1992, 2004) \nse asume que para interpretar un enunciado irónico el oyente debe percatarse de \nque no puede tratarse de una emisión literal. Para lograr lo anterior, cuenta con \ninformación generada por diversas fuentes contextuales. Al respecto, Yus (2000, \n2009) propone que existen siete fuentes contextuales que aportan información \nrelevante para lograr la adecuada interpretación de un enunciado irónico: cono-\ncimiento enciclopédico general (conocimiento que se tiene acerca del mundo: \ninformación social y cultural que permite interpretar más fácilmente una expre-\nsión irónica); conocimiento enciclopédico específico del interlocutor (gustos, \nhábitos, creencias, opiniones y demás información); conocimiento de sucesos o \nacciones que ocurrieron poco tiempo antes de la expresión irónica; enunciados \nprevios a la conversación; comunicación no verbal vocal y visual (entonación, \ngestos faciales, sonrisas); elecciones léxicas o gramaticales (pistas lingüísticas \ncomo adjetivos con connotación de cualidad extrema, adverbios, superlativos, \nrepeticiones innecesarias, frases convencionalmente irónicas) y la información \nproveniente del entorno físico que rodea a los interlocutores. De acuerdo con el \nautor, la presencia / ausencia de dichas fuentes contextuales impactará en el ac-\nceso que pueda tener un individuo a la interpretación irónica. De esta manera, a \nmayor saturación, es decir, a mayor cantidad de fuentes contextuales, más fácil \ny rápida será la interpretación irónica. Específicamente para fines de este estu -', 'El chisme: estrategias discursivas desplegadas en su construcción 13\nEstudios de Lingüística Aplicada, año 36, número 67, julio de 2018, pp. 9–43\ndoi: 10.22201/enallt.01852647p.2018.67.723\nsonas ausentes (comportamientos, características o acciones) o a terceras perso-\nnas presentes, pero cuyo aspecto a valorar aparece como temporalmente inactivo.\nLa propuesta de análisis de la conversación casual de Eggins y Slade (1997) \nes la que da sustento a la descripción del chisme y que, a su vez, parte de los \nprincipios básicos e iniciales de la teoría de la valoración para encontrar las for -\nmas gramaticales, semánticas y discursivas mediante las que se realiza el chis-\nme. Una conversación casual (Eggins & Slade, 1997) es una manifestación lin-\ngüística en donde se negocia la construcción de la realidad social y tiene como \nobjetivos afirmar y reconfirmar, establecer y mantener relaciones. Desde esta \nperspectiva, las autoras se preguntan: ¿cómo se estructura la lengua para permi-\ntirnos hacer conversaciones? Primero, dividen en dos tipos las secuencias con -\nversacionales: las secuencias chat (extremadamente interactivas, en las que se \ndespliega una rápida alternancia de turnos) y las secuencias chunk (bloques con \nuna estructura interna predecible que puede ser descrita y analizada de acuerdo \ncon el género conversacional al que pertenecen).\nPara Eggins y Slade (1997), el chisme constituye un tipo de secuencia \nchunk en el que se distinguen al menos tres etapas obligatorias, es decir, aque-\nllas que lo definen como género conversacional y que le son exclusivas: el enfo-\nque en la tercera persona (third person focus) o identificación de los caracteres, \nla exposición del comportamiento probatorio (substantiating behavior) y la eva-\nluación peyorativa (pejorative evaluation).\nLos planteamientos de Eggins y Slade (1997) encuentran en la teoría de la \nvaloración (Martin, 2000; White, 2001, 2011; Kaplan, 2004, 2007; Martin & \nWhite, 2005; entre otros) el entramado teórico que los sustenta. Los analistas del \ndiscurso enmarcados en esta corriente buscan describir los sistemas de opciones \nsemánticas que ofrece la lengua para evaluar, adoptar posiciones, construir suje-\ntos textuales o identidades discursivas, asumir roles, negociar relaciones y pro-\nmover como naturales las posiciones intersubjetivas que son, en última instancia, \nideológicas (Kaplan, 2007). En particular, este enfoque se centra en la expre -\nsión lingüística de la actitud y el compromiso asumido por el emisor frente a sus \nenunciados. Del mismo modo indaga sobre las estrategias mediante las cuales el \nemisor se alía o se distancia de los receptores. En otras palabras, esta perspectiva \ndel análisis del discurso explora, describe y explica cómo es utilizado el lenguaje \npara gestionar posicionamientos y relaciones interpersonales (White, 2011).', 'La lectura continuativa requiere de, al menos, uno de los siguientes criterios: la \naparición de frases temporales de intervalo ( desde x, hasta ahora, etc.), cuantificadores \nuniversales (siempre, nunca, en toda mi vida) o un verbo de estado permanente5.\nPasado reciente o Hot News. De acuerdo con Henderson (2010: 68), fue McCawley \n(1971) quien identificó primero esta lectura. En ella, el perfecto señala situaciones pa-\nsadas muy recientes al momento de habla, y el estatus presumible de “información \nnueva” para el interlocutor es un factor esencial para la aceptabilidad de esta lectura \n(McCawley 1971: 109; Schwenter 1994a: 997). Un ejemplo prototípico de esta lectura \nsería el que muestro en (5), durante un torneo donde la situación descrita es muy recien-\nte y el comentarista expresa:\n(5)\n¡El equipo verde han ganado!\nEn este trabajo, seguiré la propuesta de Schwenter (1994a), quien defiende que estos \ncasos tienen un estatus independiente de la lectura existencial (cf. McCawley 1971: 109) \ny que ejemplifican una lectura más inclinada hacia la expresión de aspecto perfectivo \nque de perfecto. \nAdemás de los casos de hot news, que suponen una lectura específica del ppc, existen los \ncontextos hodiernales y prehodiernales que son considerados como lecturas que propician \nel valor perfectivo del ppc  en español (Carrasco 2008; García Fernández 1995; Martínez \nAtienza 2012). Considerando que los casos de hot news, hodiernales y prehodiernales son \nmanifestaciones distintas del perfecto, pero que en conjunto sí conforman interpretaciones \naspectuales más perfectivas que perfectas (Squartini y Bertinetto 2000: 414), agruparé di -\nchos ejemplos, presentes en la documentación de este trabajo, bajo la nomenclatura de pa-\nsado perfectivo. De modo tal que, al igual que el pps revisado en §2.1, este conjunto de con-\ntextos del ppc tendría una interpretación aspectual perfectiva, donde el tt incluye al tsit.\nSi bien es cierto que en diversos análisis sobre los tiempos compuestos se localizan es-\ntas lecturas tanto en oralidad como en textos (Schwenter 1994b; Azpiazu 2013; Kempas \n2008; entre otros), lo cierto es que no hay un consenso definido para el establecimiento \nde los indicios que señalen falseablemente esta lectura. Así, por ejemplo, los casos de (6) \nhan sido considerados con una lectura perfectiva, por una parte, por contener un comple-\nmento temporal de pasado (en cursivas) como en (6a), y, por otra, por señalar cercanía \ncon el pasado, como en (6b), en la que el evento de hacer relación se interpreta como un \npasado reciente. \n5\u2009Se ha considerado que la negación y las oraciones interrogativas resultan en una lectura continuati-\nva de manera automática (Lope Blanch 1961). Sin embargo, no seguiré este criterio pues considero que \npuede modificar las frecuencias de uso de dicha lectura, además de que el contexto negado puede deber-\nse a otros factores, como de hecho Schwenter y Cacoullos (2008: 19) sugieren para el español mexicano.\n32 erikA Pérez lezAmA\nLM V-2 \nLingüística Mexicana. Nueva Época, v (2023), núm. 2: 25-47  \nISSN: 2448-8194', 'Con cada par de oraciones de (5) a (7) entendemos que el predicado expresa una \npropiedad que abarca la máxima extensión mencionada en el sujeto, no sólo cuando éste \ntiene un cuantificador universal sino también cuando se trata de una frase con artículo \ndefinido. Constatamos así que con las frases definidas singulares y plurales podemos \nhablar de la más amplia generalidad al combinarse con predicados de propiedades (tal \ny como sucede también en las frases nominales definidas del inglés: Krifka et al. 1995).\nLas oraciones de predicados episódicos, llamados también “de estadio” (“stage level”, \nen términos de Carlson 1977), por el hecho de expresar hechos particulares, se ha pen-\nsado a veces que no pueden interpretarse con lectura genérica; sin embargo, al referir un \ntiempo pasado o al presentarse en futuro, las frases definidas con las que se combinan \npueden tener una interpretación genérica3, como muestran los siguientes ejemplos:\n(8) En abril, los docentes recibirán la vacuna.\n(9) a. El 3 de julio de 1955, las mujeres mexicanas asistieron a las urnas por \nprimera vez.\nMencioné la referencia a un tiempo pasado, porque no se requiere que la forma ver-\nbal sea la del pasado para que la frase definida pueda tener una lectura genérica, como \nse muestra en (9b); se trata del uso de la forma verbal del presente, tradicionalmente \nllamado “histórico” (rae 2009: 23.6a). Tampoco se requiere que la frase nominal apa-\nrezca en plural:\n(9) b. El 3 de julio de 1955, la mujer mexicana asiste a las urnas por pri-\nmera vez.\nAl menos desde los estudios de Lawler (1973) dirigidos al inglés, se ha reconocido \nque las interpretaciones genéricas con frases definidas nos permiten entender que pue-\nden existir excepciones a lo que se predica. La genericidad de frases indefinidas resulta \nexpresar una aserción categórica; con ellas difícilmente aceptamos excepciones. Apre-\nciamos esta diferencia al contrastar las frases:\n(10) a. El hombre mediterráneo podía atreverse a explorar tímidamente las \ncostas de África hacia el sur [crea]\nb. Un hombre mediterráneo podía atreverse a explorar tímidamente las \ncostas de África hacia el sur.\n3\u2009 Carlson (1977) ya había mencionado esto para el inglés; sin embargo, Borik y Espinal (2015), \nsin especificar el tiempo verbal, consideran que en español no se generan interpretaciones genéricas \ncon predicados episódicos. Los ejemplos (8) y (9) muestran la genericidad en futuro y en pasado, \ncon predicados episódicos. De acuerdo con Lawler (1973) y a diferencia de lo que mostramos en los \nejemplos mencionados, Leonetti (1999) afirma que la inserción en coordenadas espacio – temporales \nbloquea la interpretación genérica en español.\n10  Josefina García Fajardo\nLM VI-2\nLingüística Mexicana. Nueva Época, vi (2024), núm. 2. \nISSN: 2448-8194', 'Adjetivos\nCotorra. El significado identificado de este adjetivo es ‘que es soltero en una edad en \nla que se considera que las personas deben estar casadas’ ( dem, s. v. solterón) (aunque \nesta palabra está restringida a mujeres), por lo que estaría en competencia con solterona, \nfrente a la cual cotorra sería un disfemismo, como muestra (6).\n(6)\nE: Cuando una muchacha tiene ya 20, cómo, ya no tiene chance de casarse, \n¿cómo le dicen?\nI: Que ya se le pasó el camión.\nE: Ahh\nI: Que ya se le está pasando el camión.\nE: Mmm ¿no les dicen cotorras?\nI: Pues sí, pero… Pues depende de la confianza que tenga una con aquella persona.\nE: Pero así de mucha confianza.\nI: Ah, sí, pos sí, ya le dice: “Ay, ya se te está pasando el camión,  ya estás bien \ncotorrita”. Así se le dice (chrm).\nEste intercambio entre la informante y el investigador inicia con la primera utilizan-\ndo un eufemismo ( ya se le pasó el camión ) para referirse a la mujer soltera, y el inves -\ntigador le pregunta sobre el potosinismo cotorra, tras lo cual ella acota su situación de \nuso a un contexto familiar (depende de la confianza que tenga con aquella persona), lo que \nmuestra que, más que un eufemismo, se trata de un disfemismo.\nEn cambio, no apareció ni en la encuesta de redes sociales ni en el cscslp, por lo que \nfue pertinente evaluar la variable edad y su incidencia en su reconocimiento con mayor \ndetenimiento. Finalmente, antes de pasar a los resultados, es importante señalar que \nesta palabra fue documentada en dos regiones muy alejadas entre sí: por un lado, fue \nusada por el político Hugo Luna en Jalisco; por otro, como comentario a este texto, una \ninformante de Puebla refirió que conoce este uso adjetival. Por esta razón, su extensión \ndialectal es mucho más amplia que la del resto de palabras de este trabajo.\nEl grupo I2 fue el que mayor representación tuvo de esta palabra (70.5%), seguido \npor el I1 (61%). Sumado a esto, la respuesta contraintuitiva (‘loca’) tuvo mayor repre -\nsentación en el grupo I1 (10%) frente al I2 (7%); además, el desconocimiento de la voz \nestuvo más presente en I1 (28%) que en I2 (22%). Estos datos pueden ser indicadores \nde una tendencia a la innovación en la capital, que evitaría palabras en proceso de des -\naparición (provocada por los cambios sociales a través de los cuales se ha dejado de es-\ntigmatizar a estas mujeres).\nEn cuanto a la edad, la generación más joven reconoce cada vez menos esta palabra, \ncomo indican los resultados del análisis de regresión logística, ya que ésta desfavoreció \nel uso de cotorra (0.332). En contraste, las generaciones más viejas, G2 y G3, favore -\ncieron el significado esperado (0.948 y 100% de apariciones). Esta diferencia etaria \n140 Valeria bocanegra y miguel PasTrán\nLM IV-2 \nLingüística Mexicana. Nueva Época, IV (2022), núm. 2: 125-152  \nISSN: 2448-8194', 'Estudios de Lingüística Aplicada, año 43, número 80, enero de 2025, pp. 95–123\ndoi: 10.22201/enallt.01852647p.2025.80.1086\n[ 110 ] Kalinka Velasco Zárate\nwhich, I stayed that way for years” [“Pasó mucho tiempo, y hasta \nel fi  nal, me quedé así por años”] (Kincaid, 2013 [1983]: 28–30),\nexpresando la ubicación en el tiempo o la distancia de los eventos \ncon respecto al momento en que se narran, y los límites defi  nidos \no indefi  nidos en cuanto a su duración (de Swart & Verkuyl, 1999: \n132–133; Zagona, 2002: 36–37).\nRespecto al tratamiento de las formas que expresan tempo-\nralidad (Tiempo y Aspecto), en la narración se presenta el uso \ndel adverbio de tiempo now en conjunto con formas verbales en \ntiempo pretérito o presente simple; sujeto+now+verbo [+pasado] \ny sujeto+now+verbo [–pasado], respectivamente. En estas formas, \nel adverbio de tiempo se distingue de la conjunción now, que fun-\nciona como elemento de cohesión entre oraciones. Como se señaló \nlíneas arriba, este uso del adverbio en conjunto con dichas formas \nverbales puede estar asociado a la variante del inglés hablado de \nAntigua que corresponde al idiolecto de la hija, como en los si-\nguientes ejemplos: “Between my mother and me now were the \ntears I had cried”, “My mother and I now watched each other ca-\nrefully”, “She had instructed me to follow her example, and now I \ntoo travelled”, “My mother and I now entered the cave.” (Kincaid, \n2013 [1983]: 28–29). En específi  co, aquellas construcciones con \nmorfología del verbo [+pasado] corresponden con el uso estándar \ndel inglés en pasado simple o pretérito, codifi  cando [Tiempo / As-\npecto] en la misma morfología verbal. A su vez, el tiempo presente \nen el verbo [–pasado] puede también signifi  car que la telicidad del \nevento permanece abierta, o que no es puntual, como en las inter-\npretaciones de eventos habituales o continuos.\nLa morfología verbal codifi  ca Tiempo tanto en inglés como en \nespañol, sin embargo, ambas lenguas difi  eren en la forma en que \nel Aspecto se realiza en la morfología verbal. En inglés el Tiempo \n[+pasado] tiene morfología regular (–ed) e irregular (teach–taught, \nspeak–spoke) (Zagona, 2002: 15). En español, el tiempo [+pasado] \nse expresa en la morfología fl  exiva de los verbos fi  nitos, que indi-\nca también persona y número, y el Aspecto, [perfectivo] e [imper-\nfecto], se explicita según las formas del pretérito y del copretéri-', 'Estudios de Lingüística Aplicada, año 38, número 71, julio de 2020, pp. 9–43\ndoi: 10.22201/enallt.01852647p.2020.71.900\n[ 16 ]  Kenneth Geoffrey Richter & Ricardo Alejandro Medel Romero\ngree of diffi  cultyof each of the items in a test (Alderson, Clapham\n& Wall, 1995; Bailey, 1998; Brown, 2005; Fulcher & Davidson,\n2007; Heaton, 1988; Hughes, 1989; Madsen, 1983).\nif is a number that ranges from 0.00 to 1.00. This number\nrepresents the percentage of people who answered a given item\ncorrectly. For the current study, the 50 test items in the university’s\ndiagnostic exam were statistically analyzed. To measure the if of\nthe items in this exam, it was necessary to sum up the total num-\nber of students who correctly answered the questions and divide\nthat number by the total number of students who took the test, as\nshown in the next formula:\nFor each exam item, the number of students who answered the\nitem correctly was divided by the total of 50 test-takers. This al-\nlowed detecting those items with a low facility index (close to\n0.00, i.e., very diffi  cult),those with a high facility index (close\nto 1.00, i.e., very easy), and those in the middle (around 0.50,\nwhich is considered ideal). As it is diffi  cultto calculate the if by\nhand, a formula in an Excel spreadsheet was utilized to calculate\nindividual if scores (see Table 1).\nIF =\nTotal no. of students who got the item right\nTotal no. of students taking the test\nTABLE 1. Sample of responses to test items by 50 participants\nSTUDENT I 1 I 2 I 3 I 4 I 5 I 46 I 47 I 48 I 49 I 50 TOTAL\nSt 1 1 1 1 1 1 0 0 1 0 1 32\nSt 2 1 1 1 1 1 0 0 0 0 1 31\nSt 3 1 1 1 1 1 0 1 1 0 1 31\nSt 4 1 1 1 1 1 1 1 0 0 0 30\nSt 5 1 1 1 1 1 0 0 0 0 0 30\nSt 46 0 1 1 1 1 0 1 0 1 0 15\nSt 47 0 0 1 1 0 0 0 0 0 1 15', 'Estudios de Lingüística Aplicada, año 38, número 71, julio de 2020, pp. 9–43\ndoi: 10.22201/enallt.01852647p.2020.71.900\n[ 20 ]  Kenneth Geoffrey Richter & Ricardo Alejandro Medel Romero\nOnce an item discrimination index was created, it was necessary\nto scrutinize the results in order to discover why certain items had\nlow discrimination scores.\n3.4.  Response frequency distribution\nThe response frequency distribution (rf) analysis was conducted\nto explain the fi  ndingsof the id procedure described above; that\nis, it was necessary to analyze in more detail why certain items re-\nceived good or bad id values. One of the goals of the rf analysis is\nto ascertain which distractors are more appealing to certain scorers\n(high or low). It is the aim of a rf analysis to compare the number \nof responses of each groupon certain items to fi n dthe level of dis-\ncrimination (Bailey,1998). It also shows the frequency with which\ntest items are selected by different groups.\nA total of 28 tests and their responses were analyzed statisti-\ncally. To carry out this analysis, once again, only the top-scoring\nand the bottom-scoring tests were recorded in Excel. First, the test\nitems were ordered from 1 to 50. Subsequently, a space for low-\nand high-scorers was assigned to every item. Finally,columns were\nassigned to the different distractors (A, B, C, and D in the case of\nthe grammar and reading sections, and A, B, and C in the case\nof the listening section). The number of times each option was\nselected by the low- and high-scorers was entered. In this way,\na comparison could be made between the preferences of the two \ngroups concerning the items, as shown in Table 4.\n(continued )\nTABLE 3. Item discrimination sample\nSTUDENT I 1 I 2 I 3 I 4 I 5 I 46 I 47 I 48 I 49 I 50 TOTAL\nIF upper 1.00 1.00 0.93 0.93 0.71 0.21 0.36 0.29 0.21 0.57\nIF lower 0.64 0.71 1.00 0.57 0.50 0.21 0.29 0.21 0.21 0.36\nID 0.36 0.29 -0.07 0.36 0.21 0.00 0.07 0.07 0.00 0.21\nNote: Some columns and rows have been hidden for space.']","The ISSN 2448-8194 is a unique identifier for the journal ""Lingüística Mexicana"" in the context of linguistics. The ISSN (International Standard Serial Number) is a standardized code used to uniquely identify serial publications, such as academic journals. In this case, the ISSN 2448-8194 specifically identifies the journal ""Lingüística Mexicana"" within the field of linguistics. This identifier helps in cataloging, organizing, and referencing articles and issues of the journal, making it easier for researchers, libraries, and databases to accurately identify and locate the publication."
What are some challenges faced by the Deaf community in Mexico regarding language acquisition?,"['Primeras configuraciones manuales en niños sordos en edad escolar Las lenguas de señas son sistemas lingüísticos de modalidad visogestual que hacen uso del espacio de forma gramatical. En México, casi todos los Sordos usuarios de una llss utilizan la lsm, la cual tiene sus propias reglas sintácticas y gramaticales que difie- ren del español y de otras llss. Se estima que, en México, cerca del 1.2% de la población presenta algún grado de sordera (inegi, 2021), pero no todas las personas con discapa- cidad son señantes de la lsm. En este sentido, Cruz-Aldrete (2021) indica que una de las causas principales de que la comunidad Sorda sea heterogénea lingüísticamente es que no se ha garantizado la adquisición de una primera lengua. Por otro lado, es significati- vo que una parte importante de la comunidad Sorda en México se comunica a través de la lsm, y que no sólo los Sordos hacen uso de este idioma, sino también los familiares, intérpretes y las personas que aprenden la lsm por motivación propia. A pesar de la implementación de políticas de inclusión, todavía existen asuntos pen- dientes que, como sociedad, debemos resolver. Uno de ellos está en el contexto educati- vo que afecta todos los niveles. Aunque algunos Sordos logran terminar la universidad y posgrados, los miembros de esta comunidad continúan enfrentando desafíos que afectan sus primeros años de vida, lo cual tiene un impacto negativo en las individualidades y representa una barrera comunicativa. Se estima que cerca del 90% de los niños con discapacidad auditiva nacen en fami- lias oyentes (Mitchell y Karchmer 2004). Esto supone, además de la posible adquisición tardía de un sistema comunicativo, una menor interacción social, la cual limita la acti- vidad lingüística. Caso contrario es el contexto en el cual un infante Sordo experimenta las habilidades comunicativas con los adultos Sordos. Morgan y Botting (2021) indican que en estos contextos impera una comunicación de tipo visogestual, la cual facilita la interacción entre padres e hijos. Los mismos autores indican que la interacción con los progenitores provee el andamiaje a través del cual los niños pueden compartir sus in - tenciones comunicativas, dando las bases necesarias para facilitar la socialización y el desarrollo del lenguaje.  Las lenguas de señas son sistemas lingüísticos de modalidad visogestual que hacen uso del espacio de forma gramatical. En México, casi todos los Sordos usuarios de una llss utilizan la lsm, la cual tiene sus propias reglas sintácticas y gramaticales que difie- ren del español y de otras llss. Se estima que, en México, cerca del 1.2% de la población presenta algún grado de sordera (inegi, 2021), pero no todas las personas con discapa- cidad son señantes de la lsm. En este sentido, Cruz-Aldrete (2021) indica que una de las causas principales de que la comunidad Sorda sea heterogénea lingüísticamente es que no se ha garantizado la adquisición de una primera lengua. Por otro lado, es significati- vo que una parte importante de la comunidad Sorda en México se comunica a través de la lsm, y que no sólo los Sordos hacen uso de este idioma, sino también los familiares, intérpretes y las personas que aprenden la lsm por motivación propia.']","One of the main causes of linguistic heterogeneity within the Deaf community in Mexico is the lack of guaranteed acquisition of a first language. Additionally, despite the implementation of inclusion policies, unresolved issues persist, especially in the educational context, affecting all levels. Many Deaf individuals continue to face challenges impacting their early years, leading to negative impacts on their individualities and creating communication barriers.",single_hop_specifc_query_synthesizer,"['[ 86 ] José Luis Moreno-Vega & Ana Mónica Preciado-Sánchez\nEstudios de Lingüística Aplicada, año 41, número 77, julio de 2023, pp. 85–117\ndoi: 10.22201/enallt.01852647p.2023.77.1059\nAbstract\nLearners more easily notice some lin-\nguistic forms than others. This qua -\nsi-experiment investigates whether the \neffects of explicit-deductive instruc -\ntion and explicit-inductive instruction \nare equally mediated by the perceptual \nsalience level of target forms. It also \nexamines whether each of these types \nof instruction promotes explicit knowl-\nedge, implicit knowledge, or both. The \nstudy was conducted with 65 univer -\nsity students aged 21 years old on av-\nerage. Three conditions were tested: \nexplicit-deductive instruction, explic -\nit-inductive instruction, and a control. \nThe results revealed minor learning \neffects due to explicit-inductive in -\nstruction of a target form with higher \nperceptual salience but no learning for \na less salient target form. Explicit-de -\nductive instruction resulted in learning \nboth forms regardless of their salience \nlevel. The findings suggest that explic-\nit-inductive instruction is suitable for \nteaching more salient forms, while ex-\nplicit-deductive instruction seems nec-\nessary for teaching less salient forms. \nThe pedagogical and theoretical impli-\ncations of these findings are discussed.\nKeywords: explicit instruction; de-\nductive instruction; inductive instruc-\ntion; implicit knowledge; explicit \nknowledge\nResumen\nPara los aprendices, ciertas formas \nlingüísticas sobresalen más que otras. \nEste cuasiexperimento investiga si los \nefectos de la instrucción explícita-de -\nductiva y explícita-inductiva son igual-\nmente afectados por el nivel de sobre \nsaliencia perceptual de las formas lin-\ngüísticas meta, y si cada tipo de ins -\ntrucción promueve el conocimiento ex-\nplícito, implícito o ambos. El estudio \nse llevó a cabo con 65 estudiantes uni-\nversitarios con una edad promedio de \n21 años. Se examinaron tres condicio-\nnes: la instrucción explícita-deductiva, \nla explícita-inductiva y una condición \ncontrol. Los resultados revelan que la \ninstrucción explícita-inductiva gene -\nró un aprendizaje menor en el caso de \nuna forma lingüística meta perceptual-\nmente más sobresaliente, pero no hubo \naprendizaje de la menos sobresaliente. \nLa instrucción explícita-deductiva re -\nsultó en el aprendizaje de ambas for -\nmas independientemente de qué tanto \nsobresalen. Los resultados sugieren \nque la instrucción explicita-inductiva \nes más adecuada para enseñar formas \nmás sobresalientes y la explícita-de -\nductiva para las menos sobresalientes. \nLas implicaciones pedagógicas y teó -\nricas de estos hallazgos son explicadas \na detalle.\nPalabras clave: instrucción explícita; \ninstrucción deductiva; instrucción \ninductiva; conocimiento implícito; \nconocimiento explícito', 'Estudios de Lingüística Aplicada, año 41, número 77, julio de 2023, pp. 85–117\ndoi: 10.22201/enallt.01852647p.2023.77.1059\nCan foreign language learners discover the rules of non-salient forms? [ 111 ]\ncould focus on other target forms that vary in their salience level \nand should ensure that all groups be of similar size.\n7. Limitations\nThis study has some limitations. Although a timed grammaticality \njudgment test was used to assess learners’ implicit knowledge, it \nwould have been helpful to include confi  dence rating tests such as \nthose used by Rebuschat (2013). However, it was not possible to \nimplement them due to time restrictions. Also, having a larger sam-\nple size and giving learners a longer treatment would have been \nbenefi  cial, likely yielding more robust results. Nevertheless, it was \nnot possible because not all the groups in the Foreign Languages \ndepartment were able to participate in the study, and those who did, \nhad limited available time. Also, in the present study, it was not \npossible to determine which of the two factors — typographical \nsalience and the existence of a rule in learner’s L1 and L2 — has \na greater impact in each type of instruction. Future studies may \naddress this aspect by isolating these constructs.\n8. Conclusion\nThe fi  ndings of the present study suggest that explicit-inductive \ninstruction was less effective at enabling learners to determine the \nunderlying rule of a form with low perceptual salience driven by \nbottom-up and top-down processing. Students were more success-\nful at discovering a form with higher salience for being typographi-\ncally different from other forms and governed by a rule available in \nlearners’ L1, such as the preposition by; even then, only very few \nof them did. With forms that lack these characteristics, explicit-de-\nductive instruction is probably necessary. Also, there are instances \nwhen explicit-deductive or explicit-inductive instruction may be \nunnecessary, as some forms do not require the teacher’s interven-\ntion beyond simply providing learners with comprehensible input.', 'La tabla 1 contiene los 79 neologismos referidos a la pandemia que fueron identifi -\ncados en Morfolex y se documentaron entre abril y diciembre de 2020. Las palabras se \npresentan en orden alfabético y se señala tanto el tipo de proceso o afijo que interviene \nen la formación como su número de ocurrencias en la base de datos. \nTabla 1. Neologismos relativos a la pandemia\nNúm. Palabra Ocurrencias Tipo de formación\n1 adenoviral 1 adeno- (glándula)\n2 antibacterial 1 anti-\n3 antichatarra 2 anti-\n4 antichetos 1 anti-\n5 anticoagulación 1 anti-\n6 anticoronavirus 1 anti-\n7 anticovid 2 anti-\n8 anticuarentena 1 anti-\n9 antitrombótico 1 anti-\n10 biodefensa 1 bio-\n11 bioseguridad 1 bio-\n12 cabarezoom 1 N+N\n13 choricel 1 Cruce\n14 conchavirus 1 N+N\n15 conspirólogo 1 -logo\n16 coronabicho 2 N+N\n17 coronabobo 1 N+N\n18 coronabono 1 N+N\n19 coronaburguer 1 N+N\n20 coronacrisis 1 N+N\n21 coronalibro 1 N+N\n22 coronavirulento 1 N+A\n23 coronial 1 Cruce\n24 coronnial 1 Cruce\n25 coviario 1 -ario\n26 covicumpleaños 1 N+N\n27 covidengue 2 Cruce\n10 Ramón ZacaRías Ponce de León\nLM IV-1 \nLingüística Mexicana. Nueva Época, IV (2022), núm. 1: 7-29  \nISSN: 2448-8194', 'La tabla 5 resume los casos hallados en el niño Luis, los cuales visiblemente son \npocos, en comparación con las dos primeras. No obstante, coincide con ellas en los \nresultados de las variables 1 y 2, en cuanto a la casi totalidad de los datos concordan -\ntes. En cambio, las evidencias de las variables 3 y 4 son disímiles en contraste con las \nniñas, porque él apenas logra obtener nueve nominales distribuidos en ambas variables \ny, aunque sí hay discordancias, los ejemplos resultan escasos para ser representativos. \nAsí, los datos de Luis muestran una etapa inicial en donde la concordancia de número \ncorresponde únicamente a la que denominamos superficial.\nTabla 5. Las cuatro variables y la presencia de concordancia y discordancia en Luis\nVistos y analizados los resultados de cada niño, es destacable que las variables 1 y 2 \npresenten porcentajes muy altos de concordancia, y que en las variables 3 y 4 aparezcan \nmás casos discordantes. En el desglose individual, Luis representa un primer momento \nen el que no se muestra algún tipo de análisis en la estructura de sus frases nominales; \nNatalia, al tener los datos más altos de discordancias en la cuarta variable, se coloca en \nun punto intermedio de nuestra propuesta de adquisición de la concordancia de núme -\nro, y Tita, por el periodo de edad próximo a los tres años, ha logrado una concordancia \nde número efectiva. \nEl análisis anterior subraya la necesidad de observar las producciones de los tres \nniños en su desarrollo lingüístico temporal para corroborar las conclusiones obtenidas \na partir de cada tabla. Debido a que la cuarta variable resultó ser la más representativa \npor tratarse de la que presenta la mayor variabilidad en la construcción de una frase \nnominal, es la única que se desglosará en este enfoque particular. \nPara una comprensión óptima de los resultados, cabe aclarar que las gráficas si -\nguientes muestran el número de frecuencias de aparición de cada caso y el orden en \nque las presentamos atiende a nuestra propuesta de adquisición de la concordancia \nde número. Si un mismo nominal tiene tres datos concordantes y dos discordantes,  \nVariable Concordancia Discordancia Ejemplos\n1\nDeterminante con forma única + \nnominal con forma única\n38 (100%) Un dino <dinosaurio>\n(Luis 2:08)\n2\nVarios determinantes con forma única \n+ nominal con forma única\n26 (96%) 1 (4%) E ito <quito> os zapatos\n(Luis 2:03)\n3\nDeterminante con contraste +  \nnominal con contraste\n1 (20%) 4 (80%)\nSu amico\n(Luis 2;07)\nSu amicos\n(Luis 2:07)\n4\nVarios determinantes con contraste + \nnominal con contraste\n2 (50%) 2 (50%)\nU yayó <ratón>\n(Luis 2:02)\nLos latones\n(Luis 2:06)\n108 zuLeykA mAhiTzé oLverA yAbur\nLM II-1 \nLingüística Mexicana. Nueva Época, II (2020), núm. 1: 101-115  \nISSN: 2448-8194']","The article provided does not specifically address challenges faced by the Deaf community in Mexico regarding language acquisition. However, it does discuss language acquisition in the context of second language learners and how different instructional methods affect their learning of linguistic forms.

If you are looking for information on challenges faced by the Deaf community in Mexico regarding language acquisition, it would be best to consult articles or studies specifically focused on Deaf education and sign language acquisition in Mexico. These resources may provide insights into the unique challenges and experiences of the Deaf community in Mexico when it comes to language acquisition."
What are some challenges faced by the Sordos community in terms of language development and communication?,"['A pesar de la implementación de políticas de inclusión, todavía existen asuntos pen- dientes que, como sociedad, debemos resolver. Uno de ellos está en el contexto educati- vo que afecta todos los niveles. Aunque algunos Sordos logran terminar la universidad y posgrados, los miembros de esta comunidad continúan enfrentando desafíos que afectan sus primeros años de vida, lo cual tiene un impacto negativo en las individualidades y representa una barrera comunicativa. Se estima que cerca del 90% de los niños con discapacidad auditiva nacen en fami- lias oyentes (Mitchell y Karchmer 2004). Esto supone, además de la posible adquisición tardía de un sistema comunicativo, una menor interacción social, la cual limita la acti- vidad lingüística. Caso contrario es el contexto en el cual un infante Sordo experimenta las habilidades comunicativas con los adultos Sordos. Morgan y Botting (2021) indican que en estos contextos impera una comunicación de tipo visogestual, la cual facilita la interacción entre padres e hijos. Los mismos autores indican que la interacción con los progenitores provee el andamiaje a través del cual los niños pueden compartir sus in - tenciones comunicativas, dando las bases necesarias para facilitar la socialización y el desarrollo del lenguaje. La imitación como precursora del lenguaje La adquisición del lenguaje se desarrolla a partir de la combinación de factores biológi- cos y de las interacciones con el mundo, las cuales dependen, entre otros, del contexto lingüístico (Carvalho, Lemos y Goulart 2016; Tomasello 2005; Peralta 2000). En un estudio realizado en niños con autismo se encontró que “la imitación gestual y facial, la imitación de posturas de mano no significativas, imitación de acciones con la boca (con y sin sonido), la imitación corporal sencilla y la imitación bocal” pueden ser habilidades precursoras del lenguaje (Mitre 2015). En comparación, existe una considerable litera- tura académica que ha abordado la relación entre habilidades motrices y el lenguaje en diversas poblaciones, incluyendo niños con trastorno específico del lenguaje (tel ). Por ejemplo, Marton (2009) observó que los niños con tel enfrentaban desafíos significa- tivos en la imitación de gestos y posturas, así como en la organización y control de los movimientos del cuerpo. Estos hallazgos respaldan la idea de que las dificultades motri- 51 LM V-2 Lingüística Mexicana. Nueva Época, v (2023), núm. 2: 49-71 ISSN: 2448-8194']","Although some Sordos manage to complete university and postgraduate studies, members of this community continue to face challenges that affect their early years, leading to negative impacts on individualities and creating a communication barrier. Approximately 90% of children with hearing disabilities are born into hearing families, potentially resulting in delayed acquisition of a communicative system and limited social interaction, hindering linguistic activity.",single_hop_specifc_query_synthesizer,"['Entre santos, venados y pascolas\n 119\nLM VII-1\nLingüística Mexicana. Nueva Época, vii (2025), núm. 1\nISSN: 2448-8194\nTabla 4. Tabla de relación edad- si/no hablan la lengua yoremnokki\n Colaborador  ¿Qué personas hablan más seguido el yoremnokki?\n Colaborador 1   Los mayores a veces.\n Colaborador 2  Mi tío, mi abuela y mi mamá.\n Colaborador 3  Los viejitos.\n Colaborador 4  Algunos adultos, tíos, abuelos.\nEn esta tabla 4 se observa cuál es el grupo prototípico de hablantes de yoremnokki, \ny cabe señalar que los lugares en donde se hace presente la lengua son mayoritaria -\nmente de índole religioso. Es importante destacar que el uso de la lengua siempre está \ncondicionado a que haya alguien más que la entienda como interlocutor, aunque no la \nhable, por ello las conversaciones se limitan sólo a adultos, sobre todo a adultos de edad \navanzada.\nEn las notas de diario de campo y mediante la observación se pudo comprobar que \neste fenómeno se debe a que los jóvenes mencionan constantemente que “hay lenguas \nque te dan mejores oportunidades”, lo cual se refleja en la tabla 5.\nTabla 5. El aprendizaje de los idiomas\nColaboradores    ¿Si existieran cursos gratuitos para aprender idiomas cuáles te gustaría aprender?\nColaborador 1    Inglés, para hablar con mi tío.\nColaborador 2    Inglés y yoreme para poder conocer más gente que hable otros idiomas.\nColaborador 3    Inglés.\nColaborador 4    Inglés, francés y ruso; son los idiomas que más me interesan, me van mejor.\nAlgunas de las ideas que los jóvenes repetían constantemente son que se puede ac -\nceder al “éxito” a través de un idioma extranjero y la idea de que aprender español o \nun idioma extranjero es sinónimo de “progreso”; por ejemplo, algunos colaboradores \n(distintos a los que se registran aquí) mencionaron que para poder acceder a estudiar \nse debe hablar español. De esta manera se puede constatar que el aprendizaje de los \nidiomas está ligado estrechamente con su prestigio lingüístico, pues se sabe que un \nidioma de prestigio es hablado por un grupo social que normalmente tiene las mismas \ncualidades positivas que su idioma, en otras palabras, no es sorprendente que el presti-\ngio lingüístico desempeñe un papel fundamental en la formación de actitudes hacia los \nidiomas.\nRespecto al uso del yoremnokki en los medios de comunicación, se pudo atestiguar \nque los jóvenes tienen interés en que se cuente con la presencia de esta lengua en los \nmedios porque cronsideran que así se conocería más. Cabe mencionar que los medios \nde comunicación que se tienen en mente son actuales, más bien digitales, por eso se \nconsidera que valdría la pena rescatar el yoremnokki por estos medios, además de que \nsería una oportunidad de apropiase de espacios y captar otros posibles usuarios de esta \nlengua.', 'Estudios de Lingüística Aplicada, año 39, número 72, enero de 2021, pp. 9–48\ndoi: 10.22201/enallt.01852647p.2021.72.926\n[ 34 ]  Kent Fredholm\nDucar and Schocket (2018) discussed how context-driven levels \nof formality are rendered differently in gt searches from English \nto Spanish or French, stating that gt uses the informal second \nperson singular in Spanish translations of the English you, but the \nformal second person plural in translations to French. In the 3995 \ngt searches analyzed in our study, gt did render the English you\n(both as subject and object) and your, as the Spanish informal tú, \nte, tu and tus in most cases, but exceptions were also found, espe-\ncially concerning the possessive pronouns. When the Swedish du\nwas used, the search results were highly inconsistent, repeatedly \nshowing translations with alternating second person singular and \nthird person singular verbal endings within a few seconds after \neach other. The excerpt shown in Table 9 gives a typical exam-\nple of confusing pronoun search results when Beata looked for \nthe correct translation of dig ‘you’ (2 nd p. sg. dir. obj.). The fi  nal \nscreen outcome shows how she added punctuation to change the \ntranslation.\nTABLE 9. Changing pronouns. Beata: 1\nTIME MARK GT SEARCH GT RESULT\n30’47’’\n‘no-one must decide for you’ ‘no-one must decide about you’\nWrites pienso que de nadie debe decidir sobre in the text, looking four times at the search result.\n31’35’’\n‘you’ [2nd p. sg. obj.] ‘you’ [3rd p. sg. subj.]\n31’39’’\n‘you’ [2nd p. sg. subj.] ‘you’ [3rd p. sg. subj.]\ningen ska bestämma över dig nadie debe decidir sobre ti\n27 / 5000 föreslå en förändring\ndig usted\n3 / 5000 föreslå en förändring\ndu usted\n3 / 5000 föreslå en förändring', '22 Gabriela Mariel Zunino\nEstudios de Lingüística Aplicada, año 37, número 69, julio de 2019, pp. 9–35\ndoi: 10.22201/enallt.01852647p.2019.69.828\nCuadro 1. Ejemplos de completamientos para cada una de las relaciones analizadas\nrelaCión ejemplos Completamiento\nCondicional\nHace tiempo que Damián quería comprar un televisor nuevo. Además, le gusta mucho el fútbol y ya \nllega el mundial. Ahora está a principio de mes y acaba de cobrar… piensa si pagarlo en efectivo \no con tarjeta.\nFinal\nBelén era suplente en su equipo de vóley desde hacía tiempo. Un mes antes de la primera com-\npetencia internacional, empezó a entrenar el doble que sus compañeras… para poder obtener la \ntitularidad dentro del equipo.\nContraste\nRamiro es un alumno promedio de quinto año del secundario. En los próximos meses debe empe-\nzar a pensar qué carrera universitaria seguir. Ninguna materia le gustó especialmente durante la \nsecundaria… pero también pensaba en otras cosas que le gustaban.\nComparativa Los actores se comprometieron con ese plan y trabajaron de sol a sol… tal como estaba previsto.\nComplemento\nManuel tiene problemas de presión muy alta. El médico le indicó que comiera sin sal y le prohibió \ncualquier tipo de fiambre. Todavía sigue comiendo muchas cosas con sal: se resiste a dejar el \njamón crudo y las aceitunas… que traen las pizzas.\n* Vale aclarar que todas las consecutivas, por definición, exhiben un componente temporal, pero no pueden ser consideradas solo como rela-\nciones temporales, ya que, además y especialmente, marcan una relación más específica como la de causa-efecto.\nCuadro 2. Porcentajes de tipos de completamientos totales y por instancia (sobre un total de 300)\nrelaCiones totales (%)\ninstanCia (%)\nPrimera Segunda Final\nEncadenadas 21.5 19.1 18.3 26.6\nÚnicas 78.5 80.7 81.3 73.7\nCausal (C) 9.4 16.2 10.7 0.5\nConsecutiva (C) 36.9 19.5 38.9 53.9\nAdversativa (CC) 32.2 32.4 22.1 43.4\nConcesiva (CC) 1.1 -- 3.3 --\nAditiva 12.2 18.7 16.0 0.9\nTemporal 1.1 1.7 1.6 --\nCondicional 0.1 -- -- 0.5\nFinal 3.1 8.3 0.8 --\nContraste 0.4 -- 0.8 0.5\nComparativa 0.1 3.3 0.4 --\nComplemento 3.0 -- 5.3 --\nc = Dimensión causal\ncc = Dimensión contracausal\n(continuación )', 'Procesamiento de discurso: relaciones semánticas, expectativas del lector y modelos mentales 23\nEstudios de Lingüística Aplicada, año 37, número 69, julio de 2019, pp. 9–35\ndoi: 10.22201/enallt.01852647p.2019.69.828\nCuadro 3. Porcentajes de completamientos dentro de la dimensión causal / contracausales vs. otras relaciones \nsemánticas, totales y por instancia\nrelaCiones totales (%)\ninstanCia (%)\nPrimera Segunda Final\nCausales\n(causales + consecutivas) 58.1 52.4 66.1 55.6\nContracausales\n(adversativas + concesivas) 41.9 47.6 33.9 44.4\nCausalidad global\n(causales + contracausales) 79.8 68.0 75.0 98.2\nOtras 20.02 32.0 25.0 1.8\nCuadro 4. Porcentajes de completamientos sin partícula conectiva presente (s / C) vs. con partícu-\nla conectiva presente (c / C) por tipo de relación semántica en dos primeras instancias\nrelaCiones\ntotales (%)\nc / C s / C\nCausal 80.0 20.0\nConsecutiva 67.6 32.4\nAdversativa 87.9 12.1\nConcesiva 100.0 ---\nAditiva 40.5 59.5\nTemporal 75.0 25.0\nFinal 95.0 4.5\nContraste 100.0 ---\nComparativa 100.0 ---\nPara el tratamiento estadístico, se procedió a realizar la transformación logística \nde los datos de frecuencias (proporción o porcentaje) requerida para poder llevar \nadelante de modo adecuado las pruebas de comparación de medias (Jaeger, 2008; \nWoods, Fletcher & Hughes, 1996). Así, se calculó un coeficiente para cada varia-\nble de interés por sujeto (por ejemplo, número de completamientos causales sobre \ncantidad de completamientos totales), siempre sobre los casos de continuaciones \ncon relación única. Se computaron los datos de frecuencias totales y por instancia \nde completamiento.', 'Primeras configuraciones manuales en niños sordos en edad escolar\nDurante su primer año, los infantes Sordos ya comienzan a copiar personajes, ani-\nmales y personas. Adicionalmente, las señas que realizan tienden a utilizar las partes \nmás próximas al cuerpo antes que las extremidades (Meier 2012: 590). Posteriormente, \na los dos años, los niños Sordos registran un cambio en cuanto a la forma de realizar las \nconfiguraciones de mano al corregirlas, ya sea de manera autodirigida o mediante las \nindicaciones. \nMamá Lía explica que su hijo comenzó a esa edad a corregir algunas configuraciones \nde la mano al tiempo que comenzó a producir términos de parentesco. \nAntes, mi bebé Sordo [decía] papá (cm : v)\n6 que cambió por papá ( cm: p). A los \ndos años le dije que se hacía con <p>, no <v>, y lo entendió. Otras señas que \ntambién comenzó a entender fueron ‘mamá’, ‘abuela’, ‘tío’, ‘prima’. \nMamá Olé nos cuenta que una de las primeras señas que produjo su hija fue la que \ncorresponde a ‘perdón’, pero no la realizaba con la cm <y>, como lo hacen los adultos, \nsino que la realizaba con la cm <s>, la cual es la no marcada en términos articula -\ntorios. Este proceso también se registra en la lengua de señas americana ( asl, por sus \nsiglas en inglés), donde la cm <y> es posterior en términos cronológicos a la cm <s> \n(Lillo-Martin et al. 2020: 97).\nEn este estudio registramos que las primeras cm que adquieren los infantes Sordos \nen la lsm suelen corresponder a <b>, <s> y <v>\n7 del alfabeto dactilológico8. Pos-\nteriormente adoptarán formas más complejas como <m>, <t> y <p>. Estas últimas \nconfiguraciones se comienzan a producir a los 24 meses de edad, y algunas de éstas \nsuelen reemplazar las formas no marcadas.\xa0 \nEn un estudio de adquisición de la lsm en infantes de una primaria bilingüe lsm-es-\npañol, Cruz-Aldrete (2018) dio cuenta de que el 30% de las señas producidas por niños \nincluyeron las cm que corresponden a <b>, <s> y <d>\n9. De hecho, las dos primeras \ncm son coincidentes con las que reportan las mamás Sordas que entrevistamos como \nprimeras producciones de sus hijos. \nAlgunas de las primeras señas que realizan los infantes Sordos suelen ser términos \nde parentesco como ‘mamá’, ‘tío’ y ‘papá’, que en lsm son inicializadas, es decir, se \nrealizan con una letra en el alfabeto dactilológico de la lsm. Sin embargo, las primeras \nproducciones de los infantes Sordos no necesariamente corresponden a la convención \n6\u2009La nomenclatura hace referencia a cm=Configuración Manual. En este caso corresponde a la \nletra <v>  del alfabeto dactilológico de la lsm. Ésta y las demás cm se presentan en el anexo. \n7\u2009Estas cm también se han descrito de baja complejidad, por lo tanto, son de las primeras que se \nproducen desde un punto de vista articulatorio (Brentari 2012: 41). \n8\u2009El alfabeto dactilológico de la lsm incluye todas las configuraciones manuales que tiene el alfa-\nbeto del español y se usa en situaciones de contacto lingüístico para deletrear préstamos lingüísticos \ny nombres. Sin embargo, la lsm tiene una mayor cantidad de configuraciones manuales.\n9\u2009La cm <1> corresponde a la seña que hemos advertido; se utiliza para señalar al referente y \nacompaña frases nominales en las primeras producciones infantiles.\n57\nLM V-2\nLingüística Mexicana. Nueva Época, v (2023), núm. 2: 49-71\nISSN: 2448-8194', 'Las funciones de incluso en La historia deL españoL\nTabla 3. Distribución funcional de incluso en el corde\nLa tendencia general que muestran estas cifras es que, mientras disminuye el por -\ncentaje de casos participiales, aumentan de manera progresiva los casos de partícula, \ncon ellos, los limítrofes. Hasta el siglo xv domina de manera contundente la función \nparticipial heredada del latín (90.91%) (7); en tanto que los casos donde funciona como \npartícula (8) son incipientes (9.09%).\n(7)\na. La qual cosa obtenida et impetrada del senado, como la batalla fuesse començada \net el padre subitament huuiesse visto a su fillo el consul combatiendo estar cir -\ncundado et incluso / incluido en medio de los enemigos por Poncio, duc de los \nsannites \n(Traducción de la Historia contra paganos, de Orosio 1376-1396)\nb. Más dize a Eolo, que reine en la cueva çerrada de sus vientos, casi diziendo que \nse esté incluso / incluido en la posibilidat e potençia del franco alvedrío \n(Traducción y glosas de la Eneida 1427-1428)\n(8)\na. Los Reyes Católicos encomiendan al licenciado Gutierre Velázquez de Cuéllar que \ndetermine qué parte de la dehesa de Arévalo debe reservarse para los ganados de \nlos carniceros de la villa y para los caballos y animales de labor de los regidores \nde la misma, quedando el resto para aprovechamiento de los vecinos, a los que \ndesde hacía tiempo se les vedaba incluso / ??incluido / hasta el paso y por esta \nfalta de pastos nadie quería venir a vivir en Arévalo \n(Documentación medieval abulense en el Registro General del Sello 1485-1488)\nSiglo Número de \ncasos Participio % Limítrofe % Partícula %\nxiv 1 1/ 100 - - - -\nxv 22 20/ 90.91 - - 2/ 9.09\nxvi 33 21/ 63.64 3/ 9.09 9/ 27.27\nxvii 55 43/ 78.18 4/ 7.27 8/ 14.55\nxviii 85 31/ 36.47 26/ 30.59 28/ 32.94\nxix 392 25/ 6.38 159/ 40.56 208/ 53.06\nxx 5891 5/ 0.08 66/ 1.12 5820/ 98.8\n165\nLM II-2\nLingüística Mexicana. Nueva Época, II (2020), núm. 2: 157-181\nISSN: 2448-8194', '53\nsible to imagine cases where both types of ad-\nverbs would appear. For example, in questions \nasked by a lawyer to a defendant or witness in \ncourt. Consider the following:\n(114) Lei probabilmente conosceva la vit- \ntima?\n(115) Lei, evidentemente, non era sul \nposto in quel momento?\nThe functions of these adverbs would appear to \nbe the same as in (113), in fact in this type \nof ""conducive"" question what the speaker is \ndoing in reality is asserting something to in-\nfluence the addressee and the hearers and doing \nso in a way that cannot be openly recognised. \nIn fact I think that modal adverbs can appear, \nfor the same reason in tag-questions:\n(116) Probabilmente partirai, non e’ ve- \nro?\nWhether these questions are true questions or \nnot is not of concern here 13, what is important \nhere is that they exhibit a different kind of \nneustic from that of ""normal"" questions, and \nwhich could be described as a mixed neustic be- \ntween statement and question.\nModal Adverbs in Commands and Request\nIt was said at the beginning that modal ad-\n13- But see Cornulier (1982) on the critique of \nan ""innocent” view of questions that tends \nto consider that the normal attitude of the \nspeaker in a question is that of not know-\ning the answer, ""Sur le sens des questions \ntotales et alternatives"", Langages, 1982,  \nn. 67, pp. 55-109.', 'presencia porcentual; éstos también presentan un incremento considerable con respecto \na los siglos anteriores. Por último, la función participial (6.38%) presenta una aguda \ndisminución con respecto a los siglos anteriores y su presencia ha perdido casi por com-\npleto la representatividad. En este periodo, la competencia que representan los casos \nlimítrofes puede interpretarse como un indicador de la persistencia ( vid. Hopper 1991: \n28) del significado original en los contextos originales, pues se trata mayoritariamente \nde casos donde incluso predica sobre ffnn y codifica inclusión simple (10).\n(10)\na. publicó el mismo año la instrucción en que pretendía que el Gobierno en todos \nsus ramos, incluso / incluido / hasta el de Guerra, estuviese en una Junta sere-\nnísima compuesta de individuos electos por los Ayuntamientos\n(Informe sobre los movimientos revolucionarios de San Salvador 1814)\nb. No es mercantil la venta de cerdos á un Tablajero. (S. 4 Oct. 904). Es competente \npara conocer de todos los incidentes que se promuevan con motivo de un con -\ntrato de esta clase, incluso / incluido el pago de cantidad no debida por el com-\nprador, el Juez A quien correspondería conocer si la acción ejercitada derivase \ndirectamente del contrato\n(Código de comercio 1885)\nEn el siglo xx la distribución es casi inversamente proporcional a la de los primeros \nsiglos. Los casos de partícula (98.8%) son dominantes, lo que indica que el cambio se \nconcluye en este periodo. Los casos limítrofes (1.12%) tienen una representatividad \nnula que se traduce en el éxito de la fuerza innovadora de los siglos anteriores, la cual \npor fin se ha concretado 500 años después del inicio del cambio. Por último, la función \nparticipial (0.08%) se puede considerar desaparecida, pues su presencia se restringe a \nregistros cultos, como el ensayo de corte filosófico y literario (11a) y géneros legales \no administrativos (11b), que tienden a retener usos considerados anacrónicos como \ntecnicismos. Esto se refuerza con el hecho de que no se identifican casos participiales \nposteriores a 1950.\n(11)\na. Nada nos impide entrar en este aposento: podríamos respirar en su atmósfera y \ntocar a los presentes en el hombro, pues son de nuestro mismo tejido y condición. \nSin embargo, este aposento está a su vez incluso en un libro, es decir, en otro \ncomo retablo más amplio que el primero \n(Meditaciones del Quijote, de José Ortega y Gasset 1914)\n b. Tiene esta especial legislación por principal estatuto el Decreto-ley de 29 de Di -\nciembre de 1868, y aunque otra cosa se podría inferir por la aislada lectura de su \n168 Glenda zoé lizárraGa navarro\nLM II-2 \nLingüística Mexicana. Nueva Época, II (2020), núm. 2: 157-181  \nISSN: 2448-8194']","The Sordos community faces challenges in language development and communication due to various factors. Some of these challenges include:

1. **Delayed Language Acquisition:** Children who are Deaf may experience delays in language acquisition, especially if they are not exposed to sign language early in life. This delay can impact their overall communication skills and academic performance.

2. **Limited Access to Language Input:** Some Deaf individuals may not have access to a fully developed sign language system, which can hinder their language development. Limited exposure to a rich linguistic environment can affect their ability to express themselves effectively.

3. **Educational Barriers:** Deaf children may face challenges in accessing quality education that meets their linguistic and communication needs. Inadequate support for sign language instruction and communication access in schools can impact their academic success.

4. **Social Isolation:** Communication barriers can lead to social isolation for Deaf individuals. Limited access to communication tools and lack of awareness about Deaf culture and sign language can create barriers in social interactions and relationships.

5. **Stigma and Discrimination:** Negative attitudes towards sign languages and Deaf culture can contribute to stigma and discrimination. This can affect the self-esteem and mental well-being of Deaf individuals, impacting their communication and language development.

6. **Limited Resources:** Deaf communities may face challenges in accessing resources such as qualified interpreters, assistive technologies, and educational materials in sign language. Limited resources can hinder their ability to fully participate in various aspects of life.

Addressing these challenges requires a holistic approach that includes promoting sign language education, improving access to communication services, raising awareness about Deaf culture, and advocating for the rights of Deaf individuals to ensure inclusive and accessible communication environments."
What is the significance of Cruz-Aldrete in the context of language development?,"['Primeras configuraciones manuales en niños sordos en edad escolar nificado deseado; también están influenciadas por factores como la maduración motora y la práctica. A medida que se adquiere experiencia y habilidad en la llss, la capacidad para realizar praxias se vuelve más fluida y precisa. Sin embargo, este concepto no se debe confundir con configuración manual (cm), que se refiere a la posición y forma que adoptan uno o ambos articuladores manuales (Callejas 2019). Más específicamente, im- plica el movimiento o inhibición 4 de los articuladores de la mano. Las primeras cm que producirá un niño Sordo son predecibles, pues coordinan en conjunto todos los dedos de la mano antes de producir otras formas que seleccionan específicamente uno o varios dedos. La precisión en la selección y dominio de arti- culadores de la mano se incrementa con la edad y con la apropiación del vocabulario (Cruz-Aldrete 2016), aunado a un mayor uso de la gesticulación y del espacio señante, lo que convergerá en una mayor complejidad al ejecutar las cm. Aunque praxia y cm son conceptos distintos, existe una significativa superposición entre ellos en términos de sus contribuciones motoras y el papel de ambos en el proce- samiento del lenguaje, y, particularmente, en las llss. Primero, tanto las praxias como la cm implican precisión en la coordinación motora fina. Ambos procesos requieren la coordinación de movimientos específicos para lograr una comunicación efectiva. Par- ticularmente, la cm se vuelve especialmente relevante en las llss, donde la forma y posición de las manos y los dedos representan unidades lingüísticas, que conforman la estructura discursiva. Por otro lado, tanto las praxias como la cm implican una alta inte- gración perceptual (Lai et al. 1996). En las praxias se requiere la integración precisa de la retroalimentación sensorial para monitorear y ajustar los movimientos motores con el fin de lograr la precisión y la corrección. Del mismo modo, la cm se basa en la inte- gración de información visual y propioceptiva para garantizar la formación y posición adecuadas de las manos y los dedos. Contexto ideal para adquirir una lengua visogestual Si bien la situación lingüística de los Sordos que se desarrollan en el contexto de una familia oyente no suele ser favorable debido a la ausencia de un idioma de modalidad visogestual, si un Sordo desarrolla su infancia temprana con usuarios de una llss la situación es radicalmente distinta, pues adquirirá un idioma natural en sus primeros años de vida. Sin embargo es común encontrar que los padres oyentes no suelen utilizar una llss en el contexto hogareño, a pesar de que los primeros cuatro años de vida son significativos para la adquisición (Cerdas y Murillo 2017), y es el periodo en el cual la imitación cobra un papel especial para el desarrollo del lenguaje, la socialización y las habilidades motrices. 4 La inhibición motora se refiere al proceso en el cual ciertas acciones son suprimidas, lo que permite la selección y ejecución de movimientos específicos. Lo anterior es crucial para refinar la conducta motriz porque asegura su precisión y coordinación. 53']","Cruz-Aldrete (2016) highlights the importance of hand articulator mastery and vocabulary acquisition in sign language users. It emphasizes the progression from basic manual configurations to more complex ones, influenced by age and language proficiency. The concept distinguishes between manual configurations and praxias, both crucial for fine motor coordination and effective communication, especially in sign language structures.",single_hop_specifc_query_synthesizer,"['Las funciones de incluso en La historia deL españoL\nb. Toda la servidumbre de D. Francisco, *tan incluso la peonada, que era numerosa, \nle llamaban á Chucho\xa0el niño \n(Chucho el ninfo 1871)\nAdemás de los casos en que funciona como participio o como partícula, identifico \notros aquí denominados limítrofes, donde no es posible determinar si su función es par -\nticipial o de partícula. Corresponden a ocurrencias donde incluso establece relaciones \nsintagmáticas con ffnn de número singular y género masculino, por lo que la concor -\ndancia característica del participio se ve neutralizada, como se muestra en (4). \n(4)\na. Estiéndanse los límites del señorío de la Iglesia de la otra parte del Apenino hasta \nel mar Adriático, llegando al río Pescara, y destotra al río Garellano, incluso / \nincluido / hasta gran pedazo del Abruzo y de Campania \n(Historia de Felipe II, Rey de España 1619)\nb. En el caso del párrafo primero del artículo anterior, si estuviera asegurada la \nfinca. el valor del seguro quedará afecto al pago del capital del censo y de las \npensiones vencidas, á no ser que el censatario prefiera invertirlo en reedificar la \nfinca, en cuyo caso revivirá el censo con todos sus efectos, incluso / incluido / \nhasta el pago de las pensiones no satisfechas \n(Código Civil 1889)\nLa neutralización de la concordancia de incluso con la fn dificulta su clasificación \ncomo participio o como partícula. Esto va a acompañado de una ambigüedad también \nde carácter funcional que se ilustra con la conmutación tanto por el participio analógi -\nco incluido como por la preposición hasta. Como partícula o como participio, los casos \nlimítrofes como los de (4) tienen en común el significado de inclusión que codifica esta \nunidad. De esta manera, la ambigüedad de estos casos no es sólo formal, sino también \nfuncional.\nEl segundo parámetro es la función gramatical: de acuerdo con la categoría a la que \npertenezca incluso, puede corresponder a una función participial o de partícula. Como \npartícula puede funcionar como marcador de foco –de inclusión, escalar o de concesivi-\ndad– o como marcador discursivo. En (5) ejemplifico las distintas funciones adverbiales \nde incluso como partícula. Como criterio explicativo, lo reemplazo por elementos típicos \nde la función que se ejemplifica. En (5a) funciona como una partícula de inclusión sim-\nple que indica que el elemento bajo su alcance –sargentos, cabos y tambores– pertenecen \na un dominio –un batallón–. El criterio para identificar esta función es el reemplazo por \nel participio adjetival incluido, que ha de concordar en género y número (masculino y \nplural) con el elemento modificado. \n161\nLM II-2\nLingüística Mexicana. Nueva Época, II (2020), núm. 2: 157-181\nISSN: 2448-8194', 'En la tabla 1 presento la frecuencia absoluta por siglo y por periodo. Para obtener \nla frecuencia relativa consideré que el corde consta de 125 millones de palabras, cifra \naproximada de acuerdo con la última actualización del corpus ( vid. rae [en línea]). \nAsí, se observa un paulatino pero constante aumento de frecuencia a través de los si -\nglos, que es moderado hasta el siglo xviii y más notorio en el xix, mientras que en el \nxx se pierde por completo la proporción moderada de incremento. Éste se refleja en la \nfrecuencia relativa por periodo, que en la última etapa se eleva en más de 50 puntos. \nPara obtener un panorama más claro de la frecuencia de uso de incluso, contabilicé \nel número de ocurrencias en proporción con el porcentaje de palabras que destina el \ncorpus a cada periodo histórico de la lengua4 (vid. rae [en línea]). Resumo estos resul-\ntados en la tabla 2.\nTabla 2. Frecuencia de aparición por periodo histórico de la lengua en el corde\nEn comparación con la tabla 1, los resultados de la tabla 2 permiten dar cuenta de \nmanera más clara de la representatividad de incluso en el corpus. Se mantiene el aumen-\nto progresivo en la frecuencia de uso, pero la representatividad por periodo es mayor: \nen el primer periodo la frecuencia aumenta 0.7 puntos con respecto a la proporción del \ncorpus en general; durante los Siglos de Oro el aumento es de 1.8 puntos, y en los dos \núltimos siglos el aumento es más prominente, con un total de 48.6 puntos arriba.\nEn cuanto a las funciones que desempeña en la lengua, contabilicé los casos por \ncada siglo en que esta unidad léxica funciona como participio y aquellos en que funcio-\nna como partícula; además de los casos limítrofes. Resumo los resultados en la tabla 3.\n4\u2009Aunque el análisis de las ocurrencias se hará por siglo, las frecuencias relativas se han calculado por periodo \nhistórico, dado que el corpus no proporciona la cantidad de palabras que corresponde a cada siglo.\nPeriodo histórico Siglo Millones de palabras  \npor periodo\nFrecuencia de \naparición\nFrecuencia relativa por \nmillón de palabras por \nperiodo\nOrígenes-Edad Me-\ndia (1492)\nxiv\nxv\n25,950,000\n(21%) 23 0.9\nSiglos de Oro \n(1493-1713)\nxvi\nxvii\n35,075,000\n(28%) 88 2.5\nEtapa moderna \n(1714-1980)\nxviii\nxix\nxx\n63,975,000\n(51%) 6,368 99.5\n164 Glenda zoé lizárraGa navarro\nLM II-2 \nLingüística Mexicana. Nueva Época, II (2020), núm. 2: 157-181  \nISSN: 2448-8194', 'presencia porcentual; éstos también presentan un incremento considerable con respecto \na los siglos anteriores. Por último, la función participial (6.38%) presenta una aguda \ndisminución con respecto a los siglos anteriores y su presencia ha perdido casi por com-\npleto la representatividad. En este periodo, la competencia que representan los casos \nlimítrofes puede interpretarse como un indicador de la persistencia ( vid. Hopper 1991: \n28) del significado original en los contextos originales, pues se trata mayoritariamente \nde casos donde incluso predica sobre ffnn y codifica inclusión simple (10).\n(10)\na. publicó el mismo año la instrucción en que pretendía que el Gobierno en todos \nsus ramos, incluso / incluido / hasta el de Guerra, estuviese en una Junta sere-\nnísima compuesta de individuos electos por los Ayuntamientos\n(Informe sobre los movimientos revolucionarios de San Salvador 1814)\nb. No es mercantil la venta de cerdos á un Tablajero. (S. 4 Oct. 904). Es competente \npara conocer de todos los incidentes que se promuevan con motivo de un con -\ntrato de esta clase, incluso / incluido el pago de cantidad no debida por el com-\nprador, el Juez A quien correspondería conocer si la acción ejercitada derivase \ndirectamente del contrato\n(Código de comercio 1885)\nEn el siglo xx la distribución es casi inversamente proporcional a la de los primeros \nsiglos. Los casos de partícula (98.8%) son dominantes, lo que indica que el cambio se \nconcluye en este periodo. Los casos limítrofes (1.12%) tienen una representatividad \nnula que se traduce en el éxito de la fuerza innovadora de los siglos anteriores, la cual \npor fin se ha concretado 500 años después del inicio del cambio. Por último, la función \nparticipial (0.08%) se puede considerar desaparecida, pues su presencia se restringe a \nregistros cultos, como el ensayo de corte filosófico y literario (11a) y géneros legales \no administrativos (11b), que tienden a retener usos considerados anacrónicos como \ntecnicismos. Esto se refuerza con el hecho de que no se identifican casos participiales \nposteriores a 1950.\n(11)\na. Nada nos impide entrar en este aposento: podríamos respirar en su atmósfera y \ntocar a los presentes en el hombro, pues son de nuestro mismo tejido y condición. \nSin embargo, este aposento está a su vez incluso en un libro, es decir, en otro \ncomo retablo más amplio que el primero \n(Meditaciones del Quijote, de José Ortega y Gasset 1914)\n b. Tiene esta especial legislación por principal estatuto el Decreto-ley de 29 de Di -\nciembre de 1868, y aunque otra cosa se podría inferir por la aislada lectura de su \n168 Glenda zoé lizárraGa navarro\nLM II-2 \nLingüística Mexicana. Nueva Época, II (2020), núm. 2: 157-181  \nISSN: 2448-8194', 'Estudios de Lingüística Aplicada, año 42, número 79, julio de 2024, pp. 71–109\ndoi: 10.22201/enallt.01852647p.2024.79.1096\nUso de los tiempos verbales en narraciones infantiles [ 95 ]\n1991; Sebastián & Slobin, 1994; Couto Ríos, 2014), a partir del \nprograma computacional Cuentos de la plaza (Benoit Ríos, 2013) \ny de experiencia personal (Tolchinsky, 2014), presentan coinciden-\ncias en uno o dos grupos etarios de los considerados en los corpora \nanalizados en la presente investigación.\nEn primer lugar, pareciera que los participantes de cinco años \npueden narrar las historias en presente o pasado, dependiendo de \nsu lugar de origen. Por este motivo, el tiempo dominante del es-\ntudio realizado por Couto Ríos (2014) con mexicanos de cinco \naños coincide con el de la presente investigación. En cuanto a los \nparticipantes de siete años, es notoria la preferencia por el pretéri-\nto tanto en los datos de este estudio como en los revisados en los \nantecedentes (Bayley et al., 1998; Benoit-Ríos, 2013). En los re-\nsultados del grupo de niños de nueve años, no parece haber un úni-\nco tiempo dominante (Sebastián, 1991; Sebastián & Slobin, 1994; \nHess Zimmerman, 2003; Couto Ríos, 2014; Tolchinsky, 2014). \nEsto podría deberse a que los participantes van defi  niendo progresi-\nvamente el estilo en que narran la historia.\nExiste la posibilidad de que la variante dialectal infl  uya en si \nel tiempo dominante es el presente o el pretérito, pues únicamente \nen las narraciones recolectadas en Madrid (Sebastián, 1991) y en \nChile (Benoit-Ríos, 2013) de niños de cinco años domina el pre-\nsente. Sin embargo, también es probable que infl  uya la época en \nque se recolectaron las narraciones, pues en aquellas recolectadas \nen Andalucía por Tolchinsky en 2014 domina el pretérito. A su vez, \naunque los participantes de Sebastián (1991), Sebastián y Slobin \n(1994) y Tolchinsky (2014) son españoles, es necesario señalar que \nhay más de veinte años de diferencia entre las primeras investiga-\nciones y la última.\nPor otro lado, únicamente tres de las investigaciones revisadas \nincluyen datos de la estructura narrativa: Hess Zimmermann (2003), \nAravena Reyes (2010) y Tolchinsky (2014). En particular, Hess \nZimmermann (2003) incluye corpora elicitado a partir de comple-\ntar una historia y narraciones personales, sin embargo, la manera \nde clasifi  car es distinta a la llevada a cabo en esta investigación.', 'Señas que expresan eventos \ndel tipo romper en Lengua  \nde Señas Mexicana (lsm)\nSigns encoding breaking events  \nin Mexican Sign Language ( lsm)\nRecepción del artículo: 19 de marzo de 2021\nVersión revisada: 8 de julio 2021\nAceptación: 24 de agosto del 2021\ndoi: 10.22201/enallt.01852647p.2022.74.996\nHéctor Rodolfo Montaño Juárez\nUniversidad Nacional Autónoma de \nMéxico, Posgrado en Lingüística\nhmontano94@yahoo.com.mx', 'Las funciones de incluso en La historia deL españoL\nreanálisis, que es abrupto5. Esto se ve reforzado por el peso porcentual de la función de \npartícula (27.27%), que comienza a ganar terreno sobre la función participial dominan-\nte (63.64%) y por la aparición de casos limítrofes (9.09%), ausentes en el siglo anterior. \nSegún Bybee (2004), la frecuencia es uno de los principales factores que contribuyen a \nla gramaticalización, de manera que el aumento en la frecuencia de aparición de incluso \nrefuerza la idea de que la extensión del cambio comenzó en el siglo xvi y que involucra \ngramaticalización, como mostraré más adelante.\nEn el siglo xvii prevalece la misma tendencia; esto es, domina la función participial \n(78.18%) con un aumento de casi el 20% con respecto al siglo anterior (63.63%). Esta \nfunción va seguida por la función de partícula (14.55%), que disminuyó casi en el 50% \nen contraste con el siglo anterior, lo mismo que los casos limítrofes, que presentan una \nligera disminución menor al 2%. Tanto en el siglo xvi como en el xvii, los casos limítro-\nfes desempeñan un papel fundamental en la explicación del cambio, pues pueden ser un \nindicador de dos fuerzas direccionales en competencia; por una parte, la permanencia \nde una función que ha prevalecido por siglos y, por otra, la generalización de una nueva \nfunción muy cercana en significado que busca ganar terreno en el uso. \nLos porcentajes en conjunto con las frecuencias relativas de la tabla 2 indican que \nla tendencia del cambio no era clara en un principio (siglos xvi-xvii): en el siglo xvi \naumentan los contextos de partícula y disminuyen los participiales, pero en el siglo xvii, \ncontrario a lo esperado, aumentan los segundos, mientras que disminuyen los primeros. \nEn los siglos subsecuentes la tendencia del cambio se estabiliza y se percibe de manera \nmás clara.\nEn el siglo xviii, la función participial (36.47%) sigue teniendo mayor representativi-\ndad porcentual, pero con una diferencia casi nula con respecto a la función de partícula \n(32.94%) y a los casos limítrofes (30.59%). En otras palabras, se nota una disminución \nconsiderable de la función participial que empieza a ser desplazada por la función de \npartícula, la cual ha ganado representatividad en su uso, mientras que el aumento por -\ncentual de los casos limítrofes parece reforzar el señalamiento de que en ellos coexisten \ndos fuerzas en competencia (la permanencia y la innovación), y de que el cambio opera \nde manera gradual.\nEn los siglos xix y xx se revierte la proporción que estaba presente en los siglos \nanteriores, pues ahora predomina la función de partícula en ambos siglos, y la función \nparticipial es residual. En el siglo xix la función de partícula constituye poco más de la \nmitad de las ocurrencias (53.06%) y muestra un aumento considerable en relación con \nlos siglos anteriores. Los casos limítrofes (40.56%) son la segunda instancia con mayor \n5\u2009Adopto la definición de reanálisis de Harris y Campbell (1995: 61): “Reanalysis is a mechanism which changes \nthe underlying structure of a syntactic pattern and which does not involve any modification of its surface manifesta-\ntion”. De acuerdo con esta definición, Campbell (2001:141) señala que “reanalysis depends on the possibility of more \nthan one analysis of a given construction becoming available”, y de esta manera, no cabe la posibilidad de análisis \nintermedios entre una estructura y otra, por lo que el reanálisis es abrupto. En cambio, la extensión, de acuerdo con \nHarris y Campbell (1995), es gradual en cuanto que, como apunta Campbell (2001: 142), “results in changes in sur-\nface manifestation, but does not involve immediate modification of underlying structure”.\n167\nLM II-2\nLingüística Mexicana. Nueva Época, II (2020), núm. 2: 157-181\nISSN: 2448-8194']","In the provided context about the functions of ""incluso"" in Spanish, there is no mention of Cruz-Aldrete. Therefore, there is no direct significance of Cruz-Aldrete in the context of language development discussed in the text. If you have any other questions or need further clarification, feel free to ask!"
What is the significance of Shanghai in the context of bilingual language assessment research?,"['En el cuadro se observa que, en la primera prueba, algunos niños tuvieron difi - cultad para ejecutar las praxias, particularmente aquéllos con un menor nivel de la lsm. En la primera ocasión, la media fue de ± 8.84 para la mano dominante, y de ± 8.33 para la mano no dominante. Lo anterior quiere decir que los niños pudieron hacer alrededor de 8 praxias correctas de las 12 que se les presentaron. En estos primeros datos obtenidos se observó que los niños que imitaron mejor las formas de mano fueron aquéllos que tenían un mejor nivel de lsm, ya sea porque su familia es Sorda y tienen como lengua materna la llss, o bien, porque su familia, particu- larmente la madre, es usuaria de la lengua de señas y puede comunicarse de esta manera con el niño. En general, la segunda vez que se aplicó la prueba, los resultados fueron mejores para todos los participantes, mostrando una media de ±10.57 para la mano dominante y ±10.52 para la mano no dominante. Esto quiere decir que, en promedio, casi todos los participantes pudieron hacer alrededor de 10 de las 12 praxias correctas para cada mano. Una explicación que justifica este resultado puede ser el tiempo de uso de la lsm en el contexto escolar, pues la imitación juega un papel fundamental en la adquisición, tal como lo hemos expuesto. Sin embargo, también se deben considerar los casos en los cuales algunos infantes mostraron dificultades motrices asociadas con la falta de habilidad para representar estrategias de ejecución motriz (Gheysen y Van Waelvelde 2008) al igual que la posible falta de autoconfianza para explorar su entorno debido a una menor comprensión de las instrucciones u otra información asociada a las activi - dades motrices. En la producción de praxias observamos que los niños Sordos adaptaron las cm que son similares a algunas de la lsm realizando sólo las que ya conocen y producen cotidianamente y discriminando aquellas que no corresponden a su sistema lingüís - tico. Resaltan dos praxias, una en la que todos los dedos están extendidos y el dedo medio se cruza sobre el anular, la cual, a pesar de ser una praxia radicalmente distinta a la cm <r> de la lsm, los participantes la produjeron utilizando la <r> del alfa- beto dactilológico en lugar de la praxia presentada. En la segunda praxia que resalta, todos los dedos se mantienen inactivos y el pulgar se inserta entre los dedos medio y anular, pero los chicos la produjeron con la cm <t> de la lsm. Ambas se muestran en el cuadro 6. De acuerdo con el trabajo de Bhat et al. (2018: 237), en cada etapa de la adqui - sición, los niños practican fingerspelling ‘deletreo manual’, el cual “requiere de un alto nivel de control motor fino e involucra una secuencia fluida de unidades en movimiento que tienen una o más formas de mano relacionadas entre sí” (Padden y Le Master 1985). Si bien el deletreo está presente en la vida escolar y los alumnos tienen que deletrear su nombre cuando se presentan con otras personas, una expli - cación para que esta tarea no haya sido exitosa puede ser que se trata de secuencias que alternan rasgos abstractos de las señas, es decir, secuencias que no tienen refe- rentes semánticos, por lo tanto, los niños Sordos en esta etapa de la adquisición las discriminan. 62']",There is no information related to Shanghai in the provided context.,single_hop_specifc_query_synthesizer,"['Estudios de Lingüística Aplicada, año 43, número 80, enero de 2025, pp. 7–48\ndoi:10.22201/enallt.01852647p.2025.80.1097\nSistema judicial y lengua vasca en España: una glotofobia persistente [ 25 ]\nuna presunción de conocimiento de la lengua de Cervantes (Parla-\nmento Vasco, 2023: 5).\nNo obstante, dicho Tribunal precisa que la declaración de coo-\nfi  cialidad implica “la obligación de facilitar, por parte de los pode-\nres públicos competentes, el conocimiento de la lengua [vasca] y, \nen este sentido, ofi  cialidad signifi  ca enseñanza de la lengua [pro-\npia] y posibilidad correlativa de acceso a su conocimiento” (Par-\nlamento Vasco, 2023: 5). A su vez, la Ley Orgánica 1/1990, de 3 \nde octubre, de Ordenación General del Sistema Educativo (boe, \n1990a), que regula en todo el Estado español la ordenación del \nsistema educativo,\nestablece de forma pormenorizada la capacitación en las len-\nguas ofi  ciales que deben conseguir los alumnos en cada uno de \nlos niveles de enseñanza, fi  jando siempre un nivel de capaci-\ntación igual para las lenguas propias de las Comunidades Au-\ntónomas y para el castellano. Por consiguiente [en teoría] en \nlas Comunidades Autónomas con régimen de doble ofi  cialidad \nlingüística, los alumnos que superen la enseñanza obligatoria \nhabrán acreditado los conocimientos requeridos tanto de la len-\ngua castellana como de la lengua ofi  cial propia de la Comuni-\ndad Autónoma (Parlamento Vasco, 2023: 6).\nSin embargo, el Diagnóstico del Sistema Educativo Vasco para el \n2021 demuestra que, en la práctica, si la enseñanza del euskera y \nen la lengua propia del territorio está en el origen de 200 000 vas-\ncohablantes adicionales desde inicios de los años 1980 y 71.4% de \nla población de entre 16 y 24 años es bilingüe activa 12 (Gobierno \n12 Esto resulta, entre otros factores, “del esfuerzo del conjunto de la comuni-\ndad educativa, empezando por el del personal docente para mejorar su perfi  l \nlingüístico (hace 40 años, al inicio del proceso, tan solo el 8% era capaz de \nenseñar en euskera, mientras que, en la actualidad, en torno a un 95% está ca-\npacitado para ello); y también de la fi  rme apuesta de padres y madres por mo-', 'léxica, el nombre tiene la capacidad de convertirse en núcleo de frase, de ahí que se le \ndenomine frase nominal (nuclear).\nLa estructura de la frase nominal léxica permite distinguir matices semánticos, entre \nlos que podemos mencionar la definitud, la animacidad, la referencia, la topicalidad y la \ndistinción de persona : 1ª y 2ª vs. 3ª (Silverstein 1976; Givón 1978; Comrie 1979, 1989 \n[1981]; Croft 1988; Aissen 2003). Los dos últimos, sin embargo, aunque intervengan \neventualmente mediante alguno de sus rasgos, como en el caso de la topicalidad, no se \ndiscutirán formalmente en este estudio, ya que el análisis se circunscribe a las frases \nnominales cuyo núcleo es el nombre. \nEl propósito esencial de esta investigación se centra en la identificación de la con -\nvergencia de los rasgos semánticos mencionados anteriormente en cada frase nominal \nnuclear, así como en detectar cómo el grado de confluencia de estas propiedades detona \nla incidencia en las funciones sintácticas y los papeles temáticos de los participantes \ncodificados por medio de ellas. Por ello, se realizará un análisis mixto del elemento sin-\ntáctico en un cuento en náhuatl en su variante de la Huasteca veracruzana2.\nDefinitud / indefinitud\nLa definitud y su alternancia antagónica, la indefinitud, son rasgos identificables en los \nparticipantes de los eventos comunicativos. Lo definido o indefinido de una entidad \ncodificada gramaticalmente se establece bajo los criterios de unicidad o familiaridad, \nentre otros. La teoría de la unicidad (Russell 1905) argumenta que el referente debe \nidentificarse como la única entidad en el contexto particular del acto de habla que se \nestablece entre los interlocutores. La familiaridad (Christophersen 1939) perfila al re -\nferente como una entidad identificable por el hablante y el oyente porque es conocido \ny, por lo tanto, definido para ellos en su comunicación. En otras palabras, un referente \nserá definido si es único y familiar para los interlocutores del discurso; de lo contrario, \nserá indefinido y, en consecuencia, nuevo en la decodificación del mensaje por parte \ndel interlocutor.\nEste procedimiento permite que los nombres entren en juego con otros elementos \ngramaticales que abonan a la (in)definitud de los referentes, tales como artículos, de -\nmostrativos, posesivos, clíticos, afijos, entre otros, y que pueden ser documentados en \nlas lenguas del mundo. No obstante, en determinadas lenguas, el nombre puede no estar \nacompañado de alguno de los elementos que se mencionan.\n2\u2009Los cuentos pertenecen a una colección obtenida por Alan Sandstrom en 1990, cuya transcrip -\nción inicial fue revisada por el autor de este trabajo. Para la nueva edición (Peregrina 2013; 2015; \n2020), con base en los audios originales, se hizo una nueva transcripción y las adecuaciones nece -\nsarias para homogeneizar la escritura de los fonemas: toda c se sustituye por k, excepto antes de h; \ntoda y en función del morfema de 3ª persona del singular posesivo prefijado al nombre, por i; toda \nj, por h, y toda sh, por x.\nLingüística Mexicana. Nueva Época, III (2021), núm. 1: 35-77 \nISSN: 2448-8194\n38 manuel PeReGRina llanes\nLM III-1', 'Lingüística Mexicana. Nueva Época, I (2019), Núm. 2: 170-174 \nISSN: 2448-8194\nCésar Ernesto Escobedo Delgado (dir. y ed.). Diccionario de Lengua \nde Señas Mexicana de la Ciudad de México. Instituto para las  \nPersonas con Discapacidad de la Ciudad de México, Méxi -\nco, 2017; 504 pp.\nJair Cuevas Callejas\nUniversidad Nacional Autónoma de México\ncueva_calle@hotmail.com\ne \nl 10 de junio de 2005 se publicó en el Diario Oficial de la Federación la Ley General \nde las Personas con Discapacidad, la cual establece en su Artículo 12 que «La Lengua \nde Señas Mexicana es una de las lenguas nacionales que forman parte del patrimonio \nlingüístico con que cuenta la nación mexicana» (7). A partir de ese momento se daba to-\ntal reconocimiento jurídico a la Lengua de Señas Mexicana (lsm), lo que cimentaba así \nlas bases para su promoción, enseñanza e investigación, al tiempo que se hacían visibles \npor completo los derechos de la comunidad sorda del país. Estos logros se mantuvieron \nen la vigente Ley General para la Inclusión de las Personas con Discapacidad, de 2011.\nPoco más de un lustro después, surge uno de los resultados más fructíferos del es -\ntudio de esta joven lengua nacional: el Diccionario de Lengua de Señas Mexicana de la \nCiudad de México (dlsm). Fruto del esfuerzo de un año ininterrumpido, sin duda una \nlabor titánica para el proceso de creación de una obra lexicográfica como ésta, el dlsm \nfue diseñado, elaborado y validado por la propia comunidad sorda. También estuvo \napoyado por un sólido grupo de investigadores de diferentes instituciones y especia -\nlistas en la lsm. Está dirigido a sordos y oyentes interesados en aprender el léxico de \ndicha lengua.\nCabe destacar que, tal y como ocurre en los diccionarios de uso de lengua oral, su \nobjetivo es mostrar la realización de las señas utilizadas en las distintas zonas del área \nmetropolitana. El dlsm rechaza el prescriptivismo y toda idea normativa, pero conser-\nva su firme intención pedagógica, de aprendizaje. No obstante, no estamos, como podría \npensar erróneamente algún lector novato, frente a un manual que enseñe la gramática o \nla sintaxis de la lsm, sino solamente ante un sumario de señas aisladas que servirá, eso \nsí, como herramienta de estudio de la parte léxica de la misma.\nEl contenido del libro, siguiendo el orden del índice, se estructura en seis grandes \nbloques. El primero comprende las palabras de tres autoridades de la Ciudad de México; \nun prólogo, escrito por Miroslava Cruz Aldrete y Marianna Pool Westgaard, especialis-\ntas en lsm, y una introducción acompañada de agradecimientos finales. De estos ele -\nmentos previos es necesario resaltar el prólogo y la sustancia de la introducción. Ambos \ntextos puntualizan muy bien los objetivos, los alcances y la metodología del dlsm; dan \nun acercamiento rápido, sucinto pero claro, de la terminología básica de la lengua que', 'Estudios de Lingüística Aplicada, año 42, número 79, julio de 2024, pp. 71–109\ndoi: 10.22201/enallt.01852647p.2024.79.1096\n[ 76 ] Amor Madai Peña Ramos & Verónica González Márquez\nnen Rojo y Veiga (1999) en el capítulo “El tiempo verbal. Los tiem-\npos simples” de la Gramática descriptiva de la lengua española.\nDe acuerdo con Rojo y Veiga (1999: 2874), antes de analizar \nel tiempo, se debe establecer a qué tipo de tiempo se hará referen-\ncia: al físico, al cronológico o al lingüístico. En el caso que nos \nconcierne, se hará referencia al tiempo lingüístico que “se funda-\nmenta en el establecimiento de un punto cero, pero ese punto no \nes estático sino móvil” (1999: 2873).\nSegún estos autores, la temporalidad lingüística tiene cier-\ntas características básicas: a) el establecimiento de un punto cero, \nb) “orientación” o ubicación directa o indirecta de los aconteci-\nmientos con respecto al punto cero, c) en algunas lenguas la ex-\npresión de la distancia al punto cero está gramaticalizada (1999: \n2874). Propusieron, además, una forma gráfi  ca para representar la \nubicación de los acontecimientos (Figura 1).\nEl tiempo lingüístico es representado por el punto central (O), que \nestá doblemente orientado y abierto por los dos extremos. Los \nacontecimientos podrían situarse en la zona de lo anterior (–), si-\nmultáneo (o) o posterior (+) al punto cero (Rojo & Veiga, 1999: \n2874). En este sentido, si el punto central o de origen es simultá-\nneo al acontecimiento, es decir, si se trata del tiempo presente, la \nfórmula corresponde a (OoV). Dicha fórmula se lee de derecha a \nizquierda, de la siguiente manera: el vector es simultáneo al origen \n(Rojo & Veiga, 1999: 2876).\nEn el Anexo 1, presentamos una esquematización de las for-\nmas verbales, las fórmulas correspondientes y las distintas deno-\nminaciones. Aunque se empleará la nomenclatura de Bello, se con-\nsiderará el marco teórico de Rojo y Veiga (1999). Asimismo, en \nel Anexo 2, se muestra un cuadro de elaboración propia con las \nA(-)\nOı\nı\nS(o) P(+)\nFIGURA 1. Representación del tiempo lingüístico (Rojo & Veiga, 1999: 2874)', 'Aragón Falomir, Jaime, Alfredo Edmundo Fernández de Lara Gaitán y Juan Bau-\ntista Lucca. 2019. “Las elecciones de 2018 en México y el triunfo del Movimiento \nde Regeneración Nacional (Morena)”, Estudios Políticos 54: 286–308. <https://doi.\norg/10.17533/udea.espo.n54a14>\nArroyo, Carlos, Alice Krozer, Carlos Arroyo Bautista y Braulio Güémez Graniel. \n2019. “Discriminación étnico-racial en México: entre lo étnico, lo racial y lo socioe-\nconómico”, Nexos 20, en <https://www.nexos.com.mx/?p=43996> [consultado \nen diciembre del 2021].\nÁvila, Raúl. 1999. Estudios de semántica social. México: Colegio de México. \nÁvila, Raúl. 1997. “Variación léxica: connotación, denotación y autorregulación”, \nAnuario de Letras 35: 77-102. \nBrook, Marisa, Bridget L. Jankowski, Lex Konnelly, Sali A. Tagliamonte. 2018. “«I \ndon’t come off as timid anymore»: Real-time change in early adulthood against the \nbackdrop of the community”, Journal of Sociolinguistics 22, núm. 4: 351-374.\nCabré, María Teresa. 1993. La terminología. Teoría, metodología y aplicaciones. Barcelo-\nna: Antártida/Empúries.\nCasas Gómez, Miguel. 1986. La interdicción lingüística: mecanismos del eufemismo y dis -\nfemismo. Cádiz: Universidad de Cádiz.\nCestero Mancera, Ana María. 2015. “La expresión del tabú: estudio sociolingüístico”, \nBoletín de Filología 5: 71-105.\nChamizo Domínguez, Pedro. 2008. “Tabú y lenguaje: las palabras vitandas y la censu-\nra lingüística”, Thémata 40, en <institucional.us.es/revistas/themata/40/Chamizo.\npdf> [consultado el 3 de octubre de 2020].\nCifuentes Honrubia, José Luis. 1992. “Teoría de prototipos y funcionalidad semánti-\nca”, ELUA. Estudios de Lingüística 8: 133-177.\nCoseriu, Eugenio. 1990. “Semántica estructural y semántica cognitiva” en Jornadas \nde Filología. Homenaje al Prof. F. Marsá. Barcelona: Universidad de Barcelona, pp. \n239-282. \nDiccionario del español de México ( dem). 2010. México: El Colegio de México, A. C., en \n<https://dem.colmex.mx/> [consultado en diciembre de 2021].\nFernández Jaén, Jorge. 2014. Principios fundamentales de semántica histórica. Madrid: \nArco Libros.\nFernández Juncal, Carmen y Natividad Hernández Muñoz. 2019. “Disponibilidad \nléxica y socionomástica”, Ogigia. Revista Electrónica de Estudios Hispánicos  25: 185-\n210. <https://doi.org/10.24197/ogigia.25.2019.185-210>\nGeeraerts, Dirk. 1997. Diachronic Prototype Semantics. A Contribution to Historical Lexi-\ncology. Oxford: Oxford University Press.\nGreimas, Algirdas Julius. 1976. Semántica estructural. Madrid, Gredos. \nGuerrero Ramos, Gloria. 2017. “Nuevas orientaciones de la terminología y de la neo-\nlogía en el ámbito de la semántica léxica”, Rilce. Revista de Filología Hispánica 33: \n1385-1415. <https://doi.org/10.15581/008.33.3.1385-1415>\nGuy, Gregory R. (2011). “Variation and change”, en Maguire, W. y A. McMahon (eds.), \nAnalysing Variation in English. Cambridge: Cambridge University Press, pp. 178-198.\n90\nDinorah Beatriz Montiel Pérez y Julio César serrano LM V-1 \nLingüística Mexicana. Nueva Época, v (2023), núm. 1: 65-95  \nISSN: 2448-8194', 'Algunas exploraciones en torno a la reflexión metalingüística sobre la ironía 17\nEstudios de Lingüística Aplicada, año 35, número 66, diciembre de 2017, pp. 9–39\ndoi: 10.22201/enallt.01852647p.2017.66.827\npretación irónica: aunque María literalmente dice que la fiesta estuvo fantástica, \nen realidad quiere expresar que no le gustó.\nSi bien la teoría de Sperber y Wilson (Wilson & Sperber, 1992, 2004) ha \nsido objeto de críticas (al respecto véase, entre otros, Attardo, 2000, y Kalber -\nmatten, 2006), también ha recibido un importante soporte experimental (Kal -\nbermatten, 2006). Por tanto, consideramos que resulta ser una herramienta vá-\nlida para el estudio sobre la manera en que los niños y adolescentes interpretan \nlas expresiones irónicas. Por otra parte, creemos que esta aproximación permite \nanalizar la forma en que un individuo hace una reflexión sobre el lenguaje en sí \nmismo (mención en términos de la teoría de la relevancia, reflexión metalingüís-\ntica en términos de Gombert, 1992).\n1.4. Aspectos que inciden en la interpretación de la ironía verbal\nDesde la propuesta de la teoría de la relevancia (Wilson & Sperber, 1992, 2004) \nse asume que para interpretar un enunciado irónico el oyente debe percatarse de \nque no puede tratarse de una emisión literal. Para lograr lo anterior, cuenta con \ninformación generada por diversas fuentes contextuales. Al respecto, Yus (2000, \n2009) propone que existen siete fuentes contextuales que aportan información \nrelevante para lograr la adecuada interpretación de un enunciado irónico: cono-\ncimiento enciclopédico general (conocimiento que se tiene acerca del mundo: \ninformación social y cultural que permite interpretar más fácilmente una expre-\nsión irónica); conocimiento enciclopédico específico del interlocutor (gustos, \nhábitos, creencias, opiniones y demás información); conocimiento de sucesos o \nacciones que ocurrieron poco tiempo antes de la expresión irónica; enunciados \nprevios a la conversación; comunicación no verbal vocal y visual (entonación, \ngestos faciales, sonrisas); elecciones léxicas o gramaticales (pistas lingüísticas \ncomo adjetivos con connotación de cualidad extrema, adverbios, superlativos, \nrepeticiones innecesarias, frases convencionalmente irónicas) y la información \nproveniente del entorno físico que rodea a los interlocutores. De acuerdo con el \nautor, la presencia / ausencia de dichas fuentes contextuales impactará en el ac-\nceso que pueda tener un individuo a la interpretación irónica. De esta manera, a \nmayor saturación, es decir, a mayor cantidad de fuentes contextuales, más fácil \ny rápida será la interpretación irónica. Específicamente para fines de este estu -']","The article you provided does not mention Shanghai or bilingual language assessment research. It focuses on topics related to the Basque language in Spain, linguistic discrimination, and linguistic analysis. If you are looking for information specifically about Shanghai in the context of bilingual language assessment research, I recommend searching for articles or studies that specifically address that topic. Shanghai is a diverse and multilingual city in China, and it may have its own unique significance in the field of bilingual language assessment research."
What is the significance of 'prueba' in the context of language acquisition?,"['pios de la tarea. Como resultados generales de esta prueba, se observó que, en prome - dio, los niños presentaban ±3.52 de puntaje en una escala máxima de 21, es decir, sólo ejecutaron alrededor de 3 de 21 secuencias. Al cabo de dos meses se realizó nuevamente la tarea y la media bajó a ±3.22, con - trariamente a lo que era esperable. Estos datos nos resultaron reveladores dado que se trata de una tarea que implica movimientos menos precisos que las praxias individuales (cuadros 2 y 4). Sin embargo, para esta actividad se requiere de la memoria de trabajo, que es un tipo de memoria a corto plazo donde es necesario actualizar la información re- cibida al momento de manipularla para ejecutar una acción. Las tareas de Alternancias Motoras no sólo requieren de mecanismos para mantener una secuencia en la memoria, sino mecanismos para poder reproducirla, y en este periodo de adquisición lingüística, parece ser que los niños se están especializando en la apropiación de otros rasgos del lenguaje visogestual tales como la ubicación, dirección, orientación y los movimientos que siguen las cm, es decir, los rasgos distintivos de una seña. discusión de Las prueBas Motrices Dentro del campo de la percepción visual, la saliencia se define como aquel estímulo que destaca del resto, no necesariamente por sus atributos físicos, como el tamaño o la forma, sino que también pueden suponer factores cognitivos y emocionales. Esta es una posible explicación para el resultado que se observó en los niños, pues la mayoría de ellos adaptaron la praxia mostrada con una cm de la lsm. De hecho, el proceso de apropiación de una cm puede estar relacionado con el bagaje lingüístico en esa etapa de adquisición del niño respecto al deletreo manual debido a que, en el contexto escolar, y en esta edad, están adquiriendo las cm de la lsm, pero éstas no representan necesaria- mente señas léxicas, sino partes abstractas de las mismas. En esta tarea, los niños produjeron las praxias manuales, adaptándolas de manera simi- lar a lo que sucede con los préstamos de las lenguas orales, cuando los hablantes incorpo- ran un término mediante los patrones fonológicos de la lengua meta. Lo anterior explica que ante el estímulo que parece ser similar a la cm <t>, los niños no lo copiaron idéntica- mente, sino que lo reprodujeron de forma muy similar a la cm que existe en lsm. En el caso de la segunda praxia que se mostró en el cuadro (4), se pudo ver que la postura de mano no es tan similar a la de la configuración realizada por los infantes. De hecho, los dedos activos son distintos. Sin embargo, cuando los niños trataban de copiar esta última praxia, lo hicieron mediante la única cm de la lsm que se realiza con dos dedos cruzados, la <r>. Para la prueba de Alternancias Motoras, supusimos que habría un mejor resultado en los puntajes bajo el supuesto que es una tarea secuencial y que requiere una menor precisión motriz que la tarea de praxias. Sin embargo, no fue así.']","In the context provided, 'prueba' seems to refer to motor alternation tasks that are part of language acquisition studies. These tasks involve sequences that require working memory and the ability to update information while manipulating it to execute an action. Children in the study seem to be specializing in aspects of visuospatial language acquisition, such as location, direction, orientation, and movement characteristics. The term 'prueba' appears to be associated with motor tasks that involve reproducing sequences, potentially influenced by linguistic background and the acquisition of manual spelling gestures. It is suggested that children adapt manual gestures similarly to how loanwords are incorporated into spoken languages, following phonological patterns of the target language.",single_hop_specifc_query_synthesizer,"['En la figura 2, la identificación de los no chistes también es más acertada conforme \naumenta el grado escolar. Una prueba Kruskal Wallis –identificación de no chistes por \ngrado, 2x3– señaló que dicha diferencia fue significativa: p = 0.015. Una prueba post \nhoc U de Mann-Whitney indicó que ésta radicaba únicamente entre los grupos de 2º y \n8º grados: p = 0.005. \nPor lo demás, en lo que se refiere a las reflexiones metalingüísticas, en la figura 3 se \nobserva cómo las reflexiones de contenido en las escuelas públicas parecen disminuir gra-\ndualmente conforme aumenta la edad, mientras que las de forma, por el contrario, parecen \nincrementar. A su vez, las de actuación 1 muestran un comportamiento algo distinto, ya \nque el total es similar en los grados de 2º y 5º, pero hay un incremento considerable en 8º \ngrado. Al realizar la prueba Kruskal Wallis –tipo de respuesta por grado– en los tres tipos \nde reflexiones metalingüísticas se encontró que había una diferencia significativa entre \ngrados escolares únicamente en las reflexiones metalingüísticas de actuación (p = 0.020). \nUna prueba post hoc U de Mann-Whitney señaló que la diferencia en esta categoría radica-\nba entre las comparaciones de los grupos de 2º vs. 8º (p = 0.009) y 5º vs. 8º (p = 0.006). \n* p < 0.05\nLa cantidad posible de reflexiones por grado escolar era ilimitada. \nFigura 3. Cantidad media de reflexiones metalingüísticas por categoría para cada grado escolar para las \nescuelas públicas ante la pregunta ¿Por qué es chiste?\n1\u2009Son aquellas en las que el participante reflexiona sobre el efecto que tiene el chiste sobre un po-\ntencial auditorio. Eso involucra que sea capaz de llevar a cabo un análisis hipotético de la intención \ncomunicativa de la persona que cuenta el chiste con respecto a su interlocutor. Es por ello que no \nsorprende su aparición más tardía en las respuestas de los participantes.\n6\n5\n4\n3\n2\n1\n0\nContenido Forma Actuación\nSegundo\nQuinto\nOctavo\n*\n42 KaRina Hess ZimmeRmann y danieLa Lucía JiméneZ mendoZa\nLM IV-1 \nLingüística Mexicana. Nueva Época, IV (2022), núm. 1: 31-54  \nISSN: 2448-8194', 'Tabla 1. Conformación de la muestra\nLos datos se obtuvieron por medio de diferentes ejercicios de escritura; por ejemplo, se \nles solicitó que escribieran los diálogos que se establecían entre los personajes de una his-\ntorieta con los globos vacíos. Por medio de imágenes en las que había dibujos de personas \nllevando a cabo diferentes acciones, se les pidió que escribieran la descripción de las \nacciones a partir de la pregunta ¿Qué hacen? También se obtuvieron producciones escri-\ntas por medio de preguntas como ¿Qué hiciste ayer? y ¿Tú que haces todos los días? Los \nejercicios presentaban por escrito las instrucciones de las tareas a realizar; sin embargo, \na solicitud de los colaboradores, se les dieron las indicaciones en lsm y se les dijo que \ncontestaran como ellos consideraran pertinente. Una vez que empezaban a resolver el \nejercicio ya no se les daba ningún tipo de ayuda lingüística. \nCódigo de colaborador Edad L1 L2 Escuela Año escolar Año de \nelicitación\nRBM3ºBH 21\nlsm Español conalep \nTemixco 3º preparatoria 2010\nBML3ºBH 21\nMGM3ºBH 20\nJMV3ºBH 20\nMMM3º BH 19\nAHM3º BH 18\nDSD3ºBH 18\nHGG3ºBH 17\nEMO3ºBH 17\nDAA3ºBM 16\nMEC1ºSH 30\nlsm Español Centro Clotet \nA.C. 1º secundaria 2017\nJRS1ºSH 26\nERG1ºSH 25\nAME1º SH 18\nLFD1ºSH 16\nCZE1ºSH 15\nAGA1ºSH 15\nARG1ºSM 14\nJAR1ºSH 14\nNOM1ºSM 13\nJSM1ºBM 18 LSM Español iems 1º  preparatoria 2018\n52 Jalina ramírez GryCuk\nLM II-2 \nLingüística Mexicana. Nueva Época, II (2020), núm. 2: 49-71  \nISSN: 2448-8194', '18 Karina Hess Zimmermann, Graciela Fernández Ruiz & Alejandra De León Alcantar\nEstudios de Lingüística Aplicada, año 35, número 66, diciembre de 2017, pp. 9–39\ndoi: 10.22201/enallt.01852647p.2017.66.827\ndio se pondrá en juego la presencia / ausencia de pistas lingüísticas como varia-\nble para observar si esta incide en la interpretación y reflexión que pueden hacer \nlos niños y adolescentes sobre la ironía verbal.\n2. Método\n2.1. Objetivo\nEl objetivo de este estudio es explorar la manera en que niños y adolescentes de \ndiferentes edades interpretan la ironía verbal y reflexionan sobre la misma. Es-\npecíficamente se busca indagar si existen diferencias determinadas por la edad \npara interpretar y reflexionar sobre la ironía y si la presencia / ausencia de pistas \nlingüísticas incide en la interpretación y reflexión que pueden hacer los niños y \nadolescentes sobre la misma.\n2.2. Participantes\nFormaron parte del estudio 30 niños y adolescentes de 9, 12 y 15 años de edad \n(10 participantes por grupo de edad, mitad hombres y mitad mujeres) de una es-\ncuela privada de la ciudad de Querétaro, México. Para la selección de los parti-\ncipantes se descartaron los niños y adolescentes cuya lengua materna no fuera el \nespañol y que tuvieran algún problema evidente de lenguaje o aprendizaje. De \nmanera adicional, debido a que el instrumento empleado en el estudio se presen-\ntó por escrito, a todos los participantes se les aplicó la subprueba de comprensión \nlectora de la Evaluación Neuropsicológica Infantil (eni) (Matute, Rosselli, Ardila \n& Ostrosky, 2007), con la finalidad de descartar alguna dificultad en la compren-\nsión lectora que pudiera incidir en los resultados.\n2.3. Instrumento\nPara la elaboración del instrumento se decidió trabajar con enunciados irónicos \nprototípicos, debido a que se ha encontrado que son los más frecuentes en las \nconversaciones en español (Kalbermatten, 2006). Los enunciados irónicos pro-\ntotípicos son aquellos que presentan una discrepancia entre el significado de las', 'conspirólogo\nEn el peor de los casos se dará cuenta que éste ya no es \nun fenómeno exclusivo del conspirólogo proverbial con el \ngorro de aluminio, no: la conspiración ya es parte de la con-\nversación pública.\nEl Universal. Opinión. Esteban \nIllades. 20 de agosto de 2020. \nVersión digital.\ncoronabicho Escuela en casa en tiempos del coronabicho: Entre Sherlock \nHolmes y Poirot.\nEl Universal. Confabulario. Mary \nCarmen Sánchez Ambriz. 12 de \nseptiembre de 2020. \nVersión digital.\ncoronabobo\nDe la existencia del virus nadie tiene la culpa, desde luego \n[...]. Los ciudadanos imputan la culpa a los políticos y los \npolíticos, con la boca pequeña, solo se atreven a inculpar, \nen fin, a esa “pequeña minoría” de irresponsables... ¿Peque-\nña? ¿Coronavirus? Coronabobos, dice el espejo.\nMilenio. El Mundo. Manuel Hi-\ndalgo, p. 23. 18 de septiembre \nde 2020.\ncoronabono\nEl Eurogrupo llegó este jueves a un acuerdo para movilizar \nmás de medio billón de euros en préstamos para ayudar \na estados, empresas y trabajadores afectados por el coro-\nnavirus, pero dejó para más adelante la discusión sobre la \nemisión de “coronabonos” para financiar la recuperación.\nSinembargo. Economía.  \n“Eurogrupo acuerda medio \nbillón de euros, pero sin coro-\nnabonos, para afectados por \nCOVID-19”. EFE. 10 de abril de \n2020. Versión digital.\ncoronaburguer\nEn medio de la pandemia por coronavirus el ingenio mexi-\ncano se hace presente en todo el país, con creaciones que \nvan desde un globo, pasteles, bonless, tatuajes y ahora una \nhamburguesa, se trata de la “Coronaburger” y es creada en \nCiudad Madero, Tamaulipas.\nMilenio Digital. Virales. Magda \nBárcenas. 11 de mayo de 2020.\ncoronacrisis Coronacrisis. La cuarentena trajo aparejada la crisis econó-\nmica por la que atraviesan distintos sectores.\nInfobae.com. Tendencias. Víctor \nIngrassia. 7 de junio  de 2020.\ncoronalibro\nCrean el “Coronalibro”. Más de 4 mil 500 propuestas de \n15 países respondieron a la convocatoria de la Universidad \nAutónoma Metropolitana (UAM) para un proyecto colabo-\nrativo, un fotolibro y una pieza multimedia en torno del \ncoronavirus.\nEl Universal. Cultura. Sonia Sie-\nrra. 7 de mayo de 2020. \nVersión digital.\ncoronavirulento\n“CORONAVIRULENTO”. El científico universitario refirió \nque el virus podría ya haber llegado a México sin que haya \nsido detectado, puesto que tarda 14 días en incubarse sin \nque se presenten síntomas.\nLa Crónica de Hoy. Academia. \n“El coronavirus llegará a Mé-\nxico y no estamos preparados: \nacadémicos”. Isaac Torres Cruz. \n31 de enero de 2020. \nVersión digital.\ncoronial\nEs lo que es y esto no va a terminar nunca, ni con una vacu-\nna ni con diez. Es, como están diciendo muchos de nuestros \nmás grandes pensadores: la era “coronial”. Así como la épo-\nca colonial tuvo sus características y sus valores, el corona-\nvirus nos está llevando a situaciones que jamás imaginamos \ny que no van a tener solución en la lógica “pre-coronial”.\nMilenio. Opinión. Álvaro de la \nCueva. 27 de septiembre de \n2020. Versión digital.\ncoronnial\nDespués de los millennials y la generación Z es la hora de \nlos coronnials. Este término, muy popular en las redes so-\nciales, se refiere a la generación que nacerá en los próximos \nmeses como consecuencia del aislamiento en parejas.\nInfobae.com. Tendencias. Víctor \nIngrassia. 7 de junio de 2020.\n22 Ramón ZacaRías Ponce de León\nLM IV-1 \nLingüística Mexicana. Nueva Época, IV (2022), núm. 1: 7-29  \nISSN: 2448-8194', 'Algunas exploraciones en torno a la reflexión metalingüística sobre la ironía 17\nEstudios de Lingüística Aplicada, año 35, número 66, diciembre de 2017, pp. 9–39\ndoi: 10.22201/enallt.01852647p.2017.66.827\npretación irónica: aunque María literalmente dice que la fiesta estuvo fantástica, \nen realidad quiere expresar que no le gustó.\nSi bien la teoría de Sperber y Wilson (Wilson & Sperber, 1992, 2004) ha \nsido objeto de críticas (al respecto véase, entre otros, Attardo, 2000, y Kalber -\nmatten, 2006), también ha recibido un importante soporte experimental (Kal -\nbermatten, 2006). Por tanto, consideramos que resulta ser una herramienta vá-\nlida para el estudio sobre la manera en que los niños y adolescentes interpretan \nlas expresiones irónicas. Por otra parte, creemos que esta aproximación permite \nanalizar la forma en que un individuo hace una reflexión sobre el lenguaje en sí \nmismo (mención en términos de la teoría de la relevancia, reflexión metalingüís-\ntica en términos de Gombert, 1992).\n1.4. Aspectos que inciden en la interpretación de la ironía verbal\nDesde la propuesta de la teoría de la relevancia (Wilson & Sperber, 1992, 2004) \nse asume que para interpretar un enunciado irónico el oyente debe percatarse de \nque no puede tratarse de una emisión literal. Para lograr lo anterior, cuenta con \ninformación generada por diversas fuentes contextuales. Al respecto, Yus (2000, \n2009) propone que existen siete fuentes contextuales que aportan información \nrelevante para lograr la adecuada interpretación de un enunciado irónico: cono-\ncimiento enciclopédico general (conocimiento que se tiene acerca del mundo: \ninformación social y cultural que permite interpretar más fácilmente una expre-\nsión irónica); conocimiento enciclopédico específico del interlocutor (gustos, \nhábitos, creencias, opiniones y demás información); conocimiento de sucesos o \nacciones que ocurrieron poco tiempo antes de la expresión irónica; enunciados \nprevios a la conversación; comunicación no verbal vocal y visual (entonación, \ngestos faciales, sonrisas); elecciones léxicas o gramaticales (pistas lingüísticas \ncomo adjetivos con connotación de cualidad extrema, adverbios, superlativos, \nrepeticiones innecesarias, frases convencionalmente irónicas) y la información \nproveniente del entorno físico que rodea a los interlocutores. De acuerdo con el \nautor, la presencia / ausencia de dichas fuentes contextuales impactará en el ac-\nceso que pueda tener un individuo a la interpretación irónica. De esta manera, a \nmayor saturación, es decir, a mayor cantidad de fuentes contextuales, más fácil \ny rápida será la interpretación irónica. Específicamente para fines de este estu -', 'Estudios de Lingüística Aplicada, año 42, número 79, julio de 2024, pp. 45–69\ndoi: 10.22201/enallt.01852647p.2024.79.1083\nLa duplicación del objeto indirecto en aprendientes de interpretación [ 57 ]\nde la licenciatura. Se les aplicó el cuestionario leap-q (Marian, \nBlumenfeld & Kaushanskaya, 2007) con el objetivo de tener un \nregistro del historial lingüístico de los sujetos, además de obtener \ninformación referente al tipo de bilingüismo que presentaban al \nmomento de realizar ambas prácticas de interpretación (véase Sán-\nchez, Andrade & Martínez, 2023, para una descripción detallada \ndel tipo de bilingüismo). Con respecto al bilingüismo, los sujetos \nque fueron considerados para la aplicación de las prácticas debían \ntener las siguientes características:\n i. Tener español como lengua materna,\n ii. haber aprendido inglés después de los 6 años,\niii. autoevaluarse con una ponderación mayor a 8 en compren-\nsión lectora y oral y en producción oral.\nSe contó con un total de 64 sujetos, 33 cursaban el V semestre, 13 \ncursaban el VII semestre y 18 el VIII semestre.\n4.3.  Aplicación de prácticas de interpretación\nSe estableció contacto con cinco docentes que impartían las mate-\nrias de interpretación a fi  n de solicitar su colaboración en la reali-\nzación y aplicación de las dos pruebas de interpretación. Asimis-\nmo, se les ofrecieron los archivos de audio y las transcripciones \nde los estudiantes involucrados para los fi  nes académicos y/o di-\ndácticos que ellos creyeran convenientes. Debido a las circunstan-\ncias derivadas de la pandemia, se le pidió a los docentes acceso a \nla plataforma educativa en la que impartían sus clases durante dos \nsesiones, separadas por una semana de diferencia; este paso meto-\ndológico se implementó con el objetivo de evitar una carga exce-\nsiva en la atención y la capacidad de los estudiantes para realizar \nla práctica interpretativa.\nUna vez que se tuvo acceso a la plataforma y contacto con \nlos estudiantes de cada grupo, se les comentó que estas pruebas \nde interpretación no pretendían ser una evaluación que afectara su', 'El chisme: estrategias discursivas desplegadas en su construcción 17\nEstudios de Lingüística Aplicada, año 36, número 67, julio de 2018, pp. 9–43\ndoi: 10.22201/enallt.01852647p.2018.67.723\nEl formato en la presentación de los ejemplos en la parte analítica es el si -\nguiente: en primer lugar, entre paréntesis aparece el número de ejemplo y el \ntítulo del chisme. En las siguientes filas se presenta el fragmento de la conversa-\nción, alineados a la izquierda aparece el turno de habla y, con letra mayúscula, \nla inicial del hablante seguida de dos puntos y su participación. Al interior de las \nparticipaciones, en negritas, aparece el foco del análisis de ese fragmento en es-\npecífico (véase Figura 1).\nEl sistema de transcripción utilizado es, con algunas modificaciones, el propues-\nto por el grupo Val.Es.Co. (Briz, 2003) (véase Anexo B), interesado en el análi-\nsis y descripción de la lengua coloquial, en especial del español. Se trata de un \nsistema que combina el método ortográfico con la propuesta del análisis de la \nconversación (ac) adaptado a las características de la lengua española. Como \nse especializa en fenómenos conversacionales, se enfoca en cuestiones relacio-\nnadas con la alternancia de turnos, la sucesión inmediata de emisiones, solapa-\nmientos, reinicios y autointerrupciones, rupturas conversacionales, pausas y si -\nlencios, entonación, fenómenos de énfasis, problemas relacionados con emisio-\nnes dudosas o indescifrables, alargamientos fonéticos, preguntas retóricas, estilo \ndirecto, referencias contextuales, entre otros (Briz, 2003).\nFigura 1. Formato de presentación de los ejemplos', '(6)\nEste número se lee como que la máxima entropía del sistema representado por las \ntres palabras en (4) sería de 2.585 bits. Si resolvemos el caso para el grafema A, pero \nahora sólo con las probabilidades de la tabla 1, tendríamos lo siguiente:\n(7)\nLa entropía absoluta de A sería 0.918 bits. Para poder tener una lectura general, \nse normaliza el resultado anterior con el 2.585 que obtuvimos de la máxima entropía. \nEs decir, usamos la máxima entropía como suelo común, en donde 1 representaría la \nmáxima incertidumbre posible, y 0 la mínima. Para obtener la entropía normalizada \n(también llamada relativa), realizaríamos lo siguiente:\n(8)\nEl anterior paso es el que permite realizar la comparación con otras piezas del sis -\ntema, ya sea con cada grafema o, como se llevará a cabo en los experimentos a conti-\nnuación, de cada posible combinación de grafemas dados los arreglos dispuestos en el \ninventario léxico de (4). Esto quiere decir que, para los experimentos que se desarrollan \nen este trabajo, sólo se calcula la entropía de los posibles afijos producto de todos los \nposibles cortes lógicos a partir de tomar como pivote algún lado de la palabra. \nEvaluación de los cortes\nEl resultado del cálculo de entropía relativa no dice mucho por sí solo. Es una huella, \nen contraste con los resultados de los otros afijos posibles. En todo caso, el dato sólo nos \nayudaría a confirmar que el sistema no tiende al caos, aunque se espera que un sistema \nde comunicación no lo haga (Shannon 1948). La primera etapa de la experimentación \npropuesta es exploratoria, en donde una vez realizado el cálculo, se contrasta una lista \nde posibles afijos encontrados en el primer conjunto de textos. Sin embargo, pronto se \ndescubren las limitaciones de un experimento así. Por ello, se propuso un segundo expe-\nrimento en este trabajo, lo que permite una evaluación más precisa. \nEn otros experimentos se usa una versión del cálculo de entropía para determinar \nsi hay correspondencia entre la entropía del sistema estudiado y la entropía propia de \nuna lengua, en contraste con la entropía de, por ejemplo, el adn o de un lenguaje de \n80 mAnuel AlejAndro Sánchez fernández\nLM V-2 \nLingüística Mexicana. Nueva Época, v (2023), núm. 2: 73-94  \nISSN: 2448-8194']","In the context of language acquisition, the term ""prueba"" refers to a test or assessment conducted to evaluate different aspects of language learning and proficiency. These tests are used to measure the participants' abilities, skills, and understanding of linguistic concepts. In the provided text, the ""pruebas de interpretación"" (interpretation tests) were applied to language learners to assess their proficiency in interpreting language, specifically in the context of bilingualism and the duplication of the indirect object. These tests help researchers gather data on language acquisition processes and the impact of bilingualism on linguistic abilities."
What is the significance of Nueva Época in the linguistic context?,"['Identificamos que, en el contexto escolar, los niños aprenden a copiar el deletreo o las señas casi de manera simultánea con su profesora o cuidadora y suelen deletrear su nombre o el de sus com- pañeros. En este mismo sentido y en el contexto de la prueba, los niños realizaron las secuencias paralelamente, es decir, en el mismo momento que el instructor. A partir de 64 Guillermo Hernández Santana y Coral italú Guerrero arenaS LM V-2 Lingüística Mexicana. Nueva Época, v (2023), núm. 2: 49-71 ISSN: 2448-8194']","Nueva Época is a term used in the context of the linguistic journal 'Lingüística Mexicana' to denote a new era or phase of publication, possibly indicating a shift in focus or approach.",single_hop_specifc_query_synthesizer,"['El chisme: estrategias discursivas desplegadas en su construcción 13\nEstudios de Lingüística Aplicada, año 36, número 67, julio de 2018, pp. 9–43\ndoi: 10.22201/enallt.01852647p.2018.67.723\nsonas ausentes (comportamientos, características o acciones) o a terceras perso-\nnas presentes, pero cuyo aspecto a valorar aparece como temporalmente inactivo.\nLa propuesta de análisis de la conversación casual de Eggins y Slade (1997) \nes la que da sustento a la descripción del chisme y que, a su vez, parte de los \nprincipios básicos e iniciales de la teoría de la valoración para encontrar las for -\nmas gramaticales, semánticas y discursivas mediante las que se realiza el chis-\nme. Una conversación casual (Eggins & Slade, 1997) es una manifestación lin-\ngüística en donde se negocia la construcción de la realidad social y tiene como \nobjetivos afirmar y reconfirmar, establecer y mantener relaciones. Desde esta \nperspectiva, las autoras se preguntan: ¿cómo se estructura la lengua para permi-\ntirnos hacer conversaciones? Primero, dividen en dos tipos las secuencias con -\nversacionales: las secuencias chat (extremadamente interactivas, en las que se \ndespliega una rápida alternancia de turnos) y las secuencias chunk (bloques con \nuna estructura interna predecible que puede ser descrita y analizada de acuerdo \ncon el género conversacional al que pertenecen).\nPara Eggins y Slade (1997), el chisme constituye un tipo de secuencia \nchunk en el que se distinguen al menos tres etapas obligatorias, es decir, aque-\nllas que lo definen como género conversacional y que le son exclusivas: el enfo-\nque en la tercera persona (third person focus) o identificación de los caracteres, \nla exposición del comportamiento probatorio (substantiating behavior) y la eva-\nluación peyorativa (pejorative evaluation).\nLos planteamientos de Eggins y Slade (1997) encuentran en la teoría de la \nvaloración (Martin, 2000; White, 2001, 2011; Kaplan, 2004, 2007; Martin & \nWhite, 2005; entre otros) el entramado teórico que los sustenta. Los analistas del \ndiscurso enmarcados en esta corriente buscan describir los sistemas de opciones \nsemánticas que ofrece la lengua para evaluar, adoptar posiciones, construir suje-\ntos textuales o identidades discursivas, asumir roles, negociar relaciones y pro-\nmover como naturales las posiciones intersubjetivas que son, en última instancia, \nideológicas (Kaplan, 2007). En particular, este enfoque se centra en la expre -\nsión lingüística de la actitud y el compromiso asumido por el emisor frente a sus \nenunciados. Del mismo modo indaga sobre las estrategias mediante las cuales el \nemisor se alía o se distancia de los receptores. En otras palabras, esta perspectiva \ndel análisis del discurso explora, describe y explica cómo es utilizado el lenguaje \npara gestionar posicionamientos y relaciones interpersonales (White, 2011).', 'El chisme: estrategias discursivas desplegadas en su construcción 37\nEstudios de Lingüística Aplicada, año 36, número 67, julio de 2018, pp. 9–43\ndoi: 10.22201/enallt.01852647p.2018.67.723\nparticipación las hablantes calculan y conjeturan cómo serán recibidas y eva -\nluadas sus emisiones por parte de la interlocutora, dependiendo de las relacio -\nnes interpersonales previas así como de la forma en que se esté desarrollando la \nconversación. El análisis me permite concluir que, en el contexto estudiado, los \nchismes son posibles en la medida en que se despliegan estrategias discursivas \nque están bajo el cuidado constante de la mitigación y que se corroboran o se \nmodifican constantemente gracias al uso de las estrategias interactivas.\nPuede añadirse que el grado de participación por parte de las hablantes en el \nchisme no es simétrico. La participación está en función de la cantidad de infor -\nmación que posean o de las estrategias interactivas que utilicen. El acercamiento \nque propongo, además de brindar una aproximación al chisme desde el análisis \ndel discurso, busca problematizar su estudio, ponerlo sobre la mesa de las inves-\ntigaciones actuales, evidenciando su alto valor interactivo, social y discursivo.\nEste estudio, si bien no agota el tema, pretende ser una llamada de atención \npara que los investigadores mexicanos de distintas áreas, pero sobre todo de la \nlingüística, posen su mirada en la práctica comunicativa denominada chisme. \nHay varias vetas que quedan abiertas. Sería muy interesante estudiar discursi-\nvamente el chisme desde otras perspectivas analíticas o en otros contextos, por \nejemplo, entre hombres.\n6. Referencias\nAhmed, Sara (2010). Analysing women’s talk and gossip between two female friends. En In -\nnervate. Leading Undergraduate Work in English Studies, (3), 1–14. Recuperado de  \nhttps://www.nottingham.ac.uk/english/documents/innervate/10-11/1011ahmedwomentalk.pdf\nBajtín, Mijaíl M. (1981). The dialogic imagination: Four essays. Austin: University of Texas \nPress.\nBajtín, Mijaíl M. (2005 [1982]). Estética de la creación verbal. México: Siglo xxi.\nBaumeister, Roy F.; Zhang, Liqing, & V ohs, Kathleen D. (2004). Gossip as cultural learn-\ning. Review of General Psychology, 8(2), 111–121. Recuperado de http://citeseerx.ist.psu.\nedu/viewdoc/download?doi=10.1.1.186.4613&rep=rep1&type=pdf\nBergmann, Jörg R. (1993). Discreet indiscretions: The social organization of gossip. Nueva York: \nAldine de Gruyter.', '14 María Reyes López\nEstudios de Lingüística Aplicada, año 32, número 59, julio de 2014, pp. 9-37\n2. Condiciones preparatorias: a) los hablantes están en una conversación \ncara a cara, en un contexto informal; b) el hablante cree que el oyente \nvalora que el hablante exprese p; c) no es obvio para el oyente ni para el \nhablante que el hablante expresará p de manera espontánea en el curso \nnormal de los acontecimientos.\n3. Condición de sinceridad: El hablante valora positivamente algo relativo \nal oyente y lo expresa. \n4. Condición esencial: Expresar p cuenta como hacer un cumplido del \nhablante hacia el oyente.\n5\nEsta primera caracterización tiene la ventaja de que marca ciertos límites entre el \nAc y otros actos vecinos. Sin embargo, con este primer acercamiento no es posible \ncapturar aspectos del Ac que se refieren más precisamente a las expectativas so-\nciales sobre los rasgos en torno a los cuales es adecuado expresar una valoración \npositiva. Para subsanar este problema, recurro a los planteamientos de Bach y \nHarnish (1979), cuya principal ventaja es que permiten incorporar de manera \nexplícita la dimensión de las expectativas sociales sobre lo que potencialmente \ncontiene la expresión de un acto de habla perteneciente al grupo de los actos de \n‘reconocimiento’. \nBach y Harnish (1979: 51) proponen una tipología con cinco diferentes \ngrupos de actos. Llaman reconocimientos a los actos que expresan ciertos senti-\nmientos, superficiales o genuinos, hacia el oyente; actos cuya expresión es apro-\npiada a ocasiones específicas. Comprenden los casos en los que el enunciado \nmuestra que la intención del hablante es que su enunciado satisfaga la expectati-\n5 La diferencia entre el cumplido y los actos halagar, elogiar y piropear puede capturarse a partir de \nvariaciones en las condiciones preparatorias, pero ahondar en este punto está más allá del objetivo \nde este artículo. Para los fines de este trabajo basta con precisar aquí que elogiar y actos afines como \nloar, encomiar, alabar, ensalzar, exaltar, engrandecer son actos que habitualmente ocurren en un \ncontexto formal, no en una conversación cotidiana entre dos personas, y no necesariamente realizan \npredicaciones sobre el interlocutor, sino también sobre un tercero. Para el caso de piropear, conside-\nro que es un acto que se da en una situación de calle, en la que no hay interacción y que está a medio \ncamino entre el halago y el acoso, según el nivel de obscenidad que exprese (Achugar, 2002). Para \nel caso de halagar, considerándolo un acto perlocucionario, se realiza por medio de diversos actos, \nincluido el cumplido y actos vecinos.\nELA 59.indd   14 28/08/14   17:27', 'Estudios de Lingüística Aplicada, año 42, número 79, julio de 2024, pp. 71–109\ndoi: 10.22201/enallt.01852647p.2024.79.1096\n[ 102 ] Amor Madai Peña Ramos & Verónica González Márquez\nFormas verbales de indicativo (cfr. Rojo & Veiga, 1999: 2881–2885)*\nForma Fórmulas vectoriales Bello (1847) GRAE (1931) Gili Gaya (1943) Esbozo (1973) Rojo y Veiga (1999)\nCanto OoV presente presente Presente Presente presente\nCanté O–V pretérito pretérito indefi  nido pretérito perfecto absoluto pretérito perfecto simple pretérito\nCantaba (O–V)oV co–pretérito pretérito imperfecto pretérito imperfecto pretérito imperfecto co–pretérito\nCantaré O+V futuro futuro simple futuro absoluto futuro futuro\nCantaría (O–V)+V pos–pretérito potencial simple futuro hipotético condicional pos–pretérito\nHe cantado (OoV)–V ante–presente pretérito perfecto pre. perfecto actual pret. perfecto compuesto ante–presente\nHabía cantado (O–V)–V ante–co–pretérito pret. plus–cuamperfecto pret. plus–cuamperfecto pret. plus–cuamperfecto ante–pretérito**\nHube cantado (O–V)–V ante–pretérito pretérito anterior ante–pretérito pretérito anterior ante–pretérito\nHabré cantado (O+V)–V ante–futuro futuro perfecto antefuturo futuro perfecto ante–futuro\nHabría cantado ((O–V)+V)–V ante–pos–pretérito potencial compuesto antefuturo hipotético condicional perfecto ante–pos–pretérito\n*  Los guiones de la terminología utilizada en este cuadro corresponden a la que presentan los autores consultados.\n** En la nota a pie número 21, los autores indican que este es el término adecuado “para la que interpretamos como realización temporal fundamental expresada por había cantado” \n(Rojo & Veiga, 1999: 2885).\nAnexo 1. Formas verbales de indicativo (cfr. Rojo & Veiga, 1999: 2881-2885)*', 'anExo 1\n“Mi historia de amor” \nCuando te conocí \nTe pregunté\nQue de dónde eras\nContestaste que de Villa Coapa\nYo te dije\nMás bien de Villa Guapa y sonreíste\nTe pregunté que si eras de Niñahermosa\nY entendiste Villahermosa\nNo, de Niñahermosa y sonreíste\nLuego te pregunté que si eras de Cuerpo Rico\nY entendiste Puerto Rico, \nNo, que si eras cuerporriqueña\nY sonreíste\nTe pregunté que si eras berrinchula\nY entendiste berrinchuda\nY te dije, no berrinchula y sonreíste\nTengo tus fotos pegadas en la pared \nCuando me voy a dormir\nTe beso\nCuando me despierto\nTe beso\nY pienso ¿Qué estará haciendo?\nY entonces suavecito susurro\nQue te amo\nY en la foto\nSonríes\nY no me importa lo que pase en el día\nYo me acuerdo de ti y sonrío\nJairo Norberto Lacón\nReo 32178-4\nSentencia: dos años y cuatro meses por estupro y violación\n100 Jimena Hernández león y xócHiTl TaVera cerVanTes\nLM IV-2\nLingüística Mexicana. Nueva Época, IV (2022), núm. 2: 85-100  \nISSN: 2448-8194', 'La fiesta, la palabra y la fuerza: el papel del nawésali\ncomienzan en la víspera, bachámi; esto quiere decir que las fiestas del 12 de diciembre \ninician la noche del día 11, las del 25 inician el 24 por la noche, la fiesta de Año Nuevo \ncomienza desde el  31 de diciembre y la del 6 de enero empieza la noche del 5. Estas \nfiestas logran congregar una cantidad importante de asistentes que fungen tanto como \nespectadores u oyentes, como participantes, danzantes de matachín o integrantes de los \ndiferentes puestos del gobierno tradicional.\nParticipantes (participants). Tanto el nawésali en particular como la celebración en su \ntotalidad muestran una definición muy clara de cada uno de los participantes que con -\nforman el evento y que permiten que se lleve a cabo; todos ellos tienen un papel especí-\nfico, para el cual hay una preparación previa, como aquellos que participan como emi -\nsores (aunque también pueden ser receptores) y tienen la responsabilidad de transmitir \nun mensaje. Quienes participan tanto como emisores como receptores son los siguientes.\nSilíame. El gobernador es el responsable de dar los nawésali, ofrece tres de ellos en \ncada víspera de una celebración y siempre que es posible los medita y prepara con \nantelación. El gobernador debe tener entre sus cualidades la habilidad de hablar con \ncoherencia y elocuencia, incluso es requerimiento para el puesto, ya que esta destreza le \npermitirá transmitir estas propiedades a sus discursos. \nAkánte. El encargado de ayudar al gobernador en las reuniones tiene la facultad de \ndar nawésali en lugar y/o en compañía del gobernador; ocasionalmente es nombrado \nsilíame kusiur (suplente de gobernador). Su participación en la fiesta se ejecuta puntual-\nmente al momento del nawésali interviniendo de manera secundaria al consejo principal \nque dirige el silíame; además, también puede participar dando un nawésali completo, \npero siempre después del gobernador.\nRopíli. Se encarga de cuidar los bastones de mando usados por las autoridades que \nparticipan en el nawésali, entre ellos el silíame y akánte. El ropíli resguarda los bastones \nen todo momento durante la oración que se haga dentro de la iglesia y, antes de iniciar \nel nawésali fuera del templo y mientras la gente sale al atrio de la iglesia, entrega los \nbastones a las autoridades correspondientes. Al término del consejo recoge los bastones, \nlos cuida durante las demás etapas de la celebración y los devuelve antes de iniciar cada \nuno de los nawésali de la noche.\nSakitáni. La principal tarea del sakitáni es tocar las campanas de la iglesia para llamar \na la comunidad a la celebración. Se hacen tres llamados: dos de aviso y uno de inicio. \nLas tareas del sakitáni continúan cuando inician las danzas, pues él es quien toca las \ncampanadas al término de las danzas de matachín, que hacen referencia a que debe co-\nmenzar la siguiente etapa de la celebración: las oraciones. \nTenánchi. Este cargo es principalmente ocupado por una mujer y entre sus tareas se \nencuentra barrer la iglesia antes de comenzar las celebraciones y esparcir el humo sagrado \n99\nLM VII-1\nLingüística Mexicana. Nueva Época, vii (2025), núm. 1\nISSN: 2448-8194']","In the linguistic context, ""Nueva Época"" (New Era) typically refers to a new phase or period of a linguistic journal or publication. It signifies a fresh start, often with updated content, revised editorial policies, or a new editorial team. The term ""Nueva Época"" is used to indicate a new stage in the evolution of the publication, highlighting changes or improvements that have been made to keep the journal relevant and up-to-date in the field of linguistics."
What is the analysis of morfemas in the Spanish language?,"['Segmentación de morfemaS con cálculo de entropía en pa ipai propone un análisis de varianza y uno de correlación para corroborar si tales cortes se relacionan significativamente con esta medida. La segmentación de Joël. Para este experimento, se retomó el texto de Joël (1976) en su texto y, a partir de los afijos que ella glosa, se creó un inventario, distinto al pro - puesto por el algoritmo. En contraste con los 174 potenciales prefijos y 171 sufijos del algoritmo, Joël propone 131 prefijos y 99 sufijos, para un total de 230 afijos ana- lizados. De estos, sólo 93 (39.7%) tienen un valor de entropía mayor a 0. Es relevante notar lo anterior, ya que el alcance del experimento no incluye la identificación de morfemas que funcionen como bases. Casos de entropía 0 podrían revelar este tipo de morfemas, pensando en que, dentro de la palabra, la cantidad de morfemas con estructuras inagrupables correspondería a más del 60%, mientras que aquellos que pueden agruparse (como, por ejemplo, las variaciones -um, -em, -m) corresponderían al 40% restante. La exploración de este hecho sobrepasa el objetivo de la presente investigación, pero se dejará para futuros trabajos. Posterior a esta segmentación y al cálculo de entropía relativa, se emparejaron los 230 afijos analizados por Joël con la entropía calculada por el algoritmo, incluso si fue cero. Esto debido a que el peso en este momento de la experimentación es el hecho de que son afijos que, en efecto, fueron analizados por Joël. En este punto surgió otro problema que ya había sido mencionado líneas arriba. Existen en la lengua ciertos morfemas que no toman como pivote el extremo derecho o izquierdo de la palabra. En el corpus, son morfemas que sólo aparecen entre otros morfemas. Estos afijos no son segmentados por el programa, pero sí por Joël. De los 230 afijos glosados, el programa no calculó la entropía de 50. Ahora, nótese que no son 50 casos únicos. Por ejemplo, aparece el morfema oli, el cual es propuesto como prefijo y sufijo (oli-, -oli), debido a que aparece sólo entre morfemas en la segmentación de Joël. Por lo que esos 50 casos, podrían ser aproximadamente 25 formas por explorar. De la misma manera que el primer problema enunciado, este escenario se salva retirando de la exploración los casos que no fueron analizados por el programa, pero se dejarán para otras exploraciones los casos de posibles intrafijos —afijos que van entre la base y algún otro sufijo o prefijo— tomando como criterio el análisis de Joël, o incluso, el de otras glosas hechas por otros investigadores. Correlación. Al final, el conjunto para realizar la correlación corresponde a 180 afijos que sí fueron segmentados por Joël, y otros 1690 afijos que el programa segmentó; para ambos grupos tenemos su cálculo de entropía que incluye también los casos de entropía 0. A ma- nera de contraste, en la gráfica 4 se muestra la distribución de los 180 afijos segmentados tomando como parámetro su entropía relativa calculada. Nótese la diferencia con respecto a las distribuciones anteriores (gráfica 2 y 3). Se observa que las curvas no están tan ho - mogenizadas como en los otros dos casos anteriores. Además, también sobresale que la tendencia de los datos de los sufijos es a ser bimodal (dos crestas en el gráfico). Esto podría sugerir una división entre los sufijos. Esto se deja para evaluación en futuros trabajos. 89']","The segmentation of morfemas with entropy calculation in the experiment proposes an analysis of variance and correlation to determine if the cuts are significantly related to this measure. Joël's segmentation suggests 131 prefixes and 99 suffixes, totaling 230 analyzed affixes. Only 93 (39.7%) have an entropy value greater than 0. The experiment does not aim to identify morphemes functioning as bases. Cases with entropy 0 could reveal such morphemes. The exploration of this fact exceeds the current research's scope but is left for future studies. After segmentation and relative entropy calculation, the 230 affixes analyzed by Joël were matched with the algorithm's calculated entropy, even if it was zero. Certain morphemes in the language do not pivot on the word's right or left end but only appear between other morphemes. The program did not calculate the entropy of 50 affixes glossed by Joël. These cases, approximately 25 forms, could be further explored. The correlation analysis involves 180 affixes segmented by Joël and 1690 affixes segmented by the program, including cases with entropy 0. The distribution of the 180 segmented affixes based on their calculated relative entropy shows differences compared to previous distributions. The data trend for suffixes tends to be bimodal, suggesting a division among suffixes for future evaluation.",single_hop_specifc_query_synthesizer,"['conspirólogo\nEn el peor de los casos se dará cuenta que éste ya no es \nun fenómeno exclusivo del conspirólogo proverbial con el \ngorro de aluminio, no: la conspiración ya es parte de la con-\nversación pública.\nEl Universal. Opinión. Esteban \nIllades. 20 de agosto de 2020. \nVersión digital.\ncoronabicho Escuela en casa en tiempos del coronabicho: Entre Sherlock \nHolmes y Poirot.\nEl Universal. Confabulario. Mary \nCarmen Sánchez Ambriz. 12 de \nseptiembre de 2020. \nVersión digital.\ncoronabobo\nDe la existencia del virus nadie tiene la culpa, desde luego \n[...]. Los ciudadanos imputan la culpa a los políticos y los \npolíticos, con la boca pequeña, solo se atreven a inculpar, \nen fin, a esa “pequeña minoría” de irresponsables... ¿Peque-\nña? ¿Coronavirus? Coronabobos, dice el espejo.\nMilenio. El Mundo. Manuel Hi-\ndalgo, p. 23. 18 de septiembre \nde 2020.\ncoronabono\nEl Eurogrupo llegó este jueves a un acuerdo para movilizar \nmás de medio billón de euros en préstamos para ayudar \na estados, empresas y trabajadores afectados por el coro-\nnavirus, pero dejó para más adelante la discusión sobre la \nemisión de “coronabonos” para financiar la recuperación.\nSinembargo. Economía.  \n“Eurogrupo acuerda medio \nbillón de euros, pero sin coro-\nnabonos, para afectados por \nCOVID-19”. EFE. 10 de abril de \n2020. Versión digital.\ncoronaburguer\nEn medio de la pandemia por coronavirus el ingenio mexi-\ncano se hace presente en todo el país, con creaciones que \nvan desde un globo, pasteles, bonless, tatuajes y ahora una \nhamburguesa, se trata de la “Coronaburger” y es creada en \nCiudad Madero, Tamaulipas.\nMilenio Digital. Virales. Magda \nBárcenas. 11 de mayo de 2020.\ncoronacrisis Coronacrisis. La cuarentena trajo aparejada la crisis econó-\nmica por la que atraviesan distintos sectores.\nInfobae.com. Tendencias. Víctor \nIngrassia. 7 de junio  de 2020.\ncoronalibro\nCrean el “Coronalibro”. Más de 4 mil 500 propuestas de \n15 países respondieron a la convocatoria de la Universidad \nAutónoma Metropolitana (UAM) para un proyecto colabo-\nrativo, un fotolibro y una pieza multimedia en torno del \ncoronavirus.\nEl Universal. Cultura. Sonia Sie-\nrra. 7 de mayo de 2020. \nVersión digital.\ncoronavirulento\n“CORONAVIRULENTO”. El científico universitario refirió \nque el virus podría ya haber llegado a México sin que haya \nsido detectado, puesto que tarda 14 días en incubarse sin \nque se presenten síntomas.\nLa Crónica de Hoy. Academia. \n“El coronavirus llegará a Mé-\nxico y no estamos preparados: \nacadémicos”. Isaac Torres Cruz. \n31 de enero de 2020. \nVersión digital.\ncoronial\nEs lo que es y esto no va a terminar nunca, ni con una vacu-\nna ni con diez. Es, como están diciendo muchos de nuestros \nmás grandes pensadores: la era “coronial”. Así como la épo-\nca colonial tuvo sus características y sus valores, el corona-\nvirus nos está llevando a situaciones que jamás imaginamos \ny que no van a tener solución en la lógica “pre-coronial”.\nMilenio. Opinión. Álvaro de la \nCueva. 27 de septiembre de \n2020. Versión digital.\ncoronnial\nDespués de los millennials y la generación Z es la hora de \nlos coronnials. Este término, muy popular en las redes so-\nciales, se refiere a la generación que nacerá en los próximos \nmeses como consecuencia del aislamiento en parejas.\nInfobae.com. Tendencias. Víctor \nIngrassia. 7 de junio de 2020.\n22 Ramón ZacaRías Ponce de León\nLM IV-1 \nLingüística Mexicana. Nueva Época, IV (2022), núm. 1: 7-29  \nISSN: 2448-8194', 'palabras es de estados de lengua posteriores al castellano antiguo4. Ni en el Corpus dia-\ncrónico del español 5, en el Corpus del español mexicano contemporáneo 6, en el Corpus de \nreferencia del español actual7 o en el Corpus del español del siglo xxi8 se encuentra un solo \nejemplo de construcciones de interpolación que incluyan a dizque o pinches, lo que reve-\nla su estatus emergente en el español mexicano. \nDicho carácter innovador provoca que resulte complicado atestiguar ejemplos de \npinches y dizque en corpus o publicaciones periodísticas, por lo que en la presente nota \nse muestra evidencia obtenida principalmente a partir del uso de la herramienta de \nbúsqueda en la red social Twitter, utilizada por múltiples sectores de la población mexi-\ncana, particularmente adultos jóvenes y adolescentes, y en la cual es posible atestiguar \nformas coloquiales en forma escrita (5). Esta decisión fue tomada a partir de corroborar \nque la mayoría de los datos presentados en las obras de Quepons Ramírez (2015, 2022) \nprovenían de dicha fuente.\n(5) \n1. como me pinches caga ver a alguien activo y que me esté ignorando (Twitter, \n2023, México)\n2. … (porque así lo disque quiere, enamoramiento ni amor de romance ni por aso-\nmo)… (Twitter, 2023, México)\n3. …. y cuando me pinches llamaste a mi? (Twitter, 2012, México)\n4. … y ya me dizque regaño por quedarme viendo el concierto (Twitter, 2022, México)\nVale preguntarse por qué solo dizque y pinches se permiten en esa posición, y no otros \nadverbios. Si acudimos a cuestiones semánticas, dizque tiene un valor evidencial bien \natestiguado en descripciones como las de García Fajardo (2007), De la Mora y Maldona -\ndo (2015), Martínez Levy (2019) o Demonte (2020), mientras que pinches tiene un valor \nintensificador de acuerdo con Quepons Ramírez (2015, 2019); este factor no parece ser \ndeterminante, ya que intentar introducir otros adverbios con valores evidenciales o in -\ntensificadores entre pronombres átonos y verbos resulta en construcciones agramaticales:\n(6)\n1. *Te bastante amo (vs. Te amo bastante )\n2. *Lo demasiado odio (vs. Lo odio demasiado)\n4\u2009En el corde dizque se atestigua hasta finales del siglo xv, mientras que pinche se atestigua ape-\nnas hasta finales del siglo xix como sustantivo, siendo su uso adverbial muy reciente y originado a \npartir de un estado adjetival intermedio (Quepons Ramírez 2015, 2022).\n5\u2009El corde contiene datos desde el siglo xiii hasta 1974.\n6\u2009El cemca contiene datos desde 1921 hasta 1974.\n7\u2009El crea contiene datos desde 1974 hasta el año 2000.\n8\u2009El corpes contiene datos desde el año 2000 hasta 2022.\n100 cArloS de jeSúS WAgner oviedo\nLM V-2 \nLingüística Mexicana. Nueva Época, v (2023), núm. 2: 97-109  \nISSN: 2448-8194', 'Estudios de Lingüística Aplicada, año 43, número 80, enero de 2025, pp. 7–48\ndoi:10.22201/enallt.01852647p.2025.80.1097\nSistema judicial y lengua vasca en España: una glotofobia persistente [ 25 ]\nuna presunción de conocimiento de la lengua de Cervantes (Parla-\nmento Vasco, 2023: 5).\nNo obstante, dicho Tribunal precisa que la declaración de coo-\nfi  cialidad implica “la obligación de facilitar, por parte de los pode-\nres públicos competentes, el conocimiento de la lengua [vasca] y, \nen este sentido, ofi  cialidad signifi  ca enseñanza de la lengua [pro-\npia] y posibilidad correlativa de acceso a su conocimiento” (Par-\nlamento Vasco, 2023: 5). A su vez, la Ley Orgánica 1/1990, de 3 \nde octubre, de Ordenación General del Sistema Educativo (boe, \n1990a), que regula en todo el Estado español la ordenación del \nsistema educativo,\nestablece de forma pormenorizada la capacitación en las len-\nguas ofi  ciales que deben conseguir los alumnos en cada uno de \nlos niveles de enseñanza, fi  jando siempre un nivel de capaci-\ntación igual para las lenguas propias de las Comunidades Au-\ntónomas y para el castellano. Por consiguiente [en teoría] en \nlas Comunidades Autónomas con régimen de doble ofi  cialidad \nlingüística, los alumnos que superen la enseñanza obligatoria \nhabrán acreditado los conocimientos requeridos tanto de la len-\ngua castellana como de la lengua ofi  cial propia de la Comuni-\ndad Autónoma (Parlamento Vasco, 2023: 6).\nSin embargo, el Diagnóstico del Sistema Educativo Vasco para el \n2021 demuestra que, en la práctica, si la enseñanza del euskera y \nen la lengua propia del territorio está en el origen de 200 000 vas-\ncohablantes adicionales desde inicios de los años 1980 y 71.4% de \nla población de entre 16 y 24 años es bilingüe activa 12 (Gobierno \n12 Esto resulta, entre otros factores, “del esfuerzo del conjunto de la comuni-\ndad educativa, empezando por el del personal docente para mejorar su perfi  l \nlingüístico (hace 40 años, al inicio del proceso, tan solo el 8% era capaz de \nenseñar en euskera, mientras que, en la actualidad, en torno a un 95% está ca-\npacitado para ello); y también de la fi  rme apuesta de padres y madres por mo-', 'Sujeto morfológico  (Estar + gerundio ) Presente progresivo\nTotal de verbos (estar + gerundio presente) producidos + requeridos \n1ª sg. 2ª sg. 3ª sg. 1ª pl. 2ª pl. 3ª pl.\nSuj.morf\nV+flex\nSingular\nAciertos\nii\nReglas defectivas Productividad\nSuj.morf\nV+flex\nPlural\nAciertos\nii\nReglas defectivas Productividad\nOmisiones Comisiones\n%\nAciertos\nii\nOmisiones Comisiones %\nAciertos\nii\nSin verbo V. Infiniti-\nvo(-flex)\n Flexiones\n inadecuadas Sin verbo V. Infinitivo(-flex)  Flexiones \ninadecuadas\nAux. Gdo. Aux. Gdo. Aux. Gdo. Aux. Gdo.\n1ª sg.\n(yo)\nEstoy\ncant-ando\ncom-iendo\nviv-iendo\n1ª pl.\n(nosotros/as)\nEstamos\ncant-ando\ncom-iendo\nviv-iendo\n% % % %\n% % % (-)precisión \nléxica\n% % % (-)precisión \nléxica\n% %\n2ª sg.\n(tú)\nEstás\ncant-ando\ncom-iendo\nviv-iendo\n2ª pl.\n(ustedes)\nEstán\ncant-ando\ncom-iendo\nviv-iendo\n% %\n% % % (-)precisión \nléxica\n% % % (-)precisión \nléxica\n%%\n3ª sg.\n(él/ella)\nEstá\ncant-ando\ncom-iendo\nviv-iendo\n3ª pl.\n(ellos/as)\nEstán\ncant-ando\ncom-iendo\nviv-iendo\n% %\n% % % (-)precisión \nléxica\n% % % (-)precisión \nléxica\n%%\n22\nLM III-1 Jalina RamíRez GRycuk\nLingüística Mexicana. Nueva Época, III (2021), núm. 1: 7-33  \nISSN: 2448-8194', 'Estudios de Lingüística Aplicada, año 39, número 72, enero de 2021, pp. 9–48\ndoi: 10.22201/enallt.01852647p.2021.72.926\n[ 34 ]  Kent Fredholm\nDucar and Schocket (2018) discussed how context-driven levels \nof formality are rendered differently in gt searches from English \nto Spanish or French, stating that gt uses the informal second \nperson singular in Spanish translations of the English you, but the \nformal second person plural in translations to French. In the 3995 \ngt searches analyzed in our study, gt did render the English you\n(both as subject and object) and your, as the Spanish informal tú, \nte, tu and tus in most cases, but exceptions were also found, espe-\ncially concerning the possessive pronouns. When the Swedish du\nwas used, the search results were highly inconsistent, repeatedly \nshowing translations with alternating second person singular and \nthird person singular verbal endings within a few seconds after \neach other. The excerpt shown in Table 9 gives a typical exam-\nple of confusing pronoun search results when Beata looked for \nthe correct translation of dig ‘you’ (2 nd p. sg. dir. obj.). The fi  nal \nscreen outcome shows how she added punctuation to change the \ntranslation.\nTABLE 9. Changing pronouns. Beata: 1\nTIME MARK GT SEARCH GT RESULT\n30’47’’\n‘no-one must decide for you’ ‘no-one must decide about you’\nWrites pienso que de nadie debe decidir sobre in the text, looking four times at the search result.\n31’35’’\n‘you’ [2nd p. sg. obj.] ‘you’ [3rd p. sg. subj.]\n31’39’’\n‘you’ [2nd p. sg. subj.] ‘you’ [3rd p. sg. subj.]\ningen ska bestämma över dig nadie debe decidir sobre ti\n27 / 5000 föreslå en förändring\ndig usted\n3 / 5000 föreslå en förändring\ndu usted\n3 / 5000 föreslå en förändring', 'El chisme: estrategias discursivas desplegadas en su construcción 17\nEstudios de Lingüística Aplicada, año 36, número 67, julio de 2018, pp. 9–43\ndoi: 10.22201/enallt.01852647p.2018.67.723\nEl formato en la presentación de los ejemplos en la parte analítica es el si -\nguiente: en primer lugar, entre paréntesis aparece el número de ejemplo y el \ntítulo del chisme. En las siguientes filas se presenta el fragmento de la conversa-\nción, alineados a la izquierda aparece el turno de habla y, con letra mayúscula, \nla inicial del hablante seguida de dos puntos y su participación. Al interior de las \nparticipaciones, en negritas, aparece el foco del análisis de ese fragmento en es-\npecífico (véase Figura 1).\nEl sistema de transcripción utilizado es, con algunas modificaciones, el propues-\nto por el grupo Val.Es.Co. (Briz, 2003) (véase Anexo B), interesado en el análi-\nsis y descripción de la lengua coloquial, en especial del español. Se trata de un \nsistema que combina el método ortográfico con la propuesta del análisis de la \nconversación (ac) adaptado a las características de la lengua española. Como \nse especializa en fenómenos conversacionales, se enfoca en cuestiones relacio-\nnadas con la alternancia de turnos, la sucesión inmediata de emisiones, solapa-\nmientos, reinicios y autointerrupciones, rupturas conversacionales, pausas y si -\nlencios, entonación, fenómenos de énfasis, problemas relacionados con emisio-\nnes dudosas o indescifrables, alargamientos fonéticos, preguntas retóricas, estilo \ndirecto, referencias contextuales, entre otros (Briz, 2003).\nFigura 1. Formato de presentación de los ejemplos', 'introducción\ne \nn este trabajo se explorará el estatus morfológico de pinches y dizque en cons-\ntrucciones en las cuales dichos morfemas aparecen entre las marcas de objeto y \nlos verbos, tal como se puede observar a continuación:\n(1) \n1. Ni los de la micro donde te dizque subiste a hacer un spot (Twitter, 2018, México).\n2. NO TE PINCHES RINDAS (Twitter, 2023, México).\n3. Mi tiktok la pinches banearon (Twitter, 2023, México).\n4. Sin embargo a la persona que te dizque capacita (Enriquez Servicios Obras y Su -\nministros S.A DE C.V - Carrera y Empleo, 2023).\nLos ejemplos de (1) resultan problemáticos ya que pinches y dizque se consideran \nadverbios de acuerdo con Quepons Ramírez (2015, 2022) y el Diccionario de la lengua \nespañola (asale y rae 2021)\n1, y en el español mexicano actual el situar adverbios entre \nlos pronombres de objeto átonos y los verbos resulta prácticamente imposible (2 y 3).\n(2)\n1. José se lo dijo a Juan ayer \n2. *José se lo a Juan dijo ayer\n1\u2009El desarrollo histórico y la justificación del estatus adverbial de ambas palabras quedan fuera \nde los alcances del presente trabajo, por lo que se remite al lector a las obras de Quepons Ramírez \n(2015, 2022) y Magaña (2005) para pinches y dizque, respectivamente.\nquite anomalous to place the adverbs between unstressed pronouns \nand verbs. This fact seems to be supported by the recent proposal by \nHaspelmath (2022d) in which it is considered that the object clitics of \nthe Romance languages   are affixes based on the selectivity criterion \nsince these morphemes can only be attached to verbs and not to other \nlexical classes. In this sense, since they are prefixes and form part of \nthe verbal word, they do not represent a counterproof to Haspelmath’s \nproposal.\n98 cArloS de jeSúS WAgner oviedo\nLM V-2 \nLingüística Mexicana. Nueva Época, v (2023), núm. 2: 97-109  \nISSN: 2448-8194']","The analysis of morphemes in the Spanish language involves studying the smallest units of meaning in words. Morphemes can be classified into two main categories: free morphemes, which can stand alone as words (e.g., ""book,"" ""run""), and bound morphemes, which must be attached to other morphemes to convey meaning (e.g., prefixes, suffixes).

In the context of the linguistic articles provided, the analysis of morphemes focuses on specific morphemes like ""pinches"" and ""dizque"" in constructions where they appear between object pronoun markers and verbs. These morphemes are typically considered adverbs, but their placement in certain constructions challenges traditional grammatical structures in the Spanish language.

The analysis delves into the morphological status of these morphemes, their historical development, and their syntactic behavior in contemporary Spanish, particularly in Mexican Spanish. The articles explore how these morphemes challenge conventional grammar rules and propose new insights into their linguistic functions within the language."
What is the significance of 'Nueva Época' in LM V-2 Lingüística Mexicana?,"['LM V-2 Lingüística Mexicana. Nueva Época, v (2023), núm. 2: 73-94 ISSN: 2448-8194']","Nueva Época is featured in LM V-2 Lingüística Mexicana as a specific volume, indicating a new era or phase within the linguistic research journal.",single_hop_specifc_query_synthesizer,"['El chisme: estrategias discursivas desplegadas en su construcción 13\nEstudios de Lingüística Aplicada, año 36, número 67, julio de 2018, pp. 9–43\ndoi: 10.22201/enallt.01852647p.2018.67.723\nsonas ausentes (comportamientos, características o acciones) o a terceras perso-\nnas presentes, pero cuyo aspecto a valorar aparece como temporalmente inactivo.\nLa propuesta de análisis de la conversación casual de Eggins y Slade (1997) \nes la que da sustento a la descripción del chisme y que, a su vez, parte de los \nprincipios básicos e iniciales de la teoría de la valoración para encontrar las for -\nmas gramaticales, semánticas y discursivas mediante las que se realiza el chis-\nme. Una conversación casual (Eggins & Slade, 1997) es una manifestación lin-\ngüística en donde se negocia la construcción de la realidad social y tiene como \nobjetivos afirmar y reconfirmar, establecer y mantener relaciones. Desde esta \nperspectiva, las autoras se preguntan: ¿cómo se estructura la lengua para permi-\ntirnos hacer conversaciones? Primero, dividen en dos tipos las secuencias con -\nversacionales: las secuencias chat (extremadamente interactivas, en las que se \ndespliega una rápida alternancia de turnos) y las secuencias chunk (bloques con \nuna estructura interna predecible que puede ser descrita y analizada de acuerdo \ncon el género conversacional al que pertenecen).\nPara Eggins y Slade (1997), el chisme constituye un tipo de secuencia \nchunk en el que se distinguen al menos tres etapas obligatorias, es decir, aque-\nllas que lo definen como género conversacional y que le son exclusivas: el enfo-\nque en la tercera persona (third person focus) o identificación de los caracteres, \nla exposición del comportamiento probatorio (substantiating behavior) y la eva-\nluación peyorativa (pejorative evaluation).\nLos planteamientos de Eggins y Slade (1997) encuentran en la teoría de la \nvaloración (Martin, 2000; White, 2001, 2011; Kaplan, 2004, 2007; Martin & \nWhite, 2005; entre otros) el entramado teórico que los sustenta. Los analistas del \ndiscurso enmarcados en esta corriente buscan describir los sistemas de opciones \nsemánticas que ofrece la lengua para evaluar, adoptar posiciones, construir suje-\ntos textuales o identidades discursivas, asumir roles, negociar relaciones y pro-\nmover como naturales las posiciones intersubjetivas que son, en última instancia, \nideológicas (Kaplan, 2007). En particular, este enfoque se centra en la expre -\nsión lingüística de la actitud y el compromiso asumido por el emisor frente a sus \nenunciados. Del mismo modo indaga sobre las estrategias mediante las cuales el \nemisor se alía o se distancia de los receptores. En otras palabras, esta perspectiva \ndel análisis del discurso explora, describe y explica cómo es utilizado el lenguaje \npara gestionar posicionamientos y relaciones interpersonales (White, 2011).', 'El chisme: estrategias discursivas desplegadas en su construcción 37\nEstudios de Lingüística Aplicada, año 36, número 67, julio de 2018, pp. 9–43\ndoi: 10.22201/enallt.01852647p.2018.67.723\nparticipación las hablantes calculan y conjeturan cómo serán recibidas y eva -\nluadas sus emisiones por parte de la interlocutora, dependiendo de las relacio -\nnes interpersonales previas así como de la forma en que se esté desarrollando la \nconversación. El análisis me permite concluir que, en el contexto estudiado, los \nchismes son posibles en la medida en que se despliegan estrategias discursivas \nque están bajo el cuidado constante de la mitigación y que se corroboran o se \nmodifican constantemente gracias al uso de las estrategias interactivas.\nPuede añadirse que el grado de participación por parte de las hablantes en el \nchisme no es simétrico. La participación está en función de la cantidad de infor -\nmación que posean o de las estrategias interactivas que utilicen. El acercamiento \nque propongo, además de brindar una aproximación al chisme desde el análisis \ndel discurso, busca problematizar su estudio, ponerlo sobre la mesa de las inves-\ntigaciones actuales, evidenciando su alto valor interactivo, social y discursivo.\nEste estudio, si bien no agota el tema, pretende ser una llamada de atención \npara que los investigadores mexicanos de distintas áreas, pero sobre todo de la \nlingüística, posen su mirada en la práctica comunicativa denominada chisme. \nHay varias vetas que quedan abiertas. Sería muy interesante estudiar discursi-\nvamente el chisme desde otras perspectivas analíticas o en otros contextos, por \nejemplo, entre hombres.\n6. Referencias\nAhmed, Sara (2010). Analysing women’s talk and gossip between two female friends. En In -\nnervate. Leading Undergraduate Work in English Studies, (3), 1–14. Recuperado de  \nhttps://www.nottingham.ac.uk/english/documents/innervate/10-11/1011ahmedwomentalk.pdf\nBajtín, Mijaíl M. (1981). The dialogic imagination: Four essays. Austin: University of Texas \nPress.\nBajtín, Mijaíl M. (2005 [1982]). Estética de la creación verbal. México: Siglo xxi.\nBaumeister, Roy F.; Zhang, Liqing, & V ohs, Kathleen D. (2004). Gossip as cultural learn-\ning. Review of General Psychology, 8(2), 111–121. Recuperado de http://citeseerx.ist.psu.\nedu/viewdoc/download?doi=10.1.1.186.4613&rep=rep1&type=pdf\nBergmann, Jörg R. (1993). Discreet indiscretions: The social organization of gossip. Nueva York: \nAldine de Gruyter.', '38 Fabiola Esmeralda López Rodríguez\nEstudios de Lingüística Aplicada, año 36, número 67, julio de 2018, pp. 9–43\ndoi: 10.22201/enallt.01852647p.2018.67.723\nBergmann, Jörg R., & Luckmann, Thomas (1995). Reconstructive genres of everyday commu-\nnication. En Uta M. Quasthoff (Ed.), Aspects of oral communication (pp. 289–304). Berlín: \nDe Gruyter Mouton.\nBriz Gómez, Antonio (2003). La transcripción de la conversación. El sistema Val.Es.Co. En \nAgustín Vera Luján, Ramón Almela Pérez, José María Jiménez Cano & Dolores Anunciación \nIgualada Belchí (Coords.), Homenaje al profesor Estanislao Ramón Trives (vol. 1, pp. 141–\n160). Murcia: Servicio de Publicaciones de la Universidad de Murcia.\nChafe, Wallace L., & Nichols, Johanna (Eds.) (1986). Evidentiality: The linguistic coding of \nepistemology. Norwood: Ablex.\nCox, Bruce A. (1970). What is Hopi gossip about? Information management and Hopi factions. \nMan, 5(1), 88–98. Recuperado de http://www.jstor.org/stable/2798806\nDe León Torres, María Soledad (2010). Chisme y control social. En María Soledad de León \nTorres, Palabra de mujer: familia, género y narrativas en Totatiche, Jalisco (pp. 103–138). \nMorelia: El Colegio de Michoacán.\nDunbar, Robin I. M. (1996). Grooming, gossip and the evolution of language. Londres: Faber & \nFaber.\nEder, Donna, & Enke, Janet Lynne (1991). The structure of gossip: Opportunities and con-\nstraints on collective expression among adolescents. American Sociological Review, 56(4), \n494–508. Recuperado de https://www.jstor.org/stable/2096270\nEggins, Suzanne, & Slade, Diana (1997). Analysing casual conversation. Londres: Cassell.\nFine, Gary Alan (1985). Rumors and gossiping. En Teun A. van Dijk (Ed.), Handbook of dis-\ncourse analysis. Vol. 3. Discourse and dialogue (pp. 223–236). Londres: Academic Press.\nGluckman, Max (1963). Papers in honor of Melville J. Herskovits: Gossip and scandal. Current \nAnthropology, 4(3), 307–316. Recuperado de http://www.jstor.org/stable/2739613\nGluckman, Max (1968). Psychological, sociological and anthropological explanations of witch-\ncraft and gossip: A clarification. Man, 3(1), 20–34. Recuperado de http://www.jstor.org/ \nstable/2799409\nGoffman, Erving (1991). Los recursos seguros. En Yves Winkin (Comp.), Los momentos y sus \nhombres (pp. 99–106). Barcelona: Paidós.\nGoodman, Robert F., & Ben-Ze’Ev, Aaron (Eds.) (1994). Good gossip. Lawrence: University \nPress of Kansas.\nHall, Joan Kelly (1993a). Oye oye lo que ustedes no saben: Creativity, social power, and politics \nin the oral practice of chismeando. Journal of Linguistic Anthropology, 3(l), 75–98. Recupe-\nrado de https://www.jstor.org/stable/43102870', 'Hugo H. Morales del Valle20\nFigura 7. Oscilograma, espectrograma y curva melódica del enunciado Es muy variable, producido por un hombre \nde Pénjamo, nacido entre 1945 y 1964, con estudios superiores\nEn la tabla 5, reproducimos una tabla de contingencia con los predictores que fue-\nron significativos de acuerdo con la regresión logística escalonada. De los predictores \npropuestos como potenciales variables explicativas, fueron significativos el año de naci-\nmiento, el corpus y las ciudad de origen, jerarquizados según su valor de p.\nTabla 5. Tabla de contingencia de los predictores significativos para L+H*L%\nPredictor Factor F/N % logodds\nNacimiento\n(p = 2.74e-09)\n1965-1984\n1919-1944\n1945-1964\n1985-1999\n55/240\n69/209\n54/330\n23/240\n22.92\n33.01\n16.36\n9.58\n0.466\n0.363\n-0.256\n-0.573\nCorpus\n(p = 0.00483)\nALM\n2019\n91/299\n110/720\n30.43\n15.28\n0.351\n-0.351\nCiudad\n(p = 0.0424)\nSan Felipe\nPénjamo\nLeón\nGuanajuato\n65/260\n48/250\n46/249\n42/260\n25.00\n19.20\n18.47\n16.15\n0.367\n-0.005\n-0.129\n-0.232\nTotal 201/1019 19.73\nComo señalamos arriba, los factores del predictor con el valor positivo de logodds son \nlos que favorecen el patrón L+H*L%. En este sentido, quienes patrocinan la entonación \ncircunfleja son las personas nacidas en los periodos 1919-1944 y 1965-1984 y las perso-\nnas originarias de San Felipe. Además, la probabilidad de registrar enunciados con esta \nconfiguración nuclear es mayor en el corpus del alm que en el corpus de 2019.\nLingüística Mexicana. Nueva Época, issn: 2448-8194 \nvol. vii (2025), núm. 2.', '52 Catherine Rhodes, Irma Yolanda Pomol Cahum & Miguel Óscar Chan Dzul\nEstudios de Lingüística Aplicada, año 36, número 68, diciembre de 2018, pp. 9–57\ndoi: 10.22201/enallt.01852647p.2018.68.861\n¿Qué idiomas hablas? (Selecciona las que apliquen) / What languages do you speak? \n(Select all that apply)\nMaya\nEspañol / Spanish\nInglés / English\nOtro(s), favor de especificar / Other(s), please specify\n¿Eres maestro(a) de lengua maya? / Are you a Maya language teacher?\nSí / Yes No\n¿En qué institución(es) impartes clases\xa0de lengua maya? / At what institution(s) do \nyou teach Maya language classes?\n¿Eres alumno de lengua maya? / Are you a Maya language student?\nSí / Yes No\n¿Dónde tomas o has tomado clases de lengua maya? / Where do you take or have \nyou taken Maya language classes?\n¿Cuáles diccionarios de lengua maya usas? Selecciona todos los que usas. / What Maya \nlanguage dictionaries do you use? Select all of the ones that you use.\nDiccionario Maya Popular: Maya-Español / Español-Maya (Academia de la Len -\ngua Maya de Yucatán)\nDiccionario Básico Español / Maya / Español (Bastarrachea Manzano, Briceño \nChel, Yah Pech) (cualquiera de sus ediciones / any of the editions)\nA Dictionary of the Maya Language as Spoken in Hocabá, Yucatán (Bricker, Po’ot \nYah, Dzul de Po’ot)\nDictionary & Phrasebook: Maya-English / English-Maya (Montgomery)\nDiccionario Español-Maya (Gaspar Maglah)\nDiccionario Introductorio Español-Maya / Maya-Español (Universidad de Quinta-\nna Roo, Gómez Navarrete)\nDiccionario Maya Cordemex', '12 Fabiola Esmeralda López Rodríguez\nEstudios de Lingüística Aplicada, año 36, número 67, julio de 2018, pp. 9–43\ndoi: 10.22201/enallt.01852647p.2018.67.723\n2. Marco teórico\nDiversas ciencias sociales y humanas entienden al chisme como un reflejo de \nlos modos en que concebimos la realidad y nuestra vida en sociedad, entre ellas \nla antropología (Gluckman, 1963, 1968; Paine, 1967, 1970; Cox, 1970; Handel-\nman, 1973; Wilson, 1974; Haviland, 1977; Fine, 1985; Vázquez García & Chá-\nvez Arellano, 2008, De León Torres, 2010; entre otros), la sociología (Levin & \nArluke, 1987; Goffman, 1991; Bergmann, 1993; Goodman & Ben-Ze’ev, 1994; \nBergmann & Luckmann, 1995; Pietrosemoli, 2009) y la psicología (Dunbar, \n1996; Baumeister, Zhang & V ohs, 2004; Rosnow & Foster, 2005).1 En suma, a \ntodas las propuestas subyace la idea de que el chisme propicia formas particula-\nres de socializar y al mismo tiempo es producto de ellas.\nDesde la lingüística, autores como Eder y Enke (1991), Hall (1993a, \n1993b) y Ahmed (2010) analizan la estructura del chisme, pero difieren en el \npropósito final. Eder y Enke (1991) se centran en el orden de los actos por -\nque influye en la evolución de un chisme en la conversación. Por su parte, Hall \n(1993a, 1993b) busca explicar cuáles son los recursos que emplean los parti -\ncipantes para construir, mantener y modificar sus identidades al interior de un \ngrupo a partir de esta práctica oral cotidiana, importante y frecuente en diver -\nsos grupos culturales. Ahmed (2010) analiza a profundidad una conversación \nentre dos mujeres y, después de identificar y explicar los elementos lingüísticos \nutilizados, concluye que en la construcción del chisme están fuertemente im -\nplicadas las relaciones de poder que existen entre los participantes. Un trabajo  \nque destaco es el de Eggins y Slade (1997), quienes ven al chisme como uno de \nlos géneros más comunes y socialmente significativos de la conversación casual \nen inglés; en él la gente clasifica al mundo en términos de lo que debería o no \nhacerse. De estas autoras retomo no solo un marco de referencia sino también \nalgunas herramientas analíticas.\nEn general se acepta que gran parte de nuestras interacciones las dedicamos \nal chisme y que este es una conversación casual del tipo evaluativo —entre perso-\nnas que tienen familiaridad entre sí—, sobre asuntos concernientes a terceras per-\n1 Para acceder a una revisión exhaustiva respecto a cómo ha sido estudiado el chisme desde dis-\ntintas disciplinas se recomienda consultar a López Rodríguez (2015).']","In the context of the article ""El chisme: estrategias discursivas desplegadas en su construcción"" from Estudios de Lingüística Aplicada, 'Nueva Época' in LM V-2 Lingüística Mexicana refers to the new edition or volume of the journal ""Lingüística Mexicana."" It signifies a new period or phase of the journal, indicating that it is a different era or stage from the previous publications. This term is commonly used in academic journals to denote a fresh start or a renewed focus in the content and research presented."
Who is Esther Herrera and what contribution did she make in the linguistic analysis of tlapaneco?,"['Las palabras como unidades lingüísticas”, los editores, Esther Hernández y Pedro Martín Butragueño, y los autores que ahí participan, muestran el complejo entramado que puede representar la palabra como categoría de análisis lingüístico. Los editores de esta obra mencionan en la introducción que el objetivo primordial del libro no es realizar una discusión teórica o reflexión metalingüística de la palabra ni mucho menos un estado de la cuestión, sino más bien observar cómo ésta se presenta como un aleph borgeano con múltiples caras en el que se puede vislumbrar historia, grafías, sociedades, segmentos, lenguas, morfemas y significados interactuando y que, por metodología, se aterrizan en investigaciones puntuales cuyo fin es describir dichas unidades en la praxis de las lenguas de estudio. El libro consta de diecisiete artículos distribuidos en tres secciones: “Palabras prosódicas y gráficas”, “La dimensión morfosintáctica y las clases de palabra” y “El papel del léxico”. Estos apartados analizan las palabras desde la fonología, la morfosintaxis y la lexicología, pero debe advertirse al lector que los análisis de cada trabajo no se centran en un área, dado que resaltan la multidimensionalidad y las interfaces en la descripción de esta categoría. De esta manera, la primera parte, titulada “palabras prosódicas y gráficas”, reúne cuatro artículos que miran la cara fónica (y gráfica) de las palabras en tres lenguas: español (oral y escrito), tepehuano y tlapaneco. En primer lugar, Concepción Company trabaja sobre el concepto de la palabra gramatical en español a través del estatus que se le otorga en las prácticas escriturarias o usus escribendi, es decir, las reglas fónicas, morfológicas y sintácticas a nivel de la escritura gráfica en escritos fechados del siglo xvi al xix a partir de la noción de sandhi externo (elisiones, amalgamiento, asimilación, etc.) y su frecuencia de uso. Por su parte, Gil Burgoin discute la palabra fonológica en el tepehuano del norte, la cual entra en conflicto con los clíticos tonales, dado que el tono alto es una propiedad culminativa. Esto ocurre cuando los “clíticos” se sufijan a las raíces con tono alto alterando la buena formación de la palabra prosódica, por lo que la interacción es mediada por restricciones de marcación que brindan una solución al pro- blema del isomorfismo con la palabra morfológica. En el tlapaneco, Esther Herrera mues- tra también un conflicto entre la marcación morfológica y la palabra fonológica, cuyo tamaño mínimo debe ser de dos moras. El análisis es guiado por la polaridad encontrada en los paradigmas nominales correspondientes a las flexiones de 1ª, 2ª y 3ª persona del posesivo y la elisión de la marcación de la segunda persona, que es provocada por los re- querimientos de tamaño mínimo. Al mismo tiempo, la autora hace una gran aportación al reflexionar en torno a fenómenos de la subaplicación, la sobreaplicación y la aplica- ción desatinada para entender los casos residuales, lo que sobre todo revela la gran com- plejidad en torno a los paradigmas de formas de palabras de las lenguas otomangues. Al final de esta sección, Pedro Martín Butragueño, autor y editor de este volumen, analiza el tamaño y la métrica de las palabras prosódicas en español en contextos postléxicos, es decir, en enunciados donde hay interrelación con clíticos y otras unidades prosódicas. El trabajo propone recursividad en el nivel jerárquico de palabra prosódica y concluye que ésta tiende a formarse por dos sílabas. Además, señala que hay dos clases de palabras rítmicamente hablando: las monoico-yámbicas y las trocaico-dactílicas. Un gran acierto']","In the tlapaneco language, Esther Herrera shows a conflict between morphological marking and phonological words, where the minimum size must be two moras. Her analysis is guided by the polarity found in the nominal paradigms corresponding to the inflections of 1st, 2nd, and 3rd person possessive and the elision of second person marking, which is caused by the requirements of minimum size. Additionally, she makes a significant contribution by reflecting on phenomena like subapplication, overapplication, and misapplication to understand residual cases, revealing the complexity surrounding word form paradigms in Otomangue languages.",single_hop_specifc_query_synthesizer,"['diccionarios\nCompany Company, Concepción. 2010. Diccionario de mexicanismos, México: Siglo xxi.  \nMerriam Webster. 2020. Merriam-Webster Unabridged Dictionary, en <http://unabridged.\nmerriam-webster.com> [consultado en noviembre de 2020]. \nÁlvarez Mellado, Elena. Observatorio Lázaro, Universidad de Brandeis <https://ob-\nservatoriolazaro.es/acerca.html> [consultado en noviembre de 2020]. \nCambridge University Press. 2020. Diccionario Cambridge inglés-español, <https://dictio-\nnary.cambridge.org/es/diccionario/ingles-espanol> [Consultado en noviembre de \n2020]. \nHarper Collins Publishers. 2020.  Collins  Unabridged Spanish to English and English to \nSpanish Dictionary <https://www.collinsdictionary.com/es/diccionario/inglesespa-\nnol> [Consultado en noviembre de 2020].\nDiccionario del español de México (dem). 2010. México: El Colegio de México. <http://\ndem.colmex.mx> [consultado en noviembre de 2020]\nReal Academia Española. Diccionario de la lengua española , en <http://dle.rae.es/> \n[consultado en noviembre de 2020]. \n36 mayra Haydee Tafoya cisneros y liHiT andrea Velázquez lora\nLM IV-2 \nLingüística Mexicana. Nueva Época, IV (2022), núm. 2: 15-38  \nISSN: 2448-8194', 'Estudios de Lingüística Aplicada, año 41, número 76, enero de 2023, pp. 7–36\ndoi: 10.22201/enallt.01852647p.2023.76.1030\n[ 18 ] José Manuel Solís Navarro & Édgar Oswaldo González Bello\ncias sociales y humanidades en menor medida. Esto es atribuido \na las formas de construcción de conocimiento y la naturaleza aca-\ndémica de cada disciplina.\nAsí, el dominio del inglés supone diferentes áreas de análisis \nsegún las habilidades de la lengua (oral, auditiva, lectora, escrita). \nAdemás, junto con las formas de usar el idioma para la construc-\nción de conocimiento, se incluyen aspectos gramaticales de sin-\ntaxis, así como del vocabulario correspondiente a la naturaleza e \nintereses propios de las disciplinas.\n4. Método\nEsta investigación emplea un enfoque cuantitativo, no experimental \ny de alcance descriptivo-correlacional para analizar la relación en-\ntre distintas variables mediante pruebas estadísticas multivariables \n(Johnson & Christensen, 2017). Para la recolección de datos se \nutilizó una encuesta a través de un cuestionario en formato digital \n(http://mie.uson.mx/ingles/).\nEn cuanto a los sujetos, se obtuvo una muestra no probabilís-\ntica de 670 profesores de la Unison. Se consideraron académicos \nde todas las disciplinas, a excepción de quienes estaban adscritos \nal Departamento de Lenguas Extranjeras, debido a la naturaleza de \nlos contenidos y usos del inglés en sus actividades docentes. Las \ncaracterísticas de la muestra fueron: 53.9% del sexo masculino y \n46.1% del femenino; la edad de los participantes se ubicó entre los \n26 y 75 años (M = 48.6, DE = 11.61 años). Su antigüedad osciló \nentre 1 y 50 años (M  = 16.41, DE = 12.93 años). Con respecto a \ngrados de estudio, 31.8% contaba con maestría, obtenidas en su \nmayoría en México en un programa de calidad registrado por el \nConsejo Nacional de Ciencia y Tecnología (57.8%); solo 3.7% la \nrealizó en algún país de habla inglesa. A su vez, 58.1% de acadé-\nmicos había obtenido un doctorado; de estos, 37.5% lo acreditó \nen México en un programa de calidad y 5.5% en un país de habla \ninglesa. El resto de los profesores (10.1%) cuenta con grado de \nlicenciatura. En relación con los tipos de contrato, 51.3% cuenta', 'Entre santos, venados y pascolas\n 119\nLM VII-1\nLingüística Mexicana. Nueva Época, vii (2025), núm. 1\nISSN: 2448-8194\nTabla 4. Tabla de relación edad- si/no hablan la lengua yoremnokki\n Colaborador  ¿Qué personas hablan más seguido el yoremnokki?\n Colaborador 1   Los mayores a veces.\n Colaborador 2  Mi tío, mi abuela y mi mamá.\n Colaborador 3  Los viejitos.\n Colaborador 4  Algunos adultos, tíos, abuelos.\nEn esta tabla 4 se observa cuál es el grupo prototípico de hablantes de yoremnokki, \ny cabe señalar que los lugares en donde se hace presente la lengua son mayoritaria -\nmente de índole religioso. Es importante destacar que el uso de la lengua siempre está \ncondicionado a que haya alguien más que la entienda como interlocutor, aunque no la \nhable, por ello las conversaciones se limitan sólo a adultos, sobre todo a adultos de edad \navanzada.\nEn las notas de diario de campo y mediante la observación se pudo comprobar que \neste fenómeno se debe a que los jóvenes mencionan constantemente que “hay lenguas \nque te dan mejores oportunidades”, lo cual se refleja en la tabla 5.\nTabla 5. El aprendizaje de los idiomas\nColaboradores    ¿Si existieran cursos gratuitos para aprender idiomas cuáles te gustaría aprender?\nColaborador 1    Inglés, para hablar con mi tío.\nColaborador 2    Inglés y yoreme para poder conocer más gente que hable otros idiomas.\nColaborador 3    Inglés.\nColaborador 4    Inglés, francés y ruso; son los idiomas que más me interesan, me van mejor.\nAlgunas de las ideas que los jóvenes repetían constantemente son que se puede ac -\nceder al “éxito” a través de un idioma extranjero y la idea de que aprender español o \nun idioma extranjero es sinónimo de “progreso”; por ejemplo, algunos colaboradores \n(distintos a los que se registran aquí) mencionaron que para poder acceder a estudiar \nse debe hablar español. De esta manera se puede constatar que el aprendizaje de los \nidiomas está ligado estrechamente con su prestigio lingüístico, pues se sabe que un \nidioma de prestigio es hablado por un grupo social que normalmente tiene las mismas \ncualidades positivas que su idioma, en otras palabras, no es sorprendente que el presti-\ngio lingüístico desempeñe un papel fundamental en la formación de actitudes hacia los \nidiomas.\nRespecto al uso del yoremnokki en los medios de comunicación, se pudo atestiguar \nque los jóvenes tienen interés en que se cuente con la presencia de esta lengua en los \nmedios porque cronsideran que así se conocería más. Cabe mencionar que los medios \nde comunicación que se tienen en mente son actuales, más bien digitales, por eso se \nconsidera que valdría la pena rescatar el yoremnokki por estos medios, además de que \nsería una oportunidad de apropiase de espacios y captar otros posibles usuarios de esta \nlengua.', '¿cóMo MediR el bilingüisMo?\nTabla 2. Competencia de español en la Casa Comunitaria de la ciudad de Durango\nClasificación Resultado prueba\nInformantes Cualitativa Cuantitativa Fónico Léxico Sintáctico Total\nElías A A 23 50 22 95\nEmilio A A 23 48 22.5 93.5\nRosalinda B\nAlina B\nElisa B A 20 49.5 15 84.5\nRocío A\nOliva A\nGermán A\nElsa C C 16 35 4 55\nMarta C C 14 43 5.5 62.5\nIsaías A A 18 47.5 19.5 85\nCintia B B 16 48.5 11.5 76\nBasilio A A 22 50 19 91\nSilvia C B 15 44 10 69\nRodrigo A B 16 47 19.5 82.5\nTrinidad A A 17 45 13 75\nAlberta A A 24 49 18.5 91.5\nGilberto A A 23 48 21.5 92.5\nFabiola B B 19 47 12 78\nAndrés B B 21 42 12 75\nEstos seis casos en los que se muestra una diferencia en la clasificación comparten \ntambién el hecho de que los puntajes obtenidos en la prueba de medición pueden ser \nconsiderados de frontera. Esto es, si observamos los resultados de Silvia para la ciudad \nde Durango, se aprecia que cualitativamente fue clasificada dentro del grupo con me -\nnor conocimiento, pero al obtener un puntaje de 69 se reclasificó dentro del tipo B, de \nconocimiento medio, con un rango de aciertos de 67 a 83. Vemos entonces que el resul-\ntado obtenido por Silvia es muy cercano a los valores más bajos de esta clasificación. \nLos resultados de este tipo nos muestran que el bilingüismo, a pesar de que por razones \nmetodológicas se hagan subdivisiones en tipos, es un fenómeno continuo. Esto nos per-\nmite nuevamente traer a cuento lo expuesto por Weinreich (1968 [1953]), quien insiste \nen que la evaluación o la clasificación en tipos de bilingüismo no se base en la idea de \nnormalidad y, sobre todo, que el nivel que muestren los hablantes de dos o más lenguas \ncambiará según las dinámicas sociales en las que se encuentre inmerso el hablante. Es \ndecir, las puntuaciones no se quedarán fijas, sino que se irán modificando a partir de la \nhistoria de vida de cada uno de los miembros de una comunidad bilingüe.\n79\nLM I-3\nLingüística Mexicana. Nueva Época, I (2019), núm. 3 (Especial): 63-89\nISSN: 2448-8194', '2003. Real Academia Española. Diccionario de la lengua española , 22ª edición. Espasa \nCalpe, Madrid, 2001; 2 tomos, LVII + 2368 pp. En Revista Internacional de Lingüística \nIberoamericana 1, núm. 1: 225-232.\n2004. Ana Isabel Navarro Carrasco. Léxico de Estepona. Según datos del alea y del lmp. \nUniversidad de Alicante, Salamanca, 2001; 387 pp. En Nueva Revista de Filología His-\npánica 52, núm. 1: 178. <https://doi.org/10.24201/nrfh.v52i1.2230>\n4. tesIs\n1982. Problemática de la macroestructura en los diccionarios de lengua, tesis de licenciatura. \nMéxico: Facultad de Filosofía y Letras, Universidad Nacional Autónoma de México. \n2006. Tratamiento lexicográfico de los mexicanismos y seudomexicanismos en los dicciona-\nrios académicos, tesis de doctorado. México: El Colegio de México.\n5. documentos InédItos.\ns.f. “El español mexicano desde el punto de vista dialectal. Importancia relativa del léxi-\nco dialectal en el dem. Posiciones posibles del dem”, en Documento de trabajo para el \nDiccionario del Español de México. México: El Colegio de México, manuscrito.\n1980a. Guía de estudios: el español de América. México: Facultad de Filosofía y Letras-Uni-\nversidad Nacional Autónoma de México, manuscrito.\n1980b. Guía de estudios lexicológica y semántica. México: Facultad de Filosofía y Letras- \nUniversidad Nacional Autónoma de México, manuscrito.\n1982. “Problemas de macroestructura”, en Manual de redacción del dem. (Documento de \ntrabajo para el Diccionario del Español de México). México: El Colegio de México, \nmanuscrito.\n1987. Evaluación de ocho diccionarios con respecto al  Diccionario básico del español de \nMéxico. (Documento de trabajo para el Diccionario del Español de México). México: \nEl Colegio de México, manuscrito.\nCiudad de México, diciembre de 2022\nNiktelol Palacios\nEl Colegio de México\nniktelol@colmex.mx\n158\nLM V-1 \nLingüística Mexicana. Nueva Época, v (2023), núm. 1: 153-158  \nISSN: 2448-8194\nbibliogRafÍa de luz feRnández goRdillo']","Esther Herrera is a linguist who has made significant contributions to the linguistic analysis of Tlapaneco, a language spoken in Mexico. In her work, she has focused on studying the phonetics, phonology, morphology, and syntax of the Tlapaneco language. Herrera's research has helped to document and analyze the linguistic features of Tlapaneco, contributing to our understanding of this indigenous language and its structure. Her work has been valuable in preserving and promoting the study of Tlapaneco within the field of linguistics."
What is the focus of the research on 'portugués' in the context of bilingual language assessment tools?,"['De esta manera, en “Léxico disponible y análisis de errores: un estudio de caso de portugués lengua extranjera”, Eréndira Camarena Ortiz analiza el papel del error como elemento constitutivo del proceso de adquisición de una segunda lengua. Es así como, a partir de las encuestas de léxico disponible aplicadas a un grupo de 104 alumnos universitarios, estudiantes de nivel intermedio de portugués, la autora se da a la tarea de detectar y organizar de manera sistemática los errores más comunes que éstos suelen cometer en cuanto a ortografía, interferencia léxica, transferencia léxica, sobregeneralización, hipercorrección, hibridación e invención léxica. En lo personal, me pa- rece que el hallazgo más interesante de este artículo es el modo como los estudiantes diseñan estrategias para producir palabras potenciales en función de sus intuiciones y conocimientos lingüísticos; de esta manera se hace patente la influencia que se puede dar entre dos lenguas con similitudes estructurales, como el español y el portugués, lo cual permite comprender las distintas variables que propician la aparición de fenómenos de interlengua observables en los datos recabados. En este sentido, no sólo se trata de considerar en qué nivel de aprendizaje se encuentra la población bajo estudio, sino que resulta igualmente importante conocer cuál es su lengua materna y qué otras lenguas han estudiado con anterioridad para comprender mejor las dificultades a las que habrá de enfrentarse en su proceso de aprendizaje y, por consiguiente, elaborar materiales didácticos específicos para distintos tipos de estudiantes. Por su parte, en el capítulo 4, “El léxico en el salón de clase de portugués como lengua extranjera: promoción de su aprendizaje mediante estrategias metacognitivas”, Leonardo Herrera González presenta los resultados de poner en práctica ciertas activi - dades focalizadas para fomentar y consolidar la competencia léxica de los alumnos de portugués como lengua extranjera. A partir del Modelo de lexicón mental propuesto por Ulrike Oster, Herrera González nos recuerda la complejidad de las palabras en cuan - to unidades lingüísticas vinculadas con información de tipo fonológico, grafemático, morfológico, sintáctico y semántico. Es justamente esta complejidad la que obliga a los profesores de lengua a buscar métodos eficaces para asegurar que el estudiantado logre comprender y retener los insumos léxicos que aprende en clase. A este respecto, median- te el subcomponente llamado Léxico disponible del portugués como LE para fines específicos se han desarrollado algunas actividades pedagógicas para impulsar, favorecer y afianzar el aprendizaje de léxico vinculado con distintos centros de interés. Tras hacer un listado del conjunto de actividades que se pueden emplear en el aula para dar cuenta de su apli- cabilidad, Leonardo Herrera describe la implementación de dos actividades utilizadas en el salón de clases para activar el conocimiento léxico de los estudiantes hispanoha - blantes de portugués de la Escuela Nacional de Lenguas, Lingüística y Traducción. De esta forma, sopesa las ventajas y alcances de ambos ejercicios para después reconocer algunas áreas de oportunidad que se deben explorar para continuar con los trabajos de sistematización y enseñanza del léxico en el aula.']","The research focuses on analyzing the errors commonly made by university students at an intermediate level of Portuguese as a foreign language. It delves into spelling mistakes, lexical interference, lexical transfer, overgeneralization, hypercorrection, hybridization, and lexical invention. Additionally, the study explores how students develop strategies based on their linguistic intuitions and knowledge to produce potential words, highlighting the influence of structural similarities between languages like Spanish and Portuguese.",single_hop_specifc_query_synthesizer,"['Estudios de Lingüística Aplicada, año 35, número 65, julio de 2017, pp. 11–36\nModelos temporales aplicados a la enseñanza del pretérito y copretérito 17\ndoi: 10.22201/enallt.01852647p.2017.65.725\nOtra interpretación del aspecto perfectivo e imperfectivo queda recogida en Gar-\ncía Fernández (1998), quien defiende que la puntualidad y la duración son pro -\npias del modo de acción 6 y no del aspecto gramatical. Para el autor el aspecto \nperfectivo nos permite ver la situación referida por el verbo desde su principio \nhasta su fin, mientras que el imperfectivo solo nos muestra una parte interna de la \nsituación. Estos dos tipos de aspectos poseen, a su vez, diferentes modalidades: \nla ingresiva y terminativa para el aspecto perfectivo, como en (11a-b), y la pro -\ngresiva, habitual y continua para el imperfectivo, como en (12 a-c):\n(11)  a. A las tres Marcos tocó la serenata.\n b. Ayer leí el periódico.\n(12)  a. A las cinco, Juan escribía una carta, pero no sé si la terminó.\n b. Siempre jugaba al fútbol con sus amigos.\n c.  Era  alto.\nEsta interpretación también ha recibido críticas por atribuir al pretérito y copre -\ntérito valores provenientes de elementos lingüísticos adyacentes (Rojo & Veiga, \n1999: 2901).\n2.3. Modelos discursivos\nLos modelos discursivos se proponen llevar a cabo un análisis del comporta -\nmiento de las formas verbales a nivel supra-oracional, donde tiene lugar el uso \nde las formas lingüísticas con determinadas intenciones comunicativas. Entre \nestos modelos destaca el de Weinrich (1968) quien, tras negar toda validez a las \ncategorías de tiempo y aspecto, 7 organiza el sistema verbal a partir de los con -\n6 Entendemos, siguiendo a De Miguel (1999), que el modo de acción, aspecto léxico o Aktionsart \nno consiste únicamente en la información proporcionada por el lexema verbal sino precisamen -\nte por la interacción del mismo con las diferentes unidades sintácticas oracionales que confor -\nman la clasificación cuatripartita en estados (saber, gustar, tener) caracterizados por los rasgos \n[+ duración, – dinamismo, – delimitación], actividades (correr por el parque) conformadas por \nlas propiedades [+ duración, + dinamismo, – delimitación], realizaciones (correr una hora) de-\nfinidas por los rasgos [+ duración, + dinamismo, + delimitación] y logros (caerse, nacer) carac-\nterizados por los rasgos [– duración, + dinamismo, + delimitación].\n7 En palabras de Weinrich: “No existen aspectos lingüísticos y tenemos que eliminar de la cien -', 'El chisme: estrategias discursivas desplegadas en su construcción 13\nEstudios de Lingüística Aplicada, año 36, número 67, julio de 2018, pp. 9–43\ndoi: 10.22201/enallt.01852647p.2018.67.723\nsonas ausentes (comportamientos, características o acciones) o a terceras perso-\nnas presentes, pero cuyo aspecto a valorar aparece como temporalmente inactivo.\nLa propuesta de análisis de la conversación casual de Eggins y Slade (1997) \nes la que da sustento a la descripción del chisme y que, a su vez, parte de los \nprincipios básicos e iniciales de la teoría de la valoración para encontrar las for -\nmas gramaticales, semánticas y discursivas mediante las que se realiza el chis-\nme. Una conversación casual (Eggins & Slade, 1997) es una manifestación lin-\ngüística en donde se negocia la construcción de la realidad social y tiene como \nobjetivos afirmar y reconfirmar, establecer y mantener relaciones. Desde esta \nperspectiva, las autoras se preguntan: ¿cómo se estructura la lengua para permi-\ntirnos hacer conversaciones? Primero, dividen en dos tipos las secuencias con -\nversacionales: las secuencias chat (extremadamente interactivas, en las que se \ndespliega una rápida alternancia de turnos) y las secuencias chunk (bloques con \nuna estructura interna predecible que puede ser descrita y analizada de acuerdo \ncon el género conversacional al que pertenecen).\nPara Eggins y Slade (1997), el chisme constituye un tipo de secuencia \nchunk en el que se distinguen al menos tres etapas obligatorias, es decir, aque-\nllas que lo definen como género conversacional y que le son exclusivas: el enfo-\nque en la tercera persona (third person focus) o identificación de los caracteres, \nla exposición del comportamiento probatorio (substantiating behavior) y la eva-\nluación peyorativa (pejorative evaluation).\nLos planteamientos de Eggins y Slade (1997) encuentran en la teoría de la \nvaloración (Martin, 2000; White, 2001, 2011; Kaplan, 2004, 2007; Martin & \nWhite, 2005; entre otros) el entramado teórico que los sustenta. Los analistas del \ndiscurso enmarcados en esta corriente buscan describir los sistemas de opciones \nsemánticas que ofrece la lengua para evaluar, adoptar posiciones, construir suje-\ntos textuales o identidades discursivas, asumir roles, negociar relaciones y pro-\nmover como naturales las posiciones intersubjetivas que son, en última instancia, \nideológicas (Kaplan, 2007). En particular, este enfoque se centra en la expre -\nsión lingüística de la actitud y el compromiso asumido por el emisor frente a sus \nenunciados. Del mismo modo indaga sobre las estrategias mediante las cuales el \nemisor se alía o se distancia de los receptores. En otras palabras, esta perspectiva \ndel análisis del discurso explora, describe y explica cómo es utilizado el lenguaje \npara gestionar posicionamientos y relaciones interpersonales (White, 2011).', '12 Fabiola Esmeralda López Rodríguez\nEstudios de Lingüística Aplicada, año 36, número 67, julio de 2018, pp. 9–43\ndoi: 10.22201/enallt.01852647p.2018.67.723\n2. Marco teórico\nDiversas ciencias sociales y humanas entienden al chisme como un reflejo de \nlos modos en que concebimos la realidad y nuestra vida en sociedad, entre ellas \nla antropología (Gluckman, 1963, 1968; Paine, 1967, 1970; Cox, 1970; Handel-\nman, 1973; Wilson, 1974; Haviland, 1977; Fine, 1985; Vázquez García & Chá-\nvez Arellano, 2008, De León Torres, 2010; entre otros), la sociología (Levin & \nArluke, 1987; Goffman, 1991; Bergmann, 1993; Goodman & Ben-Ze’ev, 1994; \nBergmann & Luckmann, 1995; Pietrosemoli, 2009) y la psicología (Dunbar, \n1996; Baumeister, Zhang & V ohs, 2004; Rosnow & Foster, 2005).1 En suma, a \ntodas las propuestas subyace la idea de que el chisme propicia formas particula-\nres de socializar y al mismo tiempo es producto de ellas.\nDesde la lingüística, autores como Eder y Enke (1991), Hall (1993a, \n1993b) y Ahmed (2010) analizan la estructura del chisme, pero difieren en el \npropósito final. Eder y Enke (1991) se centran en el orden de los actos por -\nque influye en la evolución de un chisme en la conversación. Por su parte, Hall \n(1993a, 1993b) busca explicar cuáles son los recursos que emplean los parti -\ncipantes para construir, mantener y modificar sus identidades al interior de un \ngrupo a partir de esta práctica oral cotidiana, importante y frecuente en diver -\nsos grupos culturales. Ahmed (2010) analiza a profundidad una conversación \nentre dos mujeres y, después de identificar y explicar los elementos lingüísticos \nutilizados, concluye que en la construcción del chisme están fuertemente im -\nplicadas las relaciones de poder que existen entre los participantes. Un trabajo  \nque destaco es el de Eggins y Slade (1997), quienes ven al chisme como uno de \nlos géneros más comunes y socialmente significativos de la conversación casual \nen inglés; en él la gente clasifica al mundo en términos de lo que debería o no \nhacerse. De estas autoras retomo no solo un marco de referencia sino también \nalgunas herramientas analíticas.\nEn general se acepta que gran parte de nuestras interacciones las dedicamos \nal chisme y que este es una conversación casual del tipo evaluativo —entre perso-\nnas que tienen familiaridad entre sí—, sobre asuntos concernientes a terceras per-\n1 Para acceder a una revisión exhaustiva respecto a cómo ha sido estudiado el chisme desde dis-\ntintas disciplinas se recomienda consultar a López Rodríguez (2015).', 'Estudios de Lingüística Aplicada, año 43, número 80, enero de 2025, pp. 7–48\ndoi:10.22201/enallt.01852647p.2025.80.1097\nSistema judicial y lengua vasca en España: una glotofobia persistente [ 15 ]\nAsimismo, el régimen creó la Escuela Judicial, dependiente \ndel ministerio de Justicia, a fi  n de adoctrinar políticamente y se-\nleccionar ideológicamente a los futuros juristas, quienes, durante \n18 meses, recibían una formación jurídica, moral y religiosa. Esta \nformación servía igualmente para inculcarles el espíritu de cuerpo \ny el respeto de la jerarquía a través de una obediencia absoluta a los \nsuperiores jerárquicos. Tal como lo indicó el ministro de Justicia de \nla época, Eduardo Aunós, al presentar ante las Cortes Generales el \nproyecto de ley sobre la creación de la Escuela Judicial, se preten-\ndía “crear una milicia de la Justicia, unida a los ideales fi  rmes del \nEstado Nacional [...] siempre dispuesta a seguir [...] las consignas \ndel Caudillo y de la España Nueva” (Lanero Táboas, 1995: citado \nen Marquesán Millán, 2021).\nA su vez, el franquismo empleó una serie de medidas para \nlimitar y, aún más, aniquilar cualquier veleidad de independencia \nde la justicia, tales como nombramientos, promociones, traslados, \nsanciones disciplinares e incluso despidos. Precisamente, la aso-\nciación\xa0Justicia Democrática\xa0surgió, en la clandestinidad, para ex-\npresar su descontento por el “férreo control ejercido por el ejecu-\ntivo sobre la carrera judicial a través del nombramiento de los más \nimportantes cargos” (Marquesán Millán, 2021).\nAdemás, el régimen recurrió al sistema judicial para impo-\nner una represión brutal, especialmente a través de los consejos \nde guerra y de las jurisdicciones especiales. Numerosos defenso-\nres de la República española fueron detenidos, encarcelados, tor-\nturados (Lorenzo Rubio, 2020), condenados a largas penas de cár-\ncel, obligados a realizar trabajos forzosos o fusilados tras juicios \nsumarísimos (Silva & Esteban, 2012). Asociados a los militares y \npolicías, los jueces y magistrados se convirtieron en los garantes \nde la dictadura y no toleraron cuestionamiento alguno de la unidad \nterritorial, del régimen dictatorial y de la ideología nacional-cató-\nlica. Así, el Decreto del 16 de abril de 1940 asignó al Fiscal Gene-\nral la tarea de investigar las actividades supuestamente criminales \nde los oponentes al régimen.', 'La tabla 1 contiene los 79 neologismos referidos a la pandemia que fueron identifi -\ncados en Morfolex y se documentaron entre abril y diciembre de 2020. Las palabras se \npresentan en orden alfabético y se señala tanto el tipo de proceso o afijo que interviene \nen la formación como su número de ocurrencias en la base de datos. \nTabla 1. Neologismos relativos a la pandemia\nNúm. Palabra Ocurrencias Tipo de formación\n1 adenoviral 1 adeno- (glándula)\n2 antibacterial 1 anti-\n3 antichatarra 2 anti-\n4 antichetos 1 anti-\n5 anticoagulación 1 anti-\n6 anticoronavirus 1 anti-\n7 anticovid 2 anti-\n8 anticuarentena 1 anti-\n9 antitrombótico 1 anti-\n10 biodefensa 1 bio-\n11 bioseguridad 1 bio-\n12 cabarezoom 1 N+N\n13 choricel 1 Cruce\n14 conchavirus 1 N+N\n15 conspirólogo 1 -logo\n16 coronabicho 2 N+N\n17 coronabobo 1 N+N\n18 coronabono 1 N+N\n19 coronaburguer 1 N+N\n20 coronacrisis 1 N+N\n21 coronalibro 1 N+N\n22 coronavirulento 1 N+A\n23 coronial 1 Cruce\n24 coronnial 1 Cruce\n25 coviario 1 -ario\n26 covicumpleaños 1 N+N\n27 covidengue 2 Cruce\n10 Ramón ZacaRías Ponce de León\nLM IV-1 \nLingüística Mexicana. Nueva Época, IV (2022), núm. 1: 7-29  \nISSN: 2448-8194', 'Estudios de Lingüística Aplicada, año 43, número 80, enero de 2025, pp. 49–93\ndoi: 10.22201/enallt.01852647p.2025.80.1112\n[ 74 ] Julio César Valerdi Zárate\ncuadRO 9. Programas de formación de profesores de inglés: accesibilidad\nPrograma Entidad Lugar de gestión Modalidad Costo\na) curso Privada México En línea No disponible\nb) curso Privada México En línea £390 ($10,860)\nc) curso Privada México En línea £228 ($6,350)\nd) curso Privada México En línea £264 ($7,350)\ne) serie de cursos Privada México En línea No disponible\nf) curso Privada E. U. A. En línea $199 USD ($3,960)\ng) curso Privada E. U. A. En línea $239 USD ($4,760)\nh) diplomado Privada México Mixta $14,000\ni) diplomado Privada México Mixta $14,000\nj) diplomado Privada México En línea $350 USD ($6,970)\nk) diplomado Privada México Mixta $3,460 USD ($68,860)\nl) diplomado Privada México En línea $300 USD ($5,970)\nm) diplomado Privada México Mixta No disponible\nn) diplomado Pública México En línea $5,000\nñ) certifi  cado Privada E.U.A. En línea $899 USD ($17,900)\no) certifi  cado Privada México En línea No disponible\np) certifi  cado Privada No disponible En línea No disponible\nq) certifi  cado Privada México En línea £408 ($11,360)\nr) certifi  cado Privada México En línea £312 ($8,730)\ns) certifi  cado Privada México En línea £552 ($15,450)\nt) certifi  cado Pública México En línea No disponible\ncuadRO 10. Programas de formación de profesores de inglés: público meta\nPrograma Necesidades meta Experiencia Formación previa Dominio de L2\na) curso Profesores de niños sep 1 año No disponible B1\nb) curso Profesores de alumnos de 6 a 17 años Enseñanza de inglés No disponible No disponible\nc) curso Profesores por tomar DELTA Enseñanza de inglés Cursos de preparación \nDELTA\nC1\nd) curso Docentes califi  cados interesados en \ninvestigación en el aula\nEnseñanza de inglés Formación docente e \ninvestigación básica\nC1', 'Estudios de Lingüística Aplicada, año 42, número 79, julio de 2024, pp. 71–109\ndoi: 10.22201/enallt.01852647p.2024.79.1096\n[ 76 ] Amor Madai Peña Ramos & Verónica González Márquez\nnen Rojo y Veiga (1999) en el capítulo “El tiempo verbal. Los tiem-\npos simples” de la Gramática descriptiva de la lengua española.\nDe acuerdo con Rojo y Veiga (1999: 2874), antes de analizar \nel tiempo, se debe establecer a qué tipo de tiempo se hará referen-\ncia: al físico, al cronológico o al lingüístico. En el caso que nos \nconcierne, se hará referencia al tiempo lingüístico que “se funda-\nmenta en el establecimiento de un punto cero, pero ese punto no \nes estático sino móvil” (1999: 2873).\nSegún estos autores, la temporalidad lingüística tiene cier-\ntas características básicas: a) el establecimiento de un punto cero, \nb) “orientación” o ubicación directa o indirecta de los aconteci-\nmientos con respecto al punto cero, c) en algunas lenguas la ex-\npresión de la distancia al punto cero está gramaticalizada (1999: \n2874). Propusieron, además, una forma gráfi  ca para representar la \nubicación de los acontecimientos (Figura 1).\nEl tiempo lingüístico es representado por el punto central (O), que \nestá doblemente orientado y abierto por los dos extremos. Los \nacontecimientos podrían situarse en la zona de lo anterior (–), si-\nmultáneo (o) o posterior (+) al punto cero (Rojo & Veiga, 1999: \n2874). En este sentido, si el punto central o de origen es simultá-\nneo al acontecimiento, es decir, si se trata del tiempo presente, la \nfórmula corresponde a (OoV). Dicha fórmula se lee de derecha a \nizquierda, de la siguiente manera: el vector es simultáneo al origen \n(Rojo & Veiga, 1999: 2876).\nEn el Anexo 1, presentamos una esquematización de las for-\nmas verbales, las fórmulas correspondientes y las distintas deno-\nminaciones. Aunque se empleará la nomenclatura de Bello, se con-\nsiderará el marco teórico de Rojo y Veiga (1999). Asimismo, en \nel Anexo 2, se muestra un cuadro de elaboración propia con las \nA(-)\nOı\nı\nS(o) P(+)\nFIGURA 1. Representación del tiempo lingüístico (Rojo & Veiga, 1999: 2874)', '– Dossier –']","I'm sorry, but the term ""portugués"" does not appear in the provided context about linguistics articles. If you have any other questions or need information on a different topic within linguistics, feel free to ask!"
Who summarizes the conceptual axes and findings supporting the relevance of addressing available lexicon as a tool for second language learning?,"['LM V-2 Lingüística Mexicana. Nueva Época, v (2023), núm. 2: 119-123 ISSN: 2448-8194 En una línea similar, María Noemí Alfaro Mejía se adentra en la relevancia del estu- dio del léxico disponible en el salón de clases. Con ello, en el capítulo “Uso de encuestas de léxico disponible como herramienta de enseñanza en el salón de clases”, la autora aborda el estudio del léxico disponible desde una perspectiva cualitativa y advierte los beneficios pedagógicos de recurrir a este tipo de encuestas para diseñar módulos y estrategias para la enseñanza de vocabulario en la clase de portugués como lengua extranjera. Una vez presentado el método de trabajo característico de los estudios de disponibilidad léxica, Alfaro Mejía observa que es necesario considerar la elaboración de materiales didácticos centrados en la revisión de las características lingüísticas y comunicativas del vocabulario estudiado, así como buscar que los aprendientes entren en contacto con unidades léxicas pertenecientes a diferentes centros de interés. Para atender lo anterior, la autora detalla su experiencia al implementar un ejercicio que supone retomar los resultados obtenidos mediante las encuestas vinculadas a los centros de interés de la “ciudad” y el “campo”, para contrastarlos con el vocabulario empleado en la redacción de pequeños párrafos en los que se describen las principales similitudes y diferencias entre la vida citadina y la campirana. Para concluir este capítulo, Alfaro Mejía propone una tipología de ejercicios orientada al fortalecimiento y enriquecimien- to del léxico adquirido en el salón de clases. Finalmente, en el sexto y último capítulo del libro, Marisela Colín realiza una recapi- tulación de los ejes conceptuales y hallazgos que sustentan la pertinencia de abordar el léxico disponible como instrumento para el aprendizaje de segundas lenguas. Partiendo de la propuesta de Irandé Antunes, quien promueve un abordaje textual-discursivo para la enseñanza del léxico, se nos recuerda que la lengua es ante todo un proceso que se lleva a cabo en actos comunicativos específicos, de ahí que resulte fundamental tener en cuenta los ocho elementos constituyentes del plano textual, es decir, el tema, la fi- nalidad, el género discursivo, el medio, el destinatario, la modalidad, el nivel de formalidad y el contexto, los cuales motivan y encauzan la aparición de cierto léxico para dar cohe- rencia y sentido a aquello que se dice, se escucha, se lee y se escribe en determinadas situaciones comunicativas. Acto seguido, la autora interpreta el comportamiento del léxico disponible desde el Modelo Gravitacional de Gile. De esta forma se ahonda en la naturaliza dinámica del léxico y en la necesidad de elaborar materiales didácticos en los que el vocabulario adquirido se repase periódicamente. Una vez planteada y justificada esta propuesta teórica, la autora explica cómo implementar en clase once actividades didácticas, originalmente desarrolladas por los profesores de portugués como segunda lengua de la enallt, para mostrar su utilidad y validez como herramientas para el aprendizaje de distintos tipos de léxico. Desde mi punto de vista, el hecho de que estas actividades partan de una ficha pedagógica donde se explicita el nombre de la actividad, la lengua para la que está pensada, el nivel de lengua al que pertenece, su duración, su descripción, el objetivo pedagógico que se busca alcanzar, su procedimiento, el modo como debe evaluarse y algunas posibles alternativas o variaciones para llevarla a cabo hacen de ellas un terreno fértil para adaptarlas a distintas condiciones de enseñanza. Como se puede notar, se trata de un libro que será de suma utilidad para todos aquellos profesores de idioma y lingüistas aplicados que busquen entender el papel del']",Marisela Colín summarizes the conceptual axes and findings supporting the relevance of addressing available lexicon as a tool for second language learning.,single_hop_specifc_query_synthesizer,"['21', '28 .....Rainer Enrique Hamel\nte señalar que la exactitud y complejidad de la transcrip\xad\nción depende en última instancia de los objetivos del aná\xad\nlisis: si se trata por ejemplo, de identificar solamente \nunidades relativamente grandes como los patrones de inte\xad\nracción verbal (cf. Hamel, 1982), la transcripción puede \nser bastante simple. Cuando, por otra parte, se intenta \nidentificar momentos de conflictos de conciencia lingüís\xad\ntica en el discurso de un hablante (cf. Schlieben-Lange, \n1979,Hamel/Muñoz, 1981, .1982), factores como la estructu\xad\nra de pausas, los patrones de entonación y las variaciones \ndinámicas (rápido-lento, forte-piano) revisten espe\xad\ncial importancia 9.\nHay que recordar que la transcripción misma, labor \nbastante tediosa, 10  no puede concebirse de ninguna ma\xad\nnera como un trabajo meramente técnico: constituye, al \ncontrario, una parte decisiva del proceso de descubrimien- \nto y análisis; la transcripción es siempre parcialmente \ninterpretativa, ya que requiere de decisiones en cuanto a \nlos elementos y aspectos que se incluyen en ella. La \ntranscripción, que significa de hecho una fijación en el \ntiempo y el espacio, tampoco debe opacar el carácter \ntranscursivo de proceso inherente a toda conversación, \ncuyas estructuras se producen y reproducen en el momento \nmismo de su ejecución. El analista nunca debe perder de \nvista la perspectiva del interactante, en el sentido que \ndescubre y explícita las interpretaciones y estructura- \nciones de éste. 11\n9\nVer el anexo 1.\n10   Para una primera transcripción conversacional, hay \nque calcular un tiempo aproximado de 15 a 20 minutos \nde transcripción por un minuto de grabación.\n11 Es evidente que la transcripción nunca podra captar\ntodos los elementos complejos de una situación de in-\nteracción. Por esta razón, el investigador debe uti-\nlizar en su análisis la transcripción junto con la \ngrabación. Ademas, tiene que anotar sus observaciones \nen el momento de la grabación (cambios de lugar de los', 'Del tratamiento de falsos amigos en un diccionario electrónico de dudas 11\nEstudios de Lingüística Aplicada, año 30, número 56, diciembre de 2012, pp. 9-33\nintroDucción\nEn este artículo, las autoras quieren aportar unas consideraciones acerca de la \ninformación pertinente en las entradas de un diccionario electrónico de dudas \n(DeD) alemán/español para hispanohablantes.1 El estudio se centra en la inclusión \nde falsos amigos y pretende demostrar que estos, sin duda, constituyen un ámbito \npertinente para una obra de estas características dado que tal y como afirma Doval \n(2006: 466): “Los falsos amigos presentan un problema muy importante y muy \nfrecuente tanto en la traducción como en la didáctica de la lengua extranjera al \nque el diccionario bilingüe presta apenas atención”.\n2\nSi esto es así, un diccionario en soporte electrónico podría cambiar esta \nrealidad. Su elaboración depende de múltiples factores, aunque consideramos \nque tres son los puntos clave: los criterios de usabilidad3 del diccionario, el perfil \nde sus usuarios y los fines perseguidos con dicha herramienta. Teniendo en cuen-\nta los criterios de usabilidad, el diccionario en soporte digital —como veremos \nmás adelante— se presta de manera formidable a entradas de tipo falso amigo, ya \nque esta herramienta permite una organización de la interfaz sencilla, dispone de \nuna flexibilidad en cuanto al espacio, ofrece la posibilidad de disponer de manera \nlógica los distintos elementos como colores de hipervínculos, estados de los dis-\ntintos botones, entre otras consideraciones. Además, por analogía con convencio-\nnes cul turales y estándares establecidos es fácil para el usuario reconocer las \netiquetas y símbolos utilizados (Cf. Torres, 2009: 16). Todos estos recursos ayu-\ndarán sobremanera a facilitar la comprensión del fenómeno falso amigo, que en \nmuchas ocasiones puede convertirse incluso en un verdadero enemigo peligroso.  \n \n1 Por razones de espacio, las autoras se han visto obligadas a dejar de lado la problemática de la \nvariación dialectal de los latinismos en el español. Sin duda se trata de un problema complejo que \nmerecería su debida atención. En el análisis de los casos del presente artículo se ha observado in-\nformación a tal respecto que no siempre coincidía. Por ejemplo, en cuanto a “competencia” (caso 3)  \nobservamos su sinónimo “competición (deportiva)” registrado en los tres diccionarios menciona-\ndos, marcado como “americanismo” (drae, clave) y uso en “zonas del español meridional”.\n2 La traducción de las citas en alemán e inglés es nuestra.\n3 Usamos este término en el sentido de, por ejemplo, Wiegand & Fuentes, 2010: 232 y Azorín Fernández \n& Santamaría Pérez (2011).\nELA 56 interiores.indd   11 15/01/14   20:25', 'concordAnciA de número suPerficiAL y efecTivA\nentonces se consideran los cinco casos. De esta manera, no se manipulan los números \nque se presentaron antes porque aludían únicamente a los tipos de nominales y no a las \nocurrencias de los mismos.\nTambién es preciso explicar que se tomaron en cuenta tres divisiones en el rango \nde edad en los tres niños. Sin embargo, debido a la independencia de los registros, las \nmuestras de Natalia abarcan menos tiempo y están divididas, aproximadamente, de \nforma mensual, porque cada rango de edad corresponde a un mes de registro y fueron \ntres meses los que se analizaron (de 1:11:24 a 2:02:18). Por el contrario, Tita y Luis \npresentan de la misma manera la división del rango de edad, cada uno con tres meses \nde alcance. \nComo se observa en la gráfica 1, a pesar de que los datos de Luis mapean un periodo \nde edad equivalente al de Tita, se ubica en una etapa muy inicial; solamente 24 nomi -\nnales presentan contraste de número, de los cuales 22 (92%) exponen concordancias y \n2 (8%) discordancias. En el primer rango de edad no tuvo ningún caso; en el segundo, \nsólo uno de concordancia; y, en el tercero, parece estar apenas comenzando a ubicar las \nformas del morfema de número. Así, los 21 casos se refieren a una concordancia super-\nficial, debido a que las ocurrencias discordantes son escasas y no hay antecedentes en \nlos registros que demuestren que el niño está trabajando la concordancia de número. \nEsta afirmación la justificamos en que la presencia de nominales con contraste es casi \nnula en los rangos de edad 1 y 2 y, sin ésta, prácticamente ‒y de acuerdo con las mues-\ntras de las dos niñas‒ no se podría aún hablar de un punto inicial en una operación de \nconcordancia de número efectiva. Con base en lo anterior, consideramos que los datos \nde Luis representan una etapa primera, en la cual impera la imitación de construcciones \nmorfosintácticas en el ámbito de frase, lo que implica una concordancia de número pro-\nveniente del input de sus cuidadores. \nGráfica 1. Análisis de las ocurrencias con respecto a la variable 4 en el desarrollo temporal de Luis\nEn seguida nos corresponde analizar la segunda etapa, en la que se ubican los \nresultados de Natalia. Esta gráfica muestra que en esta niña hay una relación de au -\nmento de casos entre la concordancia y discordancia en los tres rangos de edad anali-\nzados: si crece el número de concordancias, también el de discordancias. Sólo que el  \nVariable 4\n25Ocurrencias\n20\n15\n10\n5\n0\n0 01=100%\n21=91%\n2:05-2:082:02-2:051:11-2:02\nRango de edad\nDiscordancia Concordancia\n2=9%\n109\nLM II-1\nLingüística Mexicana. Nueva Época, II (2020) núm. 1: 101-115  \nISSN: 2448-8194', 'El chisme: estrategias discursivas desplegadas en su construcción 37\nEstudios de Lingüística Aplicada, año 36, número 67, julio de 2018, pp. 9–43\ndoi: 10.22201/enallt.01852647p.2018.67.723\nparticipación las hablantes calculan y conjeturan cómo serán recibidas y eva -\nluadas sus emisiones por parte de la interlocutora, dependiendo de las relacio -\nnes interpersonales previas así como de la forma en que se esté desarrollando la \nconversación. El análisis me permite concluir que, en el contexto estudiado, los \nchismes son posibles en la medida en que se despliegan estrategias discursivas \nque están bajo el cuidado constante de la mitigación y que se corroboran o se \nmodifican constantemente gracias al uso de las estrategias interactivas.\nPuede añadirse que el grado de participación por parte de las hablantes en el \nchisme no es simétrico. La participación está en función de la cantidad de infor -\nmación que posean o de las estrategias interactivas que utilicen. El acercamiento \nque propongo, además de brindar una aproximación al chisme desde el análisis \ndel discurso, busca problematizar su estudio, ponerlo sobre la mesa de las inves-\ntigaciones actuales, evidenciando su alto valor interactivo, social y discursivo.\nEste estudio, si bien no agota el tema, pretende ser una llamada de atención \npara que los investigadores mexicanos de distintas áreas, pero sobre todo de la \nlingüística, posen su mirada en la práctica comunicativa denominada chisme. \nHay varias vetas que quedan abiertas. Sería muy interesante estudiar discursi-\nvamente el chisme desde otras perspectivas analíticas o en otros contextos, por \nejemplo, entre hombres.\n6. Referencias\nAhmed, Sara (2010). Analysing women’s talk and gossip between two female friends. En In -\nnervate. Leading Undergraduate Work in English Studies, (3), 1–14. Recuperado de  \nhttps://www.nottingham.ac.uk/english/documents/innervate/10-11/1011ahmedwomentalk.pdf\nBajtín, Mijaíl M. (1981). The dialogic imagination: Four essays. Austin: University of Texas \nPress.\nBajtín, Mijaíl M. (2005 [1982]). Estética de la creación verbal. México: Siglo xxi.\nBaumeister, Roy F.; Zhang, Liqing, & V ohs, Kathleen D. (2004). Gossip as cultural learn-\ning. Review of General Psychology, 8(2), 111–121. Recuperado de http://citeseerx.ist.psu.\nedu/viewdoc/download?doi=10.1.1.186.4613&rep=rep1&type=pdf\nBergmann, Jörg R. (1993). Discreet indiscretions: The social organization of gossip. Nueva York: \nAldine de Gruyter.', '(6)\nEste número se lee como que la máxima entropía del sistema representado por las \ntres palabras en (4) sería de 2.585 bits. Si resolvemos el caso para el grafema A, pero \nahora sólo con las probabilidades de la tabla 1, tendríamos lo siguiente:\n(7)\nLa entropía absoluta de A sería 0.918 bits. Para poder tener una lectura general, \nse normaliza el resultado anterior con el 2.585 que obtuvimos de la máxima entropía. \nEs decir, usamos la máxima entropía como suelo común, en donde 1 representaría la \nmáxima incertidumbre posible, y 0 la mínima. Para obtener la entropía normalizada \n(también llamada relativa), realizaríamos lo siguiente:\n(8)\nEl anterior paso es el que permite realizar la comparación con otras piezas del sis -\ntema, ya sea con cada grafema o, como se llevará a cabo en los experimentos a conti-\nnuación, de cada posible combinación de grafemas dados los arreglos dispuestos en el \ninventario léxico de (4). Esto quiere decir que, para los experimentos que se desarrollan \nen este trabajo, sólo se calcula la entropía de los posibles afijos producto de todos los \nposibles cortes lógicos a partir de tomar como pivote algún lado de la palabra. \nEvaluación de los cortes\nEl resultado del cálculo de entropía relativa no dice mucho por sí solo. Es una huella, \nen contraste con los resultados de los otros afijos posibles. En todo caso, el dato sólo nos \nayudaría a confirmar que el sistema no tiende al caos, aunque se espera que un sistema \nde comunicación no lo haga (Shannon 1948). La primera etapa de la experimentación \npropuesta es exploratoria, en donde una vez realizado el cálculo, se contrasta una lista \nde posibles afijos encontrados en el primer conjunto de textos. Sin embargo, pronto se \ndescubren las limitaciones de un experimento así. Por ello, se propuso un segundo expe-\nrimento en este trabajo, lo que permite una evaluación más precisa. \nEn otros experimentos se usa una versión del cálculo de entropía para determinar \nsi hay correspondencia entre la entropía del sistema estudiado y la entropía propia de \nuna lengua, en contraste con la entropía de, por ejemplo, el adn o de un lenguaje de \n80 mAnuel AlejAndro Sánchez fernández\nLM V-2 \nLingüística Mexicana. Nueva Época, v (2023), núm. 2: 73-94  \nISSN: 2448-8194', 'Para crear el rapport, se siguió el instrumento empleado por el Proyecto para el Es -\ntudio Sociolingüístico del Español de España y América ( preseea 2003) respecto del \nfenómeno de la evaluación. En lugar de considerar nueve temas generales, se tomaron \ncuatro –el tiempo, el lugar donde vive, la familia y la amistad, y las costumbres– y se \npidió al colaborador que conversara sobre ellos. En el tema de la familia y la amistad, \npor ejemplo, las preguntas fueron: ¿quién es tu mejor amigo?; ¿qué es para ti un amigo?; \n¿cómo debe ser una persona o qué debe hacer para que la consideres un buen amigo?; \n¿estás contento/a con tu forma de vida?, ¿por qué?; ¿qué estará haciendo tu familia\u200a/\u200atu \nmarido\u200a/\u200atu hijo\u200a/\u200atu padre ahora? Estos datos obtenidos durante los primeros 10 o 15 mi-\nnutos de grabación no se tomaron en cuenta para el estudio. \nEn la misma sesión se pidió a los colaboradores que compartieran tres narraciones de \nexperiencia personal: una sobre lo más emocionante que han vivido, otra sobre la expe -\nriencia más triste que han sufrido y otra sobre lo más peligroso a lo que se han enfrenta-\ndo. Se buscaba que expresaran alegría, tristeza y miedo para asegurar que se presentara \nel componente evaluativo en las narraciones, al tiempo que se favorecía el habla espontá-\nnea o natural en las entrevistas (Labov 1983). Un ejemplo de las indicaciones dadas es el \nsiguiente: Quisiera que me compartas si has vivido circunstancias peligrosas como algún robo, \naccidente o una situación en la que hayas estado en peligro de muerte. ¿Qué ocurrió? ¿Dónde \npasó? La narración oral se obtuvo en un tiempo de entre 15 y 25 minutos por colabora -\ndor. Antes de concluir la sesión, se solicitó a cada quien que eligiera su mejor narración. \nEn la segunda sesión, se pidió a los colaboradores que escribieron esa narración que \nseleccionaron e incluyeran un título para poder recuperarla; el único requisito era que \nla extensión fuera de una cuartilla3. Posteriormente, las narraciones (tanto orales como \nescritas) se transcribieron en procesador de texto (Word) con ortografía convencional. \nLuego, se creó una base de datos en hojas de cálculo (Excel) para hacer el análisis con \nel software Goldvarb X (Sankoff et al. 2005).\nTabla 2. Narraciones del corpus\n3\u2009Al final de la sesión, no se corroboró que el texto fuera legible. Así que, como aprendizaje del piloteo, \nen entrevistas posteriores, se pidió a cada niño o joven que leyera su texto en voz alta cuando la entrevis-\ntadora tenía dudas sobre lo escrito. \nGrupo de \nedad\nNarración oral Narración escrita\nTotal\nEmoción Tristeza Peligro Emoción Tristeza Peligro\nH* M H M H M H M H M H M\n9-10 años 1 1 1 1 4\n13-14 años 1 1 1 1 4\n17-18 años 1 1 1 1 4\n30 años y más 1 2 1 1 1 1 2 1 1 1 12\nTotal 2 4 2 2 2 0 2 4 2 2 2 0 24\n*H representa los hombres y M las mujeres.\n68 gLoria ELEna gómEz martínEz y rubí cEbaLLos DomínguEz\nLM III-2 \nLingüística Mexicana. Nueva Época, III (2021), núm. 2: 63-81  \nISSN: 2448-8194', 'ANALISIS CONVERSACIONAL 51\nsocio-ecológicas (Fishman, 1972a:19)> la situación so- \ncial, el tipo de relaciones de papeles, de interacción y \nel habla (eventos y actos) misma. En la sociolingüística \nde Fishman, estos niveles están definidos por las ocu- \nrrencias o la selección de variables lingüísticas, es de- \ncir, nos encontramos nuevamente frente a un intento de es-  \ntablecer unidades sociales a partir de usos lingüísticos, \nesta vez en una sociolingüística que trabaja casi exclu\xad\nsivamente con métodos cuantitativos. Las definiciones so- \nbre la relación entre los diferentes niveles permanecen \nrelativamente vagas. Fishman no determina si su modelo \nes ascendente o descendente. Define el análisis situacio- \nnal como el área limítrofe entre macro y micro socio-lin- \ngüística y postula que la existencia de los conceptos de \ncampo (domain) y situación social revelan la existencia \nde relaciones entre los dos niveles de análisis (cf. \nFishman, 1972a: 28-29). Pero estas relaciones se estable\xad\ncen únicamente por la ocurrencia o ausencia de determina\xad\ndas formas lingüísticas en las unidades construidas.\nA mi modo de ver, las categorías de Fishman y sobre \ntodo, las relaciones que establece entre ellas, aún no es- \ntán lo suficientemente definidas y carecen, aunque de \notra manera que el análisis conversacional, de una teoría \nsociológica elaborada 30.\nCon esta incursión en un campo muy distinto de estu\xad\ndios sociales del lenguaje, me propuse ejemplificar que, \nsi bien el problema de las escalas sociales no está re\xad\nsuelto satisfactoriamente, por lo menos ya está plantea\xad\ndo como tal, lo que sugiere buscar nuevos caminos para \nlas ciencias sociales del lenguaje.\n30    Cabe señalar que, debido a la resumida exposición de \nesta problemática, podría quedar la impresión que el \nanálisis conversacional y la sociolingüística de Fish- \nman trabajan con el mismo enfoque. Esto no es así. \nFueron justamente las posiciones etnometodológicas y \netnográficas de la comunicación las que formularon las \ncríticas hasta el momento más sustanciales a la socio-', 'Estudios de Lingüística Aplicada, año 41, número 77, julio de 2023, pp. 7–47\ndoi: 10.22201/enallt.01852647p.2023.77.1038\nAproximación al análisis prosódico del foco contrastivo [ 23 ]\ny le presentaban un trofeo. En cada ensayo, el padre o la madre \ndebía hacer clic en un botón de “continuar” después de que el niño \nrespondiera. Al fi  nalizar, los personajes felicitaban al participante.\n3.6.  Procedimiento del experimento: adultos\nEn el caso de los adultos, el experimento era similar. Sin embargo, \nse omitían los personajes que se utilizaron en la versión para niños. \nAdemás, los participantes accedían al experimento a través de un \nenlace compartido en las redes sociales. Antes de comenzar, se les \npresentaba un texto y una grabación que les instruía sobre el pro-\nceso. Se les informaba que verían una serie de imágenes seguidas \nde una afi  rmación sobre ellas y debían indicar si la afi  rmación era \ncorrecta o incorrecta. En el caso de que fuera incorrecta, se les pe-\ndía que indicaran en voz alta la respuesta correcta. Previo al inicio, \nse les proporcionaba un ejemplo que mostraba una de las imágenes \nde práctica utilizadas en el experimento con niños.\nEn este caso, los estímulos se presentaban sin pausas entre \nellos, y se les dio a los participantes siete segundos de silencio para \nque pudieran responder. La duración de este tiempo se determinó \na través de pruebas previas con cuatro miembros del Laboratorio \nde Psicolingüística, con el objetivo de establecer un tiempo sufi  -\nciente para dar una respuesta, pero no tan prolongado como para \nque la tarea se volviera tediosa. Al fi  nalizar, se les agradeció su \nparticipación.\n4. Resultados\n4.1.  Niños\nSe recopiló un total de 288 grabaciones de audio (144 por condi-\nción). No hubo grabaciones incompletas o inaudibles. El primer \nanálisis consistió en comparar las respuestas correctas a los estí-\nmulos experimentales, que sumaron un total de 96 grabaciones (48 \npor condición), en los que se requería corregir la descripción erró-']","The conceptual axes and findings supporting the relevance of addressing available lexicon as a tool for second language learning are summarized by Silvia Roiss and Petra Zimmermann González in their article ""DEL TRATAMIENTO DE FALSOS AMIGOS EN UN DICCIONARIO ELECTRÓNICO DE DUDAS."" They discuss how translators and advanced students of German often encounter lexical units that pose difficulties despite appearing transparent at first. They focus on a specific group of units known as ""false friends"" and provide examples to illustrate the complexity of the relationship between (almost-) homonyms and (almost-) homographs in German-Spanish, particularly of Latin origin. Their thorough analysis leads to conclusions that are useful for designing entries in a German-Spanish electronic dictionary of doubts to provide Spanish native language translators with an effective tool and to raise awareness among advanced students of these difficulties to guide them in acquiring German effectively."
How did the linguistic researcher's encounter with Alain Rey in Montreal relate to their previous interactions in Mexico?,"['<1-hop>\n\ndiccionario de autoridades, que serviría para reforzar la idea elitista de la lengua española. Tiem- po más tarde, Kurt Baldinger me contó que Alain Rey me llamaba “experto en mexicographie”. Muchos amigos saben que la lexicografía francesa, presidida por la pareja Rey-Debove, fue la principal influencia de nuestro trabajo. A finales de la década de 1970, quizá hacia 1977 o 78, había yo organizado en El Colegio de México lo que llamaba “Café de lingüistas”. Nos reuníamos los interesados a conversar sobre cualquier tema lingüístico que nos interesara –no sólo lexicografía– y, cuando había oportunidad, invitábamos a algún colega. Los Rey-Debove vinieron a México, quizá invitados por su embaja- da, así que aproveché para que fueran a platicar con nosotros y para que les mostráramos nuestro avance incipiente y nuestras dudas. Pasamos una horas exigentes y agradables, que luego corona- mos con una cena en el restaurant San Ángel Inn. Pocos años después coincidí con él en Montreal, invitados ambos por el Conseil de la Langue Française de Quebec, gracias al interés de Jacques Maurais, cuando se dio la coincidencia de que tanto en Francia como en México había control de cambios de moneda. Yo llevaba treinta dólares que me habían sobrado de un viaje anterior y esperaba que los administradores del Conseil enviaran a recogerme en el aeropuerto, me llevaran a un hotel y me dieran dinero para viáticos, como lo aseguraba la invitación. No había nadie es - perándome en el aeropuerto, así que tomé un autobús al centro de Montreal y busqué un hotel a donde había yo llegado un par de años antes. Después de pagar el autobús, me quedaban unos 20 dólares; me registré en el hotel y no tuve que pagarlo de inmediato, pues expliqué que el pago co- rría a cargo del Conseil. Al día siguiente me dirigí a la sede del encuentro, en donde se disculparon los organizadores conmigo, por haber malentendido mi hora de llegada. Me dieron un cheque para cambiarlo en el banco. ¡A Alain Rey le había sucedido lo mismo! Así que juntos nos fuimos a un banco a cambiar nuestros cheques, para poder pagar hotel, comidas, etc. En un banco, después en otro, no quisieron pagarnos el cheque, porque, dijeron, el gobierno de Quebec no tenía buen crédito. Al tercer banco al que entramos, se acercó el gerente a nosotros y dijo: “Usted es Alain Rey, ¿verdad? Yo le oí una conferencia en París. ¿Qué lo trae por aquí?” Él le explicó nuestro predicamento y, muy amablemente, nos cambió los cheques. La ventaja de ser amigo del maestro. Después de entonces ya no volví a ver a los Rey-Debove, aunque les envié mi libro de Teoría del diccionario monolingüe y la primera edición del Diccionario del español de México . En el libro Dictionnaire amoureux des dictionnaires (Plon, 2011) escribió Alain Rey acerca de los dic- cionarios del español: “Pero esas recolecciones no encaran la necesidad de describir el uso real de un país o de una región, y no una adición de diferencias en relación con el español de Europa. El paso de un diccionario general hacia una variedad del español fue dado por un lingüista del Colegio de México, Luis Fernando Lara”. Luis Fernando Lara El Colegio de México Miembro de El Colegio Nacional lara@colmex.mx', '<2-hop>\n\ndisponibilidad léxica y exclusión social. datos sociolingüÍsticos de la ciudad de México corpus y metodoLogía Los datos que sustentan la presente investigación forman parte del estudio de Montiel (2019); en él se hizo una primera exploración de la disponibilidad léxica y la exclusión social. Dicho acercamiento fue semasiológico. Se pidió a 36 hablantes (distribuidos si- métricamente en género y en tres grupos de edad) que definieran diez disfemismos so- cioeconómicos (chaca, chairo, gato, indio, indígena, lépero, naco, ñero, pelado y rupestre). A partir de un análisis de las respuestas obtenidas, en el que se buscaron rasgos comparti- dos o más repetidos en cada grupo de edad, se crearon definiciones de estas palabras por cada grupo etario, es decir: diez definiciones que reflejaran las respuestas dadas por los jóvenes, diez de los adultos y siete de los mayores (ya que estos últimos no reconocieron los vocablos chaca, chairo ni rupestre), esto suma 27 definiciones diferentes. A partir de ellas se formó la encuesta onomasiológica utilizada en el presente artículo. Un ejemplo de definición construida a partir del análisis de las respuestas proporcionadas por los jóvenes fue la del lexema chaca: “Referido a personas que gustan del género musical re- guetón, se expresan de manera vulgar o grosera, y por su forma de vestir y de peinarse son calificados como delincuentes”; la cual se le presentaba a los colaboradores para que ofrecieran la palabra o palabras que mejor se ajustaban a dicha definición. La encuesta onomasiológica se llevó a cabo con dieciocho informantes distintos a los de la prueba semasiológica. El objetivo original de la encuesta onomasiológica era con- firmar que los encuestados empataban las 27 definiciones creadas con los diez vocablos originales. Sin embargo, no sólo emergieron las diez palabras buscadas, sino un total de 135 vocablos, todos relacionados con la exclusión social. Una observación interesante es que, durante la prueba semasiológica (Montiel 2019: 87-164), cuando a los encues- tados se les preguntaba por términos diferentes a los diez vocablos arriba mencionados, en su mayoría contestaban que desconocían otras formas. Sin embargo, los dieciocho hablantes del presente estudio, ante las definiciones proporcionadas, no dudaron en producir más léxico relacionado con la discriminación social, lo que puso en evidencia el alto nivel de interdicción lingüística presente en dicho ámbito, además de la conve- niencia de presentar diferentes definiciones para acceder a más léxico 6. Regresando al ejemplo de chaca, se esperaba que ésta fuera la primera respuesta y también la más co- mún, al menos para los colaboradores jóvenes, sin embargo, se obtuvieron también los siguientes vocablos: reguetonero (5), chaca (3), cholo (2), corriente, desalineado, detestable, miserable, pandillero, reguetoñero, vulgar y naco. La muestra de los dieciocho hablantes encuestados se distribuye en seis personas por cada grupo etario (jóvenes: 18 a 30 años; adultos: 31 a 49 años; mayores: de 50 años en adelante); asimismo, cada grupo de edad está equilibrado respecto al factor género. Se trata de una red social (Milroy 1991) de clase media vinculada principalmente por pa- rentesco. Si bien es complejo hablar de una clase media uniforme en México, al tratarse en este caso de una misma red social existe un mayor control en cuanto a la pertenen- 6 Las definiciones y sus respuestas se pueden consultar en el Anexo de este artículo. 73']","The linguistic researcher's encounter with Alain Rey in Montreal was a result of their previous interactions in Mexico, where they had organized linguistic gatherings and discussions. The researcher coincided with Alain Rey in Montreal, both invited by the Conseil de la Langue Française de Quebec. They faced a predicament with currency exchange and hotel payments, which led them to visit multiple banks. Eventually, a bank manager recognized Alain Rey and helped them cash their checks, highlighting the advantage of being friends with a respected figure. This encounter in Montreal was a continuation of their previous interactions and shared linguistic interests.",multi_hop_specific_query_synthesizer,"['Lingüística Mexicana. Nueva Época, v (2023),  \nnúm. 1: 65-95 ISSN: 2448-8194\nLicencia Creative Commons Attribution-Non-\nCommercial (CC BY-NC) 4.0 International\nFecha de recepción: 15 de febrero de 2022\nFecha de aceptación: 19 de junio de 2022\nDinorah Beatriz Montiel Pérez\nUniversidad Autónoma Metropolitana-Iztapalapa\ndin.din.dm@gmail.com\nJulio César Serrano\nUniversidad Autónoma Metropolitana-Iztapalapa\njserrano@izt.uam.mx\nDisponibilidad léxica y exclusión social.  \nDatos sociolingüísticos de la Ciudad de México\nLexical availability and social exclusion.  \nSociolinguistic data of Mexico City\nRESUMEN: En este trabajo se analizan disfemismos socioeconómicos en \nel español de la Ciudad de México, en una red social de clase media. A \ntravés de una encuesta onomasiológica se obtuvieron 135 vocablos refe -\nrentes a la exclusión social. Los resultados arrojan luz sobre el léxico de \ntres grupos de edad. El concepto de prototipicidad se utiliza para distin -\nguir la relación entre el vocabulario y los dominios temáticos donde se  \nenfoca la discriminación. El dominio temático de la exclusión social  \nse subdividió en ocho sub-dominios. La investigación aporta al conoci -\nmiento del léxico de la discriminación en grupos sociales medios de la \nCiudad de México y, metodológicamente, ofrece una alternativa para la \nobtención de léxico pasivo y activo en los estudios de disponibilidad léxica.\nABSTRACT: This article presents a sociolinguistic analysis of a group \nof dysphemisms in the Spanish of Mexico City. It is based on data \nrecollected from interviews with members of a middle-class social \nnetwork. An onomasiological survey allowed the authors to obtain a \ntotal of 135 words referring to social exclusion, which distribute vari -\nably through three age groups. The concept of prototypicity is used in \nthe analysis for understanding the relationship between lexicon and the \nthematic areas where discrimination is focused. The thematical area of \n“social exclusion” was subdivided into eight sub-areas, which oriented \nthe main analysis. This research contributes to the knowledge of the \nlexicon of discrimination in middle class speakers in Mexico City and, \nmethodologically, it offers an alternative procedure for obtaining both \npassive and active vocabulary in lexical availability studies.\nPalabras clave:  \ndisfemismo,  \nprototipicidad,  \nneologismos,  \nobsolescencias,  \ndispersión léxica.\nKeywords:  \ndysphemism,  \nprototypicity,  \nneologism,  \nobsolescence,  \nlexical dispersion.', 'disponibilidad léxica y exclusión social. datos sociolingüÍsticos de la ciudad de México\nta también el número de vocablos con dispersión=1: en el grupo de los mayores hubo \nun total de 52 palabras con una sola mención. Esta tendencia se muestra en la figura 2.\nFigura 2. Aumento de los vocablos con dispersión=1 en el tiempo aparente.\nEsto es, mientras que los jóvenes en esta comunidad comparten más vocabulario \nentre ellos, conforme aumenta la edad, éste empieza a diversificarse. Quizás esto sólo \nsea el reflejo de que los jóvenes son una comunidad más homogénea en términos expe-\nrienciales, y que la diversidad del grupo mayor se explica por las complejas historias de \nvida de cada individuo (véase tabla 4)9.\nTabla 4. Léxico de exclusión de los hablantes mayores.  \nSe encuentra sombreado el léxico que sólo emitió este grupo. N= 76\n9\u2009En Serrano (2014: cap. 5) se documenta que en el español de la Ciudad de México de los años \n1970 y 2000 los grupos de mayor edad siempre presentan un mayor volumen de léxico sustantivo. \nCambios en la estructura gramatical a lo largo de la vida se discuten en Brook et al. (2018).\nnaco 12\nvulgar 11\nignorante 9\nindígena 7\ngrosero 6\npelado 5\ncorriente 5\nindio 5\nmalhablado 5\nplebe 4\ncholo 3\nchundo 3\ncriado 3\nirrespetuoso 3\nnefasto 3\npueblerino 3\nalburero 2\naborigen 2\ninadaptado 2\nmaleducado 2\npachuco 2\n79\nLM V-1\nLingüística Mexicana. Nueva Época, v (2023), núm. 1: 65-95\nISSN: 2448-8194', 'el 4th Meeting of the Network Core Mechanisms of Exponence. Amsterdam: Meertens \nInstitute, en <http://www.bermudez-otero.com/bermudez-otero&luis.pdf> \n[consultado en septiembre de 2020].\nBlumenfeld, Lev. 2006. Constraints on Phonological Interactions , tesis de doctorado. \nCalifornia: Sanford University.\nClements, George N.  y Samuel Jay Keyser. 1983. CV Phonology. A Generative Theory \nof the Syllable. Cambridge: mit Press. \nCôté, Marie-Hélène. 2004. “Syntagmatic distinctness in consonant deletion”, Phono-\nlogy 21, núm. 1: 1-41.\nCôté, Marie-Hélène. 2000. Consonant Cluster Phonotactics: a Perceptual Approach, tesis \nde doctorado. Cambridge: mit Press. \nCôté, Marie-Hélène. 1997. “Phonetic salience and consonant cluster simplification”, \nPF: Papers at the Interface 29: 229-262.\nCovarrubias Acosta, Adela. 2020. Fonología del Dizdea: zapoteco de San Bartolo Yau-\ntepec, tesis de licenciatura. México: Escuela Nacional de Antropología e Historia.\nChávez Peón, Mario Ernesto. 2010. The Interaction of Metrical Structure, Tone and Pho-\nnation Types in Quiaviní Zapotec , tesis de doctorado. Canada: University of British \nColumbia.\nEddington, David. 1992. “Word-medial epenthesis in Spanish: a lexical phonological \napproach”, Southwest Journal of Linguistics 11: 14-28.\nGleim, Daniel. 2019. “A feeding Duke-of-York interaction of tone and epenthesis in \nArapaho”, Glossa: A Journal of General Linguistics 4, núm. 1: 1-27.\nHall, Nancy. 2011. “Vowel epenthesis”, en Marc van Oostendorp, Colin J. Ewen, Eli-\nzabeth Hume y Karen Rice (eds.), The Blackwell Companion to Phonology . Oxford: \nJohn Wiley & Sons, pp. 1576-1596.\nHall, Nancy. 2007. “Cross linguistic patterns of vowel intrusion”, Phonology 23: 387-\n429.\nHernández Luna, Mario Ulises. 2019. Fonología del miahuateco. Sincronía, diacronía y \nclasificación, tesis de doctorado. México: El Colegio de México.\nItô, Junko. 1989. “A prosodic theory of epenthesis”, Natural Language and Linguistic \nTheory 7, núm. 2: 217-60.\nKaufman, Terrence. 2016. Proto-Sapoteko and proto-Sapotekan Reconstructions , en \n<https://www.albany.edu/ims/pdlma/SapRec16%20for%20posting.pdf> [con -\nsultado el 25 de diciembre de 2019].\nKenstowicz, Michael. 2005 [1993]. Phonology in Generative Grammar. Cambridge: \nBlackwell.\nKenstowicz, Michael. 1994. “Syllabification in Chuckchee: a constraints-based analy-\nsis”, en Alice Davison, Nicole Maier, Glauccia Silva y Wan Su Yan (eds.), Papers \nfrom the fourth annual meeting of the Formal Linguistics Society of Mid-America. Iowa \nCity: University of Iowa, pp. 160-181.\nKiparsky, Paul. 2018. “Formal and empirical issues in phonological typology”, en \nLarry Hyman y Frans Plank (eds.), Phonological Typology. Berlin/Boston: Walter de \nGruyter, pp. 54-106.\n148 adela covaRRubias acosta\nLM III-1 \nLingüística Mexicana. Nueva Época, III (2021), núm. 1: 119-149  \nISSN: 2448-8194', 'Del tratamiento de falsos amigos en un diccionario electrónico de dudas 11\nEstudios de Lingüística Aplicada, año 30, número 56, diciembre de 2012, pp. 9-33\nintroDucción\nEn este artículo, las autoras quieren aportar unas consideraciones acerca de la \ninformación pertinente en las entradas de un diccionario electrónico de dudas \n(DeD) alemán/español para hispanohablantes.1 El estudio se centra en la inclusión \nde falsos amigos y pretende demostrar que estos, sin duda, constituyen un ámbito \npertinente para una obra de estas características dado que tal y como afirma Doval \n(2006: 466): “Los falsos amigos presentan un problema muy importante y muy \nfrecuente tanto en la traducción como en la didáctica de la lengua extranjera al \nque el diccionario bilingüe presta apenas atención”.\n2\nSi esto es así, un diccionario en soporte electrónico podría cambiar esta \nrealidad. Su elaboración depende de múltiples factores, aunque consideramos \nque tres son los puntos clave: los criterios de usabilidad3 del diccionario, el perfil \nde sus usuarios y los fines perseguidos con dicha herramienta. Teniendo en cuen-\nta los criterios de usabilidad, el diccionario en soporte digital —como veremos \nmás adelante— se presta de manera formidable a entradas de tipo falso amigo, ya \nque esta herramienta permite una organización de la interfaz sencilla, dispone de \nuna flexibilidad en cuanto al espacio, ofrece la posibilidad de disponer de manera \nlógica los distintos elementos como colores de hipervínculos, estados de los dis-\ntintos botones, entre otras consideraciones. Además, por analogía con convencio-\nnes cul turales y estándares establecidos es fácil para el usuario reconocer las \netiquetas y símbolos utilizados (Cf. Torres, 2009: 16). Todos estos recursos ayu-\ndarán sobremanera a facilitar la comprensión del fenómeno falso amigo, que en \nmuchas ocasiones puede convertirse incluso en un verdadero enemigo peligroso.  \n \n1 Por razones de espacio, las autoras se han visto obligadas a dejar de lado la problemática de la \nvariación dialectal de los latinismos en el español. Sin duda se trata de un problema complejo que \nmerecería su debida atención. En el análisis de los casos del presente artículo se ha observado in-\nformación a tal respecto que no siempre coincidía. Por ejemplo, en cuanto a “competencia” (caso 3)  \nobservamos su sinónimo “competición (deportiva)” registrado en los tres diccionarios menciona-\ndos, marcado como “americanismo” (drae, clave) y uso en “zonas del español meridional”.\n2 La traducción de las citas en alemán e inglés es nuestra.\n3 Usamos este término en el sentido de, por ejemplo, Wiegand & Fuentes, 2010: 232 y Azorín Fernández \n& Santamaría Pérez (2011).\nELA 56 interiores.indd   11 15/01/14   20:25', 'Estudios de Lingüística Aplicada, año 39, número 72, enero de 2021, pp. 9–48\ndoi: 10.22201/enallt.01852647p.2021.72.926\n[ 36 ]  Kent Fredholm\nControl translations frequently concerned not only gt search \nresults, but also Spanish words and sequences that the students \nhad written with no help from gt . This might indicate insecurity \non the part of the students regarding their own profi  ciency of the \nvocabulary, spelling, or grammar. A less pessimistic interpretation \nis that the strategy may reveal an interest and a will to ascertain \nthe accuracy of word choice or grammatical form; nevertheless, it \nseems to be indicative of the lack of confi  dence of the students in \ntheir own command of the language.\nTable 10 shows an example of control translations and re-elab-\norations of a sequence.\nTABLE 10. Control translations. Augusta: 4\nTIME MARK GT SEARCH GT RESULT\n32’55’’\n‘goes in to [paternal] grandmother \nwho is lying in the bed’\n‘[to] go to the grandmother lying in bed’\n[wrong agreement of perf. part. “acostado”]\nDeletes y ‘and’, adds en la abuela acostado en la cama. ‘in the grandmother lying in bed’, looking at GT\nthree times. Copies the phrase and pastes it in the GT search box.\n33’43’’\n‘Red riding hood enters in the \ngrandmother lying in bed.’\n[wrong perf. part. agreement]\n‘Red Riding Hood in inside \ngrandmother in the bed.’\nCopies La caperucita Roja from text, pastes in GT search box.\n34’03’’\n‘Red riding hood enters’ ‘Red Riding Hood in’\ngår in till farmor som ligger i sängen ir a la abuela acostado en la cama\n38 / 5000 föreslå en förändring\nLa caperucita Roja entra en la abuela acostado en la \ncama.\nRödluvan in i mormor i sängen.\n59 / 5000 föreslå en förändring\nRed Riding Hood in\n25 / 5000 föreslå en förändring\nLa caperucita Roja entra', 'Adjetivos\nCotorra. El significado identificado de este adjetivo es ‘que es soltero en una edad en \nla que se considera que las personas deben estar casadas’ ( dem, s. v. solterón) (aunque \nesta palabra está restringida a mujeres), por lo que estaría en competencia con solterona, \nfrente a la cual cotorra sería un disfemismo, como muestra (6).\n(6)\nE: Cuando una muchacha tiene ya 20, cómo, ya no tiene chance de casarse, \n¿cómo le dicen?\nI: Que ya se le pasó el camión.\nE: Ahh\nI: Que ya se le está pasando el camión.\nE: Mmm ¿no les dicen cotorras?\nI: Pues sí, pero… Pues depende de la confianza que tenga una con aquella persona.\nE: Pero así de mucha confianza.\nI: Ah, sí, pos sí, ya le dice: “Ay, ya se te está pasando el camión,  ya estás bien \ncotorrita”. Así se le dice (chrm).\nEste intercambio entre la informante y el investigador inicia con la primera utilizan-\ndo un eufemismo ( ya se le pasó el camión ) para referirse a la mujer soltera, y el inves -\ntigador le pregunta sobre el potosinismo cotorra, tras lo cual ella acota su situación de \nuso a un contexto familiar (depende de la confianza que tenga con aquella persona), lo que \nmuestra que, más que un eufemismo, se trata de un disfemismo.\nEn cambio, no apareció ni en la encuesta de redes sociales ni en el cscslp, por lo que \nfue pertinente evaluar la variable edad y su incidencia en su reconocimiento con mayor \ndetenimiento. Finalmente, antes de pasar a los resultados, es importante señalar que \nesta palabra fue documentada en dos regiones muy alejadas entre sí: por un lado, fue \nusada por el político Hugo Luna en Jalisco; por otro, como comentario a este texto, una \ninformante de Puebla refirió que conoce este uso adjetival. Por esta razón, su extensión \ndialectal es mucho más amplia que la del resto de palabras de este trabajo.\nEl grupo I2 fue el que mayor representación tuvo de esta palabra (70.5%), seguido \npor el I1 (61%). Sumado a esto, la respuesta contraintuitiva (‘loca’) tuvo mayor repre -\nsentación en el grupo I1 (10%) frente al I2 (7%); además, el desconocimiento de la voz \nestuvo más presente en I1 (28%) que en I2 (22%). Estos datos pueden ser indicadores \nde una tendencia a la innovación en la capital, que evitaría palabras en proceso de des -\naparición (provocada por los cambios sociales a través de los cuales se ha dejado de es-\ntigmatizar a estas mujeres).\nEn cuanto a la edad, la generación más joven reconoce cada vez menos esta palabra, \ncomo indican los resultados del análisis de regresión logística, ya que ésta desfavoreció \nel uso de cotorra (0.332). En contraste, las generaciones más viejas, G2 y G3, favore -\ncieron el significado esperado (0.948 y 100% de apariciones). Esta diferencia etaria \n140 Valeria bocanegra y miguel PasTrán\nLM IV-2 \nLingüística Mexicana. Nueva Época, IV (2022), núm. 2: 125-152  \nISSN: 2448-8194']","The linguistic researcher's encounter with Alain Rey in Montreal was significant because it marked a continuation of their previous interactions in Mexico. Alain Rey is a renowned lexicographer and linguist, known for his work in the field of lexicography and language studies. The researcher's previous interactions with Alain Rey in Mexico might have laid the foundation for their meeting in Montreal, possibly establishing a professional relationship or academic connection between them. This encounter in Montreal could have provided an opportunity for further discussions, collaborations, or exchanges of ideas related to linguistics, lexicography, or language studies, building upon their previous interactions in Mexico."
How does the study of the Corpus Sociolingüístico de la Ciudad de Puebla contribute to understanding language variation in Mexico?,"['<1-hop>\n\nLingüística Mexicana. Nueva Época, II (2020), núm. 2: 189-193 ISSN: 2448-8194 donde, pese a la situación de diglosia flexible que hay entre el inglés y el español, pa - rece ser que las generaciones más jóvenes ceden más y más espacios de uso a la lengua mayoritaria por sobre la lengua de origen heredada ‒en este caso, el español. Por su parte, Miroslava Cruz Aldrete y Julio Serrano nos dan a conocer un poco sobre el contacto lingüístico en la comunidad de sordomudos en México y el desarrollo de la Lengua de Señas Mexicana (lsm), producto de las migraciones no sólo de los primeros instructores americanos o franceses que llegan al país, sino de sus hablantes actuales. Muestra de ello se tiene en la reagrupación de las tres ciudades consideradas para el estudio en solo dos grupos ‒Ciudad de México y Guadalajara frente a Tijuana‒ por la interferencia o no de la Lengua de Señas Americana ( asl) en cada dialecto tratado. Al mismo tiempo, los dos autores muestran que se trata de una comunidad de habla que, a diferencia quizá de lo que sucede en el contexto haitiano-dominicano, prefiere buscar todo el tiempo una acomodación lingüística que le permita la convivencia y la postula- ción de una estandarización de su lengua, en lugar de un uso lingüístico que los atenga a la desigualdad y al conflicto. Ahora bien, es el texto de Manuel Díaz Campos y Jason Killam el único estudio en el libro que nos ofrece un acercamiento al reconocimiento de la variación no sólo apoyán- dose en la producción de habla, sino en su comprensión. El experimento perceptual con colaboradores españoles, peruanos y venezolanos que nos ofrece señala la indización que como oyentes somos capaces de realizar respecto a las características individuales de los hablantes ‒sexo, edad, etcétera‒ o a su pertenencia a cierta comunidad lingüística ‒identificación de dialectos como el argentino, el chileno, el colombiano, el mexicano, el costarricense, el español y el peruano. En el segundo apartado de esta obra, se conjuntan seis colaboraciones sobre la des - cripción y comparación de los valores prosódicos que resultan pertinentes para la deli - mitación geolingüística del habla de países como México o Colombia. Son justamente los autores Pedro Martín Butragueño y Yolanda Congosto que, siguiendo la línea temática sobre migración del apartado anterior, introducen esta sección con la revisión de datos prosódicos de inmigrantes procedentes de distintas entidades mexicanas y de migrantes mexicanos en Los Ángeles, California, respectivamente. Ambos apuestan no sólo por corroborar y comparar los rasgos prosódicos que se han descrito para variedades como la de la Ciudad de México y los que son producto del contacto lingüístico, sino además, como lo hace Martín Butragueño mediante juicios lingüísticos, dar cuenta de la capaci- dad de adaptación, neutralización o mantenimiento de los rasgos prosódicos en el habla de estos migrantes. Establecen, en fin, una correlación de éstos con variables sociales. Erika Mendoza nos otorga una descripción de los patrones prosódicos utilizados en los enunciados declarativos de foco amplio del español de Cuapiaxtla, Tlaxcala, que, al confrontar los rasgos encontrados ya para la Ciudad de México y Puebla, sirve para proponer una delimitación interdialectal de las variedades del español central mexica- no. De igual manera, el trabajo de Carlos Ivanhoe Gil ‒parte de la crítica de que pese a que la entonación es un valor dialectal fácilmente advertido, ha tenido un tratamiento pobre en términos geolingüísticos‒, contribuye a reconocer qué configuraciones tona - les y rasgos prosódicos son viables para realizar una proyección geográfica de las zonas', '<2-hop>\n\nEl Corpus Sociolingüístico de la Ciudad de Puebla está conformado por entrevistas di- vididas en dos subcorpus: el que recoge datos de los oficios tradicionales y de la flora y la fauna, y el corpus Preseea-Puebla, el cual incluye la conversación semidirigida y un cuestionario sociológico, y se complementa con pruebas lingüísticas basadas en el cscm. El primero resguarda conversaciones que dan cuenta de los oficios tradicionales representativos de la ciudad de Puebla, como la panadería, la siembra de durazno en Huejotzingo o el trabajo con piedra en San Salvador el Seco. En este apartado la autora pone a dialogar dos perspectivas teóricas para el estudio de este tipo de repertorios: la terminología y la lexicología. Lo anterior se debe a que las características altamente referenciales acercan a los repertorios a los léxicos de especialidad y, al conservar su carácter tradicional, los hacen muy interesantes para los estudios lexicológicos. El estar en la frontera entre lo especializado y lo popular ha hecho que los estudios etnográficos o antropológicos reciban mayor atención. Posteriormente, tenemos una descripción detallada del levantamiento de las 108 entrevistas que conforman el corpus; se describen las variables sociales consideradas, la manera de llevar a cabo la conversación para que, en la medida de lo posible, conser- vara su carácter semidirigido, y la descripción de las pruebas lingüísticas elicitadas. De la prueba de actitudes y creencias la autora anota resultados comparativos interesantes entre las respuestas de los entrevistados del Corpus Sociolingüístico de la Ciudad de Méxi- co y las de los hablantes que conformaron el corpus poblano en relación con preguntas como “¿Qué es hablar bien?”, en donde se nota que “para los informantes de Puebla el trato con el otro y el deber como usuarios de la lengua son lo más importante a fin de hablar bien [mientras que para los hablantes de la Ciudad de México] el habla de quie- nes tienen la autoridad por su conocimiento es relevante” (p. 59). Lo anterior es sólo un ejemplo de las muchas líneas de investigación que estos corpus nos ofrecen. El tercer capítulo es un ejemplo del diálogo interdisciplinario entre la lexicología, la lexicografía y la ingeniería lingüística. En este apartado la autora propone una me- todología para el procesamiento de textos provenientes de un corpus de habla de gran volumen. Este tipo de análisis cuantitativo hace más manejable el corpus para su lema- tización y el análisis de concordancias. Gracias a ellos, pudo obtener vocablos que cali- fica como compartidos con otras variantes del español, pues aparecen registrados en el lemario del Diccionario del Español de México6 (dem). En cuanto a los vocablos que no aparecen registrados en el dem, la autora apunta a que pueden tratarse de posibles po- blanismos; sin embargo, se requiere de una documentación exhaustiva para corroborar o descartar este estatus, debido a que muchos de ellos son propios de la oralidad y, por lo tanto, es difícil encontrarlos documentados en fuentes escritas; ésa podría ser una de las razones por las que no están registrados en el dem. 6 Versión en línea consultada en <https://dem.colmex.mx/>. 154 Anayeli Hernández Cruz LM VI-2 Lingüística Mexicana. Nueva Época, vi (2024), núm. 2. ISSN: 2448-8194']","The study of the Corpus Sociolingüístico de la Ciudad de Puebla contributes to understanding language variation in Mexico by providing insights into the prosodic values relevant for geolinguistic delimitation of speech in countries like Mexico. It includes data from interviews on traditional trades, flora, fauna, and sociological questionnaires, highlighting the interaction between terminological and lexicological perspectives. The corpus also explores attitudes and beliefs about language use, revealing differences in linguistic norms between speakers from Puebla and Mexico City.",multi_hop_specific_query_synthesizer,"['24 Rainer Enrique.Hamel\nEncontramos aquí los fundamentos básicos que guia\xad\nron las investigaciones del análisis conversacional clá- \nsico. Las observaciones se basan en amplios estudios em\xad\npíricos de los autores. A primera vista, la mención ex\xad\nplícita de estos mecanismos parece banal, puesto que for\xad\nman parte de las rutinas que cualquier hablante nativo \ndomina perfectamente. Pero fueron justamente estas obser-  \nvaciones generales las que abrieron el camino a que, tan- \nto en la sociología como en la lingüística, la estructu\xad\nra formal de la conversación cotidiana se considerará \ncomo un objeto digno de estudio.\nEste fue precisamente el objetivo de los fundadores \nde la corriente: para establecer el análisis de conver\xad\nsaciones cotidianas como nueva disciplina de investiga\xad\nción en la sociología del lenguaje, se vieron obligados \na sostener y demostrar que su objeto de estudio era ana\xad\nlizable; en otras palabras, que no reinaba el ""caos"" en \nlas conversaciones cotidianas, el azar del libre juego \nentre los participantes. Por el contrario, según ellos \nse puede detectar una estructura formal en la conversa\xad\nción : los interlocutores observan reglas estructuran\xad\ntes y participan activamente en la organización de la \nconversación, como se ha visto en los mecanismos detec\xad\ntados por Sacks, Schegloff y Jefferson.\nEl catálogo de mecanismos conversacionales se basa \nen el supuesto de que en la conversación -comprendida \ncomo interacción simbólica- existen, por un lado, tareas \nestructurales para organizaría y, por el otro, medios pa - \nra resolver estas tareas. Las tareas se pueden dividir \nen tres áreas globales que contribuyen a mantener la con-  \nversación:\n1. El aseguramiento mínimo de la cooperación.\n.2. El aseguramiento suficiente de la comprensión de \nenunciados del otro participante y la comprensi\xad\nbilidad de los enunciados propios para él.\n.3. La organización de los transcursos en el tiempo, \ncon un comienzo, una parte central y una clausu\xad\nra (cf. Kall meyer/Schütze, 1976:9).', 'Algunas exploraciones en torno a la reflexión metalingüística sobre la ironía 17\nEstudios de Lingüística Aplicada, año 35, número 66, diciembre de 2017, pp. 9–39\ndoi: 10.22201/enallt.01852647p.2017.66.827\npretación irónica: aunque María literalmente dice que la fiesta estuvo fantástica, \nen realidad quiere expresar que no le gustó.\nSi bien la teoría de Sperber y Wilson (Wilson & Sperber, 1992, 2004) ha \nsido objeto de críticas (al respecto véase, entre otros, Attardo, 2000, y Kalber -\nmatten, 2006), también ha recibido un importante soporte experimental (Kal -\nbermatten, 2006). Por tanto, consideramos que resulta ser una herramienta vá-\nlida para el estudio sobre la manera en que los niños y adolescentes interpretan \nlas expresiones irónicas. Por otra parte, creemos que esta aproximación permite \nanalizar la forma en que un individuo hace una reflexión sobre el lenguaje en sí \nmismo (mención en términos de la teoría de la relevancia, reflexión metalingüís-\ntica en términos de Gombert, 1992).\n1.4. Aspectos que inciden en la interpretación de la ironía verbal\nDesde la propuesta de la teoría de la relevancia (Wilson & Sperber, 1992, 2004) \nse asume que para interpretar un enunciado irónico el oyente debe percatarse de \nque no puede tratarse de una emisión literal. Para lograr lo anterior, cuenta con \ninformación generada por diversas fuentes contextuales. Al respecto, Yus (2000, \n2009) propone que existen siete fuentes contextuales que aportan información \nrelevante para lograr la adecuada interpretación de un enunciado irónico: cono-\ncimiento enciclopédico general (conocimiento que se tiene acerca del mundo: \ninformación social y cultural que permite interpretar más fácilmente una expre-\nsión irónica); conocimiento enciclopédico específico del interlocutor (gustos, \nhábitos, creencias, opiniones y demás información); conocimiento de sucesos o \nacciones que ocurrieron poco tiempo antes de la expresión irónica; enunciados \nprevios a la conversación; comunicación no verbal vocal y visual (entonación, \ngestos faciales, sonrisas); elecciones léxicas o gramaticales (pistas lingüísticas \ncomo adjetivos con connotación de cualidad extrema, adverbios, superlativos, \nrepeticiones innecesarias, frases convencionalmente irónicas) y la información \nproveniente del entorno físico que rodea a los interlocutores. De acuerdo con el \nautor, la presencia / ausencia de dichas fuentes contextuales impactará en el ac-\nceso que pueda tener un individuo a la interpretación irónica. De esta manera, a \nmayor saturación, es decir, a mayor cantidad de fuentes contextuales, más fácil \ny rápida será la interpretación irónica. Específicamente para fines de este estu -', 'Algunas exploraciones en torno a la reflexión metalingüística sobre la ironía 21\nEstudios de Lingüística Aplicada, año 35, número 66, diciembre de 2017, pp. 9–39\ndoi: 10.22201/enallt.01852647p.2017.66.827\n2.5. Transcripción y análisis\nLas intervenciones de cada uno de los participantes fueron videograbadas para fi-\nnes de transcripción y análisis. En un primer momento se procedió a categorizar \nlas respuestas sobre la interpretación de los textos. Dentro de este rubro se con -\nsideraron como aciertos aquellas respuestas que permitieran vislumbrar que el \nparticipante había interpretado el enunciado irónico de una manera no literal (ej.: \nle dijo algo en forma de mentira para hacerlo sentir mal; lo dice como para que \nse sienta mal; lo dijo para contradecirla) y el no irónico como literal (ej.: le está \nafirmando que su tiempo fue muy bueno; la felicitó porque se aprendió muy bien \nel poema). En un segundo momento se procedió a analizar las reflexiones metalin-\ngüísticas que presentaron los participantes sobre los textos, por lo que se codifi -\ncaron todas las respuestas que daban cuenta de las razones por las que los niños y \nadolescentes consideraban que un enunciado era irónico o no, fueran correctas o \nno. Las respuestas fueron entonces clasificadas en tres categorías generadas a pos-\nteriori a partir de las respuestas de los participantes: categoría de contenido, cate-\ngoría de forma y categoría de actuación. Dichas categorías no eran excluyentes en-\ntre sí, por lo que algunas respuestas podían ser clasificadas en más de una de ellas.\nLas respuestas de contenido incluyeron todas las reflexiones de los partici-\npantes que hacían alusión a los eventos, sucesos, trama y personajes que apare-\ncen en los textos, es decir, al contenido mismo de las situaciones planteadas por \nel texto (ej.: porque Camila estaba muy segura de que iban a ganar el partido \npero a la mera hora no; Juan, como es amigo de Camila, quiso ser bueno con \nella y no lastimarla; ella sabe que está podrida y eso no concuerda; si son ami-\ngas no le puede mentir así; es de broma solamente porque ella vio la pizza y se \nve podrida). Por su parte, bajo la categoría de forma se agruparon las respuestas \nen las que los participantes hacían mención a la manera en que estaba construi-\ndo el texto o las palabras usadas en el mismo, es decir, que denotaban un aná-\nlisis del texto como objeto en sí mismo (ej.: tiene sarcasmo; no dice explícita-\nmente, lo dice con sarcasmo; muchas veces es por el tono; porque la palabra \n‘fantástico’ es algo como bueno; lo dice con una forma en la que suena correc-\nto pero está diciendo una mentira; le dice un texto ofensivo). Finalmente, en la \ncategoría de actuación se incluyeron las respuestas de los niños y adolescentes \nque denotaban una reflexión sobre el posible impacto que el texto o la frase iró-', 'El chisme: estrategias discursivas desplegadas en su construcción 41\nEstudios de Lingüística Aplicada, año 36, número 67, julio de 2018, pp. 9–43\ndoi: 10.22201/enallt.01852647p.2018.67.723\nAnexos\nA.  Generalidades de los chismes del corpus (título, participantes, contexto y \ntemática)\ntítulo del Chisme PartiCiPantes Contexto y temátiCa\nLa amante del exmarido Ana (A)\nJimena (J)\nLas dos participantes están en la casa de A. El tema que las ocupa es el \nexmarido de J, de quien se ha separado hace relativamente poco tiempo. En \nespecífico, el objeto del chisme es la actual pareja romántica del exmarido, \na quien de algún modo culpan de la separación. \nEl marido de Regina Ana (A)\nRegina (R)\nEste chisme acontece durante el convivio que se acostumbra hacer después \ndel rezo del rosario guadalupano. A está sentada al lado de R. Las partici-\npantes empiezan hablando de una pareja que conocen y que se acaba de \nseparar. R aprovecha para hablar del engaño de su propio marido.\nTomasita Ana (A)\nNancy (N)\nSe encuentran ambas afuera de sus casas. A va de salida a hacer sus com-\npras y N está comprando el agua de garrafón. Su plática comienza después \nde la interacción con el vendedor de agua y gira en torno a una conocida \nen común (que vive en el mismo edificio). Se trata de una señora mayor \na quien A a veces ayuda con sus tareas, pero que tiende a ser exigente y \nquisquillosa. \nEl señor que se murió Ana (A)\nMary (M)\nBety (B, hija \nde M)\nA mediodía, afuera de la casa de M. El chisme se construye en dos momen-\ntos, separados por otro chisme. En el primer momento participan A y M, am-\nbas señoras con hijos y nietos. M es quien introduce a la 3ª p y quien inicia el \nchisme. En el segundo, además de las ya mencionadas, también participa B. \nEn esta parte es A quien reinicia el chisme, partiendo de la información que \nantes le fue proporcionada por M. Es un chisme encaminado a configurar la \nimagen de un señor que falleció recientemente. \nLa tamalera Ana (A)\nVerónica (V)\nCarolina (C)\nV y C (madre e hija) le relatan a A una noticia que vieron por televisión res-\npecto a una mujer que vendía tamales. Se descubrió que había asesinado \na su marido, de quien recibía malos tratos, y que parte de la carne la utilizó \npara hacer tamales. \nDoña Leo y su hija \nCarmen\nAna (A)\nPerla (P)\nAmbas están afuera de la casa de P . Este chisme inicia cuando ven pasar \na unos jóvenes, vecinos del barrio. La plática se inclina hacia una vecina, \ndoña Leo y su hija Carmen. La joven mantiene una relación sentimental \ncon un hombre violento que además está involucrado en asuntos ilegales. \nParte de la conversación gira en torno a las peleas de esta pareja, aunque \nconstantemente hacen referencia a otros jóvenes vecinos implicados en crí-\nmenes y drogas.']","The study of the Corpus Sociolingüístico de la Ciudad de Puebla contributes significantly to understanding language variation in Mexico by providing a rich source of linguistic data. This corpus allows researchers to analyze the linguistic features present in the speech of individuals in Puebla, Mexico, and to identify patterns of variation based on factors such as age, gender, social class, and education level.

By examining the linguistic data from this corpus, researchers can gain insights into how language is used in different social contexts within Puebla, Mexico. They can also investigate how language variation is influenced by historical, social, and cultural factors specific to this region. This type of research helps to deepen our understanding of the diversity of language practices in Mexico and contributes to the broader field of sociolinguistics.

Overall, the Corpus Sociolingüístico de la Ciudad de Puebla serves as a valuable resource for studying language variation in Mexico and provides a foundation for further research on sociolinguistic phenomena in this region."
