user_input,reference_contexts,reference,synthesizer_name,retrieved_contexts,response
What are some key aspects of the comparative study between Spanish from Mexico and Korean?,"['Natalia Ignatieva mente, el foco de entonación en inglés. Siendo un campo interdisciplinario entre la fo\xad nología y la sintaxis, es poco investigado, por lo que pensamos que este artículo puede arrojar luz sobre los fenómenos poco conocidos y provocar interés en nuestros lectores. Los dos trabajos que siguen se sitúan dentro de los estudios contrastivos, lo cual permite observar que el análisis contrastivo sigue en pie aun cuando han cambiado sus objetivos, métodos y prácticas, al igual que la terminología. Se habla hoy en día de estudios interlenguales e interculturales cuando se comparan elementos de diferentes lenguas. Nos es grato presentar aquí dos artículos de esta naturaleza. El primero de ellos “The English and French at work: Contrasting language practices and Cultural Shock”, de Christine Geofffoy, se dedica al fenómeno del choque cultural y prácticas lingüísticas contrastantes de los franceses e ingleses. La investigación realizada por la autora permite ver el contraste entre las actitudes comunicativas de los dos grupos analizados que causa confusión y malentendidos en el proceso de comunicación. La lin\xad güista aboga por el desarrollo de la competencia intercultural con fines de mejorar la co\xad municación internacional. Creo que este análisis es muy ilustrativo y trasciende el territorio de las dos naciones involucradas, nos podría dar pautas para otras prácticas y experiencias de la interacción en lenguas extranjeras. El otro artículo “Estudio comparativo entre las expresiones de uso cotidiano del español de México y del coreano”, de Hyejeong Jeong, compara algunas expresiones y frases idiomáticas en español con sus equivalentes en coreano. La meta final de este trabajo que nos abre un horizonte hacia una lengua “exótica”, “nueva” para nuestra revista y que, seguramente, va a enriquecer los conocimientos de nuestro púbico, es ayudar a los aprendientes coreanos de español, o, inversamente, a los hispanohablantes que estudian coreano, en su adquisición del léxico de L2. El siguiente autor, Eduardo Faingold, en su artículo “Pro-active attitudes and educational strategies in early trilingual acquisition: Referential avoidance and parental intervention at the one-word stage” estudia el fenómeno de multilingüismo en la adqui\xad sición temprana del lenguaje. Se examina el caso de un niño trilingüe que está adquirien\xad do de manera simultánea el hebreo, el español y el portugués en el ambiente de una sociedad multilingüe en Israel donde las lenguas de prestigio son inglés y francés. El autor analiza el uso de la estrategia de “explotación léxica” por el niño y los fenómenos paralelos, a saber, la “evitación referencial” y la “intervención patemo-matema”. Es una investigación interesante y muy recomendable para todos aquellos que se ocupan de la adquisición del lenguaje. Continúa el tema de adquisición de lenguas el artículo “Las actitudes y cómo me\xad dirlas” de Ali ne Signoret. Este ofrece la visión sociocultural del proceso de aprendizaje de L2, en este caso francés, y la influencia de las actitudes hacia la lengua y cultura francesa en el desarrollo del interlenguaje de los estudiantes hispanohablantes. Además nos proporciona un modelo del diseño de instrumento para medir las actitudes de los alumnos. Es un trabajo bien fundamentado y útil para profesores de lenguas extranjeras. El siguiente artículo, “Materiales para producción escrita: una propuesta metodológica para la enseñanza del español como segunda lengua”, de Rosa Esther Delgadillo sugiere el']","The article 'Estudio comparativo entre las expresiones de uso cotidiano del español de México y del coreano' by Hyejeong Jeong compares some expressions and idiomatic phrases in Spanish with their equivalents in Korean. The ultimate goal of this work is to assist Korean learners of Spanish, or vice versa, in acquiring L2 vocabulary.",single_hop_specifc_query_synthesizer,"['en el sustantivo, pues se presentan casos del uso de bronca tanto en singular como en \nplural. Sin embargo, uno de los rasgos que más llaman nuestra atención es que, a dife -\nrencia de otras formaciones entre verbos + bronca, el caso de meter es particular, ya que \nlos datos indican que la forma recurrente y aceptada entre los hablantes incluye la pro -\nnominalización reflexiva del verbo.\nEn ese tenor, Bogard (2015) señala que “si el verbo se amplía mediante la incor -\nporación de clíticos, el verbo no se convierte en una frase, sino que se mantiene como \nuna unidad morfosintáctica, es decir, se mantiene como el núcleo de la correspondiente  \nfrase verbal” (p. 5). Por esta razón, podríamos entonces decir que, para lematizar la \ncolocación –es decir, para determinar cuál sería su forma de registro lexicográfico–, las \nformaciones compuestas por meter y bronca tendrían que aparecer en una forma prono-\nminalizada. \nComo vemos en (2), es un caso que se da de manera especial en la combinatoria \ncon estas dos unidades y no se presenta necesariamente en otras. En (2a) notamos \nque se emplea la construcción con pronominalización, mientras que en (2b) la colo -\ncación se constituye por el verbo andar + en + broncas en infinitivo. Por último, en \n(2c) vemos una colocación en pretérito impersonal. Cada una presenta formas de uso \nvariadas; sin embargo, es el caso de meter el que refleja que se trata de una construcción \nexclusivamente pronominal (tabla 3).\n(2)\na. La personalidad era de meterse en broncas (PUEB_H33_087)\nb. sí una vez por andar en broncas (MONR_H11_HMP002)\nc. I: dice/ “oye mano/ ¿pues tú eres/ eres de ellos o eres de la empresa?”/ ahí es \ndonde empezaron [las...]\nE: [ajá]\nI:  broncas// (ME-267-23H-06)\nTabla 3. Meter como verbo pronominal en el colem(v+s)\nPersona Colocación (ejemplos) Total de ocurrencias\nSingular\n1º\n2º\n3º\nMe meta yo en broncas \nNi te metas en broncas \nLa bronca en la que se mete\n5\nPlural 1º ¿Para qué nos metemos en broncas? 2\nLos datos que encontramos en la tabla 3 nos indican que el uso de meterse en \nbroncas tiende a aparecer en las tres personas del singular y sólo en la primera del \nplural. Aunque esta información puede darnos una idea generalizada sobre la forma \nen que se constituyen las colocaciones de este tipo, el siguiente paso en una futura \ninvestigación deberá incluir la documentación en otras fuentes, de tal suerte que  \n92 xócHitL taveRa ceRvantes y caRLos gonZÁLeZ di PieRRo\nLM IV-1 \nLingüística Mexicana. Nueva Época, IV (2022), núm. 1: 81-97  \nISSN: 2448-8194', 'La coLocación meterse en broncas\npodamos constatar este uso pronominal del verbo meter en las colocaciones con bron-\nca y determinar si hay otros usos que no hayan aparecido en nuestro corpus y me -\nrezcan igual atención.\nVínculo de dos lexemas y restricción combinatoria . Un aspecto interesante en las for -\nmaciones que hemos identificado es que, aunque el resto de los datos nos señala que la \npredisposición combinatoria de bronca como base colocativa es en cercanía con verbos, \nel uso particular de meter ocurre necesariamente por medio del uso de una preposición, \nconcretamente en. \nEn (3) podemos ver que en el caso de esta preposición, del total de las ocurrencias \ndel corpus (11), aparece en 10 ocasiones, mientras que en sólo un hablante se presenta \nel caso con a. La insuficiencia de casos dentro de los datos no nos permite determinar \nsi la segunda preposición es también de uso frecuente. Sin embargo, podemos decir, por \nlo pronto, que la estructura de las colocaciones del verbo meter con bronca puede expre-\nsarse como meterse en  bronca(s).\n(3)\na. Para qué me meto en broncas (ME-291-11H-06).\nb. Nos metimos a esa bronca (ME-055-32M-99).\nTransparencia y opacidad. Las colocaciones meterse + en + bronca(s) pueden conside-\nrarse dentro de las estructuras con mayor opacidad, puesto que, aun cuando no se trata \nde una expresión con un significado idiomático propiamente dicho –lo cual la ubicaría \ndentro del espectro de las locuciones–, su carga metafórica es mucho más relevante que \nen otros casos de formaciones con el mismo sustantivo (4).\n(4)\na. [y todavía]/ como si nos sobrara tiempo/ nos metimos a esta bronca / (ME-055- \n32M-99).\nb. y este / y entonces fue el accidente más grande que hemos tenido y / pos me \ncostó / y pa mucho / pérdida de tiempo / y dinero para arreglar esa bronca / pero \nfue un accidente donde murió una persona (MONR_H31_HMP077).\nSegún Lakoff y Johnson (1980), el ser humano estructura su forma de concebir el \nmundo por medio de metáforas de lo que hay en él para comprenderlo de mejor mane-\nra: “una vez que hemos identificado nuestras experiencias como objetos o sustancias, \npodemos referirnos a ellas, categorizarlas, agruparlas y cuantificarlas y, de esta manera, \nrazonar sobre ellas” (p. 63). En ese sentido, podemos decir que el caso de meterse en \nbroncas tiene una implicación cercana como la metáfora del canal o de recipiente, a sa-\nber: “El hablante pone ideas (objetos) en las palabras (recipientes) y las envía (a través \nde un canal) o un oyente que extrae las ideas-objetos de sus recipientes” (Reddy, apud. \n93\nLM IV-1\nLingüística Mexicana. Nueva Época, IV (2022), núm. 1: 81-97\nISSN: 2448-8194', 'Sujeto morfológico  (Estar + gerundio ) Presente progresivo\nTotal de verbos (estar + gerundio presente) producidos + requeridos \n1ª sg. 2ª sg. 3ª sg. 1ª pl. 2ª pl. 3ª pl.\nSuj.morf\nV+flex\nSingular\nAciertos\nii\nReglas defectivas Productividad\nSuj.morf\nV+flex\nPlural\nAciertos\nii\nReglas defectivas Productividad\nOmisiones Comisiones\n%\nAciertos\nii\nOmisiones Comisiones %\nAciertos\nii\nSin verbo V. Infiniti-\nvo(-flex)\n Flexiones\n inadecuadas Sin verbo V. Infinitivo(-flex)  Flexiones \ninadecuadas\nAux. Gdo. Aux. Gdo. Aux. Gdo. Aux. Gdo.\n1ª sg.\n(yo)\nEstoy\ncant-ando\ncom-iendo\nviv-iendo\n1ª pl.\n(nosotros/as)\nEstamos\ncant-ando\ncom-iendo\nviv-iendo\n% % % %\n% % % (-)precisión \nléxica\n% % % (-)precisión \nléxica\n% %\n2ª sg.\n(tú)\nEstás\ncant-ando\ncom-iendo\nviv-iendo\n2ª pl.\n(ustedes)\nEstán\ncant-ando\ncom-iendo\nviv-iendo\n% %\n% % % (-)precisión \nléxica\n% % % (-)precisión \nléxica\n%%\n3ª sg.\n(él/ella)\nEstá\ncant-ando\ncom-iendo\nviv-iendo\n3ª pl.\n(ellos/as)\nEstán\ncant-ando\ncom-iendo\nviv-iendo\n% %\n% % % (-)precisión \nléxica\n% % % (-)precisión \nléxica\n%%\n22\nLM III-1 Jalina RamíRez GRycuk\nLingüística Mexicana. Nueva Época, III (2021), núm. 1: 7-33  \nISSN: 2448-8194']","I'm sorry, but the context provided does not contain information about a comparative study between Spanish from Mexico and Korean. If you have any other questions or need assistance with the content provided, feel free to ask!"
Who authored the article 'El discurso explicativo en la divulgación científica'?,"['El estudio llevado a cabo por las autoras de la Universidad de Concepción, Chile, les permitió llegar a la conclusión de que la adquisición oral del inglés como lengua extranjera está en relación directa con el desarrollo del pensamiento crítico y con el desarrollo de estrategias comunicativas. El uso de Intenet favorece la producción y com\xad prensión de la oralidad en el aula, que se convierte en una comunidad abierta. Los resultados positivos de esta experimentación les dan la oportunidad a las investigadoras de hablar de un programa de desarrollo de pensamiento crítico que fomentaría el entendimiento intercultural y, finalmente, contribuiría a la adquisición exitosa de la lengua extranjera. Los artículos que siguen están relacionados con el área de análisis del discurso que es otra de las líneas importantes de investigación en el Departamento de Lingüística Aplicada. Empieza este bloque el artículo “El discurso explicativo en la divulgación científi\xad ca” de M. L. Berruecos V., donde la autora estudia el proceso de explicación en un corpus de seis artículos científicos. Desde la posición de la interacción discursiva se investigan las secuencias explicativas, los procedimientos utilizados para este propósito y los rasgos principales de éstos. Una de las conclusiones de la autora es que entre mayor sea el número de secuencias explicativas en un texto, mayor su didacticidad, de ahí la importancia del papel de la explicación en el discurso académico, de difusión de conoci\xad mientos, y en el discurso didáctico. M.E. Gómez de Mas y V. Zamudio Jasso, autoras de las dos aportaciones que siguen respectivamente, son profesoras-investigadoras del CELE que trabajan en el grupo de Análisis del discurso en el DLA. Es de notarse, no obstante, que la temática de sus estudios es distinta. Publicando sus artículos cumplimos con uno de los objetivos de Estudios de Lingüística Aplicada que es difundir los resultados de investigaciones en el DLA del CELE. El artículo de M.E. Gómez “Códices coloniales en contexto: las pasiones de los conquistadores” es un estudio discursivo de dos manuscritos pictóricos del siglo xvi en una situación social de dominación española en el México colonizado. Los discursos de estos documentos litigiosos muestran el conflicto entre los indios y sus opresores y se analizan en términos de sus pasiones. Como menciona la autora, los códices se han estudiado como una realidad histórica y no han sido todavía objeto de un análisis discursivo, de ahí proviene la aportación de este estudio al área del análisis del discurso y también a la pragmática. El otro artículo, “Acercamiento a la problemática en la escritura de ensayos de análisis literario”, de V. E. Zamudio propone estudiar factores que influyen en la escri\xad tura de los ensayos de análisis literario que hacen los alumnos de Letras Inglesas en la Facultad de Filosofía y Letras de la UNAM. Entre estos factores están el dominio de la lengua extranjera, el escritor, la comunidad académica y el género textual. La autora ha realizado un estudio de tipo exploratorio-interpretativo basado en datos cualitativos que le han permitido ver este problema como uno bastante complejo, dado por varios facto\xad res, lo cual implica una resolución, por medio de cursos de redacción, por ejemplo, que fuera adecuada a las necesidades de los estudiantes.']",M. L. Berruecos V. authored the article 'El discurso explicativo en la divulgación científica' where the author studied the process of explanation in a corpus of six scientific articles.,single_hop_specifc_query_synthesizer,"['podría significar que su disponibilidad léxica es más amplia. Sin embargo, hay que mirar a \ndetalle los idl de todas las palabras para determinar si se trata efectivamente de una mayor \ndisponibilidad léxica o, por el contrario, de una distribución diferente de ellas.\nTabla 4. Índice de disponibilidad por sexo\n \nTipo de institución \nComo podemos observar en la tabla 5, se obtuvo una mayor cantidad de palabras emi -\ntidas de la institución pública (347, promedio de 8.6), que superó a la privada por 62 \nunidades. Esta última evocó 285 palabras, con lo que obtuvo un promedio de 7.1 por \ninformante. Hasta este momento, entonces, podemos constatar que la institución públi-\nca fue la que evocó más palabras.\nTabla 5. Total y promedio de palabras por tipo de institución\nEn la tabla 6, donde se muestra el índice de disponibilidad de la institución pública, \nse puede observar la palabra gay en primer lugar, con un índice de 0.28270114 y 13 \napariciones. según con estos resultados, la institución pública evocó más palabras que \nla de educación privada.\nHombres Mujeres\nPalabra idl Palabra idl\n1 gay 0.28980507 amor 0.33978312\n2 amor 0.28464675 igualdad 0.18305711\n3 homosexual 0.14978973 respeto 0.1767814\n4 libertad 0.12707167 gay 0.14604758\n5 lesbiana 0.10738158 lesbianas 0.13381209\n6 asco 0.09644609 discriminación 0.12118703\n7 joto 0.09008335 amistad 0.11768799\n8 lesbianas 0.08475817 sexo 0.115388\n9 igualdad 0.07814113 gays 0.1004557\n10 homosexualidad 0.07717483 hombres 0.08989513\nTipo de institución Palabras Promedio\nPública 347 8.6\nPrivada 285 7.1\n39\nLM II-2\nLingüística Mexicana. Nueva Época, II (2020), núm. 2: 29-48\nISSN: 2448-8194', 'Los datos presentados en la tabla 4 confirman el cumplimiento casi absoluto \nde esos patrones en las tres generaciones de hablantes. No llegan a cumplirse del todo \núnicamente por el hecho de que en la primera generación hay más mujeres que usan ey \nque hombres ―pero la diferencia es prácticamente imperceptible: 8 mujeres frente a 7 \nhombres― y porque los informantes de la tercera generación no siguen la frecuencia de \nuso escalonada de ey según su nivel educativo; es decir, se esperaría que los informantes \nde nivel educativo medio sobrepasaran a los de nivel alto, y eso no sucede:\nTabla 4. Informantes que dicen ey en Guadalajara (n = 72)\nGeneración Hablantes\nSexo Nivel educativo\nHombre Mujer Bajo Medio Alto\n20-34 años 15 7 8 6 5 4\n35-54 años 17 10 7 8 6 3\n55-… años 11 6 5 7 1 3\nTotal 43 23 20 21 12 10\nFigura 4. Informantes que dicen ey en Guadalajara respecto al total de hablantes.\nCon todo, podemos apreciar en la figura 4 que, en Guadalajara, ey no indiza un sexo \nen particular ―lo producen hombres y mujeres casi por igual― ni una edad específica ―\nlo dicen hablantes de todas las edades― pero sí un nivel educativo concreto: el bajo. Las \nfrecuencias totales de ey en el corpus sustentan dos de estas deducciones y matizarían \nuna. Aunque de las 431 ocurrencias, 219 fueron producidas por hombres y 212 por mu-\njeres, y 316 ocurrencias fueron emitidas por informantes de nivel educativo bajo, 76 por \ninformantes de nivel medio y 39 por informantes de nivel alto, tal como se aprecia en la \ntabla 5 y en la figura 5, la mayoría de las ocurrencias fue dicha por informantes mayores \nde 55 años y por informantes de 35 a 54 años, lo cual deja muy por debajo el número de \nInformantes que dicen “ey” en Guadalajara respecto al total de hablantes\nTotal de hablantes en Guadalajara: 43 (≈100%)\n52\nPatricia córdova abundis y daniel barragán trejo LM V-1 \nLingüística Mexicana. Nueva Época, v (2023), núm. 1: 41-64  \nISSN: 2448-8194', 'Tabla 6. Índice de disponibilidad por tipo de institución\nEdad\nTabla 7. Total y promedio de palabras por grupo de edad\nEn la tabla 8 se observa el índice de disponibilidad de cada grupo de edad. La prime-\nra palabra en aparecer en el grupo de 15 a 16 años es gay, con un índice de 0.24714968 \ny un total de 10 ocurrencias en la muestra. \nNuestro interés en este apartado ha sido verificar la hipótesis que sugiere que el \nlexicón de los hablantes crece en correspondencia con su rango de edad. En la grá -\nfica 1 podemos ver que el número de palabras evocadas por hombres de institución \npública es de 81 en ambos grupos de edad, lo que muestra que en este estrato no hay \ndiferencia en cuanto a esta variable. En cambio, para la institución privada podemos \nobservar un incremento: los alumnos de 15-16 años emitieron 42 palabras, mientras \nque los de 17-18 años registraron un total de 96. En cuanto al sexo femenino de \ninstitución pública, se presenta una disminución de una unidad, rasgo no represen -\nInstitución pública Institución privada\nPalabra idl Palabra idl\n1 gay 0.28270114 amor 0.36691616\n2 amor 0.26887113 lesbianas 0.1603786\n3 homosexual 0.17045594 gay 0.15923506\n4 lesbiana 0.16527261 igualdad 0.14888955\n5 joto 0.12166862 asco 0.14481304\n6 felicidad 0.12166133 respeto 0.13815132\n7 discriminación 0.12029 gays 0.10852902\n8 igualdad 0.11887211 sexo 0.10835117\n9 libertad 0.09733354 amistad 0.10822576\n10 respeto 0.0936326 raro 0.09541517\nEdad Palabras Promedio\n15-16 años 270 6.75\n17-18 años 373 9.3\n40\nJorge Lázaro y MicheLLe rubino LM II-2 \nLingüística Mexicana. Nueva Época, II (2020), núm. 2: 29-48  \nISSN: 2448-8194']","I'm sorry, but the article 'El discurso explicativo en la divulgación científica' is not mentioned in the provided context. If you have the author's name or any additional information, I can help you further."
What is the focus of Natalia Ignatieva's work in the field of linguistics?,"['Natalia Ignatieva tos en esta área, en escoger los medios adecuados para promover su presencia en even\xad tos científicos. Hyejeong Jeong en su artículo “Estudio sobre los marcadores de vacilación en coreano” abre otra página en el análisis discursivo. Se trata de un fenómeno poco estudiado, pero importante en el discurso coreano. El propósito del artículo es analizar el uso y las funciones de estos elementos discursivos. Los resultados de este estudio son interesantes, ya que la autora propone el carácter universal del fenómeno de los marca\xad dores analizados; en otras palabras, es un recurso lingüístico que está presente en todo lenguaje y que debería formar parte de un análisis conversacional en cualquier lengua. El artículo “La ansiedad en el proceso cognoscitivo al aprender inglés”, de Fran\xad cisco Castillo Navarrete, nos introduce a un tema poco discutido, por lo menos, errel ámbito mexicano. Estamos acostumbrados a investigar, analizar y discutir sobre qué hace el “buen aprendiente” de idiomas, qué estrategias usa para lograr el dominio de una lengua extranjera y actualmente existe abundante literatura acerca del tópico. Aho\xad ra bien, rara vez nos preguntamos qué es lo que hace el “mal” alumno, es decir, el que no es muy exitoso, y sobre todo, por qué no tiene éxito. A esto está dedicado el artículo de Francisco Castillo: entre las variables afectivas que influyen en la adquisición de lenguas extranjeras el autor elige el factor de ansiedad y hace un estudio exploratorio de cómo los estudiantes con ansiedad perciben el proceso de aprendizaje de inglés como L2. Al observar cinco estudiantes del sexo femenino con rasgos de ansiedad, el investi\xad gador trata de revelar cuáles aspectos de la clase han inhibido su proceso de adquisición de inglés. Las conclusiones a las que llega y sus sugerencias para futuras investigaciones ofrecen mucho sobre qué reflexionar para un profesor de idiomas. El tema de los factores que afectan la adquisición del lenguaje persiste en el artículo “En busca de las variables más influyentes en el aprendizaje de la lengua extranjera”, de David Lasagabaster. Otro de los temas de este artículo es el bilingüis\xad mo, que es un campo que adquiere cada vez mayor importancia. El autor propone estudiar algunas de las variables que ejerzan influencia en el aprendizaje de idiomas, llegando al final a la conclusión de que la competencia en la lengua materna y el conocimiento de otro idioma, más la conciencia metalingüística, resultan de las más importantes entre las que fueron exploradas en su análisis. En el mundo de la globalización donde el bilingüismo se ha hecho ya un fenómeno cotidiano y el aprendizaje de terceras lenguas se ha declarado como un prometedor terreno de estudios, el artículo de David Lasagabaster nos parece sumamente actual. Cierra la parte de artículos el trabajo de Aline Signoret “Cognición, pensamiento y lenguaje: Perspectivas teóricas desde la psicolingüística, la adquisición del lenguaje y la psicología cognitiva”, que reúne una serie de reflexiones sobre los problemas de cognición y lenguaje. La autora discute diferentes propuestas acerca de estos tópicos en el área de las ciencias cognitivas y la relación entre las mismas. Invitamos a nuestros lectores a unirse en estas reflexiones. En la parte dedicada a las reseñas, las primeras tres presentan el fruto de la mesa redonda “Novedades editoriales del CELE”, organizada en el marco de los festejos del']","Natalia Ignatieva focuses on selecting the appropriate means to promote her presence at scientific events and analyzing the use and functions of discourse elements, particularly hesitation markers in Korean discourse.",single_hop_specifc_query_synthesizer,"['(17)\na. Estiéndanse los límites del señorío de la Iglesia de la otra parte del Apenino hasta \nel mar Adriático, llegando al río Pescara, y destotra al río Garellano, incluso / \nincluido / hasta gran pedazo del Abruzo y de Campania \n(Historia de Felipe II, Rey de España 1619)\n b. En el caso del párrafo primero del artículo anterior, si estuviera asegurada la \nfinca, el valor del seguro quedará afecto al pago del capital del censo y de las \npensiones vencidas, á no ser que el censatario prefiera invertirlo en reedificar la \nfinca, en cuyo caso revivirá el censo con todos sus efectos, incluso / incluido / \nhasta el pago de las pensiones no satisfechas \n(Código Civil 1889)\nLa función de incluso como marcador de concesividad en estructuras condicionales \nestá relacionada con su función como partícula de foco escalar. Flamenco García (1999: \n3810) describe estas estructuras como concesivo-condicionales escalares, las cuales se ca-\nracterizan por combinar las propiedades concesivas con características condicionales. \nApunta que lo característico de una relación concesiva no es tanto una estructura sintác-\ntica particular, sino más bien la existencia de una información implícita que contradice \nel contenido proposicional expresado en cada uno de los miembros de que consta. Las \nconstrucciones concesivo-condicionales escalares comparten con las concesivas el con -\ntraste que se establece entre sus dos miembros y con las condicionales que en el conte -\nnido proposicional de la prótasis se hace referencia a situaciones de carácter hipotético.\nFlamenco García señala igualmente (1999: 3843) que dentro de la naturaleza escalar \nde piezas léxicas como incluso se inscribe la posibilidad de que se codifique una con -\ntraexpectativa. Esto influye de manera decisiva en la interpretación de construcciones \nencabezadas por incluso si, que es en suma el mismo tipo de contenido implícito transmi-\ntido por las expresiones concesivas y adversativas, esto es, el sentido de contradicción.  \nSi bien esta clase de estructura presenta apariciones esporádicas en etapas previas a \nla conclusión del cambio, generaliza su presencia en la segunda mitad del siglo xx, lo \ncual puede sugerir que, aunque esta función dependa de la función escalar de incluso, \nconserva una naturaleza más funcional o abstracta que la que tendría la función escalar \naisladamente. Por esta razón prolifera en la etapa final de su proceso de cambio, el cual \navanzó del plano léxico (participio) al plano funcional (partícula)9.\nIdentifico la etapa final del desarrollo histórico de incluso como el periodo más fun-\ncional, en el que K önig (1991) sitúa las partículas discursivas y, como he mostrado, in-\ncluso puede caracterizarse también como marcador discursivo o partícula discursiva. Esta \netiqueta engloba a las unidades lingüísticas que puedan presentar usos exclusi vamente \n9\u2009Sobre la direccionalidad del cambio, ver Bybee et al. (1994), Traugott (1995a), Hopper y Trau-\ngott (2003 [1993]) y Bybee (2004).\n176 Glenda zoé lizárraGa navarro\nLM II-2 \nLingüística Mexicana. Nueva Época, II (2020), núm. 2: 157-181  \nISSN: 2448-8194', 'que emplea Hopkinson, según el Collins Dictionary, es una colocación: minor matter. En \nla traducción dicha colocación aparece con una negación: así se mantiene el sentido de \nasunto grosso (“que supera lo ordinario por extensión, peso, volumen, masa” en Diziona-\nrio di italiano, La Repubblica) por medio de la antonimia, donde “el traductor selecciona \nun antónimo y lo combina con un elemento que lo niegue” (Chesterman 2016: 104), \nmientras que la segunda ocasión que Hopkinson traduce grosso opta por la estrategia de \nla sinonimia con major, palabra que en su significado ya incluye la intensificación que \nproduce el adverbio muy del texto fuente.  \nproBlEmas y solucionEs dE traducción\nEn este apartado mencionamos algunas unidades en las que consideramos que el traduc-\ntor pudo recurrir a otras soluciones en vez de traducir literalmente la unidad 5, porque \nno mantuvo la coherencia del texto, por cambio de género o por una falta de precisión. \nDichas decisiones, a nuestro parecer, tienen un peso importante en la comprensión del \ntexto en la lengua meta.\nEl primero es el ejemplo (12), el cual coincide con el único préstamo del español \nque encontramos en la traducción francesa: la unidad gaucho (Mirá que es un gaucho \nbruto → C’est un gaucho, une vraie brute!). Probablemente el traductor creyó que se \ntrataba de la forma de llamar a los argentinos en el exterior, aunque en realidad hace \nreferencia a\n(12) Gaucho (Diccionario de americanismos)\n1. adj. Arg. y Ur. Perteneciente o relativo a los gauchos. Un apero gaucho.\n2. adj. Arg. y Ur. Dicho de una persona: Noble, valiente y generosa.\n3. adj. Arg. Dicho de un animal o de una cosa: Que proporciona satisfacción por \nsu rendimiento.\n4. adj. Arg. p. us. Ducho en tretas, taimado.\nEl préstamo no sólo es poco transparente para el lector francófono, sino que puede \ncrear cierta confusión: la palabra gaucho en francés se refiere a gauchiste (izquierdista), \nunidad de la cual es abreviación:\n5\u2009La traducción literal ha sido una de las cuestiones más abordadas por los estudios de traducción. \nA partir de los aportes de Eugene Nida se pasó de un modelo de equivalentes entre dos lenguas a uno \nen donde importa más el sentido del texto meta y la relación de cercanía que guarda con el original. \nConsideramos que, si bien no existen relaciones unívocas de significado entre palabras de distintas \nlenguas, es necesario que en la traducción de esta novela se conserven rasgos tan marcados por el \nautor, como el nivel de registro y su uso en el sociolecto criminal.\n72 daniel casado gallegos y carlos yeudiel Puebla rodríguez\nLM IV-2 \nLingüística Mexicana. Nueva Época, IV (2022), núm. 2: 57-84  \nISSN: 2448-8194', 'Estudios de Lingüística Aplicada, año 43, número 81, julio de 2025, pp. 47–71\ndoi: 10.22201/enallt.01852647p.2025.81.1111\n[ 66 ] Esthela Ramírez Hernández\nción gss pasa de ser laxa a ser estricta y resulta en menos epéntesis \n(Cuadro 7).\ncuadRO 6. Jerarquización estocástica de restricciones basadas en la observación de etapas I y II\nOutput muy bajo Output bajo\nRestricción Jerarquización Restricción Jerarquización\ndep-iO\nmax-iO\ncOnT\n*cOmpleJ\nGss\n101 606\n100 000\n100 000\n98 394\n-3 571 256\ndep-iO\nmax-iO\ncOnT\n*cOmpleJ\nGss\ndm-3\n100 990\n100 000\n100 000\n99 010\n-24 696 890\n-54 673 342\ncuadRO 7. Jerarquización estocástica de restricciones basadas en la observación de etapas II y III\nOutput muy bajo Output bajo\nRestricción Jerarquización Restricción Jerarquización\ndep-iO\nmax-iO\ncOnT\n*cOmpleJ\nGss\ndm-3\n100 990\n100 000\n100 000\n99 010\n-24 696 890\n-54 673 342\ndep-iO\nmax-iO\ncOnT\n*cOmpleJ\nGss\ndm-3\n103 002\n100 000\n100 000\n96 998\n96 684\n-1 326 164\nCabe resaltar que max-io  y cont  nunca se quebrantan. Esto se \nobserva en que hay dos tipos de candidatos que nunca pueden ga-\nnar en la interlengua español-inglés. En primer lugar, aquellos que \nmuestran cualquier tipo de elisión (por ejemplo, star *[tar]). En \nsegundo lugar, los que presentan epéntesis que rompen la relación \nde contigüidad entre los dos segmentos en el inicio complejo (por \nejemplo, star *[setar]). Por ello, al correr el algoritmo de aprendi-\nzaje gradual, estas restricciones reciben el valor de 100, que es el \nvalor más estricto. Las Figuras 8, 9 y 10 son representaciones vi-\nsuales de los modelos gramaticales cuyos valores de restricciones \njerarquizadas representan intervalos en un continuo. Este continuo \nva de las restricciones más estrictas (inquebrantables), representa-\ndas en números positivos, a las más laxas, en números negativos.']","The text provided does not mention Natalia Ignatieva or her work in the field of linguistics. Therefore, I cannot provide information on the focus of Natalia Ignatieva's work based on the context given."
Who is Teresita Cabanillas and what is her role in the linguistic research field?,"['Natalia Ignatieva La meta final es apoyar la adquisición y el uso de español oral y escrito en las difíciles condiciones del desplazamiento del español por el inglés. El articulo “Exploración de las creencias maternas en tomo al proceso de adquisi\xad ción del lenguaje” de Cecilia Rojas, Rosa Ma. Ortiz, Elva Álvarez, Teresita Cabanillas, y Emma Cano es ñuto de un trabajo colectivo interinstitucional situado en el área de psicolingüística. El proceso de adquisición de la lengua materna, en este caso español, se examina desde el punto de vista de la interacción entre madre e hijo donde se explo\xad ran las creencias maternas relativas al papel del niño como emisor, destinatario e interlo\xad cutor en este proceso. La investigación, llevada a cabo en la cuidad de Hermosillo, Sonora, abre un nuevo ángulo en los estudios sobre la adquisición del lenguaje en México y seguramente causará interés en nuestro auditorio. Tokiyo Tanaka y Erika Ehnis en su artículo “Las preposiciones a, en, de y los estu\xad diantes japoneses al estudiar español: gramática contrastiva” hacen un intento de construir la gramática pedagógica sobre un punto lingüístico: las preposiciones españolas que pro\xad vocan dificultades para los aprendientes de español como L2, cuya lengua materna es el japonés. Las autoras han aplicado un& prueba a los estudiantes japoneses del CEPE para medir sus conocimientos acerca del uso de estas preposiciones y han analizado sus resul\xad tados. Es un estudio en el cual intervienen muchos factores: el análisis contrastivo, el análisis de errores, aspectos cognoscitivos. Al final se presentan las implicaciones y suge\xad rencias didácticas que puedan ser de utilidad para los maestros de español. Con el artículo de Leonardo Herrera “Planeación y seguimiento de un proyecto de investigación para abordar el impacto de los estudios sobre interacción en el salón de clase” seguimos con la tradición de la revista de dar a conocer a nuestros lectores las investigaciones del CELE. Leonardo Herrera, como miembro del Departamento de Lin\xad güística Aplicada, ha trabajado dentro de una de las líneas de investigación más repre\xad sentativas del CELE, a saber, “interacción en el salón de clase”. Sus reflexiones acerca de las contribuciones de lingüistas aplicados sobre el tema y las condiciones reales de enseñanza de lenguas extranjeras en el país nos dan pautas para la organización de un proyecto de investigación en esta área. Compartiendo su experiencia en el análisis del fenómeno de interacción dentro de la enseñanza de portugués como L2, el autor pro\xad mueve la aplicación de este tipo de estudios a otros idiomas, y en otras instituciones. Es un artículo recomendable sobre todo para los profesores de lenguas que quieren empe\xad zar a investigar la realidad del salón de clase (y no saben cómo). El último artículo “Terminología y representación de los conocimientos: análisis y generación automáticos de los términos derivados y compuestos de la terminología de la informática” de Albert Álvarez nos remite al campo de terminología, mismo que está en constante desarrollo, de acuerdo con los requerimientos de nuestros tiempos en los que la aparición de nuevos términos es un fenómeno cotidiano sujeto a muchas polémicas. En su trabajo el autor propone un sistema de análisis y generación por computadora de una clase de términos, es decir, palabras compuestas y derivadas, basado en el método elaborado por el Laboratorio de Ingeniería Lingüística y de Lingüística Aplicada de la Universidad de Niza-Sophia Antipolis (Francia). El trabajo de Albert Álvarez es un']","Teresita Cabanillas is part of a collective interinstitutional work in the area of psycholinguistics. The research focuses on examining maternal beliefs regarding the language acquisition process, specifically in the interaction between mother and child. This study, conducted in Hermosillo, Sonora, offers a new perspective on language acquisition studies in Mexico.",single_hop_specifc_query_synthesizer,"['Estudios de Lingüística Aplicada, año 43, número 81, julio de 2025, pp. 7–46\ndoi: 10.22201/enallt.01852647p.2025.81.1109\nCognitive individual differences in learning Spanish L2/FL emblematic gestures [ 11 ]\nin L2/FL Spanish? 3) What specifi  c learning styles are related to \nthe learning of emblematic gestures in L2/FL Spanish?\n2. Literature review\n2.1.  Emblematic gestures in SLa\nEmblems are highly symbolic gestures within a community whose \nmeanings have different degrees of clarity for other speakers de-\npending on their form, meaning, and resemblance to the emblem-\natic gestures in their cultural code (Ekman & Friesen, 1969; Mc-\nNeill, 1992; Gullberg, 1998; Cienki, 2008; Teßendorf, 2013; Poy-\natos, 2017; Payrató & Clemente, 2020). For L2/FL classrooms and \nstudies on sla, emblems can be classifi  ed based on the degree of \nsimilarity with those in the learners’ culture of origin. Emblems \ncan be classifi  ed into three major categories: 1) common: gestures \nwith the same form and meaning in both cultures; 2) different: \ngestures that have a different form but share the same or very sim-\nilar meaning; and 3) unique: gestures with no formal or seman-\ntic equivalent in the other culture (Belío-Apaolaza & Hernández \nMuñoz, 2024). It is reasonable to assume that the latter two catego-\nries can lead to miscommunication and cultural misunderstandings \nwhen interacting in the target language.\nDespite the role of gestures in (mis)communication, research \non this discipline in sla is scarce.1 Indeed, only two empirical stud-\nies about the learning process of emblems are available.2 In the fi  rst \n1 There is, however, a substantial body of work addressing the role of other types \nof gestures in L2/FL learning and communication, especially on co-speech \ngestures. Refer the studies by Gullberg (1998) on communication strategies; \nMcCafferty (2002) on word retrieval; Gullberg (2008) on grammar learning; \nKelly, McDevitt and Esch (2009) on word learning; Macedonia and von Kriegs-\ntein (2012) on verbal memory; Hoetjes and van Maastricht (2020) on phoneme \nacquisition; and Stam (2018) on a literature review on this fi  eld.\n2 There are two additional types of research on emblematic gestures, but with no \nlearning process involved: studies that attempted to create a valid instrument to', 'Estudios de Lingüística Aplicada, año 41, número 76, enero de 2023, pp. 7–36\ndoi: 10.22201/enallt.01852647p.2023.76.1030\n[ 26 ] José Manuel Solís Navarro & Édgar Oswaldo González Bello\nLos modelos permiten comprender características que distin-\nguen a los profesores en cuanto a su percepción sobre el dominio \ndel inglés. El Modelo 1, con el mayor porcentaje de varianza ex-\nplicativa (R2 = 19), destaca que pertenecer a las áreas stem y haber \nestudiado un posgrado en el extranjero son factores que infl  uyen \npositivamente en el dominio del inglés. El Modelo 2 (R2 = .16) re-\nsultó signifi  cativo para el caso de aquellos que señalan haber reci-\nbido una educación bilingüe, haber estudiado inglés en una escuela \nde idiomas, vivir en el extranjero y/o aprender por iniciativa propia \n(Cuadro 5). Como puede observarse, los escenarios de aprendizaje \nque mayormente han contribuido a la noción de dominio son en \nsu mayoría informales, esto puede estar relacionado a los aspectos \nafectivos, en los cuales el sujeto adquiere el idioma de forma natu-\nral y no bajo una presión institucional o bajo la forma tradicional \nde enseñanza.\nCuadro 5. Análisis de regresión para las variables predictoras de la percepción sobre el dominio del inglés\nModelos B SE B β t p\nModelo 1\n1. Sexo .20 .09 .07 2.18 .029\n2. Edad -.00 .00 .01 .23 .817\n3. Antigüedad -.00 .00 -.04 -.93 .353\n4. Tipo de contrato .08 .11 .03 .78 .435\n5. Tiempo del contrato -.23 .11 -.07 -1.98 .048\n6. Pertenencia al SNI .22 .12 .07 1.84 .066\n7. Contar con doctorado -.04 .13 -.01 -.33 .739\n8. Áreas STEM .31 .09 .11 3.38 .001\n9. Estudiar posgrado en el extranjero .11 .02 .24 5.06 .000\nModelo 2\n1. Recibir educación bilingüe .66 .11 .18 5.08 .000\n2. Estudiar licenciatura -.03 .12 -.00 -.28 .776\n3. Estudiar un posgrado -.01 .09 -.00 -.16 .867', 'Comportamiento soCiolingüístiCoy disCursivo de ey en el habla de guadalajara\nComo puede apreciarse en la figura 1, las tres variables sociales de preseea en las \ntres ciudades arroja que los hombres dicen más ey que las mujeres (47 hombres frente a \n37 mujeres), que los 48 hablantes de nivel educativo bajo que lo usan duplican en núme-\nro a los 22 de nivel medio y triplican a los 14 de nivel alto, y que no existen diferencias \ngeneracionales: los hablantes de 20 a 34 años que lo emplean son 28, los hablantes de \n35 a 54 años son 29, y los hablantes de 55 años en adelante son 27. \nFigura 1. Representatividad por variable respecto del total de hablantes a nivel nacional.\nEl análisis general de las 595 frecuencias totales de ey en las tres localidades com -\nprueba las tendencias respecto del sexo y el nivel educativo, esto es, que las ocurrencias \ndichas por los hombres, (322), superan a las de las mujeres, (273), y que el grueso de \néstas, (461), es emitido por hablantes de nivel bajo. En este caso, la variable edad ma-\nnifiesta con claridad una pauta: 277 ocurrencias se concentran en la generación mayor \nde 55 años (véanse la tabla 2 y la figura 2).\nFigura 2. Frecuencia Relativa (hi) del total de ocurrencias de ey a nivel nacional.\nRepresentatividad por variable respecto al total de hablantes a nivel nacional\nTotal de hablantes en las tres comunidades de estudio: 84 (≈100%)\nFrecuencia Relativa (hi) del total de ocurrencias de “ey” a nivel nacional\nTotal de ocurrencias las tres comunidades de estudio: 595 (≈100%)\n49\nLM V-1\nLingüística Mexicana. Nueva Época, v (2023), núm. 1: 41-64\nISSN: 2448-8194']","I'm sorry, but there is no mention of Teresita Cabanillas in the provided context. If you have any other questions or need information on a different topic related to linguistics, feel free to ask!"
What is the perspective of Feynman on the definition of addition?,"['Fernando Castaños Por otro lado, para Widdowson definir se opone a nombrar y para Selinker et al. definir incluye nombrar. Esto parece una contradicción, peio lo que sucede es que los autores están considerando diferentes tipos de definición, o mejor dicho, están usando el término definición para referirse a distintos actos (que tienen algo en común). Ni lo que dice Widdowson, ni lo que dicen Selinker, Todd y Trimble, es cierto de todo aquello que comunmente se llama “definición”. Tomemos, por ejemplo, el siguiente párrafo, cuyo autor identifica como definición: DEFINITION 1.5. Two matrices [A] and [B] can be multiplied together in the order [AB] if and only if the number of colums in the first equals the number of rows in the se- cond. The matrices are then said to be conformable for the product [AB]. Noble (1969: 5) En este caso, el término definido por Noble, “conformable for the product [AB]”, ocupa el lugar que típicamente corresponde, en una oración en inglés, a la información nueva. 5 Aplicando un criterio más claro, la palabra then tiene una relación anafórica en relación con la oración anterior y, por ende, corresponde a la información dada. Más aún, en la segunda oración, la que contiene el término definido, tenemos el verbo said que según el mismo Widdowson, sería señal de una identificación, y no de una definición. Si aceptamos que el término definido no necesariamente ocupa la posición de “dado”, el siguiente es un contraejemplo de la caracterización de Selinker et al.: If we start with a certain number a, an integer, and we count successively one unit b ti- mes, the number we arrive at we call a + b, and that defines addition of integers. Feynman (1966: 22-1) En este caso es difícil identificar la clase a la cual pertenece el concepto “adi\xad ción”, y más difícil identificar las características que lo distinguen de otros con\xad ceptos que pertenezcan a la misma clase. Es decir, no expresa información de los tipos que Selinker et al. enumeran como (2) y (3). Podría pensarse que la falta de información que clasifique y distinga a la adi\xad ción no muestra una falla en el esquema de Selinker et al., sino que simplemente indica que la definición de Feynman no es una definición formal. El problema de este punto de vista es que entonces tampoco podríamos decir que la definición no es formal. En las definiciones que no son formales, la información clasificatoria no está expresada de manera tan abierta como en las definiciones formales, y podría argüirse, con mucha buena voluntad, que la idea de que la adición es una operación está de algún modo implícita en el párrafo de Feynman et al. Sin em\xad bargo, al menos en los esquemas de Tódd y Trimble, 6 todas las definiciones con\xad 5 Según Halliday (1970), la información dada comúnmente ocurre al principio de la oración inglesa y la información nueva al final. 6 En Todd and Trimble (1979), encontramos un desarrollo de la distinción entre definición formal y definición informal. Este desarrollo, que he sintetizado en el texto de este artículo, preserva el espíritu original de la caracterización que encontramos en Selinker, Todd, and Trimble (1976).']","In the case presented by Feynman, it is challenging to identify the class to which the concept of addition belongs and even more difficult to distinguish its characteristics from other concepts in the same class. This lack of information that classifies and distinguishes addition does not fit the criteria outlined by Selinker et al. for formal definitions. It could be argued that Feynman's definition of addition, while not explicitly formal, may still implicitly suggest that addition is an operation. However, according to Todd and Trimble, all definitions should clearly express classificatory information, which is not overtly present in Feynman's definition.",single_hop_specifc_query_synthesizer,"['embargo, desde la fn resalta la importancia que hay en la disminución de marcadores. \nA partir del uso de esta prueba, se puede observar que el número de palabras de cada \ncorpus no condiciona el número de marcadores encontrados en la muestra, por lo que \nla fn es prueba definitiva para el reconocimiento sobre la cantidad de los marcadores \ndiscursivos de una generación a otra.\nTabla 4. Frecuencia normalizada de los marcadores discursivos por generación\nGeneración Marcadores discursivos Palabras totales Frecuencia normalizada (fn)\nGeneración 2013 594 36 389 16.32\nGeneración 2015 524 36 211 14.47\nTotal 1 118 72 600 15.39\nEn la fn de la generación de 2013, se usaron 16 marcadores discursivos por cada mil \npalabras, mientras que en la generación de 2015 se redujeron a 14 marcadores discursi -\nvos por cada mil palabras. Esta diferencia repercute en los resultados globales del corpus, \ndonde se obtiene que, en general, los estudiantes de ambas generaciones usan aproxima -\ndamente 15 marcadores discursivos por cada mil palabras. Con el fin de responder la pre-\ngunta acerca de qué tipo de marcadores son más frecuentes en la elaboración de las tesis, \na continuación, se presenta la tabla 5, en que se agrupan los tipos de marcadores y las ocu-\nrrencias registradas a la par del porcentaje en relación con el número total de marcadores. \nTabla 5. Tipos de marcadores discursivos más frecuentes \nCategoría Ocurrencias\nConector contraargumentativo 260 (23.25%)\nConector aditivo 259 (23.16%)\nConector consecutivo 179 (16.01%)\nConector causal 159 (14.22%)\nEstructuradores de la información 135 (12.07%)\nOperadores argumentativos 70 (6.26%)\nReformuladores 42 (3.75%)\nConector metatextual 7 (0.62%)\nMarcadores conversacionales 5 (0.44%)\nConector condicional 2 (0.17%)\nNótese cómo los conectores del tipo contraargumentativo, aditivo y consecutivo \nson los de mayor uso en ambas secciones de la tesis, con 23.25%, 23.16% y 16.01%, \nrespectivamente. Por el contrario, los conectores metatextuales, conversacionales y \ncondicionales se encuentran en la parte baja de la tabla, con menos del 1%. Estos \n128 JuLia ceciLia montes toRRes y maRco antonio PéReZ duRÁn\nLM IV-1\nLingüística Mexicana. Nueva Época, IV (2022), núm. 1: 121-134  \nISSN: 2448-8194', 'patán 2\nrevoltoso 2\nsirviente 2\nanalfabeta 1\nandrajoso 1\nautóctono 1\nbajo 1\nbarrio 1\nbarriobajero 1\nborrego 1\ncampesino 1\ncatrín 1\nchilango 1\nconsciente 1\ncreído 1\ndesadaptado 1\ndesalineado 1\ndetestable 1\ndoméstico 1\nempleado 1\nesclavo 1\nestúpido 1\ngruetzo 1\nidiota 1\nindeciso 1\nizquierdista 1\njodido 1\nlépero 1\nmamón 1\nmarginado 1\nmexicano 1\nmicrobusero 1\nmozo 1\nnecesitado 1\nneófito 1\nñero 1\npatarrajada 1\npeón 1\npobre 1\npopulachero 1\nproletario 1\nprotestante 1\nprovinciano 1\npunk 1\nranchero 1\nrebelde 1\nreguetonero 1\nretrasado 1\nrojillo 1\nsalvadoreño 1\nsencillo 1\nsoñado 1\ntepiteño 1\ntraicionero 1\nzafio 1\nLéxico compartido\nLa distribución del léxico es peculiar en la muestra analizada. Si bien es complicado \nacceder al léxico pasivo, las 27 definiciones obligaron a los informantes a recurrir a va-\nriantes distintas sobre el eje temático explorado. El análisis de la distribución del léxico \npor grupos de edad permite proponer algunos vocablos como neologismos e innovacio-\nnes (en el grupo joven) y detectar posibles obsolescencias (cuando ciertos vocablos sólo \naparecen el en grupo de mayor edad).\nInnovaciones. Aunque es esperable que los diecinueve vocablos utilizados solo por los \njóvenes deben ser conocidos por las otras dos generaciones, dos son las unidades léxi-\ncas que sobresalen, y que podrían estar más afianzadas en el léxico de los jóvenes. La \nprimera se trata de un neologismo, no sólo como disfemismo, sino como forma, ya que \nlos mayores no lo enunciaron, se trata de godín, que surge del apellido Godínez. Este \napellido es originalmente monomorfémico, pero en esta comunidad de habla ha sufrido \n80\nDinorah Beatriz Montiel Pérez y Julio César serrano LM V-1 \nLingüística Mexicana. Nueva Época, v (2023), núm. 1: 65-95  \nISSN: 2448-8194', 'Rodríguez, Darinka. 2023. “Facebook, la ‘app’ donde los mexicanos más gastan sus \ndatos móviles”, El País. Disponible en https://elpais.com/mexico/2023-07-29/face-\nbook-la-app-donde-los-mexicanos-mas-gastan-sus-datos-moviles.html\nStatista. 2024. “Redes sociales con el mayor porcentaje de usuarios en México en \n2023”. Statista. Disponible en https://es.statista.com/estadisticas/1035031/mexi-\nco-porcentaje-de-usuarios-por-red-social/\nVan Dijk, Teun A. 1985. Discurso y contexto. Barcelona: Gedisa.\nVarela-Ortega, Soledad. 2005. Morfología léxica: la formación de palabras. Madrid: \nGredos.\n109\nLM VI-2\nLingüística Mexicana. Nueva Época, vi (2024), núm. 2\nISSN: 2448-8194La lengua no necesita cambios']","I'm sorry, but there is no mention of Feynman or his perspective on the definition of addition in the provided text. If you have any other questions related to linguistics or the content provided, feel free to ask!"
How does Fernando Castaños emphasize the importance of certain points in scientific texts?,"[""Fernando Castaños Sin embargo, en un contexto dado y para ciertos lectores a) puede ser más fácil de procesar que b). En otros casos podría suceder lo opuesto.10 Si el autor de un texto es capaz de percibir cuáles formulaciones serán más fáci\xad les de procesar para sus lectores potenciales, tomará esto en cuenta al escribir su versión final. Incluso es claro que hay muchas oraciones cuya función principal es la facilitación del procesamiento de la información; por ejemplo, en el libro de Klein, después del subtítulo D. Fermat's Principle, encontramos: This principle is a close analogue of the action principle in classical mechanics. Klein (1970: 31). El autor supone que el lector ya está familiarizado con el principio de acción y que, por lo tanto, la analogía le permitirá comprender más fácilmente el principio de Fermat. Es claro que esta oración no contribuye en nada a probar el argumen\xad to que presenta el autor, sólo ayuda a su recepción. Al tratar de identificar las funciones que están cumpliendo los actos retóricos en un texto científico, salta a la vista que el autor no sólo está probando asevera\xad ciones y controlando (en cierta medida) el procesamiento de la información por el lector, sino que también está indicando la importancia de ciertos puntos. A veces, incluso, justifica explícitamente la preferencia por ciertos tratamientos. Es decir, además de argumentar y facilitar, el autor valúa. La valoración se da principal\xad mente con respecto a la utilidad y a la belleza que tienen los temas tratados. La utilidad de un trabajo científico es juzgada por la sociedad en última instan\xad cia con referencia a los beneficios prácticos que pueda generar. 11 Pero para el científico mismo, la utilidad muchas veces se mide más directamente en términos de la teoría misma. Si una nueva formulación permite el tratamiento de proble\xad mas antes inaccesibles, es útil. Además, muchos científicos hacen ciencia princi\xad palmente porque les gusta. Muchas veces (particularmente en matemáticas) una innovación consiste simplemente en un cambio que hace la teoría más atractiva, desde un punto de vista estético. A continuación tenemos dos trozos de discurso. En un caso se dice por qué han adquirido importancia los métodos numéricos (importancia anteriormente menor si se la compara con la de métodos analíticos) en la solución de ciertos problemas. En el otro caso, el autor resalta la belleza de una ecuación que es capaz de resumir una serie de relaciones que ha considerado a lo largo de todo un capítulo: 10 Evidentemente, es necesario hacer estudios empíricos sobre la legibilidad de distintos tipos de dis- curso (distintos patrones de organización de los actos retóricos) para poblaciones dadas. 11 El caso de Gabor es muy ilustrativo. El produjo toda una teoría sobre los hologramas antes de que existieran hologramas, de hecho antes de que existiera siquiera el Láser. Empezaba su trabajo pregun- tándose qué se podría hacer con un rayo de luz coherente, si existiera. Terminaba diciendo que desa- fortunadamente tal rayo no existía. Cuando se inventó el Láser, los científicos se pusieron a averiguar si la fotografía tridimensional imaginada por Gabor era posible. Cuando ésta se empezó a aplicar en ingeniería aeronáutica y en sistemas de seguridad, Gabor fue condecorado con el premio Nobel. Antes de ello, su trabajo sólo era una bella pieza de argumentación físico-matemática, de interés para unos cuantos.""]","Fernando Castaños indicates the importance of certain points in scientific texts by not only proving assertions and controlling information processing by the reader but also by explicitly justifying the preference for certain treatments. He evaluates the utility and beauty of the topics discussed, with utility being judged by society based on practical benefits and by scientists themselves in terms of theory advancement. Additionally, scientific innovations are sometimes driven by the aesthetic appeal of making theories more attractive, particularly in fields like mathematics.",single_hop_specifc_query_synthesizer,"['Estudios de Lingüística Aplicada, año 43, número 80, enero de 2025, pp. 7–48\ndoi:10.22201/enallt.01852647p.2025.80.1097\nSistema judicial y lengua vasca en España: una glotofobia persistente [ 27 ]\nlocutores de ese territorio ciertos derechos en materia lingüística \ny garantiza la defensa de la lengua vasca.\nSobre estas bases, el título preliminar de la Ley reconoce el \neuskera como lengua propia de la cav y en conjunto con el caste-\nllano como las lenguas coofi  ciales del territorio, además de pro-\nhibir cualquier discriminación por motivos lingüísticos. El primer \ntítulo aborda los derechos de los ciudadanos y las obligaciones de \nlas administraciones públicas en materia lingüística, mientras que \nel segundo título regula la acción de los poderes públicos.\nSu primer capítulo se refi  ere al uso del euskera por la admi-\nnistración pública, reconociendo el derecho al uso ciudadano de \nlas dos lenguas coofi  ciales del territorio en sus relaciones con la \nadministración autonómica. Asimismo:\nSe regula también la inscripción de documentos en los registros \npúblicos, se establece la forma bilingüe para la publicación de \nlas disposiciones normativas, resoluciones o actos de la admi-\nnistración, así como de las notifi  caciones y comunicaciones. \nSe faculta a todo ciudadano para utilizar la lengua ofi  cial de \nsu elección en las relaciones con la Administración de Justicia. \n[…] Se prevé la progresiva euskaldunización del personal [de] \nla administración pública (boe, 1982: 4).\nEn la Comunidad Foral de Navarra, la Ley Foral 18/1986, de 15 de \ndiciembre, del Vascuence, desarrolla el artículo 9 de la Ley de Re-\nintegración y Amejoramiento del Régimen Foral de Navarra. En su \npreámbulo, precisa: “aquellas Comunidades que, como Navarra, se \nhonran de disponer en su patrimonio de más de una lengua, están \nobligadas a preservar ese tesoro y evitar su deterioro o su pérdida” \n(boe, 1987). De igual forma:\n• En el título preliminar, el artículo 1 establece que:\n1) esta Ley Foral tiene por objeto la regulación del uso nor-\nmal y ofi  cial del euskera en los ámbitos de la convivencia', 'Lingüística Mexicana. Nueva Época, v (2023), núm. 1: 147-150\nISSN: 2448-8194\nConcepción Company Company.\xa0 El español en América: de lengua \nde conquista a lengua patrimonial. El Colegio Nacional, México, \n2021; 85 pp.\nEnrique Meléndez Zarco\nUniversidad Nacional Autónoma de México\nzarcounam@gmail.com\nd \nesde hace más de cuatro décadas, Concepción Company Company, investigadora \nemérita de la unam, se ha encargado de analizar rigurosamente la trayectoria dia-\ncrónica del español en obras hoy clásicas en el campo de la filología y la lingüística, \nentre las que destacan los varios volúmenes de la Sintaxis histórica de la lengua española \n(2006-2014), los Documentos lingüísticos de la Nueva España  (1994) y el Léxico histórico \ndel español de México (2002). Ahora la investigadora mexicana nos acerca a la presencia \nindeleble del español en el continente americano, sede de una gran vastedad y diversi-\ndad geográfica, dialectal y cultural.\nEl libro que examinamos,  El español en América: de lengua de conquista a lengua pa -\ntrimonial, publicado por el Colegio Nacional, consta de 85 páginas, distribuidas en un \ncapítulo introductorio, al que le siguen seis capítulos y un apartado de conclusiones. En \nél se pone de manifiesto el paulatino proceso histórico del español, que pasó de ser una \nlengua de conquista al patrimonio de casi 500 millones de hispanohablantes nacidos en \nAmérica. El objetivo de esta obra es justamente dar cuenta de los testimonios lingüís-\nticos que respaldan las fases de conquista y patrimonialización del español americano, \nasí como de los cambios conceptuales generados. En principio, esta obra nos sitúa en \nun acontecer histórico que le asigna un estatus propio al español y que lo distingue de \ncualquier otro: el arribo de Colón y de sus hombres a las Antillas, en el mar Caribe. Tal \nevento, según la autora, permite establecer una precisión muy fina de datación diacró-\nnica del español o bien del momento exacto de su llegada a tierras americanas.\nPara Company, dicho contacto inicial dio cabida a un proceso muy complejo, gradual \ny no lineal mediante el cual se gestaron las muchas identidades lingüísticas del español \nen América; en él entran en juego tres variables principales: a) contactos múltiples y', 'Tabla 6. Índice de disponibilidad por tipo de institución\nEdad\nTabla 7. Total y promedio de palabras por grupo de edad\nEn la tabla 8 se observa el índice de disponibilidad de cada grupo de edad. La prime-\nra palabra en aparecer en el grupo de 15 a 16 años es gay, con un índice de 0.24714968 \ny un total de 10 ocurrencias en la muestra. \nNuestro interés en este apartado ha sido verificar la hipótesis que sugiere que el \nlexicón de los hablantes crece en correspondencia con su rango de edad. En la grá -\nfica 1 podemos ver que el número de palabras evocadas por hombres de institución \npública es de 81 en ambos grupos de edad, lo que muestra que en este estrato no hay \ndiferencia en cuanto a esta variable. En cambio, para la institución privada podemos \nobservar un incremento: los alumnos de 15-16 años emitieron 42 palabras, mientras \nque los de 17-18 años registraron un total de 96. En cuanto al sexo femenino de \ninstitución pública, se presenta una disminución de una unidad, rasgo no represen -\nInstitución pública Institución privada\nPalabra idl Palabra idl\n1 gay 0.28270114 amor 0.36691616\n2 amor 0.26887113 lesbianas 0.1603786\n3 homosexual 0.17045594 gay 0.15923506\n4 lesbiana 0.16527261 igualdad 0.14888955\n5 joto 0.12166862 asco 0.14481304\n6 felicidad 0.12166133 respeto 0.13815132\n7 discriminación 0.12029 gays 0.10852902\n8 igualdad 0.11887211 sexo 0.10835117\n9 libertad 0.09733354 amistad 0.10822576\n10 respeto 0.0936326 raro 0.09541517\nEdad Palabras Promedio\n15-16 años 270 6.75\n17-18 años 373 9.3\n40\nJorge Lázaro y MicheLLe rubino LM II-2 \nLingüística Mexicana. Nueva Época, II (2020), núm. 2: 29-48  \nISSN: 2448-8194']","I'm sorry, but there is no mention of Fernando Castaños or his emphasis techniques in the provided context. If you have any other questions or need information on a different topic, feel free to ask!"
What is the significance of Berlin in the context of language evolution?,"['Fernando Castaños tor se define en términos de un concepto no definido en el texto, el de co\xad ordenadas cartesianas. El primer punto significa que los autores no resaltan la importancia del concep\xad to, aunque la tiene. El segundo punto significa que los autores aceptan como váli\xad dos los resultados de la teoría estándar sobre las coordenadas cartesianas. Lo ha\xad cen suyos y parten de ellos sin plantearlos explícitamente. En la oración (6) los autores aceleran aún más el desarrollo de la argumenta\xad ción, aunque presentan definiciones explícitas. Encontramos otra vez dos defini\xad ciones, pero en este caso de dos términos distintos, velocity y acceleration, no del mismo término como en la oración (5). Además en la segunda definición se ha hecho elipsis de una parte que sí está en la primera, “of L ſ J with respect to time t”, y en lugar de “is called”, se usa simplemente “is”. Tenemos en los dos párrafos que hemos considerado definiciones de cuatro tér\xad minos: particle, radius vector, velocity y acceleration. En el primer párrafo está la definición del primer término y en el segundo las definiciones de los otros tres. A cada definición le van dedicando los autores menos espacio, acelerando así el de\xad sarrollo de la argumentación. Parecería que los autores se preocuparan inicial\xad mente para que los lectores pusieran su mente a trabajar en cierta dirección y des\xad pués fueran olvidando esta preocupación para concentrarse en la pura argumen\xad tación. Veamos ahora cuáles de las características del acto de definir que discutimos an\xad teriormente se enfocan en las definiciones de Landau y Lifshitz. Al definir par\xad tícula, los autores enfocan todas las características. Indican que a partir de ese momento el término particle, que está en cursivas, tendrá cierto significado y que éste es en última instancia arbitrario: “By this we mean [...]”. Los autores presen\xad tan también las características distintivas de las partículas: sus dimensiones son despreciables (en comparación con las otras magnitudes que intervienen en la descripción de su movimiento); esto se marca muy claramente con el pronombre whose(cuyas). La definición, además, clasifica las partículas como cuerpos (“...a body [...]”). Finalmente, en la oración (3) queda claro que partícula es un tipo y que diferentes objetos podrán ser considerados como muestras de él bajo ciertas circunstancias. La definición de radio vector no tiene todas las características, y de las que si tiene, no todas se enfocan. Por un lado, no se presentan características distintivas y, por otro, no se pone ningún énfasis en el hecho de que se considera por primera vez el término radio vector con un significado especial. Que Lr,, es un vector, queda claro en su nombre: radius vector; la clasificación se enfatiza al decir que tiene coordenadas, como todos los vectores. Que radio vector es un tipo, se re\xad salta al decir que cada partícula tiene su (its) radio vector. La arbitrariedad se refleja, aunque no de manera prominente, en la selección combinada del lexema define, que tiene un carácter definitivo, del tiempo presente y de la voz pasiva (“is defined”): las cosas son así, y ya. En la definición de velocidad vuelve a aparecer la primera característica. Con']","Berlin is not directly mentioned in the provided context, which focuses on the definitions of various terms related to physics. Therefore, there is no information available to discuss the significance of Berlin in the evolution of languages.",single_hop_specifc_query_synthesizer,"['Estudios de Lingüística Aplicada, año 43, número 80, enero de 2025, pp. 7–48\ndoi:10.22201/enallt.01852647p.2025.80.1097\n[ 12 ] Eguzki Urteaga\nro. De la misma manera, “La confi  rmation du caractère illégal du \ntraitement différencié à prétexte linguistique a permis d’identi-\nfi  er l’existence de droits linguistiques affi  rmés par la plupart des \ngrands textes de protection des droits humains, des libertés fonda-\nmentales et d’interdiction des discriminations, droits souvent mé-\nconnus, corrélés aux droits culturels”7 (Blanchet, 2021: 156–157). \nEl análisis de las actitudes y comportamientos glotofóbicos en las \nsociedades contemporáneas permite evidenciar su dimensión fun-\ndamentalmente sociopolítica. Esto implica desarrollar una perspec-\ntiva multidisciplinar que asocie las contribuciones de la sociología, \nla ciencia política, las ciencias jurídicas y la historia.\nLo cierto es que el concepto de glotofobia ha conocido una \nfuerte difusión, a la vez científi  ca y social, a raíz de la publicación \nde la obra Discriminations: combattre la glottophobie (Blanchet, \n2021), especialmente en los países francófonos, como pueden ser \nFrancia, Bélgica o Canadá. En los países de tradición anglosajona, \neste concepto ha sido apropiado por los estudios poscoloniales y \nsubalternos (Bancel, 2022), como contribución a la comprensión \nde las discriminaciones en una óptica interseccional (Bilge & Hill \nCollins, 2016). En ese sentido, contribuye al cuestionamiento de \ncualquier forma de jerarquía establecida entre varias lenguas o va-\nriedades de una misma lengua de manera arbitraria y apoyándose \nen una ideología lingüística, a menudo en benefi  cio de grupos do-\nminantes (Blanchet, 2021: 158).\nPor lo tanto, a partir de un enfoque teórico basado en el con-\ncepto de glotofobia, este artículo compaginará una perspectiva \nmultidisciplinar incorporando las aportaciones de la sociología his-\ntórica (Baechler, 2001), para dar cuenta de la socio-génesis (Heil-\nbron, 2018) de la glotofobia prevalente en la judicatura española \n7 “[L]a confi  rmación del carácter ilegal del trato diferenciado bajo un pretexto \nlingüístico ha permitido identifi  car la existencia de derechos lingüísticos afi  r-\nmada por la mayoría de los textos que protegen los derechos humanos, las li-\nbertades fundamentales y prohíben las discriminaciones, derechos a menudo \ndesconocidos, vinculados a los derechos culturales.”', 'Del tratamiento de falsos amigos en un diccionario electrónico de dudas 11\nEstudios de Lingüística Aplicada, año 30, número 56, diciembre de 2012, pp. 9-33\nintroDucción\nEn este artículo, las autoras quieren aportar unas consideraciones acerca de la \ninformación pertinente en las entradas de un diccionario electrónico de dudas \n(DeD) alemán/español para hispanohablantes.1 El estudio se centra en la inclusión \nde falsos amigos y pretende demostrar que estos, sin duda, constituyen un ámbito \npertinente para una obra de estas características dado que tal y como afirma Doval \n(2006: 466): “Los falsos amigos presentan un problema muy importante y muy \nfrecuente tanto en la traducción como en la didáctica de la lengua extranjera al \nque el diccionario bilingüe presta apenas atención”.\n2\nSi esto es así, un diccionario en soporte electrónico podría cambiar esta \nrealidad. Su elaboración depende de múltiples factores, aunque consideramos \nque tres son los puntos clave: los criterios de usabilidad3 del diccionario, el perfil \nde sus usuarios y los fines perseguidos con dicha herramienta. Teniendo en cuen-\nta los criterios de usabilidad, el diccionario en soporte digital —como veremos \nmás adelante— se presta de manera formidable a entradas de tipo falso amigo, ya \nque esta herramienta permite una organización de la interfaz sencilla, dispone de \nuna flexibilidad en cuanto al espacio, ofrece la posibilidad de disponer de manera \nlógica los distintos elementos como colores de hipervínculos, estados de los dis-\ntintos botones, entre otras consideraciones. Además, por analogía con convencio-\nnes cul turales y estándares establecidos es fácil para el usuario reconocer las \netiquetas y símbolos utilizados (Cf. Torres, 2009: 16). Todos estos recursos ayu-\ndarán sobremanera a facilitar la comprensión del fenómeno falso amigo, que en \nmuchas ocasiones puede convertirse incluso en un verdadero enemigo peligroso.  \n \n1 Por razones de espacio, las autoras se han visto obligadas a dejar de lado la problemática de la \nvariación dialectal de los latinismos en el español. Sin duda se trata de un problema complejo que \nmerecería su debida atención. En el análisis de los casos del presente artículo se ha observado in-\nformación a tal respecto que no siempre coincidía. Por ejemplo, en cuanto a “competencia” (caso 3)  \nobservamos su sinónimo “competición (deportiva)” registrado en los tres diccionarios menciona-\ndos, marcado como “americanismo” (drae, clave) y uso en “zonas del español meridional”.\n2 La traducción de las citas en alemán e inglés es nuestra.\n3 Usamos este término en el sentido de, por ejemplo, Wiegand & Fuentes, 2010: 232 y Azorín Fernández \n& Santamaría Pérez (2011).\nELA 56 interiores.indd   11 15/01/14   20:25', 'Estudios de Lingüística Aplicada, año 43, número 80, enero de 2025, pp. 7–48\ndoi:10.22201/enallt.01852647p.2025.80.1097\nSistema judicial y lengua vasca en España: una glotofobia persistente [ 11 ]\nLa noción de glotofobia se inspira en las palabras xenofobia, \nhomofobia o judeofobia para situar la refl  exión sociolingüística en \nun paradigma sociopolítico que hace referencia al rechazo de los \nlocutores y no solamente de las lenguas o de las variedades lin-\ngüísticas. “L’élaboration du concept de glottophobie s’inscrit dans \nla continuité de la conceptualisation, en sociolinguistique, de la \ndiglossie, de la minoration ou satellisation sociolinguistiques, de \nl’auto-odi ou haine de soi, de l’insécurité linguistique”5 (Blanchet, \n2021: 156). Se refi  ere a los primeros trabajos de William Labov \n(1976) que critican las interpretaciones propuestas por Basil Berns-\ntein (1975) a propósito de las prácticas lingüísticas de los jóvenes \nprovenientes de las clases populares. Más allá, esta elaboración \nconcibe la lengua como un medio y un objeto de poder, inscrita en \nrelaciones de poder e inmersa en procesos de colonización, domi-\nnación y hegemonía. Esta orientación teórica ha sido desarrolla-\nda inicialmente por los sociolingüistas Jean-Baptiste Marcellesi \n(1974), Robert Lafont (1997) y Louis-Jean Calvet (1974), así como \npor el sociólogo Pierre Bourdieu (1982; 2001). En Brasil, Marcos \nBagno (1999) ha llevado a cabo una refl  exión análoga sobre la no-\nción de prejuicios lingüísticos.\nComo lo subraya Blanchet, “l’établissement du caractère illé-\ngitime des disparités de traitement à prétexte linguistique rejoint \nles perspectives d’analyse des langues et variétés comme attributs \ncatégoriels contribuant à l’identifi  cation individuelle ou collecti-\nve”6 (Blanchet, 2021: 156). En ese sentido, las discriminaciones \nglotofóbicas coinciden, a menudo, con las discriminaciones vincu-\nladas al origen geográfi  co, a la situación económica o al géne-\n5 “La elaboración del concepto de glotofobia se inscribe en la continuidad de \nla conceptualización […] de la diglosia, de la minoración […], del odio de sí \nmismo [y] de la inseguridad lingüística.”\n6 “[E]l establecimiento del carácter ilegítimo de las disparidades de trato bajo \nun pretexto lingüístico coincide con las perspectivas que analizan las lenguas y \nsus variedades como atributos categoriales que contribuyen a la identifi  cación \nindividual o colectiva.”']","I'm sorry, but there is no mention of Berlin or its significance in the provided context about linguistics articles. If you have any other questions or need information on a different topic within linguistics, feel free to ask!"
Who is Andrew P. Farley and what is the focus of his research?,"['8 Natalia Ignatieva la “adquisición de segunda lengua”, en el Departamento de Lingüística Aplicada. Es preciso mencionar que la presentación de los proyectos de investigación en curso de este departamento, siempre ha sido una de las prioridades de nuestra revista. Marilyn Buck en sus proyectos de investigación ha estudiado la adquisición de la gramática, particularmente del aspecto verbal. En el artículo aquí incluido, la autora explora la relación entre el aspecto gramatical y el aspecto léxico. Es un estudio donde se analiza la selección de las formas aspectuales del pasado en un relato y que fue aplicado a un grupo de estudiantes hispanohablantes de inglés, así como a uno de nativohablantes del mismo idioma. Los resultados del estudio apoyan la hipótesis del aspecto que establece una influencia del aspecto léxico en la selección de la morfología verbal. El siguiente trabajo, “Leamer Readiness and L2 Production in Spanish: Processability Theory on Trial”, de Andrew P. Farley y Kristina McCollam, prosigue con el tema de la adquisición de segundas lenguas y se enfoca en las etapas de adquisición del español como L2. Los autores exploran la relación entre el estado del alumno, en cuanto a su disponibilidad para aprender (readiness), y el tipo de instrucción que recibe y, por otra parte, el impacto de estas dos variables sobre el desarrollo de las etapas de adquisición. Los puntos gramaticales que sirvieron de material para los tests fueron: el marcador del objeto directo animado a y el modo subjuntivo. Este material se fundamenta en el modelo de “procesamiento del inpuf ”, de Van Patten, y la “teoría de procesabilidad”, de Pienemann, esta última se pone a prueba en el experimento. Los tipos de instrucción usados por los investigadores estadounidenses fueron: instrucción del input estructurado, instrucción de la información explícita y la combinación de estos dos. Los datos recabados después del tratamiento que recibieron los alumnos, los cuales teóricamente estaban “preparados”, o disponibles, para el punto meta, hicieron evidente que el tipo de instrucción influye en el desarrollo de las etapas y que su impacto es mayor que la influencia de la disponibilidad. De esta manera, los resultados contradicen a la teoría de procesabilidad de Pienemann y, en cambio, propor\xad cionan argumentos a favor de la instrucción de procesamiento que a través de este estudio demostró una vez más su eficacia y fuerza. Francisco Castillo y María del Pilar Cerdeira en su artículo “El papel de la partici\xad pación en la interacción en el salón de clase de español como segunda lengua”, abordan otro tema importante dentro del área de enseñanza de lenguas, que es la interacción en una clase de idiomas. Nos presentan los resultados de las observaciones obtenidas en clases de español, donde su meta fue ver cómo participan los alumnos extranjeros en dichas sesio\xad nes. Los autores han utilizado el modelo de interacción de Allwright para analizar, y procesar sus datos, mismo que les permitió estudiar la diversidad de tipos de participación manifestados por los estudiantes y confirmar sus hipótesis de que ésta, en su mayor parte, está condicionada por los requerimientos del profesor. El artículo de']","The work 'Leamer Readiness and L2 Production in Spanish: Processability Theory on Trial' by Andrew P. Farley and Kristina McCollam delves into the acquisition of second languages, specifically focusing on the stages of acquiring Spanish as a second language. The authors explore the relationship between the student's readiness to learn and the type of instruction received, as well as the impact of these variables on the development of acquisition stages.",single_hop_specifc_query_synthesizer,"['Las funciones de incluso en La historia deL españoL\nMartín Zorraquino, María Antonia. 2010. “Los marcadores del discurso y su mor -\nfología”, en Óscar Loureda Lamas y Esperanza Acín Villa (eds.),  Los estudios sobre \nmarcadores del discurso en español, hoy. Madrid: Arco / Libros, pp. 93-181.\nMartín Zorraquino, María Antonia y José Portolés Lázaro. 1999. “Los marcado-\nres del discurso”, en Ignacio Bosque y Violeta Demonte (dirs.), Gramática descriptiva \nde la lengua española, vol. 3: Entre la oración y el discurso. Morfología. Madrid: Espasa \nCalpe, pp. 4051-4212.\nPavón Lucero, María Victoria. 1999. “Clases de partículas: preposición, conjunción y \nadverbio”, en Ignacio Bosque y Violeta Demonte (dirs.),  Gramática descriptiva de la \nLengua Española, vol. 1: Sintaxis básica de las clases de palabras. Madrid: Espasa Calpe, \npp. 565-655.\nPortolés Lázaro, José. 2007. Marcadores del discurso, 4a ed. Barcelona: Ariel.\nReal Academia Española. Corpus diacrónico del español [corde], en <http://www.rae.es>.\nReal Academia Española. 2010. Diccionario de la lengua española [drae], 22ª ed., en \n<http://www.rae.es/recursos/diccionarios/drae>.\nReal Academia Española y Asociación de Academias de la Lengua Española. 2009. Nue-\nva gramática de la lengua española [ngle], t. 2: Sintaxis II. Madrid: Espasa.\nSánchez López, Cristina. 1999. “La negación”, en Ignacio Bosque y Violeta Demonte \n(dirs.), Gramática descriptiva de la lengua española, vol. 2: Las construcciones sintácticas \nfundamentales. Relaciones temporales, aspectuales y modales. Madrid: Espasa Calpe, pp. \n1025-1128.\nTraugott, Elizabeth Closs. 2010. “(Inter)subjectivity and (inter)subjectification: A re-\nassessment”, en Kristin Davidse, Lieben Vandelanotte y Hubert Cuyckens (eds.), Sub-\njectification, Intersubjectification and Grammaticalization . Berlin: Walter de Gruyter, \npp. 29-71.\nTraugott, Elizabeth Closs. 1995a. “The role of the development of discourse markers \nin a theory of grammaticalization”. Comunicación presentada en la 12th International \nconference on Historical Linguistics. Manchester, en <http://www.stanford.edu/~tr-\naugott/papers/discourse.pdf>.\nTraugott, Elizabeth Closs. 1995b. “Subjectification in grammaticalization”, en Dieter \nStein y Susan Wright (eds.),  Subjectivity and Subjectivisation. Cambridge: Cambridge \nUniversity Press, pp. 31-54.\nZimmermann, Malte. 2011. “The grammatical expression of focus in West Chadic: Va-\nriation and uniformity in and across languages”, Linguistics 49, núm. 5: 1161-1211.\nZimmermann, Malte y Edgar Onea. 2011. “Focus marking and focus interpretation”, \nLingua 121, núm. 11: 1651-1670.\nZwicky, Arnold. 1985. “Clitics and particles”, Language 61, núm. 2: 283-305.\n181\nLM II-2\nLingüística Mexicana. Nueva Época, II (2020), núm. 2: 157-181\nISSN: 2448-8194', 'Las funciones de incluso en La historia deL españoL\ndiscursivos, dentro de las cuales se inscriben las tradicionalmente llamadas partículas; \nes decir, adverbios, preposiciones y conjunciones, además de algunos otros elementos \ngramaticalizados, los cuales en ciertos contextos no desempeñan sus funciones sintácti-\ncas habituales (Martín Zorraquino y Portolés Lázaro 1999). \nMartín Zorraquino (2010: 93) resalta que no se identifican con una sola clase de \npalabras, sino con una categoría funcional –de naturaleza esencialmente semántico-\nprag mática‒, y según Portolés Lázaro (2007:48), no ejercen una función sintáctica en \nel marco de la predicación oracional. Asimismo, poseen un cometido coincidente en el \ndiscurso: el de guiar, de acuerdo con sus distintas propiedades morfosintácticas, semán-\nticas y pragmáticas, las inferencias que se realizan en la comunicación.\nPara Martín Zorraquino y Portolés Lázaro (1999: 4097), incluso se ubica dentro de \nlos conectores aditivos. Indican que el segundo miembro discursivo es más fuerte argu-\nmentativamente que el primero y, por tanto, se sitúa en una posición más alta en una \nescala argumentativa. También aluden a un criterio prosódico de caracterización al \nseñalar que no es un conector cuando aparece sin pausa posterior acompañando a otro \nelemento al que destacan. \nAdemás de la invariabilidad morfológica característica de las partículas, en contex -\ntos como los de (18), incluso presenta las propiedades que permiten caracterizarlo como \npartícula discursiva o marcador del discurso.\n(18)\na. Van a ir a parar al rescate bancario porque uno de los transitorios que aquí apro-\nbaron pri y pan autorizan a que se quebrante el adeudo que el Banco de Méxi -\nco\xa0perdón, que Fobaproa tiene con el Banco de México, y ese quebrantamiento \ndel crédito significará que ese crédito se estará solventando con estos remanentes. \nEntonces no estamos de acuerdo, por supuesto, incluso / de hecho / *incluido \n/ ??hasta lo consideramos un expediente abierto del ipab \n(Sesión pública ordinaria de la Honorable cámara de Senadores,\n celebrada el miércoles 15 de diciembre...)\n b. En Chiraz, jóvenes “guardias islámicos” asumieron el control de policía, designados \npor miembros del clero musulmán; incluso / de hecho / * incluido / ??hasta \nhan comenzado a construir nuevos caminos en la ciudad, según informa la pren-\nsa local, y crearon una\xa0“cooperativa islámica”\xa0que se hace cargo de diversas ta -\nreas\xa0comunitarias \n(Clarín 08/02/1987)\nComo se puede notar, no desempeñan ninguna función sintáctica en la oración, sino \nque guían las inferencias de la comunicación (significado procedimental). Así, la unidad \ndiscursiva conectada por medio de incluso conduce a interpretar que se trata de una \nunidad con mayor relevancia argumentativa que el resto de las unidades con las cua-\nles se conecta; y de esta manera implica la existencia de una escala en que el miembro \n177\nLM II-2\nLingüística Mexicana. Nueva Época, II (2020), núm. 2: 157-181\nISSN: 2448-8194', 'Las funciones de incluso en La historia deL españoL\nb. Toda la servidumbre de D. Francisco, *tan incluso la peonada, que era numerosa, \nle llamaban á Chucho\xa0el niño \n(Chucho el ninfo 1871)\nAdemás de los casos en que funciona como participio o como partícula, identifico \notros aquí denominados limítrofes, donde no es posible determinar si su función es par -\nticipial o de partícula. Corresponden a ocurrencias donde incluso establece relaciones \nsintagmáticas con ffnn de número singular y género masculino, por lo que la concor -\ndancia característica del participio se ve neutralizada, como se muestra en (4). \n(4)\na. Estiéndanse los límites del señorío de la Iglesia de la otra parte del Apenino hasta \nel mar Adriático, llegando al río Pescara, y destotra al río Garellano, incluso / \nincluido / hasta gran pedazo del Abruzo y de Campania \n(Historia de Felipe II, Rey de España 1619)\nb. En el caso del párrafo primero del artículo anterior, si estuviera asegurada la \nfinca. el valor del seguro quedará afecto al pago del capital del censo y de las \npensiones vencidas, á no ser que el censatario prefiera invertirlo en reedificar la \nfinca, en cuyo caso revivirá el censo con todos sus efectos, incluso / incluido / \nhasta el pago de las pensiones no satisfechas \n(Código Civil 1889)\nLa neutralización de la concordancia de incluso con la fn dificulta su clasificación \ncomo participio o como partícula. Esto va a acompañado de una ambigüedad también \nde carácter funcional que se ilustra con la conmutación tanto por el participio analógi -\nco incluido como por la preposición hasta. Como partícula o como participio, los casos \nlimítrofes como los de (4) tienen en común el significado de inclusión que codifica esta \nunidad. De esta manera, la ambigüedad de estos casos no es sólo formal, sino también \nfuncional.\nEl segundo parámetro es la función gramatical: de acuerdo con la categoría a la que \npertenezca incluso, puede corresponder a una función participial o de partícula. Como \npartícula puede funcionar como marcador de foco –de inclusión, escalar o de concesivi-\ndad– o como marcador discursivo. En (5) ejemplifico las distintas funciones adverbiales \nde incluso como partícula. Como criterio explicativo, lo reemplazo por elementos típicos \nde la función que se ejemplifica. En (5a) funciona como una partícula de inclusión sim-\nple que indica que el elemento bajo su alcance –sargentos, cabos y tambores– pertenecen \na un dominio –un batallón–. El criterio para identificar esta función es el reemplazo por \nel participio adjetival incluido, que ha de concordar en género y número (masculino y \nplural) con el elemento modificado. \n161\nLM II-2\nLingüística Mexicana. Nueva Época, II (2020), núm. 2: 157-181\nISSN: 2448-8194']","I'm sorry, but the context provided does not mention Andrew P. Farley or his research. If you have any other questions or need information on the articles listed in the context, feel free to ask!"
Who is David Lasagabaster and what is his research about?,"['David Lasagabaster, “Un análisis de las actitudes hacia el inglés como lengua extranjera por medio de grupos de discusión”, concierne a otro aspecto del proceso de la ASL, como son las actitudes hacia L2, en este caso se trata de alumnos']","David Lasagabaster is known for his research on attitudes towards English as a foreign language through discussion groups, focusing on L2 attitudes among students.",single_hop_specifc_query_synthesizer,"[""[ 8 ] José Manuel Solís Navarro & Édgar Oswaldo González Bello\nEstudios de Lingüística Aplicada, año 41, número 76, enero de 2023, pp. 7–36\ndoi: 10.22201/enallt.01852647p.2023.76.1030\nResumen\nEl dominio del inglés ha sumado va -\nlor en la educación superior desde que \nuniversidades comenzaron a incorpo -\nrar procesos de internacionalización \nen casa, lo cual ha fomentado también \nla adquisición del idioma por parte de \nprofesores. Por lo tanto, se analiza la \npercepción del profesorado sobre el do-\nminio del inglés y su relación con los \nfactores socio-académicos, así como \ndel contexto de adquisición del idio -\nma. Se recolectaron respuestas de 670 \nacadémicos de una universidad públi -\nca de México a través de un cuestiona-\nrio digital; los datos fueron analizados \nmediante una regresión lineal múltiple \npara identificar efectos. Los resulta -\ndos advierten que la habilidad lectora \nse percibe con mayor competencia y la \ncapacidad oral con algunas debilidades. \nAdicionalmente, pertenecer a las áreas \nstem y aprender el idioma en ambien-\ntes no académicos pueden predecir la \npercepción del dominio del inglés. Se \nconcluye que, a pesar de los niveles de \ndominio identificados, las exigencias \nde ciertas acciones como impartir asig-\nnaturas en inglés hacen relevante la pla-\nnificación institucional y la definición \nde escenarios estratégicos de capacita-\nción docente en los que se oriente hacia \nla adquisición del idioma.\nPalabras clave: educación superior; \ninglés; currículo; profesorado\nAbstract\nEnglish Proficiency has added value \nin higher education since universities \nstarted incorporating internationaliza-\ntion processes at home, which has also \nencouraged teachers' acquisition of the \nEnglish language. Therefore, we ana -\nlyzed teachers' perception of English \nproficiency and its relationship with \nsocio-academic factors, as well as the \ncontext of language acquisition. Re -\nsponses were collected from 670 ac -\nademic professionals from a public \nuniversity in Mexico through an online \nquestionnaire; data were analyzed us -\ning multiple linear regression to iden-\ntify potential effects. The results indi-\ncate greater perceived competence in \nreading skills and some weaknesses \nin oral skills. Additionally, being part \nof stem areas and learning the En -\nglish language in non-academic envi -\nronments can predict the perception \nof English proficiency. It is conclud -\ned that, despite the proficiency levels \nidentified, the demands of certain ac -\ntivities, such as teaching subjects in \nEnglish, point to the relevance of in -\nstitutional planning and the definition \nof strategic teacher training scenarios \noriented towards language acquisition.\nKeywords: higher education; English; \ncurriculum; teachers"", 'doi: 10.22201/enallt.01852647p.2024.79.1079\n[ 120 ] Sabine Pfl  eger\nEstudios de Lingüística Aplicada, año 42, número 79, julio de 2024, pp. 113–128\n2) Facilitan los procesos de identifi  cación individual y de per-\ntenencia a uno o más grupos sociales.\n3) Fomentan las comparaciones y evaluaciones entre indivi-\nduos y grupos.\nEn el apartado siguiente se ilustra cómo algunos de estos procesos \nde conceptualización se instancian en discursos mediáticos mexi-\ncanos acerca de los movimientos migratorios entre México y Esta-\ndos Unidos, produciendo diferentes puntos de vista y perspectivas \nidentitarias sobre el equilibrio de poder percibido en la relación \nde ambos países.\n2. La migración entre México y Estados Unidos: muchos \nescenarios diferentes, pero simultáneos\nLa migración en México es un fenómeno sui generis (iom, 2018). \nEsto se debe a que aquí, en un mismo país, coexisten diferentes \nescenarios migratorios. La ubicación geográfi  ca entre los países \ncentroamericanos y los Estados Unidos convierte a México en un \nespacio crítico para los fl  ujos migratorios. En primer lugar, México \ncuenta con un fuerte movimiento migratorio propio hacia Estados \nUnidos (Massey, Pren & Durand, 2009; Pérez-Soria, 2017). Au-\nnado a ello hay migrantes, en su mayoría transmigrantes centro-\namericanos, quienes, cada vez más, se quedan en México porque \nnunca llegan a su destino de cruzar la frontera a Estados Unidos \n(Fernández, Espinoza & Choy, 2012;  cndh, 2017). Asimismo ha \naumentado en los últimos años el número de migrantes y transmi-\ngrantes que, debido a la política estadounidense de refugiados, han \nregresado a México, de manera más o menos voluntaria (Calderón, \n2012; Mestris, 2013; Canales & Rojas, 2017). Adicionalmente a \nestos fenómenos, no se puede dejar de mencionar la fuerte mi-\ngración interna de áreas rurales a centros urbanos por la creciente \nviolencia de cárteles de droga que desplazan a las personas de sus \nlugares de origen.', 'Estudios de Lingüística Aplicada, año 41, número 76, enero de 2023, pp. 7–36\ndoi: 10.22201/enallt.01852647p.2023.76.1030\nPercepción sobre la adquisición y el dominio del inglés en profesores universitarios [ 13 ]\nacadémicos en habilidades lingüísticas y pedagógicas con respecto \nal inglés. Estas acciones han sido analizadas por González-Bello y \nGarcía-Meza (2020), sustentando que la participación de académi-\ncos en dichas iniciativas es sumamente limitada, tanto en aspectos \nde formación como en la práctica dentro del aula. Por tal motivo, \nes pertinente poner especial atención en el nivel de dominio del \ninglés de los profesores, así como los contextos en los que adqui-\nrieron dichas competencias, con el fi  n de analizar su relación con \nlos procesos de internacionalización en casa (Gacel-Ávila, 2017; \nGao, 2019).\nEn suma, la investigación sobre el dominio del inglés es re-\nlevante en contextos como el mexicano, donde los procesos de \ninternacionalización se encuentran en desarrollo y los académi-\ncos siguen adaptándose a los cambios en los paradigmas de en-\nseñanza, sobre todo los que requieren habilidades lingüísticas en \nlenguas extranjeras. Siguiendo esta lógica, se plantea como obje-\ntivo: analizar la percepción del profesorado sobre el dominio del \ninglés y su relación con factores socio-académicos y el contexto \nde adquisición del idioma como escenario en prospectiva para la \ninternacionalización en casa.\n2. Factores socio-académicos y el contexto de adquisición del \nidioma\nA nivel global, el inglés se ha posicionado como la lengua franca \npara la comunicación y la ciencia, por lo cual es considerado un \naspecto clave en la educación superior en diversos países, espe-\ncialmente en naciones no anglosajonas, pues representa un idioma \nimportante para el futuro (Altbach & de Wit, 2020). Debido a esta \nrelevancia, el nivel de dominio y uso del inglés en las actividades de \ndocencia se ha posicionado como un indicador de internacionaliza-\nción en las universidades públicas en México (Gacel-Ávila, 2017).\nMéxico es un país con un dominio de inglés “muy bajo”, se-\ngún los reportes del English First English Profi  ciency Index (2021) \nse posiciona en el lugar 92 de 112 países que participan anualmen-']","I'm sorry, but there is no mention of David Lasagabaster in the provided context. If you have any other questions or need information on a different topic, feel free to ask!"
"What insights can be gathered from the reference to Eme, Lacroix & Almecija in the text?","['Ana María Borzone, María Luisa Silva y María Elena Benítez calificar el relato previo como una versión de secuencias descriptivas, más que como un relato canónico. En muchas ocasiones, sin lugar a dudas, estos usos podrían ser considerados como síntoma de cierta competencia narrativa deficita- ria (Eme, Lacroix & Almecija, 2010). No obstante, ante la demanda de producir un relato de experiencia personal, la narradora no solo produce un relato extenso sino que, además, no se observan las falencias mencionadas previamente. A continuación transcribimos parte del relato referido: No tenía la cocina grande, tenía la cocina no más de dos kilos, la chiquita de una hornalla. En esa pues, estaba haciéndome friendo huevos, tostando huevos, como se dice [...] ahí nomás se me movió el sartén y se me vino enseguida el aceite todo en mi pie y mirá me quedó marquita ahí [...] no sabía qué hacer, lo dejé con agua un ratito y a pocos segundo me volvió a arder peor y no aguantaba, todavía tenía miedo ir al hospital. Eso pasó hace cinco años atrás, en el año de crisis [...] y después se me entró a hacer pus, ampolla se me hizo, no lastimadura [...]. Al siguiente día estaba todo de los que pinché salía agüita y me dolía peor. Hasta ahí más o menos camina- ba poquito, pero no caminaba bien, cojeando pero después me fui en remís al Hospital Piñero. El Hospital Piñero no me quiso atender, me dijo que no era para ahí, que es muy grande, que es para el Hospital del Quemados y el remís ya se había ido y no tenía en qué ir y no había ningún remís que me lleve, meta buscar y no podía ni caminar. Después me fui al Hospital del Quemado [...] me fui y me atendió, pero ahí me hizo bien gritar; agarró una cosa parece que lo hubiera hecho con alco- hol, me explotó y me arrancó todo, iba a gritar pero mal. Me arrepentí de haber ido ahí. [...] y después como yo le he dicho me hizo la limpieza, después me vendó, me dijo, no sé cuantos días, creo que fue un martes, me dijo venga el viernes, y justo era en verano y justo yo vivía en el último piso de arriba y yo estaba sentada, con el calor, me ardía más, mi amiga me ha dicho no te vas a sacar y yo no aguanté, para dos días me vendó él, ella, 3 yo ni un día, lo saqué yo y después no podía volverla a conectar como estaba, después he venido nunca más voy al hospital. [...]. Y no podía trabajar porque era justo con ese pie tengo que trabajar y no podía. Después de tres meses pude trabajar, así estaba todo enero. Como se puede observar en el fragmento transcrito, el uso de deícticos se encuentra justificado por la dinámica conversacional, no se observa escasez de 3 Posiblemente la narradora corrige con el pronombre personal femenino (ella) la referencia inade- cuada, pues una doctora (ella) realizó las primeras curaciones que refiere. Estudios de Lingüística Aplicada, año 29, número 54, diciembre de 2011, pp. 9-35 ELA 54 interiores.indd 28 20/03/13 17:09']","The reference to Eme, Lacroix & Almecija in the text suggests that certain narrative uses could be indicative of deficient narrative competence. It implies that these uses may not align with canonical storytelling standards and could reflect a lack of narrative proficiency.",single_hop_specifc_query_synthesizer,"[""20\nthat mean two different things; or in French\nII est capital/ *capita1ement\nwhere the adverb does not exist.\nSee also the possibility of focusing the ad-\njective but not the adverb:\n(48) E' evidente che Pietro ama Ma- \nria ?\n(49)*E' evidentemente che Pietro ama \nMaria?\nThe lack of semantic equivalence between the \nadverb and the corresponding adjective is evi-\ndent in question-answer pairs. For example:\nQ.  (50) E' naturale che Pietro ami Ma-\nria?\nA   (a) Si, e' naturale \n(b) Si, naturalmente\nIn A ( a ) the scope of the adjective is the \nclause 'che Pietro ami Maria', while in A (b) it   \nis the whole sentence.\nThe same happens with negation. If we take:\n(51) E' probabile che Pietro ami Ma-  \nria\n(52) Probabilmente Pietro ama Maria\nand deny them with\n(53) Non e1 vero \nThe negation of (51) would refer to the proba-"", 'palabras es de estados de lengua posteriores al castellano antiguo4. Ni en el Corpus dia-\ncrónico del español 5, en el Corpus del español mexicano contemporáneo 6, en el Corpus de \nreferencia del español actual7 o en el Corpus del español del siglo xxi8 se encuentra un solo \nejemplo de construcciones de interpolación que incluyan a dizque o pinches, lo que reve-\nla su estatus emergente en el español mexicano. \nDicho carácter innovador provoca que resulte complicado atestiguar ejemplos de \npinches y dizque en corpus o publicaciones periodísticas, por lo que en la presente nota \nse muestra evidencia obtenida principalmente a partir del uso de la herramienta de \nbúsqueda en la red social Twitter, utilizada por múltiples sectores de la población mexi-\ncana, particularmente adultos jóvenes y adolescentes, y en la cual es posible atestiguar \nformas coloquiales en forma escrita (5). Esta decisión fue tomada a partir de corroborar \nque la mayoría de los datos presentados en las obras de Quepons Ramírez (2015, 2022) \nprovenían de dicha fuente.\n(5) \n1. como me pinches caga ver a alguien activo y que me esté ignorando (Twitter, \n2023, México)\n2. … (porque así lo disque quiere, enamoramiento ni amor de romance ni por aso-\nmo)… (Twitter, 2023, México)\n3. …. y cuando me pinches llamaste a mi? (Twitter, 2012, México)\n4. … y ya me dizque regaño por quedarme viendo el concierto (Twitter, 2022, México)\nVale preguntarse por qué solo dizque y pinches se permiten en esa posición, y no otros \nadverbios. Si acudimos a cuestiones semánticas, dizque tiene un valor evidencial bien \natestiguado en descripciones como las de García Fajardo (2007), De la Mora y Maldona -\ndo (2015), Martínez Levy (2019) o Demonte (2020), mientras que pinches tiene un valor \nintensificador de acuerdo con Quepons Ramírez (2015, 2019); este factor no parece ser \ndeterminante, ya que intentar introducir otros adverbios con valores evidenciales o in -\ntensificadores entre pronombres átonos y verbos resulta en construcciones agramaticales:\n(6)\n1. *Te bastante amo (vs. Te amo bastante )\n2. *Lo demasiado odio (vs. Lo odio demasiado)\n4\u2009En el corde dizque se atestigua hasta finales del siglo xv, mientras que pinche se atestigua ape-\nnas hasta finales del siglo xix como sustantivo, siendo su uso adverbial muy reciente y originado a \npartir de un estado adjetival intermedio (Quepons Ramírez 2015, 2022).\n5\u2009El corde contiene datos desde el siglo xiii hasta 1974.\n6\u2009El cemca contiene datos desde 1921 hasta 1974.\n7\u2009El crea contiene datos desde 1974 hasta el año 2000.\n8\u2009El corpes contiene datos desde el año 2000 hasta 2022.\n100 cArloS de jeSúS WAgner oviedo\nLM V-2 \nLingüística Mexicana. Nueva Época, v (2023), núm. 2: 97-109  \nISSN: 2448-8194', 'diccionarios\nCompany Company, Concepción. 2010. Diccionario de mexicanismos, México: Siglo xxi.  \nMerriam Webster. 2020. Merriam-Webster Unabridged Dictionary, en <http://unabridged.\nmerriam-webster.com> [consultado en noviembre de 2020]. \nÁlvarez Mellado, Elena. Observatorio Lázaro, Universidad de Brandeis <https://ob-\nservatoriolazaro.es/acerca.html> [consultado en noviembre de 2020]. \nCambridge University Press. 2020. Diccionario Cambridge inglés-español, <https://dictio-\nnary.cambridge.org/es/diccionario/ingles-espanol> [Consultado en noviembre de \n2020]. \nHarper Collins Publishers. 2020.  Collins  Unabridged Spanish to English and English to \nSpanish Dictionary <https://www.collinsdictionary.com/es/diccionario/inglesespa-\nnol> [Consultado en noviembre de 2020].\nDiccionario del español de México (dem). 2010. México: El Colegio de México. <http://\ndem.colmex.mx> [consultado en noviembre de 2020]\nReal Academia Española. Diccionario de la lengua española , en <http://dle.rae.es/> \n[consultado en noviembre de 2020]. \n36 mayra Haydee Tafoya cisneros y liHiT andrea Velázquez lora\nLM IV-2 \nLingüística Mexicana. Nueva Época, IV (2022), núm. 2: 15-38  \nISSN: 2448-8194']","I'm sorry, but there is no reference to Eme, Lacroix & Almecija in the provided text. If you have any other questions or need further assistance, feel free to ask!"
Who presented the analysis of different aspects in the design of a course of redaction in English?,"['Natalia Ignatieva sentido el número 28 es bastante representativo, ya que las demás colaboraciones están escritas por profesores de nuestro Centro. La primera de éstas, «Diseño, procesos y perspectivas de un curso de redacción en inglés» de Alice Bracho y Alice Emery presenta el análisis de diferentes aspectos, tanto teóricos como metodológicos, en el diseño de un curso de redacción en inglés. Las autoras comparten con los lectores sus experiencias al diseñar el curso e impartir\xad lo durante tres años, reflexionan sobre su estado actual y su futuro. Creemos que estas experiencias serán de mucha utilidad para los maestros de inglés, asimismo como para diseñadores de cursos y público en general. Las contribuciones restantes están todas relacionadas de una manera u otra con los aspectos socioculturales en la enseñanza de lenguas. Así, en el trabajo «E.U.A. en el imaginario de estudiantes mexicanos» de María Eugenia Gómez de Mas surge como tema principal la actitud de los alumnos del CELE hacia los Estados Unidos, resultado colateral de la aplicación de un cuestionario sobre el Tratado de Libre Co\xad mercio a los alumnos de francés y, posteriormente a los de alemán e inglés. El tema en sí no parece ser nuevo, pero lo inesperado en este caso fue el hecho de que las preguntas del cuestionario fueron sobre Cañada... y esto permitirá a nuestros lectores ver el problema viejo en un contexto diferente. Los artículos que siguen constituyen ponencias presentadas en el II Coloquio de Lingüística que tuvo lugar en la Escuela Nacional de Antropología e Historia los días 24-26 de abril de 1998. Entre ellos está el trabajo «Investigaciones sobre el papel de percepciones so\xad cioculturales y lingüísticas en la enseñanza de idiomas» de Phyllis Ryan cuyo tema de alguna forma está conectado con el de la colaboración anterior, de María Eugenia Gómez. La estudiosa nos pone al tanto de los proyectos de investigación intercultural llevados a cabo en el Departamento de Lingüística Aplicada cuyos resultados le per\xad miten afirmar que las actitudes negativas, principalmente hacia la cultura norteameri\xad cana, crean barreras en el camino de aprendizaje de lenguas extranjeras, en particular, de inglés. A su vez, Monique Vercamer en el artículo denominado «Reflexiones y pro\xad puestas acerca de las relaciones de significación entre cultura y lenguaje» critica las gramáticas estructuralistas y gramáticas pedagógicas basadas en éstas e intenta propo\xad ner lo que llama «una gramática nocional» usando elementos semióticos. Aline Signoret en el trabajo «El modelo de la aculturación y el desarrollo del interlenguaje de una lengua extranjera» expone las bases teóricas de las propuestas que tratan de explicar la desigualdad en el desempeño lingüístico de los alumnos de idiomas. La investigadora toma el modelo de aculturación como marco de referencia y lo aplica con los alumnos principiantes de francés, lo cual le permite explicar el carácter desigual en el desarrollo del interlenguaje de los estudiantes. Finalmente, Roland Terborg en su contribución con el título «El ritual en el mantenimiento de lenguas indígenas» escribe sobre el uso simbólico de las lenguas. El autor distingue entre el uso creativo y el uso ritual del lenguaje y asocia éste último']",The analysis of different aspects in the design of a course of redaction in English was presented by Alice Bracho and Alice Emery.,single_hop_specifc_query_synthesizer,"['conspirólogo\nEn el peor de los casos se dará cuenta que éste ya no es \nun fenómeno exclusivo del conspirólogo proverbial con el \ngorro de aluminio, no: la conspiración ya es parte de la con-\nversación pública.\nEl Universal. Opinión. Esteban \nIllades. 20 de agosto de 2020. \nVersión digital.\ncoronabicho Escuela en casa en tiempos del coronabicho: Entre Sherlock \nHolmes y Poirot.\nEl Universal. Confabulario. Mary \nCarmen Sánchez Ambriz. 12 de \nseptiembre de 2020. \nVersión digital.\ncoronabobo\nDe la existencia del virus nadie tiene la culpa, desde luego \n[...]. Los ciudadanos imputan la culpa a los políticos y los \npolíticos, con la boca pequeña, solo se atreven a inculpar, \nen fin, a esa “pequeña minoría” de irresponsables... ¿Peque-\nña? ¿Coronavirus? Coronabobos, dice el espejo.\nMilenio. El Mundo. Manuel Hi-\ndalgo, p. 23. 18 de septiembre \nde 2020.\ncoronabono\nEl Eurogrupo llegó este jueves a un acuerdo para movilizar \nmás de medio billón de euros en préstamos para ayudar \na estados, empresas y trabajadores afectados por el coro-\nnavirus, pero dejó para más adelante la discusión sobre la \nemisión de “coronabonos” para financiar la recuperación.\nSinembargo. Economía.  \n“Eurogrupo acuerda medio \nbillón de euros, pero sin coro-\nnabonos, para afectados por \nCOVID-19”. EFE. 10 de abril de \n2020. Versión digital.\ncoronaburguer\nEn medio de la pandemia por coronavirus el ingenio mexi-\ncano se hace presente en todo el país, con creaciones que \nvan desde un globo, pasteles, bonless, tatuajes y ahora una \nhamburguesa, se trata de la “Coronaburger” y es creada en \nCiudad Madero, Tamaulipas.\nMilenio Digital. Virales. Magda \nBárcenas. 11 de mayo de 2020.\ncoronacrisis Coronacrisis. La cuarentena trajo aparejada la crisis econó-\nmica por la que atraviesan distintos sectores.\nInfobae.com. Tendencias. Víctor \nIngrassia. 7 de junio  de 2020.\ncoronalibro\nCrean el “Coronalibro”. Más de 4 mil 500 propuestas de \n15 países respondieron a la convocatoria de la Universidad \nAutónoma Metropolitana (UAM) para un proyecto colabo-\nrativo, un fotolibro y una pieza multimedia en torno del \ncoronavirus.\nEl Universal. Cultura. Sonia Sie-\nrra. 7 de mayo de 2020. \nVersión digital.\ncoronavirulento\n“CORONAVIRULENTO”. El científico universitario refirió \nque el virus podría ya haber llegado a México sin que haya \nsido detectado, puesto que tarda 14 días en incubarse sin \nque se presenten síntomas.\nLa Crónica de Hoy. Academia. \n“El coronavirus llegará a Mé-\nxico y no estamos preparados: \nacadémicos”. Isaac Torres Cruz. \n31 de enero de 2020. \nVersión digital.\ncoronial\nEs lo que es y esto no va a terminar nunca, ni con una vacu-\nna ni con diez. Es, como están diciendo muchos de nuestros \nmás grandes pensadores: la era “coronial”. Así como la épo-\nca colonial tuvo sus características y sus valores, el corona-\nvirus nos está llevando a situaciones que jamás imaginamos \ny que no van a tener solución en la lógica “pre-coronial”.\nMilenio. Opinión. Álvaro de la \nCueva. 27 de septiembre de \n2020. Versión digital.\ncoronnial\nDespués de los millennials y la generación Z es la hora de \nlos coronnials. Este término, muy popular en las redes so-\nciales, se refiere a la generación que nacerá en los próximos \nmeses como consecuencia del aislamiento en parejas.\nInfobae.com. Tendencias. Víctor \nIngrassia. 7 de junio de 2020.\n22 Ramón ZacaRías Ponce de León\nLM IV-1 \nLingüística Mexicana. Nueva Época, IV (2022), núm. 1: 7-29  \nISSN: 2448-8194', 'Estudios de Lingüística Aplicada, año 43, número 80, enero de 2025, pp. 7–48\ndoi:10.22201/enallt.01852647p.2025.80.1097\n[ 18 ] Eguzki Urteaga\na lo largo de los últimos años que dan cuenta de una glotofobia \npalpable hacia las lenguas minoritarias.\n3.2.  Las modalidades de designación de los jueces y magistrados\nAsimismo, la actitud de los jueces y magistrados está ligada a \nlas modalidades de designación de los miembros de los principa-\nles estamentos judiciales. Dichas modalidades están fi  jadas por \nel artículo 66.2 de la Constitución de 1978 y por la Ley Orgánica \n6/1985 del Poder Judicial. En efecto, a partir de entonces, los jue-\nces del Tribunal Constitucional y del Consejo General del Poder \nJudicial son designados por el Parlamento, que reúne el Congre-\nso de los Diputados y el Senado, lo que repercute en la politización \ndel poder judicial.\nAsí, el artículo 66.2 de la Constitución española estipula que \n“las Cortes Generales ejercen la potestad legislativa del Estado, \naprueban los presupuestos, controlan la acción del Gobierno y tie-\nnen las demás competencias que les atribuye la Constitución” (Bo-\nletín Ofi  cial del Estado, boe, 1978). Es precisamente en nombre \nde estas últimas que el Parlamento interviene en el nombramiento \ny la designación de los miembros de las altas instancias del Esta-\ndo y de los organismos públicos de la administración, gracias a la \nlegitimidad que confi  ere a sus miembros su elección al sufragio \nuniversal directo.\nEl Parlamento interviene de diferentes maneras: designando \nla totalidad o parte de los miembros; o pronunciándose sobre la \nidoneidad y la ausencia de confl  ictos de intereses de ciertos candi-\ndatos cuya propuesta corresponde a otros órganos:\n• En lo que se refi  ere al Tribunal Constitucional, encargado de \nvelar por el respeto de la Constitución y que está compuesto \npor doce miembros, cuatro están designados por el Congreso \nde los Diputados, cuatro por el Senado, dos por el Gobier-\nno central y otros dos por el Consejo General del Poder Judi-\ncial. Están nombrados para un periodo de nueve años y, cada', 'El chisme: estrategias discursivas desplegadas en su construcción 39\nEstudios de Lingüística Aplicada, año 36, número 67, julio de 2018, pp. 9–43\ndoi: 10.22201/enallt.01852647p.2018.67.723\n Hall, Joan Kelly (1993b). Tengo una bomba: The paralinguistic and linguistic conventions of \nthe oral practice. Research on Language and Social Interaction, 26(1), 55–83. Recuperado de \nhttps://www.researchgate.net/publication/233375372\nHandelman, Don (1973). Gossip in encounters: The transmission of information in a bounded so-\ncial setting, Man, 8(2), 210–227. Recuperado de http://www.jstor.org/stable/2800847\nHaviland, John Beard (1977). Gossip, reputation and knowledge in Zinacantan. Chicago: The \nUniversity of Chicago Press.\nHood, Susane, & Martin, James Robert (2005). Invocación de actitudes: el juego de la gra-\ndación de la valoración en el discurso. Revista Signos, 38(58), 195–220. Recuperado de  \nhttps://scielo.conicyt.cl/scielo.php?script=sci_arttext&pid=S0718-09342005000200004\nKaplan, Nora (2004). Nuevos desarrollos en el estudio de la evaluación en el lenguaje: la teoría \nde la valoración. Boletín de Lingüística, 22, 52–78. Recuperado de http://www.redalyc.org/\narticulo.oa?id=34702203\nKaplan, Nora (2007). La teoría de la valoración: un desarrollo de los estudios sobre la evaluación \nen el lenguaje. En Adriana Bolívar (Comp.), Análisis del discurso, ¿por qué y para qué? (pp. \n63–86). Caracas: Universidad Central de Venezuela.\nLevin, Jack, & Arluke, Arnold (1987). Gossip: The inside scoop. Nueva York: Plenum Press.\nLópez Rodríguez, Fabiola E. (2015). Antecedentes teóricos del chisme. En Gerardo Gutiérrez \nCham, Gerrard Mugford & Rosa Yáñez (Coords.), Argumentación discursiva en textos orales \ny escritos (pp. 93–114). Guadalajara: Universidad de Guadalajara.\nMartin, James Robert (2000). Beyond exchange: Appraisal systems in English. En Susan Hun-\nston & Geoffrey Thompson (Eds.), Evaluation in text: Authorial stance and the construction \nof discourse (pp. 142–175). Oxford: Oxford University Press.\nMartin, James Robert, & White, Peter R. R. (2005). The language of evaluation: Appraisal in \nEnglish. Nueva York: Palgrave Macmillan.\nPaine, Robert (1967). What is gossip about? An alternative hypothesis. Man, 2(2), 278–285. Re-\ncuperado de http://www.jstor.org/stable/2799493\nPaine, Robert (1970). Informal communication and information-management. Canadian Review \nof Sociology, 7(3), 172–188. doi: 10.1111/j.1755-618X.1970.tb01159.x\nPalmer, Frank R. (2001). Mood and modality. Cambridge: Cambridge University Press.\nPietrosemoli, Lourdes (2009). El chisme y su función en la conversación. Lengua y Habla, \n(13), 55–67. Recuperado de http://erevistas.saber.ula.ve/index.php/lenguayhabla/article/view \nFile/1033/1005']","I'm sorry, but the context provided does not mention any specific analysis of different aspects in the design of a course of redaction in English. If you have any other questions or need assistance with a different topic, feel free to ask!"
What are the challenges faced by researchers in the field of translation studies in Jalisco?,"['eStudioS de trAducción en méxico. PerSPectivA lingüÍSticA SoBre PAnorAmAS de inveStigAción ejemplo, hay una predilección por los estudios de traducción en la Nueva España. Una muestra de ello es el libro Contactos lingüísticos y culturales en la época novohispana. Pers- pectivas multidisciplinarias, que editaron María del Pilar Máynez, Salvador Reyes y Frida Villavicencio (2014), en el cual recogieron diversos estudios sobre la traducción de tex- tos sagrados y la censura de las traducciones en este periodo. horizontes de Los estudios de traducción en México: tareas pendientes A partir del recuento de las tendencias temáticas antes señaladas, es posible pensar en las posibilidades a futuro de esta disciplina, ya que los estudios de traducción en la academia mexicana siguen en proceso de construcción y cuentan con un camino amplio y prometedor por recorrer. No obstante, como en cualquier campo novedoso, hay un sinnúmero de desafíos que enfrentar y muchas tareas por hacer. En su “ Semblanza de los estudios de traducción en México”, Patricia Velázquez Mar- tínez detalló que, por medio de “un consenso que se llevó a cabo entre la comunidad de la Universidad de Guadalajara en el año 2006” (2008), se determinaron tres áreas en “el campo de la traducción [que] necesitan atención en Jalisco”: la primera se refiere a sa- tisfacer la demanda del mercado; la segunda, a realizar investigación, puesto que señala que “el trabajo de investigación en traducción es escaso no sólo en Jalisco sino en todo México”, y sugiere investigar sobre la “alfabetización de grupos minoritarios que hablan lenguas indígenas”. En esta área también apunta que los investigadores necesitan lo que llama “movilidad académica”, que entiende como “obtener el servicio de traducción para Artículos, Ponencias y/o Conferencias, Reportes de Investigación, Intercambios académicos, etc.”, y, por último, señala que es indispensable investigar acerca de la práctica profesional de traductores en áreas tecnológicas o comerciales; finalmente, la tercera sería “formar traductores a nivel universitario”. Si bien todas las áreas de opor- tunidad señaladas por Velázquez Martínez siguen siendo vigentes y de difícil resolución a mediano plazo, me centraré en la segunda, respecto a la investigación, puesto que es la que corresponde a los estudios de traducción propiamente dichos. Una de las tareas ingentes de este campo tiene que ver con el establecimiento de un metalenguaje disciplinario en español. La terminología es fundamental en los estudios de traducción, ya que se necesitan términos comunes entre el gremio para designar y significar (Lara 2015, 31-32) los múltiples procesos de la práctica traductora. La sub- competencia terminológica es determinante en la formación del traductor. Teresa Cabré señala que “es absolutamente imprescindible que el traductor especializado tenga for - mación en terminología para llevar a cabo de manera óptima su actividad profesional, proponiendo un esquema flexible de implicación del traductor en terminología, que dé cuenta de los diferentes grados de compromiso que éste puede adoptar en su formación terminológica” (2010, 257). Contar con una terminología compartida por los profesio - nales de la traducción es indispensable para establecer unidades terminológicas básicas y urgentes que consideren todos sus componentes (cognitivo, lingüístico, sociofuncional 15 LM V-2']","In the field of translation studies in Jalisco, researchers face challenges such as meeting market demands, conducting research, especially due to the scarcity of translation research not only in Jalisco but throughout Mexico, investigating the literacy of minority groups speaking indigenous languages, requiring academic mobility for translation services, exploring the professional practice of translators in technological or commercial areas, and the need to educate translators at the university level.",single_hop_specifc_query_synthesizer,"['Procesamiento de discurso: relaciones semánticas, expectativas del lector y modelos mentales 29\nEstudios de Lingüística Aplicada, año 37, número 69, julio de 2019, pp. 9–35\ndoi: 10.22201/enallt.01852647p.2019.69.828\nmomento de afirmación de expectativa causal, en muchas ocasiones re-\nlacionado con la justificación o explicación del quiebre causal anterior \nque reconstruya la expectativa causal global del lector.\nFinalmente, no queremos dejar de observar el patrón de presencia / ausencia  \nde marca semántica explícita en general, pero, sobre todo, en función de la re-\nlación semántica particular. El efecto principal hallado para la variable pre -\nsencia / ausencia de partícula conectiva muestra que los sujetos prefieren \nintroducir una marca semántica explícita cuando construyen relaciones semán -\nticas en virtud de producir un discurso globalmente coherente. Sin embargo, su \ninteracción significativa con el factor relación semántica también muestra \nque esa tendencia varía en función de qué tipo de relación semántica se cons -\ntruya. Nuestros datos confirman la hipótesis de continuidad de Murray (1997) \nen términos de que las relaciones aditivas, paradigmáticamente continuas, son \nlas únicas que pueden carecer de marca explícita sin impedir u obstaculizar la \nconstrucción de un modelo mental y propiciar un discurso semánticamente con-\nsistente. Esto es: si la estrategia por defecto es la expectativa de continuidad, \nmientras no exista un quiebre en esa expectativa, la instrucción semántica ex -\nplícita no resulta determinante. Las consecutivas, por su parte, también conside-\nradas continuas, muestran, asimismo, una posibilidad relativamente consistente \nde prescindir de marca semántica explícita; sin embargo, esta posibilidad dis -\nminuye con las causales propiamente dichas y se restringe aún más con las con-\ntracausales —tanto adversativas como concesivas, como caso extremo que no \npodría construirse sin marca semántica explícita. Vale mencionar que aquí pare-\nce darse una articulación entre la expectativa de continuidad y la de causalidad \n—similar a la descripta en Zunino (2014) y Zunino (2016a) para el proceso de \ncomprensión— y que en ese cruce se determina un continuum respecto del rol y \nefecto de la partícula conectiva: las causales continuas, con entonces, serían las \nque pueden prescindir de marca explícita con mayor facilidad y en orden cre -\nciente de dificultad y necesidad —a propósito del quiebre de sucesivas expecta-\ntivas semánticas del lector— se ubicarían la causales discontinuas, con porque, \ny, por último, las contracausales, con pero y con aunque. En este sentido, halla-\nmos aquí otro punto en común entre procesos de comprensión y producción de \ndiscurso.', 'Estudios de Lingüística Aplicada, año 37, número 70, diciembre de 2019, pp. 9–36\ndoi: 10.22201/enallt.01852647p.2019.70.869\n[ 34 ]  Ittay Gil Carrillo\nNEELY, JaMEs (1991).  Semantic priming effects in visual word recognition: A \nselective review of current fi  ndings and theories. En Derek Besner \n& Glyn W. Humphreys (Eds.), Basic processes in reading: Visual \nword recognition (pp. 264–336). Hillsdale: Erlbaum.\npapaFRaGOU, aNNa, & MUsOLINO, JULIEN (2003).  Scalar implicatures: Experiments at the \nsemantics-pragmatics interface. Cognition, 86(3), 253–282.\npEREa, MaNUEL, & R Osa, Eva (2002).  Does the proportion of associatively related \npairs modulate the associative priming effect at very brief stimu-\nlus-onset asynchronies? Acta Psychologica, 110(1), 103–124.\nspERBER, DaN, & WILsON, DEIRDRE (1995).  Relevance: Communication and cognition. \nOxford: Blackwell.\nvaN TIEL, BOB; vaN MILTENBURG, EMIEL; ZEvaKHINa, NaTaLIa, & G EURTs, BaRT (2016).  Scalar diversity. \nJournal of Semantics, 33(1), 137–175.\nvILLasEÑOR, GaLa KaRINa (2017).  Interpretación de términos numéricos: un estudio \nempírico. Estudios de Lingüística Aplicada, 35(66), 135–172.\nZEvaKHINa, NaTaLIa (2012). Strength and similarity of scalar alternatives. En Ana \nAguilar Guevara, Anna Chernilovskaya & Rick Nouwen (Eds.), Pro-\nceedings of Sinn und Bedeutung 16 (V ol. 2, pp. 647–658). Utrecht: \nmit Working Papers in Linguistics.', 'Estudios de Lingüística Aplicada, año 35, número 65, julio de 2017, pp. 11–36\nModelos temporales aplicados a la enseñanza del pretérito y copretérito 23\ndoi: 10.22201/enallt.01852647p.2017.65.725\nCuadro 3. Categorización del pretérito y el copretérito a partir del input proporcionado a los aprendientes de español L2 en \nla muestra analizada: cifras absolutas  \nNivel 2 Nivel 3 Nivel 4\nPre Co Pre Co Pre Co\nAspecto gramatical (1)\n[+ puntual] 5 0 10 0 20 0\n[+ durativo] 0 0 0 2 0 2\nAspecto gramatical (2)\n[+ perfectivo] 7 0 7 0 21 0\n[+ ingresivo] 0 0 0 0 10 0\n[+ terminativo] 7 0 7 0 18 0\n[+ imperfectivo] 0 1 0 12 0 20\n[+ progresivo] 0 0 0 1 0 2\n[+ habitual] 0 1 0 2 0 7\n[+ continuo] 0 0 0 9 0 17\nPerspectiva discursiva\nPrimer plano 0 0 0 0 22 0\nSecuencia de acciones 0 0 0 0 22 0\nCambio de estados 0 0 0 0 0 0\nSegundo plano 0 2 0 6 0 23\nHábitos 0 1 0 2 0 7\nDescripciones 0 1 0 4 0 16\nTemporalidad verbal\nO–V 0 0 0 0 0 0\n(O–V)oV 0 0 0 2 0 9\nTotal de pretéritos y copretéritos 7 2 17 18 55 44\nNota: Pre: pretérito, Co: copretérito, O–V: anterioridad al momento de la enunciación, (O–V)oV: simultaneidad respecto a un momento anterior \na la enunciación.']","I'm sorry, but the provided context does not mention any specific challenges faced by researchers in the field of translation studies in Jalisco. If you have any other questions or need information on a different topic, feel free to ask!"
Who is Carrasco and what is their relevance in the context of language assessment research?,"['cAmBio ASPectuAl en loS tiemPoS Perfecto SimPle y comPueSto del eSPAñol mexicAno Al respecto, Squartini y Bertinetto (2000: 419) discuten precisamente la interpreta - ción diacrónica de estos estadios y sugieren una hipótesis en la que el estadio 2 puede ser un paso ajeno a la gramaticalización del ppc hacia valores perfectivos, la cual será abordada en las conclusiones. Con estas observaciones, pasaré al análisis. corpus y anáLisis de Los datos Brevemente comentaré las características del corpus que utilicé para este trabajo. Tomé tres cortes temporales: la primera mitad de los siglos xvii, xix y xxi. El motivo de esta segmentación fue recuperar documentación que incluyera un periodo colonial ya consoli- dado (casi un siglo después de la llegada española), así como mostrar datos actualizados del s. xxi, que ya estaban disponibles. La selección del corpus se justifica a partir de la dis- ponibilidad de géneros replicables en estos mismos cortes, de modo tal que se utilizaron 6 géneros: crónica, prosa literaria, teatro, periódicos, documentos personales —que abar- can blogs para el s. xxi y los Documentos lingüísticos de la Nueva España (dlne) (Company 1994) para los siglos xvii y xix—, así como entrevistas orales provenientes del Corpus sociolingüístico de la Ciudad de México (cscm) (Martín Butragueño y Lastra 2011). El uso de materiales de habla oral en el s. xxi sólo considera el análisis de la oralidad en este siglo y no propone, en modo alguno, un análisis de la oralidad para los siglos xvii y xix. Para que los resultados del análisis de cada siglo fueran comparables en términos cuantitativos, establecí una muestra base de 10 mil palabras para cada género, y a partir de dicha muestra, se seleccionaron los verbos en análisis que aparecían. Sin embargo, hubo restricciones de documentación en el periodo abordado: el s. xxi contiene infor- mación de los seis géneros; en los s. xix y xvii no hay entrevistas orales, y en el s. xvii (durante la primera mitad) no hay registro de periódicos de la época. De este modo, el universo de palabras entre siglos difiere y hablaré entonces de proporciones de uso. Pretérito Perfecto Simple Empezaremos analizando el pps y su aparición con adverbios hodiernales. Nuestros datos confirman lo que otros autores han descrito para español en general (Moreno de Alba 2006; Carrasco 2008; rae y asale 2009): que el pps tiene un contenido aspectual perfectivo y que este contenido es constante diacrónicamente en el español mexicano, pues en los tres siglos observamos que el 100% de las situaciones catalogadas como eventos tuvieron una lectura de inclusión total, donde el tsit se incluye completamente en el tt de la oración. En este caso, hablamos de eventos flexionados en pretérito simple, como en José caminó una calle, donde el evento de caminar se expone como concluido dentro de un periodo, el cual es anterior al tu. En contraste con esto, el uso de los contextos hodiernales refiere un cambio impor - tante en el pps del español mexicano. En la tabla 3 vemos los porcentajes de aparición de dichos contextos en el corpus. Como se puede apreciar, en el s. xvii hay 8 casos, pos- 35 LM V-2']","Carrasco is mentioned in the context in relation to analyzing language assessment tools for bilingual individuals in different contexts. The text discusses the aspectual perspective in the Simple and Compound Past Tenses of Mexican Spanish, where Carrasco's work is referenced alongside other authors like Squartini and Bertinetto (2000) in the diachronic interpretation of these stages. Carrasco's contribution is highlighted in the analysis of verb usage across different genres and time periods, particularly focusing on the aspectual perfective content of the Pretérito Perfecto Simple in Mexican Spanish.",single_hop_specifc_query_synthesizer,"['A partir de este sustento teórico, la aplicación del procedimiento para validar y \ndeterminar la terminología común del dominio a partir de nuestros datos const ó de \ntres pasos. Primero, partimos de los listados de candidatos a términos obtenidos de los \ncedularios. Hay que recordar que el total de candidatos ascendía a 4 mil 063, distribui-\ndos de la manera siguiente: 1 mil 114 candidatos para tipo de objeto, 1 mil 091 para \nmateriales, 457 para técnicas, 25 para estilos, 1 mil 336 para regiones, 76 para términos \nasociados, 424 para agentes, 9 para etnias, 4 para oficios y 67 para ramas artesanales.\nSegundo, corroboramos que los términos correspondientes a la lista de términos aso-\nciados, obtenidos mediante la revisión de las cédulas de museos, estuvieran registrados \nen los listados de candidatos a términos obtenidos mediante el método de disponibili -\ndad léxica5. La razón operativa por la cual cotejamos los listados de los cedularios en \nlos listados de disponibilidad terminológica, y no al revés, reside en que el listado es \nmenos numeroso. Esta decisión, naturalmente, acota el proceso a la revisión manual de \nmenos candidatos a términos. En pocas palabras, este ordenamiento nos permitió evitar \n61 búsquedas que no darían ningún resultado. Para ello, hemos usado la herramienta \nde gestión documental, concordancias y análisis textual, antconc (Anthony 2015), la \ncual permite, entre otras cosas, la obtención de concordancias y generación de listas de \nítems léxicos.\nTercero, a partir de las búsquedas por concordancias de antconc, corroboramos \nque también se registrara el candidato a término en los documentos de nuestro corpus. \nDe esta forma, logramos reducir los listados a 58  términos que se documentan en tres \nconjuntos de fuentes terminológicas diferentes. El resultado de este cruce de información \nse representa gráficamente en la figura 8, en la cual se puede observar en color negro \nla intersección de la terminología documentada en cedularios (paso 1), la terminología \ndisponible (paso 2) y la terminología documentada en el corpus o terminología común.\nFigura 8. Representación de la intersección de la terminología disponible, \nla terminología en cedularios y la terminología en el corpus\n5\u2009Estos listados recogen un total de 675 candidatos a términos, distribuidos en seis subdominios: \n237 candidatos para tipo de objeto, 155 para materiales, 106 para técnicas, 86 para estilos, 154 para \nregiones y 37 para términos asociados.\nDocumentación\nen cedularios\nCorpus\nEspecialistas \n(Disponibilidad \nléxica)\n110 cLauDio moLina saLinas\nLM III-2\nLingüística Mexicana. Nueva Época, III (2021), núm. 2: 101-114  \nISSN: 2448-8194', 'Anexos\nAnexo 1. Numerales del 1 al 20 en mixe, cada numeral escrito en una secuencia gráfica\ntu’uk uno mäjktu’uk once 10 + 1\nmajtsk dos mäjkmajtsk doce 10 + 2\ntëkëëk tres mäjktëkëëk trece 10 + 3\nmaktäxk cuatro mäjkmäjkts catorce 10 + 4\nmakoxk cinco mäjkmojkx quince 10 + 5\ntutujk seis mäjktujk dieciséis 10 + 6\nwëxtujk siete mäjkwëxtujk diecisiete 10 + 7\ntuktujk ocho mäjktuktujk dieciocho 10 + 8\ntäxtujk nueve mäjktäxtujk diecinueve 10 + 9\nmäjk 10 ee’px 20\nFuente: Romero (2009)\nAnexo 2. Numerales del 20 al 100 en mixe (intervalos de 10 en 10)\nee’px veinte 20\nee’pxmäjk treinta 20 + 10\nwëxijkxy cuarenta 2 x 20\nwëxijkxymäjk cincuenta (2 x 20) + 10\ntëki’pxy sesenta 3 x 20\ntëki’pxymäjk setenta (3 x 20) + 10\nmakta’pxy ochenta 4 x 20\nmakta’pxymäjk noventa (4 x 20) + 10\nmakë’pxy 100 (5 x 20)\nFuente: Romero (2009)\nAnexo 3. AVISO\nSe informa a la población en general que ya llegó la vacuna de la influenza. Las enfer -\nmeras aplicarán dos veces la vacuna a\n-pacientes con diabetes\n-embarazadas\n-niños de 6 semanas a 11 años\n-adultos mayores\nContamos con 138 dosis disponibles. Acudir por la primera dosis al Centro de Salud de \n8:00 a 12:00 hrs.\n40\nDaniela espinoza y emilia Ferreiro LM V-1 \nLingüística Mexicana. Nueva Época, v (2023), núm. 1: 25-40  \nISSN: 2448-8194', 'Estudios de Lingüística Aplicada, año 38, número 71, julio de 2020, pp. 9–43\ndoi: 10.22201/enallt.01852647p.2020.71.900\nItem analysis of a multiple-choice test of incoming EFL students at a public university  [ 19 ]\nargues that an acceptable value should be set at 0.25 or 0.35, Mad-\nsen (1983) holds that values of 0.15 or above are generally accept-\nable, Alderson et al. (1995) mention that values of 0.40 or above\nare preferred, and Heaton (1988) states that the acceptable values\nrange from 0.30 and above. Following Heaton’s (1988: 182) ad-\nmonition that “[i]tems showing a discrimination index of below\n0.30 are of doubtful use”, the accepted id threshold in the current\nresearch was set at 0.30.\nBefore computing id, it was fi  rstnecessary to arrange the\nscores of the tests in order to identify the high- and low-scorers\n(see Table 3). Then, Flanagan’s method (see Hales, 1972) was uti-\nlized to approximate the correlation coeffi  cient:the top 27.5% of\nthe exams (n = 14) and the bottom 27.5% were analyzed. The id\nvalue of each item was then computed by subtracting the if of the\nlow-scoring group from the if of the high-scoring group for each\nitem, as shown by the following formula:\nTABLE 3. Item discrimination sample\nSTUDENT I 1 I 2 I 3 I 4 I 5 I 46 I 47 I 48 I 49 I 50 TOTAL\nSt 1 1 1 1 1 1 0 0 1 0 1 32\nSt 2 1 1 1 1 1 0 0 0 0 1 31\nSt 3 1 1 1 1 1 0 1 1 0 1 31\nSt 4 1 1 1 1 1 1 1 0 0 0 30\nSt 5 1 1 1 1 1 0 0 0 0 0 30\nSt 46 0 1 1 1 1 0 1 0 1 0 15\nSt 47 0 0 1 1 0 0 0 0 0 1 15\nSt 48 1 1 1 1 0 1 0 0 0 0 15\nSt 49 0 0 1 0 1 0 0 0 0 1 14\nSt 50 1 1 1 1 1 0 1 0 0 0 14\nID = IF of high-scoring group – IF of low-scoring group']","I'm sorry, but there is no mention of Carrasco in the provided context about linguistics articles. Therefore, I cannot provide information about Carrasco's relevance in the context of language assessment research."
What is the significance of the ISSN 2448-8194 in the context of Linguistica Mexicana?,"['Lingüística Mexicana. Nueva Época, v (2023), núm. 2: 25-47 ISSN: 2448-8194']","The ISSN 2448-8194 is associated with the journal Lingüística Mexicana, specifically in its fifth volume from 2023, issue number 2.",single_hop_specifc_query_synthesizer,"['Algunas exploraciones en torno a la reflexión metalingüística sobre la ironía 17\nEstudios de Lingüística Aplicada, año 35, número 66, diciembre de 2017, pp. 9–39\ndoi: 10.22201/enallt.01852647p.2017.66.827\npretación irónica: aunque María literalmente dice que la fiesta estuvo fantástica, \nen realidad quiere expresar que no le gustó.\nSi bien la teoría de Sperber y Wilson (Wilson & Sperber, 1992, 2004) ha \nsido objeto de críticas (al respecto véase, entre otros, Attardo, 2000, y Kalber -\nmatten, 2006), también ha recibido un importante soporte experimental (Kal -\nbermatten, 2006). Por tanto, consideramos que resulta ser una herramienta vá-\nlida para el estudio sobre la manera en que los niños y adolescentes interpretan \nlas expresiones irónicas. Por otra parte, creemos que esta aproximación permite \nanalizar la forma en que un individuo hace una reflexión sobre el lenguaje en sí \nmismo (mención en términos de la teoría de la relevancia, reflexión metalingüís-\ntica en términos de Gombert, 1992).\n1.4. Aspectos que inciden en la interpretación de la ironía verbal\nDesde la propuesta de la teoría de la relevancia (Wilson & Sperber, 1992, 2004) \nse asume que para interpretar un enunciado irónico el oyente debe percatarse de \nque no puede tratarse de una emisión literal. Para lograr lo anterior, cuenta con \ninformación generada por diversas fuentes contextuales. Al respecto, Yus (2000, \n2009) propone que existen siete fuentes contextuales que aportan información \nrelevante para lograr la adecuada interpretación de un enunciado irónico: cono-\ncimiento enciclopédico general (conocimiento que se tiene acerca del mundo: \ninformación social y cultural que permite interpretar más fácilmente una expre-\nsión irónica); conocimiento enciclopédico específico del interlocutor (gustos, \nhábitos, creencias, opiniones y demás información); conocimiento de sucesos o \nacciones que ocurrieron poco tiempo antes de la expresión irónica; enunciados \nprevios a la conversación; comunicación no verbal vocal y visual (entonación, \ngestos faciales, sonrisas); elecciones léxicas o gramaticales (pistas lingüísticas \ncomo adjetivos con connotación de cualidad extrema, adverbios, superlativos, \nrepeticiones innecesarias, frases convencionalmente irónicas) y la información \nproveniente del entorno físico que rodea a los interlocutores. De acuerdo con el \nautor, la presencia / ausencia de dichas fuentes contextuales impactará en el ac-\nceso que pueda tener un individuo a la interpretación irónica. De esta manera, a \nmayor saturación, es decir, a mayor cantidad de fuentes contextuales, más fácil \ny rápida será la interpretación irónica. Específicamente para fines de este estu -', 'Adjetivos\nCotorra. El significado identificado de este adjetivo es ‘que es soltero en una edad en \nla que se considera que las personas deben estar casadas’ ( dem, s. v. solterón) (aunque \nesta palabra está restringida a mujeres), por lo que estaría en competencia con solterona, \nfrente a la cual cotorra sería un disfemismo, como muestra (6).\n(6)\nE: Cuando una muchacha tiene ya 20, cómo, ya no tiene chance de casarse, \n¿cómo le dicen?\nI: Que ya se le pasó el camión.\nE: Ahh\nI: Que ya se le está pasando el camión.\nE: Mmm ¿no les dicen cotorras?\nI: Pues sí, pero… Pues depende de la confianza que tenga una con aquella persona.\nE: Pero así de mucha confianza.\nI: Ah, sí, pos sí, ya le dice: “Ay, ya se te está pasando el camión,  ya estás bien \ncotorrita”. Así se le dice (chrm).\nEste intercambio entre la informante y el investigador inicia con la primera utilizan-\ndo un eufemismo ( ya se le pasó el camión ) para referirse a la mujer soltera, y el inves -\ntigador le pregunta sobre el potosinismo cotorra, tras lo cual ella acota su situación de \nuso a un contexto familiar (depende de la confianza que tenga con aquella persona), lo que \nmuestra que, más que un eufemismo, se trata de un disfemismo.\nEn cambio, no apareció ni en la encuesta de redes sociales ni en el cscslp, por lo que \nfue pertinente evaluar la variable edad y su incidencia en su reconocimiento con mayor \ndetenimiento. Finalmente, antes de pasar a los resultados, es importante señalar que \nesta palabra fue documentada en dos regiones muy alejadas entre sí: por un lado, fue \nusada por el político Hugo Luna en Jalisco; por otro, como comentario a este texto, una \ninformante de Puebla refirió que conoce este uso adjetival. Por esta razón, su extensión \ndialectal es mucho más amplia que la del resto de palabras de este trabajo.\nEl grupo I2 fue el que mayor representación tuvo de esta palabra (70.5%), seguido \npor el I1 (61%). Sumado a esto, la respuesta contraintuitiva (‘loca’) tuvo mayor repre -\nsentación en el grupo I1 (10%) frente al I2 (7%); además, el desconocimiento de la voz \nestuvo más presente en I1 (28%) que en I2 (22%). Estos datos pueden ser indicadores \nde una tendencia a la innovación en la capital, que evitaría palabras en proceso de des -\naparición (provocada por los cambios sociales a través de los cuales se ha dejado de es-\ntigmatizar a estas mujeres).\nEn cuanto a la edad, la generación más joven reconoce cada vez menos esta palabra, \ncomo indican los resultados del análisis de regresión logística, ya que ésta desfavoreció \nel uso de cotorra (0.332). En contraste, las generaciones más viejas, G2 y G3, favore -\ncieron el significado esperado (0.948 y 100% de apariciones). Esta diferencia etaria \n140 Valeria bocanegra y miguel PasTrán\nLM IV-2 \nLingüística Mexicana. Nueva Época, IV (2022), núm. 2: 125-152  \nISSN: 2448-8194', 'Estudios de Lingüística Aplicada, año 38, número 71, julio de 2020, pp. 9–43\ndoi: 10.22201/enallt.01852647p.2020.71.900\n[ 20 ]  Kenneth Geoffrey Richter & Ricardo Alejandro Medel Romero\nOnce an item discrimination index was created, it was necessary\nto scrutinize the results in order to discover why certain items had\nlow discrimination scores.\n3.4.  Response frequency distribution\nThe response frequency distribution (rf) analysis was conducted\nto explain the fi  ndingsof the id procedure described above; that\nis, it was necessary to analyze in more detail why certain items re-\nceived good or bad id values. One of the goals of the rf analysis is\nto ascertain which distractors are more appealing to certain scorers\n(high or low). It is the aim of a rf analysis to compare the number \nof responses of each groupon certain items to fi n dthe level of dis-\ncrimination (Bailey,1998). It also shows the frequency with which\ntest items are selected by different groups.\nA total of 28 tests and their responses were analyzed statisti-\ncally. To carry out this analysis, once again, only the top-scoring\nand the bottom-scoring tests were recorded in Excel. First, the test\nitems were ordered from 1 to 50. Subsequently, a space for low-\nand high-scorers was assigned to every item. Finally,columns were\nassigned to the different distractors (A, B, C, and D in the case of\nthe grammar and reading sections, and A, B, and C in the case\nof the listening section). The number of times each option was\nselected by the low- and high-scorers was entered. In this way,\na comparison could be made between the preferences of the two \ngroups concerning the items, as shown in Table 4.\n(continued )\nTABLE 3. Item discrimination sample\nSTUDENT I 1 I 2 I 3 I 4 I 5 I 46 I 47 I 48 I 49 I 50 TOTAL\nIF upper 1.00 1.00 0.93 0.93 0.71 0.21 0.36 0.29 0.21 0.57\nIF lower 0.64 0.71 1.00 0.57 0.50 0.21 0.29 0.21 0.21 0.36\nID 0.36 0.29 -0.07 0.36 0.21 0.00 0.07 0.07 0.00 0.21\nNote: Some columns and rows have been hidden for space.']","I'm sorry, but the ISSN 2448-8194 is not mentioned in the provided context about Linguistica Mexicana. If you need information about a specific ISSN related to Linguistica Mexicana, you may need to refer to the specific publication or database where that ISSN is associated."
What are some challenges faced by the Deaf community in Mexico regarding language acquisition?,"['Primeras configuraciones manuales en niños sordos en edad escolar Las lenguas de señas son sistemas lingüísticos de modalidad visogestual que hacen uso del espacio de forma gramatical. En México, casi todos los Sordos usuarios de una llss utilizan la lsm, la cual tiene sus propias reglas sintácticas y gramaticales que difie- ren del español y de otras llss. Se estima que, en México, cerca del 1.2% de la población presenta algún grado de sordera (inegi, 2021), pero no todas las personas con discapa- cidad son señantes de la lsm. En este sentido, Cruz-Aldrete (2021) indica que una de las causas principales de que la comunidad Sorda sea heterogénea lingüísticamente es que no se ha garantizado la adquisición de una primera lengua. Por otro lado, es significati- vo que una parte importante de la comunidad Sorda en México se comunica a través de la lsm, y que no sólo los Sordos hacen uso de este idioma, sino también los familiares, intérpretes y las personas que aprenden la lsm por motivación propia. A pesar de la implementación de políticas de inclusión, todavía existen asuntos pen- dientes que, como sociedad, debemos resolver. Uno de ellos está en el contexto educati- vo que afecta todos los niveles. Aunque algunos Sordos logran terminar la universidad y posgrados, los miembros de esta comunidad continúan enfrentando desafíos que afectan sus primeros años de vida, lo cual tiene un impacto negativo en las individualidades y representa una barrera comunicativa. Se estima que cerca del 90% de los niños con discapacidad auditiva nacen en fami- lias oyentes (Mitchell y Karchmer 2004). Esto supone, además de la posible adquisición tardía de un sistema comunicativo, una menor interacción social, la cual limita la acti- vidad lingüística. Caso contrario es el contexto en el cual un infante Sordo experimenta las habilidades comunicativas con los adultos Sordos. Morgan y Botting (2021) indican que en estos contextos impera una comunicación de tipo visogestual, la cual facilita la interacción entre padres e hijos. Los mismos autores indican que la interacción con los progenitores provee el andamiaje a través del cual los niños pueden compartir sus in - tenciones comunicativas, dando las bases necesarias para facilitar la socialización y el desarrollo del lenguaje.  Las lenguas de señas son sistemas lingüísticos de modalidad visogestual que hacen uso del espacio de forma gramatical. En México, casi todos los Sordos usuarios de una llss utilizan la lsm, la cual tiene sus propias reglas sintácticas y gramaticales que difie- ren del español y de otras llss. Se estima que, en México, cerca del 1.2% de la población presenta algún grado de sordera (inegi, 2021), pero no todas las personas con discapa- cidad son señantes de la lsm. En este sentido, Cruz-Aldrete (2021) indica que una de las causas principales de que la comunidad Sorda sea heterogénea lingüísticamente es que no se ha garantizado la adquisición de una primera lengua. Por otro lado, es significati- vo que una parte importante de la comunidad Sorda en México se comunica a través de la lsm, y que no sólo los Sordos hacen uso de este idioma, sino también los familiares, intérpretes y las personas que aprenden la lsm por motivación propia.']","One of the main causes of linguistic heterogeneity within the Deaf community in Mexico is the lack of guaranteed acquisition of a first language. Additionally, despite the implementation of inclusion policies, unresolved issues persist, especially in the educational context, affecting all levels. Many Deaf individuals continue to face challenges impacting their early years, leading to negative impacts on their individualities and creating communication barriers.",single_hop_specifc_query_synthesizer,"['Estudios de Lingüística Aplicada, año 37, número 70, diciembre de 2019, pp. 9–36\ndoi: 10.22201/enallt.01852647p.2019.70.869\n[ 34 ]  Ittay Gil Carrillo\nNEELY, JaMEs (1991).  Semantic priming effects in visual word recognition: A \nselective review of current fi  ndings and theories. En Derek Besner \n& Glyn W. Humphreys (Eds.), Basic processes in reading: Visual \nword recognition (pp. 264–336). Hillsdale: Erlbaum.\npapaFRaGOU, aNNa, & MUsOLINO, JULIEN (2003).  Scalar implicatures: Experiments at the \nsemantics-pragmatics interface. Cognition, 86(3), 253–282.\npEREa, MaNUEL, & R Osa, Eva (2002).  Does the proportion of associatively related \npairs modulate the associative priming effect at very brief stimu-\nlus-onset asynchronies? Acta Psychologica, 110(1), 103–124.\nspERBER, DaN, & WILsON, DEIRDRE (1995).  Relevance: Communication and cognition. \nOxford: Blackwell.\nvaN TIEL, BOB; vaN MILTENBURG, EMIEL; ZEvaKHINa, NaTaLIa, & G EURTs, BaRT (2016).  Scalar diversity. \nJournal of Semantics, 33(1), 137–175.\nvILLasEÑOR, GaLa KaRINa (2017).  Interpretación de términos numéricos: un estudio \nempírico. Estudios de Lingüística Aplicada, 35(66), 135–172.\nZEvaKHINa, NaTaLIa (2012). Strength and similarity of scalar alternatives. En Ana \nAguilar Guevara, Anna Chernilovskaya & Rick Nouwen (Eds.), Pro-\nceedings of Sinn und Bedeutung 16 (V ol. 2, pp. 647–658). Utrecht: \nmit Working Papers in Linguistics.', 'La tabla 5 resume los casos hallados en el niño Luis, los cuales visiblemente son \npocos, en comparación con las dos primeras. No obstante, coincide con ellas en los \nresultados de las variables 1 y 2, en cuanto a la casi totalidad de los datos concordan -\ntes. En cambio, las evidencias de las variables 3 y 4 son disímiles en contraste con las \nniñas, porque él apenas logra obtener nueve nominales distribuidos en ambas variables \ny, aunque sí hay discordancias, los ejemplos resultan escasos para ser representativos. \nAsí, los datos de Luis muestran una etapa inicial en donde la concordancia de número \ncorresponde únicamente a la que denominamos superficial.\nTabla 5. Las cuatro variables y la presencia de concordancia y discordancia en Luis\nVistos y analizados los resultados de cada niño, es destacable que las variables 1 y 2 \npresenten porcentajes muy altos de concordancia, y que en las variables 3 y 4 aparezcan \nmás casos discordantes. En el desglose individual, Luis representa un primer momento \nen el que no se muestra algún tipo de análisis en la estructura de sus frases nominales; \nNatalia, al tener los datos más altos de discordancias en la cuarta variable, se coloca en \nun punto intermedio de nuestra propuesta de adquisición de la concordancia de núme -\nro, y Tita, por el periodo de edad próximo a los tres años, ha logrado una concordancia \nde número efectiva. \nEl análisis anterior subraya la necesidad de observar las producciones de los tres \nniños en su desarrollo lingüístico temporal para corroborar las conclusiones obtenidas \na partir de cada tabla. Debido a que la cuarta variable resultó ser la más representativa \npor tratarse de la que presenta la mayor variabilidad en la construcción de una frase \nnominal, es la única que se desglosará en este enfoque particular. \nPara una comprensión óptima de los resultados, cabe aclarar que las gráficas si -\nguientes muestran el número de frecuencias de aparición de cada caso y el orden en \nque las presentamos atiende a nuestra propuesta de adquisición de la concordancia \nde número. Si un mismo nominal tiene tres datos concordantes y dos discordantes,  \nVariable Concordancia Discordancia Ejemplos\n1\nDeterminante con forma única + \nnominal con forma única\n38 (100%) Un dino <dinosaurio>\n(Luis 2:08)\n2\nVarios determinantes con forma única \n+ nominal con forma única\n26 (96%) 1 (4%) E ito <quito> os zapatos\n(Luis 2:03)\n3\nDeterminante con contraste +  \nnominal con contraste\n1 (20%) 4 (80%)\nSu amico\n(Luis 2;07)\nSu amicos\n(Luis 2:07)\n4\nVarios determinantes con contraste + \nnominal con contraste\n2 (50%) 2 (50%)\nU yayó <ratón>\n(Luis 2:02)\nLos latones\n(Luis 2:06)\n108 zuLeykA mAhiTzé oLverA yAbur\nLM II-1 \nLingüística Mexicana. Nueva Época, II (2020), núm. 1: 101-115  \nISSN: 2448-8194', 'Gráfica 8. Porcentaje total de discordancias por lengua\nGráfica 9. Porcentaje total de discordancias por lengua y por grado escolar\nTabla 4. Discordancias\nCódigo Ejemplos\n1CaE3º\n2AE4º\n3MaE5º\n4CeM3º el niño lo busco [el niño la buscó a la rana] \n5YM4º no lo encontraba [no la encontraba]; lo buscaba [la buscaba]; no lo encon-\ntró [no la encontró]; lo fue a buscarlo [la fue a buscarla]\n6KM5º y se lo yebo [y se la llevó]\n7GO3º lo puso [la puso]; lo busco [la buscó]; y lo busco [y la buscó]\n8HO4º\n9MiO5º Lo atraPo [la atrapó]\n10MaM3º se lo comio [se la comió]\n11SUM4º avuscarlo [a buscar la]; y lo ymconmtro [y la encontró]\n12DM5º lo bentana [la ventana]\nEspañol Mazahua Otomí Mazateco\n1.4\n1.2\n1\n0.8\n0.6\n0.4\n0.2\n0\nPorcentaje total  \nde la producción\nEspañol Mazahua Otomí Mazateco\n3º 4º 5º\n4.5\n4\n3.5\n3\n2.5\n2\n1.5\n1\n0.5\n0\nPorcentaje total \nde la producción\n32 Rebeca baRRiga VillanueVa\nLM I-3 \nLingüística Mexicana. Nueva Época, I (2019), núm. 3 (Especial): 17-40  \nISSN: 2448-8194']","I'm sorry, but I couldn't find specific information about challenges faced by the Deaf community in Mexico regarding language acquisition in the provided context. This text focuses on linguistic studies related to children's language development and concordance in number agreement. If you have any other questions or need information on a different topic, feel free to ask!"
What are some challenges faced by the Sordos community in terms of language development and communication?,"['A pesar de la implementación de políticas de inclusión, todavía existen asuntos pen- dientes que, como sociedad, debemos resolver. Uno de ellos está en el contexto educati- vo que afecta todos los niveles. Aunque algunos Sordos logran terminar la universidad y posgrados, los miembros de esta comunidad continúan enfrentando desafíos que afectan sus primeros años de vida, lo cual tiene un impacto negativo en las individualidades y representa una barrera comunicativa. Se estima que cerca del 90% de los niños con discapacidad auditiva nacen en fami- lias oyentes (Mitchell y Karchmer 2004). Esto supone, además de la posible adquisición tardía de un sistema comunicativo, una menor interacción social, la cual limita la acti- vidad lingüística. Caso contrario es el contexto en el cual un infante Sordo experimenta las habilidades comunicativas con los adultos Sordos. Morgan y Botting (2021) indican que en estos contextos impera una comunicación de tipo visogestual, la cual facilita la interacción entre padres e hijos. Los mismos autores indican que la interacción con los progenitores provee el andamiaje a través del cual los niños pueden compartir sus in - tenciones comunicativas, dando las bases necesarias para facilitar la socialización y el desarrollo del lenguaje. La imitación como precursora del lenguaje La adquisición del lenguaje se desarrolla a partir de la combinación de factores biológi- cos y de las interacciones con el mundo, las cuales dependen, entre otros, del contexto lingüístico (Carvalho, Lemos y Goulart 2016; Tomasello 2005; Peralta 2000). En un estudio realizado en niños con autismo se encontró que “la imitación gestual y facial, la imitación de posturas de mano no significativas, imitación de acciones con la boca (con y sin sonido), la imitación corporal sencilla y la imitación bocal” pueden ser habilidades precursoras del lenguaje (Mitre 2015). En comparación, existe una considerable litera- tura académica que ha abordado la relación entre habilidades motrices y el lenguaje en diversas poblaciones, incluyendo niños con trastorno específico del lenguaje (tel ). Por ejemplo, Marton (2009) observó que los niños con tel enfrentaban desafíos significa- tivos en la imitación de gestos y posturas, así como en la organización y control de los movimientos del cuerpo. Estos hallazgos respaldan la idea de que las dificultades motri- 51 LM V-2 Lingüística Mexicana. Nueva Época, v (2023), núm. 2: 49-71 ISSN: 2448-8194']","Although some Sordos manage to complete university and postgraduate studies, members of this community continue to face challenges that affect their early years, leading to negative impacts on individualities and creating a communication barrier. Approximately 90% of children with hearing disabilities are born into hearing families, potentially resulting in delayed acquisition of a communicative system and limited social interaction, hindering linguistic activity.",single_hop_specifc_query_synthesizer,"['Procesamiento de discurso: relaciones semánticas, expectativas del lector y modelos mentales 23\nEstudios de Lingüística Aplicada, año 37, número 69, julio de 2019, pp. 9–35\ndoi: 10.22201/enallt.01852647p.2019.69.828\nCuadro 3. Porcentajes de completamientos dentro de la dimensión causal / contracausales vs. otras relaciones \nsemánticas, totales y por instancia\nrelaCiones totales (%)\ninstanCia (%)\nPrimera Segunda Final\nCausales\n(causales + consecutivas) 58.1 52.4 66.1 55.6\nContracausales\n(adversativas + concesivas) 41.9 47.6 33.9 44.4\nCausalidad global\n(causales + contracausales) 79.8 68.0 75.0 98.2\nOtras 20.02 32.0 25.0 1.8\nCuadro 4. Porcentajes de completamientos sin partícula conectiva presente (s / C) vs. con partícu-\nla conectiva presente (c / C) por tipo de relación semántica en dos primeras instancias\nrelaCiones\ntotales (%)\nc / C s / C\nCausal 80.0 20.0\nConsecutiva 67.6 32.4\nAdversativa 87.9 12.1\nConcesiva 100.0 ---\nAditiva 40.5 59.5\nTemporal 75.0 25.0\nFinal 95.0 4.5\nContraste 100.0 ---\nComparativa 100.0 ---\nPara el tratamiento estadístico, se procedió a realizar la transformación logística \nde los datos de frecuencias (proporción o porcentaje) requerida para poder llevar \nadelante de modo adecuado las pruebas de comparación de medias (Jaeger, 2008; \nWoods, Fletcher & Hughes, 1996). Así, se calculó un coeficiente para cada varia-\nble de interés por sujeto (por ejemplo, número de completamientos causales sobre \ncantidad de completamientos totales), siempre sobre los casos de continuaciones \ncon relación única. Se computaron los datos de frecuencias totales y por instancia \nde completamiento.', '22 Gabriela Mariel Zunino\nEstudios de Lingüística Aplicada, año 37, número 69, julio de 2019, pp. 9–35\ndoi: 10.22201/enallt.01852647p.2019.69.828\nCuadro 1. Ejemplos de completamientos para cada una de las relaciones analizadas\nrelaCión ejemplos Completamiento\nCondicional\nHace tiempo que Damián quería comprar un televisor nuevo. Además, le gusta mucho el fútbol y ya \nllega el mundial. Ahora está a principio de mes y acaba de cobrar… piensa si pagarlo en efectivo \no con tarjeta.\nFinal\nBelén era suplente en su equipo de vóley desde hacía tiempo. Un mes antes de la primera com-\npetencia internacional, empezó a entrenar el doble que sus compañeras… para poder obtener la \ntitularidad dentro del equipo.\nContraste\nRamiro es un alumno promedio de quinto año del secundario. En los próximos meses debe empe-\nzar a pensar qué carrera universitaria seguir. Ninguna materia le gustó especialmente durante la \nsecundaria… pero también pensaba en otras cosas que le gustaban.\nComparativa Los actores se comprometieron con ese plan y trabajaron de sol a sol… tal como estaba previsto.\nComplemento\nManuel tiene problemas de presión muy alta. El médico le indicó que comiera sin sal y le prohibió \ncualquier tipo de fiambre. Todavía sigue comiendo muchas cosas con sal: se resiste a dejar el \njamón crudo y las aceitunas… que traen las pizzas.\n* Vale aclarar que todas las consecutivas, por definición, exhiben un componente temporal, pero no pueden ser consideradas solo como rela-\nciones temporales, ya que, además y especialmente, marcan una relación más específica como la de causa-efecto.\nCuadro 2. Porcentajes de tipos de completamientos totales y por instancia (sobre un total de 300)\nrelaCiones totales (%)\ninstanCia (%)\nPrimera Segunda Final\nEncadenadas 21.5 19.1 18.3 26.6\nÚnicas 78.5 80.7 81.3 73.7\nCausal (C) 9.4 16.2 10.7 0.5\nConsecutiva (C) 36.9 19.5 38.9 53.9\nAdversativa (CC) 32.2 32.4 22.1 43.4\nConcesiva (CC) 1.1 -- 3.3 --\nAditiva 12.2 18.7 16.0 0.9\nTemporal 1.1 1.7 1.6 --\nCondicional 0.1 -- -- 0.5\nFinal 3.1 8.3 0.8 --\nContraste 0.4 -- 0.8 0.5\nComparativa 0.1 3.3 0.4 --\nComplemento 3.0 -- 5.3 --\nc = Dimensión causal\ncc = Dimensión contracausal\n(continuación )', 'Primeras configuraciones manuales en niños sordos en edad escolar\nDurante su primer año, los infantes Sordos ya comienzan a copiar personajes, ani-\nmales y personas. Adicionalmente, las señas que realizan tienden a utilizar las partes \nmás próximas al cuerpo antes que las extremidades (Meier 2012: 590). Posteriormente, \na los dos años, los niños Sordos registran un cambio en cuanto a la forma de realizar las \nconfiguraciones de mano al corregirlas, ya sea de manera autodirigida o mediante las \nindicaciones. \nMamá Lía explica que su hijo comenzó a esa edad a corregir algunas configuraciones \nde la mano al tiempo que comenzó a producir términos de parentesco. \nAntes, mi bebé Sordo [decía] papá (cm : v)\n6 que cambió por papá ( cm: p). A los \ndos años le dije que se hacía con <p>, no <v>, y lo entendió. Otras señas que \ntambién comenzó a entender fueron ‘mamá’, ‘abuela’, ‘tío’, ‘prima’. \nMamá Olé nos cuenta que una de las primeras señas que produjo su hija fue la que \ncorresponde a ‘perdón’, pero no la realizaba con la cm <y>, como lo hacen los adultos, \nsino que la realizaba con la cm <s>, la cual es la no marcada en términos articula -\ntorios. Este proceso también se registra en la lengua de señas americana ( asl, por sus \nsiglas en inglés), donde la cm <y> es posterior en términos cronológicos a la cm <s> \n(Lillo-Martin et al. 2020: 97).\nEn este estudio registramos que las primeras cm que adquieren los infantes Sordos \nen la lsm suelen corresponder a <b>, <s> y <v>\n7 del alfabeto dactilológico8. Pos-\nteriormente adoptarán formas más complejas como <m>, <t> y <p>. Estas últimas \nconfiguraciones se comienzan a producir a los 24 meses de edad, y algunas de éstas \nsuelen reemplazar las formas no marcadas.\xa0 \nEn un estudio de adquisición de la lsm en infantes de una primaria bilingüe lsm-es-\npañol, Cruz-Aldrete (2018) dio cuenta de que el 30% de las señas producidas por niños \nincluyeron las cm que corresponden a <b>, <s> y <d>\n9. De hecho, las dos primeras \ncm son coincidentes con las que reportan las mamás Sordas que entrevistamos como \nprimeras producciones de sus hijos. \nAlgunas de las primeras señas que realizan los infantes Sordos suelen ser términos \nde parentesco como ‘mamá’, ‘tío’ y ‘papá’, que en lsm son inicializadas, es decir, se \nrealizan con una letra en el alfabeto dactilológico de la lsm. Sin embargo, las primeras \nproducciones de los infantes Sordos no necesariamente corresponden a la convención \n6\u2009La nomenclatura hace referencia a cm=Configuración Manual. En este caso corresponde a la \nletra <v>  del alfabeto dactilológico de la lsm. Ésta y las demás cm se presentan en el anexo. \n7\u2009Estas cm también se han descrito de baja complejidad, por lo tanto, son de las primeras que se \nproducen desde un punto de vista articulatorio (Brentari 2012: 41). \n8\u2009El alfabeto dactilológico de la lsm incluye todas las configuraciones manuales que tiene el alfa-\nbeto del español y se usa en situaciones de contacto lingüístico para deletrear préstamos lingüísticos \ny nombres. Sin embargo, la lsm tiene una mayor cantidad de configuraciones manuales.\n9\u2009La cm <1> corresponde a la seña que hemos advertido; se utiliza para señalar al referente y \nacompaña frases nominales en las primeras producciones infantiles.\n57\nLM V-2\nLingüística Mexicana. Nueva Época, v (2023), núm. 2: 49-71\nISSN: 2448-8194']","I'm sorry, but the provided context does not contain information about the challenges faced by the Sordos community in terms of language development and communication. This text specifically discusses linguistic studies related to speech processing, semantic relationships, and mental models. If you have any other questions or need information on a different topic, feel free to ask!"
What is the significance of Cruz-Aldrete in the context of language development?,"['Primeras configuraciones manuales en niños sordos en edad escolar nificado deseado; también están influenciadas por factores como la maduración motora y la práctica. A medida que se adquiere experiencia y habilidad en la llss, la capacidad para realizar praxias se vuelve más fluida y precisa. Sin embargo, este concepto no se debe confundir con configuración manual (cm), que se refiere a la posición y forma que adoptan uno o ambos articuladores manuales (Callejas 2019). Más específicamente, im- plica el movimiento o inhibición 4 de los articuladores de la mano. Las primeras cm que producirá un niño Sordo son predecibles, pues coordinan en conjunto todos los dedos de la mano antes de producir otras formas que seleccionan específicamente uno o varios dedos. La precisión en la selección y dominio de arti- culadores de la mano se incrementa con la edad y con la apropiación del vocabulario (Cruz-Aldrete 2016), aunado a un mayor uso de la gesticulación y del espacio señante, lo que convergerá en una mayor complejidad al ejecutar las cm. Aunque praxia y cm son conceptos distintos, existe una significativa superposición entre ellos en términos de sus contribuciones motoras y el papel de ambos en el proce- samiento del lenguaje, y, particularmente, en las llss. Primero, tanto las praxias como la cm implican precisión en la coordinación motora fina. Ambos procesos requieren la coordinación de movimientos específicos para lograr una comunicación efectiva. Par- ticularmente, la cm se vuelve especialmente relevante en las llss, donde la forma y posición de las manos y los dedos representan unidades lingüísticas, que conforman la estructura discursiva. Por otro lado, tanto las praxias como la cm implican una alta inte- gración perceptual (Lai et al. 1996). En las praxias se requiere la integración precisa de la retroalimentación sensorial para monitorear y ajustar los movimientos motores con el fin de lograr la precisión y la corrección. Del mismo modo, la cm se basa en la inte- gración de información visual y propioceptiva para garantizar la formación y posición adecuadas de las manos y los dedos. Contexto ideal para adquirir una lengua visogestual Si bien la situación lingüística de los Sordos que se desarrollan en el contexto de una familia oyente no suele ser favorable debido a la ausencia de un idioma de modalidad visogestual, si un Sordo desarrolla su infancia temprana con usuarios de una llss la situación es radicalmente distinta, pues adquirirá un idioma natural en sus primeros años de vida. Sin embargo es común encontrar que los padres oyentes no suelen utilizar una llss en el contexto hogareño, a pesar de que los primeros cuatro años de vida son significativos para la adquisición (Cerdas y Murillo 2017), y es el periodo en el cual la imitación cobra un papel especial para el desarrollo del lenguaje, la socialización y las habilidades motrices. 4 La inhibición motora se refiere al proceso en el cual ciertas acciones son suprimidas, lo que permite la selección y ejecución de movimientos específicos. Lo anterior es crucial para refinar la conducta motriz porque asegura su precisión y coordinación. 53']","Cruz-Aldrete (2016) highlights the importance of hand articulator mastery and vocabulary acquisition in sign language users. It emphasizes the progression from basic manual configurations to more complex ones, influenced by age and language proficiency. The concept distinguishes between manual configurations and praxias, both crucial for fine motor coordination and effective communication, especially in sign language structures.",single_hop_specifc_query_synthesizer,"['anExo 1\nVocablo Diccionario de america-\nnismos\nDiccionario etimológico \ndel lunfardo (Conde, \n2004)\nNovísimo diccionario lun-\nfardo (Gobello y Oliveri, \n2005)\na cara o ceca x\naguantadero x x x\napretar x x x\nbacán x x x\nboliche x x x\nbolo x x x\nbuchón x\nbufarrón x\nbulín x x x\nbulo x x\ncachirla x\ncana x x\ncaño x\ncapote x\nchiche x\ncortada x\ncosturón x\ndato x\nencanastar x\nentrador x\nentregador x x x\nfariña x\nfarolear x\nfierro x\nflaco x\nfono x\ngaucho x\ngavilla x\ngrosso x\nguanaco x\nguita x x x\nmalandra x x x\n82 daniel casado gallegos y carlos yeudiel Puebla rodríguez\nLM IV-2 \nLingüística Mexicana. Nueva Época, IV (2022), núm. 2: 57-84  \nISSN: 2448-8194', 'Hopkinson fue domesticante, en tanto que la variación rioplatense se enmarca en las \nposibilidades de un registro informal del inglés estándar que no toma en cuenta los giros \ndialectales que aparecen a lo largo del primer capítulo de Plata quemada. \nComo sugerencias para futuras investigaciones en torno a este tema, recomendamos \nla consulta de fuentes lexicográficas en formato físico sobre la variante rioplatense. \nUna de las limitantes de nuestro trabajo fue que únicamente pudimos acceder a fuentes \nsecundarias en línea. De la misma forma, aconsejamos el acercamiento con un mayor \nnúmero de hablantes nativos del francés e inglés para verificar que el registro de las \nunidades léxicas traducidas sea equivalente en cada lengua. \nBiBliografía\nAcademia Argentina de Letras. 2008. Diccionario del habla de los argentinos . Buenos Ai-\nres: Emecé Editores.\nAsociación de Academias de la Lengua Española. 2010. Diccionario de americanismos, en \n<https://www.asale.org/obras-yproyectos/diccionarios/diccionario-de-americanis-\nmos> [consultado en octubre de 2020].\nAugusto, Gerardo. 2016. “El lunfardo en la evolución del español argentino”, Literatu-\nra y Lingüística 34: 335-356.\nCarr, Karin. 2013. Métodos y técnicas de traducción de los culturemas en la versión espa -\nñola de Skumtimmen, de Johan Theorin, tesis de maestría. Estocolmo, Suecia: Univer-\nsidad de Estocolmo. \nChesterman, Andrew. 2016. Memes of Translation. The Spread of Ideas in Translation \nTheories. Revised Edition. Ámsterdam: Benjamins.\nConde, Oscar. 2016. “Lunfardo rioplatense: delimitación, descripción y evolución”, en \nDe parces y troncos. Nuevos enfoques sobre los argots hispánicos. España: Edicions de la \nUniversitat de Lleida, pp. 77-105.\nConde, Oscar. 2010. “El lunfardo en la literatura argentina”, Gramma. Revista de la Es-\ncuela de Letras 47: 224-246.\nConde, Oscar. 2004. Diccionario etimológico del lunfardo. Buenos Aires: Taurus.\nCoseriu, Eugenio. 1986. Introducción a la lingüística. Madrid: Gredos. \nMerriam-Webster.com. 2020. <https://www.merriam-webster.com/> [consultado en \noctubre de 2020].\nEtchebarria, Maitena. 2013. “La variación lingüística: precisiones en torno a la noción \nen diversas teorías lingüísticas”, Oihenart: cuadernos de lengua y literatura , 28: 207-\n239.\nFranco, Erik. 2019. “Tipología descriptiva del galicismo y el anglicismo léxicos”, Lin-\ngüística Mexicana. Nueva Época 1: 107-140. \nGobello, José y Marcelo Oliveri. 2005. Novísimo diccionario lunfardo . Buenos Aires: \nCorregidor.\nGonzález, Daniela. 2016. “El lunfardo: ¿un habla de delincuentes que quedó en el pa-\nsado?”, Revista de Filología y Lingüística de la Universidad de Costa Rica 42: 107-118.\n80 daniel casado gallegos y carlos yeudiel Puebla rodríguez\nLM IV-2 \nLingüística Mexicana. Nueva Época, IV (2022), núm. 2: 57-84  \nISSN: 2448-8194', 'anglicismos, mexicanismos y cómo Traducirlos\nmarco tEórico\nAlgunos conceptos que serán fundamentales para este estudio son los de anglicismo y \nmexicanismo desde el análisis lexicográfico. Con respecto al ámbito de la traducción, \nabordaremos la cuestión del giro cultural y de la traducción inversa como elementos rele-\nvantes para la toma de decisiones para esta propuesta.\nAnglicismos\nDe acuerdo con Gerding, Cañete y Adam (2018), el contacto lingüístico promueve la \ncreación y el uso de los anglicismos en las comunidades lingüísticas. Éste atiende a los \nfactores culturales mencionados antes, por lo que es necesario especificar cómo se plan-\ntea en el cuento y por qué es necesario reflejarlo en su traducción. El grupo de hablan -\ntes en la frontera mexicano-estadounidense está integrado por quienes se encuentran \nen contacto tanto con el español como con el inglés, ya sea por su influjo cultural, por \ncuestiones de migración o por posición geográfica. Se encuentran entre dos mundos \nmonolingües, uno prestigioso y el otro estigmatizado, puesto que el inglés pertenece a \nla cultura dominante establecida por Estados Unidos como potencia mundial frente a la \ncultura dominada de México, por lo que las interferencias y los cambios de código pue-\nden considerarse como una forma de establecer su identidad de grupo, la cual de otra \nforma es reprimida (Zentella 2008).\nEl presente trabajo aborda el concepto de contacto lingüístico, comprendido como \nun fenómeno que sucede cuando dos lenguas que, a raíz de la interacción entre sus \nhablantes bajo condiciones políticas, culturales, demográficas y geográficas, presentan \ntransferencias e integraciones lingüísticas en uno o varios niveles de la lengua: fono -\nlógico, morfosintáctico o léxico. Dichas transferencias responden a los fenómenos que \natienden a la influencia de una lengua sobre otra, es decir, los procesos de convergencia \nlingüística para balancear las estructuras de ambas lenguas, al igual que los procesos \nde simplificación, generalización y pérdida, como establece Silva-Corvalán (1994: 4-5).\nLas interferencias, dentro de este concepto integrador, son desvíos voluntarios e \nindividuales de la norma, por sustitución o adaptación lingüística. Pueden ocurrir en \ncualquiera de los niveles de la lengua, pero se dan con mayor facilidad en el léxico y \nconforman los préstamos. Dependiendo de su adaptación fonológica, morfológica y sin -\ntáctica al sistema de la lengua, además de su aceptación social, puede tratarse de prés -\ntamos ya consolidados o préstamos en vías de integración (Gómez Molina 1999-2000: \n319). El grado de receptividad puede ser motivado por el prestigio o por la necesidad \nde nombrar o describir un concepto u objeto preexistente en la lengua fuente y de esta-\nblecer relaciones sociales, como ocurre en el caso presente entre hablantes del español \ne inglés (Zentella 2008: 114).\nEl cambio de código  es el uso alterno de sintagmas, oraciones o proposiciones que \npertenecen y atienden a las normas gramaticales de dos lenguas distintas. Este procedi-\nmiento tiene lugar, por ejemplo, en la relación que guardan el español y el inglés en el \n17\nLM IV-2\nLingüística Mexicana. Nueva Época, IV (2022), núm. 2: 15-38\nISSN: 2448-8194']","I'm sorry, but there is no mention of Cruz-Aldrete in the provided context about linguistics articles. If you have any other questions or need information on a different topic, feel free to ask!"
What is the significance of Shanghai in the context of bilingual language assessment research?,"['En el cuadro se observa que, en la primera prueba, algunos niños tuvieron difi - cultad para ejecutar las praxias, particularmente aquéllos con un menor nivel de la lsm. En la primera ocasión, la media fue de ± 8.84 para la mano dominante, y de ± 8.33 para la mano no dominante. Lo anterior quiere decir que los niños pudieron hacer alrededor de 8 praxias correctas de las 12 que se les presentaron. En estos primeros datos obtenidos se observó que los niños que imitaron mejor las formas de mano fueron aquéllos que tenían un mejor nivel de lsm, ya sea porque su familia es Sorda y tienen como lengua materna la llss, o bien, porque su familia, particu- larmente la madre, es usuaria de la lengua de señas y puede comunicarse de esta manera con el niño. En general, la segunda vez que se aplicó la prueba, los resultados fueron mejores para todos los participantes, mostrando una media de ±10.57 para la mano dominante y ±10.52 para la mano no dominante. Esto quiere decir que, en promedio, casi todos los participantes pudieron hacer alrededor de 10 de las 12 praxias correctas para cada mano. Una explicación que justifica este resultado puede ser el tiempo de uso de la lsm en el contexto escolar, pues la imitación juega un papel fundamental en la adquisición, tal como lo hemos expuesto. Sin embargo, también se deben considerar los casos en los cuales algunos infantes mostraron dificultades motrices asociadas con la falta de habilidad para representar estrategias de ejecución motriz (Gheysen y Van Waelvelde 2008) al igual que la posible falta de autoconfianza para explorar su entorno debido a una menor comprensión de las instrucciones u otra información asociada a las activi - dades motrices. En la producción de praxias observamos que los niños Sordos adaptaron las cm que son similares a algunas de la lsm realizando sólo las que ya conocen y producen cotidianamente y discriminando aquellas que no corresponden a su sistema lingüís - tico. Resaltan dos praxias, una en la que todos los dedos están extendidos y el dedo medio se cruza sobre el anular, la cual, a pesar de ser una praxia radicalmente distinta a la cm <r> de la lsm, los participantes la produjeron utilizando la <r> del alfa- beto dactilológico en lugar de la praxia presentada. En la segunda praxia que resalta, todos los dedos se mantienen inactivos y el pulgar se inserta entre los dedos medio y anular, pero los chicos la produjeron con la cm <t> de la lsm. Ambas se muestran en el cuadro 6. De acuerdo con el trabajo de Bhat et al. (2018: 237), en cada etapa de la adqui - sición, los niños practican fingerspelling ‘deletreo manual’, el cual “requiere de un alto nivel de control motor fino e involucra una secuencia fluida de unidades en movimiento que tienen una o más formas de mano relacionadas entre sí” (Padden y Le Master 1985). Si bien el deletreo está presente en la vida escolar y los alumnos tienen que deletrear su nombre cuando se presentan con otras personas, una expli - cación para que esta tarea no haya sido exitosa puede ser que se trata de secuencias que alternan rasgos abstractos de las señas, es decir, secuencias que no tienen refe- rentes semánticos, por lo tanto, los niños Sordos en esta etapa de la adquisición las discriminan. 62']",There is no information related to Shanghai in the provided context.,single_hop_specifc_query_synthesizer,"['Estudios de Lingüística Aplicada, año 43, número 80, enero de 2025, pp. 7–48\ndoi:10.22201/enallt.01852647p.2025.80.1097\nSistema judicial y lengua vasca en España: una glotofobia persistente [ 25 ]\nuna presunción de conocimiento de la lengua de Cervantes (Parla-\nmento Vasco, 2023: 5).\nNo obstante, dicho Tribunal precisa que la declaración de coo-\nfi  cialidad implica “la obligación de facilitar, por parte de los pode-\nres públicos competentes, el conocimiento de la lengua [vasca] y, \nen este sentido, ofi  cialidad signifi  ca enseñanza de la lengua [pro-\npia] y posibilidad correlativa de acceso a su conocimiento” (Par-\nlamento Vasco, 2023: 5). A su vez, la Ley Orgánica 1/1990, de 3 \nde octubre, de Ordenación General del Sistema Educativo (boe, \n1990a), que regula en todo el Estado español la ordenación del \nsistema educativo,\nestablece de forma pormenorizada la capacitación en las len-\nguas ofi  ciales que deben conseguir los alumnos en cada uno de \nlos niveles de enseñanza, fi  jando siempre un nivel de capaci-\ntación igual para las lenguas propias de las Comunidades Au-\ntónomas y para el castellano. Por consiguiente [en teoría] en \nlas Comunidades Autónomas con régimen de doble ofi  cialidad \nlingüística, los alumnos que superen la enseñanza obligatoria \nhabrán acreditado los conocimientos requeridos tanto de la len-\ngua castellana como de la lengua ofi  cial propia de la Comuni-\ndad Autónoma (Parlamento Vasco, 2023: 6).\nSin embargo, el Diagnóstico del Sistema Educativo Vasco para el \n2021 demuestra que, en la práctica, si la enseñanza del euskera y \nen la lengua propia del territorio está en el origen de 200 000 vas-\ncohablantes adicionales desde inicios de los años 1980 y 71.4% de \nla población de entre 16 y 24 años es bilingüe activa 12 (Gobierno \n12 Esto resulta, entre otros factores, “del esfuerzo del conjunto de la comuni-\ndad educativa, empezando por el del personal docente para mejorar su perfi  l \nlingüístico (hace 40 años, al inicio del proceso, tan solo el 8% era capaz de \nenseñar en euskera, mientras que, en la actualidad, en torno a un 95% está ca-\npacitado para ello); y también de la fi  rme apuesta de padres y madres por mo-', 'Josefina gaRcÍa faJaRdo118\nLM V-1\nLingüística Mexicana. Nueva Época, v (2023), núm. 1: 117-121  \nISSN: 2448-8194\nexpresar evidencialidad; describen las direcciones que toma cada uno de los capítulos \ndel volumen al tratar los temas de evidencialidad y miratividad —expresión de sorpresa \nante una información nueva—; y ofrecen una abundante bibliografía sobre el tema.\nEn el primer capítulo, “Caminos hacia la interpretación evidencial de se ve que” (pp. \n23-59), Marta Albelda Marco nos presenta un análisis de los distintos valores evidencia-\nles expresados con se ve que, así como sus características sintácticas en el español de la \nzona bilingüe con el catalán y en el español andaluz; ambos en dos tipos de registro: co-\nloquial y (semi)formal. A partir de los resultados de un estudio previo en coautoría con \nJansegers, Albelda considera siete valores semánticos, desde la expresión de percepción \ndirecta física —basada en el significado léxico, en cuyas ocurrencias puede advertirse \nuna concordancia entre verbo y percepto, además de la posibilidad de que se presente un \nadjunto—, hasta el valor plenamente evidencial, sin adjuntos y sin argumentos. Escribe \nla autora: “En los usos de se ve que con valor evidencial no se admiten argumentos” (p. \n52). En estos casos, podríamos decir que no tienen un argumento de primer orden, sino \nque el argumento es una proposición, es decir que se trata de un argumento de tercer \norden. Los resultados del análisis muestran claramente que los casos de percepción sen-\nsorial están orientados al estímulo o percepto, mientras que las ocurrencias de valores \nmás abstractos se orientan hacia el conceptualizador. En la variante se ve encuentra Al-\nbelda el grado máximo de valor evidencial. Puede apreciarse una identificación fina de \nlos valores de la expresión estudiada y su correlación con su comportamiento sintáctico.\nMaria Josep Cuenca y Maria Estellés, en “Certezas evidentes: el caso de visto que, \nestá visto que y visto lo visto” (pp. 61-97), se dirigen a encontrar los matices semánticos \ncon los que ocurren las tres expresiones del español visto que, está visto que y visto lo \nvisto, así como las características sintácticas que permitan conocer su nivel de gramati-\ncalización. El tipo de contenido de la cláusula introducido por visto que y está visto que \nles permite distinguir los casos en los que el emisor se manifiesta activo, indicio de que \ndichas expresiones están funcionando como evidenciales. En las tres expresiones ana-\nlizaron la posibilidad de entrar en una construcción coordinada y de expandirse, para \ndemostrar su grado de gramaticalización. Otro aspecto analizado es la presentación de \nalgún tipo de negación en la cláusula que introducen visto que y está visto que; para ello \ntoman en cuenta el adverbio de negación, elementos léxicos negativos y la ironía; en-\ncuentran en esta relación con la negación una marca de intersubjetividad. El análisis les  \npermite establecer la estabilidad, variación o bajo contenido del valor evidencial de \ncada expresión, además de otros valores semánticos que presentan. Quizá por restric -\nciones en la extensión del capítulo, las autoras no se detienen a ejemplificar y describir \ncada matiz semántico y pragmático que mencionan.\n“Los marcadores evidenciales en la interacción conversacional. El caso de por lo visto \ny al parecer” (pp. 99-127) se titula el tercer capítulo; en él, Bert Cornillie y Pedro Gras \npresentan un análisis interaccional de corte sociolingüístico de los marcadores mencio -\nnados, en el habla de Madrid. En un corpus que contiene distintos géneros y registros de \ninteracción (conversaciones espontáneas, de dos y de varios participantes, interacciones \nsemiguiadas, interacción entre un especialista y un consultante, y relatos de reportero), \nCornillie y Gras analizan la posición del marcador en el turno, el tipo de acto de habla,', 'Algunas exploraciones en torno a la reflexión metalingüística sobre la ironía 17\nEstudios de Lingüística Aplicada, año 35, número 66, diciembre de 2017, pp. 9–39\ndoi: 10.22201/enallt.01852647p.2017.66.827\npretación irónica: aunque María literalmente dice que la fiesta estuvo fantástica, \nen realidad quiere expresar que no le gustó.\nSi bien la teoría de Sperber y Wilson (Wilson & Sperber, 1992, 2004) ha \nsido objeto de críticas (al respecto véase, entre otros, Attardo, 2000, y Kalber -\nmatten, 2006), también ha recibido un importante soporte experimental (Kal -\nbermatten, 2006). Por tanto, consideramos que resulta ser una herramienta vá-\nlida para el estudio sobre la manera en que los niños y adolescentes interpretan \nlas expresiones irónicas. Por otra parte, creemos que esta aproximación permite \nanalizar la forma en que un individuo hace una reflexión sobre el lenguaje en sí \nmismo (mención en términos de la teoría de la relevancia, reflexión metalingüís-\ntica en términos de Gombert, 1992).\n1.4. Aspectos que inciden en la interpretación de la ironía verbal\nDesde la propuesta de la teoría de la relevancia (Wilson & Sperber, 1992, 2004) \nse asume que para interpretar un enunciado irónico el oyente debe percatarse de \nque no puede tratarse de una emisión literal. Para lograr lo anterior, cuenta con \ninformación generada por diversas fuentes contextuales. Al respecto, Yus (2000, \n2009) propone que existen siete fuentes contextuales que aportan información \nrelevante para lograr la adecuada interpretación de un enunciado irónico: cono-\ncimiento enciclopédico general (conocimiento que se tiene acerca del mundo: \ninformación social y cultural que permite interpretar más fácilmente una expre-\nsión irónica); conocimiento enciclopédico específico del interlocutor (gustos, \nhábitos, creencias, opiniones y demás información); conocimiento de sucesos o \nacciones que ocurrieron poco tiempo antes de la expresión irónica; enunciados \nprevios a la conversación; comunicación no verbal vocal y visual (entonación, \ngestos faciales, sonrisas); elecciones léxicas o gramaticales (pistas lingüísticas \ncomo adjetivos con connotación de cualidad extrema, adverbios, superlativos, \nrepeticiones innecesarias, frases convencionalmente irónicas) y la información \nproveniente del entorno físico que rodea a los interlocutores. De acuerdo con el \nautor, la presencia / ausencia de dichas fuentes contextuales impactará en el ac-\nceso que pueda tener un individuo a la interpretación irónica. De esta manera, a \nmayor saturación, es decir, a mayor cantidad de fuentes contextuales, más fácil \ny rápida será la interpretación irónica. Específicamente para fines de este estu -']","I'm sorry, but the context provided does not mention anything about Shanghai or its significance in bilingual language assessment research."
What is the significance of 'prueba' in the context of language acquisition?,"['pios de la tarea. Como resultados generales de esta prueba, se observó que, en prome - dio, los niños presentaban ±3.52 de puntaje en una escala máxima de 21, es decir, sólo ejecutaron alrededor de 3 de 21 secuencias. Al cabo de dos meses se realizó nuevamente la tarea y la media bajó a ±3.22, con - trariamente a lo que era esperable. Estos datos nos resultaron reveladores dado que se trata de una tarea que implica movimientos menos precisos que las praxias individuales (cuadros 2 y 4). Sin embargo, para esta actividad se requiere de la memoria de trabajo, que es un tipo de memoria a corto plazo donde es necesario actualizar la información re- cibida al momento de manipularla para ejecutar una acción. Las tareas de Alternancias Motoras no sólo requieren de mecanismos para mantener una secuencia en la memoria, sino mecanismos para poder reproducirla, y en este periodo de adquisición lingüística, parece ser que los niños se están especializando en la apropiación de otros rasgos del lenguaje visogestual tales como la ubicación, dirección, orientación y los movimientos que siguen las cm, es decir, los rasgos distintivos de una seña. discusión de Las prueBas Motrices Dentro del campo de la percepción visual, la saliencia se define como aquel estímulo que destaca del resto, no necesariamente por sus atributos físicos, como el tamaño o la forma, sino que también pueden suponer factores cognitivos y emocionales. Esta es una posible explicación para el resultado que se observó en los niños, pues la mayoría de ellos adaptaron la praxia mostrada con una cm de la lsm. De hecho, el proceso de apropiación de una cm puede estar relacionado con el bagaje lingüístico en esa etapa de adquisición del niño respecto al deletreo manual debido a que, en el contexto escolar, y en esta edad, están adquiriendo las cm de la lsm, pero éstas no representan necesaria- mente señas léxicas, sino partes abstractas de las mismas. En esta tarea, los niños produjeron las praxias manuales, adaptándolas de manera simi- lar a lo que sucede con los préstamos de las lenguas orales, cuando los hablantes incorpo- ran un término mediante los patrones fonológicos de la lengua meta. Lo anterior explica que ante el estímulo que parece ser similar a la cm <t>, los niños no lo copiaron idéntica- mente, sino que lo reprodujeron de forma muy similar a la cm que existe en lsm. En el caso de la segunda praxia que se mostró en el cuadro (4), se pudo ver que la postura de mano no es tan similar a la de la configuración realizada por los infantes. De hecho, los dedos activos son distintos. Sin embargo, cuando los niños trataban de copiar esta última praxia, lo hicieron mediante la única cm de la lsm que se realiza con dos dedos cruzados, la <r>. Para la prueba de Alternancias Motoras, supusimos que habría un mejor resultado en los puntajes bajo el supuesto que es una tarea secuencial y que requiere una menor precisión motriz que la tarea de praxias. Sin embargo, no fue así.']","In the context provided, 'prueba' seems to refer to motor alternation tasks that are part of language acquisition studies. These tasks involve sequences that require working memory and the ability to update information while manipulating it to execute an action. Children in the study seem to be specializing in aspects of visuospatial language acquisition, such as location, direction, orientation, and movement characteristics. The term 'prueba' appears to be associated with motor tasks that involve reproducing sequences, potentially influenced by linguistic background and the acquisition of manual spelling gestures. It is suggested that children adapt manual gestures similarly to how loanwords are incorporated into spoken languages, following phonological patterns of the target language.",single_hop_specifc_query_synthesizer,"['18 Karina Hess Zimmermann, Graciela Fernández Ruiz & Alejandra De León Alcantar\nEstudios de Lingüística Aplicada, año 35, número 66, diciembre de 2017, pp. 9–39\ndoi: 10.22201/enallt.01852647p.2017.66.827\ndio se pondrá en juego la presencia / ausencia de pistas lingüísticas como varia-\nble para observar si esta incide en la interpretación y reflexión que pueden hacer \nlos niños y adolescentes sobre la ironía verbal.\n2. Método\n2.1. Objetivo\nEl objetivo de este estudio es explorar la manera en que niños y adolescentes de \ndiferentes edades interpretan la ironía verbal y reflexionan sobre la misma. Es-\npecíficamente se busca indagar si existen diferencias determinadas por la edad \npara interpretar y reflexionar sobre la ironía y si la presencia / ausencia de pistas \nlingüísticas incide en la interpretación y reflexión que pueden hacer los niños y \nadolescentes sobre la misma.\n2.2. Participantes\nFormaron parte del estudio 30 niños y adolescentes de 9, 12 y 15 años de edad \n(10 participantes por grupo de edad, mitad hombres y mitad mujeres) de una es-\ncuela privada de la ciudad de Querétaro, México. Para la selección de los parti-\ncipantes se descartaron los niños y adolescentes cuya lengua materna no fuera el \nespañol y que tuvieran algún problema evidente de lenguaje o aprendizaje. De \nmanera adicional, debido a que el instrumento empleado en el estudio se presen-\ntó por escrito, a todos los participantes se les aplicó la subprueba de comprensión \nlectora de la Evaluación Neuropsicológica Infantil (eni) (Matute, Rosselli, Ardila \n& Ostrosky, 2007), con la finalidad de descartar alguna dificultad en la compren-\nsión lectora que pudiera incidir en los resultados.\n2.3. Instrumento\nPara la elaboración del instrumento se decidió trabajar con enunciados irónicos \nprototípicos, debido a que se ha encontrado que son los más frecuentes en las \nconversaciones en español (Kalbermatten, 2006). Los enunciados irónicos pro-\ntotípicos son aquellos que presentan una discrepancia entre el significado de las', 'conspirólogo\nEn el peor de los casos se dará cuenta que éste ya no es \nun fenómeno exclusivo del conspirólogo proverbial con el \ngorro de aluminio, no: la conspiración ya es parte de la con-\nversación pública.\nEl Universal. Opinión. Esteban \nIllades. 20 de agosto de 2020. \nVersión digital.\ncoronabicho Escuela en casa en tiempos del coronabicho: Entre Sherlock \nHolmes y Poirot.\nEl Universal. Confabulario. Mary \nCarmen Sánchez Ambriz. 12 de \nseptiembre de 2020. \nVersión digital.\ncoronabobo\nDe la existencia del virus nadie tiene la culpa, desde luego \n[...]. Los ciudadanos imputan la culpa a los políticos y los \npolíticos, con la boca pequeña, solo se atreven a inculpar, \nen fin, a esa “pequeña minoría” de irresponsables... ¿Peque-\nña? ¿Coronavirus? Coronabobos, dice el espejo.\nMilenio. El Mundo. Manuel Hi-\ndalgo, p. 23. 18 de septiembre \nde 2020.\ncoronabono\nEl Eurogrupo llegó este jueves a un acuerdo para movilizar \nmás de medio billón de euros en préstamos para ayudar \na estados, empresas y trabajadores afectados por el coro-\nnavirus, pero dejó para más adelante la discusión sobre la \nemisión de “coronabonos” para financiar la recuperación.\nSinembargo. Economía.  \n“Eurogrupo acuerda medio \nbillón de euros, pero sin coro-\nnabonos, para afectados por \nCOVID-19”. EFE. 10 de abril de \n2020. Versión digital.\ncoronaburguer\nEn medio de la pandemia por coronavirus el ingenio mexi-\ncano se hace presente en todo el país, con creaciones que \nvan desde un globo, pasteles, bonless, tatuajes y ahora una \nhamburguesa, se trata de la “Coronaburger” y es creada en \nCiudad Madero, Tamaulipas.\nMilenio Digital. Virales. Magda \nBárcenas. 11 de mayo de 2020.\ncoronacrisis Coronacrisis. La cuarentena trajo aparejada la crisis econó-\nmica por la que atraviesan distintos sectores.\nInfobae.com. Tendencias. Víctor \nIngrassia. 7 de junio  de 2020.\ncoronalibro\nCrean el “Coronalibro”. Más de 4 mil 500 propuestas de \n15 países respondieron a la convocatoria de la Universidad \nAutónoma Metropolitana (UAM) para un proyecto colabo-\nrativo, un fotolibro y una pieza multimedia en torno del \ncoronavirus.\nEl Universal. Cultura. Sonia Sie-\nrra. 7 de mayo de 2020. \nVersión digital.\ncoronavirulento\n“CORONAVIRULENTO”. El científico universitario refirió \nque el virus podría ya haber llegado a México sin que haya \nsido detectado, puesto que tarda 14 días en incubarse sin \nque se presenten síntomas.\nLa Crónica de Hoy. Academia. \n“El coronavirus llegará a Mé-\nxico y no estamos preparados: \nacadémicos”. Isaac Torres Cruz. \n31 de enero de 2020. \nVersión digital.\ncoronial\nEs lo que es y esto no va a terminar nunca, ni con una vacu-\nna ni con diez. Es, como están diciendo muchos de nuestros \nmás grandes pensadores: la era “coronial”. Así como la épo-\nca colonial tuvo sus características y sus valores, el corona-\nvirus nos está llevando a situaciones que jamás imaginamos \ny que no van a tener solución en la lógica “pre-coronial”.\nMilenio. Opinión. Álvaro de la \nCueva. 27 de septiembre de \n2020. Versión digital.\ncoronnial\nDespués de los millennials y la generación Z es la hora de \nlos coronnials. Este término, muy popular en las redes so-\nciales, se refiere a la generación que nacerá en los próximos \nmeses como consecuencia del aislamiento en parejas.\nInfobae.com. Tendencias. Víctor \nIngrassia. 7 de junio de 2020.\n22 Ramón ZacaRías Ponce de León\nLM IV-1 \nLingüística Mexicana. Nueva Época, IV (2022), núm. 1: 7-29  \nISSN: 2448-8194', 'Estudios de Lingüística Aplicada, año 42, número 79, julio de 2024, pp. 45–69\ndoi: 10.22201/enallt.01852647p.2024.79.1083\nLa duplicación del objeto indirecto en aprendientes de interpretación [ 57 ]\nde la licenciatura. Se les aplicó el cuestionario leap-q (Marian, \nBlumenfeld & Kaushanskaya, 2007) con el objetivo de tener un \nregistro del historial lingüístico de los sujetos, además de obtener \ninformación referente al tipo de bilingüismo que presentaban al \nmomento de realizar ambas prácticas de interpretación (véase Sán-\nchez, Andrade & Martínez, 2023, para una descripción detallada \ndel tipo de bilingüismo). Con respecto al bilingüismo, los sujetos \nque fueron considerados para la aplicación de las prácticas debían \ntener las siguientes características:\n i. Tener español como lengua materna,\n ii. haber aprendido inglés después de los 6 años,\niii. autoevaluarse con una ponderación mayor a 8 en compren-\nsión lectora y oral y en producción oral.\nSe contó con un total de 64 sujetos, 33 cursaban el V semestre, 13 \ncursaban el VII semestre y 18 el VIII semestre.\n4.3.  Aplicación de prácticas de interpretación\nSe estableció contacto con cinco docentes que impartían las mate-\nrias de interpretación a fi  n de solicitar su colaboración en la reali-\nzación y aplicación de las dos pruebas de interpretación. Asimis-\nmo, se les ofrecieron los archivos de audio y las transcripciones \nde los estudiantes involucrados para los fi  nes académicos y/o di-\ndácticos que ellos creyeran convenientes. Debido a las circunstan-\ncias derivadas de la pandemia, se le pidió a los docentes acceso a \nla plataforma educativa en la que impartían sus clases durante dos \nsesiones, separadas por una semana de diferencia; este paso meto-\ndológico se implementó con el objetivo de evitar una carga exce-\nsiva en la atención y la capacidad de los estudiantes para realizar \nla práctica interpretativa.\nUna vez que se tuvo acceso a la plataforma y contacto con \nlos estudiantes de cada grupo, se les comentó que estas pruebas \nde interpretación no pretendían ser una evaluación que afectara su']","The term ""prueba"" in the context of language acquisition refers to a test or assessment used to evaluate the language skills of individuals. In the provided context, the ""pruebas de interpretación"" (interpretation tests) were applied to students by collaborating teachers to assess their language proficiency and skills in interpretation. These tests were not meant to be evaluations that would negatively impact the students."
What is the significance of Nueva Época in the linguistic context?,"['Identificamos que, en el contexto escolar, los niños aprenden a copiar el deletreo o las señas casi de manera simultánea con su profesora o cuidadora y suelen deletrear su nombre o el de sus com- pañeros. En este mismo sentido y en el contexto de la prueba, los niños realizaron las secuencias paralelamente, es decir, en el mismo momento que el instructor. A partir de 64 Guillermo Hernández Santana y Coral italú Guerrero arenaS LM V-2 Lingüística Mexicana. Nueva Época, v (2023), núm. 2: 49-71 ISSN: 2448-8194']","Nueva Época is a term used in the context of the linguistic journal 'Lingüística Mexicana' to denote a new era or phase of publication, possibly indicating a shift in focus or approach.",single_hop_specifc_query_synthesizer,"['14 María Reyes López\nEstudios de Lingüística Aplicada, año 32, número 59, julio de 2014, pp. 9-37\n2. Condiciones preparatorias: a) los hablantes están en una conversación \ncara a cara, en un contexto informal; b) el hablante cree que el oyente \nvalora que el hablante exprese p; c) no es obvio para el oyente ni para el \nhablante que el hablante expresará p de manera espontánea en el curso \nnormal de los acontecimientos.\n3. Condición de sinceridad: El hablante valora positivamente algo relativo \nal oyente y lo expresa. \n4. Condición esencial: Expresar p cuenta como hacer un cumplido del \nhablante hacia el oyente.\n5\nEsta primera caracterización tiene la ventaja de que marca ciertos límites entre el \nAc y otros actos vecinos. Sin embargo, con este primer acercamiento no es posible \ncapturar aspectos del Ac que se refieren más precisamente a las expectativas so-\nciales sobre los rasgos en torno a los cuales es adecuado expresar una valoración \npositiva. Para subsanar este problema, recurro a los planteamientos de Bach y \nHarnish (1979), cuya principal ventaja es que permiten incorporar de manera \nexplícita la dimensión de las expectativas sociales sobre lo que potencialmente \ncontiene la expresión de un acto de habla perteneciente al grupo de los actos de \n‘reconocimiento’. \nBach y Harnish (1979: 51) proponen una tipología con cinco diferentes \ngrupos de actos. Llaman reconocimientos a los actos que expresan ciertos senti-\nmientos, superficiales o genuinos, hacia el oyente; actos cuya expresión es apro-\npiada a ocasiones específicas. Comprenden los casos en los que el enunciado \nmuestra que la intención del hablante es que su enunciado satisfaga la expectati-\n5 La diferencia entre el cumplido y los actos halagar, elogiar y piropear puede capturarse a partir de \nvariaciones en las condiciones preparatorias, pero ahondar en este punto está más allá del objetivo \nde este artículo. Para los fines de este trabajo basta con precisar aquí que elogiar y actos afines como \nloar, encomiar, alabar, ensalzar, exaltar, engrandecer son actos que habitualmente ocurren en un \ncontexto formal, no en una conversación cotidiana entre dos personas, y no necesariamente realizan \npredicaciones sobre el interlocutor, sino también sobre un tercero. Para el caso de piropear, conside-\nro que es un acto que se da en una situación de calle, en la que no hay interacción y que está a medio \ncamino entre el halago y el acoso, según el nivel de obscenidad que exprese (Achugar, 2002). Para \nel caso de halagar, considerándolo un acto perlocucionario, se realiza por medio de diversos actos, \nincluido el cumplido y actos vecinos.\nELA 59.indd   14 28/08/14   17:27', 'Estudios de Lingüística Aplicada, año 42, número 79, julio de 2024, pp. 71–109\ndoi: 10.22201/enallt.01852647p.2024.79.1096\n[ 102 ] Amor Madai Peña Ramos & Verónica González Márquez\nFormas verbales de indicativo (cfr. Rojo & Veiga, 1999: 2881–2885)*\nForma Fórmulas vectoriales Bello (1847) GRAE (1931) Gili Gaya (1943) Esbozo (1973) Rojo y Veiga (1999)\nCanto OoV presente presente Presente Presente presente\nCanté O–V pretérito pretérito indefi  nido pretérito perfecto absoluto pretérito perfecto simple pretérito\nCantaba (O–V)oV co–pretérito pretérito imperfecto pretérito imperfecto pretérito imperfecto co–pretérito\nCantaré O+V futuro futuro simple futuro absoluto futuro futuro\nCantaría (O–V)+V pos–pretérito potencial simple futuro hipotético condicional pos–pretérito\nHe cantado (OoV)–V ante–presente pretérito perfecto pre. perfecto actual pret. perfecto compuesto ante–presente\nHabía cantado (O–V)–V ante–co–pretérito pret. plus–cuamperfecto pret. plus–cuamperfecto pret. plus–cuamperfecto ante–pretérito**\nHube cantado (O–V)–V ante–pretérito pretérito anterior ante–pretérito pretérito anterior ante–pretérito\nHabré cantado (O+V)–V ante–futuro futuro perfecto antefuturo futuro perfecto ante–futuro\nHabría cantado ((O–V)+V)–V ante–pos–pretérito potencial compuesto antefuturo hipotético condicional perfecto ante–pos–pretérito\n*  Los guiones de la terminología utilizada en este cuadro corresponden a la que presentan los autores consultados.\n** En la nota a pie número 21, los autores indican que este es el término adecuado “para la que interpretamos como realización temporal fundamental expresada por había cantado” \n(Rojo & Veiga, 1999: 2885).\nAnexo 1. Formas verbales de indicativo (cfr. Rojo & Veiga, 1999: 2881-2885)*', 'ANALISIS CONVERSACIONAL 23\n4. Son frecuentes las transiciones (de un turno \nal siguiente) sin intervalo y sin traslape. \nJunto con las transiciones caracterizadas por \nun breve intervalo o traslape, conforman la \ngran mayoría de las transiciones (...)\n5. El orden de los turnos no es fijo, sino varia\xad\nble (...)\n6. La extensión de los turnos no es fija, sino va\xad\nriable (...)\n7. La extensión de las conversaciones no es fija, \nni predeterminada de antemano (...)\n9. La distribución relativa de los turnos no está \nfijada, especificada de antemano (...)\n10. El número de participantes puede variar (...)\n11. La conversación puede ser continua o disconti\xad\nnua (...)\n12. Obviamente se usan técnicas para atribuir tur\xad\nnos. El hablante de turno puede escoger al si\xad\nguiente (cuando, por ejemplo, el hablante de \nturno dirige una pregunta a otro participante); \nlos participantes pueden escogerse a sí mismos, \ncon el simple hecho de empezar a hablar (...)\n13. Se usan varias \'unidades de construcción de \nturnos\' . Los turnos pueden proyectarse por la \nduración de una palabra o, por ejemplo, exten-  \nderse a una oración (...)\n14. Es evidente que se dispone de mecanismos para\ntratar errores y violaciones en la toma de tur\xad\nnos. Si dos participantes, por ejemplo, per\xad\nciben que están hablando al mismo tiempo, uno \nde ellos se detendrá prematuramente, reparan\xad\ndo así la perturbación (...)"" (Sacks / Scheglo \nff/ Jefferson, 1974:700-701, traducción R.E.H.).']","I'm sorry, but the term ""Nueva Época"" is not mentioned in the provided context about linguistics articles. If you have any other questions or terms related to the text provided, feel free to ask!"
What is the analysis of morfemas in the Spanish language?,"['Segmentación de morfemaS con cálculo de entropía en pa ipai propone un análisis de varianza y uno de correlación para corroborar si tales cortes se relacionan significativamente con esta medida. La segmentación de Joël. Para este experimento, se retomó el texto de Joël (1976) en su texto y, a partir de los afijos que ella glosa, se creó un inventario, distinto al pro - puesto por el algoritmo. En contraste con los 174 potenciales prefijos y 171 sufijos del algoritmo, Joël propone 131 prefijos y 99 sufijos, para un total de 230 afijos ana- lizados. De estos, sólo 93 (39.7%) tienen un valor de entropía mayor a 0. Es relevante notar lo anterior, ya que el alcance del experimento no incluye la identificación de morfemas que funcionen como bases. Casos de entropía 0 podrían revelar este tipo de morfemas, pensando en que, dentro de la palabra, la cantidad de morfemas con estructuras inagrupables correspondería a más del 60%, mientras que aquellos que pueden agruparse (como, por ejemplo, las variaciones -um, -em, -m) corresponderían al 40% restante. La exploración de este hecho sobrepasa el objetivo de la presente investigación, pero se dejará para futuros trabajos. Posterior a esta segmentación y al cálculo de entropía relativa, se emparejaron los 230 afijos analizados por Joël con la entropía calculada por el algoritmo, incluso si fue cero. Esto debido a que el peso en este momento de la experimentación es el hecho de que son afijos que, en efecto, fueron analizados por Joël. En este punto surgió otro problema que ya había sido mencionado líneas arriba. Existen en la lengua ciertos morfemas que no toman como pivote el extremo derecho o izquierdo de la palabra. En el corpus, son morfemas que sólo aparecen entre otros morfemas. Estos afijos no son segmentados por el programa, pero sí por Joël. De los 230 afijos glosados, el programa no calculó la entropía de 50. Ahora, nótese que no son 50 casos únicos. Por ejemplo, aparece el morfema oli, el cual es propuesto como prefijo y sufijo (oli-, -oli), debido a que aparece sólo entre morfemas en la segmentación de Joël. Por lo que esos 50 casos, podrían ser aproximadamente 25 formas por explorar. De la misma manera que el primer problema enunciado, este escenario se salva retirando de la exploración los casos que no fueron analizados por el programa, pero se dejarán para otras exploraciones los casos de posibles intrafijos —afijos que van entre la base y algún otro sufijo o prefijo— tomando como criterio el análisis de Joël, o incluso, el de otras glosas hechas por otros investigadores. Correlación. Al final, el conjunto para realizar la correlación corresponde a 180 afijos que sí fueron segmentados por Joël, y otros 1690 afijos que el programa segmentó; para ambos grupos tenemos su cálculo de entropía que incluye también los casos de entropía 0. A ma- nera de contraste, en la gráfica 4 se muestra la distribución de los 180 afijos segmentados tomando como parámetro su entropía relativa calculada. Nótese la diferencia con respecto a las distribuciones anteriores (gráfica 2 y 3). Se observa que las curvas no están tan ho - mogenizadas como en los otros dos casos anteriores. Además, también sobresale que la tendencia de los datos de los sufijos es a ser bimodal (dos crestas en el gráfico). Esto podría sugerir una división entre los sufijos. Esto se deja para evaluación en futuros trabajos. 89']","The segmentation of morfemas with entropy calculation in the experiment proposes an analysis of variance and correlation to determine if the cuts are significantly related to this measure. Joël's segmentation suggests 131 prefixes and 99 suffixes, totaling 230 analyzed affixes. Only 93 (39.7%) have an entropy value greater than 0. The experiment does not aim to identify morphemes functioning as bases. Cases with entropy 0 could reveal such morphemes. The exploration of this fact exceeds the current research's scope but is left for future studies. After segmentation and relative entropy calculation, the 230 affixes analyzed by Joël were matched with the algorithm's calculated entropy, even if it was zero. Certain morphemes in the language do not pivot on the word's right or left end but only appear between other morphemes. The program did not calculate the entropy of 50 affixes glossed by Joël. These cases, approximately 25 forms, could be further explored. The correlation analysis involves 180 affixes segmented by Joël and 1690 affixes segmented by the program, including cases with entropy 0. The distribution of the 180 segmented affixes based on their calculated relative entropy shows differences compared to previous distributions. The data trend for suffixes tends to be bimodal, suggesting a division among suffixes for future evaluation.",single_hop_specifc_query_synthesizer,"['conspirólogo\nEn el peor de los casos se dará cuenta que éste ya no es \nun fenómeno exclusivo del conspirólogo proverbial con el \ngorro de aluminio, no: la conspiración ya es parte de la con-\nversación pública.\nEl Universal. Opinión. Esteban \nIllades. 20 de agosto de 2020. \nVersión digital.\ncoronabicho Escuela en casa en tiempos del coronabicho: Entre Sherlock \nHolmes y Poirot.\nEl Universal. Confabulario. Mary \nCarmen Sánchez Ambriz. 12 de \nseptiembre de 2020. \nVersión digital.\ncoronabobo\nDe la existencia del virus nadie tiene la culpa, desde luego \n[...]. Los ciudadanos imputan la culpa a los políticos y los \npolíticos, con la boca pequeña, solo se atreven a inculpar, \nen fin, a esa “pequeña minoría” de irresponsables... ¿Peque-\nña? ¿Coronavirus? Coronabobos, dice el espejo.\nMilenio. El Mundo. Manuel Hi-\ndalgo, p. 23. 18 de septiembre \nde 2020.\ncoronabono\nEl Eurogrupo llegó este jueves a un acuerdo para movilizar \nmás de medio billón de euros en préstamos para ayudar \na estados, empresas y trabajadores afectados por el coro-\nnavirus, pero dejó para más adelante la discusión sobre la \nemisión de “coronabonos” para financiar la recuperación.\nSinembargo. Economía.  \n“Eurogrupo acuerda medio \nbillón de euros, pero sin coro-\nnabonos, para afectados por \nCOVID-19”. EFE. 10 de abril de \n2020. Versión digital.\ncoronaburguer\nEn medio de la pandemia por coronavirus el ingenio mexi-\ncano se hace presente en todo el país, con creaciones que \nvan desde un globo, pasteles, bonless, tatuajes y ahora una \nhamburguesa, se trata de la “Coronaburger” y es creada en \nCiudad Madero, Tamaulipas.\nMilenio Digital. Virales. Magda \nBárcenas. 11 de mayo de 2020.\ncoronacrisis Coronacrisis. La cuarentena trajo aparejada la crisis econó-\nmica por la que atraviesan distintos sectores.\nInfobae.com. Tendencias. Víctor \nIngrassia. 7 de junio  de 2020.\ncoronalibro\nCrean el “Coronalibro”. Más de 4 mil 500 propuestas de \n15 países respondieron a la convocatoria de la Universidad \nAutónoma Metropolitana (UAM) para un proyecto colabo-\nrativo, un fotolibro y una pieza multimedia en torno del \ncoronavirus.\nEl Universal. Cultura. Sonia Sie-\nrra. 7 de mayo de 2020. \nVersión digital.\ncoronavirulento\n“CORONAVIRULENTO”. El científico universitario refirió \nque el virus podría ya haber llegado a México sin que haya \nsido detectado, puesto que tarda 14 días en incubarse sin \nque se presenten síntomas.\nLa Crónica de Hoy. Academia. \n“El coronavirus llegará a Mé-\nxico y no estamos preparados: \nacadémicos”. Isaac Torres Cruz. \n31 de enero de 2020. \nVersión digital.\ncoronial\nEs lo que es y esto no va a terminar nunca, ni con una vacu-\nna ni con diez. Es, como están diciendo muchos de nuestros \nmás grandes pensadores: la era “coronial”. Así como la épo-\nca colonial tuvo sus características y sus valores, el corona-\nvirus nos está llevando a situaciones que jamás imaginamos \ny que no van a tener solución en la lógica “pre-coronial”.\nMilenio. Opinión. Álvaro de la \nCueva. 27 de septiembre de \n2020. Versión digital.\ncoronnial\nDespués de los millennials y la generación Z es la hora de \nlos coronnials. Este término, muy popular en las redes so-\nciales, se refiere a la generación que nacerá en los próximos \nmeses como consecuencia del aislamiento en parejas.\nInfobae.com. Tendencias. Víctor \nIngrassia. 7 de junio de 2020.\n22 Ramón ZacaRías Ponce de León\nLM IV-1 \nLingüística Mexicana. Nueva Época, IV (2022), núm. 1: 7-29  \nISSN: 2448-8194', 'Estudios de Lingüística Aplicada, año 43, número 80, enero de 2025, pp. 49–93\ndoi: 10.22201/enallt.01852647p.2025.80.1112\n[ 74 ] Julio César Valerdi Zárate\ncuadRO 9. Programas de formación de profesores de inglés: accesibilidad\nPrograma Entidad Lugar de gestión Modalidad Costo\na) curso Privada México En línea No disponible\nb) curso Privada México En línea £390 ($10,860)\nc) curso Privada México En línea £228 ($6,350)\nd) curso Privada México En línea £264 ($7,350)\ne) serie de cursos Privada México En línea No disponible\nf) curso Privada E. U. A. En línea $199 USD ($3,960)\ng) curso Privada E. U. A. En línea $239 USD ($4,760)\nh) diplomado Privada México Mixta $14,000\ni) diplomado Privada México Mixta $14,000\nj) diplomado Privada México En línea $350 USD ($6,970)\nk) diplomado Privada México Mixta $3,460 USD ($68,860)\nl) diplomado Privada México En línea $300 USD ($5,970)\nm) diplomado Privada México Mixta No disponible\nn) diplomado Pública México En línea $5,000\nñ) certifi  cado Privada E.U.A. En línea $899 USD ($17,900)\no) certifi  cado Privada México En línea No disponible\np) certifi  cado Privada No disponible En línea No disponible\nq) certifi  cado Privada México En línea £408 ($11,360)\nr) certifi  cado Privada México En línea £312 ($8,730)\ns) certifi  cado Privada México En línea £552 ($15,450)\nt) certifi  cado Pública México En línea No disponible\ncuadRO 10. Programas de formación de profesores de inglés: público meta\nPrograma Necesidades meta Experiencia Formación previa Dominio de L2\na) curso Profesores de niños sep 1 año No disponible B1\nb) curso Profesores de alumnos de 6 a 17 años Enseñanza de inglés No disponible No disponible\nc) curso Profesores por tomar DELTA Enseñanza de inglés Cursos de preparación \nDELTA\nC1\nd) curso Docentes califi  cados interesados en \ninvestigación en el aula\nEnseñanza de inglés Formación docente e \ninvestigación básica\nC1', 'Del tratamiento de falsos amigos en un diccionario electrónico de dudas 11\nEstudios de Lingüística Aplicada, año 30, número 56, diciembre de 2012, pp. 9-33\nintroDucción\nEn este artículo, las autoras quieren aportar unas consideraciones acerca de la \ninformación pertinente en las entradas de un diccionario electrónico de dudas \n(DeD) alemán/español para hispanohablantes.1 El estudio se centra en la inclusión \nde falsos amigos y pretende demostrar que estos, sin duda, constituyen un ámbito \npertinente para una obra de estas características dado que tal y como afirma Doval \n(2006: 466): “Los falsos amigos presentan un problema muy importante y muy \nfrecuente tanto en la traducción como en la didáctica de la lengua extranjera al \nque el diccionario bilingüe presta apenas atención”.\n2\nSi esto es así, un diccionario en soporte electrónico podría cambiar esta \nrealidad. Su elaboración depende de múltiples factores, aunque consideramos \nque tres son los puntos clave: los criterios de usabilidad3 del diccionario, el perfil \nde sus usuarios y los fines perseguidos con dicha herramienta. Teniendo en cuen-\nta los criterios de usabilidad, el diccionario en soporte digital —como veremos \nmás adelante— se presta de manera formidable a entradas de tipo falso amigo, ya \nque esta herramienta permite una organización de la interfaz sencilla, dispone de \nuna flexibilidad en cuanto al espacio, ofrece la posibilidad de disponer de manera \nlógica los distintos elementos como colores de hipervínculos, estados de los dis-\ntintos botones, entre otras consideraciones. Además, por analogía con convencio-\nnes cul turales y estándares establecidos es fácil para el usuario reconocer las \netiquetas y símbolos utilizados (Cf. Torres, 2009: 16). Todos estos recursos ayu-\ndarán sobremanera a facilitar la comprensión del fenómeno falso amigo, que en \nmuchas ocasiones puede convertirse incluso en un verdadero enemigo peligroso.  \n \n1 Por razones de espacio, las autoras se han visto obligadas a dejar de lado la problemática de la \nvariación dialectal de los latinismos en el español. Sin duda se trata de un problema complejo que \nmerecería su debida atención. En el análisis de los casos del presente artículo se ha observado in-\nformación a tal respecto que no siempre coincidía. Por ejemplo, en cuanto a “competencia” (caso 3)  \nobservamos su sinónimo “competición (deportiva)” registrado en los tres diccionarios menciona-\ndos, marcado como “americanismo” (drae, clave) y uso en “zonas del español meridional”.\n2 La traducción de las citas en alemán e inglés es nuestra.\n3 Usamos este término en el sentido de, por ejemplo, Wiegand & Fuentes, 2010: 232 y Azorín Fernández \n& Santamaría Pérez (2011).\nELA 56 interiores.indd   11 15/01/14   20:25']","I'm sorry, but the context provided does not contain information about the analysis of morphemes in the Spanish language. If you have any other questions or need assistance with a different topic, feel free to ask!"
What is the significance of 'Nueva Época' in LM V-2 Lingüística Mexicana?,"['LM V-2 Lingüística Mexicana. Nueva Época, v (2023), núm. 2: 73-94 ISSN: 2448-8194']","Nueva Época is featured in LM V-2 Lingüística Mexicana as a specific volume, indicating a new era or phase within the linguistic research journal.",single_hop_specifc_query_synthesizer,"['38 Fabiola Esmeralda López Rodríguez\nEstudios de Lingüística Aplicada, año 36, número 67, julio de 2018, pp. 9–43\ndoi: 10.22201/enallt.01852647p.2018.67.723\nBergmann, Jörg R., & Luckmann, Thomas (1995). Reconstructive genres of everyday commu-\nnication. En Uta M. Quasthoff (Ed.), Aspects of oral communication (pp. 289–304). Berlín: \nDe Gruyter Mouton.\nBriz Gómez, Antonio (2003). La transcripción de la conversación. El sistema Val.Es.Co. En \nAgustín Vera Luján, Ramón Almela Pérez, José María Jiménez Cano & Dolores Anunciación \nIgualada Belchí (Coords.), Homenaje al profesor Estanislao Ramón Trives (vol. 1, pp. 141–\n160). Murcia: Servicio de Publicaciones de la Universidad de Murcia.\nChafe, Wallace L., & Nichols, Johanna (Eds.) (1986). Evidentiality: The linguistic coding of \nepistemology. Norwood: Ablex.\nCox, Bruce A. (1970). What is Hopi gossip about? Information management and Hopi factions. \nMan, 5(1), 88–98. Recuperado de http://www.jstor.org/stable/2798806\nDe León Torres, María Soledad (2010). Chisme y control social. En María Soledad de León \nTorres, Palabra de mujer: familia, género y narrativas en Totatiche, Jalisco (pp. 103–138). \nMorelia: El Colegio de Michoacán.\nDunbar, Robin I. M. (1996). Grooming, gossip and the evolution of language. Londres: Faber & \nFaber.\nEder, Donna, & Enke, Janet Lynne (1991). The structure of gossip: Opportunities and con-\nstraints on collective expression among adolescents. American Sociological Review, 56(4), \n494–508. Recuperado de https://www.jstor.org/stable/2096270\nEggins, Suzanne, & Slade, Diana (1997). Analysing casual conversation. Londres: Cassell.\nFine, Gary Alan (1985). Rumors and gossiping. En Teun A. van Dijk (Ed.), Handbook of dis-\ncourse analysis. Vol. 3. Discourse and dialogue (pp. 223–236). Londres: Academic Press.\nGluckman, Max (1963). Papers in honor of Melville J. Herskovits: Gossip and scandal. Current \nAnthropology, 4(3), 307–316. Recuperado de http://www.jstor.org/stable/2739613\nGluckman, Max (1968). Psychological, sociological and anthropological explanations of witch-\ncraft and gossip: A clarification. Man, 3(1), 20–34. Recuperado de http://www.jstor.org/ \nstable/2799409\nGoffman, Erving (1991). Los recursos seguros. En Yves Winkin (Comp.), Los momentos y sus \nhombres (pp. 99–106). Barcelona: Paidós.\nGoodman, Robert F., & Ben-Ze’Ev, Aaron (Eds.) (1994). Good gossip. Lawrence: University \nPress of Kansas.\nHall, Joan Kelly (1993a). Oye oye lo que ustedes no saben: Creativity, social power, and politics \nin the oral practice of chismeando. Journal of Linguistic Anthropology, 3(l), 75–98. Recupe-\nrado de https://www.jstor.org/stable/43102870', 'El chisme: estrategias discursivas desplegadas en su construcción 13\nEstudios de Lingüística Aplicada, año 36, número 67, julio de 2018, pp. 9–43\ndoi: 10.22201/enallt.01852647p.2018.67.723\nsonas ausentes (comportamientos, características o acciones) o a terceras perso-\nnas presentes, pero cuyo aspecto a valorar aparece como temporalmente inactivo.\nLa propuesta de análisis de la conversación casual de Eggins y Slade (1997) \nes la que da sustento a la descripción del chisme y que, a su vez, parte de los \nprincipios básicos e iniciales de la teoría de la valoración para encontrar las for -\nmas gramaticales, semánticas y discursivas mediante las que se realiza el chis-\nme. Una conversación casual (Eggins & Slade, 1997) es una manifestación lin-\ngüística en donde se negocia la construcción de la realidad social y tiene como \nobjetivos afirmar y reconfirmar, establecer y mantener relaciones. Desde esta \nperspectiva, las autoras se preguntan: ¿cómo se estructura la lengua para permi-\ntirnos hacer conversaciones? Primero, dividen en dos tipos las secuencias con -\nversacionales: las secuencias chat (extremadamente interactivas, en las que se \ndespliega una rápida alternancia de turnos) y las secuencias chunk (bloques con \nuna estructura interna predecible que puede ser descrita y analizada de acuerdo \ncon el género conversacional al que pertenecen).\nPara Eggins y Slade (1997), el chisme constituye un tipo de secuencia \nchunk en el que se distinguen al menos tres etapas obligatorias, es decir, aque-\nllas que lo definen como género conversacional y que le son exclusivas: el enfo-\nque en la tercera persona (third person focus) o identificación de los caracteres, \nla exposición del comportamiento probatorio (substantiating behavior) y la eva-\nluación peyorativa (pejorative evaluation).\nLos planteamientos de Eggins y Slade (1997) encuentran en la teoría de la \nvaloración (Martin, 2000; White, 2001, 2011; Kaplan, 2004, 2007; Martin & \nWhite, 2005; entre otros) el entramado teórico que los sustenta. Los analistas del \ndiscurso enmarcados en esta corriente buscan describir los sistemas de opciones \nsemánticas que ofrece la lengua para evaluar, adoptar posiciones, construir suje-\ntos textuales o identidades discursivas, asumir roles, negociar relaciones y pro-\nmover como naturales las posiciones intersubjetivas que son, en última instancia, \nideológicas (Kaplan, 2007). En particular, este enfoque se centra en la expre -\nsión lingüística de la actitud y el compromiso asumido por el emisor frente a sus \nenunciados. Del mismo modo indaga sobre las estrategias mediante las cuales el \nemisor se alía o se distancia de los receptores. En otras palabras, esta perspectiva \ndel análisis del discurso explora, describe y explica cómo es utilizado el lenguaje \npara gestionar posicionamientos y relaciones interpersonales (White, 2011).', '40 Fabiola Esmeralda López Rodríguez\nEstudios de Lingüística Aplicada, año 36, número 67, julio de 2018, pp. 9–43\ndoi: 10.22201/enallt.01852647p.2018.67.723\nRosnow, Ralph L., & Foster, Eric K. (2005). Rumor and gossip research. Psychological Sci -\nence Agenda, 19(3), 1–6. Recuperado de http://www.apa.org/science/about/psa/2005/04/  \ngossip.aspx\nVázquez García, Verónica, & Chávez Arellano, María Eugenia (2008). Género, sexualidad \ny poder. El chisme en la vida estudiantil de la Universidad Autónoma Chapingo, México. Es-\ntudios sobre las Culturas Contemporáneas, XIV(27), 77–112.\nWhite, Peter R. R. (2001). Un recorrido por la teoría de la valoración. Recuperado de  \nhttp://www.grammatics.com/appraisal/spanish_tr/spanishtranslation-appraisaloutline.pdf \nWhite, Peter R. R. (2011). Appraisal. En Jan Zienkowski, Jan-Ola Östman & Jef Verschueren \n(Eds). The Handbook of Pragmatic Highlights. Volumen 8. Discursive Pragmatics (pp. 14–\n36). Ámsterdam: John Benjamins. Recuperado de http://www.prrwhite.info/prrwhite,%20\n2011,%20Appraisal,%20%20Handbook%20of%20Pragmatics%20Highlights.pdf\nWilson, Peter J. (1974). Filcher of good names: An enquiry into anthropology and gossip. Man, \n9(1), 93–102. Recuperado de http://www.jstor.org/stable/2800038\nZienkowski, Jan; Östman, Jan-Ola, &Verschueren, Jef (Eds.) (2011). The Handbook of Prag-\nmatics. Ámsterdam: John Benjamins.']","I'm sorry, but the article you provided does not mention anything about 'Nueva Época' in LM V-2 Lingüística Mexicana. If you have any other questions or need information on a different topic within linguistics, feel free to ask!"
Who is Esther Herrera and what contribution did she make in the linguistic analysis of tlapaneco?,"['Las palabras como unidades lingüísticas”, los editores, Esther Hernández y Pedro Martín Butragueño, y los autores que ahí participan, muestran el complejo entramado que puede representar la palabra como categoría de análisis lingüístico. Los editores de esta obra mencionan en la introducción que el objetivo primordial del libro no es realizar una discusión teórica o reflexión metalingüística de la palabra ni mucho menos un estado de la cuestión, sino más bien observar cómo ésta se presenta como un aleph borgeano con múltiples caras en el que se puede vislumbrar historia, grafías, sociedades, segmentos, lenguas, morfemas y significados interactuando y que, por metodología, se aterrizan en investigaciones puntuales cuyo fin es describir dichas unidades en la praxis de las lenguas de estudio. El libro consta de diecisiete artículos distribuidos en tres secciones: “Palabras prosódicas y gráficas”, “La dimensión morfosintáctica y las clases de palabra” y “El papel del léxico”. Estos apartados analizan las palabras desde la fonología, la morfosintaxis y la lexicología, pero debe advertirse al lector que los análisis de cada trabajo no se centran en un área, dado que resaltan la multidimensionalidad y las interfaces en la descripción de esta categoría. De esta manera, la primera parte, titulada “palabras prosódicas y gráficas”, reúne cuatro artículos que miran la cara fónica (y gráfica) de las palabras en tres lenguas: español (oral y escrito), tepehuano y tlapaneco. En primer lugar, Concepción Company trabaja sobre el concepto de la palabra gramatical en español a través del estatus que se le otorga en las prácticas escriturarias o usus escribendi, es decir, las reglas fónicas, morfológicas y sintácticas a nivel de la escritura gráfica en escritos fechados del siglo xvi al xix a partir de la noción de sandhi externo (elisiones, amalgamiento, asimilación, etc.) y su frecuencia de uso. Por su parte, Gil Burgoin discute la palabra fonológica en el tepehuano del norte, la cual entra en conflicto con los clíticos tonales, dado que el tono alto es una propiedad culminativa. Esto ocurre cuando los “clíticos” se sufijan a las raíces con tono alto alterando la buena formación de la palabra prosódica, por lo que la interacción es mediada por restricciones de marcación que brindan una solución al pro- blema del isomorfismo con la palabra morfológica. En el tlapaneco, Esther Herrera mues- tra también un conflicto entre la marcación morfológica y la palabra fonológica, cuyo tamaño mínimo debe ser de dos moras. El análisis es guiado por la polaridad encontrada en los paradigmas nominales correspondientes a las flexiones de 1ª, 2ª y 3ª persona del posesivo y la elisión de la marcación de la segunda persona, que es provocada por los re- querimientos de tamaño mínimo. Al mismo tiempo, la autora hace una gran aportación al reflexionar en torno a fenómenos de la subaplicación, la sobreaplicación y la aplica- ción desatinada para entender los casos residuales, lo que sobre todo revela la gran com- plejidad en torno a los paradigmas de formas de palabras de las lenguas otomangues. Al final de esta sección, Pedro Martín Butragueño, autor y editor de este volumen, analiza el tamaño y la métrica de las palabras prosódicas en español en contextos postléxicos, es decir, en enunciados donde hay interrelación con clíticos y otras unidades prosódicas. El trabajo propone recursividad en el nivel jerárquico de palabra prosódica y concluye que ésta tiende a formarse por dos sílabas. Además, señala que hay dos clases de palabras rítmicamente hablando: las monoico-yámbicas y las trocaico-dactílicas. Un gran acierto']","In the tlapaneco language, Esther Herrera shows a conflict between morphological marking and phonological words, where the minimum size must be two moras. Her analysis is guided by the polarity found in the nominal paradigms corresponding to the inflections of 1st, 2nd, and 3rd person possessive and the elision of second person marking, which is caused by the requirements of minimum size. Additionally, she makes a significant contribution by reflecting on phenomena like subapplication, overapplication, and misapplication to understand residual cases, revealing the complexity surrounding word form paradigms in Otomangue languages.",single_hop_specifc_query_synthesizer,"['¿cóMo MediR el bilingüisMo?\nTabla 2. Competencia de español en la Casa Comunitaria de la ciudad de Durango\nClasificación Resultado prueba\nInformantes Cualitativa Cuantitativa Fónico Léxico Sintáctico Total\nElías A A 23 50 22 95\nEmilio A A 23 48 22.5 93.5\nRosalinda B\nAlina B\nElisa B A 20 49.5 15 84.5\nRocío A\nOliva A\nGermán A\nElsa C C 16 35 4 55\nMarta C C 14 43 5.5 62.5\nIsaías A A 18 47.5 19.5 85\nCintia B B 16 48.5 11.5 76\nBasilio A A 22 50 19 91\nSilvia C B 15 44 10 69\nRodrigo A B 16 47 19.5 82.5\nTrinidad A A 17 45 13 75\nAlberta A A 24 49 18.5 91.5\nGilberto A A 23 48 21.5 92.5\nFabiola B B 19 47 12 78\nAndrés B B 21 42 12 75\nEstos seis casos en los que se muestra una diferencia en la clasificación comparten \ntambién el hecho de que los puntajes obtenidos en la prueba de medición pueden ser \nconsiderados de frontera. Esto es, si observamos los resultados de Silvia para la ciudad \nde Durango, se aprecia que cualitativamente fue clasificada dentro del grupo con me -\nnor conocimiento, pero al obtener un puntaje de 69 se reclasificó dentro del tipo B, de \nconocimiento medio, con un rango de aciertos de 67 a 83. Vemos entonces que el resul-\ntado obtenido por Silvia es muy cercano a los valores más bajos de esta clasificación. \nLos resultados de este tipo nos muestran que el bilingüismo, a pesar de que por razones \nmetodológicas se hagan subdivisiones en tipos, es un fenómeno continuo. Esto nos per-\nmite nuevamente traer a cuento lo expuesto por Weinreich (1968 [1953]), quien insiste \nen que la evaluación o la clasificación en tipos de bilingüismo no se base en la idea de \nnormalidad y, sobre todo, que el nivel que muestren los hablantes de dos o más lenguas \ncambiará según las dinámicas sociales en las que se encuentre inmerso el hablante. Es \ndecir, las puntuaciones no se quedarán fijas, sino que se irán modificando a partir de la \nhistoria de vida de cada uno de los miembros de una comunidad bilingüe.\n79\nLM I-3\nLingüística Mexicana. Nueva Época, I (2019), núm. 3 (Especial): 63-89\nISSN: 2448-8194', 'Estudios de Lingüística Aplicada, año 41, número 76, enero de 2023, pp. 7–36\ndoi: 10.22201/enallt.01852647p.2023.76.1030\n[ 18 ] José Manuel Solís Navarro & Édgar Oswaldo González Bello\ncias sociales y humanidades en menor medida. Esto es atribuido \na las formas de construcción de conocimiento y la naturaleza aca-\ndémica de cada disciplina.\nAsí, el dominio del inglés supone diferentes áreas de análisis \nsegún las habilidades de la lengua (oral, auditiva, lectora, escrita). \nAdemás, junto con las formas de usar el idioma para la construc-\nción de conocimiento, se incluyen aspectos gramaticales de sin-\ntaxis, así como del vocabulario correspondiente a la naturaleza e \nintereses propios de las disciplinas.\n4. Método\nEsta investigación emplea un enfoque cuantitativo, no experimental \ny de alcance descriptivo-correlacional para analizar la relación en-\ntre distintas variables mediante pruebas estadísticas multivariables \n(Johnson & Christensen, 2017). Para la recolección de datos se \nutilizó una encuesta a través de un cuestionario en formato digital \n(http://mie.uson.mx/ingles/).\nEn cuanto a los sujetos, se obtuvo una muestra no probabilís-\ntica de 670 profesores de la Unison. Se consideraron académicos \nde todas las disciplinas, a excepción de quienes estaban adscritos \nal Departamento de Lenguas Extranjeras, debido a la naturaleza de \nlos contenidos y usos del inglés en sus actividades docentes. Las \ncaracterísticas de la muestra fueron: 53.9% del sexo masculino y \n46.1% del femenino; la edad de los participantes se ubicó entre los \n26 y 75 años (M = 48.6, DE = 11.61 años). Su antigüedad osciló \nentre 1 y 50 años (M  = 16.41, DE = 12.93 años). Con respecto a \ngrados de estudio, 31.8% contaba con maestría, obtenidas en su \nmayoría en México en un programa de calidad registrado por el \nConsejo Nacional de Ciencia y Tecnología (57.8%); solo 3.7% la \nrealizó en algún país de habla inglesa. A su vez, 58.1% de acadé-\nmicos había obtenido un doctorado; de estos, 37.5% lo acreditó \nen México en un programa de calidad y 5.5% en un país de habla \ninglesa. El resto de los profesores (10.1%) cuenta con grado de \nlicenciatura. En relación con los tipos de contrato, 51.3% cuenta', 'diccionarios\nCompany Company, Concepción. 2010. Diccionario de mexicanismos, México: Siglo xxi.  \nMerriam Webster. 2020. Merriam-Webster Unabridged Dictionary, en <http://unabridged.\nmerriam-webster.com> [consultado en noviembre de 2020]. \nÁlvarez Mellado, Elena. Observatorio Lázaro, Universidad de Brandeis <https://ob-\nservatoriolazaro.es/acerca.html> [consultado en noviembre de 2020]. \nCambridge University Press. 2020. Diccionario Cambridge inglés-español, <https://dictio-\nnary.cambridge.org/es/diccionario/ingles-espanol> [Consultado en noviembre de \n2020]. \nHarper Collins Publishers. 2020.  Collins  Unabridged Spanish to English and English to \nSpanish Dictionary <https://www.collinsdictionary.com/es/diccionario/inglesespa-\nnol> [Consultado en noviembre de 2020].\nDiccionario del español de México (dem). 2010. México: El Colegio de México. <http://\ndem.colmex.mx> [consultado en noviembre de 2020]\nReal Academia Española. Diccionario de la lengua española , en <http://dle.rae.es/> \n[consultado en noviembre de 2020]. \n36 mayra Haydee Tafoya cisneros y liHiT andrea Velázquez lora\nLM IV-2 \nLingüística Mexicana. Nueva Época, IV (2022), núm. 2: 15-38  \nISSN: 2448-8194']","I'm sorry, but there is no mention of Esther Herrera or her contributions to the linguistic analysis of Tlapaneco in the provided context. If you have any other questions or need information on a different topic, feel free to ask!"
What is the focus of the research on 'portugués' in the context of bilingual language assessment tools?,"['De esta manera, en “Léxico disponible y análisis de errores: un estudio de caso de portugués lengua extranjera”, Eréndira Camarena Ortiz analiza el papel del error como elemento constitutivo del proceso de adquisición de una segunda lengua. Es así como, a partir de las encuestas de léxico disponible aplicadas a un grupo de 104 alumnos universitarios, estudiantes de nivel intermedio de portugués, la autora se da a la tarea de detectar y organizar de manera sistemática los errores más comunes que éstos suelen cometer en cuanto a ortografía, interferencia léxica, transferencia léxica, sobregeneralización, hipercorrección, hibridación e invención léxica. En lo personal, me pa- rece que el hallazgo más interesante de este artículo es el modo como los estudiantes diseñan estrategias para producir palabras potenciales en función de sus intuiciones y conocimientos lingüísticos; de esta manera se hace patente la influencia que se puede dar entre dos lenguas con similitudes estructurales, como el español y el portugués, lo cual permite comprender las distintas variables que propician la aparición de fenómenos de interlengua observables en los datos recabados. En este sentido, no sólo se trata de considerar en qué nivel de aprendizaje se encuentra la población bajo estudio, sino que resulta igualmente importante conocer cuál es su lengua materna y qué otras lenguas han estudiado con anterioridad para comprender mejor las dificultades a las que habrá de enfrentarse en su proceso de aprendizaje y, por consiguiente, elaborar materiales didácticos específicos para distintos tipos de estudiantes. Por su parte, en el capítulo 4, “El léxico en el salón de clase de portugués como lengua extranjera: promoción de su aprendizaje mediante estrategias metacognitivas”, Leonardo Herrera González presenta los resultados de poner en práctica ciertas activi - dades focalizadas para fomentar y consolidar la competencia léxica de los alumnos de portugués como lengua extranjera. A partir del Modelo de lexicón mental propuesto por Ulrike Oster, Herrera González nos recuerda la complejidad de las palabras en cuan - to unidades lingüísticas vinculadas con información de tipo fonológico, grafemático, morfológico, sintáctico y semántico. Es justamente esta complejidad la que obliga a los profesores de lengua a buscar métodos eficaces para asegurar que el estudiantado logre comprender y retener los insumos léxicos que aprende en clase. A este respecto, median- te el subcomponente llamado Léxico disponible del portugués como LE para fines específicos se han desarrollado algunas actividades pedagógicas para impulsar, favorecer y afianzar el aprendizaje de léxico vinculado con distintos centros de interés. Tras hacer un listado del conjunto de actividades que se pueden emplear en el aula para dar cuenta de su apli- cabilidad, Leonardo Herrera describe la implementación de dos actividades utilizadas en el salón de clases para activar el conocimiento léxico de los estudiantes hispanoha - blantes de portugués de la Escuela Nacional de Lenguas, Lingüística y Traducción. De esta forma, sopesa las ventajas y alcances de ambos ejercicios para después reconocer algunas áreas de oportunidad que se deben explorar para continuar con los trabajos de sistematización y enseñanza del léxico en el aula.']","The research focuses on analyzing the errors commonly made by university students at an intermediate level of Portuguese as a foreign language. It delves into spelling mistakes, lexical interference, lexical transfer, overgeneralization, hypercorrection, hybridization, and lexical invention. Additionally, the study explores how students develop strategies based on their linguistic intuitions and knowledge to produce potential words, highlighting the influence of structural similarities between languages like Spanish and Portuguese.",single_hop_specifc_query_synthesizer,"['El chisme: estrategias discursivas desplegadas en su construcción 13\nEstudios de Lingüística Aplicada, año 36, número 67, julio de 2018, pp. 9–43\ndoi: 10.22201/enallt.01852647p.2018.67.723\nsonas ausentes (comportamientos, características o acciones) o a terceras perso-\nnas presentes, pero cuyo aspecto a valorar aparece como temporalmente inactivo.\nLa propuesta de análisis de la conversación casual de Eggins y Slade (1997) \nes la que da sustento a la descripción del chisme y que, a su vez, parte de los \nprincipios básicos e iniciales de la teoría de la valoración para encontrar las for -\nmas gramaticales, semánticas y discursivas mediante las que se realiza el chis-\nme. Una conversación casual (Eggins & Slade, 1997) es una manifestación lin-\ngüística en donde se negocia la construcción de la realidad social y tiene como \nobjetivos afirmar y reconfirmar, establecer y mantener relaciones. Desde esta \nperspectiva, las autoras se preguntan: ¿cómo se estructura la lengua para permi-\ntirnos hacer conversaciones? Primero, dividen en dos tipos las secuencias con -\nversacionales: las secuencias chat (extremadamente interactivas, en las que se \ndespliega una rápida alternancia de turnos) y las secuencias chunk (bloques con \nuna estructura interna predecible que puede ser descrita y analizada de acuerdo \ncon el género conversacional al que pertenecen).\nPara Eggins y Slade (1997), el chisme constituye un tipo de secuencia \nchunk en el que se distinguen al menos tres etapas obligatorias, es decir, aque-\nllas que lo definen como género conversacional y que le son exclusivas: el enfo-\nque en la tercera persona (third person focus) o identificación de los caracteres, \nla exposición del comportamiento probatorio (substantiating behavior) y la eva-\nluación peyorativa (pejorative evaluation).\nLos planteamientos de Eggins y Slade (1997) encuentran en la teoría de la \nvaloración (Martin, 2000; White, 2001, 2011; Kaplan, 2004, 2007; Martin & \nWhite, 2005; entre otros) el entramado teórico que los sustenta. Los analistas del \ndiscurso enmarcados en esta corriente buscan describir los sistemas de opciones \nsemánticas que ofrece la lengua para evaluar, adoptar posiciones, construir suje-\ntos textuales o identidades discursivas, asumir roles, negociar relaciones y pro-\nmover como naturales las posiciones intersubjetivas que son, en última instancia, \nideológicas (Kaplan, 2007). En particular, este enfoque se centra en la expre -\nsión lingüística de la actitud y el compromiso asumido por el emisor frente a sus \nenunciados. Del mismo modo indaga sobre las estrategias mediante las cuales el \nemisor se alía o se distancia de los receptores. En otras palabras, esta perspectiva \ndel análisis del discurso explora, describe y explica cómo es utilizado el lenguaje \npara gestionar posicionamientos y relaciones interpersonales (White, 2011).', 'El chisme: estrategias discursivas desplegadas en su construcción 37\nEstudios de Lingüística Aplicada, año 36, número 67, julio de 2018, pp. 9–43\ndoi: 10.22201/enallt.01852647p.2018.67.723\nparticipación las hablantes calculan y conjeturan cómo serán recibidas y eva -\nluadas sus emisiones por parte de la interlocutora, dependiendo de las relacio -\nnes interpersonales previas así como de la forma en que se esté desarrollando la \nconversación. El análisis me permite concluir que, en el contexto estudiado, los \nchismes son posibles en la medida en que se despliegan estrategias discursivas \nque están bajo el cuidado constante de la mitigación y que se corroboran o se \nmodifican constantemente gracias al uso de las estrategias interactivas.\nPuede añadirse que el grado de participación por parte de las hablantes en el \nchisme no es simétrico. La participación está en función de la cantidad de infor -\nmación que posean o de las estrategias interactivas que utilicen. El acercamiento \nque propongo, además de brindar una aproximación al chisme desde el análisis \ndel discurso, busca problematizar su estudio, ponerlo sobre la mesa de las inves-\ntigaciones actuales, evidenciando su alto valor interactivo, social y discursivo.\nEste estudio, si bien no agota el tema, pretende ser una llamada de atención \npara que los investigadores mexicanos de distintas áreas, pero sobre todo de la \nlingüística, posen su mirada en la práctica comunicativa denominada chisme. \nHay varias vetas que quedan abiertas. Sería muy interesante estudiar discursi-\nvamente el chisme desde otras perspectivas analíticas o en otros contextos, por \nejemplo, entre hombres.\n6. Referencias\nAhmed, Sara (2010). Analysing women’s talk and gossip between two female friends. En In -\nnervate. Leading Undergraduate Work in English Studies, (3), 1–14. Recuperado de  \nhttps://www.nottingham.ac.uk/english/documents/innervate/10-11/1011ahmedwomentalk.pdf\nBajtín, Mijaíl M. (1981). The dialogic imagination: Four essays. Austin: University of Texas \nPress.\nBajtín, Mijaíl M. (2005 [1982]). Estética de la creación verbal. México: Siglo xxi.\nBaumeister, Roy F.; Zhang, Liqing, & V ohs, Kathleen D. (2004). Gossip as cultural learn-\ning. Review of General Psychology, 8(2), 111–121. Recuperado de http://citeseerx.ist.psu.\nedu/viewdoc/download?doi=10.1.1.186.4613&rep=rep1&type=pdf\nBergmann, Jörg R. (1993). Discreet indiscretions: The social organization of gossip. Nueva York: \nAldine de Gruyter.', 'El chisme: estrategias discursivas desplegadas en su construcción 39\nEstudios de Lingüística Aplicada, año 36, número 67, julio de 2018, pp. 9–43\ndoi: 10.22201/enallt.01852647p.2018.67.723\n Hall, Joan Kelly (1993b). Tengo una bomba: The paralinguistic and linguistic conventions of \nthe oral practice. Research on Language and Social Interaction, 26(1), 55–83. Recuperado de \nhttps://www.researchgate.net/publication/233375372\nHandelman, Don (1973). Gossip in encounters: The transmission of information in a bounded so-\ncial setting, Man, 8(2), 210–227. Recuperado de http://www.jstor.org/stable/2800847\nHaviland, John Beard (1977). Gossip, reputation and knowledge in Zinacantan. Chicago: The \nUniversity of Chicago Press.\nHood, Susane, & Martin, James Robert (2005). Invocación de actitudes: el juego de la gra-\ndación de la valoración en el discurso. Revista Signos, 38(58), 195–220. Recuperado de  \nhttps://scielo.conicyt.cl/scielo.php?script=sci_arttext&pid=S0718-09342005000200004\nKaplan, Nora (2004). Nuevos desarrollos en el estudio de la evaluación en el lenguaje: la teoría \nde la valoración. Boletín de Lingüística, 22, 52–78. Recuperado de http://www.redalyc.org/\narticulo.oa?id=34702203\nKaplan, Nora (2007). La teoría de la valoración: un desarrollo de los estudios sobre la evaluación \nen el lenguaje. En Adriana Bolívar (Comp.), Análisis del discurso, ¿por qué y para qué? (pp. \n63–86). Caracas: Universidad Central de Venezuela.\nLevin, Jack, & Arluke, Arnold (1987). Gossip: The inside scoop. Nueva York: Plenum Press.\nLópez Rodríguez, Fabiola E. (2015). Antecedentes teóricos del chisme. En Gerardo Gutiérrez \nCham, Gerrard Mugford & Rosa Yáñez (Coords.), Argumentación discursiva en textos orales \ny escritos (pp. 93–114). Guadalajara: Universidad de Guadalajara.\nMartin, James Robert (2000). Beyond exchange: Appraisal systems in English. En Susan Hun-\nston & Geoffrey Thompson (Eds.), Evaluation in text: Authorial stance and the construction \nof discourse (pp. 142–175). Oxford: Oxford University Press.\nMartin, James Robert, & White, Peter R. R. (2005). The language of evaluation: Appraisal in \nEnglish. Nueva York: Palgrave Macmillan.\nPaine, Robert (1967). What is gossip about? An alternative hypothesis. Man, 2(2), 278–285. Re-\ncuperado de http://www.jstor.org/stable/2799493\nPaine, Robert (1970). Informal communication and information-management. Canadian Review \nof Sociology, 7(3), 172–188. doi: 10.1111/j.1755-618X.1970.tb01159.x\nPalmer, Frank R. (2001). Mood and modality. Cambridge: Cambridge University Press.\nPietrosemoli, Lourdes (2009). El chisme y su función en la conversación. Lengua y Habla, \n(13), 55–67. Recuperado de http://erevistas.saber.ula.ve/index.php/lenguayhabla/article/view \nFile/1033/1005']","I'm sorry, but the context provided does not mention any research specifically related to ""portugués"" in the context of bilingual language assessment tools. If you have any other questions or need information on a different topic within linguistics, feel free to ask!"
Who summarizes the conceptual axes and findings supporting the relevance of addressing available lexicon as a tool for second language learning?,"['LM V-2 Lingüística Mexicana. Nueva Época, v (2023), núm. 2: 119-123 ISSN: 2448-8194 En una línea similar, María Noemí Alfaro Mejía se adentra en la relevancia del estu- dio del léxico disponible en el salón de clases. Con ello, en el capítulo “Uso de encuestas de léxico disponible como herramienta de enseñanza en el salón de clases”, la autora aborda el estudio del léxico disponible desde una perspectiva cualitativa y advierte los beneficios pedagógicos de recurrir a este tipo de encuestas para diseñar módulos y estrategias para la enseñanza de vocabulario en la clase de portugués como lengua extranjera. Una vez presentado el método de trabajo característico de los estudios de disponibilidad léxica, Alfaro Mejía observa que es necesario considerar la elaboración de materiales didácticos centrados en la revisión de las características lingüísticas y comunicativas del vocabulario estudiado, así como buscar que los aprendientes entren en contacto con unidades léxicas pertenecientes a diferentes centros de interés. Para atender lo anterior, la autora detalla su experiencia al implementar un ejercicio que supone retomar los resultados obtenidos mediante las encuestas vinculadas a los centros de interés de la “ciudad” y el “campo”, para contrastarlos con el vocabulario empleado en la redacción de pequeños párrafos en los que se describen las principales similitudes y diferencias entre la vida citadina y la campirana. Para concluir este capítulo, Alfaro Mejía propone una tipología de ejercicios orientada al fortalecimiento y enriquecimien- to del léxico adquirido en el salón de clases. Finalmente, en el sexto y último capítulo del libro, Marisela Colín realiza una recapi- tulación de los ejes conceptuales y hallazgos que sustentan la pertinencia de abordar el léxico disponible como instrumento para el aprendizaje de segundas lenguas. Partiendo de la propuesta de Irandé Antunes, quien promueve un abordaje textual-discursivo para la enseñanza del léxico, se nos recuerda que la lengua es ante todo un proceso que se lleva a cabo en actos comunicativos específicos, de ahí que resulte fundamental tener en cuenta los ocho elementos constituyentes del plano textual, es decir, el tema, la fi- nalidad, el género discursivo, el medio, el destinatario, la modalidad, el nivel de formalidad y el contexto, los cuales motivan y encauzan la aparición de cierto léxico para dar cohe- rencia y sentido a aquello que se dice, se escucha, se lee y se escribe en determinadas situaciones comunicativas. Acto seguido, la autora interpreta el comportamiento del léxico disponible desde el Modelo Gravitacional de Gile. De esta forma se ahonda en la naturaliza dinámica del léxico y en la necesidad de elaborar materiales didácticos en los que el vocabulario adquirido se repase periódicamente. Una vez planteada y justificada esta propuesta teórica, la autora explica cómo implementar en clase once actividades didácticas, originalmente desarrolladas por los profesores de portugués como segunda lengua de la enallt, para mostrar su utilidad y validez como herramientas para el aprendizaje de distintos tipos de léxico. Desde mi punto de vista, el hecho de que estas actividades partan de una ficha pedagógica donde se explicita el nombre de la actividad, la lengua para la que está pensada, el nivel de lengua al que pertenece, su duración, su descripción, el objetivo pedagógico que se busca alcanzar, su procedimiento, el modo como debe evaluarse y algunas posibles alternativas o variaciones para llevarla a cabo hacen de ellas un terreno fértil para adaptarlas a distintas condiciones de enseñanza. Como se puede notar, se trata de un libro que será de suma utilidad para todos aquellos profesores de idioma y lingüistas aplicados que busquen entender el papel del']",Marisela Colín summarizes the conceptual axes and findings supporting the relevance of addressing available lexicon as a tool for second language learning.,single_hop_specifc_query_synthesizer,"['Para crear el rapport, se siguió el instrumento empleado por el Proyecto para el Es -\ntudio Sociolingüístico del Español de España y América ( preseea 2003) respecto del \nfenómeno de la evaluación. En lugar de considerar nueve temas generales, se tomaron \ncuatro –el tiempo, el lugar donde vive, la familia y la amistad, y las costumbres– y se \npidió al colaborador que conversara sobre ellos. En el tema de la familia y la amistad, \npor ejemplo, las preguntas fueron: ¿quién es tu mejor amigo?; ¿qué es para ti un amigo?; \n¿cómo debe ser una persona o qué debe hacer para que la consideres un buen amigo?; \n¿estás contento/a con tu forma de vida?, ¿por qué?; ¿qué estará haciendo tu familia\u200a/\u200atu \nmarido\u200a/\u200atu hijo\u200a/\u200atu padre ahora? Estos datos obtenidos durante los primeros 10 o 15 mi-\nnutos de grabación no se tomaron en cuenta para el estudio. \nEn la misma sesión se pidió a los colaboradores que compartieran tres narraciones de \nexperiencia personal: una sobre lo más emocionante que han vivido, otra sobre la expe -\nriencia más triste que han sufrido y otra sobre lo más peligroso a lo que se han enfrenta-\ndo. Se buscaba que expresaran alegría, tristeza y miedo para asegurar que se presentara \nel componente evaluativo en las narraciones, al tiempo que se favorecía el habla espontá-\nnea o natural en las entrevistas (Labov 1983). Un ejemplo de las indicaciones dadas es el \nsiguiente: Quisiera que me compartas si has vivido circunstancias peligrosas como algún robo, \naccidente o una situación en la que hayas estado en peligro de muerte. ¿Qué ocurrió? ¿Dónde \npasó? La narración oral se obtuvo en un tiempo de entre 15 y 25 minutos por colabora -\ndor. Antes de concluir la sesión, se solicitó a cada quien que eligiera su mejor narración. \nEn la segunda sesión, se pidió a los colaboradores que escribieron esa narración que \nseleccionaron e incluyeran un título para poder recuperarla; el único requisito era que \nla extensión fuera de una cuartilla3. Posteriormente, las narraciones (tanto orales como \nescritas) se transcribieron en procesador de texto (Word) con ortografía convencional. \nLuego, se creó una base de datos en hojas de cálculo (Excel) para hacer el análisis con \nel software Goldvarb X (Sankoff et al. 2005).\nTabla 2. Narraciones del corpus\n3\u2009Al final de la sesión, no se corroboró que el texto fuera legible. Así que, como aprendizaje del piloteo, \nen entrevistas posteriores, se pidió a cada niño o joven que leyera su texto en voz alta cuando la entrevis-\ntadora tenía dudas sobre lo escrito. \nGrupo de \nedad\nNarración oral Narración escrita\nTotal\nEmoción Tristeza Peligro Emoción Tristeza Peligro\nH* M H M H M H M H M H M\n9-10 años 1 1 1 1 4\n13-14 años 1 1 1 1 4\n17-18 años 1 1 1 1 4\n30 años y más 1 2 1 1 1 1 2 1 1 1 12\nTotal 2 4 2 2 2 0 2 4 2 2 2 0 24\n*H representa los hombres y M las mujeres.\n68 gLoria ELEna gómEz martínEz y rubí cEbaLLos DomínguEz\nLM III-2 \nLingüística Mexicana. Nueva Época, III (2021), núm. 2: 63-81  \nISSN: 2448-8194', 'Estudios de Lingüística Aplicada, año 38, número 71, julio de 2020, pp. 9–43\ndoi: 10.22201/enallt.01852647p.2020.71.900\nItem analysis of a multiple-choice test of incoming EFL students at a public university  [ 19 ]\nargues that an acceptable value should be set at 0.25 or 0.35, Mad-\nsen (1983) holds that values of 0.15 or above are generally accept-\nable, Alderson et al. (1995) mention that values of 0.40 or above\nare preferred, and Heaton (1988) states that the acceptable values\nrange from 0.30 and above. Following Heaton’s (1988: 182) ad-\nmonition that “[i]tems showing a discrimination index of below\n0.30 are of doubtful use”, the accepted id threshold in the current\nresearch was set at 0.30.\nBefore computing id, it was fi  rstnecessary to arrange the\nscores of the tests in order to identify the high- and low-scorers\n(see Table 3). Then, Flanagan’s method (see Hales, 1972) was uti-\nlized to approximate the correlation coeffi  cient:the top 27.5% of\nthe exams (n = 14) and the bottom 27.5% were analyzed. The id\nvalue of each item was then computed by subtracting the if of the\nlow-scoring group from the if of the high-scoring group for each\nitem, as shown by the following formula:\nTABLE 3. Item discrimination sample\nSTUDENT I 1 I 2 I 3 I 4 I 5 I 46 I 47 I 48 I 49 I 50 TOTAL\nSt 1 1 1 1 1 1 0 0 1 0 1 32\nSt 2 1 1 1 1 1 0 0 0 0 1 31\nSt 3 1 1 1 1 1 0 1 1 0 1 31\nSt 4 1 1 1 1 1 1 1 0 0 0 30\nSt 5 1 1 1 1 1 0 0 0 0 0 30\nSt 46 0 1 1 1 1 0 1 0 1 0 15\nSt 47 0 0 1 1 0 0 0 0 0 1 15\nSt 48 1 1 1 1 0 1 0 0 0 0 15\nSt 49 0 0 1 0 1 0 0 0 0 1 14\nSt 50 1 1 1 1 1 0 1 0 0 0 14\nID = IF of high-scoring group – IF of low-scoring group', 'un nivel indica, con un input de 0.61511, que las variantes que favorecen la presencia de \natenuadores de certeza son, por el tipo, narraciones de peligro orales (0.616) y escritas \n(0.516), así como narraciones de tristeza orales (0.522) y escritas (0.553); por sexo, \nhombres (0.532); y por edad, jóvenes de 17-18 años (0.592). En cambio, la desfavore -\ncen las narraciones orales de emoción (0.445), las mujeres (0.473) y los niños de 9-10 \naños (0.472) y de 13-14 años (0.383). Por lo demás, las narraciones escritas de emoción \n(0.499) y los adultos de 30 años y más (0.505) no parecen tener relación, estadística -\nmente hablando, con la presencia de atenuadores de certeza en las narraciones de ex -\nperiencia personal. En cuanto al análisis binomial de subida y bajada, se ve que no hay \nuna relación entre la función de certeza –que incluye los cuantificadores de atenuación, \nlas reformulaciones y las expresiones de duda– ni con tipo de narración, sexo o edad 12, \npor lo que no parecen incidir en la creación de un modelo para determinar la presencia \nde atenuadores de certeza a partir de las variables consideradas.\nFunción de veracidad. El análisis binomial de un nivel indica, con un input de 0.25713, \nque las variantes que favorecen la presencia de atenuadores de veracidad son, por su \ncategoría, narraciones de tristeza orales (0.608) y escritas (0.638), y narraciones escritas \nde peligro (0.590); por sexo, mujeres (0.536); y por edad, niños de 13-14 años (0.621) y \njóvenes de 17-18 años (0.628). La desfavorecen las narraciones de emoción tanto orales \n(0.434) como escritas (0.339), los hombres (0.457), los niños de 9-10 años (0.439) y los \nadultos de 30 años y más (0.432). La variante de narración oral de peligro (0.498) no \nparece tener relación, en términos estadísticos, con la presencia o ausencia de atenua -\ndores de veracidad en las narraciones de experiencia personal. \nEn el análisis binomial de subida y bajada, la edad resultó ser un factor determinan-\nte para los atenuadores de veracidad: los niños de 13-14 años (0.730) y los jóvenes de \n17-18 años (0.578) favorecen su presencia, no así los niños de 9-10 años (0.319) y los \nadultos de 30 años y más (0.436)14. En cambio, ni el tipo de narración ni el sexo resulta-\nron significativos para la función de veracidad. La edad, por lo tanto, sí participa en la \ncreación de un modelo para determinar la presencia de atenuadores de veracidad. \nEstos resultados pueden proyectarse, por su valor de significación, a todos los niños \nde 13-14 años y jóvenes de 17-18 años de San Luis Potosí, México.\nFunción de estima. Para realizar el análisis binomial sobre los atenuadores de estima, \npuesto que éstos no aparecen en los 23 registros de narraciones escritas de tristeza, en \nlos 26 registros de narraciones orales de peligro, en los 13 registros de narraciones es -\ncritas de peligro, en los 49 registros de los niños de 13-14 años ni en los 61 registros de \n11\u2009Total Chi-square\u200a\u200a=\u200a\u200a11.3919. Chi-square\u200a\u200a/\u200a\u200acell\u200a\u200a=\u200a\u200a0.5425. Log likelihood\u200a\u200a=\u200a\u200a-209.010.\n12\u2009Logaritmo de verosimilitud\u200a\u200a=\u200a\u200a-213.146. Valor de significación\u200a\u200a=\u200a\u200a0.126.\n13\u2009Total Chi-square\u200a\u200a=\u200a13.2939. Chi-square\u200a\u200a/\u200a\u200acell\u200a\u200a=\u200a\u200a0.6330. Log likelihood\u200a\u200a=\u200a\u2006-175.735.\n14\u2009Logaritmo de verosimilitud\u200a=\u200a-178.351 de subida y de bajada. Valores de significación \u200a=\u200a0.001 (de \nsubida) y 0.486 (de bajada).\n76 gLoria ELEna gómEz martínEz y rubí cEbaLLos DomínguEz\nLM III-2 \nLingüística Mexicana. Nueva Época, III (2021), núm. 2: 63-81  \nISSN: 2448-8194']","I'm sorry, but the context provided does not contain information about summarizing the conceptual axes and findings supporting the relevance of addressing available lexicon as a tool for second language learning."
How did the linguistic researcher's encounter with Alain Rey in Montreal relate to their previous interactions in Mexico?,"['<1-hop>\n\ndiccionario de autoridades, que serviría para reforzar la idea elitista de la lengua española. Tiem- po más tarde, Kurt Baldinger me contó que Alain Rey me llamaba “experto en mexicographie”. Muchos amigos saben que la lexicografía francesa, presidida por la pareja Rey-Debove, fue la principal influencia de nuestro trabajo. A finales de la década de 1970, quizá hacia 1977 o 78, había yo organizado en El Colegio de México lo que llamaba “Café de lingüistas”. Nos reuníamos los interesados a conversar sobre cualquier tema lingüístico que nos interesara –no sólo lexicografía– y, cuando había oportunidad, invitábamos a algún colega. Los Rey-Debove vinieron a México, quizá invitados por su embaja- da, así que aproveché para que fueran a platicar con nosotros y para que les mostráramos nuestro avance incipiente y nuestras dudas. Pasamos una horas exigentes y agradables, que luego corona- mos con una cena en el restaurant San Ángel Inn. Pocos años después coincidí con él en Montreal, invitados ambos por el Conseil de la Langue Française de Quebec, gracias al interés de Jacques Maurais, cuando se dio la coincidencia de que tanto en Francia como en México había control de cambios de moneda. Yo llevaba treinta dólares que me habían sobrado de un viaje anterior y esperaba que los administradores del Conseil enviaran a recogerme en el aeropuerto, me llevaran a un hotel y me dieran dinero para viáticos, como lo aseguraba la invitación. No había nadie es - perándome en el aeropuerto, así que tomé un autobús al centro de Montreal y busqué un hotel a donde había yo llegado un par de años antes. Después de pagar el autobús, me quedaban unos 20 dólares; me registré en el hotel y no tuve que pagarlo de inmediato, pues expliqué que el pago co- rría a cargo del Conseil. Al día siguiente me dirigí a la sede del encuentro, en donde se disculparon los organizadores conmigo, por haber malentendido mi hora de llegada. Me dieron un cheque para cambiarlo en el banco. ¡A Alain Rey le había sucedido lo mismo! Así que juntos nos fuimos a un banco a cambiar nuestros cheques, para poder pagar hotel, comidas, etc. En un banco, después en otro, no quisieron pagarnos el cheque, porque, dijeron, el gobierno de Quebec no tenía buen crédito. Al tercer banco al que entramos, se acercó el gerente a nosotros y dijo: “Usted es Alain Rey, ¿verdad? Yo le oí una conferencia en París. ¿Qué lo trae por aquí?” Él le explicó nuestro predicamento y, muy amablemente, nos cambió los cheques. La ventaja de ser amigo del maestro. Después de entonces ya no volví a ver a los Rey-Debove, aunque les envié mi libro de Teoría del diccionario monolingüe y la primera edición del Diccionario del español de México . En el libro Dictionnaire amoureux des dictionnaires (Plon, 2011) escribió Alain Rey acerca de los dic- cionarios del español: “Pero esas recolecciones no encaran la necesidad de describir el uso real de un país o de una región, y no una adición de diferencias en relación con el español de Europa. El paso de un diccionario general hacia una variedad del español fue dado por un lingüista del Colegio de México, Luis Fernando Lara”. Luis Fernando Lara El Colegio de México Miembro de El Colegio Nacional lara@colmex.mx', '<2-hop>\n\ndisponibilidad léxica y exclusión social. datos sociolingüÍsticos de la ciudad de México corpus y metodoLogía Los datos que sustentan la presente investigación forman parte del estudio de Montiel (2019); en él se hizo una primera exploración de la disponibilidad léxica y la exclusión social. Dicho acercamiento fue semasiológico. Se pidió a 36 hablantes (distribuidos si- métricamente en género y en tres grupos de edad) que definieran diez disfemismos so- cioeconómicos (chaca, chairo, gato, indio, indígena, lépero, naco, ñero, pelado y rupestre). A partir de un análisis de las respuestas obtenidas, en el que se buscaron rasgos comparti- dos o más repetidos en cada grupo de edad, se crearon definiciones de estas palabras por cada grupo etario, es decir: diez definiciones que reflejaran las respuestas dadas por los jóvenes, diez de los adultos y siete de los mayores (ya que estos últimos no reconocieron los vocablos chaca, chairo ni rupestre), esto suma 27 definiciones diferentes. A partir de ellas se formó la encuesta onomasiológica utilizada en el presente artículo. Un ejemplo de definición construida a partir del análisis de las respuestas proporcionadas por los jóvenes fue la del lexema chaca: “Referido a personas que gustan del género musical re- guetón, se expresan de manera vulgar o grosera, y por su forma de vestir y de peinarse son calificados como delincuentes”; la cual se le presentaba a los colaboradores para que ofrecieran la palabra o palabras que mejor se ajustaban a dicha definición. La encuesta onomasiológica se llevó a cabo con dieciocho informantes distintos a los de la prueba semasiológica. El objetivo original de la encuesta onomasiológica era con- firmar que los encuestados empataban las 27 definiciones creadas con los diez vocablos originales. Sin embargo, no sólo emergieron las diez palabras buscadas, sino un total de 135 vocablos, todos relacionados con la exclusión social. Una observación interesante es que, durante la prueba semasiológica (Montiel 2019: 87-164), cuando a los encues- tados se les preguntaba por términos diferentes a los diez vocablos arriba mencionados, en su mayoría contestaban que desconocían otras formas. Sin embargo, los dieciocho hablantes del presente estudio, ante las definiciones proporcionadas, no dudaron en producir más léxico relacionado con la discriminación social, lo que puso en evidencia el alto nivel de interdicción lingüística presente en dicho ámbito, además de la conve- niencia de presentar diferentes definiciones para acceder a más léxico 6. Regresando al ejemplo de chaca, se esperaba que ésta fuera la primera respuesta y también la más co- mún, al menos para los colaboradores jóvenes, sin embargo, se obtuvieron también los siguientes vocablos: reguetonero (5), chaca (3), cholo (2), corriente, desalineado, detestable, miserable, pandillero, reguetoñero, vulgar y naco. La muestra de los dieciocho hablantes encuestados se distribuye en seis personas por cada grupo etario (jóvenes: 18 a 30 años; adultos: 31 a 49 años; mayores: de 50 años en adelante); asimismo, cada grupo de edad está equilibrado respecto al factor género. Se trata de una red social (Milroy 1991) de clase media vinculada principalmente por pa- rentesco. Si bien es complejo hablar de una clase media uniforme en México, al tratarse en este caso de una misma red social existe un mayor control en cuanto a la pertenen- 6 Las definiciones y sus respuestas se pueden consultar en el Anexo de este artículo. 73']","The linguistic researcher's encounter with Alain Rey in Montreal was a result of their previous interactions in Mexico, where they had organized linguistic gatherings and discussions. The researcher coincided with Alain Rey in Montreal, both invited by the Conseil de la Langue Française de Quebec. They faced a predicament with currency exchange and hotel payments, which led them to visit multiple banks. Eventually, a bank manager recognized Alain Rey and helped them cash their checks, highlighting the advantage of being friends with a respected figure. This encounter in Montreal was a continuation of their previous interactions and shared linguistic interests.",multi_hop_specific_query_synthesizer,"['Lingüística Mexicana. Nueva Época, v (2023),  \nnúm. 1: 65-95 ISSN: 2448-8194\nLicencia Creative Commons Attribution-Non-\nCommercial (CC BY-NC) 4.0 International\nFecha de recepción: 15 de febrero de 2022\nFecha de aceptación: 19 de junio de 2022\nDinorah Beatriz Montiel Pérez\nUniversidad Autónoma Metropolitana-Iztapalapa\ndin.din.dm@gmail.com\nJulio César Serrano\nUniversidad Autónoma Metropolitana-Iztapalapa\njserrano@izt.uam.mx\nDisponibilidad léxica y exclusión social.  \nDatos sociolingüísticos de la Ciudad de México\nLexical availability and social exclusion.  \nSociolinguistic data of Mexico City\nRESUMEN: En este trabajo se analizan disfemismos socioeconómicos en \nel español de la Ciudad de México, en una red social de clase media. A \ntravés de una encuesta onomasiológica se obtuvieron 135 vocablos refe -\nrentes a la exclusión social. Los resultados arrojan luz sobre el léxico de \ntres grupos de edad. El concepto de prototipicidad se utiliza para distin -\nguir la relación entre el vocabulario y los dominios temáticos donde se  \nenfoca la discriminación. El dominio temático de la exclusión social  \nse subdividió en ocho sub-dominios. La investigación aporta al conoci -\nmiento del léxico de la discriminación en grupos sociales medios de la \nCiudad de México y, metodológicamente, ofrece una alternativa para la \nobtención de léxico pasivo y activo en los estudios de disponibilidad léxica.\nABSTRACT: This article presents a sociolinguistic analysis of a group \nof dysphemisms in the Spanish of Mexico City. It is based on data \nrecollected from interviews with members of a middle-class social \nnetwork. An onomasiological survey allowed the authors to obtain a \ntotal of 135 words referring to social exclusion, which distribute vari -\nably through three age groups. The concept of prototypicity is used in \nthe analysis for understanding the relationship between lexicon and the \nthematic areas where discrimination is focused. The thematical area of \n“social exclusion” was subdivided into eight sub-areas, which oriented \nthe main analysis. This research contributes to the knowledge of the \nlexicon of discrimination in middle class speakers in Mexico City and, \nmethodologically, it offers an alternative procedure for obtaining both \npassive and active vocabulary in lexical availability studies.\nPalabras clave:  \ndisfemismo,  \nprototipicidad,  \nneologismos,  \nobsolescencias,  \ndispersión léxica.\nKeywords:  \ndysphemism,  \nprototypicity,  \nneologism,  \nobsolescence,  \nlexical dispersion.', 'Lingüística Mexicana. Nueva Época, II (2020), núm. 1: 159-161\nISSN: 2448-8194\nJuan Gabriel Nadal Palazón. Discurso ajeno en titulares periodísticos: \nun nuevo modelo de análisis.  Universidad Nacional Autónoma \nde México, México, 2018; 388 pp. \nEnrique Meléndez Zarco\nUniversidad Nacional Autónoma de México\nzarcounam@gmail.com \nu \nna de las posibilidades básicas de todo acto comunicativo es poder recuperar las \npalabras dichas o enunciadas por el otro en un marco sociolingüístico específico. \nEl procesamiento del habla ajena en la propia constituye, sin duda, un asunto crucial \nen los estudios sobre el lenguaje, de ahí que se considere como parte esencial del fun -\ncionamiento de toda lengua y aun como un comportamiento social del ser humano en \ncualquier cultura. El libro Discurso ajeno en titulares periodísticos: un nuevo modelo de aná-\nlisis, que en esta ocasión nos presenta el doctor Juan Gabriel Nadal Palazón, del Instituto \nde Investigaciones Filológicas de la unam, se aboca justamente al estudio de esta tarea \nen un ámbito donde la lengua española se aloja y reluce con particular naturalidad: el \ndiscurso periodístico en los titulares de nota informativa. \nEl libro está integrado de un conjunto de siete capítulos y un apartado de apéndices, \nen el cual el autor nos pone en relación no sólo con el estado actual y tradicional de la \nliteratura generada sobre los encabezados periodísticos y el discurso ajeno, sino también \npropone una metodología pertinente de base lingüística que, si bien fue pensada para \nel estudio que se desarrolla a lo largo de 388 páginas, su aplicación puede extenderse \na otro tipo de quehaceres científicos. El propósito fundamental es realizar una caracte -\nrización y descripción de los mecanismos lingüísticos de 3 689 titulares de nota infor -\nmativa pertenecientes a diez países del mundo hispanohablante, en suplementos como \nEl País (España), La Opinión (Estados Unidos), El Universal (México), La Nación (Costa \nRica), Hoy (República Dominicana), El Tiempo (Colombia), El Nacional (Venezuela), El \nComercio (Perú), El Mercurio (Chile) y Clarín (Buenos Aires), en un periodo temporal que \nva del 18 al 24 de enero de 2010. Asimismo, toma en cuenta diversas ediciones de pe -\nriódicos españoles, rotativos mexicanos y publicaciones periódicas varias pertenecientes \na los países mencionados, que reúne en cuatro muestras correspondientes a 2004, 2005, \n2007 y 2009.\nEl primer capítulo, “Los titulares periodísticos”, presenta un marco de referencia \nmuy ilustrativo sobre las prácticas editoriales, las funciones, la configuración lingüística \ny los orígenes de los encabezados de la nota informativa –por cierto, el género periodís-\ntico más abundante en los medios de comunicación–, a los cuales, las más de las veces, \nse ha asignado apelativos “más pintorescos que esclarecedores”, a saber: “versos con \nolor a tinta”, “el señuelo de la noticia”, “la incitación periodística”, “escaparates de la \ninformación”, “la primera puerta de la noticia”, “tarjetas de presentación”, “la luz que \natrae y fija la huidiza atención del lector” (Nadal 2018: 27). Aclara el autor que el titular', 'Del tratamiento de falsos amigos en un diccionario electrónico de dudas 11\nEstudios de Lingüística Aplicada, año 30, número 56, diciembre de 2012, pp. 9-33\nintroDucción\nEn este artículo, las autoras quieren aportar unas consideraciones acerca de la \ninformación pertinente en las entradas de un diccionario electrónico de dudas \n(DeD) alemán/español para hispanohablantes.1 El estudio se centra en la inclusión \nde falsos amigos y pretende demostrar que estos, sin duda, constituyen un ámbito \npertinente para una obra de estas características dado que tal y como afirma Doval \n(2006: 466): “Los falsos amigos presentan un problema muy importante y muy \nfrecuente tanto en la traducción como en la didáctica de la lengua extranjera al \nque el diccionario bilingüe presta apenas atención”.\n2\nSi esto es así, un diccionario en soporte electrónico podría cambiar esta \nrealidad. Su elaboración depende de múltiples factores, aunque consideramos \nque tres son los puntos clave: los criterios de usabilidad3 del diccionario, el perfil \nde sus usuarios y los fines perseguidos con dicha herramienta. Teniendo en cuen-\nta los criterios de usabilidad, el diccionario en soporte digital —como veremos \nmás adelante— se presta de manera formidable a entradas de tipo falso amigo, ya \nque esta herramienta permite una organización de la interfaz sencilla, dispone de \nuna flexibilidad en cuanto al espacio, ofrece la posibilidad de disponer de manera \nlógica los distintos elementos como colores de hipervínculos, estados de los dis-\ntintos botones, entre otras consideraciones. Además, por analogía con convencio-\nnes cul turales y estándares establecidos es fácil para el usuario reconocer las \netiquetas y símbolos utilizados (Cf. Torres, 2009: 16). Todos estos recursos ayu-\ndarán sobremanera a facilitar la comprensión del fenómeno falso amigo, que en \nmuchas ocasiones puede convertirse incluso en un verdadero enemigo peligroso.  \n \n1 Por razones de espacio, las autoras se han visto obligadas a dejar de lado la problemática de la \nvariación dialectal de los latinismos en el español. Sin duda se trata de un problema complejo que \nmerecería su debida atención. En el análisis de los casos del presente artículo se ha observado in-\nformación a tal respecto que no siempre coincidía. Por ejemplo, en cuanto a “competencia” (caso 3)  \nobservamos su sinónimo “competición (deportiva)” registrado en los tres diccionarios menciona-\ndos, marcado como “americanismo” (drae, clave) y uso en “zonas del español meridional”.\n2 La traducción de las citas en alemán e inglés es nuestra.\n3 Usamos este término en el sentido de, por ejemplo, Wiegand & Fuentes, 2010: 232 y Azorín Fernández \n& Santamaría Pérez (2011).\nELA 56 interiores.indd   11 15/01/14   20:25']","The context provided does not mention any encounter between the linguistic researcher and Alain Rey in Montreal or any previous interactions in Mexico. Therefore, based on the information available, there is no connection between the linguistic researcher's encounter with Alain Rey in Montreal and any previous interactions in Mexico."
How does the study of the Corpus Sociolingüístico de la Ciudad de Puebla contribute to understanding language variation in Mexico?,"['<1-hop>\n\nLingüística Mexicana. Nueva Época, II (2020), núm. 2: 189-193 ISSN: 2448-8194 donde, pese a la situación de diglosia flexible que hay entre el inglés y el español, pa - rece ser que las generaciones más jóvenes ceden más y más espacios de uso a la lengua mayoritaria por sobre la lengua de origen heredada ‒en este caso, el español. Por su parte, Miroslava Cruz Aldrete y Julio Serrano nos dan a conocer un poco sobre el contacto lingüístico en la comunidad de sordomudos en México y el desarrollo de la Lengua de Señas Mexicana (lsm), producto de las migraciones no sólo de los primeros instructores americanos o franceses que llegan al país, sino de sus hablantes actuales. Muestra de ello se tiene en la reagrupación de las tres ciudades consideradas para el estudio en solo dos grupos ‒Ciudad de México y Guadalajara frente a Tijuana‒ por la interferencia o no de la Lengua de Señas Americana ( asl) en cada dialecto tratado. Al mismo tiempo, los dos autores muestran que se trata de una comunidad de habla que, a diferencia quizá de lo que sucede en el contexto haitiano-dominicano, prefiere buscar todo el tiempo una acomodación lingüística que le permita la convivencia y la postula- ción de una estandarización de su lengua, en lugar de un uso lingüístico que los atenga a la desigualdad y al conflicto. Ahora bien, es el texto de Manuel Díaz Campos y Jason Killam el único estudio en el libro que nos ofrece un acercamiento al reconocimiento de la variación no sólo apoyán- dose en la producción de habla, sino en su comprensión. El experimento perceptual con colaboradores españoles, peruanos y venezolanos que nos ofrece señala la indización que como oyentes somos capaces de realizar respecto a las características individuales de los hablantes ‒sexo, edad, etcétera‒ o a su pertenencia a cierta comunidad lingüística ‒identificación de dialectos como el argentino, el chileno, el colombiano, el mexicano, el costarricense, el español y el peruano. En el segundo apartado de esta obra, se conjuntan seis colaboraciones sobre la des - cripción y comparación de los valores prosódicos que resultan pertinentes para la deli - mitación geolingüística del habla de países como México o Colombia. Son justamente los autores Pedro Martín Butragueño y Yolanda Congosto que, siguiendo la línea temática sobre migración del apartado anterior, introducen esta sección con la revisión de datos prosódicos de inmigrantes procedentes de distintas entidades mexicanas y de migrantes mexicanos en Los Ángeles, California, respectivamente. Ambos apuestan no sólo por corroborar y comparar los rasgos prosódicos que se han descrito para variedades como la de la Ciudad de México y los que son producto del contacto lingüístico, sino además, como lo hace Martín Butragueño mediante juicios lingüísticos, dar cuenta de la capaci- dad de adaptación, neutralización o mantenimiento de los rasgos prosódicos en el habla de estos migrantes. Establecen, en fin, una correlación de éstos con variables sociales. Erika Mendoza nos otorga una descripción de los patrones prosódicos utilizados en los enunciados declarativos de foco amplio del español de Cuapiaxtla, Tlaxcala, que, al confrontar los rasgos encontrados ya para la Ciudad de México y Puebla, sirve para proponer una delimitación interdialectal de las variedades del español central mexica- no. De igual manera, el trabajo de Carlos Ivanhoe Gil ‒parte de la crítica de que pese a que la entonación es un valor dialectal fácilmente advertido, ha tenido un tratamiento pobre en términos geolingüísticos‒, contribuye a reconocer qué configuraciones tona - les y rasgos prosódicos son viables para realizar una proyección geográfica de las zonas', '<2-hop>\n\nEl Corpus Sociolingüístico de la Ciudad de Puebla está conformado por entrevistas di- vididas en dos subcorpus: el que recoge datos de los oficios tradicionales y de la flora y la fauna, y el corpus Preseea-Puebla, el cual incluye la conversación semidirigida y un cuestionario sociológico, y se complementa con pruebas lingüísticas basadas en el cscm. El primero resguarda conversaciones que dan cuenta de los oficios tradicionales representativos de la ciudad de Puebla, como la panadería, la siembra de durazno en Huejotzingo o el trabajo con piedra en San Salvador el Seco. En este apartado la autora pone a dialogar dos perspectivas teóricas para el estudio de este tipo de repertorios: la terminología y la lexicología. Lo anterior se debe a que las características altamente referenciales acercan a los repertorios a los léxicos de especialidad y, al conservar su carácter tradicional, los hacen muy interesantes para los estudios lexicológicos. El estar en la frontera entre lo especializado y lo popular ha hecho que los estudios etnográficos o antropológicos reciban mayor atención. Posteriormente, tenemos una descripción detallada del levantamiento de las 108 entrevistas que conforman el corpus; se describen las variables sociales consideradas, la manera de llevar a cabo la conversación para que, en la medida de lo posible, conser- vara su carácter semidirigido, y la descripción de las pruebas lingüísticas elicitadas. De la prueba de actitudes y creencias la autora anota resultados comparativos interesantes entre las respuestas de los entrevistados del Corpus Sociolingüístico de la Ciudad de Méxi- co y las de los hablantes que conformaron el corpus poblano en relación con preguntas como “¿Qué es hablar bien?”, en donde se nota que “para los informantes de Puebla el trato con el otro y el deber como usuarios de la lengua son lo más importante a fin de hablar bien [mientras que para los hablantes de la Ciudad de México] el habla de quie- nes tienen la autoridad por su conocimiento es relevante” (p. 59). Lo anterior es sólo un ejemplo de las muchas líneas de investigación que estos corpus nos ofrecen. El tercer capítulo es un ejemplo del diálogo interdisciplinario entre la lexicología, la lexicografía y la ingeniería lingüística. En este apartado la autora propone una me- todología para el procesamiento de textos provenientes de un corpus de habla de gran volumen. Este tipo de análisis cuantitativo hace más manejable el corpus para su lema- tización y el análisis de concordancias. Gracias a ellos, pudo obtener vocablos que cali- fica como compartidos con otras variantes del español, pues aparecen registrados en el lemario del Diccionario del Español de México6 (dem). En cuanto a los vocablos que no aparecen registrados en el dem, la autora apunta a que pueden tratarse de posibles po- blanismos; sin embargo, se requiere de una documentación exhaustiva para corroborar o descartar este estatus, debido a que muchos de ellos son propios de la oralidad y, por lo tanto, es difícil encontrarlos documentados en fuentes escritas; ésa podría ser una de las razones por las que no están registrados en el dem. 6 Versión en línea consultada en <https://dem.colmex.mx/>. 154 Anayeli Hernández Cruz LM VI-2 Lingüística Mexicana. Nueva Época, vi (2024), núm. 2. ISSN: 2448-8194']","The study of the Corpus Sociolingüístico de la Ciudad de Puebla contributes to understanding language variation in Mexico by providing insights into the prosodic values relevant for geolinguistic delimitation of speech in countries like Mexico. It includes data from interviews on traditional trades, flora, fauna, and sociological questionnaires, highlighting the interaction between terminological and lexicological perspectives. The corpus also explores attitudes and beliefs about language use, revealing differences in linguistic norms between speakers from Puebla and Mexico City.",multi_hop_specific_query_synthesizer,"['Algunas exploraciones en torno a la reflexión metalingüística sobre la ironía 17\nEstudios de Lingüística Aplicada, año 35, número 66, diciembre de 2017, pp. 9–39\ndoi: 10.22201/enallt.01852647p.2017.66.827\npretación irónica: aunque María literalmente dice que la fiesta estuvo fantástica, \nen realidad quiere expresar que no le gustó.\nSi bien la teoría de Sperber y Wilson (Wilson & Sperber, 1992, 2004) ha \nsido objeto de críticas (al respecto véase, entre otros, Attardo, 2000, y Kalber -\nmatten, 2006), también ha recibido un importante soporte experimental (Kal -\nbermatten, 2006). Por tanto, consideramos que resulta ser una herramienta vá-\nlida para el estudio sobre la manera en que los niños y adolescentes interpretan \nlas expresiones irónicas. Por otra parte, creemos que esta aproximación permite \nanalizar la forma en que un individuo hace una reflexión sobre el lenguaje en sí \nmismo (mención en términos de la teoría de la relevancia, reflexión metalingüís-\ntica en términos de Gombert, 1992).\n1.4. Aspectos que inciden en la interpretación de la ironía verbal\nDesde la propuesta de la teoría de la relevancia (Wilson & Sperber, 1992, 2004) \nse asume que para interpretar un enunciado irónico el oyente debe percatarse de \nque no puede tratarse de una emisión literal. Para lograr lo anterior, cuenta con \ninformación generada por diversas fuentes contextuales. Al respecto, Yus (2000, \n2009) propone que existen siete fuentes contextuales que aportan información \nrelevante para lograr la adecuada interpretación de un enunciado irónico: cono-\ncimiento enciclopédico general (conocimiento que se tiene acerca del mundo: \ninformación social y cultural que permite interpretar más fácilmente una expre-\nsión irónica); conocimiento enciclopédico específico del interlocutor (gustos, \nhábitos, creencias, opiniones y demás información); conocimiento de sucesos o \nacciones que ocurrieron poco tiempo antes de la expresión irónica; enunciados \nprevios a la conversación; comunicación no verbal vocal y visual (entonación, \ngestos faciales, sonrisas); elecciones léxicas o gramaticales (pistas lingüísticas \ncomo adjetivos con connotación de cualidad extrema, adverbios, superlativos, \nrepeticiones innecesarias, frases convencionalmente irónicas) y la información \nproveniente del entorno físico que rodea a los interlocutores. De acuerdo con el \nautor, la presencia / ausencia de dichas fuentes contextuales impactará en el ac-\nceso que pueda tener un individuo a la interpretación irónica. De esta manera, a \nmayor saturación, es decir, a mayor cantidad de fuentes contextuales, más fácil \ny rápida será la interpretación irónica. Específicamente para fines de este estu -', 'Algunas exploraciones en torno a la reflexión metalingüística sobre la ironía 21\nEstudios de Lingüística Aplicada, año 35, número 66, diciembre de 2017, pp. 9–39\ndoi: 10.22201/enallt.01852647p.2017.66.827\n2.5. Transcripción y análisis\nLas intervenciones de cada uno de los participantes fueron videograbadas para fi-\nnes de transcripción y análisis. En un primer momento se procedió a categorizar \nlas respuestas sobre la interpretación de los textos. Dentro de este rubro se con -\nsideraron como aciertos aquellas respuestas que permitieran vislumbrar que el \nparticipante había interpretado el enunciado irónico de una manera no literal (ej.: \nle dijo algo en forma de mentira para hacerlo sentir mal; lo dice como para que \nse sienta mal; lo dijo para contradecirla) y el no irónico como literal (ej.: le está \nafirmando que su tiempo fue muy bueno; la felicitó porque se aprendió muy bien \nel poema). En un segundo momento se procedió a analizar las reflexiones metalin-\ngüísticas que presentaron los participantes sobre los textos, por lo que se codifi -\ncaron todas las respuestas que daban cuenta de las razones por las que los niños y \nadolescentes consideraban que un enunciado era irónico o no, fueran correctas o \nno. Las respuestas fueron entonces clasificadas en tres categorías generadas a pos-\nteriori a partir de las respuestas de los participantes: categoría de contenido, cate-\ngoría de forma y categoría de actuación. Dichas categorías no eran excluyentes en-\ntre sí, por lo que algunas respuestas podían ser clasificadas en más de una de ellas.\nLas respuestas de contenido incluyeron todas las reflexiones de los partici-\npantes que hacían alusión a los eventos, sucesos, trama y personajes que apare-\ncen en los textos, es decir, al contenido mismo de las situaciones planteadas por \nel texto (ej.: porque Camila estaba muy segura de que iban a ganar el partido \npero a la mera hora no; Juan, como es amigo de Camila, quiso ser bueno con \nella y no lastimarla; ella sabe que está podrida y eso no concuerda; si son ami-\ngas no le puede mentir así; es de broma solamente porque ella vio la pizza y se \nve podrida). Por su parte, bajo la categoría de forma se agruparon las respuestas \nen las que los participantes hacían mención a la manera en que estaba construi-\ndo el texto o las palabras usadas en el mismo, es decir, que denotaban un aná-\nlisis del texto como objeto en sí mismo (ej.: tiene sarcasmo; no dice explícita-\nmente, lo dice con sarcasmo; muchas veces es por el tono; porque la palabra \n‘fantástico’ es algo como bueno; lo dice con una forma en la que suena correc-\nto pero está diciendo una mentira; le dice un texto ofensivo). Finalmente, en la \ncategoría de actuación se incluyeron las respuestas de los niños y adolescentes \nque denotaban una reflexión sobre el posible impacto que el texto o la frase iró-', 'Algunas exploraciones en torno a la reflexión metalingüística sobre la ironía 11\nEstudios de Lingüística Aplicada, año 35, número 66, diciembre de 2017, pp. 9–39\ndoi: 10.22201/enallt.01852647p.2017.66.827\n1. Introducción\n1.1. La ironía verbal en el desarrollo lingüístico tardío\nA través de los últimos años las investigaciones sobre la manera en que los ni-\nños y adolescentes interpretan la ironía verbal han aportado información impor -\ntante al campo de la psicolingüística. Sin embargo, hasta la fecha los estudios \nque intentan explicar los aspectos involucrados en la interpretación y produc -\nción de la ironía verbal son relativamente escasos y predominan aquellos lleva-\ndos a cabo con poblaciones angloparlantes. Por ende, resulta esencial analizar el \ndesarrollo de la ironía verbal en poblaciones hispanohablantes, como se preten-\nde hacer en esta investigación.\nEs sabido que la ironía verbal es una expresión lingüística compleja que \npara ser comprendida requiere que el individuo observe y reorganice la discre-\npancia entre lo que se dice y lo que se quiere decir (Attardo, 2000; Giora & At-\ntardo, 2014; Kalbermatten, 2006; Nippold, 2007; Pexman, 2008). A su vez, se \nsabe que la comprensión de la ironía mejora conforme el individuo avanza en \nedad. En este sentido, autores como Filippova (2014), Filippova y Astington \n(2008), Milosky (1994), Pexman y Glenwright (2007, 2010), Pexman y Harris \n(2003) y Winner y Leekam (1991), entre otros, plantean que existe un claro pa-\ntrón de desarrollo en la capacidad para interpretar expresiones irónicas por parte \nde los niños que no termina a los 9 años de edad, lo que confirma que el progre-\nsivo cambio previsto en la interpretación de los componentes involucrados en la \nironía se da muy entrado en la adolescencia.\nDiversas investigaciones (Climie & Pexman, 2008; Dews, Winner, Kaplan, \nRosenblatt, Hunt, Lim, McGovern, Qualter & Smarsh, 1996; Filippova & As -\ntington, 2008, 2010; Kümmerling Meibauer, 1999; Winner & Leekam, 1991, \nentre otras) señalan que a partir de los 5‒6 años de edad los niños son capaces \nde prestar atención a rasgos de personalidad de los hablantes y a pistas sociales, \nlo que les permite identificar que en una expresión irónica las palabras no coin-\nciden con la intención del hablante. Empiezan a entender que hay enunciados \ncon los que el hablante no quiere dar a entender lo que dice literalmente sino \nque se propone transmitir algo más que el sentido literal de sus palabras (Creu-\nsere, 2000; Loukusa & Leinonen, 2008; Nilsen, Glenwright & Huyder, 2011;']","I'm sorry, but the context provided does not mention the Corpus Sociolingüístico de la Ciudad de Puebla or its contribution to understanding language variation in Mexico. If you have any other questions or need information on a different topic within linguistics, feel free to ask!"
How do the linguistic characteristics of the zapoteco de San Pablo Güilá differ based on the presence of specific consonants in coda?,"['<1-hop>\n\núltimo, en el zapoteco de San Pablo Güilá dos consonantes lenis en coda conforman una mora, de tal suerte que la vocal precedente necesariamente es breve: /nin̆ɡ/ ˩ > [nìŋx] ( vid. López Cruz 1997a: 66). En cambio, una consonante más /j/ o /w/ en coda está precedida por una vocal larga, si la consonante es lenis: /ɡidj/ ˩ > [ɡìːθʲ] ‘cuero, piel’; /miɡw/ ˥˩ > [mîːxʷ] ‘amigo’. 197 LM III-1 Lingüística Mexicana. Nueva Época, III (2021), núm. 1: 193-223 ISSN: 2448-8194', '<2-hop>\n\nReseña de Identidades lingüísticas de México 187 LM VII-1 Lingüística Mexicana. Nueva Época, vii (2025), núm. 1 ISSN: 2448-8194']","The linguistic characteristics of the zapoteco de San Pablo Güilá differ based on the presence of specific consonants in coda. Two lenis consonants in coda form a mora, requiring the preceding vowel to be short, while the presence of /j/ or /w/ in coda with a lenis consonant leads to a long preceding vowel, as evidenced by examples like /nin̆ɡ/ ˩ > [nìŋx] and /ɡidj/ ˩ > [ɡìːθʲ] 'cuero, piel' in the language.",multi_hop_specific_query_synthesizer,"['Estudios de Lingüística Aplicada, año 43, número 80, enero de 2025, pp. 7–48\ndoi:10.22201/enallt.01852647p.2025.80.1097\nSistema judicial y lengua vasca en España: una glotofobia persistente [ 15 ]\nAsimismo, el régimen creó la Escuela Judicial, dependiente \ndel ministerio de Justicia, a fi  n de adoctrinar políticamente y se-\nleccionar ideológicamente a los futuros juristas, quienes, durante \n18 meses, recibían una formación jurídica, moral y religiosa. Esta \nformación servía igualmente para inculcarles el espíritu de cuerpo \ny el respeto de la jerarquía a través de una obediencia absoluta a los \nsuperiores jerárquicos. Tal como lo indicó el ministro de Justicia de \nla época, Eduardo Aunós, al presentar ante las Cortes Generales el \nproyecto de ley sobre la creación de la Escuela Judicial, se preten-\ndía “crear una milicia de la Justicia, unida a los ideales fi  rmes del \nEstado Nacional [...] siempre dispuesta a seguir [...] las consignas \ndel Caudillo y de la España Nueva” (Lanero Táboas, 1995: citado \nen Marquesán Millán, 2021).\nA su vez, el franquismo empleó una serie de medidas para \nlimitar y, aún más, aniquilar cualquier veleidad de independencia \nde la justicia, tales como nombramientos, promociones, traslados, \nsanciones disciplinares e incluso despidos. Precisamente, la aso-\nciación\xa0Justicia Democrática\xa0surgió, en la clandestinidad, para ex-\npresar su descontento por el “férreo control ejercido por el ejecu-\ntivo sobre la carrera judicial a través del nombramiento de los más \nimportantes cargos” (Marquesán Millán, 2021).\nAdemás, el régimen recurrió al sistema judicial para impo-\nner una represión brutal, especialmente a través de los consejos \nde guerra y de las jurisdicciones especiales. Numerosos defenso-\nres de la República española fueron detenidos, encarcelados, tor-\nturados (Lorenzo Rubio, 2020), condenados a largas penas de cár-\ncel, obligados a realizar trabajos forzosos o fusilados tras juicios \nsumarísimos (Silva & Esteban, 2012). Asociados a los militares y \npolicías, los jueces y magistrados se convirtieron en los garantes \nde la dictadura y no toleraron cuestionamiento alguno de la unidad \nterritorial, del régimen dictatorial y de la ideología nacional-cató-\nlica. Así, el Decreto del 16 de abril de 1940 asignó al Fiscal Gene-\nral la tarea de investigar las actividades supuestamente criminales \nde los oponentes al régimen.', 'Estudios de Lingüística Aplicada, año 43, número 80, enero de 2025, pp. 7–48\ndoi:10.22201/enallt.01852647p.2025.80.1097\nSistema judicial y lengua vasca en España: una glotofobia persistente [ 25 ]\nuna presunción de conocimiento de la lengua de Cervantes (Parla-\nmento Vasco, 2023: 5).\nNo obstante, dicho Tribunal precisa que la declaración de coo-\nfi  cialidad implica “la obligación de facilitar, por parte de los pode-\nres públicos competentes, el conocimiento de la lengua [vasca] y, \nen este sentido, ofi  cialidad signifi  ca enseñanza de la lengua [pro-\npia] y posibilidad correlativa de acceso a su conocimiento” (Par-\nlamento Vasco, 2023: 5). A su vez, la Ley Orgánica 1/1990, de 3 \nde octubre, de Ordenación General del Sistema Educativo (boe, \n1990a), que regula en todo el Estado español la ordenación del \nsistema educativo,\nestablece de forma pormenorizada la capacitación en las len-\nguas ofi  ciales que deben conseguir los alumnos en cada uno de \nlos niveles de enseñanza, fi  jando siempre un nivel de capaci-\ntación igual para las lenguas propias de las Comunidades Au-\ntónomas y para el castellano. Por consiguiente [en teoría] en \nlas Comunidades Autónomas con régimen de doble ofi  cialidad \nlingüística, los alumnos que superen la enseñanza obligatoria \nhabrán acreditado los conocimientos requeridos tanto de la len-\ngua castellana como de la lengua ofi  cial propia de la Comuni-\ndad Autónoma (Parlamento Vasco, 2023: 6).\nSin embargo, el Diagnóstico del Sistema Educativo Vasco para el \n2021 demuestra que, en la práctica, si la enseñanza del euskera y \nen la lengua propia del territorio está en el origen de 200 000 vas-\ncohablantes adicionales desde inicios de los años 1980 y 71.4% de \nla población de entre 16 y 24 años es bilingüe activa 12 (Gobierno \n12 Esto resulta, entre otros factores, “del esfuerzo del conjunto de la comuni-\ndad educativa, empezando por el del personal docente para mejorar su perfi  l \nlingüístico (hace 40 años, al inicio del proceso, tan solo el 8% era capaz de \nenseñar en euskera, mientras que, en la actualidad, en torno a un 95% está ca-\npacitado para ello); y también de la fi  rme apuesta de padres y madres por mo-', '21']","I'm sorry, but the linguistic characteristics of the Zapoteco de San Pablo Güilá are not discussed in the provided text. If you have any other questions or need information on a different topic within the text, feel free to ask!"
How did the encounter in Montreal relate to the research on bilingual language assessment tools by Montrul?,"['<1-hop>\n\ndiccionario de autoridades, que serviría para reforzar la idea elitista de la lengua española. Tiem- po más tarde, Kurt Baldinger me contó que Alain Rey me llamaba “experto en mexicographie”. Muchos amigos saben que la lexicografía francesa, presidida por la pareja Rey-Debove, fue la principal influencia de nuestro trabajo. A finales de la década de 1970, quizá hacia 1977 o 78, había yo organizado en El Colegio de México lo que llamaba “Café de lingüistas”. Nos reuníamos los interesados a conversar sobre cualquier tema lingüístico que nos interesara –no sólo lexicografía– y, cuando había oportunidad, invitábamos a algún colega. Los Rey-Debove vinieron a México, quizá invitados por su embaja- da, así que aproveché para que fueran a platicar con nosotros y para que les mostráramos nuestro avance incipiente y nuestras dudas. Pasamos una horas exigentes y agradables, que luego corona- mos con una cena en el restaurant San Ángel Inn. Pocos años después coincidí con él en Montreal, invitados ambos por el Conseil de la Langue Française de Quebec, gracias al interés de Jacques Maurais, cuando se dio la coincidencia de que tanto en Francia como en México había control de cambios de moneda. Yo llevaba treinta dólares que me habían sobrado de un viaje anterior y esperaba que los administradores del Conseil enviaran a recogerme en el aeropuerto, me llevaran a un hotel y me dieran dinero para viáticos, como lo aseguraba la invitación. No había nadie es - perándome en el aeropuerto, así que tomé un autobús al centro de Montreal y busqué un hotel a donde había yo llegado un par de años antes. Después de pagar el autobús, me quedaban unos 20 dólares; me registré en el hotel y no tuve que pagarlo de inmediato, pues expliqué que el pago co- rría a cargo del Conseil. Al día siguiente me dirigí a la sede del encuentro, en donde se disculparon los organizadores conmigo, por haber malentendido mi hora de llegada. Me dieron un cheque para cambiarlo en el banco. ¡A Alain Rey le había sucedido lo mismo! Así que juntos nos fuimos a un banco a cambiar nuestros cheques, para poder pagar hotel, comidas, etc. En un banco, después en otro, no quisieron pagarnos el cheque, porque, dijeron, el gobierno de Quebec no tenía buen crédito. Al tercer banco al que entramos, se acercó el gerente a nosotros y dijo: “Usted es Alain Rey, ¿verdad? Yo le oí una conferencia en París. ¿Qué lo trae por aquí?” Él le explicó nuestro predicamento y, muy amablemente, nos cambió los cheques. La ventaja de ser amigo del maestro. Después de entonces ya no volví a ver a los Rey-Debove, aunque les envié mi libro de Teoría del diccionario monolingüe y la primera edición del Diccionario del español de México . En el libro Dictionnaire amoureux des dictionnaires (Plon, 2011) escribió Alain Rey acerca de los dic- cionarios del español: “Pero esas recolecciones no encaran la necesidad de describir el uso real de un país o de una región, y no una adición de diferencias en relación con el español de Europa. El paso de un diccionario general hacia una variedad del español fue dado por un lingüista del Colegio de México, Luis Fernando Lara”. Luis Fernando Lara El Colegio de México Miembro de El Colegio Nacional lara@colmex.mx', '<2-hop>\n\nLM VI-1 Lingüística Mexicana. Nueva Época, vi (2024), núm. 1: 165-170 ISSN: 2448-8194 en el día a día, a través de la socialización en la casa, en la escuela y en la comunidad; y en situaciones bilingües, aunque incluye casos de complejas situaciones multilingües. El libro sigue la perspectiva de Marc H. Bornstein 2 sobre la familia, conceptualizada como dinámica y transaccional. Bajo este enfoque, De Houwer discute la influencia del macrosistema en la experiencia interpersonal; es decir, explora cómo los patrones de creencias, valores y actitu- des institucionales y sociales afectan el posicionamiento y la conducta hacia los niños bilin- gües y sus familias, y cómo también pueden afectar su bienestar socioemocional. Por último, la autora hace un llamado a la construcción intersubjetiva de un bilingüismo armonioso. Annick De Houwer ya había introducido en trabajos anteriores el término bilingüismo armo- nioso (harmonious bilingualism) que se refiere a una experiencia subjetiva neutral o positiva que los miembros de una familia en una situación bilingüe tienen en torno a los aspectos de esa situación (p. 6) 3. El libro se estructura tomando como base las distintas etapas tempranas en las que dos lenguas pueden adquirirse, según los periodos de desarrollo descritos por Laurence Steinberg, Deborah Lowe Vandell y Marc H. Bornstein. La primera es la infancia (infancy), que comprende a los infantes, y abarca desde el nacimiento hasta cerca de los 2 años. La segunda etapa es la niñez temprana (early childhood), que comprende a los niños y prees - colares, y abarca desde los 2 hasta cerca de los 6 años. La tercera etapa es la niñez media (middle childhood), que comprende a los escolares, y abarca de los 6 hasta cerca de los 11 años. La autora también explica que la transición entre estos periodos coincide con cambios fundamentales en el uso del lenguaje y que, dependiendo de la manera en la que se susciten estos cambios, se pueden establecer categorías para el bilingüismo temprano. Bajo el término Adquisición bilingüe de una primera lengua (bfla = Bilingual First Lan- guage Acquisition), que recupera de Jürgen M. Meisel, la autora hace referencia al tipo de bilingüismo que se desarrolla cuando se ha tenido contacto con dos lenguas desde el nacimiento; estas lenguas son la lengua a (lengua mayoritaria) y la lengua Alpha (lengua minoritaria), conceptualización que retoma de Wolfgang W ölck, quien enfatiza el tipo de diferencias cronológicas entre lenguas a partir de su primera exposición regular; es decir, a y Alpha indican que los infantes no tienen cronológicamente una primera o segunda lengua. Bajo el término Adquisición temprana de una segunda lengua (esla = Early Second Language Acquisition), la autora comprende el bilingüismo desarrollado al escuchar una segunda lengua al final de la infancia o al inicio de la niñez, pues hay un cambio en el uso del lenguaje entre la etapa de la infancia y la niñez temprana 4. En 2 Las obras que se mencionan y que son parte de las fuentes retomadas en el libro de Annick De Houwer no se referencian al final de esta reseña. 3 Para más información sobre el bilingüismo armonioso se puede consultar la iniciativa HaBilNet = Harmonious Bilingualism Network. HaBilNet. n.d. <www.habilnet.org/>. 4 Encuentro relación entre los términos bfla y esla con bilingüismo simultáneo y bilingüismo secuencial, respectivamente. Con base en Montrul (2013: 9), el bilingüismo simultáneo se refiere a los casos en que un infante adquiere sus lenguas como primeras y nativas, aproximadamente entre el nacimiento y los 3 años; mientras que el bilingüismo secuencial abarca las situaciones en las que un infante adquiere una lengua como primera y nativa, y aprende la otra después de los 4 años, regularmente cuando ingresa a la escuela.']","The encounter in Montreal, where Luis Fernando Lara coincided with Alain Rey, was related to the research on bilingual language assessment tools by Montrul through the discussion of bilinguismo armonioso (harmonious bilingualism) and the different stages of language acquisition described by Laurence Steinberg, Deborah Lowe Vandell, and Marc H. H. Bornstein. This encounter highlighted the importance of understanding the dynamics of bilingualism in various contexts, including the impact of social and institutional beliefs on bilingual individuals and their families.",multi_hop_specific_query_synthesizer,"['Estudios de Lingüística Aplicada, año 41, número 77, julio de 2023, pp. 85–117\ndoi: 10.22201/enallt.01852647p.2023.77.1059\n[ 114 ] José Luis Moreno-Vega & Ana Mónica Preciado-Sánchez\nErlam, Rosemary (2009).  The elicited oral imitation test as a measure of im-\nplicit knowledge. In Rod Ellis, Shawn Loewen, Catherine Elder, \nRosemary Erlam, Jenefer Philp & Hayo Reinders (Eds.), Implicit \nand explicit knowledge in second language learning, testing and \nteaching (pp. 65–93). Bristol: Multilingual Matters.\nGodfroid, Aline; Loewen, Shawn; Jung, Sehoon; Park, Ji-Hyun; Gass, Susan, & Ellis, Rod (2015). \nTimed and untimed grammaticality judgements measure distinct types \nof knowledge. Evidence from eye-movement patterns. Studies in Sec-\nond Language Acquisition, 37(2), 269–297. doi: 10.1017/S0272263\n114000850\nGoldschneider, Jennifer M., & DeKeyser, Robert (2001).  Explaining the “natural order of \nL2 morpheme acquisition” in English: A meta-analysis of multiple \ndeterminants. Language Learning, 51(1), 1–50.\nGutiérrez, Xavier (2013).  The construct validity of grammaticality judgment \ntests as measures of implicit and explicit knowledge. Studies in Sec-\nond Language Acquisition, 35(3), 423–449. doi: 10.1017/S0272263\n113000041\nHaight, Carrie E.; Herron, Carol, & Cole, Steven P. (2007).  The effects of deductive and \nguided inductive instructional approaches on the learning of gram-\nmar in the elementary foreign language college classroom. Foreign \nLanguage Annals, 40(2), 288–310.\nHejvani, Fatemeh, & Farahani, Mehrdad V. (2018).  An investigation into inductive and \ndeductive methods in teaching grammar to German EFL learners: A \ncomparative study. Global Journal of Foreign Language Teaching, \n8(2), 76–91.\nHerron, Carol, & Tomasello, Michael (1992).  Acquiring grammatical structures by \nguided induction. The French Review, 65(5), 708–718.\nKim, Jeong-eun, & Nam, Hosung (2017).  Measures of implicit knowledge revisited. \nProcessing modes, time pressure, and modality. Studies in Second \nLanguage Acquisition, 39(3), 431–457.\nKrashen, Stephen (1981).  Second language acquisition and second language \nlearning. Oxford: Pergamon.\nKrashen, Stephen (1982).  Principles and practice in second language acquisi-\ntion. Oxford: Pergamon.', 'Estudios de Lingüística Aplicada, año 41, número 77, julio de 2023, pp. 85–117\ndoi: 10.22201/enallt.01852647p.2023.77.1059\nCan foreign language learners discover the rules of non-salient forms? [ 115 ]\nLai, Chun; Qi, Xuedan; Lü , Chan, & Lyu, Boning (2020).  The effectiveness of guided \ninductive instruction and deductive instruction on semantic radical \ndevelopment in Chinese character processing. Language Teaching \nResearch, 24(4), 496–518. doi: 10.1177/1362168818805265\nLarsen-Freeman, Diane (2009).  Teaching and testing grammar. In Michael Long \n& Catherine Doughty (Eds.), The handbook of language teaching\n(pp. 518–542). Hoboken: Wiley-Blackwell.\nLindstromberg, Seth (2010).  English prepositions explained: Revised edition. \nAmsterdam: John Benjamins.\nLoewen, Shawn (2009).  Grammaticality judgment tests and the measurement \nof implicit and explicit L2 knowledge. In Rod Ellis, Shawn Loewen, \nCatherine Elder, Rosemary Erlam, Jenefer Philp & Hayo Reinders \n(Eds.), Implicit and explicit knowledge in second language learning, \ntesting and teaching (pp. 94–112). Bristol: Multilingual Matters.\nMoreno-Vega, José Luis, & Preciado-Sánchez, Ana Mónica (2023)  The Role of Salience in \nForm-Focused Instruction in L2 Learning. [Manuscript in prepara-\ntion].\nMorgan-Short, Kara; Sanz, Cristina; Steinhauer, Karsten, & Ullman, Michael T. (2010).  Second \nlanguage acquisition of gender agreement in explicit and implic-\nit training conditions: An event-related potential study. Language \nLearning, 60(1), 154–193.\nPeters, Elke (2016).  The learning burden of collocations: The role of interlex-\nical and intralexical factors. Language Teaching Research, 20(1), \n113–138.\nReber, Arthur S. (1993).  Implicit learning and tacit knowledge: An essay on the \ncognitive unconscious. New York. Oxford University Press.\nRebuschat, Patrick (2013).  Measuring implicit and explicit knowledge in second \nlanguage research. Language Learning, 63(3), 595–626.\nRobinson, Peter (1995).  Aptitude, awareness and the fundamental similarity \nof implicit and explicit second language learning. In Richard \nSchmidt (Ed.), Attention and awareness in foreign language learn-\ning (pp. 303–357). Honolulu: University of Hawaii Press.\nRoehr, Karen (2008).  Metalinguistic knowledge and language ability in uni-\nversity-level L2 learners. Applied Linguistics, 29(2), 173–199. doi: \n10.1093/applin/amm037', 'Estudios de Lingüística Aplicada, año 41, número 77, julio de 2023, pp. 85–117\ndoi: 10.22201/enallt.01852647p.2023.77.1059\nCan foreign language learners discover the rules of non-salient forms? [ 87 ]\n1. Introduction\nThe role of instruction has attracted the attention of researchers \nstudying second-language acquisition (sla) and teachers over the \npast four decades. Specifi  cally, there has been wide interest in \nknowing whether teaching formal rules of a second or foreign lan-\nguage (L2) allows students to use the target language more fl  uent-\nly and accurately during actual conversations or whether learners \nmust discover rules by themselves to gain spontaneous knowledge. \nAccording to Roehr (2008), explaining a target rule tends to lead \nlearners to better understand the form-meaning mapping of target \nitems than instructing them to discover a rule on their own. How-\never, this type of instruction does not encourage learners to create \nand test their own hypotheses about L2 forms; therefore, learners \ncould potentially be less likely to play an active role in establish-\ning form-meaning connections (Herron & Tomasello, 1992; V ogel, \nHerron, Cole & York, 2011). Learners are more likely to become \nactive and engaged in processing target forms when they are guid-\ned to pay attention to a target linguistic form within a context and \ntry to discover the underlying rule by themselves (Cerezo, Caras \n& Leow, 2016). Nevertheless, this also has its drawbacks as it re-\nquires learners to make inferences (Erlam, 2003), and not all learn-\ners are equally capable of discovering rules on their own (V ogel \net al., 2011). In addition, learners need to encounter a form many \ntimes over a long period to successfully discover its underlying \nrule by themselves (refer to Ellis, 1993).\n2. Background literature\nBasically, there are two types of explicit instruction in L2 learning: \ndeductive and inductive. According to Decoo (1996), explicit-de-\nductive instruction refers to the pedagogical intervention through \nwhich the language teacher explains a target form to students at \nthe beginning of a lesson, and then the learners practice the form. \nOn the other hand, explicit-inductive instruction entails providing']","I'm sorry, but the context provided does not mention an encounter in Montreal or research specifically conducted by Montrul on bilingual language assessment tools. If you have any other questions or need information on a different topic, feel free to ask!"
How do the linguistic studies by Guerrero Galván contribute to understanding the relationship between attenuators and linguistic variables?,"['<1-hop>\n\nEstímulos Se seleccionaron 60 palabras de alta frecuencia del español según la base de datos del LexMex (Silva-Pereyra et al. 2014) y se tradujeron al hñäñho. Todas las palabras uti- lizadas fueron sustantivos concretos, esto con la finalidad de poder representarlos de manera gráfica y facilitar el aprendizaje de palabras (Kroll y De Groot 2009). Se utilizó una tarea de asociación de palabras entre su forma oral, la representación gráfica de su significado y su forma escrita. Para la representación gráfica del significado de las pa- labras se obtuvieron imágenes de las bases de datos de Duñabeitia et al., (2018b) y Mo- reno-Martínez y Montoro (2012). Estas imágenes han sido validadas en seis diferentes lenguas, las cuales no incluían el hñäñho. Sin embargo, se realizó un estudio con ocho personas bilingües hñäñho-español a quienes se les pidió que mencionaran a qué pala - bra les remitía cada una de las imágenes. Todas las imágenes utilizadas en este estudio evocaban la palabra deseada. Una vez seleccionadas las 60 palabras con sus respectivas imágenes, se grabó la respectiva pronunciación en hñäñho por una persona bilingüe hñäñho-español. Posteriormente, a través del software Praat, se realizó un análisis fo- nético de todas las grabaciones para obtener su transcripción en AFI (ver Apéndice). Las transcripciones fonéticas de cada una de las palabras se basaron en estudios previos sobre el sistema fonológico del hñäñho (Guerrero Galván 2015; Hekking 2010; Palancar 2009). Para la forma escrita de las palabras se siguió la convencionalidad de la lengua hñäñho propuesta en Hekking et al. (2014). A través del programa R (R Core Team 2013) se obtuvo la densidad de vecindario fonológico y vecindario ortográfico de cada palabra en hñäñho con respecto del español. Para la realización de este cálculo, se utilizó como referencia la base de datos del español mexicano de LexMex (Silva-Pereyra et al. 2014). La densidad de los vecindarios se obtu- vo en función de la distancia de Levenshtein (LD, por sus siglas en inglés), la cual consi- dera el número de movimientos (inserciones, omisiones y sustituciones) de grafías (O) o fonemas (P) necesarios para transformar una palabra en sus 20 palabras más similares, sin importar la longitud. De esta forma, la densidad de vecinos fonológicos (PLD20) y ortográficos (OLD20) en español se calcula a partir de la similitud de la forma escrita y fonológica que existe entre una palabra del hñäñho y las 20 palabras del español más similares. Por ejemplo, la palabra en hñäñho /do/ (‘piedra’, en español) tendría en pro- medio una distancia de 1.55 movimientos, lo que significa un número promedio de 1.5 movimientos necesarios para transformar dicha palabra en las 20 palabras más cercanas del español (di, don, da, día, lo, etc). Así, entre más bajo sea el valor promedio de la distancia de Levenshtein, mayor será el grado de similitud de dicha palabra con el vecin- dario léxico del español. Las palabras del hñäñho que compartían una mayor similitud en la pronunciación con las palabras del español se clasificaron en el grupo de palabras con una alta Densidad de Vecinos Fonológicos (DVF). Mientras que las que tenían una pronunciación menos similar (por ejemplo, /bəkha/ [bojä], que está compuesta por los fonemas /ə/ y /kh/) se clasificaron como palabras con baja DVF. En resumen, podemos decir que, por un lado, las palabras del hñäñho con una alta DVF pueden guardar una 51 LM VI-2 Lingüística Mexicana. Nueva Época, vi (2024), núm. 2 ISSN: 2448-8194', '<2-hop>\n\nLa rELación DE Los atEnuaDorEs con variabLEs Lingüísticas Esperamos corroborar que los atenuadores se usan más en lengua oral que en lengua escrita, más entre mujeres que entre hombres, y más entre adultos que entre niños y jó- venes. Además, nuestro objetivo central es saber si la función de cada tipo de atenuador se asocia con alguna de las variables sociolingüísticas mencionadas, para así determinar desde dónde se trabaja la credibilidad en lo narrado: si desde la función de veracidad, la de certeza o la de estima. estudios previos Hasta ahora, la mayor cantidad de trabajos se ha concentrado en narraciones orales, tan- to de experiencia personal (Guerrero 2011, 2015; Olave y Prado 2014) como de ficción (Hess 2010; Romero y Gómez 2013; Barriga 2014; Montes 2014). Los pocos trabajos sobre narración escrita se centran en narraciones de ficción (Jiménez 2006; Sotomayor et al. 2013), de modo que no se sabe a ciencia cierta qué ocurre con las narraciones es- critas de experiencia personal. También hay estudios en los que se comparan narraciones orales con narraciones es- critas, en ambos casos de ficción, y se investigan características sintácticas como el uso de conectores discursivos (Hess y González 2013) o selección léxica (Hess 2013), no así marcas evaluativas. Hasta ahora, lo que se sabe sobre la relación entre tipo de narración y evaluación (o componente evaluativo) es que “en la producción de los niños de tercer grado, las versiones orales [fueron] más largas y con un poco más de elementos eva - luativos que las escritas” (Alarcón 2013: 254); es decir, hay mayor cantidad de marcas evaluativas en narraciones orales que en narraciones escritas. Con respecto al factor sexo, hay que tomar en cuenta varios estudios previos. Labov (1972) fue uno de los pioneros de la sociolingüística variacionista al incluir esta varia - ble para buscar diferencias entre el habla de hombres y mujeres. Entre sus principales hallazgos destaca que las mujeres de clase media son activas en el cambio lingüístico y utilizan la norma de prestigio más que los hombres; esto es, las mujeres transmiten a las siguientes generaciones comportamientos lingüísticos de los estratos socioculturales elevados, a quienes imitan. Soler (2004), interesada también en diferencias establecidas por el sexo, realizó un estudio sobre comportamientos lingüísticos en narraciones de vida, anécdotas y rela - tos de 30 informantes (15 hombres y 15 mujeres) de Bogotá, Colombia. Sus resultados indican que las mujeres utilizan un 30% de elementos evaluativos, equivalente casi al doble de lo que los utilizan los hombres (16.1%). Este dato es muy importante porque los atenuadores –junto con recursos como los intensificadores, expresión de emocio - nes, entre otros– constituyen elementos evaluativos mediante los cuales el narrador, sobre todo si es mujer, fija una postura ante lo narrado. Los hombres, en cambio, se concentran en reportar las acciones vividas y en resaltar cómo las resolvieron. Por esta misma razón, no es inusual encontrar que los hombres sean los protagonistas de sus propios relatos, mientras que las mujeres tienden a narrar lo ocurrido a terceras personas. 65']","The linguistic studies by Guerrero Galván contribute to understanding the relationship between attenuators and linguistic variables by focusing on the usage of attenuators in oral and written language, particularly among different demographics such as women, men, adults, and children. The studies aim to determine if the function of each type of attenuator is associated with sociolinguistic variables like veracity, certainty, or esteem. Previous research has concentrated on oral narratives, both personal experiences and fiction, with limited focus on written narratives. Guerrero Galván's work sheds light on the differences in linguistic patterns between oral and written narratives, especially in terms of evaluative markers and syntactic features.",multi_hop_specific_query_synthesizer,"['Señas que expresan eventos \ndel tipo romper en Lengua  \nde Señas Mexicana (lsm)\nSigns encoding breaking events  \nin Mexican Sign Language ( lsm)\nRecepción del artículo: 19 de marzo de 2021\nVersión revisada: 8 de julio 2021\nAceptación: 24 de agosto del 2021\ndoi: 10.22201/enallt.01852647p.2022.74.996\nHéctor Rodolfo Montaño Juárez\nUniversidad Nacional Autónoma de \nMéxico, Posgrado en Lingüística\nhmontano94@yahoo.com.mx', 'El chisme: estrategias discursivas desplegadas en su construcción 17\nEstudios de Lingüística Aplicada, año 36, número 67, julio de 2018, pp. 9–43\ndoi: 10.22201/enallt.01852647p.2018.67.723\nEl formato en la presentación de los ejemplos en la parte analítica es el si -\nguiente: en primer lugar, entre paréntesis aparece el número de ejemplo y el \ntítulo del chisme. En las siguientes filas se presenta el fragmento de la conversa-\nción, alineados a la izquierda aparece el turno de habla y, con letra mayúscula, \nla inicial del hablante seguida de dos puntos y su participación. Al interior de las \nparticipaciones, en negritas, aparece el foco del análisis de ese fragmento en es-\npecífico (véase Figura 1).\nEl sistema de transcripción utilizado es, con algunas modificaciones, el propues-\nto por el grupo Val.Es.Co. (Briz, 2003) (véase Anexo B), interesado en el análi-\nsis y descripción de la lengua coloquial, en especial del español. Se trata de un \nsistema que combina el método ortográfico con la propuesta del análisis de la \nconversación (ac) adaptado a las características de la lengua española. Como \nse especializa en fenómenos conversacionales, se enfoca en cuestiones relacio-\nnadas con la alternancia de turnos, la sucesión inmediata de emisiones, solapa-\nmientos, reinicios y autointerrupciones, rupturas conversacionales, pausas y si -\nlencios, entonación, fenómenos de énfasis, problemas relacionados con emisio-\nnes dudosas o indescifrables, alargamientos fonéticos, preguntas retóricas, estilo \ndirecto, referencias contextuales, entre otros (Briz, 2003).\nFigura 1. Formato de presentación de los ejemplos', '21']","I'm sorry, but the context provided does not mention any linguistic studies by Guerrero Galván or their contribution to understanding the relationship between attenuators and linguistic variables. If you have any other questions or need information on the articles mentioned in the context, feel free to ask!"
How do expressions of emotions use metaphors and what is the relationship between space and time in metaphorical expressions?,"['<1-hop>\n\nmetÁfoRas en La exPResión de emociones', '<2-hop>\n\nEn La gEstuaLiDaD, tiEmpo Es Espacio no Es una mEtáfora que se refiere a los sonidos como un concepto, y donde hay una relación icónica entre sig- nificado y significante, llamamos onomatopeya. Expresiones como miau para representar el sonido que hace un gato son claramente motivadas o analógicas, pero ¿son metafóricas? Otro problema con el papel de espacio y tiempo como conceptos fuente y meta de una metáfora es que, como dimensiones de la experiencia humana –recuérdese la premisa corpórea o experiencial de la tmc–, son inseparables y a veces indistintos. No se trata sólo de 100 metros de distancia entre mi casa y la tienda, sino del tiempo que me va a tomar recorrer esa distancia. Cuando decimos que algo está lejos, normalmente nos refe- rimos a que se hacen como 20 minutos caminando hasta allá y no tanto a que el lugar está a 1 kilómetro; podemos parafrasearlo de cualquiera de las dos formas. Claro que las lenguas pueden codificarlos por separado; ése es uno de los argumen - tos más recurrentes para distinguir estas dimensiones en el análisis. Sin embargo, si estamos fuera del terreno de la codificación, no necesitan las expresiones del lenguaje un mecanismo asociativo para permitirles transitar entre ambas dimensiones; a veces, más bien, no se sabe bien en cuáles de ellas se encuentran. Por ejemplo, en la lengua de señas mexicana (lsm) es de lo más común observar expresiones en las que la distin- ción articulatoria de las señas aquí y hoy se pierde a favor de la primera (vid. Escobar 2016: 225-26). Por lo demás, en los ejemplos sobre gestualidad (De la Fuente et al. 2014; Pagán Cánovas y Valenzuela 2017; Escobar y Ramírez 2020; Escobar, en prensa a), frecuentemente ni la afiliación léxica es suficiente para tratar de distinguir si el gesto expresa más el espacio o el tiempo. concLusiones Diversos estudios han tomado frases de la lengua escrita como tienes el futuro por delante, comúnmente estudiadas bajo la categoría de lenguaje figurativo y la perspectiva de Lakoff y Johnson (1980, 1999). Argumentan que el uso de estas expresiones y su interpretación es posible gracias a que en la cognición integramos metáforas conceptuales. Operaciones que presentan a A en términos de B, porque este último es más concreto y ayuda a com- prender mejor el primero. Luego, esta misma lógica se ha aplicado a la lengua en su conjunto –escrita, oral y de señas– y, por último, a la gestualidad. La metáfora tiempo es espacio y sus derivados, el pasado está atrás, adelante o a la izquierda, han sido, sin duda, de los más estudiados desde esta perspectiva. Sin embargo, cuando observamos con detenimiento el uso de la noción metáfora conceptual nos damos cuenta de que muchas veces los ejemplos no se refieren explícitamente a A en términos de B. Se empieza a confundir la frontera entre metáfora y la relación gene - ral entre un significado y significante, la polisemia de las expresiones lingüísticas y la iconicidad. Nos da la impresión de que metáfora conceptual abarca todos los recursos del área figurativa del lenguaje ( vid. Gibbs 2019: 33). Entonces, nos percatamos de que ni la noción tiene su sentido original ni, al parecer, los principios del modelo de la tmc han sobrevivido a las transformaciones en los estudios sobre el lenguaje y la cognición durante los últimos años. 23']","Expressions of emotions use metaphors to convey meanings, where the relationship between space and time in metaphorical expressions is complex. The concept of space and time as source and target of a metaphor is intertwined due to their inseparable nature in human experience. While languages may encode them separately, the transition between these dimensions does not always require an associative mechanism. For example, in Mexican Sign Language (LSM), distinctions between signs for 'here' and 'today' can blur, emphasizing the challenge of distinguishing between spatial and temporal expressions. Studies have explored phrases like 'you have the future ahead of you' as examples of figurative language, highlighting the integration of conceptual metaphors in cognition to enhance understanding. The metaphor 'time is space' and its variations, such as 'the past is behind,' have been extensively studied, revealing the intricate relationship between conceptual metaphors, linguistic expressions, and iconicity in language.",multi_hop_specific_query_synthesizer,"['', '', '']","In expressions of emotions, metaphors are often used to convey complex feelings and experiences. For example, phrases like ""I'm feeling down"" or ""She's on cloud nine"" use metaphors to describe emotions in a more vivid and relatable way.

The relationship between space and time in metaphorical expressions can vary depending on the specific metaphor used. In some cases, time can be metaphorically represented as a physical space, such as in the expression ""looking back on the past."" This metaphorical connection between space and time allows us to conceptualize abstract concepts like time in more concrete terms. 

If you are looking for more specific information on how space and time are related in metaphorical expressions, I recommend consulting articles or studies on cognitive linguistics and metaphor theory."
How did the encounter in Montreal between Luis Fernando Lara and Alain Rey unfold?,"['<1-hop>\n\ndiccionario de autoridades, que serviría para reforzar la idea elitista de la lengua española. Tiem- po más tarde, Kurt Baldinger me contó que Alain Rey me llamaba “experto en mexicographie”. Muchos amigos saben que la lexicografía francesa, presidida por la pareja Rey-Debove, fue la principal influencia de nuestro trabajo. A finales de la década de 1970, quizá hacia 1977 o 78, había yo organizado en El Colegio de México lo que llamaba “Café de lingüistas”. Nos reuníamos los interesados a conversar sobre cualquier tema lingüístico que nos interesara –no sólo lexicografía– y, cuando había oportunidad, invitábamos a algún colega. Los Rey-Debove vinieron a México, quizá invitados por su embaja- da, así que aproveché para que fueran a platicar con nosotros y para que les mostráramos nuestro avance incipiente y nuestras dudas. Pasamos una horas exigentes y agradables, que luego corona- mos con una cena en el restaurant San Ángel Inn. Pocos años después coincidí con él en Montreal, invitados ambos por el Conseil de la Langue Française de Quebec, gracias al interés de Jacques Maurais, cuando se dio la coincidencia de que tanto en Francia como en México había control de cambios de moneda. Yo llevaba treinta dólares que me habían sobrado de un viaje anterior y esperaba que los administradores del Conseil enviaran a recogerme en el aeropuerto, me llevaran a un hotel y me dieran dinero para viáticos, como lo aseguraba la invitación. No había nadie es - perándome en el aeropuerto, así que tomé un autobús al centro de Montreal y busqué un hotel a donde había yo llegado un par de años antes. Después de pagar el autobús, me quedaban unos 20 dólares; me registré en el hotel y no tuve que pagarlo de inmediato, pues expliqué que el pago co- rría a cargo del Conseil. Al día siguiente me dirigí a la sede del encuentro, en donde se disculparon los organizadores conmigo, por haber malentendido mi hora de llegada. Me dieron un cheque para cambiarlo en el banco. ¡A Alain Rey le había sucedido lo mismo! Así que juntos nos fuimos a un banco a cambiar nuestros cheques, para poder pagar hotel, comidas, etc. En un banco, después en otro, no quisieron pagarnos el cheque, porque, dijeron, el gobierno de Quebec no tenía buen crédito. Al tercer banco al que entramos, se acercó el gerente a nosotros y dijo: “Usted es Alain Rey, ¿verdad? Yo le oí una conferencia en París. ¿Qué lo trae por aquí?” Él le explicó nuestro predicamento y, muy amablemente, nos cambió los cheques. La ventaja de ser amigo del maestro. Después de entonces ya no volví a ver a los Rey-Debove, aunque les envié mi libro de Teoría del diccionario monolingüe y la primera edición del Diccionario del español de México . En el libro Dictionnaire amoureux des dictionnaires (Plon, 2011) escribió Alain Rey acerca de los dic- cionarios del español: “Pero esas recolecciones no encaran la necesidad de describir el uso real de un país o de una región, y no una adición de diferencias en relación con el español de Europa. El paso de un diccionario general hacia una variedad del español fue dado por un lingüista del Colegio de México, Luis Fernando Lara”. Luis Fernando Lara El Colegio de México Miembro de El Colegio Nacional lara@colmex.mx', '<2-hop>\n\nVeinte. Para este numeral cardinal se recuperan tres formas reemplazantes, de las cuales dos se etiquetan bajo la categoría iii), dado que son sustantivos antroponímicos. El juego de palabras hace referencia a las características del billete azul de polímero de la familia F, concretamente, al motivo principal del anverso: la efigie de Benito Juárez. Es importante notar que los hablantes ignoran por completo la imagen de una vista pa- norámica de la zona arqueológica de Monte Albán que aparece como motivo principal 93 LM III-2 Lingüística Mexicana. Nueva Época, III (2021), núm. 2: 83-97 ISSN: 2448-8194']","The encounter in Montreal between Luis Fernando Lara and Alain Rey unfolded when both were invited by the Conseil de la Langue Française de Quebec. They coincided due to currency exchange controls in France and Mexico. Lara arrived with leftover dollars from a previous trip and expected accommodation and expenses covered by the Conseil. However, no one awaited him at the airport, so he took a bus to Montreal, where he stayed at a hotel. The organizers apologized for the misunderstanding and provided a check for expenses. Rey faced a similar situation, and together they struggled to cash their checks due to Quebec's credit issues. Eventually, a bank manager recognized Rey, helped them cash the checks, and highlighted the advantage of being friends with a master like Rey.",multi_hop_specific_query_synthesizer,"['Starting foreign-language teaching earlier… 23\nsuch as China, with an average of two and a half hours per week in 40-minute \nperiods, weekly instructional time is limited to one hour and 40 minutes.\nFinally, 70% of the countries sampled have experienced an educational  \nreform within the last decade or so aimed at introducing the teaching of an l2 at \nlower grade levels; in several cases, such as Chile, Denmark, and Turkey the age \nreduction has been moderate, with students beginning one or two years earlier, \nwhereas in other cases, such as Argentina and Colombia, it has been considerably \ndrastic, with \nl2 instruction starting six and five years earlier. \nAs the above comparison has shown, there is very little connection in \npractice between the findings of the empirical studies on learner age, on the one \nhand, and the educational policies currently implemented in most of these 20 \ncountries, on the other. In fact, the policies adopted tend to be the opposite of \nwhat the research findings suggest. Public educational policies on \nl2 teaching \nadopted by departments of education in various countries show that, faced with \ngenerally unsatisfactory results in the language(s) being taught and/or increasing \nsocial demands for higher levels of l2 proficiency (particularly in eu countries at \npresent with reference to English), such institutions have responded by introducing \nreform after reform which consist mainly or exclusively in lowering the starting \nage for l2 teaching. These official entities appear to do so in the naive belief that \nthe key is to introduce the institutional teaching/learning processes as early as \npossible and that such a notion is strongly supported by scientific evidence from \nsla in general and the Cph in particular. In the area of educational policymaking \nthe notion of the Cph as a specialized prediction (i.e., one that is generally thought \nto apply to naturalistic l1 acquisition, and less frequently, to naturalistic l2 \nacquisition) has been increasingly ignored. It is unfortunate that the most frequent \napplication of the \nCph in language education has been a gross misinterpretation \nof its nature, that is, the idea that “the earlier, the better” is a valid prediction in \nany learning circumstance. This happens partly as a result of the lack of direct \nparticipation that second-language specialists have in educational policymaking. \nIn addition, political and financial matters are frequently more involved in \nl2 \npolicies than it may seem on the surface; as Spolsky (1989) warns, “Educational \nsystems usually arrive first at a decision of optimal learning age on political or \neconomic grounds and then seek educational justification for their decision” \n(1989: 91). It is worth noting that the political benefits involved in official \ndecisions to reduce the starting age in recent educational reforms in various parts', 'Estudios de Lingüística Aplicada, año 41, número 77, julio de 2023, pp. 85–117\ndoi: 10.22201/enallt.01852647p.2023.77.1059\nCan foreign language learners discover the rules of non-salient forms? [ 97 ]\nly with implicit knowledge, whereas written tgjts tend to correlate \ncloser with explicit knowledge.\nParticipants were given six seconds to listen to each target \nitem and judge whether it was grammatical or ungrammatical. We \ndecided that six seconds were suffi  cient based on a previous pilot \nstudy with fi  ve native English speakers. In addition, we followed \nthe criteria implemented by Ellis (2005) and Zhang (2015), who \nestablished the time limit for the tgjt based on the mean number \nof seconds it took a group of native speakers to make a judgment, \nplus an extra 20% of time. In our pilot study, participants took an \naverage of fi  ve seconds to listen to each sentence and select one of \ntwo options: grammatical or ungrammatical. Following the same \nprocedure as in the studies by Ellis and Zhang, we agreed that we \nwould give the participants one extra second for each item, con-\nsidering that they were not native English speakers like the par-\nticipants in the pilot study. Besides, we pilot-tested the tgjts a \nsecond time with L2 learners to ensure that six seconds would be \na reasonable time. We found that, on average, six seconds enabled \nlearners to listen to a sentence and make a judgment while limiting \ntheir access to linguistic rules.\n4.5.  Procedures\nThe data collection process was completed in six sessions. Each \nsession lasted twenty minutes and was separated from the others \nby a one-week interval. The participants were given an informa-\ntion sheet and a consent form at the beginning of their fi  rst training \nsession, and every participant read and signed it. Next, the partici-\npants were given a pre-test, which included a fi  ll-in-the-blank (fib) \ntest and a timed grammaticality judgment test (tgjt). Participants \nwere unaware that they were completing a test. Instead, they were \ntold that they were going to complete an exercise. In the four ses-\nsions that followed, participants in the control and explicit induc-\ntive groups were given a text with the target forms colorized. Each \ntext included seven instances of in or on and seven instances of by.', 'Starting foreign-language teaching earlier… 11\nIntroduction\nIt is well known that the lay observer tends to see some kind of intuitive relationship \nbetween starting early in a foreign language ( l2) and managing to achieve an \nadvanced level of proficiency in it. What is surprising, however, is that over the \nlast 10 years or so this very same logic has found its way into mass media reports, \nmagazines for l2 teachers, and even official departments of education. This paper \nis intended to offer a critical view of the notion that systematically reducing the \nage at which English or some other foreign language ( efl/l2) is introduced \nat school will yield better outcomes, that is, higher levels of competence and \nperformance towards the end of the learning process. To that end, the implicit/\nexplicit role of the critical period hypothesis (henceforth \nCph) in second language \nacquisition (sla) and educational policymaking is analyzed; emphasis is placed \non the effects of the Cph on recent reforms that have resulted in an international \ntrend toward an early start in efl/l2 teaching. The findings of empirical research \non early-start school programs over the last three decades are reviewed and \ncontrasted with current l2 trends in the public-school systems in 20 countries \naround the world. Recent l2 reforms and policies adopted in countries as dissimilar \nas Korea and Spain, for example, appear to follow the “new trend”. In Korea, \neducational authorities decided to lower the starting age from the seventh to the \nthird grade beginning in 1997. In Spain, authorities decided to continue reducing \nthe starting age for the first foreign language from the third grade to kindergarten, \nat age five, in 2006 (see section on Spanish educational reforms). However, as \nwill be shown in the remainder of this paper, the prime motivation for changes \nsuch as these is often sociopolitical rather than educational or psycholinguistic; it \nis argued that age reduction reforms are unlikely to be effective in practice as they \nare typically not accompanied by other equally important measures, often more \ncomplex and costly to implement. \nThe age factor and the critical period hypothesis (\ncph) in second language \nacquisition\nThe effects related to the age at which learners are first exposed to an l2 constitute \na topic that has been present in informal discussion for centuries. The most \nfrequent claim is that children are “superior” to adults in regard to the level of']","I'm sorry, but the encounter between Luis Fernando Lara and Alain Rey in Montreal is not mentioned in the provided context. If you have any other questions or need information on a different topic, feel free to ask!"
How can the test scores be calculated for the bilingual language assessment tool in the español-inglés version?,"['<1-hop>\n\nLa cuarta pregunta de la versión español-inglés es la siguiente: Cuando se habla a usted mismo, ¿con qué frecuencia se habla a sí mismo en las siguientes lenguas? El total, 20 elizabeth Mendoza, donna Jackson-Maldonado y Gloria avecilla-raMÍrez LM VI-1 Lingüística Mexicana. Nueva Época, vi (2024), núm. 1: 7-31 ISSN: 2448-8194', '<2-hop>\n\nen cuenta distintas variables. Cada una de las preguntas del blp contiene una escala de puntos asociada a un valor numérico, así, se pueden calcular las puntuaciones del ha - blante por cada módulo, por cada lengua o por un índice de dominancia lingüística. Los valores de cada pregunta se pueden observar en la tabla 6. Tabla 6. ¿Cómo calificar la prueba? blp español-inglés cdls lsm-español escrito/oral 1. Historial lingüístico: 6 preguntas con valor de 0 a 20. Cada ítem tiene el valor numérico de la respues- ta. 2. Uso de lenguas: 5 preguntas con valor de 0 a 10. Cada ítem tiene el valor numérico de la respuesta. 3. Proficiencia lingüística: 4 preguntas con valor de 0 a 6. Cada ítem tiene el valor numérico de la respuesta. 4. Actitudes lingüísticas: 4 preguntas con valor de 0 a 6. Cada ítem tiene el valor numérico de la respuesta. 1. Historial lingüístico: 7 preguntas con valor de 0 a 20. Cada ítem tiene el valor numérico de la respuesta. 2. Uso de lenguas: 6 preguntas con valor de 0 a 10. En las primeras tres preguntas, 0 es equivalente a 0, 1.2 horas es equivalente a 2.5, 3.4 horas es equiva- lente a 5, 5.6 es equivalente a 7.5 y más de 6 horas equivale a 10. Las últimas dos preguntas tienen un valor 1-6. Cada ítem tiene el valor numérico de la respuesta. 3. Proficiencia lingüística: 3 preguntas con valor de 0 a 6. Cada ítem tiene el valor numérico de la respuesta. 4. Actitudes lingüísticas: 4 preguntas con valor de 0 a 6. Cada ítem tiene el valor numérico de la respuesta. Para obtener el valor de dominancia lingüística, es necesario extraer la puntuación total de una lengua a la otra. El valor de dominancia lingüística va de -218 a +218 puntos, donde 0= balanceado. (español vs inglés) Para obtener el valor de dominancia lingüística, es necesario extraer la puntuación total de una lengua a la otra. El valor de dominancia lingüística va de -242 a +242 puntos, donde 0= balanceado. (LSM vs español escrito; LSM vs español oral; español escrito vs español oral) Como se puede observar y como se describió en la sección previa, se trató de mante- ner e igualar, en la medida de lo posible, las escalas propuestas en el blp español-inglés para la adaptación del cdls. Como los autores de la prueba indican, para obtener el índice de dominancia lingüística, es necesario obtener la puntuación total de cada una de las lenguas del hablante y restar la de menor valor a la lengua con mayor puntua - ción. Las puntuaciones van de -218 a +218, y, si el valor de la resta es 0, significa que el bilingüe tiene un dominio balanceado de sus lenguas. En caso de que el valor no sea 0, la lengua de mayor puntuación representará la lengua más dominante del hablante. La suma de todos los puntos en la adaptación cdls va de -242 a +242. Para esta ver- sión es posible obtener la dominancia de tres pares lingüísticos: lsm vs español escrito, lsm vs español oral y español escrito vs español oral. Para las preguntas de los módulos i, ii y iv, en las que no se separó entre español escrito y español oral, la puntuación de español será considerada para ambas modalidades al momento de hacer la resta. Igual que en la versión original, si el número obtenido de la resta es igual a 0, significará que el dominio del hablante en el par lingüístico está balanceado.']","The test scores for the bilingual language assessment tool in the español-inglés version can be calculated by considering different variables. Each question in the assessment contains a point scale associated with a numerical value, allowing the calculation of scores for each module, each language, or a linguistic dominance index. The values for each question can be seen in the provided table. To calculate the test scores, historical linguistic background, language use, linguistic proficiency, and linguistic attitudes are assessed with varying numerical values assigned to each response. The dominance index is determined by subtracting the total score of one language from the other, ranging from -218 to +218 points, where 0 indicates a balanced proficiency between the languages being assessed.",multi_hop_specific_query_synthesizer,"['Estudios de Lingüística Aplicada, año 41, número 77, julio de 2023, pp. 85–117\ndoi: 10.22201/enallt.01852647p.2023.77.1059\nCan foreign language learners discover the rules of non-salient forms? [ 97 ]\nly with implicit knowledge, whereas written tgjts tend to correlate \ncloser with explicit knowledge.\nParticipants were given six seconds to listen to each target \nitem and judge whether it was grammatical or ungrammatical. We \ndecided that six seconds were suffi  cient based on a previous pilot \nstudy with fi  ve native English speakers. In addition, we followed \nthe criteria implemented by Ellis (2005) and Zhang (2015), who \nestablished the time limit for the tgjt based on the mean number \nof seconds it took a group of native speakers to make a judgment, \nplus an extra 20% of time. In our pilot study, participants took an \naverage of fi  ve seconds to listen to each sentence and select one of \ntwo options: grammatical or ungrammatical. Following the same \nprocedure as in the studies by Ellis and Zhang, we agreed that we \nwould give the participants one extra second for each item, con-\nsidering that they were not native English speakers like the par-\nticipants in the pilot study. Besides, we pilot-tested the tgjts a \nsecond time with L2 learners to ensure that six seconds would be \na reasonable time. We found that, on average, six seconds enabled \nlearners to listen to a sentence and make a judgment while limiting \ntheir access to linguistic rules.\n4.5.  Procedures\nThe data collection process was completed in six sessions. Each \nsession lasted twenty minutes and was separated from the others \nby a one-week interval. The participants were given an informa-\ntion sheet and a consent form at the beginning of their fi  rst training \nsession, and every participant read and signed it. Next, the partici-\npants were given a pre-test, which included a fi  ll-in-the-blank (fib) \ntest and a timed grammaticality judgment test (tgjt). Participants \nwere unaware that they were completing a test. Instead, they were \ntold that they were going to complete an exercise. In the four ses-\nsions that followed, participants in the control and explicit induc-\ntive groups were given a text with the target forms colorized. Each \ntext included seven instances of in or on and seven instances of by.', 'Estudios de Lingüística Aplicada, año 41, número 77, julio de 2023, pp. 85–117\ndoi: 10.22201/enallt.01852647p.2023.77.1059\nCan foreign language learners discover the rules of non-salient forms? [ 115 ]\nLai, Chun; Qi, Xuedan; Lü , Chan, & Lyu, Boning (2020).  The effectiveness of guided \ninductive instruction and deductive instruction on semantic radical \ndevelopment in Chinese character processing. Language Teaching \nResearch, 24(4), 496–518. doi: 10.1177/1362168818805265\nLarsen-Freeman, Diane (2009).  Teaching and testing grammar. In Michael Long \n& Catherine Doughty (Eds.), The handbook of language teaching\n(pp. 518–542). Hoboken: Wiley-Blackwell.\nLindstromberg, Seth (2010).  English prepositions explained: Revised edition. \nAmsterdam: John Benjamins.\nLoewen, Shawn (2009).  Grammaticality judgment tests and the measurement \nof implicit and explicit L2 knowledge. In Rod Ellis, Shawn Loewen, \nCatherine Elder, Rosemary Erlam, Jenefer Philp & Hayo Reinders \n(Eds.), Implicit and explicit knowledge in second language learning, \ntesting and teaching (pp. 94–112). Bristol: Multilingual Matters.\nMoreno-Vega, José Luis, & Preciado-Sánchez, Ana Mónica (2023)  The Role of Salience in \nForm-Focused Instruction in L2 Learning. [Manuscript in prepara-\ntion].\nMorgan-Short, Kara; Sanz, Cristina; Steinhauer, Karsten, & Ullman, Michael T. (2010).  Second \nlanguage acquisition of gender agreement in explicit and implic-\nit training conditions: An event-related potential study. Language \nLearning, 60(1), 154–193.\nPeters, Elke (2016).  The learning burden of collocations: The role of interlex-\nical and intralexical factors. Language Teaching Research, 20(1), \n113–138.\nReber, Arthur S. (1993).  Implicit learning and tacit knowledge: An essay on the \ncognitive unconscious. New York. Oxford University Press.\nRebuschat, Patrick (2013).  Measuring implicit and explicit knowledge in second \nlanguage research. Language Learning, 63(3), 595–626.\nRobinson, Peter (1995).  Aptitude, awareness and the fundamental similarity \nof implicit and explicit second language learning. In Richard \nSchmidt (Ed.), Attention and awareness in foreign language learn-\ning (pp. 303–357). Honolulu: University of Hawaii Press.\nRoehr, Karen (2008).  Metalinguistic knowledge and language ability in uni-\nversity-level L2 learners. Applied Linguistics, 29(2), 173–199. doi: \n10.1093/applin/amm037', 'Estudios de Lingüística Aplicada, año 41, número 77, julio de 2023, pp. 85–117\ndoi: 10.22201/enallt.01852647p.2023.77.1059\nCan foreign language learners discover the rules of non-salient forms? [ 111 ]\ncould focus on other target forms that vary in their salience level \nand should ensure that all groups be of similar size.\n7. Limitations\nThis study has some limitations. Although a timed grammaticality \njudgment test was used to assess learners’ implicit knowledge, it \nwould have been helpful to include confi  dence rating tests such as \nthose used by Rebuschat (2013). However, it was not possible to \nimplement them due to time restrictions. Also, having a larger sam-\nple size and giving learners a longer treatment would have been \nbenefi  cial, likely yielding more robust results. Nevertheless, it was \nnot possible because not all the groups in the Foreign Languages \ndepartment were able to participate in the study, and those who did, \nhad limited available time. Also, in the present study, it was not \npossible to determine which of the two factors — typographical \nsalience and the existence of a rule in learner’s L1 and L2 — has \na greater impact in each type of instruction. Future studies may \naddress this aspect by isolating these constructs.\n8. Conclusion\nThe fi  ndings of the present study suggest that explicit-inductive \ninstruction was less effective at enabling learners to determine the \nunderlying rule of a form with low perceptual salience driven by \nbottom-up and top-down processing. Students were more success-\nful at discovering a form with higher salience for being typographi-\ncally different from other forms and governed by a rule available in \nlearners’ L1, such as the preposition by; even then, only very few \nof them did. With forms that lack these characteristics, explicit-de-\nductive instruction is probably necessary. Also, there are instances \nwhen explicit-deductive or explicit-inductive instruction may be \nunnecessary, as some forms do not require the teacher’s interven-\ntion beyond simply providing learners with comprehensible input.']","I'm sorry, but the context provided does not contain information specifically about the calculation of test scores for a bilingual language assessment tool in the Spanish-English version. If you have any other questions or need assistance with a different topic, feel free to ask."
How does the book 'Bilingual Development in Childhood' by Annick De Houwer contribute to understanding early bilingual language development and the need for research in multilingual contexts?,"['<1-hop>\n\nISSN: 2448-8194 monolingües, mientras que, en el sur, muchas sociedades son altamente multilingües y viven interactuando con varias lenguas de manera cotidiana. Me parece que, al conside- rar estas diferencias entre norte y sur global, la autora también intuye la necesidad de ampliar nuestra mirada a otras situaciones de bilingüismo y a lenguas en contacto en el cono sur 6. Por último, vale la pena mencionar que los estudios revisados en la obra se han basado en distintos métodos de recolección de datos; algunos recurrieron a estudios de caso registrados en diarios, encuestas e informes parentales; otros se basaron en experimentos, pruebas estandarizadas, tareas diseñadas u observaciones directas del uso lingüístico en el bilingüismo temprano. No se dialoga en esta obra con las perspec- tivas teóricas de los estudios revisados. Se espera que, en un futuro, pueda discutirse la investigación de distintos casos de desarrollo bilingüe temprano, en los que, para cada caso, se utilicen distintos métodos de recolección de datos, analizados a la luz de distintas teorías sobre el desarrollo del lenguaje bilingüe. La obra ofrece una recapitulación de estudios previos hechos por la autora y una con- siderable revisión bibliográfica de investigaciones que giran en torno al desarrollo bilin- güe temprano. También se enriquece con enlaces a corpus y sitios de interés lingüístico que incluyen ejemplos en audio y video de diferentes situaciones de desarrollo bilingüe en la infancia y la niñez. Sin duda, este texto es una pieza clave para comprender el estado del arte del desarrollo del lenguaje oral de tres tipos de bilingüismo temprano: bfla, esla y sla. El libro, Bilingual Development in Childhood , de Annick De Houwer, principalmente está dirigido a especialistas de la lingüística y las ciencias del lenguaje. Esta obra debería ser de especial interés para las instituciones educativas que busquen dar a los niños y a las familias el soporte positivo que necesitan, y para trabajar desde enfoques pedagógi- cos que reconozcan y valoren el multilingüismo y la multiculturalidad. Por último, en este texto se promueve el desarrollo del bilingüismo armonioso y se sugiere la revisión de iniciativas como HaBilNet y Háblame Bebé 7. Se recomienda esta obra por la revisión amplia y la precisa discusión que se lleva a cabo de diversas investigaciones en torno a las trayectorias lingüísticas de las situa - ciones bfla, esla y sla, sin dejar de considerar que se deben atender casos sobre el desarrollo bilingüe con otros pares de lenguas, sobre todo del sur global. Por último, nos sumamos al llamado que realiza Annick De Houwer (p. 59) sobre la apremiante necesi- dad de seguir realizando estudios que ahonden en el desarrollo bilingüe temprano y que den cuenta de las dinámicas de elecciones y uso lingüístico de dos o más lenguas a través de los años, pues, de esta manera, se abonará a la comprensión de cómo las familias se 6 De hecho, como presidenta de la Asociación Internacional para el Estudio del Lenguaje Infantil (iascl = International Association for the Study of Child Language ), durante el periodo 2021-2024, Annick De Houwer ha hecho un llamado para llevar la sede de la organización al sur global, acción que, sin duda, coadyuvaría a entablar un diálogo en otras situaciones multilingües y multiculturales. 7 Háblame Bebé. 2018. <https://hablamebebe.org/>.', '<2-hop>\n\nEl suBtitulado En las plataformas digitalEs y la traducción dEl humor Traducir expresiones idiomáticas no es una tarea sencilla, pues se está trabajando con el nivel semántico-pragmático del lenguaje, que se ocupa precisamente del contexto de la comunicación y de la interpretación de los significados (Portal de Lingüística Hispánica 2021).']","The book 'Bilingual Development in Childhood' by Annick De Houwer contributes to understanding early bilingual language development by providing a recapitulation of previous studies and a significant literature review on early bilingual development. It emphasizes the importance of studying different cases of early bilingual development using various data collection methods and analyzing them based on different theories. The book promotes harmonious bilingual development and suggests reviewing initiatives like HaBilNet and Háblame Bebé to support positive language development in children and families. Additionally, Annick De Houwer's call for further research on early bilingual development, especially in multilingual contexts, highlights the need to deepen our understanding of language choices and usage dynamics over time.",multi_hop_specific_query_synthesizer,"['Las funciones de incluso en La historia deL españoL\nb. Toda la servidumbre de D. Francisco, *tan incluso la peonada, que era numerosa, \nle llamaban á Chucho\xa0el niño \n(Chucho el ninfo 1871)\nAdemás de los casos en que funciona como participio o como partícula, identifico \notros aquí denominados limítrofes, donde no es posible determinar si su función es par -\nticipial o de partícula. Corresponden a ocurrencias donde incluso establece relaciones \nsintagmáticas con ffnn de número singular y género masculino, por lo que la concor -\ndancia característica del participio se ve neutralizada, como se muestra en (4). \n(4)\na. Estiéndanse los límites del señorío de la Iglesia de la otra parte del Apenino hasta \nel mar Adriático, llegando al río Pescara, y destotra al río Garellano, incluso / \nincluido / hasta gran pedazo del Abruzo y de Campania \n(Historia de Felipe II, Rey de España 1619)\nb. En el caso del párrafo primero del artículo anterior, si estuviera asegurada la \nfinca. el valor del seguro quedará afecto al pago del capital del censo y de las \npensiones vencidas, á no ser que el censatario prefiera invertirlo en reedificar la \nfinca, en cuyo caso revivirá el censo con todos sus efectos, incluso / incluido / \nhasta el pago de las pensiones no satisfechas \n(Código Civil 1889)\nLa neutralización de la concordancia de incluso con la fn dificulta su clasificación \ncomo participio o como partícula. Esto va a acompañado de una ambigüedad también \nde carácter funcional que se ilustra con la conmutación tanto por el participio analógi -\nco incluido como por la preposición hasta. Como partícula o como participio, los casos \nlimítrofes como los de (4) tienen en común el significado de inclusión que codifica esta \nunidad. De esta manera, la ambigüedad de estos casos no es sólo formal, sino también \nfuncional.\nEl segundo parámetro es la función gramatical: de acuerdo con la categoría a la que \npertenezca incluso, puede corresponder a una función participial o de partícula. Como \npartícula puede funcionar como marcador de foco –de inclusión, escalar o de concesivi-\ndad– o como marcador discursivo. En (5) ejemplifico las distintas funciones adverbiales \nde incluso como partícula. Como criterio explicativo, lo reemplazo por elementos típicos \nde la función que se ejemplifica. En (5a) funciona como una partícula de inclusión sim-\nple que indica que el elemento bajo su alcance –sargentos, cabos y tambores– pertenecen \na un dominio –un batallón–. El criterio para identificar esta función es el reemplazo por \nel participio adjetival incluido, que ha de concordar en género y número (masculino y \nplural) con el elemento modificado. \n161\nLM II-2\nLingüística Mexicana. Nueva Época, II (2020), núm. 2: 157-181\nISSN: 2448-8194', 'Las funciones de incluso en La historia deL españoL\nTabla 3. Distribución funcional de incluso en el corde\nLa tendencia general que muestran estas cifras es que, mientras disminuye el por -\ncentaje de casos participiales, aumentan de manera progresiva los casos de partícula, \ncon ellos, los limítrofes. Hasta el siglo xv domina de manera contundente la función \nparticipial heredada del latín (90.91%) (7); en tanto que los casos donde funciona como \npartícula (8) son incipientes (9.09%).\n(7)\na. La qual cosa obtenida et impetrada del senado, como la batalla fuesse començada \net el padre subitament huuiesse visto a su fillo el consul combatiendo estar cir -\ncundado et incluso / incluido en medio de los enemigos por Poncio, duc de los \nsannites \n(Traducción de la Historia contra paganos, de Orosio 1376-1396)\nb. Más dize a Eolo, que reine en la cueva çerrada de sus vientos, casi diziendo que \nse esté incluso / incluido en la posibilidat e potençia del franco alvedrío \n(Traducción y glosas de la Eneida 1427-1428)\n(8)\na. Los Reyes Católicos encomiendan al licenciado Gutierre Velázquez de Cuéllar que \ndetermine qué parte de la dehesa de Arévalo debe reservarse para los ganados de \nlos carniceros de la villa y para los caballos y animales de labor de los regidores \nde la misma, quedando el resto para aprovechamiento de los vecinos, a los que \ndesde hacía tiempo se les vedaba incluso / ??incluido / hasta el paso y por esta \nfalta de pastos nadie quería venir a vivir en Arévalo \n(Documentación medieval abulense en el Registro General del Sello 1485-1488)\nSiglo Número de \ncasos Participio % Limítrofe % Partícula %\nxiv 1 1/ 100 - - - -\nxv 22 20/ 90.91 - - 2/ 9.09\nxvi 33 21/ 63.64 3/ 9.09 9/ 27.27\nxvii 55 43/ 78.18 4/ 7.27 8/ 14.55\nxviii 85 31/ 36.47 26/ 30.59 28/ 32.94\nxix 392 25/ 6.38 159/ 40.56 208/ 53.06\nxx 5891 5/ 0.08 66/ 1.12 5820/ 98.8\n165\nLM II-2\nLingüística Mexicana. Nueva Época, II (2020), núm. 2: 157-181\nISSN: 2448-8194', 'Las funciones de incluso en La historia deL españoL\ncomo adverbio puede tener alcance sobre una frase (6b), la cual puede ser de cualquier \nnaturaleza categorial, y sobre una oración (6c).\n(6)\na. Véase en la Junta de obras y Bosques el memorial incluso de Mánuel de Castro, \ny sobre lo que en él suplica me informará con su parecer \n(Petición 1698)\nb. Años ha cuando la ignorancia era bastante más común, incluso en la clase alta, \ny a la puerta del taita paraban quitrines y volantas \n(Los negros brujos 1906)\nc. En el fondo de sus tempestuosos sentimientos no lo odiaba, antes por lo contrario \nhabía allí un vehemente impulso hacia la simpatía e incluso tuvo momentos de \ngenerosa admiración \n(Canaima 1935)\nEl último parámetro para el análisis es el año de registro de cada ocurrencia incluida \nen el corpus, que indico al final de cada ejemplo.\nanálisis Cuantitativo\nCon el fin de obtener una idea general de la distribución cronológica de incluso, reali-\ncé un conteo de su frecuencia de aparición por siglo y contabilicé el número de ocu -\nrrencias como participio y como partícula. En las tablas 1 y 2 resumo los resultados \ndel conteo.\nTabla 1. Frecuencia de aparición de incluso en el corde\nPeriodo histórico Siglo Frecuencia absoluta \npor siglo\nFrecuencia absoluta\npor periodo\nFrecuencia relativa \nen el corpus por \nmillón de palabra\nOrígenes-Edad Media \n(1492)\nxiv\nxv\n1\n22 23 0.2\nSiglos de Oro \n(1493-1713)\nxvi\nxvii\n33\n55 88 0.7\nEtapa moderna \n(1714-1980)\nxviii\nxix\nxx\n85\n392\n5891\n6,368 50.9\n163\nLM II-2\nLingüística Mexicana. Nueva Época, II (2020), núm. 2: 157-181\nISSN: 2448-8194']","I'm sorry, but the context provided does not mention the book ""Bilingual Development in Childhood"" by Annick De Houwer. Therefore, I cannot provide specific information on how that book contributes to understanding early bilingual language development and the need for research in multilingual contexts. If you have any other questions or need assistance with the provided context, feel free to ask!"
How does the epenthesis process in Zapoteco relate to the principle of perceptual prominence and the contrast between segments?,"['<1-hop>\n\nrestricciOnes sOBre el iniciO siláBicO El zapoteco de San Pablo Güilá es una lengua de inicio obligatorio, lo cual quiere decir que en toda sílaba el núcleo debe estar precedido por al menos una consonante, la cual ocupa justamente la posición de inicio16. Ésta es una condición impuesta desde el léxico para el vocabulario nativo y, por lo tanto, no hay procesos activos que doten de inicio silábico a sílabas que previamente carecen de él 17. Así ocurre, por ejemplo, en muchas de las lenguas mayas en las que se inserta un cierre glotal epentético [ʔ] cuando la palabra ‒y, por lo tanto, la primera sílaba de la palabra‒ comienza con vocal; tal es el caso del maya yucateco (vid. Sobrino Gómez 2010: 32). De hecho, en el zapoteco de San Pablo Güilá no hay palabras que comiencen con cierre glotal, razón contundente para considerar que en la lengua éste no constituye una consonante. Dejando de lado el hecho de que en inicio de palabra no hay contraste entre consonantes resonantes fortis y lenis, no existen restricciones en inicio simple respecto del propio timbre 16 Uno de los dictaminadores señala que la palabra ‘año’ ‒cuya protoforma es, según Kaufman (2016: 58), *jisa‒ podría ser una excepción a esta afirmación, pues en varias lenguas zapotecas dicha palabra comienza con la vocal /i/. López Cruz (1997a: 92) la reporta con una /b/ inicial ‒/biz/ ˩ ˃ [bìːs]‒, mientras que en mi propia base tiene una /ɡ/ inicial: /ɡiz/ ˩ ˃ [ɡìːs]. Sin embargo, incluso si fuera el caso que hubiera hablantes que pronunciaran la palabra ‘año’ sin consonante inicial ‒es decir, [ìːs]‒, un solo contraejemplo no pondría en tela de juicio el hecho de que la lengua es de inicio obligatorio. Por lo demás, en los préstamos del español que empiezan con vocal se epentetiza una consonante cuyo timbre corresponde al de alguna de las consonantes siguientes en la palabra ‒[i.no. ˈsen.sjo] > /senosen/ ˩˥ ˃ [sè.nò.ˈsěnː] ‘Inocencio’; [ˈaŋ.xel] > /ɡanɡ/ ˩˥ ˃ [ɡǎŋx] ‘Ángel’‒, o bien se pierde la vocal inicial: /aɡapito/ > /pit/ ˥˩ ˃ [pîtː] ‘Agapito’; /ines/ > /nes/ ˥˩ ˃ [nêsː] ‘Inés’. En los préstamos nominales sólo la vocal tónica tiene tono, mientras que, si hay sílabas átonas ‒como en ‘Inocencio’‒, éstas reciben un tono bajo por default. Sobre la adaptación silábico-prosódica de los prés- tamos, particularmente en nombres propios, véase Arellanes (2017). El mismo dictaminador señala que debe descartarse la posibilidad de que las formas con diptongos simétricos como la de (4a) ‒[mèú] ‘mugre’‒ sean hiatos y no diptongos, pues, de ser los primeros, también irían en contra de la afirmación de que la lengua es de inicio obligatorio. Uchihara y Pérez Báez (2016: 15-16) dan dos argumentos en contra de considerar hiatos este tipo de secuencias en el zapoteco de San Lucas Quiaviní, los cuales también son válidos para el zapoteco de San Pablo Güilá: i) las raíces son categóricamente monosilábicas, de modo que formas como (4a) serían las únicas instancias no monosilábicas, y ii) las vocales de las formas como (4a) nunca tienen distinto tipo de voz no modal ‒por ejemplo, *[mḛ.uʔ]‒ ni un patrón tonal propio ‒como en *[mě.û]‒. Además, si las formas como (4a) fueran bisilábicas, se esperaría que la primera de las vocales fuera larga, gracias a la condición de bimoraicidad de la sílaba tónica: *[mèː.ú]. 17 Excepto en los préstamos consignados en la nota a pie de página anterior. 206 FRancisco aRellanes aRellanes LM III-1 Lingüística Mexicana. Nueva Época, III (2021), núm. 1: 193-223 ISSN: 2448-8194', '<2-hop>\n\nePéntesis vocálica en el zaPoteco Como se explicó antes, ambos tipos de epéntesis –la que se produce para romper grupos de tres o más consonantes y la que separa segmentos muy similares y adyacentes entre sí– se pueden concebir como un mismo proceso fonológico motivado por el prin - cipio de prominencia perceptual, con el que la lengua tratará de maximizar el contraste entre los diferentes segmentos para que éstos sean más perceptibles. Si entendemos los segmentos de la lengua como conjuntos de rasgos distintivos, entonces dicho principio se resume de la siguiente forma: “Un segmento que contrasta en n rasgos con sus seg - mentos vecinos es más perceptible que un segmento que contrasta en n-1 rasgos” (Côté 2000: 139). En el caso de la primera generalización que se mencionó –“las consonantes quieren aparecer adyacentes a una vocal y preferentemente seguidas de una vocal”–, se debe entender que la diferencia entre vocales y consonantes aquí es una diferencia de rasgos distintivos y no de posiciones silábicas, debido a que son estas diferencias en ras- gos y niveles de sonoridad entre los segmentos las que realmente motivan las distintas estructuras silábicas que se observan en la lengua. epéntesis pOstléXica Anteriormente se mencionó que también encontramos elementos vocálicos semejantes a vocales epentéticas entre palabras fonológicas, pero con un timbre ligeramente más alto [ɐ]. A diferencia de las vocales epentéticas que aparecen en palabras fonológicas y entre los enclíticos, las vocales epentéticas que aparecen en frases y entre palabras fo - nológicas son opcionales: su aparición es variable y está asociada al estilo de habla, tal como sucede con otros fenómenos vinculados al dominio de la frase entonativa (Nespor y Vogel 1986). En esta sección se demuestra que éstas también son vocales epentéticas que constituyen núcleos silábicos, los cuales son producto de un proceso postléxico de resilabificación y no vocales intrusivas o elementos esvarabáticos. Estos últimos no constituyen núcleos silábicos y son invisibles a los patrones fonológicos de la lengua (Hall 2007). Del ejemplo (10) al (15) tenemos oraciones en las que se produce la epéntesis entre palabras fonológicas cuando se forman grupos de tres consonantes. Cabe men - cionar que, aunque no se incluyeron por falta de espacio, se atestiguaron sin que se produjera la epéntesis entre palabras; es decir, se trata de un proceso opcional o sujeto a diferentes estilos de habla. Del lado derecho de cada ejemplo se indica la se- cuencia de sílabas pesadas y ligeras de cada oración mediante p y l respectivamente. En (11), (13) y (15) se puede corroborar cómo la epéntesis genera secuencias de dos sílabas ligeras seguidas y en (14) tenemos dos sílabas pesadas seguidas, por lo que la inserción de estos elementos vocálicos es indiferente a la metrificación o no opera con el fin de generar una alternancia rítmica entre sílabas pesadas y ligeras. De hecho, es esperable que los procesos fonológicos de epéntesis estén motivados únicamente por el contexto segmental y no por el contexto prosódico de tono o acentuación (Blu- menfeld 2006; Gleim 2019). 135']","The epenthesis process in Zapoteco is related to the principle of perceptual prominence and the contrast between segments by maximizing the contrast between different segments to enhance their perceptibility. This process aims to break groups of three or more consonants or separate similar and adjacent segments to make them more noticeable, following the principle that a segment contrasting in n features with its neighbors is more perceptible than one contrasting in n-1 features.",multi_hop_specific_query_synthesizer,"['10. Si vinieras mañana, te doy el dinero\n  ¿Es seguro que vaya mañana?\n  ¿Le dio dinero?\n11. Si vienes mañana, te doy el dinero\n  ¿Es seguro que vaya mañana?\n  ¿Le dio el dinero?\n12. Lo que hubieras hecho es decirle que no quieres ir al pueblo\n  ¿Le dijo que no quería ir al pueblo?\n  ¿Fue al pueblo?\n  ¿Qué es lo que no quería hacer?\n13. Si compras un chocolate, te va a doler el estómago\n  ¿Le duele el estómago?\n  ¿Por qué le dolería el estómago?\n14. Deberías de llegar a tiempo todos los días\n  ¿Llega a tiempo?\n15. María creyó que Juan sería alto\n  ¿Juan es alto?\n16. El cielo está nublado, supongo que llueve mañana\n  ¿Es seguro que llueva mañana?\n  ¿Por qué parece que lloverá mañana?\n17. Mis amigos creen que jugaremos en la tarde\n  ¿Van a jugar mañana?\n18. Juan besó a María\n  ¿Quién beso a quién?\n19. El gato que está en mi casa, que es tu casa, es negro\n  ¿De quién es la casa?\n20. El paciente curó al médico\n  ¿Quién curó a quién?\n21.  ¿Usted llegó temprano a la reunión? \n¿Le está hablando a alguien mayor, menor o misma edad, desconocido o cono-\ncido?\n88 nadiezdha toRRes sánchez\nLM I-3\nLingüística Mexicana. Nueva Época, I (2019), núm. 3 (Especial): 63-89  \nISSN: 2448-8194', 'cristina buEnrostro138\nLM III-2\nLingüística Mexicana. Nueva Época, III (2021), núm. 2: 138-138  \nISSN: 2448-8194\nManrique Castañeda, Leonardo. 1994. “Las lenguas prehispánicas en el México ac -\ntual”, Arqueología Mexicana 5: 6-13.\nManrique Castañeda, Leonardo. 1997. “Clasificaciones de las lenguas indígenas de \nMéxico y sus resultados en el censo de 1990”, en Beatriz Garza Cuarón (coord.), \nPolíticas lingüísticas en México . México: La Jornada Ediciones-Universidad Nacional \nAutónoma de México, pp. 39-65.\nManrique Castañeda, Leonardo (coord.). 1988. Atlas cultural de México. Lingüística . \nMéxico: Secretaría de Educación Pública-Instituto Nacional de Antropología e His -\ntoria-Planeta.\nSmith-Stark, Thomas. 1995. “El estado actual de los estudios de las lenguas mixte -\ncanas y zapotecanas”, en Doris Bartholomew, Yolanda Lastra y Leonardo Manrique \n(coords.),  Panorama de los estudios de las lenguas indígenas de México. Quito: Edicio-\nnes Abya-Yala, t. 2, pp. 5-186.\nSmith-Stark, Thomas. 2007. “Algunas isoglosas zapotecas”, en Cristina Buenrostro et \nal. Clasificación de las lenguas indígenas de México. Memorias del III Coloquio Interna -\ncional de Lingüística Mauricio Swadesh . México: Universidad Nacional Autónoma de \nMéxico-Instituto Nacional de Lenguas Indígenas, pp. 69-133.', 'Estudios de Lingüística Aplicada, año 42, número 79, julio de 2024, pp. 71–109\ndoi: 10.22201/enallt.01852647p.2024.79.1096\n[ 108 ] Amor Madai Peña Ramos & Verónica González Márquez\nCód. \nidentifi  cador Ante–co–pretérito Ante–presente Ante–pretérito Co–pretérito Futuro Pos–pretérito Presente Pretérito\n5–N6–I–H 0 0 0 7 0 1 5 6\n5–N7–I–H 0 0 0 12 0 0 2 9\n5–N8–LC–H 1 0 0 9 0 0 10 14\n7–N1–I–M 0 0 0 7 0 0 0 5\n7–N2–I–M 0 1 0 9 0 0 1 8\n7–N3–EA–M 0 0 0 10 0 1 1 22\n7–N4–EA–M 1 0 0 19 0 3 3 18\n7–N5–I–H 0 0 0 0 0 1 1 6\n7–N6–EA–H 0 1 0 14 0 2 2 14\n7–N7–EA–H 0 0 0 15 0 1 3 19\n7–N8–EA–H 2 0 0 1 0 1 1 7\n9–N1–I–M 1 0 0 15 0 0 3 32\n9–N2–I–M 2 0 0 23 0 3 0 21\n9–N3–I–M 0 0 0 14 0 0 0 25\n9–N4–EA–M 0 0 0 9 0 1 5 19\n9–N5–I–H 4 0 0 19 1 1 5 30\n9–N6–EA–H 0 0 0 16 0 1 7 15\n9–N7–EA–H 0 0 0 16 0 0 3 15\n9–N8–EA–H 1 0 0 16 0 1 3 21\nA–N1––M 2 0 0 44 1 3 17 37\nA–N2––M 4 0 0 18 0 1 31 21\nA–N3––H 4 1 1 34 3 3 16 37\nA–N4––H 4 0 0 8 3 0 38 4\nGrupo etario\n5 años 1 1 0 56 0 6 31 70\n7 años 3 2 0 75 0 9 12 99\n9 años 8 0 0 128 1 7 26 178\n(continuación )']","I'm sorry, but the context provided does not contain information specifically about the epenthesis process in Zapoteco, the principle of perceptual prominence, or the contrast between segments. For detailed information on this topic, I recommend referring to specific linguistic studies or articles that focus on Zapoteco phonology and phonetics."
How does Moreno define prestige in the context of linguistic attitudes and behaviors?,"['<1-hop>\n\nLM VII-1 Lingüística Mexicana. Nueva Época, vii (2025), núm. 1 ISSN: 2448-8194 es decir, un grupo de población califica a una variante lingüística motivado por circuns- tancias temporales o definitivas y opina sobre una lengua a partir de ideas arraigadas o de discursos temporales. preStIgIo lIngüíStIco El prestigio lingüístico es considerado como un factor fundamental en la formación de actitudes lingüísticas, como lo mencionan Fallas y Sancho (2018). Dado que las actitudes lingüísticas aparecen ligadas al concepto de prestigio como una conducta (algo que se tiene) o como una actitud (algo que se concede) es necesario averiguar qué se considera prestigioso, pues, en su mayoría, aquellos que poseen prestigio social también lo tienen en su forma de hablar. Esta dinámica se refleja claramente en el contexto de las lenguas minorizadas, cuyos hablantes raramente tienen prestigio social, lo que conlleva que sus idiomas queden relegados a una posición desfavorecida. Christiansen (2012) menciona dos enfoques principales en el estudio del prestigio lingüístico: valor inherente y norma impuesta. En el valor inherente, se analiza la actitud hacia dos variantes lingüísticas comparadas entre sí, sin considerar a sus hablantes. En cambio, la norma impuesta im - plica una valoración positiva de una variante sobre la otra debido a que es hablada por un grupo de mayor prestigio. Ferguson (1974) contribuyó al concepto de que la fama de una lengua o variante lingüística considerada como refinada, superior y elegante (en la que se puede incluir cualquier palabra que denote “superioridad”) depende en gran medida de su prestigio; si una lengua tiene baja aceptación y los hablantes la rechazan, entonces carece de prestigio. Moreno (2009), por su parte, define prestigio como algo que se tiene y se demues - tra, lo llama conducta, pero también algo que se concede mediante la actitud, es decir, lo define como un proceso de concesión de estima y respeto hacia individuos o grupos que reúnen ciertas características, las cuales son visibles para quien no cree poseerlas y llevan a la limitación de las conductas y creencias de los individuos o grupos. Por otra parte, señala dos conceptos importantes para el estudio de las actitudes lingüísticas y su tratamiento: la seguridad lingüística y la inseguridad lingüística, que se entienden como la relación que existe entre lo que un hablante considera correcto, adecuado o prestigioso y su propio uso lingüístico. Se habla de seguridad lingüística cuando lo que el hablante considera como correcto o adecuado es de mayor “prestigio” y coincide con los usos espontáneos del mismo hablante. Por otra parte, la inseguridad lingüística sur- ge cuando tal coincidencia disminuye o desaparece. Estos conceptos se ven claramente aplicados en la comunidad de estudio, porque, mientras que el yoremnokki se encuentra en declive de uso, el español funge como una lengua dominante y de prestigio; además, el inglés, probablemente por las instituciones de educación, se ha vuelto una lengua de prestigio incluso superior porque promete un mejor nivel de vida que hablar español o yoremnokki. En resumen, se puede señalar que el prestigio social también conlleva al prestigio lingüístico. Usualmente los grupos de poder y prestigio son los que dictan las normas Entre santos, venados y pascolas', '<2-hop>\n\nLa etnografía de la comunicación es la línea por la cual se lleva a cabo la presente inves- tigación. De acuerdo con los postulados de Dell Hymes (1986), en la etnografía de la co- municación el principal método empleado es “hacer etnografía”, que incluye observar, hacer preguntas y participar en las actividades de la sociedad a estudiar (Saville-Troike, 2003: 3). Para introducir a la primer metodología a la que Saville-Troike hace referen - cia –la etnografía–, es elemental saber que proviene de la investigación cualitativa, la cual “estudia diferentes objetos para comprender la vida social del sujeto a través de los significados desarrollados por éste” (Katayama, 2014: 43). Las metodologías cualitativas están construidas por fundamentos precisos, estrate - gias y técnicas; buscan estudiar científicamente fenómenos sociales, culturales y todo aquello relacionado con el ser humano y su entorno; y sus bases son epistemológicas, on- tológicas y filosóficas. Las ciencias sociales pueden ser abordadas desde estas metodolo- gías, ya que intentan comprender fenómenos complejos que llegan a ser subjetivos, que son puramente humanos o expresiones sociales poco accesibles. De aquí se desprenden diversas estrategias y, entre ellas, es de especial interés para este estudio la etnografía. Una vez que se ha comprendido el tema de estudio de la etnografía, es preciso llegar a la etnografía de la comunicación, cuyo concepto nació en la escuela norteamericana por la década de 1960. En 1962 Dell Hymes lanz ó una nueva disciplina que puso foco en los patrones de comportamiento comunicativo como un constituyente del sistema cultural (Saville-Troike, 2003). De acuerdo con Prado (2007), Dell Hymes es también conocido porque estableció los primeros lineamientos de la disciplina que hasta hoy en día son utilizados como bases para la misma y los cuales consisten primordialmente en la implementación del modelo speaking y la conceptualización de competencia comu- nicativa, comunidad de habla y evento comunicativo. Prado (2007: 1511) enuncia que a la etnografía de la comunicación “le corresponde dar cuenta de los procesos relacio - nados entre el habla y su uso, las clases de eventos comunicativos, factores relevantes y rango de funciones”. Moreno (2018: 43), por otro lado, menciona que la etnografía de la comunicación se caracteriza principalmente por considerar aspectos etnográficos en el registro y análisis de los eventos comunicativos. Por su parte, Bussmann aporta que la etnografía de la comunicación “se refiere al análisis del uso de la lengua en su entorno sociocultural, en contraste con las entonces teorías lingüísticas populares del estructuralismo y la gramática transformacional, este enfoque se basa en la premisa que el significado de un enunciado s ólo puede entenderse con relación al acontecimiento comunicativo” (2006: 381). En suma, la etnografía de la comunicación tiene como principal objetivo aislar y analizar los fenómenos lingüísticos más sobresalientes para reconstruirlos y explicarlos y, simultáneamente, relacionar esas estructuras con sus contextos sociales y de situación (Cortés y Camacho, 2003: 92). Una de las razones para recurrir a la línea de la etnografía de la comunicación es que utiliza los recursos lingüísticos para construir el objeto de estudio social que se pretende 94 Carmen Herminia Muñoz Amaya LM VII-1 Lingüística Mexicana. Nueva Época, vii (2025), núm. 1. ISSN: 2448-8194']","Moreno defines prestige as something that is both possessed and demonstrated, calling it behavior, but also as something that is granted through attitude. He describes it as a process of granting esteem and respect to individuals or groups with certain visible characteristics, leading to the limitation of behaviors and beliefs. Moreno also highlights the concepts of linguistic security and insecurity, which relate to the relationship between what a speaker considers prestigious and their own linguistic usage.",multi_hop_specific_query_synthesizer,"['Estudios de Lingüística Aplicada, año 42, número 79, julio de 2024, pp. 71–109\ndoi: 10.22201/enallt.01852647p.2024.79.1096\nUso de los tiempos verbales en narraciones infantiles [ 95 ]\n1991; Sebastián & Slobin, 1994; Couto Ríos, 2014), a partir del \nprograma computacional Cuentos de la plaza (Benoit Ríos, 2013) \ny de experiencia personal (Tolchinsky, 2014), presentan coinciden-\ncias en uno o dos grupos etarios de los considerados en los corpora \nanalizados en la presente investigación.\nEn primer lugar, pareciera que los participantes de cinco años \npueden narrar las historias en presente o pasado, dependiendo de \nsu lugar de origen. Por este motivo, el tiempo dominante del es-\ntudio realizado por Couto Ríos (2014) con mexicanos de cinco \naños coincide con el de la presente investigación. En cuanto a los \nparticipantes de siete años, es notoria la preferencia por el pretéri-\nto tanto en los datos de este estudio como en los revisados en los \nantecedentes (Bayley et al., 1998; Benoit-Ríos, 2013). En los re-\nsultados del grupo de niños de nueve años, no parece haber un úni-\nco tiempo dominante (Sebastián, 1991; Sebastián & Slobin, 1994; \nHess Zimmerman, 2003; Couto Ríos, 2014; Tolchinsky, 2014). \nEsto podría deberse a que los participantes van defi  niendo progresi-\nvamente el estilo en que narran la historia.\nExiste la posibilidad de que la variante dialectal infl  uya en si \nel tiempo dominante es el presente o el pretérito, pues únicamente \nen las narraciones recolectadas en Madrid (Sebastián, 1991) y en \nChile (Benoit-Ríos, 2013) de niños de cinco años domina el pre-\nsente. Sin embargo, también es probable que infl  uya la época en \nque se recolectaron las narraciones, pues en aquellas recolectadas \nen Andalucía por Tolchinsky en 2014 domina el pretérito. A su vez, \naunque los participantes de Sebastián (1991), Sebastián y Slobin \n(1994) y Tolchinsky (2014) son españoles, es necesario señalar que \nhay más de veinte años de diferencia entre las primeras investiga-\nciones y la última.\nPor otro lado, únicamente tres de las investigaciones revisadas \nincluyen datos de la estructura narrativa: Hess Zimmermann (2003), \nAravena Reyes (2010) y Tolchinsky (2014). En particular, Hess \nZimmermann (2003) incluye corpora elicitado a partir de comple-\ntar una historia y narraciones personales, sin embargo, la manera \nde clasifi  car es distinta a la llevada a cabo en esta investigación.', 'Para crear el rapport, se siguió el instrumento empleado por el Proyecto para el Es -\ntudio Sociolingüístico del Español de España y América ( preseea 2003) respecto del \nfenómeno de la evaluación. En lugar de considerar nueve temas generales, se tomaron \ncuatro –el tiempo, el lugar donde vive, la familia y la amistad, y las costumbres– y se \npidió al colaborador que conversara sobre ellos. En el tema de la familia y la amistad, \npor ejemplo, las preguntas fueron: ¿quién es tu mejor amigo?; ¿qué es para ti un amigo?; \n¿cómo debe ser una persona o qué debe hacer para que la consideres un buen amigo?; \n¿estás contento/a con tu forma de vida?, ¿por qué?; ¿qué estará haciendo tu familia\u200a/\u200atu \nmarido\u200a/\u200atu hijo\u200a/\u200atu padre ahora? Estos datos obtenidos durante los primeros 10 o 15 mi-\nnutos de grabación no se tomaron en cuenta para el estudio. \nEn la misma sesión se pidió a los colaboradores que compartieran tres narraciones de \nexperiencia personal: una sobre lo más emocionante que han vivido, otra sobre la expe -\nriencia más triste que han sufrido y otra sobre lo más peligroso a lo que se han enfrenta-\ndo. Se buscaba que expresaran alegría, tristeza y miedo para asegurar que se presentara \nel componente evaluativo en las narraciones, al tiempo que se favorecía el habla espontá-\nnea o natural en las entrevistas (Labov 1983). Un ejemplo de las indicaciones dadas es el \nsiguiente: Quisiera que me compartas si has vivido circunstancias peligrosas como algún robo, \naccidente o una situación en la que hayas estado en peligro de muerte. ¿Qué ocurrió? ¿Dónde \npasó? La narración oral se obtuvo en un tiempo de entre 15 y 25 minutos por colabora -\ndor. Antes de concluir la sesión, se solicitó a cada quien que eligiera su mejor narración. \nEn la segunda sesión, se pidió a los colaboradores que escribieron esa narración que \nseleccionaron e incluyeran un título para poder recuperarla; el único requisito era que \nla extensión fuera de una cuartilla3. Posteriormente, las narraciones (tanto orales como \nescritas) se transcribieron en procesador de texto (Word) con ortografía convencional. \nLuego, se creó una base de datos en hojas de cálculo (Excel) para hacer el análisis con \nel software Goldvarb X (Sankoff et al. 2005).\nTabla 2. Narraciones del corpus\n3\u2009Al final de la sesión, no se corroboró que el texto fuera legible. Así que, como aprendizaje del piloteo, \nen entrevistas posteriores, se pidió a cada niño o joven que leyera su texto en voz alta cuando la entrevis-\ntadora tenía dudas sobre lo escrito. \nGrupo de \nedad\nNarración oral Narración escrita\nTotal\nEmoción Tristeza Peligro Emoción Tristeza Peligro\nH* M H M H M H M H M H M\n9-10 años 1 1 1 1 4\n13-14 años 1 1 1 1 4\n17-18 años 1 1 1 1 4\n30 años y más 1 2 1 1 1 1 2 1 1 1 12\nTotal 2 4 2 2 2 0 2 4 2 2 2 0 24\n*H representa los hombres y M las mujeres.\n68 gLoria ELEna gómEz martínEz y rubí cEbaLLos DomínguEz\nLM III-2 \nLingüística Mexicana. Nueva Época, III (2021), núm. 2: 63-81  \nISSN: 2448-8194', '22 Karina Hess Zimmermann, Graciela Fernández Ruiz & Alejandra De León Alcantar\nEstudios de Lingüística Aplicada, año 35, número 66, diciembre de 2017, pp. 9–39\ndoi: 10.22201/enallt.01852647p.2017.66.827\nnica tiene en un potencial auditorio, es decir, sobre la relación entre el texto y el \ndestinatario (ej.: es más divertido usar sarcasmo; siendo sarcástico es como más \ndiscreto; cuando usas sarcasmo es porque te estás burlando de la otra persona; \ntiene que ver mucho con el contexto de cuándo lo dices y cómo lo dices).\n3. Resultados\n3.1. Interpretación de la ironía verbal\n3.1.1. Aciertos para los textos con final irónico por grupo de edad\nEn primer lugar se buscó saber si los participantes eran capaces de interpretar \nlos textos con final irónico como tales. Los resultados de este primer análisis se \nmuestran en la Figura 1, en la cual se aprecia que existe un incremento en la ca-\npacidad para interpretar los textos con final irónico conforme avanza la edad de \nlos participantes. Esto es, los participantes de 9 y 12 años de edad interpretaron \ncomo irónicos 2 de 4 textos en promedio, mientras que los participantes de 15 \naños de edad interpretaron como irónicos un promedio mayor de textos (prácti-\ncamente todos). Esta diferencia en la interpretación de los textos irónicos resultó \nser estadísticamente significativa mediante un análisis de varianza (ANOV A) de \nuna vía con “edad” como factor de grupo (F = 8.846, gl = 2.27, p = .001).\nPor otro lado, en un análisis un poco más profundo de las respuestas dadas \npor los participantes se observó que aquellos que lograron identificar los finales \nirónicos como tales hicieron alusión en sus respuestas a que existía una discre-\npancia en el texto. Los niños de 9 años de edad observaron dicha discrepancia \nentre los eventos que ocurrían dentro de los textos, sin referirse a las palabras. \nAl respecto obsérvese (5):\n(5) Es que cuando leo ‘Joel vuela el balón afuera del colegio’ yo ya sabía que le iba a \ndecir algo malo. [Omar, 9 años, texto 2]\nPor su parte, los participantes de 12 y 15 años de edad fueron capaces de men-\ncionar que existe una discrepancia entre lo que el hablante dice y lo que pien -']","I'm sorry, but there is no mention of Moreno or the definition of prestige in the provided context about linguistic attitudes and behaviors. If you have any other questions or need information on a different topic within the context provided, feel free to ask!"
How does the author address the need to expand the study of bilingualism and languages in contact in different contexts?,"['<1-hop>\n\nISSN: 2448-8194 monolingües, mientras que, en el sur, muchas sociedades son altamente multilingües y viven interactuando con varias lenguas de manera cotidiana. Me parece que, al conside- rar estas diferencias entre norte y sur global, la autora también intuye la necesidad de ampliar nuestra mirada a otras situaciones de bilingüismo y a lenguas en contacto en el cono sur 6. Por último, vale la pena mencionar que los estudios revisados en la obra se han basado en distintos métodos de recolección de datos; algunos recurrieron a estudios de caso registrados en diarios, encuestas e informes parentales; otros se basaron en experimentos, pruebas estandarizadas, tareas diseñadas u observaciones directas del uso lingüístico en el bilingüismo temprano. No se dialoga en esta obra con las perspec- tivas teóricas de los estudios revisados. Se espera que, en un futuro, pueda discutirse la investigación de distintos casos de desarrollo bilingüe temprano, en los que, para cada caso, se utilicen distintos métodos de recolección de datos, analizados a la luz de distintas teorías sobre el desarrollo del lenguaje bilingüe. La obra ofrece una recapitulación de estudios previos hechos por la autora y una con- siderable revisión bibliográfica de investigaciones que giran en torno al desarrollo bilin- güe temprano. También se enriquece con enlaces a corpus y sitios de interés lingüístico que incluyen ejemplos en audio y video de diferentes situaciones de desarrollo bilingüe en la infancia y la niñez. Sin duda, este texto es una pieza clave para comprender el estado del arte del desarrollo del lenguaje oral de tres tipos de bilingüismo temprano: bfla, esla y sla. El libro, Bilingual Development in Childhood , de Annick De Houwer, principalmente está dirigido a especialistas de la lingüística y las ciencias del lenguaje. Esta obra debería ser de especial interés para las instituciones educativas que busquen dar a los niños y a las familias el soporte positivo que necesitan, y para trabajar desde enfoques pedagógi- cos que reconozcan y valoren el multilingüismo y la multiculturalidad. Por último, en este texto se promueve el desarrollo del bilingüismo armonioso y se sugiere la revisión de iniciativas como HaBilNet y Háblame Bebé 7. Se recomienda esta obra por la revisión amplia y la precisa discusión que se lleva a cabo de diversas investigaciones en torno a las trayectorias lingüísticas de las situa - ciones bfla, esla y sla, sin dejar de considerar que se deben atender casos sobre el desarrollo bilingüe con otros pares de lenguas, sobre todo del sur global. Por último, nos sumamos al llamado que realiza Annick De Houwer (p. 59) sobre la apremiante necesi- dad de seguir realizando estudios que ahonden en el desarrollo bilingüe temprano y que den cuenta de las dinámicas de elecciones y uso lingüístico de dos o más lenguas a través de los años, pues, de esta manera, se abonará a la comprensión de cómo las familias se 6 De hecho, como presidenta de la Asociación Internacional para el Estudio del Lenguaje Infantil (iascl = International Association for the Study of Child Language ), durante el periodo 2021-2024, Annick De Houwer ha hecho un llamado para llevar la sede de la organización al sur global, acción que, sin duda, coadyuvaría a entablar un diálogo en otras situaciones multilingües y multiculturales. 7 Háblame Bebé. 2018. <https://hablamebebe.org/>.', '<2-hop>\n\ncuestionario de doMinancia linGüÍstica en sordos sumando las respuestas del uso de español, inglés y otras lenguas, debe llegar al 100%. En esta ocasión se detectaron dos factores que podrían llegar a ser conflictivas para una población con bajo nivel de lectura, como la población Sorda. En primer lugar, el término hablarse a sí mismo, el cual, para evitar confusiones y obtener la mayor canti- dad de información precisa en la prueba, se sustituyó por los términos pensar, imaginar y soñar en lsm/español. Debido a que las acepciones de pensar, imaginar y soñar implican la presencia de imágenes y/o discurso oral/manual, no se consideró adecuado hacer la distinción entre español escrito y oral y tampoco se incluyeron otras lenguas distin- tas a las ya mencionadas. En segundo lugar, la estructura con qué frecuencia se sustituyó por cuánto. Finalmente, la suma del porcentaje semanal de uso también fue modificado en esta pregunta; en su lugar, se colocó como respuesta una escala de 0-10, donde 0 significa nada y 10, mucho. En la escala de calificaciones, el 0 se correspondería con 0%, mientras que 1 sería 10% y así sucesivamente hasta llegar a 10, que representaría el 100% del tiempo. Tabla 2. Módulo i y sección de información biográfica del blp en su versión español-inglés y lsm-español escrito/oral BLP español-inglés CDLS Información biográfica • Nombre • Edad • Sexo • Lugar de residencia • Nivel más alto de educación formal • Nombre • Edad • Género • ¿Dónde vives? (Ciudad) • País • Nivel de estudios Módulo i: Historial lingüístico • ¿A qué edad empezó a aprender ESPAÑOL(INGLÉS)? • ¿A qué edad empezó a sentirse cómodo usando ESPA- ÑOL(INGLÉS)? • ¿Cuántos años de clases (gramática, historia, matemá- ticas, etc.) ha tenido en ESPAÑOL(INGLÉS)? • ¿Cuántos años ha pasado en un país/región donde se habla ESPAÑOL(INGLÉS)? • ¿Cuántos años ha pasado en familia hablando ESPA- ÑOL(INGLÉS)? • ¿Cuántos años ha pasado en un ambiente de trabajo donde se habla ESPAÑOL(INGLÉS)? • ¿Hablas ESPAÑOL ORAL/Estás oralizado? • ¿Cuántos años tenías cuando empezaste a aprender LSM(ESPAÑOL ESCRITO; ESPAÑOL ORAL)? • ¿Cuántos años tenías cuando empezaste a sentirte bien usando LSM(ESPAÑOL ESCRITO; ESPAÑOL ORAL)? • ¿Qué idioma usas en la escuela? • ¿Cuántos años fuiste a la escuela en LSM(ESPAÑOL)? • ¿Cuántos años has vivido en un país o ciudad donde se usa LSM(ESPAÑOL)? • ¿Qué idioma usas con tus amigos? • ¿Cuántos años has pasado en grupos de amigos, de- portes, iglesias, escuelas donde se usa LSM(ESPAÑOL)? • ¿Qué idioma usas con tu familia? • ¿Cuántos años has usado LSM(ESPAÑOL ESCRITO; ESPAÑOL ORAL) con tu familia? • ¿Qué idioma usas en el trabajo? • ¿Cuántos años has trabajado en un lugar donde se usa LSM(ESPAÑOL ESCRITO; ESPAÑOL ORAL)? Para cerrar con la información incluida en este módulo, la pregunta final correspon- de a la frecuencia en la que el hablante usa cada una de sus lenguas para hacer cálculos. Otra vez, se solicita que el porcentaje total semanal de inglés, español y otras lenguas 21']","The author addresses the need to expand the study of bilingualism and languages in contact in different contexts by considering the differences between monolingual and multilingual societies, highlighting the importance of exploring other bilingualism situations and languages in contact. Additionally, the author emphasizes the use of various data collection methods and the analysis of different theories on early bilingual language development to deepen the understanding of bilingualism.",multi_hop_specific_query_synthesizer,"['Tabla 6. Índice de disponibilidad por tipo de institución\nEdad\nTabla 7. Total y promedio de palabras por grupo de edad\nEn la tabla 8 se observa el índice de disponibilidad de cada grupo de edad. La prime-\nra palabra en aparecer en el grupo de 15 a 16 años es gay, con un índice de 0.24714968 \ny un total de 10 ocurrencias en la muestra. \nNuestro interés en este apartado ha sido verificar la hipótesis que sugiere que el \nlexicón de los hablantes crece en correspondencia con su rango de edad. En la grá -\nfica 1 podemos ver que el número de palabras evocadas por hombres de institución \npública es de 81 en ambos grupos de edad, lo que muestra que en este estrato no hay \ndiferencia en cuanto a esta variable. En cambio, para la institución privada podemos \nobservar un incremento: los alumnos de 15-16 años emitieron 42 palabras, mientras \nque los de 17-18 años registraron un total de 96. En cuanto al sexo femenino de \ninstitución pública, se presenta una disminución de una unidad, rasgo no represen -\nInstitución pública Institución privada\nPalabra idl Palabra idl\n1 gay 0.28270114 amor 0.36691616\n2 amor 0.26887113 lesbianas 0.1603786\n3 homosexual 0.17045594 gay 0.15923506\n4 lesbiana 0.16527261 igualdad 0.14888955\n5 joto 0.12166862 asco 0.14481304\n6 felicidad 0.12166133 respeto 0.13815132\n7 discriminación 0.12029 gays 0.10852902\n8 igualdad 0.11887211 sexo 0.10835117\n9 libertad 0.09733354 amistad 0.10822576\n10 respeto 0.0936326 raro 0.09541517\nEdad Palabras Promedio\n15-16 años 270 6.75\n17-18 años 373 9.3\n40\nJorge Lázaro y MicheLLe rubino LM II-2 \nLingüística Mexicana. Nueva Época, II (2020), núm. 2: 29-48  \nISSN: 2448-8194', 'Si cambiamos el determinante definido de (12a) por un indefinido, no tendríamos \nproblema para estar de acuerdo con su veracidad:\n(12) b. Martin Cooper inventó un teléfono.\nPuesto que Cooper fue el inventor del teléfono móvil, estaríamos diciendo algo ver-\ndadero con (12b). El contraste entre la frase definida y la indefinida, al combinarse con \nun predicado de clase, pone de manifiesto que con la primera nos referimos al conjunto \ncomo una unidad atómica; interpretación que no podemos obtener con el determinante \nindefinido. Este contraste se ha encontrado en el inglés (Lawler 1973, Carlson 1977 y \nKrifka et al. 1995) y en el español (Leonetti 1999 y Borik y Espinal 2015). Con el inde-\nfinido nos referimos a un subconjunto; en el caso de (12b), el subconjunto referido es \nun tipo de teléfono y no la clase general. El mismo contraste encontramos con cualquier \npredicado de clase; ejemplificamos ahora con “cultivar”:\n(14) El kiwi se cultivó en China originalmente.\n(15) Un kiwi se cultivó en Nueva Zelanda originalmente.\nPodríamos estar de acuerdo con el contenido de (14), a pesar de que existe una sub-\nclase de kiwis que se originó en Nueva Zelanda, porque con la frase nominal definida no \nnos referimos a los integrantes de la clase llamada “kiwi” sino a la clase misma. En (15), \ncon la frase indefinida no nos referimos a la clase sino a una subclase; en la realidad \ndenota al llamado “kiwi dorado”.\nCon los predicados de clase encontramos también un contraste entre el definido sin-\ngular y el definido plural; en este caso el contraste radica en la diferencia entre predicar \nde la clase de manera atómica y predicar de todos los subconjuntos que constituyen la \nclase4:\n(16) a. El coronavirus humano fue descubierto por Dorothy Hamre en 1965.\nb. Los coronavirus humanos fueron descubiertos por Dorothy Hamre \nen 1965.\nAl combinarse el predicado de clase “descubrir” con la clase de objetos referida \nmediante la frase definida singular, resulta adecuado adjudicarle el descubrimiento a \nDorothy Hamre, como se expresa en (16a); sin embargo, en (16b) no se presenta un \ncontenido veraz porque no ha sido la misma doctora quien ha descubierto la serie de \ncoronavirus conocidos hasta la fecha y, en esta oración, con la frase definida plural, nos \nreferimos a las subclases de coronavirus. De manera semejante, con (17a) podemos estar \n4\u2009 Esta misma diferencia entre las frases definidas singulares y las plurales encontraron Leonetti \n(1999) y Borik y Espinal (2015).\n12  Josefina García Fajardo\nLM VI-2\nLingüística Mexicana. Nueva Época, vi (2024), núm. 2. \nISSN: 2448-8194', '(17)\na. Estiéndanse los límites del señorío de la Iglesia de la otra parte del Apenino hasta \nel mar Adriático, llegando al río Pescara, y destotra al río Garellano, incluso / \nincluido / hasta gran pedazo del Abruzo y de Campania \n(Historia de Felipe II, Rey de España 1619)\n b. En el caso del párrafo primero del artículo anterior, si estuviera asegurada la \nfinca, el valor del seguro quedará afecto al pago del capital del censo y de las \npensiones vencidas, á no ser que el censatario prefiera invertirlo en reedificar la \nfinca, en cuyo caso revivirá el censo con todos sus efectos, incluso / incluido / \nhasta el pago de las pensiones no satisfechas \n(Código Civil 1889)\nLa función de incluso como marcador de concesividad en estructuras condicionales \nestá relacionada con su función como partícula de foco escalar. Flamenco García (1999: \n3810) describe estas estructuras como concesivo-condicionales escalares, las cuales se ca-\nracterizan por combinar las propiedades concesivas con características condicionales. \nApunta que lo característico de una relación concesiva no es tanto una estructura sintác-\ntica particular, sino más bien la existencia de una información implícita que contradice \nel contenido proposicional expresado en cada uno de los miembros de que consta. Las \nconstrucciones concesivo-condicionales escalares comparten con las concesivas el con -\ntraste que se establece entre sus dos miembros y con las condicionales que en el conte -\nnido proposicional de la prótasis se hace referencia a situaciones de carácter hipotético.\nFlamenco García señala igualmente (1999: 3843) que dentro de la naturaleza escalar \nde piezas léxicas como incluso se inscribe la posibilidad de que se codifique una con -\ntraexpectativa. Esto influye de manera decisiva en la interpretación de construcciones \nencabezadas por incluso si, que es en suma el mismo tipo de contenido implícito transmi-\ntido por las expresiones concesivas y adversativas, esto es, el sentido de contradicción.  \nSi bien esta clase de estructura presenta apariciones esporádicas en etapas previas a \nla conclusión del cambio, generaliza su presencia en la segunda mitad del siglo xx, lo \ncual puede sugerir que, aunque esta función dependa de la función escalar de incluso, \nconserva una naturaleza más funcional o abstracta que la que tendría la función escalar \naisladamente. Por esta razón prolifera en la etapa final de su proceso de cambio, el cual \navanzó del plano léxico (participio) al plano funcional (partícula)9.\nIdentifico la etapa final del desarrollo histórico de incluso como el periodo más fun-\ncional, en el que K önig (1991) sitúa las partículas discursivas y, como he mostrado, in-\ncluso puede caracterizarse también como marcador discursivo o partícula discursiva. Esta \netiqueta engloba a las unidades lingüísticas que puedan presentar usos exclusi vamente \n9\u2009Sobre la direccionalidad del cambio, ver Bybee et al. (1994), Traugott (1995a), Hopper y Trau-\ngott (2003 [1993]) y Bybee (2004).\n176 Glenda zoé lizárraGa navarro\nLM II-2 \nLingüística Mexicana. Nueva Época, II (2020), núm. 2: 157-181  \nISSN: 2448-8194']","I'm sorry, but the context provided does not address the need to expand the study of bilingualism and languages in contact in different contexts. If you have any other questions or need information on a different topic within the provided context, feel free to ask!"
What contributions did Gerardo Sierra make to the field of linguistics in the context of LM III-2?,"['<1-hop>\n\nreseñA de traducción dE tExtos EspEcializados 155 LM II-1 Lingüística Mexicana. Nueva Época, II (2020), núm. 1: 153-158 ISSN: 2448-8194 extenso. Si bien algunos autores han propuesto algunos métodos para traducir este tipo de sintagmas, son propuestas que carecen de un análisis sintáctico y semántico para es- tablecer una solución. En consecuencia, los autores desarrollan una descripción estruc - tural de los sintagmas nominales extensos, a nivel tanto sintáctico como semántico, para ofrecer algunas estrategias didácticas que permitan buscar soluciones. Las propuestas que ofrecen se basan en el análisis de una larga muestra de sintagmas nominales y exa- minan una serie de traducciones del inglés al español hechas por traductores aprendices. Una investigación que vale la pena por su aporte práctico y su mirada analítica ante uno de los problemas más frecuentes en el trabajo de la traducción. Daniel Rodríguez Vergara en su capítulo “La teoría sistémico funcional aplicada a la traducción (inglés-español)” aborda el estudio y análisis de la traducción desde una perspectiva lingüística, en particular desde la gramática sistémico-funcional ( lsf), que desarrolló Michael Halliday (1985, 1994). En la primera parte, el autor hace hincapié en la aplicabilidad de ésta en la traducción, ya que la teoría da prominencia a los facto- res contextuales de situación y cultura, aspectos sumamente importantes para la com - prensión de las circunstancias de producción del texto fuente (L1) y el texto meta (L2). Luego, se centra en la descripción de los sistemas de la lengua a partir de tres vectores que propone Halliday (1985, 1994): estratificación, metafunción y rango. Estos vecto - res ayudan a descomponer la lengua en niveles, lo que permite determinar varios tipos de equivalencia en traducción ‒equivalencia léxico-gramatical, semántica, ideacional, etcétera‒. El autor se basa en la traducción de artículos científicos del ámbito médico para ejemplificar la descomposición de la lengua en vectores y establecer el tipo de equivalencia de traducción que se da en casos concretos. Al final del capítulo, propone una serie de ejercicios que permite al usuario practicar las herramientas de análisis tex- tual y observar las diferentes categorías semántico-gramaticales que propone la teoría sistémico-funcional. ', '<2-hop>\n\nGerardo Sierra 152 LM III-2 Lingüística Mexicana. Nueva Época, III (2021), núm. 2: 149-152 ISSN: 2448-8194 investigación conjunta e impartir cursos, fuimos a tocar diferentes puertas. Según la trayectoria del profesor Sager, la ingeniería lingüística se forma con la interacción de disciplinas de las cien- cias y de las humanidades para la creación de herramientas y desarrollos a favor de diversas empresas académicas, profesionales y de servicio. Por ello, esquematizamos diferentes líneas de conocimiento, así como las múltiples aplicaciones y áreas de oportunidad. Ofrecimos cursos en las licenciaturas de la Facultad de Ingeniería, en la de Ciencias y en la de Filosofía y Letras, así como en los posgrados de Lingüística, de Computación y de Bibliotecología. Esos cursos actualmente se han ampliado por varios de los alumnos formados, no s ólo en la unam, sino en varios lugares del país, tales como El Colegio de México, la Benemérita Universidad Autóno- ma de Puebla, la Universidad Autónoma de Querétaro, la Universidad Autónoma de Baja California y el Instituto Superior de Intérpretes y Traductores. Con base en la visión teórica y aplicada de Sager, nos acercamos a los profesores e investigadores del Centro de Instrumentos, al de Lenguas Extran - jeras, al de Enseñanza para Extranjeros y al Universitario de Investigaciones Bibliotecológicas; al Instituto de Investigaciones Filológicas y al de Investigaciones en Matemáticas Aplicadas y en Siste- mas. Como él mismo llegó a comentarme en ese jardín que tanto cuidaba como a cada uno de sus discípulos: “Se llamarán de muchas formas, según los tiempos y las modas”. Ingeniería lingüística, lingüística computacional, procesamiento de lenguaje natural, tecnologías del lenguaje, industrias de la lengua; terminótica, lexicografía computacional, tradumática, ofimática, traducción automáti - ca; minería de texto, tecnologías del habla, interacción humano-computadora, sistemas de diálogo; recuperación de información, extracción de información, bibliometría, estilometría; lingüística de corpus, lingüística forense. Quedaron sus palabras, “es la interacción conjunta entre la lingüística y la computación, no cada una de ellas por separado”. Lo que vino después es historia: la ingeniería lingüística en México es, hoy en día, un legado de las enseñanzas del profesor Sager. Desde que se jubiló y con la disciplina de hierro que se le conocía, el profesor se iba en bici - cleta a nadar y a clases de gimnasia. Era común encontrarlo trepado en las escaleras para limpiar el tejado o arreglar alguna parte de la estructura de su casa del siglo xix. Había que ejercitar el cuerpo al igual que la mente, decía. El 18 de febrero de 2021, tras una corta estancia de seis días en el hospital, “Prof”, como to - dos sus discípulos le decían, no se fue, sino que queda en todos aquellos que tuvimos la fortuna de tratarlo. Como fue su voluntad, el 2 de marzo fue cremado sin ceremonias. En tiempos de restricciones por la pandemia de Covid-19, s ólo un puñado de personas asistió a la llegada del coche fúnebre. Trasciende en nuestras obras, y los más de veinte años del Grupo de Ingeniería Lingüística de la unam le quedarán eternamente en deuda.']","Gerardo Sierra made significant contributions to the field of linguistics in the context of LM III-2 by engaging in joint research efforts, offering courses in various disciplines, and expanding the reach of linguistic studies to different academic institutions across Mexico. His work focused on the interdisciplinary nature of linguistic engineering, computational linguistics, natural language processing, and other language-related technologies, leaving a lasting legacy in the field of linguistic studies.",multi_hop_specific_query_synthesizer,"['El chisme: estrategias discursivas desplegadas en su construcción 17\nEstudios de Lingüística Aplicada, año 36, número 67, julio de 2018, pp. 9–43\ndoi: 10.22201/enallt.01852647p.2018.67.723\nEl formato en la presentación de los ejemplos en la parte analítica es el si -\nguiente: en primer lugar, entre paréntesis aparece el número de ejemplo y el \ntítulo del chisme. En las siguientes filas se presenta el fragmento de la conversa-\nción, alineados a la izquierda aparece el turno de habla y, con letra mayúscula, \nla inicial del hablante seguida de dos puntos y su participación. Al interior de las \nparticipaciones, en negritas, aparece el foco del análisis de ese fragmento en es-\npecífico (véase Figura 1).\nEl sistema de transcripción utilizado es, con algunas modificaciones, el propues-\nto por el grupo Val.Es.Co. (Briz, 2003) (véase Anexo B), interesado en el análi-\nsis y descripción de la lengua coloquial, en especial del español. Se trata de un \nsistema que combina el método ortográfico con la propuesta del análisis de la \nconversación (ac) adaptado a las características de la lengua española. Como \nse especializa en fenómenos conversacionales, se enfoca en cuestiones relacio-\nnadas con la alternancia de turnos, la sucesión inmediata de emisiones, solapa-\nmientos, reinicios y autointerrupciones, rupturas conversacionales, pausas y si -\nlencios, entonación, fenómenos de énfasis, problemas relacionados con emisio-\nnes dudosas o indescifrables, alargamientos fonéticos, preguntas retóricas, estilo \ndirecto, referencias contextuales, entre otros (Briz, 2003).\nFigura 1. Formato de presentación de los ejemplos', 'conspirólogo\nEn el peor de los casos se dará cuenta que éste ya no es \nun fenómeno exclusivo del conspirólogo proverbial con el \ngorro de aluminio, no: la conspiración ya es parte de la con-\nversación pública.\nEl Universal. Opinión. Esteban \nIllades. 20 de agosto de 2020. \nVersión digital.\ncoronabicho Escuela en casa en tiempos del coronabicho: Entre Sherlock \nHolmes y Poirot.\nEl Universal. Confabulario. Mary \nCarmen Sánchez Ambriz. 12 de \nseptiembre de 2020. \nVersión digital.\ncoronabobo\nDe la existencia del virus nadie tiene la culpa, desde luego \n[...]. Los ciudadanos imputan la culpa a los políticos y los \npolíticos, con la boca pequeña, solo se atreven a inculpar, \nen fin, a esa “pequeña minoría” de irresponsables... ¿Peque-\nña? ¿Coronavirus? Coronabobos, dice el espejo.\nMilenio. El Mundo. Manuel Hi-\ndalgo, p. 23. 18 de septiembre \nde 2020.\ncoronabono\nEl Eurogrupo llegó este jueves a un acuerdo para movilizar \nmás de medio billón de euros en préstamos para ayudar \na estados, empresas y trabajadores afectados por el coro-\nnavirus, pero dejó para más adelante la discusión sobre la \nemisión de “coronabonos” para financiar la recuperación.\nSinembargo. Economía.  \n“Eurogrupo acuerda medio \nbillón de euros, pero sin coro-\nnabonos, para afectados por \nCOVID-19”. EFE. 10 de abril de \n2020. Versión digital.\ncoronaburguer\nEn medio de la pandemia por coronavirus el ingenio mexi-\ncano se hace presente en todo el país, con creaciones que \nvan desde un globo, pasteles, bonless, tatuajes y ahora una \nhamburguesa, se trata de la “Coronaburger” y es creada en \nCiudad Madero, Tamaulipas.\nMilenio Digital. Virales. Magda \nBárcenas. 11 de mayo de 2020.\ncoronacrisis Coronacrisis. La cuarentena trajo aparejada la crisis econó-\nmica por la que atraviesan distintos sectores.\nInfobae.com. Tendencias. Víctor \nIngrassia. 7 de junio  de 2020.\ncoronalibro\nCrean el “Coronalibro”. Más de 4 mil 500 propuestas de \n15 países respondieron a la convocatoria de la Universidad \nAutónoma Metropolitana (UAM) para un proyecto colabo-\nrativo, un fotolibro y una pieza multimedia en torno del \ncoronavirus.\nEl Universal. Cultura. Sonia Sie-\nrra. 7 de mayo de 2020. \nVersión digital.\ncoronavirulento\n“CORONAVIRULENTO”. El científico universitario refirió \nque el virus podría ya haber llegado a México sin que haya \nsido detectado, puesto que tarda 14 días en incubarse sin \nque se presenten síntomas.\nLa Crónica de Hoy. Academia. \n“El coronavirus llegará a Mé-\nxico y no estamos preparados: \nacadémicos”. Isaac Torres Cruz. \n31 de enero de 2020. \nVersión digital.\ncoronial\nEs lo que es y esto no va a terminar nunca, ni con una vacu-\nna ni con diez. Es, como están diciendo muchos de nuestros \nmás grandes pensadores: la era “coronial”. Así como la épo-\nca colonial tuvo sus características y sus valores, el corona-\nvirus nos está llevando a situaciones que jamás imaginamos \ny que no van a tener solución en la lógica “pre-coronial”.\nMilenio. Opinión. Álvaro de la \nCueva. 27 de septiembre de \n2020. Versión digital.\ncoronnial\nDespués de los millennials y la generación Z es la hora de \nlos coronnials. Este término, muy popular en las redes so-\nciales, se refiere a la generación que nacerá en los próximos \nmeses como consecuencia del aislamiento en parejas.\nInfobae.com. Tendencias. Víctor \nIngrassia. 7 de junio de 2020.\n22 Ramón ZacaRías Ponce de León\nLM IV-1 \nLingüística Mexicana. Nueva Época, IV (2022), núm. 1: 7-29  \nISSN: 2448-8194', 'Estudios de Lingüística Aplicada, año 38, número 71, julio de 2020, pp. 9–43\ndoi: 10.22201/enallt.01852647p.2020.71.900\n[ 16 ]  Kenneth Geoffrey Richter & Ricardo Alejandro Medel Romero\ngree of diffi  cultyof each of the items in a test (Alderson, Clapham\n& Wall, 1995; Bailey, 1998; Brown, 2005; Fulcher & Davidson,\n2007; Heaton, 1988; Hughes, 1989; Madsen, 1983).\nif is a number that ranges from 0.00 to 1.00. This number\nrepresents the percentage of people who answered a given item\ncorrectly. For the current study, the 50 test items in the university’s\ndiagnostic exam were statistically analyzed. To measure the if of\nthe items in this exam, it was necessary to sum up the total num-\nber of students who correctly answered the questions and divide\nthat number by the total number of students who took the test, as\nshown in the next formula:\nFor each exam item, the number of students who answered the\nitem correctly was divided by the total of 50 test-takers. This al-\nlowed detecting those items with a low facility index (close to\n0.00, i.e., very diffi  cult),those with a high facility index (close\nto 1.00, i.e., very easy), and those in the middle (around 0.50,\nwhich is considered ideal). As it is diffi  cultto calculate the if by\nhand, a formula in an Excel spreadsheet was utilized to calculate\nindividual if scores (see Table 1).\nIF =\nTotal no. of students who got the item right\nTotal no. of students taking the test\nTABLE 1. Sample of responses to test items by 50 participants\nSTUDENT I 1 I 2 I 3 I 4 I 5 I 46 I 47 I 48 I 49 I 50 TOTAL\nSt 1 1 1 1 1 1 0 0 1 0 1 32\nSt 2 1 1 1 1 1 0 0 0 0 1 31\nSt 3 1 1 1 1 1 0 1 1 0 1 31\nSt 4 1 1 1 1 1 1 1 0 0 0 30\nSt 5 1 1 1 1 1 0 0 0 0 0 30\nSt 46 0 1 1 1 1 0 1 0 1 0 15\nSt 47 0 0 1 1 0 0 0 0 0 1 15']","I'm sorry, but there is no mention of Gerardo Sierra or his contributions to the field of linguistics in the provided context."
How does the assessment tool designed for bilingual individuals in the community of Santa María de Ocotán aim to measure linguistic competence?,"['<1-hop>\n\nla facilidad de reconocimiento, que implica experimentos en los que al hablante se le po - nen distracciones auditivas que dificulten el reconocimiento de las lenguas. Ahora bien, de lo expuesto en los párrafos anteriores se tomaron sólo algunas de las ideas para la elaboración de la prueba, no por su falta de validez, sino porque la prueba diseñada se elicitó en un contexto in situ en las diferentes localidades de la comunidad, por lo que algunas indicaciones son imposibles de llevar a cabo. Un ejemplo de esto es la propuesta de Siguán (2001) en relación con el empleo de distractores lingüísticos, pues resulta complicado llevarlos a cabo al momento de elicitar la prueba en una situación in situ en la que, de manera natural, ya existen distractores lingüísticos y no lingüísticos. Otro punto que se deja fuera es la medición de la fluidez, pues la prueba diseñada tendría que determinar cómo medirla, para lo cual es necesario definir primero qué se entiende por riqueza lingüística, en qué nivel de lengua se determina y, sobre todo, cuál es el punto base que permita hacer una escala de los colaboradores con mayor o menor riqueza. Esto es, si esta base está representada por un hablante-oyente ideal abstracto, un hablante his - panohablante de la zona o, incluso, un miembro bilingüe de la comunidad. Finalmente, en lo que corresponde a las diferentes habilidades a evaluar es importante destacar que, dado que muchos de los colaboradores no saben escribir, no es posible hacer una prueba en la que se mida la competencia lingüística tanto en el plano oral como escrito. De estas apreciaciones se retomaron algunas ideas puntuales para la elaboración de la prueba: 1) medir más de un nivel lingüístico, 2) evaluar habilidades orales y 3) pensar que la prueba se hace en un momento específico del hablante; por lo tanto, su evaluación cambiará de tiempo en tiempo. Este punto tiene como consecuencia meto - dológica la necesidad de aplicar la prueba más de una vez a un mismo colaborador en distintas temporalidades. La prueba diseñada no pretende ser un examen de evaluación punitiva, por lo que su aplicación intenta ser lo más cercana a lengua en uso y se encuentra anclada en un contexto comunicativo. Tanto las decisiones que se tomaron para su elaboración como la manera en la que se aplicó se discuten a continuación. Diseño y aplicación de la prueba de competencia lingüística La prueba tiene como objetivo principal medir la competencia lingüística de los colabo- radores bilingües de la comunidad de Santa María de Ocotán, para así poder clasificar - los en tipos de bilingüismo. Una primera decisión que se tomó fue el hecho de evaluar únicamente la competencia del español y no la del o’dam, lo que conlleva la discusión de si en realidad se está clasificando a los individuos en tipos de bilingüismo, pues no se evalúa su desempeño en la lengua indígena. No obstante, este criterio se debe a las 72 nadiezdha toRRes sánchez LM I-3 Lingüística Mexicana. Nueva Época, I (2019), núm. 3 (Especial): 63-89 ISSN: 2448-8194', '<2-hop>\n\ntania P. heRnández-heRnández116 LM I-3 Lingüística Mexicana. Nueva Época, I (2019), núm. 3 (Especial): 115-119 ISSN: 2448-8194 En “La planificación del bilingüismo en estudiantes y profesores de L2/LE”, John Evaristo Flórez Osorio argumenta que la planificación del estatus es un instrumento clave para aumentar la conciencia sobre los bilingüismos desarrollados en los procesos de aprendizaje de segundas lenguas. Así, luego de definir las nociones de política, plani- ficación del lenguaje y los bilingüismos coordinado, compuesto y subordinado, Flórez Osorio presenta un cuestionario que permite a los actores “reflexionar sobre el grado de con - ciencia (estatus) que tienen frente al proceso de enseñanza/aprendizaje de una L2/LE” (p. 81), para así orientar actividades y materiales hacia el desarrollo de un bilingüismo más coordinado. La distinción entre el bilingüismo de los sordos y el de los oyentes es el punto de partida de “El papel del bilingüismo en investigación de educación en ciencias para es- colares sordos”. En este capítulo, Lesly Guadalupe Morales Sánchez argumenta que la naturaleza bimodal del bilingüismo de la comunidad sorda requiere de instrumentos de enseñanza y análisis específicos. En este sentido, señala que es fundamental considerar y evaluar los procesos comunicativos y educativos de los miembros de dicha comunidad, a partir de “las diferencias de modo y canal de producción-recepción” (p. 90) entre las lenguas orales y las de señas. Las condiciones de producción y recepción específicas de- ben ser también un punto de partida en el diseño de cursos y materiales educativos. En el caso de las ciencias, Morales Sánchez explica que es necesario desarrollar materiales dirigidos a la comunidad sorda mexicana que, por ejemplo, tomen en cuenta la dificul - tad para enseñar las diferencias entre el lenguaje científico y el lenguaje cotidiano. En el último capítulo de esta sección, “La conceptualización de una lengua ágrafa y su relación con el fracaso escolar”, Alejandro Hernández Canarios también enfatiza la necesidad de redefinir la comunicación entre la comunidad sorda a partir de su especi - ficidad lingüística y no de las deficiencias que les atribuyen los etnocentrismos oral y escrito, lo cual implica dejar de considerar a los sordos como sujetos bilingües, pues son lingüísticamente competentes “en los binomios lengua de señas-lengua de señas, lengua de señas-lengua escrita o lengua de señas-lengua oral” (p. 109). El autor cuestiona en - tonces el carácter ágrafo tradicionalmente atribuido a las lenguas de señas y propone valorar la escritura de esta comunidad no a la luz de las lenguas orales, sino a la de un enfoque gestualista que ponga en relieve su función comunicativa y reconocimiento social. En este enfoque la lengua de los señantes sólo se distingue de las lenguas orales porque su “modalidad de producción y recepción […] es viso-gestual y no auditivo-oral (p.108)”. Hernández Canarios concluye que el éxito o fracaso educativo del sordo está íntimamente relacionado con su socialización lingüística y con el reconocimiento o no de las lenguas de señas como herramientas básicas para la enseñanza y el aprendizaje. Analizar los tipos y niveles de bilingüismo a partir de evidencias recolectadas en el espacio escolar y familiar es el propósito de los cinco capítulos de la segunda sección, “']","The assessment tool designed for bilingual individuals in the community of Santa María de Ocotán aims to measure linguistic competence by evaluating only the Spanish proficiency, not the o'dam language, to classify them into types of bilingualism. The tool focuses on measuring multiple linguistic levels, assessing oral skills, and considering the specific moment of the speaker, leading to the need for multiple applications over time to the same collaborator for a comprehensive evaluation.",multi_hop_specific_query_synthesizer,"['Estudios de Lingüística Aplicada, año 39, número 72, enero de 2021, pp. 9–48\ndoi: 10.22201/enallt.01852647p.2021.72.926\n[ 34 ]  Kent Fredholm\nDucar and Schocket (2018) discussed how context-driven levels \nof formality are rendered differently in gt searches from English \nto Spanish or French, stating that gt uses the informal second \nperson singular in Spanish translations of the English you, but the \nformal second person plural in translations to French. In the 3995 \ngt searches analyzed in our study, gt did render the English you\n(both as subject and object) and your, as the Spanish informal tú, \nte, tu and tus in most cases, but exceptions were also found, espe-\ncially concerning the possessive pronouns. When the Swedish du\nwas used, the search results were highly inconsistent, repeatedly \nshowing translations with alternating second person singular and \nthird person singular verbal endings within a few seconds after \neach other. The excerpt shown in Table 9 gives a typical exam-\nple of confusing pronoun search results when Beata looked for \nthe correct translation of dig ‘you’ (2 nd p. sg. dir. obj.). The fi  nal \nscreen outcome shows how she added punctuation to change the \ntranslation.\nTABLE 9. Changing pronouns. Beata: 1\nTIME MARK GT SEARCH GT RESULT\n30’47’’\n‘no-one must decide for you’ ‘no-one must decide about you’\nWrites pienso que de nadie debe decidir sobre in the text, looking four times at the search result.\n31’35’’\n‘you’ [2nd p. sg. obj.] ‘you’ [3rd p. sg. subj.]\n31’39’’\n‘you’ [2nd p. sg. subj.] ‘you’ [3rd p. sg. subj.]\ningen ska bestämma över dig nadie debe decidir sobre ti\n27 / 5000 föreslå en förändring\ndig usted\n3 / 5000 föreslå en förändring\ndu usted\n3 / 5000 föreslå en förändring', 'cuestionario de doMinancia linGüÍstica en sordos\nEn el bilingüismo unimodal, los hablantes dominan dos o más lenguas orales; es \ndecir, la entrada y salida de información en este tipo de bilingües suele ser oral y audi-\ntiva. Sin embargo, el tipo de bilingüismo en el que se sitúan los individuos Sordos es el \nbilingüismo bimodal, que es el tipo de bilingüismo en donde se emplean dos canales de \nentrada y salida de información: uno que implica el uso de una lengua oral y otro en el \nque se emplea una lengua de señas (Grosjean 1992). \nDe acuerdo con autores como Lillo-Martin, Müller de Quadros y Chen Pichler (2017), \nen la descripción anterior es posible incluir a los niños con audición normal nacidos en \nfamilias de personas Sordas usuarias de alguna lengua de señas. En otras palabras, estos \nbilingües bimodales son personas oyentes que tienen acceso a ambas lenguas de manera \nparalela; es decir, no tienen ningún tipo de impedimento sensorial que les dificulte com-\nprender y producir tanto la lengua oral como la lengua manual. \nPor otro lado, estos mismos autores mencionan el caso de los niños Sordos que utili-\nzan una lengua de señas, pero también una lengua oral. Esto lo logran mediante el uso \nde dispositivos auditivos o implantes cocleares. Finalmente, se encuentran los bilingües \nbimodales referidos como bilingües seña-texto. En este caso, los bilingües adquieren la \nmodalidad escrita de su l2 y, en algunas ocasiones, pueden mostrar habilidad para pro-\nducir lenguaje hablado en distintos grados, además de comprender el lenguaje a través \nde la lectura de labios (Piñar, Dussias y Morford 2011). Es preciso señalar que, igual que \nlos bilingües unimodales, estos niños suelen desarrollar distintos niveles de competencia \nen cada una de sus lenguas (Lillo-Martin, Müller de Quadros y Chen Pichler 2017).\nEl estudio del bilingüismo, en general, es importante puesto que sirve como he -\nrramienta para entender los procesos y mecanismos neurocognitivos que subyacen al \nlenguaje. El bilingüismo bimodal, por su parte, nos ofrece una visión diferente de cómo \nestá estructurado el lenguaje, debido a que, para comprender y producir las dos len -\nguas, están implicados distintos sistemas sensoriomotores del hablante (Emmorey, Gei-\nzen y \nGollan 2016). Además, en contraste con los bilingües unimodales, es posible para \nlos bilingües bimodales producir y percibir sus dos lenguas al mismo tiempo (Emmorey \net al. 2008). Los bilingües bimodales adquieren dos sistemas lingüísticos diferentes, pero \nsu desarrollo se da de manera interrelacionada, pues, de acuerdo algunos autores, am -\nbos sistemas pueden influirse mutuamente (Plaza-Pust 2019).\nEn los estudios sobre bilingüismo es común encontrarse con los términos proficiencia \ny dominancia lingüística. En algunas ocasiones, estos dos términos se usan de manera \nindistinta, sin embargo, no son exactamente lo mismo. La proficiencia lingüística hace \nreferencia al conocimiento en distintos dominios del lenguaje, como la fonética y fono-\nlogía o la sintaxis; no es necesario ser bilingüe para hablar de proficiencia lingüística, ya \nque también existe en el caso de los monolingües (Hulstijn 2010). La dominancia, por su \nparte, está relacionada con la competencia de dos o más lenguas en un mismo individuo \n(Kohnert 2008).\nLa dominancia y la proficiencia de una lengua u otra varían en los bilingües bimoda-\nles sordos y oyentes. Mientras que en los primeros es más común que su lengua de ma -\nyor dominio sea la lengua de señas, los segundos muestran mayor dominio de la lengua \noral, probablemente debido al tipo de educación recibida y al contexto social en el que \n11\nLM VI-1\nLingüística Mexicana. Nueva Época, vi (2024), núm. 1: 7-31\nISSN: 2448-8194', 'Josefina gaRcÍa faJaRdo120\nLM V-1\nLingüística Mexicana. Nueva Época, v (2023), núm. 1: 117-121  \nISSN: 2448-8194\ny el hablado en la Ciudad de México, a partir de un corpus amplio de cada localidad. \nMediante el análisis del aumento de usos epistémicos frente a los de opinión (deseman-\ntización) y de una mayor fijación de la forma, con menor variación sintagmática (deca-\ntegorización), logran determinar la diferencia entre las dos localidades en el uso grama-\nticalizado de creo; además, la aportación de esta investigación, que se revela rigurosa en \nel análisis y en la estadística, concierne al correlato de la presencia del pronombre yo \nante creo, en los usos no gramaticalizados y la ubicación inicial de creo asindético en el \nhabla de la Ciudad de México.\nCierran el volumen tres capítulos dedicados a la relación entre evidencialidad y \nmiratividad. María Marta García Negroni y Manuel Libenson, en “¡Al final tenías plata! \nAcerca de las causas mirativo-evidenciales de la enunciación” (pp. 243-264), se propo-\nnen mostrar la manera como se combinan la miratividad (marcación de sorpresa del lo-\ncutor) y la evidencialidad (en el sentido de indicación de la fuente de información); para \nello analizan datos orales y escritos del español rioplatense, desde un enfoque dialógico \nde la argumentación y de la polifonía. Distinguen las enunciaciones por su relación \nentre la sorpresa y su causa: la motivada por lo no esperado, por la novedad y por una \ncontraexpectativa. De manera crucial, describen la diferencia entre enunciados mirati-\nvos que no presentan ninguna instrucción para recuperar la causa de la miratividad y \nlas enunciaciones mirativas con punto de vista evidencial. Con este análisis, las autoras \npresentan una propuesta metodológica para estudiar enunciados con puntos de vista \nevidenciales, identificando los “marcos discursivos” argumentativos. En la exposición \nofrecen algunas curvas melódicas de enunciados mirativos evidenciales cuya relación \ncon las aportaciones del análisis merecería una mayor descripción.\nGonzalo Jiménez Pascual, en “Sobre el valor mirativo de soltar y saltar como intro-\nductores de cita” (pp. 265-288), describe el significado de los verbos mencionados en su \nfunción citativo-mirativa; para ello acude a la teoría de la metáfora conceptual y al con-\ncepto de dinámica de fuerzas. Concibe en dicha función un valor evidencial, entendido \ncomo índice “que apuntan a elementos del contexto extralingüístico” (p. 269). Describe \nla construcción subjetiva de la escena, a partir del significado direccional que los verbos \ntienen en su dimensión física.\nEl último capítulo del volumen está dedicado a los usos de mira. Ricardo Maldonado \ny Juliana de la Mora, en su estudio “Mira. Evidencialidad, miratividad y validación sub-\njetiva” (pp. 289-316), sugieren que ha habido dos caminos distintos en la extensión de \nmira a partir de su significado deíctico ostensivo: uno que conduce al valor evidencial \ny otro que lleva a la miratividad. Describen estos desarrollos desde la perspectiva de \nespacios mentales y de subjetividad e intersubjetividad. En una vía, mira va perdiendo \ndeixicidad y, mediante el valor apelativo de su forma imperativa, el hablante invita al \noyente a compartir el espacio mental que ha construido; de esta manera la extensión \nsubjetiva llega a la intersubjetividad; el hablante le presenta al oyente como verdadero \no pertinente lo que dice, surgiendo así una función de evidencialidad. Por otra parte, la \ndeixis ostensiva, dirigida originalmente a espacios concretos, mantiene la deixicidad y \nextiende su dirección hacia una información que ha sido nueva para el hablante, la cual \nle resulta sorprendente: uso mirativo. Maldonado y de la Mora clasifican los enunciados']","I'm sorry, but the context provided does not contain information about an assessment tool designed for bilingual individuals in the community of Santa María de Ocotán. If you have any other questions or need information on a different topic, feel free to ask!"
What efforts were made to describe the variant of Spanish spoken in Puebla and what were the outcomes of these projects?,"['<1-hop>\n\nreseña de desarrollo lingüístico tardío 179 LM VI-1', '<2-hop>\n\nEn el primer capítulo, “Antecedentes: corpus orales del español de Puebla”, la autora proporciona un panorama de los esfuerzos de investigadores y equipos de trabajo por des- cribir la variante poblana. Los proyectos emprendidos desde la Benemérita Universidad Autónoma de Puebla, a partir de marcos teóricos y metodológicos diversos, intentaron recopilar, desde los años ochenta, corpus orales que diera cuenta del español poblano; de ellos se derivaron algunas investigaciones enfocadas en las múltiples dimensiones de esta variedad: el habla popular escuchada en las vecindades tradicionales de la ciudad, el español poblano en el ámbito religioso o estudios del habla infantil. Lamentablemen- te, como la autora lo señala, la mayor parte de estos materiales están perdidos, y sólo tenemos noticias de ellos por las investigaciones que resultaron de ellos, o por los libros publicados en los que se explicita la necesidad de crear corpus que dieran cuenta de las peculiaridades de la variante poblana y la planeación consecuente para llevarlos a cabo. En el capítulo dos, “El Corpus Sociolingüístico de la Ciudad de Puebla y Preseea-Pue- bla”, se nos proporciona una descripción detallada de la planeación y elaboración del corpus poblano. Para quien desee emprender un proyecto tan complejo que involucre el levantamiento, la transcripción y el etiquetado de un repositorio de habla real, éste es un capítulo imprescindible5. La autora nos describe detalladamente todas las decisio- nes tomadas para la recopilación de las 108 entrevistas que lo conforman, comenzando por la delimitación de la zona en la que se levantarían los datos. Con ello muestra la importancia de conocer la historia de la región, la configuración demográfica de la po- blación y la complejidad lingüística producto de los contactos con otras lenguas, para poder delimitar el área de elicitación de los datos y justificar aquella que no se tomó en cuenta, pero que es importante analizar para poder conocer a cabalidad las hablas regionales. En este capítulo se muestra la importancia histórica de la ciudad de Puebla, considerando que también es un área comercial y de paso obligado hacia la capital. Su configuración poblacional e historia marcaron pautas para la conformación del español poblano, así como de las actitudes y creencias en relación con lo propio y con lo ajeno. Es decir, esta información nos permite delinear un perfil del hablante poblano y de las ideologías que subyacen en la construcción de su identidad. Además, la autora muestra el gran mosaico lingüístico que se encuentra en todo el estado, pues en él se hablan ná- huatl, totonaco, mazateco y popoloca, entre otras lenguas. Al fungir la ciudad de Puebla como un centro de irradiación cultural y comercial, las migraciones desde el interior y exterior del estado han sido constantes. La autora indica que urge comenzar a hacer estudios enfocados en estas comunidades para dar cuenta del contacto lingüístico entre el español y algunas de las lenguas de las poblaciones migrantes. Lo anterior podrá, por ejemplo, mostrar el impacto de la migración en los procesos de pérdida y desplazamien- to lingüístico. Además, destaca la importancia que han tenido las migraciones externas 5 Actualmente están en proceso de levantamiento las entrevistas del Corpus Sociolingüístico de la Ciudad de Chihuahua y el Corpus Sociolingüístico de la ciudad de Xalapa, coordinados por Anayeli Her- nández Cruz y Mariana Aguirre Corona, para el caso del primero, y por Luis David Meneses, para el segundo, que replican la metodología de Preseea-Puebla. 153 LM VI-2']","Efforts to describe the variant of Spanish spoken in Puebla included projects initiated from the Benemérita Universidad Autónoma de Puebla in the 1980s. These projects aimed to collect oral corpora that reflected the Spanish spoken in Puebla, focusing on various dimensions such as popular speech in traditional neighborhoods, religious contexts, and child speech. Unfortunately, most of these materials are lost, with only references available through subsequent research or publications. The projects emphasized the need to create corpora that captured the peculiarities of the Puebla variant and the necessary planning to execute them effectively.",multi_hop_specific_query_synthesizer,"['El chisme: estrategias discursivas desplegadas en su construcción 37\nEstudios de Lingüística Aplicada, año 36, número 67, julio de 2018, pp. 9–43\ndoi: 10.22201/enallt.01852647p.2018.67.723\nparticipación las hablantes calculan y conjeturan cómo serán recibidas y eva -\nluadas sus emisiones por parte de la interlocutora, dependiendo de las relacio -\nnes interpersonales previas así como de la forma en que se esté desarrollando la \nconversación. El análisis me permite concluir que, en el contexto estudiado, los \nchismes son posibles en la medida en que se despliegan estrategias discursivas \nque están bajo el cuidado constante de la mitigación y que se corroboran o se \nmodifican constantemente gracias al uso de las estrategias interactivas.\nPuede añadirse que el grado de participación por parte de las hablantes en el \nchisme no es simétrico. La participación está en función de la cantidad de infor -\nmación que posean o de las estrategias interactivas que utilicen. El acercamiento \nque propongo, además de brindar una aproximación al chisme desde el análisis \ndel discurso, busca problematizar su estudio, ponerlo sobre la mesa de las inves-\ntigaciones actuales, evidenciando su alto valor interactivo, social y discursivo.\nEste estudio, si bien no agota el tema, pretende ser una llamada de atención \npara que los investigadores mexicanos de distintas áreas, pero sobre todo de la \nlingüística, posen su mirada en la práctica comunicativa denominada chisme. \nHay varias vetas que quedan abiertas. Sería muy interesante estudiar discursi-\nvamente el chisme desde otras perspectivas analíticas o en otros contextos, por \nejemplo, entre hombres.\n6. Referencias\nAhmed, Sara (2010). Analysing women’s talk and gossip between two female friends. En In -\nnervate. Leading Undergraduate Work in English Studies, (3), 1–14. Recuperado de  \nhttps://www.nottingham.ac.uk/english/documents/innervate/10-11/1011ahmedwomentalk.pdf\nBajtín, Mijaíl M. (1981). The dialogic imagination: Four essays. Austin: University of Texas \nPress.\nBajtín, Mijaíl M. (2005 [1982]). Estética de la creación verbal. México: Siglo xxi.\nBaumeister, Roy F.; Zhang, Liqing, & V ohs, Kathleen D. (2004). Gossip as cultural learn-\ning. Review of General Psychology, 8(2), 111–121. Recuperado de http://citeseerx.ist.psu.\nedu/viewdoc/download?doi=10.1.1.186.4613&rep=rep1&type=pdf\nBergmann, Jörg R. (1993). Discreet indiscretions: The social organization of gossip. Nueva York: \nAldine de Gruyter.', 'Estudios de Lingüística Aplicada, año 41, número 77, julio de 2023, pp. 85–117\ndoi: 10.22201/enallt.01852647p.2023.77.1059\n[ 96 ] José Luis Moreno-Vega & Ana Mónica Preciado-Sánchez\nhave tested its construct validity through factor analysis (refer to \nBowles, 2011; Ellis, 2005, 2009; Gutiérrez, 2013; Kim & Nam, \n2017). However, Suzuki (2017) has claimed that tgjts assess ex-\nplicit procedural knowledge because they attract attention to form. \nNevertheless, even if learners relied partially on explicit procedural \nknowledge to make their judgments, this does not mean they are \nnot using their implicit knowledge to some extent. In addition, im-\nplicit and explicit procedural knowledge are functionally similar, \nand either approach can enable learners to cope with the demands \nof using L2 in real time.\nThe rationale for using the tgjt instead of other measures of \nimplicit knowledge was that, according to Kim and Nam (2017), \nit is cognitively less demanding on students than other tests, such \nas the oral elicited imitation test (oeit), and students at Beginning \nor Lower Intermediate stages are usually developmentally ready to \nuse the automatic cognitive processes needed to complete a tgjt. \nOur participants had an intermediate profi  ciency level but had lim-\nited opportunities to practice the L2 outside the classroom. There-\nfore, we considered that the oeit  would be too challenging for \nthem as it would have likely required higher L2 processing levels \ncompared to those normally used by students when they practice \nEnglish in the classroom.\nThe tgjt contained 26 items, 16 of which were target items \nand ten were distractors. Six items (three grammatical and three \nungrammatical) evaluated the use of by. Similarly, ten items (fi  ve \ngrammatical and fi  ve ungrammatical) assessed the use of in  vs. \non; fi  ve items assessed the use of in and the other fi  ve the use \nof on. Distractor items (50% grammatical and 50% ungrammat-\nical) assessed the use of tag questions, yes/no questions, simple \npresent conjugation, and the past progressive tense. We recorded \nthe voice of a native English speaker while he read each tgjt item. \nWe decided to use an aural tgjt because, according to Kim and \nNam (2017), this modality triggers stronger implicit knowledge \nthan written tgjts. Also, a factor analysis conducted by Spada, \nShiu, and Tomita (2015) revealed that aural tgjts correlate strong-', 'Estudios de Lingüística Aplicada, año 41, número 77, julio de 2023, pp. 85–117\ndoi: 10.22201/enallt.01852647p.2023.77.1059\n[ 104 ] José Luis Moreno-Vega & Ana Mónica Preciado-Sánchez\ntaBle 3. Pre- and post-test tGJt scores for the in vs. on rule\nCondition Pre-test Post-test Pre- to post-test Min.\nscore\nMax.\nscore\nTest\nN M (SD) N M (SD) P z-score d\nControl 25 4.84 \n(1.28) 25 4.83 \n(1.06) 0.96 -0.05 0.01 2 7 B\nInductive 15 4.93 \n(1.22) 15 5.00 \n(1.46) 0.68 -0.41 0.03 3 7 B\nDeductive 25 4.44 \n(1.30) 25 5.92 \n(2.14) 0.008 -2.48 0.58 2 9 A\n* Confi  dence interval = 95%   * A =Paired-samples t-test   B = Wilcoxon signed-rank test; max. score = 10 points\nIn the case of the preposition by, Table 4 and Figure 4 show that \nonly the explicit-deductive group signifi  cantly improved its tgjt\nscores from pre- to post-test. However, the gains by the explic-\nit-deductive group had a small effect size, indicating that the ex-\nplanation by the teacher may not always result in increased implicit \nknowledge of the target form.\nFIGuRe 3. Comparison of pre- and post-test tGJt scores for items in vs. on\nPre-test\nTime\nPost-test\nTGJT_IN_ON\n.00\n2.00\n4.00\n6.00\n8.00\n10.00\nGroup\nControl\nInductive Instruction\nDeductive Instruction']","I'm sorry, but the context provided does not contain information about efforts made to describe the variant of Spanish spoken in Puebla or the outcomes of such projects."
How do the phonological properties of /j/ and /w/ in the Zapotec language of San Pablo Güilá differ from those in San Lucas Quiaviní according to Uchihara and Pérez Báez?,"['<1-hop>\n\nestRuctuRa silábica melódica en el zaPoteco una vocal, forman parte del núcleo silábico, lo que da lugar a diptongos asimétricos, en oposición a los diptongos simétricos conformados por dos vocales. En los primeros la duración de la vocal es claramente mayor a la de /j/ o /w/ ‒por ejemplo, /djaɡ/ ˩ > [dĭ̀àˑx] ‘oreja’‒, mientras que en los segundos la duración de ambas vocales es compa - rable ‒por ejemplo, /bia/ ˩ > [bìà] ‘quiote’‒ ( vid. Arellanes 2009: 169-173). Cuando ocurren en posición inmediatamente posterior a una vocal que está seguida de conso - nante o se encuentra a final de emisión, tienen una realización plenamente vocálica de una duración muy similar a la de la vocal precedente: /r-aw=ba/ ˩ ˩˥ > [ràù.βǎ] ‘él/ella come’, /buj/ ˥˩ > [búì] ‘guayaba’, de modo que en estos casos el diptongo es siempre simétrico. Cuando / j/ y /w/ no están en adyacencia a una vocal plena, forman parte del inicio o de la coda. Si preceden a una consonante y están a inicio de palabra tienen una realización aproximante con independencia segmental: /wbiʒ/ ˩ > [wβìːʃ] ‘sol’, / wɡwaɡ/ ˩ > [wɣŭ̀àˑx] ‘rata’ (vid. Arellanes 2009: 163); /j-biɡ=a̰/ ˩˥ ˥˩ > [jβǐː.ɣâˀ] ‘voy a acercarme’; /j-sɨdj=nǔ/ ˥ ˩ ˩˥ > [jsɨ̂ːðʲ.nǔ] ‘vamos a estudiar’ ( vid. López Cruz 1997a: 102). Si, en cambio, están después de una consonante a final de la emisión, se fu - sionan con ésta y se realizan como una articulación secundaria: /nopj/ ˥˩ > [nôpːʲ] ‘pulque’; /ʧimj/ ˩˥ > [ʧǐmːʲ] ‘canasto’; /bḛkw/ ˩ > [bḛ̀kːʷ] ‘perro’; /ʃa̰kw/ ˩ > [ʃà̰kːʷ] ‘cucaracha’ (vid. Arellanes 2009: 164-165). Por último, en posición intervocálica ‒en palabras morfológicamente complejas en las que la raíz está seguida de un enclítico vocálico‒ se silabifican exclusivamente como inicio de la segunda sílaba cuyo núcleo Considerar que /j/ y /w/ son consonantes fortis en el zapoteco de San Pablo Güilá sería muy problemático tanto por razones descriptivas como teóricas. En el nivel fonotáctico, en San Lucas Quiaviní el tono ascendente sólo ocurre en sílabas con coda, incluidas aquellas que terminan en /j/ y /w/ (Uchihara y Pérez Báez 2016: 10-11). No obstante, en San Pablo Güilá no existe tal restricción: /bzie/ ˩˥ > [bzìé] ‘pozo’; /bṵ/ ˩˥ > [bù͡ú̬] ‘carbón’ ‒donde [u̬] representa una porción vocálica con voz tensa‒; /le/ ˩˥ > [lěː] ‘eco’; /ʃi/ ˩˥ > [ʃǐː] ‘qué’. En San Lucas Quiaviní hay dos alomorfos del diminutivo (Uchihara y Pérez Báez 2016: 12-13): i) /-nj/, que se añade a raíces nominales terminadas en vocal y que produce un cambio del tipo de voz sobre dicha vocal; y ii) /-eˀe/, que se añade a raíces nominales terminadas en consonante, in - cluidas /j/ y /w/. Este segundo alomorfo tiene un alófono [iˀi] en contexto palatal. En cambio, en San Pablo Güilá hay un solo exponente fonológico del diminutivo, /=ḛ̀/, que se emplea en todos los casos ‒aunque también tiene un alófono con timbre [i] como el sufijo correspondiente en San Lucas Quiaviní‒. Es decir, en esta comunidad no hay evidencia de que /j/ y /w/ se comporten como con - sonantes, como sí la hay en San Lucas Quiaviní. Desde el punto de vista teórico, Uchihara y Pérez Báez (2016) consideran como único criterio para definir una consonante fortis ser subyacentemente moraica. Arellanes (2004) considera que, además de su moraicidad en coda, una propiedad fundamental de las consonantes fortis, al menos en el zapoteco de San Pablo Güilá, es su alta estabilidad segmental, de la cual /j/ y /w/ carecen por completo, como se describe enseguida. Por', '<2-hop>\n\nOtra propiedad fonológica notable de las lenguas zapotecas es la asimetría entre los constituyentes silábicos no nucleares. La contribución de Arellanes en este volumen mues- tra que en el zapoteco de San Pablo Güilá esta asimetría no sólo se manifiesta en el núme- ro de segmentos que se permiten en inicio respecto de los que se permiten en coda, sino también respecto del (in)cumplimiento del principio de secuencia de sonoridad. El grado de marcación de los inicios silábicos en algunas lenguas zapotecas es tal que algunas secuencias están conformadas por dos consonantes fricativas sibilantes, una verdadera rareza tipológica, como ya lo habían apuntado Jaeger y van Valin (1982). Esta asimetría se debe en gran medida a una propiedad que en principio no era fonológica, sino morfo- lógica: las lenguas zapotecas carecen de sufijos, al menos históricamente.2 En cambio, su riqueza prefijal es notable tanto en el dominio nominal como en el verbal. De tal modo, la marcada tendencia prefijante del protozapoteco, más una pérdida progresiva de las vocales átonas de los prefijos (Uchihara [en prensa]) y la eventual desmorfologización de los propios prefijos, son los factores responsables de esta asimetría. Sin embargo, la contribución de Covarrubias Acosta en este mismo volumen muestra que no todos los zapotecos actuales aceptaron con la misma naturalidad la conformación de grupos con- sonánticos y que algunos de ellos, como el zapoteco de San Bartolo Yautepec, desarro - llaron estrategias de simplificación mediante distintos tipos de epéntesis.3 Así, las aportaciones del presente dossier permiten comenzar a esbozar un conjunto de criterios para clasificar las lenguas zapotecas considerando sus propiedades fonoló - gicas estructurales y no sólo los miembros de sus inventarios ‒tonales, consonánticos, vocálicos, etcétera‒. Por supuesto, las lenguas zapotecas pueden diferir entre aquellas en que contrastan dos y hasta tres tipos de voz no modal con aquellas en que sólo hay un tipo de voz no modal, pero también pueden distinguirse entre aquellas en que la larin - gización es una propiedad interna de las vocales y aquellas en las que es una propiedad prosódica cuya unidad portadora es la mora. Las lenguas zapotecas pueden diferenciarse en el grado de tolerancia que manifiestan en los grupos consonánticos ‒tanto en inicio como en coda‒, así como en el tipo de diptongos que permiten, pero también en el 2 Esta afirmación la escuché por primera vez de Terrence Kaufman, uno de los zapotequistas más notables, como comentario a una ponencia que presenté en el Coloquio de Lenguas Otoman - gues y Vecinas en su edición del año 2008. Por lo demás, Uchihara (en prensa) afirma que el comitativo en el zapoteco de Teotitlán del Valle no es un enclítico, sino un sufijo, pues provoca un desplazamiento acentual a partir de la raíz que los enclíticos, en su condición de elementos extramétrico, no producen. 3 En este punto no puedo dejar de señalar, como diferencia analógica, que el español desarrolló una estrategia de epéntesis vocálica en contextos donde el catalán tolera un grupo consonántico, como en el plural de pan: panes / pans. 86 FRancisco aRellanes aRellanes LM III-1 Lingüística Mexicana. Nueva Época, III (2021), núm. 1: 81-91 ISSN: 2448-8194']","According to Uchihara and Pérez Báez, in the Zapotec language of San Pablo Güilá, /j/ and /w/ do not behave as consonants like they do in San Lucas Quiaviní. In San Pablo Güilá, there is no evidence that /j/ and /w/ exhibit consonantal behavior, unlike in San Lucas Quiaviní where they have specific phonological characteristics related to their behavior as consonants.",multi_hop_specific_query_synthesizer,"['Estudios de Lingüística Aplicada, año 43, número 80, enero de 2025, pp. 7–48\ndoi:10.22201/enallt.01852647p.2025.80.1097\nSistema judicial y lengua vasca en España: una glotofobia persistente [ 25 ]\nuna presunción de conocimiento de la lengua de Cervantes (Parla-\nmento Vasco, 2023: 5).\nNo obstante, dicho Tribunal precisa que la declaración de coo-\nfi  cialidad implica “la obligación de facilitar, por parte de los pode-\nres públicos competentes, el conocimiento de la lengua [vasca] y, \nen este sentido, ofi  cialidad signifi  ca enseñanza de la lengua [pro-\npia] y posibilidad correlativa de acceso a su conocimiento” (Par-\nlamento Vasco, 2023: 5). A su vez, la Ley Orgánica 1/1990, de 3 \nde octubre, de Ordenación General del Sistema Educativo (boe, \n1990a), que regula en todo el Estado español la ordenación del \nsistema educativo,\nestablece de forma pormenorizada la capacitación en las len-\nguas ofi  ciales que deben conseguir los alumnos en cada uno de \nlos niveles de enseñanza, fi  jando siempre un nivel de capaci-\ntación igual para las lenguas propias de las Comunidades Au-\ntónomas y para el castellano. Por consiguiente [en teoría] en \nlas Comunidades Autónomas con régimen de doble ofi  cialidad \nlingüística, los alumnos que superen la enseñanza obligatoria \nhabrán acreditado los conocimientos requeridos tanto de la len-\ngua castellana como de la lengua ofi  cial propia de la Comuni-\ndad Autónoma (Parlamento Vasco, 2023: 6).\nSin embargo, el Diagnóstico del Sistema Educativo Vasco para el \n2021 demuestra que, en la práctica, si la enseñanza del euskera y \nen la lengua propia del territorio está en el origen de 200 000 vas-\ncohablantes adicionales desde inicios de los años 1980 y 71.4% de \nla población de entre 16 y 24 años es bilingüe activa 12 (Gobierno \n12 Esto resulta, entre otros factores, “del esfuerzo del conjunto de la comuni-\ndad educativa, empezando por el del personal docente para mejorar su perfi  l \nlingüístico (hace 40 años, al inicio del proceso, tan solo el 8% era capaz de \nenseñar en euskera, mientras que, en la actualidad, en torno a un 95% está ca-\npacitado para ello); y también de la fi  rme apuesta de padres y madres por mo-', 'Estudios de Lingüística Aplicada, año 43, número 80, enero de 2025, pp. 7–48\ndoi:10.22201/enallt.01852647p.2025.80.1097\nSistema judicial y lengua vasca en España: una glotofobia persistente [ 27 ]\nlocutores de ese territorio ciertos derechos en materia lingüística \ny garantiza la defensa de la lengua vasca.\nSobre estas bases, el título preliminar de la Ley reconoce el \neuskera como lengua propia de la cav y en conjunto con el caste-\nllano como las lenguas coofi  ciales del territorio, además de pro-\nhibir cualquier discriminación por motivos lingüísticos. El primer \ntítulo aborda los derechos de los ciudadanos y las obligaciones de \nlas administraciones públicas en materia lingüística, mientras que \nel segundo título regula la acción de los poderes públicos.\nSu primer capítulo se refi  ere al uso del euskera por la admi-\nnistración pública, reconociendo el derecho al uso ciudadano de \nlas dos lenguas coofi  ciales del territorio en sus relaciones con la \nadministración autonómica. Asimismo:\nSe regula también la inscripción de documentos en los registros \npúblicos, se establece la forma bilingüe para la publicación de \nlas disposiciones normativas, resoluciones o actos de la admi-\nnistración, así como de las notifi  caciones y comunicaciones. \nSe faculta a todo ciudadano para utilizar la lengua ofi  cial de \nsu elección en las relaciones con la Administración de Justicia. \n[…] Se prevé la progresiva euskaldunización del personal [de] \nla administración pública (boe, 1982: 4).\nEn la Comunidad Foral de Navarra, la Ley Foral 18/1986, de 15 de \ndiciembre, del Vascuence, desarrolla el artículo 9 de la Ley de Re-\nintegración y Amejoramiento del Régimen Foral de Navarra. En su \npreámbulo, precisa: “aquellas Comunidades que, como Navarra, se \nhonran de disponer en su patrimonio de más de una lengua, están \nobligadas a preservar ese tesoro y evitar su deterioro o su pérdida” \n(boe, 1987). De igual forma:\n• En el título preliminar, el artículo 1 establece que:\n1) esta Ley Foral tiene por objeto la regulación del uso nor-\nmal y ofi  cial del euskera en los ámbitos de la convivencia', 'Estudios de Lingüística Aplicada, año 43, número 80, enero de 2025, pp. 7–48\ndoi:10.22201/enallt.01852647p.2025.80.1097\nSistema judicial y lengua vasca en España: una glotofobia persistente [ 15 ]\nAsimismo, el régimen creó la Escuela Judicial, dependiente \ndel ministerio de Justicia, a fi  n de adoctrinar políticamente y se-\nleccionar ideológicamente a los futuros juristas, quienes, durante \n18 meses, recibían una formación jurídica, moral y religiosa. Esta \nformación servía igualmente para inculcarles el espíritu de cuerpo \ny el respeto de la jerarquía a través de una obediencia absoluta a los \nsuperiores jerárquicos. Tal como lo indicó el ministro de Justicia de \nla época, Eduardo Aunós, al presentar ante las Cortes Generales el \nproyecto de ley sobre la creación de la Escuela Judicial, se preten-\ndía “crear una milicia de la Justicia, unida a los ideales fi  rmes del \nEstado Nacional [...] siempre dispuesta a seguir [...] las consignas \ndel Caudillo y de la España Nueva” (Lanero Táboas, 1995: citado \nen Marquesán Millán, 2021).\nA su vez, el franquismo empleó una serie de medidas para \nlimitar y, aún más, aniquilar cualquier veleidad de independencia \nde la justicia, tales como nombramientos, promociones, traslados, \nsanciones disciplinares e incluso despidos. Precisamente, la aso-\nciación\xa0Justicia Democrática\xa0surgió, en la clandestinidad, para ex-\npresar su descontento por el “férreo control ejercido por el ejecu-\ntivo sobre la carrera judicial a través del nombramiento de los más \nimportantes cargos” (Marquesán Millán, 2021).\nAdemás, el régimen recurrió al sistema judicial para impo-\nner una represión brutal, especialmente a través de los consejos \nde guerra y de las jurisdicciones especiales. Numerosos defenso-\nres de la República española fueron detenidos, encarcelados, tor-\nturados (Lorenzo Rubio, 2020), condenados a largas penas de cár-\ncel, obligados a realizar trabajos forzosos o fusilados tras juicios \nsumarísimos (Silva & Esteban, 2012). Asociados a los militares y \npolicías, los jueces y magistrados se convirtieron en los garantes \nde la dictadura y no toleraron cuestionamiento alguno de la unidad \nterritorial, del régimen dictatorial y de la ideología nacional-cató-\nlica. Así, el Decreto del 16 de abril de 1940 asignó al Fiscal Gene-\nral la tarea de investigar las actividades supuestamente criminales \nde los oponentes al régimen.']","I'm sorry, but I couldn't find any information in the provided context about the phonological properties of /j/ and /w/ in the Zapotec languages of San Pablo Güilá and San Lucas Quiaviní according to Uchihara and Pérez Báez. This specific topic is not covered in the text you provided."
How did the style of appealing change for the candidates who participated in the debates of 2006 and 2012?,"['<1-hop>\n\núltimo, en el zapoteco de San Pablo Güilá dos consonantes lenis en coda conforman una mora, de tal suerte que la vocal precedente necesariamente es breve: /nin̆ɡ/ ˩ > [nìŋx] ( vid. López Cruz 1997a: 66). En cambio, una consonante más /j/ o /w/ en coda está precedida por una vocal larga, si la consonante es lenis: /ɡidj/ ˩ > [ɡìːθʲ] ‘cuero, piel’; /miɡw/ ˥˩ > [mîːxʷ] ‘amigo’. 197 LM III-1 Lingüística Mexicana. Nueva Época, III (2021), núm. 1: 193-223 ISSN: 2448-8194', '<2-hop>\n\nLa tercera parte del libro, “El estilo personal de apelar”, se divide cronológicamente. Para cada debate se describe el empleo de formas de tratamiento de cada uno de los de - batientes. De este modo, es posible observar cuáles son las preferencias de los candidatos gracias al perfil apelativo que la autora reconstruye para cada uno de los trece candidatos que participaron en los cuatro debates. Debido a que, como se mencionó, la presentación se estructura por debate, es incluso posible ver cómo varió la manera de apelar de los candidatos que participaron en dos ocasiones —Cuauhtémoc Cárdenas Solórzano en los debates de 1994 y 2000; Andrés Manuel López Obrador en los de 2006 y 2012. La información de este capítulo es reveladora en muchos sentidos, porque se devela lo que la autora, inspirada en Daniel Cosío Villegas, llama el estilo personal de apelar de cada candidato. Menciono a manera de ejemplo algunos rasgos que perfilan a los candidatos, como la preferencia por tutear o tratar de usted, a quién se dirigen con más frecuencia en sus discursos, si se sirven de apelaciones directas o indirectas para tratar a sus oponentes o si usan o no el plural mayestático, pero el lector podrá interesarse por otros tantos más. Por último, en el apartado de conclusiones se discuten los resultados en función de la pregunta de investigación, se muestra que, en general, prevaleció el uso de la primera persona y que esto puede deberse a varios factores tanto a la necesidad de los candidatos de “mostrarse como políticos con más capacidad de gobernar” (p. 181), como a la recu- rrencia de actos argumentativos y de exposición de propuestas. Incluso, señala la autora, es probable que esto se correlacione con el formato rígido de los debates, dada la estruc- turación de los turnos de habla y las limitaciones de tiempo asignado a los debatientes. Sin embargo, a pesar del uso abrumador de la primera persona y contrario a la per - cepción de los mexicanos, Vázquez Laslop concluye que los candidatos sí dialogaron. De los tratos, directos e indirectos, se desprende que todos los candidatos apelaron a sus contrincantes y a la audiencia, ya fuera a su propio grupo político, al pueblo o a todos los anteriores. En este apartado se sugiere, asimismo, una interpretación más discursiva de los resultados y se arroja luz sobre futuras vetas de investigación que podrían deli - nearse en términos del análisis conversacional, la cortesía lingüística y las actividades de imagen, así como la identidad. El libro finaliza con un índice de los tratamientos nominales emitidos por cada uno de los candidatos. En cada entrada, el lector puede ver cuáles fueron las distintas for - mas asociadas con ellos y quiénes las emitieron. Por ejemplo, el término compatriotas lo emplearon Ernesto Zedillo y Diego Fernández de Cevallos, al que acompañaron de un posesivo, mis compatriotas, tanto estos dos candidatos como Cuauhtémoc Cárdenas. Por último, el libro cierra con un apéndice que incluye las transcripciones del corpus y los criterios de etiquetado y transcripción. En resumen, este libro, producto de una investigación rigurosa, representa una con- tribución al estudio de las formas de tratamiento en México desde un aspecto inexplo - rado previamente: el del discurso de los políticos mexicanos que contendieron por la presidencia en los sexenios de 1994 a 2012.']","The style of appealing for the candidates who participated in the debates of 2006 and 2012 changed as observed in the book's third part, where the author describes the use of forms of treatment for each debater. The information reveals the personal style of appealing for each candidate, showing variations in how they addressed their opponents, whether they used direct or indirect appeals, and their preference for first-person usage. This analysis sheds light on the evolving strategies employed by the candidates during the debates over the years.",multi_hop_specific_query_synthesizer,"['20      Fernando Castaños\ncon todas las personas con que “John” lo hace.\n2) En la definición se habla de tipos, o categorías relativamente generales; en \nlas ecuacione se habla de muestras, o individuos particulares. Los términos que \nintervienen en una definición no ocurren en expresiones que se pueden usar para \ncumplir la función referencial sin modificaciones.\nEn la definición diríamos: “una garlopa ...”\nEn una proposición diríamos: “la garlopa ...”\nEn cambio, en una ecuación los términos pueden tener ya la forma de las expre\xad\nsiones referenciales; “the leader” sólo necesita ocurrir, sin modificaciones, en el \ncontexto apropiado, para cumplir la función referencial.\nEntonces, en las definiciones no sólo se establece que los términos que se identi\xad\nfican pueden ocurrir en expresiones referenciales que sirvan para referirse a la \nmisma cosa, sino que también se establece que estos términos, en cuanto tipos, \ntienen la misma denotación. (Por supuesto, esto no implica que las definiciones \nsean aseveraciones triviales. Las dos expresiones que se identifican en una defini\xad\nción no son sinónimos: aunque tienen la misma denotación, los distintos elemen\xad\ntos que intervienen en ellas tienen diferente sentido.)\nAhora bien, hay muchos \ntipos de definiciones, según las intenciones de los \nhablantes o escritores que \nlas producen. Como casos \nextremos podríamos consi\xad\nderar las definiciones de un diccionario y las de una teoría matemática. La defini\xad\nción de un término en un diccionario está hecha para las personas que lo desco\xad\nnozcan, lo encuentren en un texto y deseen averiguar su significado. Una defini\xad\nción formal en una teoría matemática está hecha para todos los lectores, y en cier\xad\nto sentido, para ninguno; indica cómo se usará un término dentro de la teoría. La \ndefinición del diccionario reporta el uso de un término, describe o explica el signi\xad\nficado que ya tiene. La definición matemática crea un concepto, establece ar\xad\nbitrariamente el significado del término. De una definición de diccionario podría \ndecirse que es falsa, si no corresponde al uso de los hablantes nativos. De una de\xad\nfinición matemática no tendría sentido decir que es falsa: es cierto que las expre\xad\nsiones que identifica son correferenciales ¡por definición!\nLa arbitrariedad de las definiciones matemáticas en ocasiones da origen a ora\xad\nciones que en el lenguaje común resultarían contradictorias, pero que en la teoría \nson perfectamente coherentes, como:\nIf the indexed family F of spaces is disjoint, then each is both open and closed.\nHu (1964: 36).\nEn inglés cotidiano, open y closed son excluyentes entre sí. En el inglés de la \ntopología, las relaciones de sentido entre los dos términos, que resultan de sus de\xad\nfiniciones, permiten que algo sea al mismo tiempo open y closed. Esto no quiere \ndecir que las definiciones sean falsas. Simplemente son extrañas y les dan a los \ntérminos significados distintos de los cotidianos.\nCabe aclarar que la arbitrariedad de las definiciones matemáticas es total', '26      Fernando Castaños\nprincipio de esta sección proporcionamos una caracterización general de la defi\xad\nnición como meta-aseveración de correferencialidad. En la sección anterior indi\xad\ncamos cómo la definición puede servir para desempeñar diferentes funciones del \ndiscurso científico, lo que permite explicar, tomando en cuenta las intenciones del \nautor, por qué ocurren ciertos tipos de definición de un texto. Y en los últimos \npárrafos discutimos las características de las definiciones argumentativas en el \ndiscurso científico. Pasaremos ahora a combinar los tres enfoques en el análisis \nconcreto del siguiente texto, cuyas oraciones han sido numeradas para facilitar \nlas referencias en la discusión:\nCHAPTER 1 \nTHE EQUATIONS OF MOTION\n1. Generalized co-ordinates\n(1) One of the fundamental concepts of mechanics is that of a particle. (2) By this we mean \na body whose dimensions may be neglected in describing its motion. (3) The possibi-\nlity of so doing depends, of course, on the conditions of the problem concerned. (4) For \nexample, the planets may be regarded as particles in considering their motion about the \nsun, but not in considering their rotation about their axes.\n(5) The position of a particle in \nspace is defined by its radious vector r, whose compo-\nnents are its Cartesian co-ordinates, x, y, z. (6) The derívate v = d r / dt of r with res-\npect to the time t is called the velocity of the particle, and the second derívate d r /dt is \nits acceleration.\nLandau & Lifshitz (1972: 3).\nEl libro de donde fue tomado este texto está escrito para estudiantes que ya han \nllevado un curso de mecánica. Podemos decir que es un libro para estudiantes \navanzados del nivel de licenciatura. El título del primer capítulo indica que no se \nseguirá el enfoque de los libros introductorios, en los que se separan los proble\xad\nmas estáticos de los dinámicos. Aquí, el título nos hace suponer que se discutirán \ndesde un principio las consideraciones básicas para el planteamiento de proble\xad\nmas de dinámica; quizá los problemas estáticos se traten como casos particulares \nde problemas dinámicos. El título, entonces, cumple una función facilitadora: la \nde anunciar el contenido y el enfoque del capítulo y del libro.\nEl subtítulo Generalised co-ordinates indica que en la primera sección se dis\xad\ncutirá la manera de representar la ubicación, en el tiempo y en el espacio, de las \nentidades físicas. Tiene una función facilitadora.\nLas dos primeras oraciones sirven para realizar una definición. Cabe pregun\xad\ntarse por qué los autores usan dos oraciones para la definición de partícula, en lu\xad\ngar de una, como lo hacen para la velocidad más adelante. La razón es que los \nautores no sólo están llevando a cabo una función argumentativa, sino también \nuna función facilitadora y una función valorativa.\nLa función facilitadora es doble. Por un lado, los autores están diciéndoles a \naquellos alumnos que ya saben lo que es una partícula (supuestamente la mayoría \nde ellos): “vamos a definir partícula”. Esto les permite leer la definición muy rá\xad\npidamente, casi saltándosela. Por otro lado, están colocando el término definido', '26 Encarna Atienza Cerezo\nAsimismo, bajo la falta de estructuración gráfica del texto pueden mencio -\nnarse también los casos en que el estudiante no segmenta la información para \nfacilitar la lectura del receptor, sino que presenta su texto como un bloque de  \ninformación, mediante una sucesión de puntos y seguido (creación de párrafos-\nbloque) o, bien, coloca los puntos y aparte de forma gratuita (creación de párrafos \nlibres). En cualquier caso, hay un desajuste entre la estructuración gráfica y la \ntemática.\nEn el texto siguiente, el único punto y aparte que aparece es el punto final \ncon el que se cierra el texto, lo que pone de manifiesto que el joven escritor asocia \nel hecho de escribir con sólo decir, apiñar datos. No concibe el espacio en blanco \nque implica el punto y aparte como un espacio necesario en su función facilitadora \nde lectura, como medio de combatir la organización lineal del texto (Bessonat, \n1988; Rama, 1994; Ferreiro, et al., 1996):\nLas causas de la colonización fueron diversas y éstas dependen según los autores. \nUnos dicen que la colonia era un medio para invertir monedas para otros la causa \nera de tipo político, otros decían que las causas eran de tipo social... La verdad es \nque todas estas causas influyeron en la colonización, pues en un principio las poten-\ncias al tener gran número de población, por el aumento demográfico, vieron en las \ncolonias un medio de escape, otras potencias como Inglaterra y Francia utilizarán \nsus colonias para invertir cierto capital y poder explotarlas obteniendo gran benefi-\ncio. […] Inglaterra, por su parte, quería conseguir una gran flota y con ella estable-\ncer diversas rutas comerciales, por lo que al principio iría consiguiendo puntos \nestratégicos como Gibraltar, El Cairo, Sierra Leona... que le permitirían establecer \nrutas comerciales a La India y otras zonas asiáticas. En cuanto a Francia esta se \nextendió por la zona del norte de África y otras zonas asiáticas como la denominada \nIndonesia. Otros países como Alemania en un principio no participaron pues creían \nque con esto se debilitaba su gran imperio, pero posteriormente conquistaron diver-\nsas zonas africanas, hasta el punto de romper relaciones con Inglaterra, que veía \ncomo Alemania estaba consiguiendo un gran imperio. Países como Japón conquis-\ntaron algunas zonas de su costa y otras como Austria-Hungría no colonizarán, pues \nsus pretensiones estaban en la zona de los Balcanes. La zona más pretendida fue \nÁfrica, que llegó a significar un gran problema. Allí zonas como El Congo, fueron \npretendidas por ingleses, franceses y belgas, finalmente el Congreso de Berlín de -\nterminó que fuese un dominio belga. Las zonas más importantes fueron las de \nEgipto y El Cairo que poseían los ingleses junto con Sudáfrica y otras más Francia \ntenía la costa mediterránea con Marruecos y Argelia como principales países. \nELA49ok.indd   26 14/9/11   15:02:39']","I'm sorry, but the text provided does not contain information about the style of appealing for candidates in debates from 2006 and 2012. If you have any other questions or need information on a different topic, feel free to ask!"
How do children transition from base lexical constructions to more complex integrations in language development according to Olvera's research?,"['<1-hop>\n\nforma gradual al interactuar con sus cuidadores y recibir el input de ellos. Con base en esta teoría se considera que los niños pasan por distintas etapas que les permiten poco a poco, mediante la detección y análisis de los constituyentes, construir su lenguaje. En el desarrollo lingüístico, los niños comienzan con la tarea de mapear las construcciones entre su forma y su significado; es en este momento cuando inician las operaciones de sustituir, agregar, insertar, recortar y reorganizar (Lieven et al. 2009). Esto se debe a que ya detectaron patrones en su lengua y, por ende, han superado la etapa de base léxica (item based) en la que sólo producían elementos sin analizar, tomados de las cons- trucciones del input de sus cuidadores. Por lo tanto, los niños pasan de realizar cons - trucciones mediante simples adiciones a integraciones más complejas. Un ejemplo de lo anterior se daría cuando un niño que produce la frase el león en repetidas ocasiones, un día agrega información y ahora construye el león grande. Esta frase mostraría los pri- meros indicios de que el niño está comenzando a trabajar sus integraciones. En nuestro trabajo observamos las etapas descritas y determinamos el momento de la integración como su sustento principal. Nos basamos únicamente en el análisis del número porque, si se compara con el género y la persona, sus sufijos ‒en singular, el morfema vacío o no marcado -ø, y en plural, -s y sus alomorfos -s y -es‒ son más claros de detectar, sobre todo si consideramos que la parte última de la palabra es más fácil de ubicar y segmentar (Rojas 2011). Otro punto que nos llevó a enfocarnos en este análisis fueron los resultados globales que ob- tuvimos de tres niños al analizar la concordancia y discordancia en los tres rasgos. Por una parte, el número mostró un índice más elevado de discordancias, respecto al género y a la persona, y, al desglosar el porcentaje bruto, notamos que era la categoría que los niños estaban trabajando más. Por otra, los números tan elevados de concordancia lla - maron nuestra atención (Olvera 2018). Ahora que hemos presentado un breve panorama general sobre cómo los niños ma - nejan la información que reciben del input de sus cuidadores, es preciso referir y espe - cificar la concordancia de número en el desarrollo lingüístico. Es necesario considerar que son pocos los estudios en español que analizan esta concordancia; por lo general, los datos provienen del inglés, lengua con una escasa concordancia de esta naturaleza. Se ha propuesto que la adquisición de número es temprana en inglés (Clark y Nikiti - na 2009), donde las elicitaciones demostraron que a los cinco y seis meses los bebés distinguen el número uno de dos, tres y cuatro elementos; a los catorce meses pueden distinguir hasta tres objetos, pero no más. En español, se comprobó que los niños entre los 1:11 y 2:01 comprenden el plural con el sufijo -s y lo relacionan con el significado ʻmás que unoʼ (Arias-Trejo et al. 2014). La categoría de número parece aprenderse a través de dos vías paralelas en el desa- rrollo: por una parte, la léxica ‒cantidades numéricas: 1, 2, etc.‒, y, por otra, la morfo- lógica ‒singular / plural‒. De acuerdo con los autores Li, Ogura, Barner, Yang y Carey (2009), la distinción conceptual singular / plural es la que debe soportar la adquisición de la morfología de número, porque los niños distinguen entre conjuntos individuales y plurales a una edad temprana, pero sólo en contextos que proporcionan cuestiones 103 LM II-1 Lingüística Mexicana. Nueva Época, II (2020) núm. 1: 101-115 ISSN: 2448-8194', '<2-hop>\n\nEn suma, el desarrollo lingüístico propuesto en esta sección apunta al proceso que se da cuando los niños pasan de las categorías robustas – input de los cuidadores– a las emergentes –análisis de los niños–. Es decir, se llega a la detección de la morfología de número por medio de un continuum (Clark 2001) entre ambas categorías. Sin duda, en este aspecto, la emergencia corresponde a la distinción conceptual singular / plural que soporta la morfología de número, como explicaron Li et al. (2009) en su estudio sobre el japonés y el chino, y que aquí se relaciona con nuestros hallazgos. discusión Los resultados que se obtuvieron y que hemos presentado en párrafos anteriores corresponden a etapas tempranas en el desarrollo lingüístico de los tres niños, por lo que esperábamos que el léxico fuera reducido. No obstante, el estudio derivó en lo opuesto y se comprobó que, desde periodos tempranos, los niños prestan atención al input que reciben y que primero reproducen a partir de una base léxica que, gradualmente, los llevará a detectar, analizar y segmentar el morfema de número para la construcción de sus frases nominales concordadas en número de manera efectiva. Vimos que el ámbito de frase correspondiente a la construcción determinante + no- minal es el que muestra los efectos más importantes para comprender cómo se adquiere la concordancia de número, porque en los periodos de edad analizados, los niños produ- cen más frases nominales que oraciones (Olvera 2018). Así, los datos de Tita y Natalia 111 LM II-1 Lingüística Mexicana. Nueva Época, II (2020) núm. 1: 101-115 ISSN: 2448-8194']","According to Olvera's research, children transition from base lexical constructions to more complex integrations in language development by first detecting and analyzing constituents in their language, then moving on to operations like substituting, adding, inserting, cutting, and reorganizing. This transition occurs as children detect patterns in their language, surpass the base lexical stage where they only produce elements without analysis, and progress to more complex integrations by adding information to their constructions. For example, a child who repeatedly produces the phrase 'el león' may eventually add information to construct 'el león grande,' indicating the beginning of working on integrations in language development.",multi_hop_specific_query_synthesizer,"['introducción\ne \nn este trabajo se explorará el estatus morfológico de pinches y dizque en cons-\ntrucciones en las cuales dichos morfemas aparecen entre las marcas de objeto y \nlos verbos, tal como se puede observar a continuación:\n(1) \n1. Ni los de la micro donde te dizque subiste a hacer un spot (Twitter, 2018, México).\n2. NO TE PINCHES RINDAS (Twitter, 2023, México).\n3. Mi tiktok la pinches banearon (Twitter, 2023, México).\n4. Sin embargo a la persona que te dizque capacita (Enriquez Servicios Obras y Su -\nministros S.A DE C.V - Carrera y Empleo, 2023).\nLos ejemplos de (1) resultan problemáticos ya que pinches y dizque se consideran \nadverbios de acuerdo con Quepons Ramírez (2015, 2022) y el Diccionario de la lengua \nespañola (asale y rae 2021)\n1, y en el español mexicano actual el situar adverbios entre \nlos pronombres de objeto átonos y los verbos resulta prácticamente imposible (2 y 3).\n(2)\n1. José se lo dijo a Juan ayer \n2. *José se lo a Juan dijo ayer\n1\u2009El desarrollo histórico y la justificación del estatus adverbial de ambas palabras quedan fuera \nde los alcances del presente trabajo, por lo que se remite al lector a las obras de Quepons Ramírez \n(2015, 2022) y Magaña (2005) para pinches y dizque, respectivamente.\nquite anomalous to place the adverbs between unstressed pronouns \nand verbs. This fact seems to be supported by the recent proposal by \nHaspelmath (2022d) in which it is considered that the object clitics of \nthe Romance languages   are affixes based on the selectivity criterion \nsince these morphemes can only be attached to verbs and not to other \nlexical classes. In this sense, since they are prefixes and form part of \nthe verbal word, they do not represent a counterproof to Haspelmath’s \nproposal.\n98 cArloS de jeSúS WAgner oviedo\nLM V-2 \nLingüística Mexicana. Nueva Época, v (2023), núm. 2: 97-109  \nISSN: 2448-8194', 'palabras es de estados de lengua posteriores al castellano antiguo4. Ni en el Corpus dia-\ncrónico del español 5, en el Corpus del español mexicano contemporáneo 6, en el Corpus de \nreferencia del español actual7 o en el Corpus del español del siglo xxi8 se encuentra un solo \nejemplo de construcciones de interpolación que incluyan a dizque o pinches, lo que reve-\nla su estatus emergente en el español mexicano. \nDicho carácter innovador provoca que resulte complicado atestiguar ejemplos de \npinches y dizque en corpus o publicaciones periodísticas, por lo que en la presente nota \nse muestra evidencia obtenida principalmente a partir del uso de la herramienta de \nbúsqueda en la red social Twitter, utilizada por múltiples sectores de la población mexi-\ncana, particularmente adultos jóvenes y adolescentes, y en la cual es posible atestiguar \nformas coloquiales en forma escrita (5). Esta decisión fue tomada a partir de corroborar \nque la mayoría de los datos presentados en las obras de Quepons Ramírez (2015, 2022) \nprovenían de dicha fuente.\n(5) \n1. como me pinches caga ver a alguien activo y que me esté ignorando (Twitter, \n2023, México)\n2. … (porque así lo disque quiere, enamoramiento ni amor de romance ni por aso-\nmo)… (Twitter, 2023, México)\n3. …. y cuando me pinches llamaste a mi? (Twitter, 2012, México)\n4. … y ya me dizque regaño por quedarme viendo el concierto (Twitter, 2022, México)\nVale preguntarse por qué solo dizque y pinches se permiten en esa posición, y no otros \nadverbios. Si acudimos a cuestiones semánticas, dizque tiene un valor evidencial bien \natestiguado en descripciones como las de García Fajardo (2007), De la Mora y Maldona -\ndo (2015), Martínez Levy (2019) o Demonte (2020), mientras que pinches tiene un valor \nintensificador de acuerdo con Quepons Ramírez (2015, 2019); este factor no parece ser \ndeterminante, ya que intentar introducir otros adverbios con valores evidenciales o in -\ntensificadores entre pronombres átonos y verbos resulta en construcciones agramaticales:\n(6)\n1. *Te bastante amo (vs. Te amo bastante )\n2. *Lo demasiado odio (vs. Lo odio demasiado)\n4\u2009En el corde dizque se atestigua hasta finales del siglo xv, mientras que pinche se atestigua ape-\nnas hasta finales del siglo xix como sustantivo, siendo su uso adverbial muy reciente y originado a \npartir de un estado adjetival intermedio (Quepons Ramírez 2015, 2022).\n5\u2009El corde contiene datos desde el siglo xiii hasta 1974.\n6\u2009El cemca contiene datos desde 1921 hasta 1974.\n7\u2009El crea contiene datos desde 1974 hasta el año 2000.\n8\u2009El corpes contiene datos desde el año 2000 hasta 2022.\n100 cArloS de jeSúS WAgner oviedo\nLM V-2 \nLingüística Mexicana. Nueva Época, v (2023), núm. 2: 97-109  \nISSN: 2448-8194', 'Estudios de Lingüística Aplicada, año 42, número 79, julio de 2024, pp. 71–109\ndoi: 10.22201/enallt.01852647p.2024.79.1096\n[ 86 ] Amor Madai Peña Ramos & Verónica González Márquez\nnarraciones de niños de cinco años. Es decir, conforme es mayor \nla edad de los participantes de los grupos infantiles, incrementa el \nporcentaje mínimo de uso del pretérito para cláusulas de resolu-\nción en sus narraciones: pasa de 0 a 17%. Sin embargo, en las na-\nrraciones de adultos, el porcentaje más alto (15%) es ligeramente \nsuperior al porcentaje mínimo encontrado en las narraciones de \nniños de nueve años: 17%.\nEn las secciones restantes los porcentajes de uso son bastante \nbajos, lo cual se relaciona con el hecho de que, en suma, esas sec-\nciones representan menos del 10%. Para la sección evaluación, el \npretérito corresponde a 2.18% y el co–pretérito a 1.36%. Las cláu-\nsulas de resolución + coda con mayor porcentaje están en pretérito \ny corresponden al 1.84% del corpus. Finalmente, el tiempo verbal \nde la sección coda que tiene más ocurrencias es el pretérito (1.2%).\nEl uso de pretérito en cláusulas de evaluación muestra un in-\ncremento general: conforme es mayor la edad de los participantes \nde los grupos infantiles, incrementa la cantidad de narraciones en \nlas que se usa y, aunado a ello, el porcentaje de la narración dedi-\ncado a dicho uso. En el caso del grupo de adultos, aunque en solo \nuna narración se usa el pretérito en evaluación, el porcentaje dedi-\ncado a ello es relativamente alto (13%).\nA partir de los párrafos anteriores, se puede concluir que el \npretérito es el único tiempo verbal presente y con mayor porcentaje \nen todas las secciones de la estructura narrativa de las narraciones \ndel corpus de cuento a partir de imágenes. La excepción son las \ncláusulas de orientación que fueron producidas en co–pretérito por \nparticipantes de nueve años.\n5.2.  Corpus de recuento\nLas narraciones de recuento generadas a partir de la historia El \nvestido nuevo del emperador tienen la ocurrencia de secciones por \nedad que se muestra en el Cuadro 6.']","I'm sorry, but I cannot find any information related to Olvera's research or the transition of children from base lexical constructions to more complex integrations in the provided context. This text focuses on the morphological status of certain adverbs in Spanish constructions. If you have any other questions related to this topic or any other linguistics-related inquiries, feel free to ask!"
